id,section,title,body
3313.1,Section 3313 Water Supply for Fire Protection,Where Required,"An approved water supply for fire protection, either temporary or permanent, shall be made available as soon as combustible building materials arrive on the site, on commencement of vertical combustible construction, and on installation of a standpipe system in buildings under construction, in accordance with Sections 3313.2 through 3313.5.Exception: The fire code official is authorized to reduce the fire-flow requirements for isolated buildings or a group of buildings in rural areas or small communities where the development of full fire-flow requirements is impractical."
3313.2,Section 3313 Water Supply for Fire Protection,Combustible Building Materials,"When combustible building materials of the building under construction are delivered to a site, a minimum fire flow of 500 gallons per minute (1893 L/m) shall be provided. The fire hydrant used to provide this fire flow supply shall be within 500 feet (152 m) of the combustible building materials, as measured along an approved fire apparatus access lane. Where the site configuration is such that one fire hydrant cannot be located within 500 feet (152 m) of all combustible building materials, additional fire hydrants shall be required to provide coverage in accordance with this section."
3313.3,Section 3313 Water Supply for Fire Protection,"Vertical Construction of Types III, IV and V Construction","Prior to commencement of vertical construction of Type III, IV or V buildings that utilize any combustible building materials, the fire flow required by Sections 3313.3.1 through 3313.3.3 shall be provided, accompanied by fire hydrants in sufficient quantity to deliver the required fire flow and proper coverage."
3313.3.1,Section 3313 Water Supply for Fire Protection,Fire Separation Up to 30 Feet,"Where a building of Type III, IV or V construction has a fire separation distance of less than 30 feet (9144 mm) from property lot lines, and an adjacent property has an existing structure or otherwise can be built on, the water supply shall provide either a minimum of 500 gallons per minute (1893 L/m), or the entire fire flow required for the building when constructed, whichever is greater."
3313.3.2,Section 3313 Water Supply for Fire Protection,Fire Separation of 30 Feet Up to 60 Feet,"Where a building of Type III, IV or V construction has a fire separation distance of 30 feet (9144 mm) up to 60 feet (18 288 mm) from property lot lines, and an adjacent property has an existing structure or otherwise can be built on, the water supply shall provide a minimum of 500 gallons per minute (1893 L/m), or 50 percent of the fire flow required for the building when constructed, whichever is greater."
3313.3.3,Section 3313 Water Supply for Fire Protection,Fire Separation of 60 Feet or Greater,"Where a building of Type III, IV or V construction has a fire separation of 60 feet (18 288 mm) or greater from a property lot line, a water supply of 500 gallons per minute (1893 L/m) shall be provided."
3313.4,Section 3313 Water Supply for Fire Protection,"Vertical Construction, Types I and II Construction","If combustible building materials are delivered to the construction site, water supply in accordance with Section 3313.2 shall be provided. Additional water supply for fire flow is not required prior to commencing vertical construction of Type I and II buildings."
3313.5,Section 3313 Water Supply for Fire Protection,Standpipe Supply,"Regardless of the presence of combustible building materials, the construction type or the fire separation distance, where a standpipe is required in accordance with Section 3311, a water supply providing a minimum flow of 500 gallons per minute (1893 L/m) shall be provided. The fire hydrant used for this water supply shall be located within 100 feet (30 480 mm) of the fire department connection supplying the standpipe."
3314,Chapter 33 Safeguards During Construction,Fire Watch During Construction,
3314.1,Section 3314 Fire Watch During Construction,Fire Watch During Construction,"A fire watch shall be provided during nonworking hours for construction that exceeds 40 feet (12 192 mm) in height above the lowest adjacent grade at any point along the building perimeter, for new multistory construction with an aggregate area exceeding 50,000 square feet (4645 m2) per story or as required by the fire code official."
