id,section,title,body,ifc_type,occupancy,design_phase,code_category,primary_responsibility
4,,Prescriptive Compliance Methods,,,,,,
401,Chapter 4 Prescriptive Compliance Methods,General,,,,,,
401.1,Section 401 General,Scope,"The provisions of this chapter shall control the alteration, repair, addition and change of occupancy or relocation of existing buildings and structures, including historic buildings and structures as referenced in Section 301.1.1. Exception: Existing bleachers, grandstands and folding and telescopic seating shall comply with ICC 300.",,,,,
401.1.1,Section 401 General,Compliance With Other Methods,"Alterations, repairs, additions and changes of occupancy to or relocation of, existing buildings and structures shall comply with the provisions of this chapter or with one of the methods provided in Section 301.1.",,,,,
401.2,Section 401 General,Building Materials and Systems,Building materials and systems shall comply with the requirements of this section.,,,,,
401.2.1,Section 401 General,Existing Materials,Materials already in use in a building in compliance with requirements or approvals in effect at the time of their erection or installation shall be permitted to remain in use unless determined by the building official to be unsafe per Section 115.,,,,,
401.2.2,Section 401 General,New and Replacement Materials,"Except as otherwise required or permitted by this code, materials permitted by the applicable code for new construction shall be used. Like materials shall be permitted for repairs and alterations, provided no hazard to life, health or property is created. Hazardous materials shall not be used where the code for new construction would not permit their use in buildings of similar occupancy, purpose and location.",,,,,
401.2.3,Section 401 General,Existing Seismic Force-Resisting Systems,"Where the existing seismic force-resisting system is a type that can be designated ordinary, values of R, Ω0 and Cd for the existing seismic force-resisting system shall be those specified by the International Building Code for an ordinary system unless it is demonstrated that the existing system will provide performance equivalent to that of a detailed, intermediate or special system.",,,,,
401.3,Section 401 General,Dangerous Conditions,The building official shall have the authority to require the elimination of conditions deemed dangerous.,,,,,
402,Chapter 4 Prescriptive Compliance Methods,Additions,,,,,,
402.1,Section 402 Additions,General,Additions to any building or structure shall comply with the requirements of the International Building Code for new construction. Alterations to the existing building or structure shall be made to ensure that the existing building or structure together with the addition are no less conforming to the provisions of the International Building Code than the existing building or structure was prior to the addition. An existing building together with its additions shall comply with the height and area provisions of Chapter 5 of the International Building Code.,,,,,
402.2,Section 402 Additions,Flood Hazard Areas,"For buildings and structures in flood hazard areas established in Section 1612.3 of the International Building Code, or Section R322 of the International Residential Code, as applicable, any addition that constitutes substantial improvement of the existing structure shall comply with the flood design requirements for new construction, and all aspects of the existing structure shall be brought into compliance with the requirements for new construction for flood design. For buildings and structures in flood hazard areas established in Section 1612.3 of the International Building Code, or Section R322 of the International Residential Code, as applicable, any additions that do not constitute substantial improvement of the existing structure are not required to comply with the flood design requirements for new construction.",,,,,
402.3,Section 402 Additions,Existing Structural Elements Carrying Gravity Load,"Any existing gravity load-carrying structural element for which an addition and its related alterations cause an increase in design gravity load of more than 5 percent shall be strengthened, supplemented, replaced or otherwise altered as needed to carry the increased gravity load required by the International Building Code for new structures. Any existing gravity load-carrying structural element whose gravity load-carrying capacity is decreased shall be considered an altered element subject to the requirements of Section 403.3. Any existing element that will form part of the lateral load path for any part of the addition shall be considered an existing lateral load-carrying structural element subject to the requirements of Section 402.4.",,,,,
402.3.1,Section 402 Additions,Design Live Load,"Where the addition does not result in increased design live load, existing gravity load-carrying structural elements shall be permitted to be evaluated and designed for live loads approved prior to the addition. If the approved live load is less than that required by Section 1607 of the International Building Code, the area designed for the nonconforming live load shall be posted with placards of approved design indicating the approved live load. Where the addition does result in increased design live load, the live load required by Section 1607 of the International Building Code shall be used.",,,,,
402.4,Section 402 Additions,Existing Structural Elements Carrying Lateral Load,"Where the addition is structurally independent of the existing structure, existing lateral load-carrying structural elements shall be permitted to remain unaltered. Where the addition is not structurally independent of the existing structure, the existing structure and its addition acting together as a single structure shall be shown to meet the requirements of Sections 1609 and 1613 of the International Building Code. For purposes of this section, compliance with ASCE 41, using a Tier 3 procedure and the two-level performance objective in Table 301.1.4.1 for the applicable risk category, shall be deemed to meet the requirements of Section 1613. Exception: Any existing lateral load-carrying structural element whose demand-capacity ratio with the addition considered is no more than 10 percent greater than its demand-capacity ratio with the addition ignored shall be permitted to remain unaltered. For purposes of calculating demand-capacity ratios, the demand shall consider applicable load combinations with design lateral loads or forces in accordance with Sections 1609 and 1613 of the International Building Code. For purposes of this exception, comparisons of demand-capacity ratios and calculation of design lateral loads, forces and capacities shall account for the cumulative effects of additions and alterations since original construction.",,,,,
402.5,Section 402 Additions,Smoke Alarms in Existing Portions of a Building,"Where an addition is made to a building or structure of a Group R or I-1 occupancy, the existing building shall be provided with smoke alarms in accordance with Section 1103.8 of the International Fire Code.",,,,,
403,Chapter 4 Prescriptive Compliance Methods,Alterations,,,,,,
403.1,Section 403 Alterations,General,"Except as provided by Section 401.2 or this section, alterations to any building or structure shall comply with the requirements of the International Building Code for new construction. Alterations shall be such that the existing building or structure is no less conforming to the provisions of the International Building Code than the existing building or structure was prior to the alteration. Exceptions: An existing stairway shall not be required to comply with the requirements of Section 1011 of the International Building Code where the existing space and construction does not allow a reduction in pitch or slope. Handrails otherwise required to comply with Section 1011.11 of the International Building Code shall not be required to comply with the requirements of Section 1014.6 of the International Building Code regarding full extension of the handrails where such extensions would be hazardous due to plan configuration.",,,,,
403.2,Section 403 Alterations,Flood Hazard Areas,"For buildings and structures in flood hazard areas established in Section 1612.3 of the International Building Code, or Section R322 of the International Residential Code, as applicable, any alteration that constitutes substantial improvement of the existing structure shall comply with the flood design requirements for new construction, and all aspects of the existing structure shall be brought into compliance with the requirements for new construction for flood design. For buildings and structures in flood hazard areas established in Section 1612.3 of the International Building Code, or Section R322 of the International Residential Code, as applicable, any alterations that do not constitute substantial improvement of the existing structure are not required to comply with the flood design requirements for new construction.",,,,,
403.3,Section 403 Alterations,Existing Structural Elements Carrying Gravity Load,"Any existing gravity load-carrying structural element for which an alteration causes an increase in design gravity load of more than 5 percent shall be strengthened, supplemented, replaced or otherwise altered as needed to carry the increased gravity load required by the International Building Code for new structures. Any existing gravity load-carrying structural element whose gravity load-carrying capacity is decreased as part of the alteration shall be shown to have the capacity to resist the applicable design gravity loads required by the International Building Code for new structures.",,,,,
403.3.1,Section 403 Alterations,Design Live Load,"Where the alteration does not result in increased design live load, existing gravity load-carrying structural elements shall be permitted to be evaluated and designed for live loads approved prior to the alteration. If the approved live load is less than that required by Section 1607 of the Building Code, the area designed for the nonconforming live load shall be posted with placards of approved design indicating the approved live load. Where the alteration does result in increased design live load, the live load required by Section 1607 of the Building Code shall be used. Exception: Buildings erected before July 1, 1925: In the alteration of buildings erected before July 1, 1925, the engineer of record is authorized to apply a maximum reduction of thirty percent (30%) of the specified minimum live loads in Table 1607.1 of the Building Code for live loads above 40 psf (1.92 kN/m2), provided that official live load placards are posted on the public areas of the affected floors showing this reduced live load. Live loads shall not be reduced to less than 40 psf (1.92 kN/m2).",,,,,
403.4,Section 403 Alterations,Existing Structural Elements Carrying Lateral Load,"Except as permitted by Section 403.9, where the alteration increases design lateral loads in accordance with Section 1609 or 1613 of the International Building Code, or where the alteration results in a prohibited structural irregularity as defined in ASCE 7, or where the alteration decreases the capacity of any existing lateral load-carrying structural element, the structure of the altered building or structure shall be shown to meet the requirements of Sections 1609 and 1613 of the International Building Code. For purposes of this section, compliance with ASCE 41, using a Tier 3 procedure and the two-level performance objective in Table 301.1.4.1 for the applicable risk category, shall be deemed to meet the requirements of Section 1613 of the International Building Code. Exception: Any existing lateral load-carrying structural element whose demand-capacity ratio with the alteration considered is no more than 10 percent greater than its demand-capacity ratio with the alteration ignored shall be permitted to remain unaltered. For purposes of calculating demand-capacity ratios, the demand shall consider applicable load combinations with design lateral loads or forces in accordance with Sections 1609 and 1613 of the International Building Code. For purposes of this exception, comparisons of demand-capacity ratios and calculation of design lateral loads, forces and capacities shall account for the cumulative effects of additions and alterations since original construction.",,,,,
403.4.1,Section 403 Alterations,Seismic Design Category F,"Where the portion of the building undergoing the intended alteration exceeds 50 percent of the aggregate area of the building, and where the building is assigned to Seismic Design Category F, the structure of the altered building shall be shown to meet the earthquake design provisions of the International Building Code. For purposes of this section, the earthquake loads need not be taken greater than 75 percent of those prescribed in Section 1613 of the International Building Code for new buildings of similar occupancy, purpose and location. New structural members and connections required by this section shall comply with the detailing provisions of this code for new buildings of similar structure, purpose and location.",,,,,
403.5,Section 403 Alterations,Bracing for Unreinforced Masonry Parapets Upon Reroofing,"Where the intended alteration requires a permit for reroofing and involves removal of roofing materials from more than 25 percent of the roof area of a building assigned to Seismic Design Category D, E or F that has parapets constructed of unreinforced masonry, the work shall include installation of parapet bracing to resist out-of-plane seismic forces, unless an evaluation demonstrates compliance of such items. For purposes of this section, design seismic forces need not be taken greater than 75 percent of those that would be required for the design of similar nonstructural components in new buildings of similar purpose and location.",,,,,
403.6,Section 403 Alterations,Wall Anchorage for Unreinforced Masonry Walls in Major Alterations,"Where the portion of the building undergoing the intended alteration exceeds 50 percent of the aggregate area of the building, the building is assigned to Seismic Design Category C, D, E or F, and the building's structural system includes unreinforced masonry walls, the alteration work shall include installation of wall anchors at the roof line to resist seismic forces, unless an evaluation demonstrates compliance of existing wall anchorage. For purposes of this section, design seismic forces need not be taken greater than 75 percent of those that would be required for the design of new buildings of similar structure, purpose and location.",,,,,
403.7,Section 403 Alterations,Bracing for Unreinforced Masonry Parapets in Major Alterations,"Where the portion of the building undergoing the intended alteration exceeds 50 percent of the aggregate area of the building, and where the building is assigned to Seismic Design Category C, D, E or F, parapets constructed of unreinforced masonry shall have bracing installed as needed to resist out-of-plane seismic forces, unless an evaluation demonstrates compliance of such items. For purposes of this section, design seismic forces need not be taken greater than 75 percent of those that would be required for the design of similar nonstructural components in new buildings of similar purpose and location.",,,,,
403.8,Section 403 Alterations,Roof Diaphragms Resisting Wind Loads in High-Wind Regions,"Where the intended alteration requires a permit for reroofing and involves removal of roofing materials from more than 50 percent of the roof diaphragm of a building or section of a building located where the ultimate design wind speed is greater than 115 mph (51 m/s) in accordance with Figure 1609.3(1) of the International Building Code or in a special wind region as defined in Section 1609 of the International Building Code, roof diaphragms, connections of the roof diaphragm to roof framing members, and roof-to-wall connections shall be evaluated for the wind loads specified in Section 1609 of the International Building Code, including wind uplift. If the diaphragms and connections in their current condition are not capable of resisting at least 75 percent of those wind loads, they shall be replaced or strengthened in accordance with the loads specified in Section 1609 of the International Building Code.",,,,,
403.9,Section 403 Alterations,Voluntary Seismic Improvements,"Alterations to existing structural elements or additions of new structural elements that are not otherwise required by this chapter and are initiated for the purpose of improving the performance of the seismic force-resisting system of an existing structure or the performance of seismic bracing or anchorage of existing nonstructural elements shall be permitted, provided that an engineering analysis is submitted demonstrating the following: The altered structure and the altered nonstructural elements are no less conforming to the provisions of the International Building Code with respect to earthquake design than they were prior to the alteration. New structural elements are detailed as required for new construction. New or relocated nonstructural elements are detailed and connected to existing or new structural elements as required for new construction. The alterations do not create a structural irregularity as defined in ASCE 7 or make an existing structural irregularity more severe.",,,,,
403.10,Section 403 Alterations,Smoke Alarms,Individual sleeping units and individual dwelling units in Group R and I-1 occupancies shall be provided with smoke alarms in accordance with Section 1103.8 of the International Fire Code.,,,,,
403.11,Section 403 Alterations,Refuge Areas,"Where alterations affect the configuration of an area utilized as a refuge area, the capacity of the refuge area shall not be reduced below that required in Sections 403.11.1 through 403.11.3.",,,,,
403.11.1,Section 403 Alterations,Smoke Compartments,"In Group I-2 and I-3 occupancies, the required capacity of the refuge areas for smoke compartments in accordance with Sections 407.5.1 and 408.6.2 of the International Building Code shall be maintained.",,,,,
403.11.2,Section 403 Alterations,Ambulatory Care,"In ambulatory care facilities required to be separated by Section 422.2 of the International Building Code, the required capacity of the refuge areas for smoke compartments in accordance with Section 422.3.2 of the International Building Code shall be maintained.",,,,,
403.11.3,Section 403 Alterations,Horizontal Exits,The required capacity of the refuge area for horizontal exits in accordance with Section 1026.4 of the International Building Code shall be maintained.,,,,,
404,Chapter 4 Prescriptive Compliance Methods,Repairs,,,,,,
404.1,Section 404 Repairs,General,"Buildings and structures, and parts thereof, shall be repaired in compliance with Sections 401.2 and 404. Work on nondamaged components that is necessary for the required repair of damaged components shall be considered part of the repair and shall not be subject to the requirements for alterations in this chapter. Routine maintenance required by Section 401.2, ordinary repairs exempt from permit in accordance with Section 105.2, and abatement of wear due to normal service conditions shall not be subject to the requirements for repairs in this section.",,,,,
404.2,Section 404 Repairs,Substantial Structural Damage to Vertical Elements of the Lateral Force-Resisting System,"A building that has sustained substantial structural damage to the vertical elements of its lateral force-resisting system shall be evaluated and repaired in accordance with the applicable provisions of Sections 404.2.1 through 404.2.3. Exceptions: Buildings assigned to Seismic Design Category A, B or C whose substantial structural damage was not caused by earthquake need not be evaluated or rehabilitated for load combinations that include earthquake effects. One- and two-family dwellings need not be evaluated or rehabilitated for load combinations that include earthquake effects.",,,,,
404.2.1,Section 404 Repairs,Evaluation,"The building shall be evaluated by a registered design professional, and the evaluation findings shall be submitted to the building official. The evaluation shall establish whether the damaged building, if repaired to its predamage state, would comply with the provisions of the International Building Code for wind and earthquake loads. Wind loads for this evaluation shall be those prescribed in Section 1609 of the International Building Code. Earthquake loads for this evaluation, if required, shall be permitted to be 75 percent of those prescribed in Section 1613 of the International Building Code. Alternatively, compliance with ASCE 41, using the performance objective in Table 301.1.4.2 for the applicable risk category, shall be deemed to meet the earthquake evaluation requirement.",,,,,
404.2.2,Section 404 Repairs,Extent of Repair for Compliant Buildings,"If the evaluation establishes compliance of the predamage building in accordance with Section 404.2.1, then repairs shall be permitted that restore the building to its predamage state.",,,,,
404.2.3,Section 404 Repairs,Extent of Repair for Noncompliant Buildings,"If the evaluation does not establish compliance of the predamage building in accordance with Section 404.2.1, then the building shall be rehabilitated to comply with applicable provisions of the International Building Code for load combinations that include wind or seismic loads. The wind loads for the repair shall be as required by the building code in effect at the time of original construction, unless the damage was caused by wind, in which case the wind loads shall be as required by the International Building Code. Earthquake loads for this rehabilitation design shall be those required for the design of the predamage building, but not less than 75 percent of those prescribed in Section 1613 of the International Building Code. New structural members and connections required by this rehabilitation design shall comply with the detailing provisions of the International Building Code for new buildings of similar structure, purpose and location. Alternatively, compliance with ASCE 41, using the performance objective in Table 301.1.4.2 for the applicable risk category, shall be deemed to meet the earthquake rehabilitation requirement.",,,,,
404.3,Section 404 Repairs,Substantial Structural Damage to Gravity Load-Carrying Components,"Gravity load-carrying components that have sustained substantial structural damage shall be rehabilitated to comply with the applicable provisions of the International Building Code for dead and live loads. Snow loads shall be considered if the substantial structural damage was caused by or related to snow load effects. Existing gravity load-carrying structural elements shall be permitted to be designed for live loads approved prior to the damage. If the approved live load is less than that required by Section 1607 of the International Building Code, the area designed for the nonconforming live load shall be posted with placards of approved design indicating the approved live load. Nondamaged gravity load-carrying components that receive dead, live or snow loads from rehabilitated components shall also be rehabilitated or shown to have the capacity to carry the design loads of the rehabilitation design. New structural members and connections required by this rehabilitation design shall comply with the detailing provisions of the International Building Code for new buildings of similar structure, purpose and location.",,,,,
404.3.1,Section 404 Repairs,Lateral Force-Resisting Elements,"Regardless of the level of damage to vertical elements of the lateral force-resisting system, if substantial structural damage to gravity load-carrying components was caused primarily by wind or earthquake effects, then the building shall be evaluated in accordance with Section 404.2.1 and, if noncompliant, rehabilitated in accordance with Section 404.2.3. Exceptions: One- and two-family dwellings need not be evaluated or rehabilitated for load combinations that include earthquake effects. Buildings assigned to Seismic Design Category A, B or C whose substantial structural damage was not caused by earthquake need not be evaluated or rehabilitated for load combinations that include earthquake effects.",,,,,
404.4,Section 404 Repairs,Less Than Substantial Structural Damage,"For damage less than substantial structural damage, repairs shall be allowed that restore the building to its predamage state. New structural members and connections used for this repair shall comply with the detailing provisions of the International Building Code for new buildings of similar structure, purpose and location.",,,,,
404.5,Section 404 Repairs,Flood Hazard Areas,"For buildings and structures in flood hazard areas established in Section 1612.3 of the International Building Code, or Section R322 of the International Residential Code, as applicable, any repair that constitutes substantial improvement or repair of substantial damage of the existing structure shall comply with the flood design requirements for new construction, and all aspects of the existing structure shall be brought into compliance with the requirements for new construction for flood design. For buildings and structures in flood hazard areas established in Section 1612.3 of the International Building Code, or Section R322 of the International Residential Code, as applicable, any repairs that do not constitute substantial improvement or repair of substantial damage of the existing structure are not required to comply with the flood design requirements for new construction.",,,,,
405,Chapter 4 Prescriptive Compliance Methods,Fire Escapes,,,,,,
