id,section,title,body,ifc_type,occupancy,design_phase,code_category,primary_responsibility
405.1,Section 405 Fire Escapes,Where Permitted,Fire escapes shall be permitted only as provided for in Sections 405.1.1 through 405.1.4.,,,,,
405.1.1,Section 405 Fire Escapes,New Buildings,Fire escapes shall not constitute any part of the required means of egress in new buildings.,,,,,
405.1.2,Section 405 Fire Escapes,Existing Fire Escapes,Existing fire escapes shall continue to be accepted as a component in the means of egress in existing buildings only.,,,,,
405.1.3,Section 405 Fire Escapes,New Fire Escapes,"New fire escapes for existing buildings shall be permitted only where exterior stairways cannot be utilized due to lot lines limiting stairway size or due to the sidewalks, alleys or roads at grade level. New fire escapes shall not incorporate ladders or access by windows.",,,,,
405.1.4,Section 405 Fire Escapes,Limitations,Fire escapes shall comply with this section and shall not constitute more than 50 percent of the required number of exits nor more than 50 percent of the required exit capacity.,,,,,
405.2,Section 405 Fire Escapes,Location,"Where located on the front of the building and where projecting beyond the building line, the lowest landing shall be not less than 7 feet (2134 mm) or more than 12 feet (3658 mm) above grade, and shall be equipped with a counterbalanced stairway to the street. In alleyways and thoroughfares less than 30 feet (9144 mm) wide, the clearance under the lowest landing shall be not less than 12 feet (3658 mm).",,,,,
405.3,Section 405 Fire Escapes,Construction,The fire escape shall be designed to support a live load of 100 pounds per square foot (4788 Pa) and shall be constructed of steel or other approved noncombustible materials. Fire escapes constructed of wood not less than nominal 2 inches (51 mm) thick are permitted on buildings of Type V construction. Walkways and railings located over or supported by combustible roofs in buildings of Type III and IV construction are permitted to be of wood not less than nominal 2 inches (51 mm) thick.,,,,,
405.4,Section 405 Fire Escapes,Dimensions,"Stairways shall be at least 22 inches (559 mm) wide with risers not more than, and treads not less than, 8 inches (203 mm) and landings at the foot of stairways not less than 40 inches (1016 mm) wide by 36 inches (914 mm) long, located not more than 8 inches (203 mm) below the door.",,,,,
405.5,Section 405 Fire Escapes,Opening Protectives,Doors and windows along the fire escape shall be protected with 3/4-hour opening protectives.,,,,,
406,Chapter 4 Prescriptive Compliance Methods,Glass Replacement and Replacement Windows,,,,,,
406.1,Section 406 Glass Replacement and Replacement Windows,Replacement Glass,The installation or replacement of glass shall be as required for new installations.,,,,,
406.2,Section 406 Glass Replacement and Replacement Windows,Replacement Window Opening Control Devices,"In Group R-2 or R-3 buildings containing dwelling units, window opening control devices complying with ASTM F 2090 shall be installed where an existing window is replaced and where all of the following apply to the replacement window: The window is operable; The window replacement includes replacement of the sash and the frame; The top of the sill of the window opening is at a height less than 36 inches (915 mm) above the finished floor; The window will permit openings that will allow passage of a 4-inch-diameter (102 mm) sphere when the window is in its largest opened position; and The vertical distance from the top of the sill of the window opening to the finished grade or other surface below, on the exterior of the building, is greater than 72 inches (1829 mm). The window opening control device, after operation to release the control device allowing the window to fully open, shall not reduce the minimum net clear opening area of the window unit to less than the area required by Section 1030.2 of the International Building Code. Exceptions: Operable windows where the top of the sill of the window opening is located more than 75 feet (22 860 mm) above the finished grade or other surface below, on the exterior of the room, space or building, and that are provided with window fall prevention devices that comply with ASTM F 2006. Operable windows with openings that are provided with window fall prevention devices that comply with ASTM F 2090.",,,,,
406.3,Section 406 Glass Replacement and Replacement Windows,Replacement Window Emergency Escape and Rescue Openings,"Where windows are required to provide emergency escape and rescue openings in Group R-2 and R-3 occupancies, replacement windows shall be exempt from the requirements of Sections 1030.2, 1030.3 and 1030.5 of the International Building Code provided the replacement window meets the following conditions: The replacement window is the manufacturer's largest standard size window that will fit within the existing frame or existing rough opening. The replacement window shall be permitted to be of the same operating style as the existing window or a style that provides for an equal or greater window opening area than the existing window. The replacement of the window is not part of a change of occupancy.",,,,,
407,Chapter 4 Prescriptive Compliance Methods,Change of Occupancy,,,,,,
407.1,Section 407 Change of Occupancy,Conformance,"No change shall be made in the use or occupancy of any building unless such building is made to comply with the requirements of the International Building Code for the use or occupancy. Changes in use or occupancy in a building or portion thereof shall be such that the existing building is no less complying with the provisions of this code than the existing building or structure was prior to the change. Subject to the approval of the building official, the use or occupancy of existing buildings shall be permitted to be changed and the building is allowed to be occupied for purposes in other groups without conforming to all of the requirements of this code for those groups, provided the new or proposed use is less hazardous, based on life and fire risk, than the existing use. Exception: The building need not be made to comply with the seismic requirements for a new structure unless required by Section 407.4.",,,,,
407.1.1,Section 407 Change of Occupancy,Change in the Character of Use,"A change in occupancy with no change of occupancy classification shall not be made to any structure that will subject the structure to any special provisions of the applicable International Codes, without approval of the building official. Compliance shall be only as necessary to meet the specific provisions and is not intended to require the entire building be brought into compliance.",,,,,
407.2,Section 407 Change of Occupancy,Certificate of Occupancy,A certificate of occupancy shall be issued where it has been determined that the requirements for the new occupancy classification have been met.,,,,,
407.3,Section 407 Change of Occupancy,Stairways,An existing stairway shall not be required to comply with the requirements of Section 1011 of the International Building Code where the existing space and construction does not allow a reduction in pitch or slope.,,,,,
407.4,Section 407 Change of Occupancy,Structural,"When a change of occupancy results in a structure being reclassified to a higher risk category, the structure shall conform to the seismic requirements for a new structure of the higher risk category. For purposes of this section, compliance with ASCE 41, using a Tier 3 procedure and the two-level performance objective in Table 301.1.4.1 for the applicable risk category, shall be deemed to meet the requirements of Section 1613 of the International Building Code. Exceptions: Specific seismic detailing requirements of Section 1613 of the International Building Code for a new structure shall not be required to be met where the seismic performance is shown to be equivalent to that of a new structure. A demonstration of equivalence shall consider the regularity, overstrength, redundancy and ductility of the structure. When a change of use results in a structure being reclassified from Risk Category I or II to Risk Category III and the structure is located where the seismic coefficient, SDS, is less than 0.33, compliance with the seismic requirements of Section 1613 of the International Building Code is not required.",,,,,
408,Chapter 4 Prescriptive Compliance Methods,Historic Buildings,,,,,,
408.1,Section 408 Historic Buildings,Historic Buildings,"The provisions of this code that require improvements relative to a building's existing condition or, in the case of repairs, that require improvements relative to a building's predamage condition, shall not be mandatory for historic buildings unless specifically required by this section.",,,,,
408.2,Section 408 Historic Buildings,Life Safety Hazards,The provisions of this code shall apply to historic buildings judged by the building official to constitute a distinct life safety hazard.,,,,,
408.3,Section 408 Historic Buildings,Flood Hazard Areas,"Within flood hazard areas established in accordance with Section 1612.3 of the International Building Code, or Section R322 of the International Residential Code, as applicable, where the work proposed constitutes substantial improvement, the building shall be brought into compliance with Section 1612 of the International Building Code, or Section R322 of the International Residential Code, as applicable: Exception: Historic buildings need not be brought into compliance that are: Listed or preliminarily determined to be eligible for listing in the National Register of Historic Places; Determined by the Secretary of the U.S. Department of Interior as contributing to the historical significance of a registered historic district or a district preliminarily determined to qualify as an historic district; or Designated as historic under a state or local historic preservation program that is approved by the Department of Interior.",,,,,
409,Chapter 4 Prescriptive Compliance Methods,Moved Structures,,,,,,
409.1,Section 409 Moved Structures,Conformance,Structures moved into or within the jurisdiction shall comply with the provisions of the International Building Code for new structures.,,,,,
410,Chapter 4 Prescriptive Compliance Methods,Accessibility for Existing Buildings,,,,,,
410.1,Section 410 Accessibility for Existing Buildings,Scope,"The provisions of Sections 410.1 through 410.9 apply to maintenance, change of occupancy, additions and alterations to existing buildings, including those identified as historic buildings.",,,,,
410.2,Section 410 Accessibility for Existing Buildings,Maintenance of Facilities,A facility that is constructed or altered to be accessible shall be maintained accessible during occupancy.,,,,,
410.3,Section 410 Accessibility for Existing Buildings,Extent of Application,An alteration of an existing facility shall not impose a requirement for greater accessibility than that which would be required for new construction. Alterations shall not reduce or have the effect of reducing accessibility of a facility or portion of a facility.,,,,,
410.4,Section 410 Accessibility for Existing Buildings,Change of Occupancy,Existing buildings that undergo a change of group or occupancy shall comply with this section. Exception: Type B dwelling or sleeping units required by Section 1107 of the International Building Code are not required to be provided in existing buildings and facilities undergoing a change of occupancy in conjunction with alterations where the work area is 50 percent or less of the aggregate area of the building.,,,,,
410.4.1,Section 410 Accessibility for Existing Buildings,Partial Change in Occupancy,"Where a portion of the building is changed to a new occupancy classification, any alterations shall comply with Sections 410.6, 410.7 and 410.8.",,,,,
410.4.2,Section 410 Accessibility for Existing Buildings,Complete Change of Occupancy,"Where an entire building undergoes a change of occupancy, it shall comply with Section 410.4.1 and shall have all of the following accessible features: At least one accessible building entrance. At least one accessible route from an accessible building entrance to primary function areas. Signage complying with Section 1111 of the International Building Code. Accessible parking, where parking is being provided. At least one accessible passenger loading zone, when loading zones are provided. At least one accessible route connecting accessible parking and accessible passenger loading zones to an accessible entrance. Where it is technically infeasible to comply with the new construction standards for any of these requirements for a change of group or occupancy, the above items shall conform to the requirements to the maximum extent technically feasible. Exception: The accessible features listed in Items 1 through 6 are not required for an accessible route to Type B units.",,,,,
410.5,Section 410 Accessibility for Existing Buildings,Additions,"Provisions for new construction shall apply to additions. An addition that affects the accessibility to, or contains an area of, a primary function shall comply with the requirements in Section 410.7.",,,,,
410.6,Section 410 Accessibility for Existing Buildings,Alterations,"A facility that is altered shall comply with the applicable provisions in Chapter 11 of the International Building Code, unless technically infeasible. Where compliance with this section is technically infeasible, the alteration shall provide access to the maximum extent technically feasible. Exceptions: The altered element or space is not required to be on an accessible route, unless required by Section 410.7. Accessible means of egress required by Chapter 10 of the International Building Code are not required to be provided in existing facilities. The alteration to Type A individually owned dwelling units within a Group R-2 occupancy shall be permitted to meet the provision for a Type B dwelling unit. Type B dwelling or sleeping units required by Section 1107 of the International Building Code are not required to be provided in existing buildings and facilities undergoing a change of occupancy in conjunction with alterations where the work area is 50 percent or less of the aggregate area of the building.",,,,,
410.7,Section 410 Accessibility for Existing Buildings,Alterations Affecting an Area Containing a Primary Function,"Where an alteration affects the accessibility to, or contains an area of primary function, the route to the primary function area shall be accessible. The accessible route to the primary function area shall include toilet facilities and drinking fountains serving the area of primary function. Exceptions: The costs of providing the accessible route are not required to exceed 20 percent of the costs of the alterations affecting the area of primary function. This provision does not apply to alterations limited solely to windows, hardware, operating controls, electrical outlets and signs. This provision does not apply to alterations limited solely to mechanical systems, electrical systems, installation or alteration of fire protection systems and abatement of hazardous materials. This provision does not apply to alterations undertaken for the primary purpose of increasing the accessibility of a facility. This provision does not apply to altered areas limited to Type B dwelling and sleeping units.",,,,,
410.8,Section 410 Accessibility for Existing Buildings,Scoping for Alterations,The provisions of Sections 410.8.1 through 410.8.14 shall apply to alterations to existing buildings and facilities.,,,,,
410.8.1,Section 410 Accessibility for Existing Buildings,Entrances,"Accessible entrances shall be provided in accordance with Section 1105. Exception: Where an alteration includes alterations to an entrance, and the facility has an accessible entrance, the altered entrance is not required to be accessible, unless required by Section 410.7. Signs complying with Section 1111 of the International Building Code shall be provided.",,,,,
410.8.2,Section 410 Accessibility for Existing Buildings,Elevators,Altered elements of existing elevators shall comply with ASME A17.1 and ICC A117.1. Such elements shall also be altered in elevators programmed to respond to the same hall call control as the altered elevator.,,,,,
410.8.3,Section 410 Accessibility for Existing Buildings,Platform Lifts,Platform (wheelchair) lifts complying with ICC A117.1 and installed in accordance with ASME A18.1 shall be permitted as a component of an accessible route.,,,,,
410.8.4,Section 410 Accessibility for Existing Buildings,Stairways and Escalators in Existing Buildings,"In alterations, change of occupancy or additions where an escalator or stairway is added where none existed previously and major structural modifications are necessary for installation, an accessible route shall be provided between the levels served by the escalator or stairways in accordance with Section 1104.4 of the International Building Code.",,,,,
410.8.5,Section 410 Accessibility for Existing Buildings,Ramps,"Where slopes steeper than allowed by Section 1012.2 of the International Building Code are necessitated by space limitations, the slope of ramps in or providing access to existing facilities shall comply with Table 410.8.5. TABLE 410.8.5 RAMPS SLOPE MAXIMUM RISE Steeper than 1:10 but not steeper than 1:8 3 inches Steeper than 1:12 but not steeper than 1:10 6 inches For SI: 1 inch = 25.4 mm.",,,,,
410.8.6,Section 410 Accessibility for Existing Buildings,Accessible Dwelling or Sleeping Units,"Where Group I-1, I-2, I-3, R-1, R-2 or R-4 dwelling or sleeping units are being altered or added, the requirements of Section 1107 of the International Building Code for Accessible units apply only to the quantity of spaces being altered or added.",,,,,
410.8.7,Section 410 Accessibility for Existing Buildings,Type A Dwelling or Sleeping Units,"Where more than 20 Group R-2 dwelling or sleeping units are being altered or added, the requirements of Section 1107 of the International Building Code for Type A units apply only to the quantity of the spaces being altered or added.",,,,,
410.8.8,Section 410 Accessibility for Existing Buildings,Type B Dwelling or Sleeping Units,"Where four or more Group I-1, I-2, R-1, R-2, R-3 or R-4 dwelling or sleeping units are being added, the requirements of Section 1107 of the International Building Code for Type B units apply only to the quantity of the spaces being added. Where Group I-1, I-2, R-1, R-2, R-3 or R-4 dwelling or sleeping units are being altered and where the work area is greater than 50 percent of the aggregate area of the building, the requirements of Section 1107 of the International Building Code for Type B units apply only to the quantity of the spaces being altered.",,,,,
410.8.9,Section 410 Accessibility for Existing Buildings,Jury Boxes and Witness Stands,"In alterations, accessible wheelchair spaces are not required to be located within the defined area of raised jury boxes or witness stands and shall be permitted to be located outside these spaces where the ramp or lift access restricts or projects into the means of egress.",,,,,
410.8.10,Section 410 Accessibility for Existing Buildings,Toilet Rooms,"Where it is technically infeasible to alter existing toilet and bathing rooms to be accessible, an accessible family or assisted-use toilet or bathing room constructed in accordance with Section 1109.2.1 of the International Building Code is permitted. The family or assisted-use toilet or bathing room shall be located on the same floor and in the same area as the existing toilet or bathing rooms. At the inaccessible toilet and bathing rooms, provide directional signs indicating the location of the nearest family or assisted-use toilet room or bathing room. These directional signs shall include the International Symbol of Accessibility and sign characters shall meet the visual character requirements in accordance with ICC A117.1.",,,,,
410.8.11,Section 410 Accessibility for Existing Buildings,"Dressing, Fitting and Locker Rooms","Where it is technically infeasible to provide accessible dressing, fitting or locker rooms at the same location as similar types of rooms, one accessible room on the same level shall be provided. Where separate-sex facilities are provided, accessible rooms for each sex shall be provided. Separate-sex facilities are not required where only unisex rooms are provided.",,,,,
410.8.12,Section 410 Accessibility for Existing Buildings,Fuel Dispensers,"Operable parts of replacement fuel dispensers shall be permitted to be 54 inches (1370 mm) maximum, measuring from the surface of the vehicular way where fuel dispensers are installed on existing curbs.",,,,,
410.8.13,Section 410 Accessibility for Existing Buildings,Thresholds,The maximum height of thresholds at doorways shall be 3/4 inch (19.1 mm). Such thresholds shall have beveled edges on each side.,,,,,
410.8.14,Section 410 Accessibility for Existing Buildings,Amusement Rides,"Where the structural or operational characteristics of an amusement ride are altered to the extent that the amusement ride's performance differs from that specified by the manufacturer or the original design, the amusement ride shall comply with requirements for new construction in Section 1110.4.8 of the International Building Code.",,,,,
410.9,Section 410 Accessibility for Existing Buildings,Historic Buildings,"These provisions shall apply to facilities designated as historic structures that undergo alterations or a change of occupancy, unless technically infeasible. Where compliance with the requirements for accessible routes, entrances or toilet rooms would threaten or destroy the historic significance of the facility, as determined by the applicable governing authority, the alternative requirements of Sections 410.9.1 through 410.9.4 for that element shall be permitted. Exception: Type B dwelling or sleeping units required by Section 1107 of the International Building Code are not required to be provided in historical buildings.",,,,,
410.9.1,Section 410 Accessibility for Existing Buildings,Site Arrival Points,At least one accessible route from a site arrival point to an accessible entrance shall be provided.,,,,,
410.9.2,Section 410 Accessibility for Existing Buildings,Multilevel Buildings and Facilities,An accessible route from an accessible entrance to public spaces on the level of the accessible entrance shall be provided.,,,,,
410.9.3,Section 410 Accessibility for Existing Buildings,Entrances,"At least one main entrance shall be accessible. Exceptions: If a main entrance cannot be made accessible, an accessible nonpublic entrance that is unlocked while the building is occupied shall be provided; or If a main entrance cannot be made accessible, a locked accessible entrance with a notification system or remote monitoring shall be provided. Signs complying with Section 1111 of the International Building Code shall be provided at the primary entrance and the accessible entrance.",,,,,
410.9.4,Section 410 Accessibility for Existing Buildings,Toilet and Bathing Facilities,"Where toilet rooms are provided, at least one accessible family or assisted-use toilet room complying with Section 1109.2.1 of the International Building Code shall be provided.",,,,,
