id,section,reference,title,depth,body
,,37,Chapter 37 Branch Circuit and Feeder Requirements,0,"ICC user notes:About this chapter: Chapter 37 addresses the sizing of conductors for feeders and branch circuits, specifies the required branch circuits, provides for overcurrent protection of such conductors, specifies limitations for branch circuit loading, and addresses panel board ratings and protection. Design and installation processes move directly from the service to feeders and branch circuits."
37,Chapter 37 Branch Circuit and Feeder Requirements,E3701,Section E3701 General,1,
37,Chapter 37 Branch Circuit and Feeder Requirements,E3701.1,E3701.1 Scope,2,"This chapter covers branch circuits and feeders and specifies the minimum required branch circuits, the allowable loads and the required overcurrent protection for branch circuits and feeders that serve less than 100 percent of the total dwelling unit load. Feeder circuits that serve 100 percent of the dwelling unit load shall be sized in accordance with the procedures in Chapter 36. [310.12(B)]"
37,Chapter 37 Branch Circuit and Feeder Requirements,E3701.2,E3701.2 Branch-Circuit and Feeder Ampacity,2,"Branch-circuit and feeder conductors shall have ampacities not less than the maximum load to be served. Where a branch circuit or a feeder supplies continuous loads or any combination of continuous and noncontinuous loads, the minimum branch-circuit or feeder conductor size shall not be less the larger of Section E3701.2.1 or E3701.2.2 and shall comply with Section E3705.4."
37,Chapter 37 Branch Circuit and Feeder Requirements,E3701.2.1,E3701.2.1 Continuous Load,3,"Where a branch circuit or feeder supplies continuous loads or any combination of continuous and noncontinuous loads, the minimum branch-circuit or feeder conductor size shall have an ampacity not less than the noncontinuous load plus 125 percent of the continuous load in accordance with Table E3705.1."
37,Chapter 37 Branch Circuit and Feeder Requirements,E3701.2.2,E3701.2.2 Ampacity Adjustment or Correction,3,"The minimum branch-circuit or feeder conductor size shall have an ampacity not less than the maximum load to be served after the application of any adjustment or correction factors in accordance with Tables E3705.1, E3705.2 and E3705.3. [210.19(A)(1) and (A)(2) and 215.2(A)(1) and (2)] Exception: The grounded conductors of feeders that are not connected to an overcurrent device shall be permitted to be sized at 100 percent of the continuous and noncontinuous load. [215.1(A)(1) Exception No. 3]"
37,Chapter 37 Branch Circuit and Feeder Requirements,E3701.3,E3701.3 Selection of Ampacity,2,"Where more than one calculated or tabulated ampacity could apply for a given circuit length, the lowest value shall be used. [310.14(A)(2)]Exception: Where different ampacities apply to portions of a circuit, the higher ampacity shall be permitted to be used where the total portion(s) of the circuit with the lower ampacity does not exceed the lesser of 10 feet (3048 mm) or 10 percent of the total circuit. [310.14(A)(2) Exception]"
37,Chapter 37 Branch Circuit and Feeder Requirements,E3701.4,E3701.4 Branch Circuits With More Than One Receptacle,2,Conductors of branch circuits supplying more than one receptacle for cord-and-plug-connected portable loads shall have ampacities of not less than the rating of the branch circuit. [210.19(B)]
37,Chapter 37 Branch Circuit and Feeder Requirements,E3701.5,E3701.5 Multiwire Branch Circuits,2,"All conductors for multiwire branch circuits shall originate from the equipment containing the branch-circuit overcurrent protective device or protective devices. A multiwire circuit shall be permitted to be considered as multiple circuits. Except where all ungrounded conductors are opened simultaneously by the branch-circuit overcurrent device, multiwire branch circuits shall supply only line-to-neutral loads or only one appliance. [210.4(A) and 210.4(C)]"
37,Chapter 37 Branch Circuit and Feeder Requirements,E3701.5.1,E3701.5.1 Disconnecting Means,3,Each multiwire branch circuit shall be provided with a means that will simultaneously disconnect all ungrounded conductors at the point where the branch circuit originates. [210.4(B)]
37,Chapter 37 Branch Circuit and Feeder Requirements,E3701.5.2,E3701.5.2 Grouping,3,"The ungrounded and grounded circuit conductors of each multiwire branch circuit shall be grouped by wire markers, cable ties or similar means in at least one location within the panelboard or other point of origination. [200.4(B) and 210.4(D)]Exception: Grouping shall not be required where the circuit conductors enter from a cable or raceway unique to the circuit, thereby making the grouping obvious, or where the conductors pass through a box or conduit body without a loop as described in Section E3905.12.2.1 or without a splice or termination. [200.4(B) Exceptions 1 and 2]"
37,Chapter 37 Branch Circuit and Feeder Requirements,E3702,Section E3702 Branch Circuit Ratings,1,
37,Chapter 37 Branch Circuit and Feeder Requirements,E3702.1,E3702.1 Branch-Circuit Voltage Limitations,2,"The voltage ratings of branch circuits that supply luminaires or receptacles for cord-and-plug-connected loads of up to 1,400 volt-amperes or of less than 1/4 horsepower (0.186 kW) shall be limited to a maximum rating of 120 volts, nominal, between conductors. Branch circuits that supply cord-and-plug-connected or permanently connected utilization equipment and appliances rated over 1,440 volt-amperes or 1/4 horsepower (0.186 kW) and greater shall be rated at 120 volts or 240 volts, nominal. [210.6(A), (B), and (C)]"
37,Chapter 37 Branch Circuit and Feeder Requirements,E3702.2,E3702.2 Branch-Circuit Ampere Rating,2,"Branch circuits shall be rated in accordance with the maximum allowable ampere rating or setting of the overcurrent protection device. The rating for other than individual branch circuits shall be 10, 15, 20, 30, 40 and 50 amperes. Where conductors of higher ampacity are used, the ampere rating or setting of the specified over-current device shall determine the circuit rating. (210.18)"
37,Chapter 37 Branch Circuit and Feeder Requirements,E3702.3,E3702.3 Ten-Ampere Branch Circuits,2,"A 10-ampere branch circuit shall comply with the following: A 10-ampere branch circuit shall be permitted to supply one or more of the following: lighting outlets, dwelling unit exhaust fans on bathroom or laundry room lighting circuits, and a gas fireplace unit supplied by an individual branch circuit.A 10-ampere branch circuit shall not supply receptacle outlets, fixed appliances except as permitted for individual branch circuits, garage door openers and laundry equipment. [210.23(A)(1) and (2)]"
37,Chapter 37 Branch Circuit and Feeder Requirements,E3702.4,E3702.4 Fifteen- And 20-Ampere Branch Circuits,2,"A 15- or 20-ampere branch circuit shall be permitted to supply lighting outlets, lighting units, or other utilization equipment, or any combination of them. The rating of any one cord-and-plug-connected utilization equipment not fastened in place shall not exceed 80 percent of the branch-circuit ampere rating. The total rating of utilization equipment fastened in place, other than luminaires, shall not exceed 50 percent of the branch-circuit ampere rating where lighting units, cord-and-plug-connected utilization equipment not fastened in place, or both, are also supplied. [210.23(B)(1) and (2)]"
37,Chapter 37 Branch Circuit and Feeder Requirements,E3702.5,E3702.5 Thirty-Ampere Branch Circuits,2,A 30-ampere branch circuit shall be permitted to supply fixed utilization equipment. A rating of any one cord-and-plug-connected utilization equipment shall not exceed 80 percent of the branch-circuit ampere rating. [210.23(C)]
37,Chapter 37 Branch Circuit and Feeder Requirements,E3702.6,E3702.6 Branch Circuits Serving Multiple Loads or Outlets,2,"General-purpose branch circuits shall supply lighting outlets, appliances, equipment or receptacle outlets, and combinations of such. Multioutlet branch circuits serving lighting or receptacles shall be limited to a maximum branch-circuit rating of 20 amperes. [210.23(B), (C) and (D)]"
37,Chapter 37 Branch Circuit and Feeder Requirements,E3702.7,E3702.7 Branch Circuits Serving a Single Motor,2,Branch-circuit conductors supplying a single motor shall have an ampacity not less than 125 percent of the motor full-load current rating. [430.22(A)]
37,Chapter 37 Branch Circuit and Feeder Requirements,E3702.8,E3702.8 Branch Circuits Serving Motor-Operated and Combination Loads,2,"For circuits supplying loads consisting of motor-operated utilization equipment that is fastened in place and that has a motor larger than 1/8 horsepower (0.093 kW) in combination with other loads, the total calculated load shall be based on 125 percent of the largest motor load plus the sum of the other loads. [220.11(A)]"
37,Chapter 37 Branch Circuit and Feeder Requirements,E3702.9,E3702.9 Branch-Circuit Inductive and LED Lighting Loads,2,"For circuits supplying luminaires having ballasts or LED drivers, the calculated load shall be based on the total ampere ratings of such units and not on the total watts of the lamps. [220.11(B)]"
37,Chapter 37 Branch Circuit and Feeder Requirements,E3702.10,E3702.10 Branch-Circuit Load for Ranges and Cooking Appliances,2,"It shall be permissible to calculate the branch-circuit load for one range in accordance with Table E3704.2(2). The branch-circuit load for one wall-mounted oven or one counter-mounted cooking unit shall be the nameplate rating of the appliance. The branch-circuit load for a counter-mounted cooking unit and not more than two wall-mounted ovens all supplied from a single branch circuit and located in the same room shall be calculated by adding the nameplate ratings of the individual appliances and treating the total as equivalent to one range. (220.55 Notes 4, 5 and 6)"
37,Chapter 37 Branch Circuit and Feeder Requirements,E3702.10.1,E3702.10.1 Minimum Branch Circuit for Ranges,3,Ranges with a rating of 8.75 kVA or more shall be supplied by a branch circuit having a minimum rating of 40 amperes. [210.19( C)]
37,Chapter 37 Branch Circuit and Feeder Requirements,E3702.11,E3702.11 Branch Circuits Serving Heating Loads,2,Branch circuits supplying space heating and water heating equipment shall be sized in accordance with the following: The branch circuit conductors and overcurrent protective device supplying fixed storage-type water heaters having a capacity of 120 gallons (450 L) or less shall have an ampere rating of not less than 125 percent of the water heater ampere rating. [422.13]The ampacity of branch circuit conductors supplying electric space-heating equipment and any associated motors shall be sized not less than 125 percent of the load of the fixed electric space-heating equipment and any associated motor(s). Branch circuits supplying two or more outlets for fixed electric space-heating equipment shall be rated not over 30 amperes. [424.3(A) and (B)]
37,Chapter 37 Branch Circuit and Feeder Requirements,E3702.12,E3702.12 Branch Circuits for Air-Conditioning and Heat Pump Equipment,2,The ampacity of the conductors supplying multimotor and combination load equipment shall be not less than the minimum circuit ampacity marked on the equipment. The branch-circuit overcurrent device rating shall be the size and type marked on the appliance. [440.4(B) and 440.35]
37,Chapter 37 Branch Circuit and Feeder Requirements,E3702.13,E3702.13 Branch Circuits Serving Room Air Conditioners,2,"A room air conditioner shall be considered as a single motor unit in determining its branch-circuit requirements where all the following conditions are met: It is cord- and attachment plug-connected. The rating is not more than 40 amperes and 250 volts; single phase. Total rated-load current is shown on the room air-conditioner nameplate rather than individual motor currents. The rating of the branch-circuit short-circuit and ground-fault protective device does not exceed the ampacity of the branch-circuit conductors, or the rating of the branch-circuit conductors, or the rating of the receptacle, whichever is less. [440.62(A)]"
37,Chapter 37 Branch Circuit and Feeder Requirements,E3702.13.1,E3702.13.1 Where No Other Loads Are Supplied,3,The total marked current rating of a cord- and attachment plug-connected room air conditioner shall not exceed 80 percent of the current rating of a branch circuit where no other appliances are also supplied. [440.62(B)]
37,Chapter 37 Branch Circuit and Feeder Requirements,E3702.13.2,E3702.13.2 Where Lighting Units or Other Appliances Are Also Supplied,3,"The total marked current rating of a cord- and attachment plug-connected room air conditioner shall not exceed 50 percent of the current rating of a branch circuit where lighting or other appliances are also supplied. Where the circuitry is interlocked to prevent simultaneous operation of the room air conditioner and energization of other outlets on the same branch circuit, a cord- and attachment plug-connected room air conditioner shall not exceed 80 percent of the branch-circuit current rating. [440.62(C)]"
37,Chapter 37 Branch Circuit and Feeder Requirements,E3702.14,E3702.14 Electric Vehicle Branch Circuit,2,Each outlet installed for the purpose of supplying electric vehicle supply equipment greater than 16 amperes or 120 volts shall be supplied by an individual branch circuit. Electric vehicle charging loads shall be considered to be continuous loads. [625.40 and 625.42]
37,Chapter 37 Branch Circuit and Feeder Requirements,E3702.15,E3702.15 Branch-Circuit Requirement—Summary,2,"The requirements for circuits having two or more outlets, or receptacles, other than the receptacle circuits of Sections E3703.2, E3703.3 and E3703.4, are summarized in Tables E3702.15(1) and E3702.15(2). Branch circuits in dwelling units shall supply only loads within that dwelling unit or loads associated only with that dwelling unit. Branch circuits installed for the purpose of lighting, central alarm, signal, communications or other purposes for public or common areas of a two-family dwelling shall not be supplied from equipment that supplies an individual dwelling unit. (210.24 and 210.25) TABLE E3702.15(1) [Table 210.24 (1)]BRANCH-CIRCUIT REQUIREMENTS—SUMMARYa, b CIRCUIT RATING 10 amp 15 amp 20 amp 30 amp Conductors: Minimum size (AWG) circuit conductors 14 14 12 10 Maximum overcurrent-protection device rating Ampere rating 10A 15A 20A 30A Outlet devices: Lampholders permitted Receptacle rating (amperes) Any typeNA Any type15A maximum Any type15 or 20 NA30A Maximum load (amperes) 10A 15A 20A 30A These gages are for copper conductors. NA = Not Allowed. TABLE E3702.15(2) [Table 210.24(2)]BRANCH-CIRCUIT REQUIREMENTS—SUMMARYa, b CIRCUIT RATING 10 amp 15 amp 20 amp 30 amp Conductors: Minimum size (AWG) circuit conductors 12 12 10 8 Maximum overcurrent-protection device rating Ampere rating 10A 15A 20A 30A Outlet devices: Lampholders permitted Receptacle rating (amperes) Any typeNA Any type15A maximum Any type15 or 20 NA30A Maximum load (amperes) 10A 15A 20A 30A 10A 15A 20A 30A These gages are for aluminum and copper-clad aluminum conductors. NA = Not Allowed."
37,Chapter 37 Branch Circuit and Feeder Requirements,E3703,Section E3703 Required Branch Circuits,1,
37,Chapter 37 Branch Circuit and Feeder Requirements,E3703.1,E3703.1 Branch Circuits for Central Heating,2,"Central heating equipment other than fixed electric space heating shall be supplied by an individual branch circuit. Permanently connected air-conditioning equipment, and auxiliary equipment directly associated with the central heating equipment such as pumps, motorized valves, humidifiers and electrostatic air cleaners, shall not be prohibited from connecting to the same branch circuit as the central heating equipment. (422.12 and 422.12 Exceptions No. 1 and No. 2)"
37,Chapter 37 Branch Circuit and Feeder Requirements,E3703.2,E3703.2 Kitchen and Dining Area Receptacles,2,A minimum of two 20-ampere-rated small-appliance branch circuits shall be provided for all receptacle outlets specified by Section E3901.3. [210.11(C)(1)]Exception: Additional receptacle outlets for specific appliances shall be permitted to be supplied from an individual branch circuit rated 15 amperes or greater. [210.52(B)(1) Exception No. 2]
37,Chapter 37 Branch Circuit and Feeder Requirements,E3703.3,E3703.3 Laundry Circuit,2,A minimum of one 20-ampere-rated branch circuit shall be provided for receptacle outlets required by Section E3901.8 and shall serve only receptacle outlets located in the laundry area. [210.11(C)(2)]
37,Chapter 37 Branch Circuit and Feeder Requirements,E3703.4,E3703.4 Bathroom Branch Circuits,2,"A minimum of one 20-ampere branch circuit shall be provided to supply bathroom receptacle outlet(s) required by Section E3901.6 and any countertop or similar work surface receptacle outlets. Such circuits shall have no other outlets. [210.11(C)(3)]Exception: Where the 20-ampere circuit supplies a single bathroom, outlets for other equipment within the same bathroom shall be permitted to be supplied in accordance with Section E3702. [210.11(C)(3) Exception]"
37,Chapter 37 Branch Circuit and Feeder Requirements,E3703.5,E3703.5 Garage Branch Circuits,2,"In addition to the number of branch circuits required by other parts of this section, not less than one 120-volt, 20-ampere branch circuit shall be installed to supply receptacle outlets required by Section E3901.9 in attached garages and in detached garages with electric power. This circuit shall not have other outlets. Exceptions: This circuit shall be permitted to supply outdoor receptacle outlets. If the 20-ampere circuit supplies a single vehicle bay garage, outlets for other equipment within the same garage shall be permitted to be supplied in accordance with Section E3702.4."
37,Chapter 37 Branch Circuit and Feeder Requirements,E3703.6,E3703.6 Number of Branch Circuits,2,"The minimum number of branch circuits shall be determined from the total calculated load and the size or rating of the circuits used. The number of circuits shall be sufficient to supply the load served. In no case shall the load on any circuit exceed the maximum specified by Sections E3702.8, E3702.9 and E3702.10. [210.11(A)]"
37,Chapter 37 Branch Circuit and Feeder Requirements,E3703.7,E3703.7 Branch-Circuit Load Proportioning,2,"Where the branch-circuit load is calculated on a volt-amperes-per-square-foot (m2) basis, the wiring system, up to and including the branch-circuit panelboard(s), shall have the capacity to serve not less than the calculated load. This load shall be evenly proportioned among multioutlet branch circuits within the panelboard(s). Branch-circuit overcurrent devices and circuits shall only be required to be installed to serve the connected load. [210.11(B)]"
37,Chapter 37 Branch Circuit and Feeder Requirements,E3704,Section E3704 Feeder Requirements,1,
37,Chapter 37 Branch Circuit and Feeder Requirements,E3704.1,E3704.1 Conductor Size,2,Feeder conductors that do not serve 100 percent of the dwelling unit load and branch-circuit conductors shall be of a size sufficient to carry the load as determined by this chapter. Feeder conductors shall not be required to be larger than the service-entrance conductors that supply the dwelling unit. The load for feeder conductors that serve as the main power feeder to a dwelling unit shall be determined as specified in Chapter 36 for services. [310.12(B) and (C)]
37,Chapter 37 Branch Circuit and Feeder Requirements,E3704.2,E3704.2 Feeder Loads,2,"The minimum load in volt-amperes shall be calculated in accordance with the load calculation procedure prescribed in Table E3704.2(1). The associated table demand factors shall be applied to the actual load to determine the minimum load for feeders. (220.40)TABLE E3704.2(1) [220.14(J), Table 220.42, 220.50, 220.51, 220.52, 220.53, 220.54, 220.55, 220.57, and 220.60] FEEDER LOAD CALCULATION LOAD CALCULATION PROCEDURE APPLIED DEMAND FACTOR Lighting and receptacles: A unit load of not less than 3 VA per square foot of total floor area shall constitute the lighting and 120-volt, 15- and 20-ampere general use receptacle load. 1,500 VA shall be added for each 20-ampere branch circuit serving receptacles in the kitchen, dining room, pantry, breakfast area and laundry area. 100 percent of first 3,000 VA or less and 35 percent of that in excess of 3,000 VA. Plus Appliances and motors: The nameplate rating load of all fastened-in-place appliances 1/4 horsepower or greater, or 500 watts or greater, that are fastened in place, other than dryers, ranges, air-conditioning and space-heating equipment, and electric vehicle supply equipment (EVSE). 100 percent of load for three or less appliances. 75 percent of load for four or more appliances. Plus Fixed motors: Full-load current of motors plus 25 percent of the full load current of the largest motor. Plus Electric clothes dryer: The dryer load shall be 5,000 VA for each dryer circuit or the nameplate rating load of each dryer, whichever is greater. Plus Cooking appliances: The nameplate rating of ranges, wall-mounted ovens, counter-mounted cooking units and other cooking appliances rated in excess of 1.75 kVA shall be summed. Demand factors shall be as allowed by Table E3704.2(2). Plus The electric vehicle supply equipment (EVSE) load shall be 7,200 watts (volt-amperes) or the nameplate rating of the equipment, whichever is greater. Plus the largest of either the heating or cooling load Largest of the following two selections: 100 percent of the nameplate rating(s) of the air conditioning and cooling, including heat pump compressors.100 percent of the fixed electric space heating. For SI: 1 square foot = 0.0929 m2.TABLE E3704.2(2) (220.55 and Table 220.55) DEMAND LOADS FOR ELECTRIC RANGES, WALL-MOUNTED OVENS, COUNTER-MOUNTED COOKING UNITS AND OTHER COOKING APPLIANCES OVER 13/4 kVA RATINGa, b NUMBER OF APPLIANCES MAXIMUM DEMANDb, c DEMAND FACTORS (percent)d Column A maximum 12 kVA rating Column B less than 31/2 kVA rating Column C 31/2 to 83/4 kVA rating 1 8 kVA 80 80 2 11 kVA 75 65 Column A shall be used in all cases except as provided for in Note d.For ranges all having the same rating and individually rated more than 12 kVA but not more than 27 kVA, the maximum demand in Column A shall be increased 5 percent for each additional kVA of rating or major fraction thereof by which the rating of individual ranges exceeds 12 kVA.For ranges of unequal ratings and individually rated more than 8.75 kVA, but none exceeding 27 kVA, an average value of rating shall be computed by adding together the ratings of all ranges to obtain the total connected load (using 12 kVA for any ranges rated less than 12 kVA) and dividing by the total number of ranges; and then the maximum demand in Column A shall be increased 5 percent for each kVA or major fraction thereof by which this average value exceeds 12 kVA.Over 1.75 kVA through 8.75 kVA. As an alternative to the method provided in Column A, the nameplate ratings of all ranges rated more than 1.75 kVA but not more than 8.75 kVA shall be added and the sum shall be multiplied by the demand factor specified in Column B or C for the given number of appliances."
37,Chapter 37 Branch Circuit and Feeder Requirements,E3704.3,E3704.3 Feeder Neutral Load,2,"The feeder neutral load shall be the maximum unbalance of the load determined in accordance with this chapter. The maximum unbalanced load shall be the maximum net calculated load between the neutral and any one ungrounded conductor. For a feeder or service supplying electric ranges, wall-mounted ovens, counter-mounted cooking units and electric dryers, the maximum unbalanced load shall be considered as 70 percent of the load on the ungrounded conductors. [220.61(A) and (B)]"
37,Chapter 37 Branch Circuit and Feeder Requirements,E3704.4,E3704.4 Lighting and General Use Receptacle Load,2,A load of not less than 3 volt-amperes shall constitute the minimum unit load for each square foot of floor area (33 VA for each square meter of floor area). The floor area for each floor shall be calculated from the outside dimensions of the building. The calculated floor area shall not include open porches or unfinished spaces not adaptable for future use as a habitable room or occupiable space. The minimum lighting load shall be determined using the minimum unit load and floor area as specified in this section. Motors rated less than 1/8 horsepower and connected to a lighting circuit shall be considered part of the minimum lighting load. [220.5(C) and 220.41]
37,Chapter 37 Branch Circuit and Feeder Requirements,E3704.5,E3704.5 Ampacity and Calculated Loads,2,"The calculated load of a feeder shall be not less than the sum of the loads on the branch circuits supplied, as determined by Section E3704, after any applicable demand factors permitted by Section E3704 have been applied. (220.40)"
37,Chapter 37 Branch Circuit and Feeder Requirements,E3704.6,E3704.6 Equipment Grounding Conductor,2,"Where a feeder supplies branch circuits in which equipment grounding conductors are required, the feeder shall include or provide an equipment grounding conductor that is one or more or a combination of the types specified in Section E3908.9, to which the equipment grounding conductors of the branch circuits shall be connected. Where the feeder supplies a separate building or structure, the requirements of Section E3607.3.1 shall apply. (215.6)"
37,Chapter 37 Branch Circuit and Feeder Requirements,E3705,Section E3705 Conductor Sizing and Overcurrent Protection,1,
