id,section,reference,title,depth,body
36,Chapter 36 Services,E3605.9,E3605.9 Overhead Service Locations,2,Connections at service heads shall be in accordance with Sections E3605.9.1 through E3605.9.7. (230.54)
36,Chapter 36 Services,E3605.9.1,E3605.9.1 Service Head,3,Service raceways shall be equipped with a service head at the point of connection to service-drop or overhead conductors. The service head shall be listed for use in wet locations. [230.54(A)]
36,Chapter 36 Services,E3605.9.2,"E3605.9.2 Service Cable, Service Head or Gooseneck",3,Service-entrance cable shall be equipped with a service head or shall be formed into a gooseneck in an approved manner. The service head shall be listed for use in wet locations. [230.54(B)]
36,Chapter 36 Services,E3605.9.3,E3605.9.3 Service-Head Location,3,"Service heads on raceways or service-entrance cables, and goosenecks in service-entrance cables, shall be located above the point of attachment of the service-drop or overhead service conductors to the building or other structure. [230.54(C)]Exception: Where it is impracticable to locate the service head or gooseneck above the point of attachment, the service head or gooseneck location shall be not more than 24 inches (610 mm) from the point of attachment. [230.54(C) Exception]"
36,Chapter 36 Services,E3605.9.4,E3605.9.4 Separately Bushed Openings,3,Service heads shall have conductors of different potential brought out through separately bushed openings. [230.54(E)]
36,Chapter 36 Services,E3605.9.5,E3605.9.5 Drip Loops,3,"Drip loops shall be formed on individual conductors. To prevent the entrance of moisture, service-entrance conductors shall be connected to the service-drop or overhead conductors either below the level of the service head or below the level of the termination of the service-entrance cable sheath. [230.54(F)]"
36,Chapter 36 Services,E3605.9.6,E3605.9.6 Conductor Arrangement,3,Service-entrance and overhead service conductors shall be arranged so that water will not enter service raceways or equipment. [230.54(G)]
36,Chapter 36 Services,E3605.9.7,E3605.9.7 Secured,3,Service-entrance cables shall be held securely in place. [230.54(D)]
36,Chapter 36 Services,E3606,Section E3606 Service Equipment—General,1,
36,Chapter 36 Services,E3606.1,E3606.1 Service Equipment Enclosures,2,Energized parts of service equipment shall be enclosed. (230.62)
36,Chapter 36 Services,E3606.2,E3606.2 Working Space,2,The working space in the vicinity of service equipment shall be not less than that specified in Chapter 34. (110.26)
36,Chapter 36 Services,E3606.3,E3606.3 Available Short-Circuit Current,2,"Service equipment shall be suitable for the maximum fault current available at its supply terminals, but not less than 10,000 amperes. (110.9)"
36,Chapter 36 Services,E3606.4,E3606.4 Marking,2,Service equipment shall be marked to identify it as being suitable for use as service equipment. Service equipment shall be listed or field labeled. Individual meter socket enclosures shall not be considered as service equipment but shall be listed and rated for the voltage and ampacity of the service. [230.66 (A) &amp; (B)]Exception: Meter sockets supplied by and under the exclusive control of an electric utility shall not be required to be listed. (230.66 Exception)
36,Chapter 36 Services,E3606.5,E3606.5 Surge Protection,2,All services supplying one- and two-family dwelling units shall be provided with a surge-protective device (SPD) installed in accordance with Sections E3606.5.1 through E3606.5.3.
36,Chapter 36 Services,E3606.5.1,E3606.5.1 Location,3,The SPD shall be an integral part of the service equipment or shall be located immediately adjacent thereto. Exception: The SPD shall not be required to be located in the service equipment if located at each next-level distribution equipment downstream toward the load.
36,Chapter 36 Services,E3606.5.2,E3606.5.2 Type,3,The SPD shall be a Type 1 or Type 2 SPD.
36,Chapter 36 Services,E3606.5.3,E3606.5.3 Replacement,3,"Where service equipment is replaced, all of the requirements of this section shall apply. [230.67]"
36,Chapter 36 Services,E3606.5.4,E3606.5.4 Ratings,3,SPDs shall have a nominal discharge current rating (In) of not less than 10 kA. [230.67]
36,Chapter 36 Services,E3607,Section E3607 System Grounding,1,
36,Chapter 36 Services,E3607.1,E3607.1 System Service Ground,2,The premises wiring system shall be grounded at the service with a grounding electrode conductor connected to a grounding electrode system as required by this code. Grounding electrode conductors shall be sized in accordance with Table E3603.4. [250.20(B)(1) and 250.24(A)]
36,Chapter 36 Services,E3607.2,E3607.2 Location of Grounding Electrode Conductor Connection,2,"The grounding electrode conductor shall be connected to the grounded service conductor at any accessible point from the load end of the overhead service conductors, service drop, underground service conductors, or service lateral to and including the terminal or bus to which the grounded service conductor is connected at the service disconnecting means. A grounded conductor shall not be connected to metal parts of equipment that normally do not carry current or to equipment grounding conductors, or be reconnected to ground on the load side of the service disconnecting means, except as provided in Section E3607.3.2. [250.24(A)(1) and 250.24(B)]"
36,Chapter 36 Services,E3607.3,E3607.3 Buildings or Structures Supplied by Feeder(s) or Branch Circuit(s),2,"A building or structure supplied by a feeder(s) or branch circuit(s) shall have a grounding electrode system and grounding electrode conductor installed in accordance with Section E3608. Where there is no existing grounding electrode, the grounding electrode(s) required in Section E3608 shall be installed. [250.32(A)]Exception: A grounding electrode system and grounding electrode conductor shall not be required if only a single branch circuit, including a multiwire branch circuit, supplies the building or structure and the branch circuit includes an equipment grounding conductor for grounding the noncurrent-carrying parts of equipment."
36,Chapter 36 Services,E3607.3.1,E3607.3.1 Equipment Grounding Conductor,3,"An equipment grounding conductor as described in Section E3908 shall be run with the supply conductors and connected to the building or structure disconnecting means and to the grounding electrode(s). The equipment grounding conductor shall be used for grounding or bonding of equipment, structures or frames required to be grounded or bonded. The equipment grounding conductor shall be sized in accordance with Section E3908.13. Any installed grounded conductor shall not be connected to the equipment grounding conductor or to the grounding electrode(s). [250.32(B) and Table 250.122]"
36,Chapter 36 Services,E3607.3.2,"E3607.3.2 Grounded Conductor, Existing Premises",3,"For installations made in compliance with previous editions of this code that permitted such connection and where an equipment grounding conductor is not run with the supply conductors to the building or structure, there are no continuous metallic paths bonded to the grounding system in both buildings or structures involved, and ground-fault protection of equipment has not been installed on the supply side of the feeder(s), the grounded conductor run with the supply to the buildings or structure shall be connected to the building or structure disconnecting means and to the grounding electrode(s) and shall be used for grounding or bonding of equipment, structures, or frames required to be grounded or bonded. Where used for grounding in accordance with this provision, the grounded conductor shall be not smaller than the larger of:That required by Section E3704.3.That required by Section E3908.13. [250.32(B)(1) Exception]"
36,Chapter 36 Services,E3607.4,E3607.4 Grounding Electrode Conductor,2,"A grounding electrode conductor shall be used to connect the equipment grounding conductors, the service equipment enclosures, and the grounded service conductor to the grounding electrode(s). This conductor shall be sized in accordance with Table E3603.4. [250.24(E)]"
36,Chapter 36 Services,E3607.5,E3607.5 Main Bonding Jumper,2,An unspliced main bonding jumper shall be used to connect the equipment grounding conductor(s) and the service-disconnect enclosure to the grounded conductor of the system within the enclosure for each service disconnect. [250.24(C)]
36,Chapter 36 Services,E3607.6,E3607.6 Common Grounding Electrode,2,"If an AC system is connected to a grounding electrode in or at a building or structure, the same electrode shall be used to ground conductor enclosures and equipment in or on that building or structure. If separate services, feeders or branch circuits supply a building and are required to be connected to a grounding electrode(s), the same grounding electrode(s) shall be used. (250.58)"
36,Chapter 36 Services,E3608,Section E3608 Grounding Electrode System,1,
36,Chapter 36 Services,E3608.1,E3608.1 Grounding Electrode System,2,"All electrodes specified in Sections E3608.1.1, E3608.1.2, E3608.1.3, E3608.1.4 E3608.1.5 and E3608.1.6 that are present at each building or structure served shall be bonded together to form the grounding electrode system. If none of these electrodes are present, one or more of the electrodes specified in Sections E3608.1.3, E3608.1.4, E3608.1.5 and E3608.1.6 shall be installed and used. (250.50)Exception: Concrete-encased electrodes of existing buildings or structures shall not be required to be part of the grounding electrode system if the steel reinforcing bars or rods are not accessible for use without disturbing the concrete. (250.50 Exception)"
36,Chapter 36 Services,E3608.1.1,E3608.1.1 Metal Underground Water Pipe,3,"A metal underground water pipe that is in direct contact with the earth for 10 feet (3048 mm) or more, including any well casing effectively bonded to the pipe and that is electrically continuous, or made electrically continuous by bonding around insulating joints or insulating pipe to the points of connection of the grounding electrode conductor and the bonding conductors, shall be considered as a grounding electrode (see Section E3608.1). [250.52(A)(1)]"
36,Chapter 36 Services,E3608.1.1.1,E3608.1.1.1 Interior Metal Water Piping,4,"Interior metal water piping located more than 5 feet (1524 mm) from the point of entrance into the building, as measured along the piping, shall not be used as a conductor to interconnect electrodes of the grounding electrode system. [250.68(C)(1)]"
36,Chapter 36 Services,E3608.1.1.2,E3608.1.1.2 Installation,4,"Continuity of the grounding path or the bonding connection to interior piping shall not rely on water meters, filtering devices and similar equipment. A metal underground water pipe shall be supplemented by an additional electrode of a type specified in Sections E3608.1.2 through E3608.1.6. The supplemental electrode shall be bonded to the grounding electrode conductor, the grounded service-entrance conductor, a nonflexible grounded service raceway, any grounded service enclosure or to the equipment grounding conductor provided in accordance with Section E3607.3.1. Where the supplemental electrode is a rod, pipe or plate electrode in accordance with Section E3608.1.4 or E3608.1.5, it shall comply with Section E3608.4.Where the supplemental electrode is a rod, pipe or plate electrode in accordance with Section E3608.1.4 or E3608.1.5, that portion of the bonding jumper that is the sole connection to the supplemental grounding electrode shall not be required to be larger than 6 AWG copper or 4 AWG aluminum wire. [250.53(D) and (E)]"
36,Chapter 36 Services,E3608.1.2,E3608.1.2 Concrete-Encased Electrode,3,"A concrete-encased electrode consisting of not less than 20 feet (6096 mm) of either of the following shall be considered as a grounding electrode:One or more bare or zinc-galvanized or other electrically conductive coated rebar not less than 1/2 inch (13 mm) in diameter, installed in one continuous 20-foot (6096 mm) length, or if in multiple pieces connected together by the usual steel tie wires, exothermic welding, welding, or other effective means to create a 20-foot (6096 mm) or greater length.A bare copper conductor not smaller than 4 AWG.Metal components shall be encased by at least 2 inches (51 mm) of concrete and shall be located horizontally within that portion of a concrete foundation or footing that is in direct contact with the earth or within vertical foundations or structural components or members that are in direct contact with the earth.If multiple concrete-encased electrodes are present at a building or structure, only one shall be required to be bonded into the grounding electrode system. [250.52(A)(3)]"
36,Chapter 36 Services,E3608.1.3,E3608.1.3 Ground Rings,3,"A ground ring encircling the building or structure, in direct contact with the earth at a depth below the earth's surface of not less than 30 inches (762 mm), consisting of at least 20 feet (6096 mm) of bare copper conductor not smaller than 2 AWG shall be considered as a grounding electrode. [250.52(A)(4)]"
36,Chapter 36 Services,E3608.1.4,E3608.1.4 Rod and Pipe Electrodes,3,"Rod and pipe electrodes not less than 8 feet (2438 mm) in length and consisting of the following materials shall be considered as a grounding electrode:Grounding electrodes of pipe or conduit shall not be smaller than trade size 3/4 (metric designator 21) and, where of iron or steel, shall have the outer surface galvanized or otherwise metal-coated for corrosion protection.Rod-type grounding electrodes of stainless steel and copper or zinc-coated steel shall be at least 5/8 inch (15.9 mm) in diameter unless listed. [250.52(A)(5)]"
36,Chapter 36 Services,E3608.1.4.1,E3608.1.4.1 Installation,4,"The rod and pipe electrodes shall be installed such that at least 8 feet (2438 mm) of length is in contact with the soil. They shall be driven to a depth of not less than 8 feet (2438 mm) except that, where rock bottom is encountered, electrodes shall be driven at an oblique angle not to exceed 45 degrees (0.79 rad) from the vertical or shall be buried in a trench that is at least 30 inches (762 mm) deep. The upper end of the electrodes shall be flush with or below ground level except where the above-ground end and the grounding electrode conductor attachment are protected against physical damage. [250.53(A)(4)]"
36,Chapter 36 Services,E3608.1.5,E3608.1.5 Plate Electrodes,3,"A plate electrode that exposes not less than 2 square feet (0.186 m2) of surface to exterior soil shall be considered as a grounding electrode. Electrodes of bare or electrically conductive coated iron or steel plates shall be not less than 1/4 inch (6.4 mm) in thickness. Solid, uncoated electrodes of nonferrous metal shall be not less than 0.06 inch (1.5 mm) in thickness. Plate electrodes shall be installed not less than 30 inches (762 mm) below the surface of the earth. [250.52(A)(7) and 250.53(A)(5)]"
36,Chapter 36 Services,E3608.1.6,E3608.1.6 Other Electrodes,3,"In addition to the grounding electrodes specified in Sections E3608.1.1 through E3608.1.5, other listed grounding electrodes shall be permitted. [250.52(A)(6)]"
36,Chapter 36 Services,E3608.2,E3608.2 Bonding Jumper,2,"The bonding jumper(s) used to connect the grounding electrodes together to form the grounding electrode system shall be installed in accordance with Sections E3610.2 and E3610.3, shall be sized in accordance with Section E3603.4, and shall be connected in the manner specified in Section E3611.1. Rebar shall not be used as a conductor to interconnect the electrodes of grounding electrode systems. [250.53(C)]"
36,Chapter 36 Services,E3608.3,"E3608.3 Rod, Pipe and Plate Electrode Requirements",2,"Where practicable, rod, pipe and plate electrodes shall be embedded below permanent moisture level. Such electrodes shall be free from nonconductive coatings such as paint or enamel. Where more than one such electrode is used, each electrode of one grounding system shall be not less than 6 feet (1829 mm) from any other electrode of another grounding system. That portion of a bonding jumper that is the sole connection to a rod, pipe or plate electrode shall not be required to be larger than 6 AWG copper or 4 AWG aluminum wire. [250.53(A)(1), 250.53(B), 250.53(E)]"
36,Chapter 36 Services,E3608.4,E3608.4 Supplemental Electrode Required,2,"A single rod, pipe or plate electrode shall be supplemented by an additional electrode of a type specified in Sections E3608.1.2 through E3608.1.6. The supplemental electrode shall be bonded to one of the following:A rod, pipe or plate electrode.A grounding electrode conductor.A grounded service-entrance conductor.A nonflexible grounded service raceway.A grounded service enclosure.Where multiple rod, pipe or plate electrodes are installed to meet the requirements of this section, they shall be not less than 6 feet (1829 mm) apart. [250.53(A)(2) and (A)(3)]Exception: Where a single rod, pipe or plate grounding electrode has a resistance to earth of 25 ohms or less, the supplemental electrode shall not be required. [250.53(A)(2) Exception]"
36,Chapter 36 Services,E3608.5,E3608.5 Aluminum Electrodes,2,Aluminum electrodes shall not be permitted. [250.52(B)(2)]
36,Chapter 36 Services,E3608.6,E3608.6 Metal Underground Gas Piping System,2,A metal underground gas piping system shall not be used as a grounding electrode. [250.52(B)(1)]
36,Chapter 36 Services,E3608.7,"E3608.7 Pool, Spa and Hot Tub Structures and Structural Reinforcing Steel",2,"The structures and structural reinforcing steel described in Section E4204.2, Items 1 and 2, shall not be used as a grounding electrode. [250.52 (B)(3)]"
36,Chapter 36 Services,E3609,Section E3609 Bonding,1,
36,Chapter 36 Services,E3609.1,E3609.1 General,2,Bonding shall be provided where necessary to ensure electrical continuity and the capacity to conduct safely any fault current likely to be imposed. (250.90)
36,Chapter 36 Services,E3609.2,E3609.2 Bonding of Equipment for Services,2,"The noncurrent-carrying metal parts of the following equipment shall be effectively bonded together:Raceways or service cable armor or sheath that enclose, contain, or support service conductors.Service enclosures containing service conductors, including meter fittings, and boxes, interposed in the service raceway or armor. [250.92(A)]"
36,Chapter 36 Services,E3609.3,E3609.3 Bonding for Communications Systems,2,Communications system bonding terminations shall be connected in accordance with Section E3609.3.1 or E3609.3.2. (250.94)
36,Chapter 36 Services,E3609.3.1,E3609.3.1 Intersystem Bonding Termination Device,3,"An intersystem bonding termination (IBT) for connecting intersystem bonding conductors shall be provided external to enclosures at the service equipment or metering equipment enclosure and at the disconnecting means for any additional buildings or structures. An IBT shall comply with all of the following:It shall be accessible for connection and inspection.It shall consist of a set of terminals with the capacity for connection of not less than three intersystem bonding conductors.It shall not interfere with opening of the enclosure for a service, building or structure disconnecting means, or metering equipment.Where located at the service equipment, it shall be securely mounted and electrically connected to an enclosure for the service equipment, to the meter enclosure, or to an exposed nonflexible metallic service raceway, or shall be mounted at one of these enclosures and connected to the enclosure or to the grounding electrode conductor with a 6 AWG or larger copper conductor.Where located at the disconnecting means for a building or structure, it shall be securely mounted and electrically connected to the metallic enclosure for the building or structure disconnecting means, or shall be mounted at the disconnecting means and connected to the metallic enclosure or to the grounding electrode conductor with a 6 AWG or larger copper conductor.It shall be listed as grounding and bonding equipment. [250.94(A)]Exception: Means for connecting intersystem bonding conductors are not required where communications systems are not likely to be used."
36,Chapter 36 Services,E3609.3.2,E3609.3.2 Other Means,3,"An aluminum or copper busbar not less than 1/4 inch thick by 2 inches wide (6.4 mm by 51 mm) and of sufficient length to accommodate not fewer than three terminations for communications systems in addition to other connections shall be provided. The busbar shall be securely fastened and shall be installed in an accessible location. Connections shall be made by a listed connector. Where aluminum busbars are used, the installation shall comply with Section E3610.2.Exception: Means for connecting intersystem bonding conductors are not required where communications systems are not likely to be used. [250.94(B)]"
36,Chapter 36 Services,E3609.4,E3609.4 Method of Bonding at the Service,2,"Bonding jumpers meeting the requirements of this chapter shall be used around impaired connections, such as reducing washers or oversized, concentric, or eccentric knockouts. Standard locknuts or bushings shall not be the only means for the bonding required by this section but shall be permitted to be installed to make mechanical connections of raceways. Electrical continuity at service equipment, service raceways and service conductor enclosures shall be ensured by one or more of the methods specified in Sections E3609.4.1 through E3609.4.4."
36,Chapter 36 Services,E3609.4.1,E3609.4.1 Grounded Service Conductor,3,Equipment shall be bonded to the grounded service conductor by an applicable method in accordance with Section E3406.14.
36,Chapter 36 Services,E3609.4.2,E3609.4.2 Threaded Connections,3,"Equipment shall be bonded by connections using threaded couplings, threaded entries or listed threaded hubs on enclosures. Such connections shall be made wrench tight."
36,Chapter 36 Services,E3609.4.3,E3609.4.3 Threadless Couplings and Connectors,3,Equipment shall be bonded by threadless couplings and connectors for metal raceways and metal-clad cables. Such couplings and connectors shall be made tight.
36,Chapter 36 Services,E3609.4.4,E3609.4.4 Other Devices,3,"Equipment shall be bonded by other listed devices, such as bonding-type locknuts, bushings and bushings with bonding jumpers. [250.92(B)]"
36,Chapter 36 Services,E3609.5,E3609.5 Sizing Supply-Side Bonding Jumper and Main Bonding Jumper,2,"The bonding jumper shall not be smaller than the sizes shown in Table E3603.4 for grounding electrode conductors. If the service-entrance conductors are paralleled in two or more raceways or cables, and an individual supply-side bonding jumper is used for bonding these raceways or cables, the supply-side bonding jumper for each raceway or cable shall be selected from Table E3603.4 based on the size of the ungrounded supply conductors in each raceway or cable. A single supply-side bonding jumper installed for bonding two or more raceways or cables shall be sized in accordance with Table E3603.4 based on the sum of the circular mil areas of the largest ungrounded conductors from each set connected in parallel in each raceway or cable. The size of the grounded conductor(s) in each raceway or cable shall be based on the largest ungrounded conductor in each raceway or cable, or the sum of the circular mil areas of the largest ungrounded conductors from each set connected in parallel in each raceway or cable. [250.102(C)]"
36,Chapter 36 Services,E3609.6,E3609.6 Metal Water Piping Bonding,2,"The metal water piping system shall be bonded to the service equipment enclosure, the grounded conductor at the service, the grounding electrode conductor where of sufficient size, or to the one or more grounding electrodes used if the grounding electrode conductor or bonding jumper to the grounding electrode is of sufficient size. The bonding jumper shall be sized in accordance with Table E3603.4. The points of attachment of the bonding jumper(s) shall be accessible. [250.104(A) and 250.104(A)(1)]"
36,Chapter 36 Services,E3609.7,E3609.7 Bonding Other Metal Piping,2,"Where installed in or attached to a building or structure, metal piping systems, including gas piping, capable of becoming energized shall be bonded to the service equipment enclosure, the grounded conductor at the service, the grounding electrode conductor where of sufficient size, or to the one or more grounding electrodes used. The bonding conductor(s) or jumper(s) shall be sized in accordance with Table E3908.13 and equipment grounding conductors shall be sized in accordance with Table E3908.13 using the rating of the circuit capable of energizing the piping. The equipment grounding conductor for the circuit that is capable of energizing the piping shall be permitted to serve as the bonding means. The points of attachment of the bonding jumper(s) shall be accessible. [250.104(B)]"
36,Chapter 36 Services,E3610,Section E3610 Grounding Electrode Conductors,1,
36,Chapter 36 Services,E3610.1,E3610.1 Continuous,2,"The grounding electrode conductor shall be installed in one continuous length without splices or joints and shall run to any convenient grounding electrode available in the grounding electrode system where the other electrode(s), if any, are connected by bonding jumpers in accordance with Section E3608.2, or to one or more grounding electrode(s) individually. The grounding electrode conductor shall be sized based on the largest grounding electrode conductor required among all of the electrodes connected to it. If necessary, splicing of the grounding electrode conductor by irreversible compression-type connectors listed as grounding and bonding equipment or by the exothermic welding process shall not be prohibited. [250.64(C) and 250.64(C)(1)]"
