id,section,reference,title,depth,body
36,Chapter 36 Services,E3610.2,E3610.2 Securing and Protection Against Physical Damage,2,"Where exposed, a grounding electrode conductor or its enclosure shall be securely fastened to the surface on which it is carried. Grounding electrode conductors shall be permitted to be installed on or through framing members. A 6 AWG or larger copper or aluminum grounding electrode conductor not exposed to physical damage shall be permitted to be run along the surface of the building construction without metal covering or protection. A 6 AWG or larger copper or aluminum grounding electrode exposed to physical damage shall be in rigid metal conduit, intermediate metal conduit, rigid polyvinyl chloride (PVC), nonmetallic conduit, reinforced thermosetting resin (RTRC-XW) nonmetallic conduit, electrical metallic tubing or cable armor. Grounding electrode conductors smaller than 6 AWG shall be in rigid metal conduit, intermediate metal conduit, rigid polyvinyl chloride (PVC) nonmetallic conduit, reinforced thermosetting resin (RTRC-XW) nonmetallic conduit, electrical metallic tubing or cable armor. Grounding electrode conductors and grounding electrode bonding jumpers in contact with the earth shall not be required to comply with Section E3803, but shall be buried or otherwise protected if subject to physical damage. [250.64(B)]Bare aluminum or copper-clad aluminum grounding electrode conductors shall comply with the following: Bare or covered conductors without an extruded polymeric covering shall not be installed where subject to corrosive conditions or be installed in direct contact with concrete.Terminations made within outdoor enclosures that are listed and identified for the environment shall be permitted within 18 inches (457 mm) of the bottom of the enclosure.Aluminum or copper-clad aluminum conductors external to buildings or equipment enclosures shall not be terminated within 18 inches (457 mm) of the earth. [250.64(A)]"
36,Chapter 36 Services,E3610.3,E3610.3 Raceways and Enclosures for Grounding Electrode Conductors,2,"Ferrous metal raceways, enclosures and cable armor for grounding electrode conductors shall be electrically continuous from the point of attachment to cabinets or equipment to the grounding electrode, and shall be securely fastened to the ground clamp or fitting. Ferrous metal raceways, enclosures and cable armor shall be bonded at each end of the raceway or enclosure to the grounding electrode or to the grounding electrode conductor to create an electrically parallel path. Nonferrous metal raceways, enclosures and cable armor shall not be required to be electrically continuous. Bonding methods in compliance with Section E3609.4 for installations at service equipment locations and with Sections E3609.4.2 through E3609.4.4 for other than service equipment locations shall apply at each end and to all intervening ferrous raceways, boxes, and enclosures between the cabinets or equipment and the grounding electrode. The bonding jumper for a grounding electrode conductor(s), raceway(s), enclosure(s) or cable armor shall be the same size or larger than the largest enclosed grounding electrode conductor.Where a raceway is used as protection for a grounding conductor, the installation shall comply with the requirements of Chapter 38. [250.64(E)(1), (2), (3), (4)]"
36,Chapter 36 Services,E3610.4,E3610.4 Prohibited Use,2,"An equipment grounding conductor shall not be used as a grounding electrode conductor. (250.118(B))Exception: A wire-type equipment grounding conductor shall be permitted to serve as both an equipment grounding conductor and a grounding electrode conductor where installed in accordance with the applicable requirements for both the equipment grounding conductor and the grounding electrode conductor in Chapters 36 and 39. Where used as a grounding electrode conductor, the wire-type equipment grounding conductor shall be installed and arranged in a manner that will prevent objectionable current. [250.118(B)(1) Exception and 250.6(A)]"
36,Chapter 36 Services,E3611,Section E3611 Grounding Electrode Conductor Connection to the Grounding Electrodes,1,
36,Chapter 36 Services,E3611.1,E3611.1 Methods of Grounding Conductor Connection to Electrodes,2,"The grounding or bonding conductor shall be connected to the grounding electrode by exothermic welding, listed lugs, listed pressure connectors, listed clamps or other listed means. Connections depending on solder shall not be used. Ground clamps shall be listed for the materials of the grounding electrode and the grounding electrode conductor and, if used on pipe, rod or other buried electrodes, shall also be listed for direct soil burial or concrete encasement. Not more than one conductor shall be connected to the grounding electrode by a single clamp or fitting unless the clamp or fitting is listed for multiple conductors. [250.70(A)]"
36,Chapter 36 Services,E3611.1.1,E3611.1.1 Indoor Communications,3,"For indoor communications purposes only, the grounding electrode conductor connection shall be a listed sheet metal strap-type ground clamp having a rigid metal base that seats on the electrode and having a strap of such material and dimensions that it is not likely to stretch during or after installation. [250.70(B)]"
36,Chapter 36 Services,E3611.2,E3611.2 Accessibility,2,All mechanical elements used to terminate a grounding electrode conductor or bonding jumper to the grounding electrodes that are not buried or concrete encased shall be accessible. [250.68(A) and 250.68(A) Exception]
36,Chapter 36 Services,E3611.3,E3611.3 Effective Grounding Path,2,"The connection of the grounding electrode conductor or bonding jumper shall be made in a manner that will ensure a permanent and effective grounding path. Where necessary to ensure effective grounding for a metal piping system used as a grounding electrode, effective bonding shall be provided around insulated joints and sections and around any equipment that is likely to be disconnected for repairs or replacement. Bonding jumpers shall be of sufficient length to permit removal of such equipment while retaining the integrity of the grounding path. [250.68(B)]"
36,Chapter 36 Services,E3611.4,E3611.4 Interior Metal Water Piping,2,"Where grounding electrode conductors and bonding jumpers are connected to interior metal water piping as a means to extend the grounding electrode conductor connection to an electrode(s), such piping shall be located not more than 5 feet (1524 mm) from the point of entry into the building, as measured along the water piping. Where interior metal water piping is used as a conductor to interconnect electrodes that are part of the grounding electrode system, such piping shall be located not more than 5 feet (1524 mm) from the point of entry into the building, as measured along the water piping. [250.68(C)(1)]"
36,Chapter 36 Services,E3611.5,E3611.5 Rebar-Type Concrete-Encased Electrode,2,"A rebar-type concrete-encased electrode installed in accordance with Section E3608.1.2 with an additional rebar section extended from its location within the concrete foundation or footing to an accessible location that is not subject to corrosion shall be permitted for connection of grounding electrode conductors and bonding jumpers in accordance with the following:The additional rebar section shall be continuous with the grounding electrode rebar or shall be connected to the grounding electrode rebar and connected together by the usual steel tie wires, exothermic welding, welding or other effective means.The rebar extension shall not be exposed to contact with the earth without corrosion protection.The rebar shall not be used as a conductor to interconnect the electrodes of grounding electrode systems. [250.68 (C) (3)]"
36,Chapter 36 Services,E3611.6,E3611.6 Protection of Ground Clamps and Fittings,2,"Ground clamps or other fittings shall be approved for applications without protection or shall be protected from physical damage by installing them where they are not likely to be damaged or by enclosing them in metal, wood or equivalent protective coverings. (250.10)"
36,Chapter 36 Services,E3611.7,E3611.7 Clean Surfaces,2,"Nonconductive coatings (such as paint, enamel and lacquer) on equipment to be grounded or bonded shall be removed from threads and other contact surfaces to ensure electrical continuity or shall be connected by fittings that make such removal unnecessary. (250.12)"
