id,section,reference,displayTitle,depth,body
13.1306,Section 1306 Building Score,1306.1,1306.1 Building Score,2,"After determining the appropriate data from Section 1305.2, enter those data in Table 1306.1 and total the building score.TABLE 1306.1SUMMARY SHEET—BUILDING CODE Existing occupancy: ___________________________________ Proposed occupancy: ___________________________________ Year building was constructed: ___________________________ Number of stories: ___________ Height in feet: ______________ Type of construction: ___________________________________ Area per floor: _________________________________________ Percentage of open perimeter increase: ________ % Completely suppressed: Yes_______ No_____ Corridor wall rating:_____________________________________ Type:________________________________________________ Compartmentation: Yes ______ No _______ Required door closers: Yes__________ No___________ Fire-resistance rating of vertical opening enclosures: ______________________________________________________________________ Type of HVAC system:___________________________________________, serving number of floors: ____________________________ Automatic fire detection: Yes_______ No_______ Type and location: ______________________________________ Fire alarm system: Yes_______ No_______ Type: ________________________________________________ Smoke control: Yes_______ No_______ Type: ________________________________________________ Adequate exit routes: Yes _______ No_______ Dead ends: ______________ Yes ________ No __________ Maximum exit access travel distance: ______________________ Elevator controls: Yes ________ No __________ Means of egress emergency lighting: Yes _______ No ______ Mixed occupancies: Yes ________ No __________ Standpipes: Yes_______ No_______ Care recipients ability for self-preservation: _________________________ Incidental use: Yes_______ No_______ Care recipients concentration: ___________________________________ Smoke compartmentation less than 22,500 ft2 (2092 m2): Yes_______ No_______ Attendant-to-care recipients ratio: ________________________________ SAFETY PARAMETERS FIRE SAFETY (FS) MEANS OF EGRESS (ME) GENERAL SAFETY (GS) 1305.2.1 Building height 1305.2.2 Building area 1305.2.3 Compartmentation 1305.2.4 Tenant and dwelling unit separations 1305.2.5 Corridor walls 1305.2.6 Vertical openings 1305.2.7 HVAC systems 1305.2.8 Automatic fire detection 1305.2.9 Fire alarm system 1305.2.10 Smoke control * * * * 1305.2.11 Means of egress * * * * 1305.2.12 Dead ends * * * * 1305.2.13 Maximum exit access travel distance * * * * 1305.2.14 Elevator control 1305.2.15 Means of egress emergency lighting * * * * 1305.2.16 Mixed occupancies * * * * 1305.2.17 Automatic sprinklers ÷ 2 = 1305.2.18 Standpipes 1305.2.19 Incidental use 1305.2.20 Smoke compartmentation 1305.2.21.1 Care recipients ability for self-preservationa * * * * 1305.2.21.2 Care recipients concentrationa * * * * 1305.2.21.3 Attendant-to-care recipients ratioa * * * * Building score—total value * * * *No applicable value to be inserted.Only applicable to Group I-2 occupancies."
13.1306,Section 1306 Building Score,1306.2,1306.2 Safety Scores,2,"The values in Table 1306.2 are the required mandatory safety scores for the evaluation process listed in Section 1305.2.TABLE 1306.2MANDATORY SAFETY SCORESa OCCUPANCY FIRE SAFETY(MFS) MEANS OF EGRESS (MME) GENERAL SAFETY (MGS) A-1 20 31 31 A-2 21 32 32 A-3 22 33 33 A-4, E 29 40 40 B 30 40 40 F 24 34 34 I-2 19 34 34 M 23 40 40 R 21 38 38 S-1 19 29 29 S-2 29 39 39 MFS = Mandatory Fire Safety.MME = Mandatory Means of Egress.MGS = Mandatory General Safety."
13,Chapter 13 Performance Compliance Methods,1307,Section 1307 Evaluation of Building Safety,1,
13.1307,Section 1307 Evaluation of Building Safety,1307.1,1307.1 Evaluation of Building Safety,2,"The mandatory safety score in Table 1306.2 shall be subtracted from the building score in Table 1306.1 for each category in accordance with the evaluation formulas in Table 1307.1. Where the final score for any category equals zero or more, the building is in compliance with the requirements of this section for that category. Where the final score for any category is less than zero, the building is not in compliance with the requirements of this section.TABLE 1307.1EVALUATION FORMULASa FORMULA TABLE 1306.1 TABLE 1306.2 SCORE PASS FAIL FS — MFS ≥ 0 ______(FS) — ______(MFS) = ______ ______ ______ ME — MME ≥ 0 ______(ME) — ______(MME) = ______ ______ ______ GS — MGS ≥ 0 ______(GS) — ______(MGS) = ______ ______ ______ FS = Fire Safety.ME = Means of Egress.GS = General Safety.MFS = Mandatory Fire Safety.MME = Mandatory Means of Egress.MGS = Mandatory General Safety."
13.1307,Section 1307 Evaluation of Building Safety,1307.1.1,1307.1.1 Mixed Occupancies,3,"For mixed occupancies, the following provisions shall apply:Where the separation between mixed occupancies does not qualify for any category indicated in Section 1305.2.16, the mandatory safety scores for the occupancy with the lowest general safety score in Table 1306.2 shall be utilized (see Section 1305.2).Where the separation between mixed occupancies qualifies for any category indicated in Section 1305.2.16, the mandatory safety scores for each occupancy shall be placed against the evaluation scores for the appropriate occupancy. An evaluation is not required for areas of the building with separated occupancies in accordance with Table 508.4 of the International Building Code in which there are no alterations or change of occupancy."
