id,section,reference,displayTitle,depth,body
13.1305,Section 1305 Scoring and Evaluation,1305.2.9,1305.2.9 Fire Alarm Systems,3,"Evaluate the capability of the fire alarm system in accordance with Section 907 of the International Building Code. Under the categories and occupancies in Table 1305.2.9, determine the appropriate value and enter that value into Table 1306.1 under Safety Parameter 1305.2.9, Fire Alarm System, for fire safety, means of egress and general safety.TABLE 1305.2.9FIRE ALARM SYSTEM VALUES OCCUPANCY CATEGORIES a ba c d A-1, A-2, A-3, A-4, B, E, R -10 -5 0 5 F, M, S 0 5 10 15 I-2 -4 1 2 5 For buildings equipped throughout with an automatic sprinkler system, add 2 points for activation by a sprinkler water-flow device."
13.1305,Section 1305 Scoring and Evaluation,1305.2.9.1,1305.2.9.1 Categories,4,"The categories for fire alarm systems are:Category a—None.Category b—Fire alarm system with manual fire alarm boxes in accordance with Section 907.4 of the International Building Code and alarm notification appliances in accordance with Section 907.5.2 of the International Building Code.Category c—Fire alarm system in accordance with Section 907 of the International Building Code.Category d—Category c plus a required emergency voice/alarm communications system and a fire command station that conforms to Section 911 of the International Building Code and contains the emergency voice/alarm communications system controls, fire department communication system controls, and any other controls specified in Section 911 of the International Building Code where those systems are provided."
13.1305,Section 1305 Scoring and Evaluation,1305.2.10,1305.2.10 Smoke Control,3,"Evaluate the ability of a natural or mechanical venting, exhaust or pressurization system to control the movement of smoke from a fire. Under the categories and occupancies in Table 1305.2.10, determine the appropriate value and enter that value into Table 1306.1 under Safety Parameter 1305.2.10, Smoke Control, for means of egress and general safety.TABLE 1305.2.10SMOKE CONTROL VALUES OCCUPANCY CATEGORIES a b c d e f A-1, A-2, A-3 0 1 2 3 6 6 A-4, E 0 0 0 1 3 5 B, M, R 0 2a 3a 3a 3a 4a F, S 0 2a 2a 3a 3a 3a I-2 -4 0 0 0 3 0 This value shall be 0 if compliance with Category d or e in Section 1305.2.8.1 has not been obtained."
13.1305,Section 1305 Scoring and Evaluation,1305.2.10.1,1305.2.10.1 Categories,4,"The categories for smoke control are:Category a—None.Category b—The building is equipped throughout with an automatic sprinkler system. Openings are provided in exterior walls at the rate of 20 square feet (1.86 m2) per 50 linear feet (15 240 mm) of exterior wall in each story and distributed around the building perimeter at intervals not exceeding 50 feet (15 240 mm). Such openings shall be readily openable from the inside without a key or separate tool and shall be provided with ready access thereto. In lieu of operable openings, clearly and permanently marked tempered glass panels shall be used.Category c—One enclosed exit stairway, with ready access thereto, from each occupied floor of the building. The stairway has operable exterior windows, and the building has openings in accordance with Category b.Category d—One smokeproof enclosure and the building has openings in accordance with Category b.Category e—The building is equipped throughout with an automatic sprinkler system. Each floor area is provided with a mechanical air-handling system designed to accomplish smoke containment. Return and exhaust air shall be moved directly to the outside without recirculation to other floor areas of the building under fire conditions. The system shall exhaust not less than six air changes per hour from the floor area. Supply air by mechanical means to the floor area is not required. Containment of smoke shall be considered as confining smoke to the floor area involved without migration to other floor areas. Any other tested and approved design that will adequately accomplish smoke containment is permitted.Category f—Each stairway shall be one of the following: a smokeproof enclosure in accordance with Section 1023.12 of the International Building Code; pressurized in accordance with Section 909.20.4 of the International Building Code; or shall have operable exterior windows."
13.1305,Section 1305 Scoring and Evaluation,1305.2.11,1305.2.11 Means of Egress Capacity and Number,3,"Evaluate the means of egress capacity and the number of exits available to the building occupants. In applying this section, the means of egress are required to conform to the following sections of the International Building Code: 1003.7, 1004, 1005, 1006, 1007, 1016.2, 1026.1, 1028.3, 1028.5, 1030.2, 1030.3, 1030.4 and 1031. The number of exits credited is the number that is available to each occupant of the area being evaluated. Existing fire escapes shall be accepted as a component in the means of egress when conforming to Section 504.Under the categories and occupancies in Table 1305.2.11, determine the appropriate value and enter that value into Table 1306.1 under Safety Parameter 1305.2.11, Means of Egress, for means of egress and general safety.TABLE 1305.2.11MEANS OF EGRESS VALUES OCCUPANCY CATEGORIES aa b c d e A-1, A-2, A-3, A-4, E, I-2 -10 0 2 8 10 M -3 0 1 2 4 B, F, S -1 0 0 0 0 R -3 0 0 0 0 The values indicated are for buildings six stories or less in height. For buildings over six stories above grade plane, add an additional -10 points."
13.1305,Section 1305 Scoring and Evaluation,1305.2.11.1,1305.2.11.1 Categories,4,"The categories for means-of-egress capacity and number of exits are:Category a—Compliance with the minimum required means-of-egress capacity or number of exits is achieved through the use of a fire escape in accordance with Section 504.Category b—Capacity of the means of egress complies with Section 1005 of the International Building Code, and the number of exits complies with the minimum number required by Section 1006 of the International Building Code.Category c—Capacity of the means of egress is equal to or exceeds 125 percent of the required means-of-egress capacity, the means of egress complies with the minimum required width dimensions specified in the International Building Code, and the number of exits complies with the minimum number required by Section 1006 of the International Building Code.Category d—The number of exits provided exceeds the number of exits required by Section 1006 of the International Building Code. Exits shall be located a distance apart from each other equal to not less than that specified in Section 1007 of the International Building Code.Category e—The area being evaluated meets both Categories c and d."
13.1305,Section 1305 Scoring and Evaluation,1305.2.12,1305.2.12 Dead Ends,3,"In spaces required to be served by more than one means of egress, evaluate the length of the exit access travel path in which the building occupants are confined to a single path of travel. Under the categories and occupancies in Table 1305.2.12, determine the appropriate value and enter that value into Table 1306.1 under Safety Parameter 1305.2.12, Dead Ends, for means of egress and general safety.TABLE 1305.2.12DEAD-END VALUES OCCUPANCY CATEGORIESa a b c d A-1, A-3, A-4, B, F, M, R, S -2 0 2 -4 A-2, E -2 0 2 -4 I-2 -2 0 2 -6 For dead-end distances between categories, the dead-end value shall be obtained by linear interpolation."
13.1305,Section 1305 Scoring and Evaluation,1305.2.12.1,1305.2.12.1 Categories,4,"The categories for dead ends are:Category a—Dead end of 35 feet (10 670 mm) in nonsprinklered buildings or 70 feet (21 340 mm) in sprinklered buildings.Category b—Dead end of 20 feet (6096 mm); or 50 feet (15 240 mm) in Group B in accordance with Section 1020.5, Exception 2, of the International Building Code.Category c—No dead ends; or ratio of length to width (l/w) is less than 2.5:1.Category d—Dead ends exceeding Category a."
13.1305,Section 1305 Scoring and Evaluation,1305.2.13,1305.2.13 Maximum Exit Access Travel Distance to an Exit,3,"Evaluate the length of exit access travel to an approved exit. Determine the appropriate points in accordance with the following equation and enter that value into Table 1306.1 under Safety Parameter 1305.2.13, Maximum Exit Access Travel Distance, for means of egress and general safety. The maximum allowable exit access travel distance shall be determined in accordance with Section 1017 of the International Building Code. Equation 13-7"
13.1305,Section 1305 Scoring and Evaluation,1305.2.14,1305.2.14 Elevator Control,3,"Evaluate the passenger elevator equipment and controls that are available to the fire department to reach all occupied floors. Emergency recall and in-car operation of elevators shall be provided in accordance with the International Fire Code. Under the categories and occupancies in Table 1305.2.14, determine the appropriate value and enter that value into Table 1306.1 under Safety Parameter 1305.2.14, Elevator Control, for fire safety, means of egress and general safety. The values shall be zero for a single-story building.TABLE 1305.2.14ELEVATOR CONTROL VALUES ELEVATOR TRAVEL CATEGORIES a b c d Less than 25 feet of travel above or below the primary level of elevator access for emergency fire-fighting or rescue personnel -2 0 0 +2 Travel of 25 feet or more above or below the primary level of elevator access for emergency fire-fighting or rescue personnel -4 NP 0 +4 For SI: 1 foot = 304.8 mm.NP = Not Permitted."
13.1305,Section 1305 Scoring and Evaluation,1305.2.14.1,1305.2.14.1 Categories,4,The categories for elevator controls are:Category a—No elevator.Category b—Any elevator without Phase I emergency recall operation and Phase II emergency in-car operation.Category c—All elevators with Phase I emergency recall operation and Phase II emergency in-car operation as required by the International Fire Code.Category d—All meet Category c; or Category b where permitted to be without Phase I emergency recall operation and Phase II emergency in-car operation; and at least one elevator that complies with new construction requirements serves all occupied floors.
13.1305,Section 1305 Scoring and Evaluation,1305.2.15,1305.2.15 Means of Egress Emergency Lighting,3,"Evaluate the presence of and reliability of means of egress emergency lighting. Under the categories and occupancies in Table 1305.2.15, determine the appropriate value and enter that value into Table 1306.1 under Safety Parameter 1305.2.15, Means of Egress Emergency Lighting, for means of egress and general safety.TABLE 1305.2.15MEANS OF EGRESS EMERGENCY LIGHTING VALUES NUMBER OF EXITS REQUIRED BY SECTION 1006 OF THE INTERNATIONAL BUILDING CODE CATEGORIES a b c Two or more exits NP 0 4 Minimum of one exit 0 1 1 NP = Not Permitted."
13.1305,Section 1305 Scoring and Evaluation,1305.2.15.1,1305.2.15.1 Categories,4,"The categories for means of egress emergency lighting are:Category a—Means-of-egress lighting and exit signs not provided with emergency power in accordance with Section 2702 of the International Building Code.Category b—Means of egress lighting and exit signs provided with emergency power in accordance with Section 2702 of the International Building Code.Category c—Emergency power provided to means of egress lighting and exit signs, which provides protection in the event of power failure to the site or building."
13.1305,Section 1305 Scoring and Evaluation,1305.2.16,1305.2.16 Mixed Occupancies,3,"Where a building has two or more occupancies that are not in the same occupancy classification, the separation between the mixed occupancies shall be evaluated in accordance with this section. Where there is no separation between the mixed occupancies or the separation between mixed occupancies does not qualify for any of the categories indicated in Section 1305.2.16.1, the building shall be evaluated as indicated in Section 1305.2, and the value for mixed occupancies shall be zero. Under the categories and occupancies in Table 1305.2.16, determine the appropriate value and enter that value into Table 1306.1 under Safety Parameter 1305.2.16, Mixed Occupancies, for fire safety and general safety. For buildings without mixed occupancies, the value shall be zero. Facilities in Group I-2 occupancies meeting Category a shall be considered to fail the evaluation.TABLE 1305.2.16MIXED OCCUPANCY VALUESa OCCUPANCY CATEGORIES a b c A-1, A-2, R -10 0 10 A-3, A-4, B, E, F, M, S -5 0 5 I-2 NP 0 5 NP = Not Permitted.For fire-resistance ratings between categories, the value shall be obtained by linear interpolation."
13.1305,Section 1305 Scoring and Evaluation,1305.2.16.1,1305.2.16.1 Categories,4,"The categories for mixed occupancies are:Category a—Occupancies separated by minimum 1-hour fire barriers or minimum 1-hour horizontal assemblies, or both.Category b—Separations between occupancies in accordance with Section 508.4 of the International Building Code.Category c—Separations between occupancies having a fire-resistance rating of not less than twice that required by Section 508.4 of the International Building Code."
13.1305,Section 1305 Scoring and Evaluation,1305.2.17,1305.2.17 Automatic Sprinklers,3,"Evaluate the ability to suppress or control a fire based on the installation of an automatic sprinkler system in accordance with Section 903.3.1 of the International Building Code. ""Required sprinklers"" shall be based on the requirements of the International Building Code . Under the categories and occupancies in Table 1305.2.17, determine the appropriate value and enter that value into Table 1306.1 under Safety Parameter 1305.2.17, Automatic Sprinklers, for fire safety, means of egress divided by 2, and general safety. High-rise buildings defined in Chapter 2 of the International Building Code that undergo a change of occupancy to Group R shall be equipped throughout with an automatic sprinkler system in accordance with Section 403 of the International Building Code and Chapter 9 of the International Building Code. Facilities in Group I-2 occupancies meeting Category a, b, c or f shall be considered to fail the evaluation.TABLE 1305.2.17SPRINKLER SYSTEM VALUES OCCUPANCY CATEGORIES aa ba c d e f A-1, A-3, F, M, R, S-1 -6 -3 0 2 4 6 A-2 -4 -2 0 1 2 4 A-4, B, E, S-2 -12 -6 0 3 6 12 I-2 NP NP NP 8 10 NP NP = Not Permitted.These options cannot be taken if Category a in Section 1305.2.18 is used."
13.1305,Section 1305 Scoring and Evaluation,1305.2.17.1,1305.2.17.1 Categories,4,The categories for automatic sprinkler system protection are:Category a—An approved automatic sprinkler system is required throughout; an approved automatic sprinkler system is not provided.Category b—An approved automatic sprinkler system is required in a portion of a building; an approved automatic sprinkler system is not provided; the sprinkler system design is not adequate for the hazard protected in accordance with Chapter 9 of the International Building Code.Category c—An approved automatic sprinkler system is not required; none are provided.Category d—An approved automatic sprinkler system is required in a portion of a building; an approved automatic sprinkler system is provided in a portion of a building in accordance with Chapter 9 of the International Building Code.Category e—An approved automatic sprinkler system is required throughout; an approved automatic sprinkler system is provided throughout in accordance with Chapter 9 of the International Building Code.Category f—An approved automatic sprinkler system is not required throughout; an approved automatic sprinkler system is provided throughout in accordance with Chapter 9 of the International Building Code.
13.1305,Section 1305 Scoring and Evaluation,1305.2.18,1305.2.18 Standpipes,3,"Evaluate the ability to initiate attack on a fire by making a supply of water readily available through the installation of standpipes in accordance with Section 905 of the International Building Code. ""Required Standpipes"" shall be based on the requirements of the International Building Code. Under the categories and occupancies in Table 1305.2.18, determine the appropriate value and enter that value into Table 1306.1 under Safety Parameter 1305.2.18, Standpipes, for fire safety, means of egress and general safety.TABLE 1305.2.18STANDPIPE SYSTEM VALUES OCCUPANCY CATEGORIES aa b c d A-1, A-3, F, M, R, S-1 -6 0 4 6 A-2 -4 0 2 4 A-4, B, E, S-2 -12 0 6 12 I-2 -2 0 1 2 This option cannot be taken if Category a or Category b in Section 1305.2.17 is used."
13.1305,Section 1305 Scoring and Evaluation,1305.2.18.1,1305.2.18.1 Standpipe Categories,4,The categories for standpipe systems are:Category a—Standpipes are required; standpipe is not provided or the standpipe system design is not in compliance with Section 905.3 of the International Building Code.Category b—Standpipes are not required; none are provided.Category c—Standpipes are required; standpipes are provided in accordance with Section 905 of the International Building Code.Category d—Standpipes are not required; standpipes are provided in accordance with Section 905 of the International Building Code.
13.1305,Section 1305 Scoring and Evaluation,1305.2.19,1305.2.19 Incidental Uses,3,"Evaluate the protection of incidental uses in accordance with Section 509.4.2 of the International Building Code. Do not include those where this code requires automatic sprinkler systems throughout the building including covered and open mall buildings, high-rise buildings, public garages and unlimited area buildings. Assign the lowest score from Table 1305.2.19 for the building or floor area being evaluated and enter that value into Table 1306.1 under Safety Parameter 1305.2.19, Incidental Use, for fire safety, means of egress and general safety. If there are no specific occupancy areas in the building or floor area being evaluated, the value shall be zero.TABLE 1305.2.19INCIDENTAL USE AREA VALUES PROTECTION REQUIRED BY TABLE 509.1 OF THE INTERNATIONAL BUILDING CODE PROTECTION PROVIDED None 1 hour AS AS with CRS 1 hour and AS 2 hours 2 hours and AS 2 hours and AS -4 -3 -2 -2 -1 -2 0 2 hours, or 1 hour and AS -3 -2 -1 -1 0 0 0 1 hour and AS -3 -2 -1 -1 0 -1 0 1 hour -1 0 -1 -1 0 0 0 1 hour, or AS with CRS -1 0 -1 -1 0 0 0 AS with CRS -1 -1 -1 -1 0 -1 0 1 hour or AS -1 0 0 0 0 0 0 AS = Automatic Sprinkler System.CRS = Construction capable of resisting the passage of smoke. (See Section 509.4.2 of the International Building Code.)"
13.1305,Section 1305 Scoring and Evaluation,1305.2.20,1305.2.20 Smoke Compartmentation,3,"Evaluate the smoke compartments for compliance with Section 407.5 of the International Building Code. Under the categories and occupancies in Table 1305.2.20, determine the appropriate smoke compartmentation value (SCV) and enter that value into Table 1306.1 under Safety Parameter 1305.2.20, Smoke Compartmentation, for fire safety, means of egress and general safety. Facilities in Group I-2 occupancies meeting Category b or c shall be considered to fail the evaluation.TABLE 1305.2.20SMOKE COMPARTMENTATION VALUES OCCUPANCY CATEGORIESa a b c A, B, E, F, M, R and S 0 0 0 I-2 0 -10 NP NP = Not Permitted.For areas between categories, the smoke compartmentation value shall be obtained by linear interpolation."
13.1305,Section 1305 Scoring and Evaluation,1305.2.20.1,1305.2.20.1 Categories,4,Categories for smoke compartment size are:Category a—Smoke compartment complies with Section 407.5 of the International Building Code.Category b—Smoke compartment are provided but do not comply with Section 407.5 of the International Building Code.Category c—Smoke compartments are not provided.
13.1305,Section 1305 Scoring and Evaluation,1305.2.21,"1305.2.21 Care Recipient Ability, Concentration, Smoke Compartment Location and Ratio to Attendant",3,"In I-2 occupancies, the ability of care recipients, their concentration and ratio to attendants shall be evaluated and applied in accordance with this section. Evaluate each smoke compartment using the categories in Sections 1305.2.21.1, 1305.2.21.2 and 1305.2.21.3 and enter the value in Table 1306.1. To determine the safety factor, multiply the three values together; if the product is less than 6, compliance has failed."
13.1305,Section 1305 Scoring and Evaluation,1305.2.21.1,1305.2.21.1 Care Recipient Ability for Self-Preservation,4,"Evaluate the ability of the care recipients for self-preservation in each smoke compartment in an emergency. Under the categories and occupancies in Table 1305.2.21.1, determine the appropriate value and enter that value in Table 1306.1 under Safety Parameter 1305.2.21.1, Care Recipient Ability for Self-preservation, for means of egress and general safety.TABLE 1305.2.21.1CARE RECIPIENT ABILITY VALUES OCCUPANCY CATEGORIES a b c I-2 3 2 1"
13.1305,Section 1305 Scoring and Evaluation,1305.2.21.1.1,1305.2.21.1.1 Categories,5,The categories for care recipient ability for self-preservation are:Category a—(mobile) Care recipients are capable of self-preservation without assistance.Category b—(not mobile) Care recipients rely on assistance for evacuation or relocation.Category c—(not movable) Care recipients cannot be evacuated or relocated.
13.1305,Section 1305 Scoring and Evaluation,1305.2.21.2,1305.2.21.2 Care Recipient Concentration,4,"Evaluate the concentration of care recipients in each smoke compartment under Section 1305.2.21.2. Under the categories and occupancies in Table 1305.2.21.2 determine the appropriate value and enter that value in Table 1306.1 under Safety Parameter 1305.2.21.2, Care Recipient Concentration, for means of egress and general safety.TABLE 1305.2.21.2CARE RECIPIENT CONCENTRATION VALUES OCCUPANCY CATEGORIES a b c I-2 3 2 1"
13.1305,Section 1305 Scoring and Evaluation,1305.2.21.2.1,1305.2.21.2.1 Categories:,5,The categories for care recipient concentration are:Category a—smoke compartment has 1 to 10 care recipients.Category b—smoke compartment has more than 10 to 40 care recipients.Category c—smoke compartment has more than 40 care recipients.
13.1305,Section 1305 Scoring and Evaluation,1305.2.21.3,1305.2.21.3 Attendant-to-Care Recipients Ratio,4,"Evaluate the attendant-to-care recipients ratio for each compartment under Section 1305.2.21.3. Under the categories and occupancies in Table 1305.2.21.3 determine the appropriate value and enter that value in Table 1306.1 under Safety Parameter 1305.2.21.3, Attendant-to-Care Recipients Ratio, for means of egress and general safety.TABLE 1305.2.21.3ATTENDANT-TO-CARE RECIPIENTS RATIO VALUES OCCUPANCY CATEGORIES a b c I-2 3 2 1"
13.1305,Section 1305 Scoring and Evaluation,1305.2.21.3.1,1305.2.21.3.1 Categories,5,The categories for attendant-to-care recipient concentrations are:Category a—attendant-to-care recipients concentration is 1:5 or no care recipients.Category b—attendant-to-care recipients concentration is 1:6 to 1:10.Category c—attendant-to-care recipients concentration is greater than 1:10.
13,Chapter 13 Performance Compliance Methods,1306,Section 1306 Building Score,1,
