id,section,reference,displayTitle,depth,body
,,13,Chapter 13 Performance Compliance Methods,0,"User notes:About this chapter: Chapter 13 allows for existing buildings to be evaluated so as to show that alterations, while not meeting new construction requirements, will improve the current existing situation. Provisions are based on a numerical scoring system involving 21 various safety parameters and the degree of code compliance for each issue."
13,Chapter 13 Performance Compliance Methods,1301,Section 1301 General,1,
13.1301,Section 1301 General,1301.1,1301.1 Scope,2,"The provisions of this chapter shall apply to the alteration, addition and change of occupancy of existing structures, including historic structures, as referenced in Section 301.3.3. The provisions of this chapter are intended to maintain or increase the current degree of public safety, health and general welfare in existing buildings while permitting, alteration, addition and change of occupancy without requiring full compliance with Chapters 6 through 12, except where compliance with the prescriptive method of Chapter 5 or the work area method of other provisions of this code is specifically required in this chapter."
13.1301,Section 1301 General,1301.1.1,1301.1.1 Compliance With Other Methods,3,"Alterations, additions and changes of occupancy to existing structures shall comply with the provisions of this chapter or with one of the methods provided in Section 301.3."
13,Chapter 13 Performance Compliance Methods,1302,Section 1302 Applicability,1,
13.1302,Section 1302 Applicability,1302.1,1302.1 Applicability,2,"Existing buildings in which there is work involving additions, alterations or changes of occupancy shall be made to conform to the requirements of this chapter or the provisions of Chapters 6 through 12. The provisions of Sections 1302.1.1 through 1302.1.6 shall apply to existing occupancies that will continue to be, or are proposed to be, in Groups A, B, E, F, I-2, M, R and S. These provisions shall also apply to Group U occupancies where such occupancies are undergoing a change of occupancy or a partial change in occupancy with separations in accordance with Section 1302.1.2. These provisions shall not apply to buildings with occupancies in Group H, I-1, I-3 or I-4."
13.1302,Section 1302 Applicability,1302.1.1,1302.1.1 Change in Occupancy,3,"Where an existing building is changed to a new occupancy classification and this section is applicable, the provisions of this section for the new occupancy shall be used to determine compliance with this code."
13.1302,Section 1302 Applicability,1302.1.2,1302.1.2 Partial Change in Occupancy,3,"Where a portion of the building is changed to a new occupancy classification and that portion is separated from the remainder of the building with fire barrier or horizontal assemblies having a fire-resistance rating as required by Table 508.4 of the International Building Code or Section R302 of the International Residential Code for the separate occupancies, or with approved compliance alternatives, the portion changed shall be made to conform to the provisions of this section. Only the portion separated shall be required to be evaluated for compliance.Where a portion of the building is changed to a new occupancy classification and that portion is not separated from the remainder of the building with fire barriers or horizontal assemblies having a fire-resistance rating as required by Table 508.4 of the International Building Code or Section R302 of the International Residential Code for the separate occupancies, or with approved compliance alternatives, the provisions of this section which apply to each occupancy shall apply to the entire building. Where there are conflicting provisions, those requirements which secure the greater public safety shall apply to the entire building or structure."
13.1302,Section 1302 Applicability,1302.1.3,1302.1.3 Additions,3,"Additions to existing buildings shall comply with the requirements of the International Building Code or the International Residential Code for new construction. The combined height and area of the existing building and the new addition shall not exceed the height and area allowed by Chapter 5 of the International Building Code. Where a fire wall that complies with Section 706 of the International Building Code is provided between the addition and the existing building, the addition shall be considered a separate building. Where a new occupiable roof is added to a building or structure, the occupiable roof shall comply with the provisions of the International Building Code. Exception: In-filling of floor openings and nonoccupiable appendages, such as elevator and exit stairway shafts, shall be permitted beyond that permitted by the International Building Code."
13.1302,Section 1302 Applicability,1302.1.4,1302.1.4 Alterations,3,"An existing building or portion thereof shall not be altered in such a manner that results in the building being less safe or sanitary than such building is currently.Exception: Where the current level of safety or sanitation is proposed to be reduced, the portion altered shall conform to the requirements of the International Building Code."
13.1302,Section 1302 Applicability,1302.1.5,1302.1.5 Escalators,3,"Where escalators are provided in below-grade transportation stations, existing and new escalators shall be permitted to have a clear width of less than 32 inches (815 mm)."
13.1302,Section 1302 Applicability,1302.1.6,1302.1.6 Plumbing Fixtures,3,Plumbing fixtures shall be provided in accordance with Section 1009 for a change of occupancy and Section 808 for alterations. Plumbing fixtures for additions shall be in accordance with the International Plumbing Code.
13,Chapter 13 Performance Compliance Methods,1303,Section 1303 Acceptance,1,
13.1303,Section 1303 Acceptance,1303.1,1303.1 Acceptance,2,"For repairs, alterations, additions and changes of occupancy to existing buildings that are evaluated in accordance with this section, compliance with this section shall be accepted by the code official."
13.1303,Section 1303 Acceptance,1303.1.1,1303.1.1 Hazards,3,"Where the code official determines that an unsafe condition exists as provided for in Section 115, such unsafe condition shall be abated in accordance with Section 115."
13.1303,Section 1303 Acceptance,1303.1.2,1303.1.2 Compliance With Other Codes,3,Buildings that are evaluated in accordance with this section shall comply with the International Fire Code and International Property Maintenance Code.
13.1303,Section 1303 Acceptance,1303.1.3,[BS]  1303.1.3 Compliance With Flood Hazard Provisions,3,"In flood hazard areas, buildings that are evaluated in accordance with this section shall comply with Section 1612 of the International Building Code, or Section R306 of the International Residential Code, as applicable, if the work covered by this section constitutes substantial improvement. If the work covered by this section is a structurally connected horizontal addition that does not constitute substantial improvement, the addition is not required to comply with the flood design requirements for new construction, provided that both of the following apply. The addition shall not create or extend any nonconformity of the existing building with the flood-resistant construction requirements.The lowest floor of the addition shall be at or above the lower of the lowest floor of the existing building or the lowest floor elevation required in Section 1612 of the International Building Code or Section R306 of the International Residential Code, as applicable."
13,Chapter 13 Performance Compliance Methods,1304,Section 1304 Investigation and Evaluation,1,
13.1304,Section 1304 Investigation and Evaluation,1304.1,1304.1 Investigation and Evaluation,2,"For proposed work covered by this chapter, the building owner shall cause the existing building to be investigated and evaluated in accordance with the provisions of Sections 1304.1 through 1307.1."
13.1304,Section 1304 Investigation and Evaluation,1304.1.1,[BS]  1304.1.1 Structural Analysis,3,"The owner shall have a structural analysis of the existing building made to determine adequacy of structural systems for the proposed alteration, addition or change of occupancy. The analysis shall demonstrate that the building with the work completed is capable of resisting the loads specified in Chapter 16 of the International Building Code."
13.1304,Section 1304 Investigation and Evaluation,1304.1.2,1304.1.2 Submittal,3,"The results of the investigation and evaluation as required in Section 1304.1, along with proposed compliance alternatives, shall be submitted to the code official."
13.1304,Section 1304 Investigation and Evaluation,1304.1.3,1304.1.3 Determination of Compliance,3,"The code official shall determine whether the existing building, with the proposed addition, alteration or change of occupancy, complies with the provisions of this section in accordance with the evaluation process in Sections 1305.1 through 1307.1."
13,Chapter 13 Performance Compliance Methods,1305,Section 1305 Scoring and Evaluation,1,
13.1305,Section 1305 Scoring and Evaluation,1305.1,1305.1 Evaluation,2,"The evaluation shall be composed of three categories: fire safety, means of egress and general safety, as defined in Sections 1305.1.1 through 1305.1.3."
13.1305,Section 1305 Scoring and Evaluation,1305.1.1,1305.1.1 Fire Safety,3,"Included within the fire safety category are the structural fire resistance, automatic fire detection, fire alarm, automatic sprinkler system and fire suppression system features of the facility."
13.1305,Section 1305 Scoring and Evaluation,1305.1.2,1305.1.2 Means of Egress,3,"Included within the means of egress category are the configuration, characteristics and support features for means of egress in the facility."
13.1305,Section 1305 Scoring and Evaluation,1305.1.3,1305.1.3 General Safety,3,Included within the general safety category are the fire safety parameters and the means of egress parameters.
13.1305,Section 1305 Scoring and Evaluation,1305.2,1305.2 Evaluation Process,2,"The evaluation process specified herein shall be followed in its entirety to evaluate existing buildings in Groups A, B, E, F, M, R, S and U. For existing buildings in Group I-2, the evaluation process specified herein shall be followed and applied to each and every individual smoke compartment. Table 1306.1 shall be utilized for tabulating the results of the evaluation. References to other sections of this code or other codes indicate that compliance with those sections is required in order to gain credit in the evaluation herein outlined. In applying this section to a building with mixed occupancies, where the separation between the mixed occupancies does not qualify for any category indicated in Section 1305.2.16, the score for each occupancy shall be determined, and the lower score determined for each section of the evaluation process shall apply to the entire building or to each smoke compartment for Group I-2 occupancies.Where the separation between the mixed occupancies qualifies for any category indicated in Section 1305.2.16, the score for each occupancy shall apply to each portion or smoke compartment of the building based on the occupancy of the space."
13.1305,Section 1305 Scoring and Evaluation,1305.2.1,1305.2.1 Building Height and Number of Stories,3,"The value for building height and number of stories shall be the lesser value determined by the formula in Section 1305.2.1.1. Section 504 of the International Building Code shall be used to determine the allowable height and number of stories of the building. Subtract the actual building height from the allowable height and divide by 12.5 feet (3810 mm). Enter the height value and its sign (positive or negative) in Table 1306.1 under Safety Parameter 1305.2.1, Building Height, for fire safety, means of egress and general safety. The maximum score for a building shall be 10."
13.1305,Section 1305 Scoring and Evaluation,1305.2.1.1,1305.2.1.1 Height Formula,4,"The following formulas shall be used in computing the building height value. Equation 13-1 Equation 13-2 where: AH = Allowable height in feet (mm) from Section 504 of the International Building Code. EBH = Existing building height in feet (mm). AS = Allowable height in stories from Section 504 of the International Building Code. EBS = Existing building height in stories. CF = 1 if (AH) — (EBH) is positive. CF = Construction-type factor shown in Table 1305.2.6(2) if (AH) — (EBH) is negative. Note: Where mixed occupancies are separated and individually evaluated as indicated in Section 1305.2, the values AH, AS, EBH and EBS shall be based on the height of the occupancy being evaluated."
13.1305,Section 1305 Scoring and Evaluation,1305.2.2,1305.2.2 Building Area,3,"The value for building area shall be determined by the formula in Section 1305.2.2.2. Section 506 of the International Building Code and the formula in Section 1305.2.2.1 shall be used to determine the allowable area of the building. Enter the area value and its sign (positive or negative) in Table 1306.1 under Safety Parameter 1305.2.2, Building Area, for fire safety, means of egress and general safety. In determining the area value, the maximum permitted positive value for area is 50 percent of the fire safety score as listed in Table 1306.2, Mandatory Safety Scores. Group I-2 occupancies shall be scored zero."
13.1305,Section 1305 Scoring and Evaluation,1305.2.2.1,1305.2.2.1 Allowable Area Formula,4,"The following formula shall be used in computing allowable area: Equation 13-3 where: Aa = Allowable building area per story (square feet). At = Tabular allowable area factor (NS, S1, S13R, or SM value, as applicable) in accordance with Table 506.2 of the International Building Code. NS = Tabular allowable area factor in accordance with Table 506.2 of the International Building Code for a nonsprinklered building (regardless of whether the building is sprinklered). If = Area factor increase due to frontage as calculated in accordance with Section 506.3 of the International Building Code."
13.1305,Section 1305 Scoring and Evaluation,1305.2.2.2,1305.2.2.2 Area Formula,4,The following formulas shall be used in computing the area value. Equation 13-4 shall be used for a single occupancy buildings and Equation 13-5 shall be used for multiple occupancy buildings. Determine the area value for each occupancy floor area on a floor-by-floor basis. For multiple occupancy buildings with the minimum area value of the set of values obtained for the particular occupancy shall be used as the area value for that occupancy. For single occupancy buildings: Equation 13-4 For multiple occupancy buildings: Equation 13-5 where: i = Value for an individual separated occupancy on a floor. n = Number of separated occupancies on a floor.
13.1305,Section 1305 Scoring and Evaluation,1305.2.3,1305.2.3 Compartmentation,3,"Evaluate the compartments created by fire barriers or horizontal assemblies which comply with Sections 1305.2.3.2 and 1305.2.3.3and which are exclusive of the wall elements considered under Sections 1305.2.4 and 1305.2.5. Conforming compartments shall be figured as the net area and do not include shafts, chases, stairways, walls or columns. Using Table 1305.2.3, determine the appropriate compartmentation value (CV) and enter that value into Table 1306.1 under Safety Parameter 1305.2.3, Compartmentation, for fire safety, means of egress and general safety.TABLE 1305.2.3COMPARTMENTATION VALUES OCCUPANCY CATEGORIESa a b c d e A-1, A-3 0 6 10 14 18 A-2 0 4 10 14 18 A-4, B, E, S-2 0 5 10 15 20 F, M, R, S-1 0 4 10 16 22 I-2 0 2 8 10 14 For compartment sizes between categories, the compartmentation value shall be obtained by linear interpolation."
13.1305,Section 1305 Scoring and Evaluation,1305.2.3.1,1305.2.3.1 Categories,4,"The categories for compartment separations are: Category a—Compartment size of 15,000 square feet (1394 m2) or more.Category b—Maximum compartment size of 10,000 square feet (929 m2).Category c—Maximum compartment size of 7,500 square feet (697 m2).Category d—Maximum compartment size of 5,000 square feet (464 m2).Category e—Maximum compartment size of 2,500 square feet (232 m2)."
13.1305,Section 1305 Scoring and Evaluation,1305.2.3.2,1305.2.3.2 Wall Construction,4,"A wall used to create separate compartments shall be a fire barrier conforming to Section 707 of the International Building Code with a fire-resistance rating of not less than 2 hours. Where the building is not divided into more than one compartment, the compartment size shall be taken as the total floor area on all floors. Where there is more than one compartment within a story, each compartmented area on such story shall be provided with a horizontal exit conforming to Section 1026 of the International Building Code. The fire door serving as the horizontal exit between compartments shall be so installed, fitted and gasketed that such fire door will provide a substantial barrier to the passage of smoke."
13.1305,Section 1305 Scoring and Evaluation,1305.2.3.3,1305.2.3.3 Floor/Ceiling Construction,4,A floor/ceiling assembly used to create compartments shall conform to Section 711 of the International Building Code and shall have a fire-resistance rating of not less than 2 hours.
13.1305,Section 1305 Scoring and Evaluation,1305.2.4,1305.2.4 Tenant and Dwelling Unit Separations,3,"Evaluate the fire-resistance rating of floors and walls separating tenants, including dwelling units, and not evaluated under Sections 1305.2.3 and 1305.2.5. Group I-2 occupancies shall evaluate the rating of the separations between care recipient sleeping rooms.Under the categories and occupancies in Table 1305.2.4, determine the appropriate value and enter that value in Table 1306.1 under Safety Parameter 1305.2.4, Tenant and Dwelling Unit Separations, for fire safety, means of egress and general safety. The value shall be zero for single tenant buildings and buildings without dwelling units.TABLE 1305.2.4SEPARATION VALUES OCCUPANCY CATEGORIES a b c d e A-1 0 0 0 0 1 A-2 -5 -3 0 1 3 R -4 -2 0 2 4 A-3, A-4, B, E, F, M, S-1 -4 -3 0 2 4 I-2 0 1 2 3 4 S-2 -5 -2 0 2 4"
13.1305,Section 1305 Scoring and Evaluation,1305.2.4.1,1305.2.4.1 Categories,4,"The categories for tenant and dwelling unit separations are:Category a—No fire partitions; incomplete fire partitions; no doors; doors not self-closing or automatic-closing.Category b—Fire partitions or floor assemblies with less than 1-hour fire-resistance ratings or not constructed in accordance with Section 708 or 711 of the International Building Code, respectively.Category c—Fire partitions with 1-hour or greater fire-resistance ratings constructed in accordance with Section 708 of the International Building Code and floor assemblies with 1-hour but less than 2-hour fire-resistance ratings constructed in accordance with Section 711 of the International Building Code or with only one tenant within the floor area.Category d—Fire barriers with 1-hour but less than 2-hour fire-resistance ratings constructed in accordance with Section 707 of the International Building Code and floor assemblies with 2-hour or greater fire-resistance ratings constructed in accordance with Section 711 of the International Building Code.Category e—Fire barriers and floor assemblies with 2-hour or greater fire-resistance ratings and constructed in accordance with Sections 707 and 711 of the International Building Code, respectively."
13.1305,Section 1305 Scoring and Evaluation,1305.2.5,1305.2.5 Corridor Walls,3,"Evaluate the fire-resistance rating and degree of completeness of walls which create corridors serving the floor and that are constructed in accordance with Section 1020 of the International Building Code. This evaluation shall not include the wall elements considered under Sections 1305.2.3 and 1305.2.4. Under the categories and groups in Table 1305.2.5, determine the appropriate value and enter that value into Table 1306.1 under Safety Parameter 1305.2.5, Corridor Walls, for fire safety, means of egress and general safety.TABLE 1305.2.5CORRIDOR WALL VALUES OCCUPANCY CATEGORIES a b ca da A-1 -10 -4 0 2 A-2 -30 -12 0 2 A-3, F, M, R, S-1 -7 -3 0 2 A-4, B, E, S-2 -5 -2 0 5 I-2 -10 0 1 2 Corridors not providing at least one-half the exit access travel distance for all occupants on a floor shall use Category b."
13.1305,Section 1305 Scoring and Evaluation,1305.2.5.1,1305.2.5.1 Categories,4,"The categories for corridor walls are:Category a—No fire partitions; incomplete fire partitions; no doors; or doors not self-closing.Category b—Less than 1-hour fire-resistance rating or not constructed in accordance with Section 708.4 of the International Building Code.Category c—1-hour to less than 2-hour fire-resistance rating, with doors conforming to Section 716 of the International Building Code or corridors as permitted by Section 1020 of the International Building Code to be without a fire-resistance rating.Category d—2-hour or greater fire-resistance rating, with doors conforming to Section 716 of the International Building Code."
13.1305,Section 1305 Scoring and Evaluation,1305.2.6,1305.2.6 Vertical Openings,3,"Evaluate the fire-resistance rating of interior exit stairways or ramps, hoistways, escalator openings and other shaft enclosures within the building, and openings between two or more floors. Table 1305.2.6(1) contains the appropriate protection values. Multiply that value by the construction-type factor found in Table 1305.2.6(2). Enter the vertical opening value and its sign (positive or negative) in Table 1306.1 under Safety Parameter 1305.2.6, Vertical Openings, for fire safety, means of egress and general safety. If the structure is a one-story building or if all the unenclosed vertical openings within the building conform to the requirements of Section 712 of the International Building Code, enter a value of 2. The maximum positive value for this requirement (VO) shall be 2.TABLE 1305.2.6(1)VERTICAL OPENING PROTECTION VALUE PROTECTION VALUE None (unprotected opening) -2 times number of floors connected Less than 1 hour -1 times number of floors connected 1 to less than 2 hours 1 2 hours or more 2 TABLE 1305.2.6(2)CONSTRUCTION-TYPE FACTOR FACTOR TYPE OF CONSTRUCTION IA IB IIA IIB IIIA IIIB IV VA VB 1.2 1.5 2.2 3.5 2.5 3.5 2.3 3.3 7"
13.1305,Section 1305 Scoring and Evaluation,1305.2.6.1,1305.2.6.1 Vertical Opening Formula,4,The following formula shall be used in computing vertical opening value. Equation 13-6 where: VO = Vertical opening value. The calculated value shall not be greater than positive 2.0. PV = Protection value from Table 1305.2.6(1). CF = Construction-type factor from Table 1305.2.6(2).
13.1305,Section 1305 Scoring and Evaluation,1305.2.7,1305.2.7 HVAC Systems,3,"Evaluate the ability of the HVAC system to resist the movement of smoke and fire beyond the point of origin. Under the categories in Section 1305.2.7.1, determine the appropriate value and enter that value into Table 1306.1 under Safety Parameter 1305.2.7, HVAC Systems, for fire safety, means of egress and general safety. Facilities in Group I-2 occupancies meeting Category a, b or c shall be considered to fail the evaluation."
13.1305,Section 1305 Scoring and Evaluation,1305.2.7.1,1305.2.7.1 Categories,4,The categories for HVAC systems are:Category a—Plenums not in accordance with Section 602 of the International Mechanical Code. -10 points.Category b—Air movement in egress elements not in accordance with Section 1020.6 of the International Building Code. -5 points.Category c—Both Categories a and b are applicable. -15 points.Category d—Compliance of the HVAC system with Section 1020.6 of the International Building Code and Section 602 of the International Mechanical Code. 0 points.Category e—Systems serving one story; or a central boiler/chiller system without ductwork connecting two or more stories or where systems have no ductwork. +5 points.
13.1305,Section 1305 Scoring and Evaluation,1305.2.8,1305.2.8 Automatic Fire Detection,3,"Evaluate the smoke detection capability based on the location and operation of automatic fire detectors in accordance with the International Mechanical Code and Section 907 of the International Building Code. Under the categories and occupancies in Table 1305.2.8, determine the appropriate value and enter that value into Table 1306.1 under Safety Parameter 1305.2.8, Automatic Fire Detection, for fire safety, means of egress and general safety. Facilities in Group I-2 occupancies meeting Category a, b or c shall be considered to fail the evaluation.TABLE 1305.2.8AUTOMATIC FIRE DETECTION VALUES OCCUPANCY CATEGORIES a b c d e f A-1, A-3, F, M, R, S-1 -10 -5 0 2 6 NA A-2 -25 -5 0 5 9 NA A-4, B, E, S-2 -4 -2 0 4 8 NA I-2 NP NP NP 4 5 2 NA = Not Applicable.NP = Not Permitted."
13.1305,Section 1305 Scoring and Evaluation,1305.2.8.1,1305.2.8.1 Categories,4,"The categories for automatic fire detection are:Category a—None.Category b—Existing smoke detectors in HVAC systems and maintained in accordance with the International Fire Code.Category c—Smoke detectors in HVAC systems. The detectors are installed in accordance with the requirements for new buildings in the International Mechanical Code.Category d—Smoke detectors throughout all floor areas other than individual sleeping units, tenant spaces and dwelling units.Category e—Smoke detectors installed throughout the floor area.Category f—Smoke detectors in corridors only."
