id,section,title,body
21,,Masonry,"CALIFORNIA BUILDING CODE — MATRIX ADOPTION TABLECHAPTER 21 — MASONRY (Matrix Adoption Tables are nonregulatory, intended only as an aid to the code user. See Chapter 1 for state agency authority and building applications.) Adopting agency BSC BSC- CG SFM HCD DSA OSHPD BSCC DPH AGR DWR CEC CA SL SLC 1 2 1/AC AC SS SS/CC 1 1R 2 3 4 5 6 Adopt entire chapter X X X X X Adopt entire chapter as amended (amended sections listed below) X X X X Adopt only those sections that are listed below X X Chapter / Section 2101.1.1 X X X X 2101.1.2 X X X X 2101.1.3 X X X X 2101.1.4 X 2101.1.5 X 2101.2 X X X 2101.2.2 X X X 2103.1 X X X 2103.4 X X X 2103.5 X X X 2103.6 X X X 2104.2 X X X 2104.3 X X X 2105.2 X X X 2105.3 X X X 2105.4 X X X 2106.1.1 X X X 2106.1.2 X X X 2106.1.3 X X X 2107.1 X X X 2107.5 X X X 2109 X X X 2109.2.4.8.2 X 2110.1 X X X 2113.9.2 X 2115 X The state agency does not adopt sections identified with the following symbol: † The Office of the State Fire Marshal's adoption of this chapter or individual sections is applicable to structures regulated by other state agencies pursuant to Section 1.11. User notes: About this chapter: Chapter 21 establishes minimum requirements for masonry construction. The provisions address: material specifications and test methods; types of wall construction; criteria for engineered and empirical designs; and required details of construction, including the execution of construction. The provisions provide a framework for applying applicable standards to the design and construction of masonry structures. Masonry design methodologies including allowable stress design, strength design and empirical design are covered by the provisions of this chapter. Also addressed are masonry fireplaces and chimneys, masonry heaters and glass unit masonry. ICC code development note: Code change proposals to this chapter will be considered by the IBC— Structural Code Development Committee during the 2025 (Group B) Code Development Cycle."
2101,Chapter 21 Masonry,General,
2101.1,Section 2101 General,Scope,"This chapter shall govern the materials, design, construction and quality of masonry."
2101.1.1,Section 2101 General,Application,"[DSA-SS/CC, OSHPD] The scope of application of Chapter 21 is as follows:Structures regulated by the Division of the State Architect—Structural Safety/Community Colleges (DSA-SS/CC) which include those applications listed in Section 1.9.2.2.Structures regulated by the Department of Health Care Access and Information/Office of Statewide Hospital planning and development (OSHPD), which include hospital buildings removed from general acute care service, skilled nursing facility buildings, intermediate care facility buildings and acute psychiatric hospital buildings listed in Sections 1.10.1, 1.10.2 and 1.10.5."
2101.1.2,Section 2101 General,Amendments in This Chapter,"[DSA-SS/CC, OSHPD] DSA-SS/CC, OSHPD adopt this chapter as amended."
2101.1.3,Section 2101 General,Identification of Amendments,"[DSA-SS/CC, OSHPD] [DSA-SS/CC] Division of the State Architect - Structural Safety/Community Colleges amendments appear in this chapter preceded by the appropriate acronym, as follows: [DSA-SS/CC] - For applications listed in Section 1.9.2.2. [OSHPD 1R, 2 &amp; 5] Office of Statewide Hospital Planning and Development (OSHPD) amendments appear in this chapter preceded by the appropriate acronym, as follows: [OSHPD 1R] - For applications listed in Section 1.10.1.[OSHPD 2] - For applications listed in Section 1.10.2.[OSHPD 5] - For applications listed in Section 1.10.5."
2101.1.4,Section 2101 General,Reference to Other Chapters,"[DSA-SS/CC] Where reference within this chapter is made to sections in Chapters 17 and 18, the provisions in Chapters 17A and 18A respectively shall apply instead."
2101.1.5,Section 2101 General,Additional Amendments,[DSA-SS/CC] See Section 2115 for additional requirements.
2101.2,Section 2101 General,Design Methods,"Masonry shall comply with the provisions of TMS 402, TMS 403 or TMS 404 as well as applicable requirements of this chapter. [OSHPD 1R, 2 &amp; 5] TMS 403 Not permitted by OSHPD."
2101.2.1,Section 2101 General,Masonry Veneer,Masonry veneer shall comply with the provisions of Chapter 14.
2101.2.2,Section 2101 General,Prohibition,"[OSHPD 1R, 2 &amp; 5] The following design methods, systems and materials in TMS402/602 are not permitted by OSHPD:Unreinforced masonry.Autoclaved Aerated Concrete (AAC) Masonry.Empirical design of masonry.Adobe construction.Ordinary reinforced masonry shear walls.Intermediate reinforced masonry shear walls.Prestressed masonry shear walls.Direct design of masonry.Design of masonry infill.Prescriptive design of masonry partition walls.Limit design method.Glass fiber reinforced polymer (GFRP) reinforced masonry."
2101.3,Section 2101 General,Special Inspection,"The special inspection of masonry shall be as defined in Chapter 17, or an itemized testing and inspection program shall be provided that meets or exceeds the requirements of Chapter 17."
2102,Chapter 21 Masonry,Notations,
2102.1,Section 2102 Notations,General,"The following notations are used in the chapter: NOTATIONS. db = Diameter of reinforcement, inches (mm). Fs = Allowable tensile or compressive stress in reinforcement, psi (MPa). fr = Modulus of rupture, psi (MPa). fs = Computed stress in reinforcement due to design loads, psi (MPa). Ls = Distance between supports, inches (mm). ld = Required development length or lap length of reinforcement, inches (mm). P = The applied load at failure, pounds (N). St = Thickness of the test specimen measured parallel to the direction of load, inches (mm). Sw = Width of the test specimen measured parallel to the loading cylinder, inches (mm)."
2103,Chapter 21 Masonry,Masonry Construction Materials,
2103.1,Section 2103 Masonry Construction Materials,Masonry Units,"Concrete masonry units, clay or shale masonry units, stone masonry units, glass unit masonry and AAC masonry units shall comply with Article 2.3 of TMS 602. Architectural cast stone shall conform to TMS 504. [OSHPD 1R, 2 &amp; 5] Architectural cast stone construction shall be considered as an alternative system.Exception: Structural clay tile for nonstructural use in fireproofing of structural members and in wall furring shall not be required to meet the compressive strength specifications. The fire-resistance rating shall be determined in accordance with ASTM E119 or UL 263 and shall comply with the requirements of Table 705.5."
2103.1.1,Section 2103 Masonry Construction Materials,Second-Hand Units,"Second-hand masonry units shall not be reused unless they conform to the requirements of new units. The units shall be of whole, sound materials and free from cracks and other defects that will interfere with proper laying or use. Old mortar shall be cleaned from the unit before reuse."
2103.2,Section 2103 Masonry Construction Materials,Mortar,"Mortar for masonry construction shall comply with Section 2103.2.1, 2103.2.2, 2103.2.3 or 2103.2.4."
2103.2.1,Section 2103 Masonry Construction Materials,Masonry Mortar,Mortar for use in masonry construction shall conform to Articles 2.1 and 2.6 A of TMS 602.
2103.2.2,Section 2103 Masonry Construction Materials,Surface-Bonding Mortar,Surface-bonding mortar shall comply with ASTM C887. Surface bonding of concrete masonry units shall comply with ASTM C946.
2103.2.3,Section 2103 Masonry Construction Materials,Mortars for Ceramic Wall and Floor Tile,"Portland cement mortars for installing ceramic wall and floor tile shall comply with ANSI A108.1A and ANSI A108.1B and be of the compositions indicated in Table 2103.2.3.TABLE 2103.2.3CERAMIC TILE MORTAR COMPOSITIONS LOCATION MORTAR COMPOSITION Walls Scratchcoat 1 cement; 1/5 hydrated lime; 4 dry or 5 damp sand Setting bed and leveling coat 1 cement; 1/2 hydrated lime; 5 damp sand to 1 cement; 1 hydrated lime, 7 damp sand Floors Setting bed 1 cement; 1/10 hydrated lime; 5 dry or 6 damp sand; or 1 cement; 5 dry or 6 damp sand Ceilings Scratchcoat and sand bed 1 cement; 1/2 hydrated lime; 21/2 dry sand or 3 damp sand"
2103.2.3.1,Section 2103 Masonry Construction Materials,Dry-Set Portland Cement Mortars,"Premixed prepared Portland cement mortars, which require only the addition of water and are used in the installation of ceramic tile, shall comply with ANSI A118.1. The shear bond strength for tile set in such mortar shall be as required in accordance with ANSI A118.1. Tile set in dry-set Portland cement mortar shall be installed in accordance with ANSI A108.5."
2103.2.3.2,Section 2103 Masonry Construction Materials,Latex-Modified Portland Cement Mortar,Latex-modified Portland cement thin-set mortars in which latex is added to dry-set mortar as a replacement for all or part of the gauging water that are used for the installation of ceramic tile shall comply with ANSI A118.4. Tile set in latex-modified Portland cement shall be installed in accordance with ANSI A108.5.
2103.2.3.3,Section 2103 Masonry Construction Materials,Epoxy Mortar,Ceramic tile set and grouted with chemical-resistant epoxy shall comply with ANSI A118.3. Tile set and grouted with epoxy shall be installed in accordance with ANSI A108.6.
2103.2.3.4,Section 2103 Masonry Construction Materials,Furan Mortar and Grout,Chemical-resistant furan mortar and grout that are used to install ceramic tile shall comply with ANSI A118.5. Tile set and grouted with furan shall be installed in accordance with ANSI A108.8.
2103.2.3.5,Section 2103 Masonry Construction Materials,Modified Epoxy-Emulsion Mortar and Grout,Modified epoxy-emulsion mortar and grout that are used to install ceramic tile shall comply with ANSI A118.8. Tile set and grouted with modified epoxy-emulsion mortar and grout shall be installed in accordance with ANSI A108.9.
2103.2.3.6,Section 2103 Masonry Construction Materials,Organic Adhesives,Water-resistant organic adhesives used for the installation of ceramic tile shall comply with ANSI A136.1. The shear bond strength after water immersion shall be not less than 40 psi (275 kPa) for Type I adhesive and not less than 20 psi (138 kPa) for Type II adhesive when tested in accordance with ANSI A136.1. Tile set in organic adhesives shall be installed in accordance with ANSI A108.4.
2103.2.3.7,Section 2103 Masonry Construction Materials,Portland Cement Grouts,Portland cement grouts used for the installation of ceramic tile shall comply with ANSI A118.6. Portland cement grouts for tile work shall be installed in accordance with ANSI A108.10.
2103.2.4,Section 2103 Masonry Construction Materials,Mortar for Adhered Masonry Veneer,Mortar for use with adhered masonry veneer shall conform to Section 13.3 of TMS 402.
2103.3,Section 2103 Masonry Construction Materials,Grout,Grout shall comply with Article 2.2 of TMS 602.
2103.4,Section 2103 Masonry Construction Materials,Metal Reinforcement and Accessories,"Metal reinforcement and accessories shall conform to Article 2.4 of TMS 602. Where unidentified reinforcement [OSHPD 1R, 2 &amp; 5], or bar reinforcement without mill certification, is approved for use, not less than three tension and three bending tests shall be made on representative specimens of the reinforcement from each shipment and grade of reinforcing steel proposed for use in the work. [OSHPD 1R, 2 &amp; 5] Alternatively, the frequency of sampling for unidentifiable reinforcing bars specified in Section 1910.2 can be used."
2103.5,Section 2103 Masonry Construction Materials,Air Entrainment,"[OSHPD 1R, 2 &amp; 5] Air-entraining materials or air-entraining admixtures shall not be used in grout."
2103.6,Section 2103 Masonry Construction Materials,Specified Compressive Strength of Masonry and Grout,"[OSHPD 1R, 2 &amp; 5] Replace TMS 402 Table 4.3.1 by the following:TABLE 4.3.1SPECIFIED COMPRESSIVE STRENGTH REQUIREMENTS TYPE OF MASONRY SPECIFIED COMPRESSIVE STRENGTH OF MASONRY SPECIFIED COMPRESSIVE STRENGTH OF GROUT Concrete masonry 2,000 psi (13.79 MPa) ≤ f'm ≤ 3,000 psi (20.68 MPa) f'g ≥ f'm ≤ 5,000 psi (34.47 MPa) Clay masonry 1,500 psi (10.34 MPa) ≤ f'm ≤ 4,500 psi (31.02 MPa) f'g ≤ 6,000 (41.37 MPa)"
2104,Chapter 21 Masonry,Construction,
2104.1,Section 2104 Construction,Masonry Construction,Masonry construction shall comply with the requirements of Sections 2104.1.1 and 2104.1.2 and with the requirements of either TMS 602 or TMS 604.
2104.1.1,Section 2104 Construction,Support on Wood,Masonry shall not be supported on wood girders or other forms of wood construction except as permitted in Section 2304.13.
2104.1.2,Section 2104 Construction,Molded Cornices,"Unless structural support and anchorage are provided to resist the overturning moment, the center of gravity of projecting masonry or molded cornices shall lie within the middle one-third of the supporting wall. Terra cotta and metal cornices shall be provided with a structural frame of approved noncombustible material anchored in an approved manner."
2104.2,Section 2104 Construction,Reinforced Grouted Masonry,"[OSHPD 1R, 2 &amp; 5]"
2104.2.1,Section 2104 Construction,"TMS 602, Article 3.3 B Placing Mortar and Units","Modify TMS 602, Article 3.3 B.2.c as follows: Remove masonry protrusions extending greater than 1/4 inch (6.4 mm) into cells or cavities to be grouted."
2104.2.2,Section 2104 Construction,"TMS 602, Article 3.4 B Reinforcement","Modify TMS 602, Article 3.4 B.1 through Article 3.4 B.3 as follows:Support reinforcement to prevent displacement caused by construction loads or by placement of grout or mortar. Reinforcement and embedded items shall be clean, properly positioned and securely anchored against movement prior to grouting. Bolts shall be accurately set with templates or by approved equivalent means and held in place to prevent dislocation during grouting.Completely embed reinforcing bars and embedded items in grout in accordance with Article 3.5.Maintain clear distance between reinforcing bars and the interior of masonry unit or formed surface of at least 1/2 inch(12.7 mm) and a minimum of one bar diameter, except where cross webs of hollow units are used as supports for horizontal reinforcement."
2104.2.3,Section 2104 Construction,"TMS 602, Article 3.4 E Anchor Bolts","Replace TMS 602, Article 3.4 E.3 and add Articles 3.4 E.5 and 3.4 E.6 as follows: Anchor bolts in the wythe or face shells of hollow masonry units shall be positioned to maintain a minimum of 1/2 inch (12.7 mm) of grout between the bolt circumference, the wythe or the face shell. For the portion of the bolt that is within the grouted cell, maintain a clear distance between the bolt and the face of masonry unit and between the head of the bolt and the formed surface of grout of at least 1/4 inch (6.4 mm) when using fine grout and at least 1/2 inch (12.7 mm) when using coarse grout. Bolts shall be solidly embedded in grout. Bent bar anchor bolts shall not be allowed. The maximum size anchor shall be 1/2-inch (12.7 mm) diameter for 6-inch (152 mm) nominal masonry, 3/4- inch (19.1 mm) diameter for 8-inch (203 mm) nominal masonry, 7/8-inch (22.2 mm) diameter for 10-inch (254 mm) nominal masonry, and 1-inch (25.4 mm) diameter for 12-inch (305 mm) nominal masonry. Bolts shall be accurately set with templates or by approved equivalent means and held in place to prevent dislocation during grouting."
2104.2.4,Section 2104 Construction,"TMS 602, Article 3.5 F.1 Grout Key","Replace TMS 602, Article 3.5 F.1 as follows:Between grout pours or where grouting has been stopped more than an hour, a horizontal construction joint shall be formed by terminating grout a minimum of 11/2 inches (38.1 mm) and a maximum of one-half the masonry unit height below a mortar joint, except at the top of the wall. Where bond beams occur, the grout pour shall be terminated a minimum of 1/2 inch (12.7 mm) below the mortar joint. Horizontal reinforcement shall be placed in bond beam units with a minimum grout cover of 1 inch (25.4 mm) above reinforcing steel for each grout pour."
2104.3,Section 2104 Construction,Aluminum Equipment,"[OSHPD 1R, 2 &amp; 5] Grout shall not be handled nor pumped utilizing aluminum equipment unless it can be demonstrated with the materials and equipment to be used that there will be no deleterious effect on the strength of the grout."
2105,Chapter 21 Masonry,Quality Assurance,
2105.1,Section 2105 Quality Assurance,General,A quality assurance program shall be used to ensure that the constructed masonry is in compliance with the approved construction documents. The quality assurance program shall comply with the inspection and testing requirements of Chapter 17 and TMS 602.
2105.2,Section 2105 Quality Assurance,"Compressive Strength, f'm","[OSHPD 1R, 2 &amp; 5] Testing of masonry shall be provided in accordance with TMS 602, Article 1.4 B. Exception: Where values of f'm greater than 2,000 psi (13.79 MPa) are used in the design of reinforced grouted multi-wythe masonry and reinforced hollow unit masonry, they shall be based on prism test results in accordance with TMS 602, Article 1.4 B.3 submitted by the architect or engineer to the enforcement agency which demonstrate the ability of the proposed construction to meet prescribed performance criteria for strength exceed 3,000 psi (20.7 MPa). The architect or structural engineer shall establish a method of quality control of the masonry construction acceptable to the enforcement agency which shall be described in the contract documents. Verification of compliance with the requirements for the specified strength of masonry during construction shall be provided using the prism test method in accordance with TMS 602, Article 1.4 B.3. Verification of compliance with the specified compressive strength prior to the start of construction shall be obtained by using the prism test method in accordance with TMS 602, Article 1.4 B.3."
2105.3,Section 2105 Quality Assurance,Mortar and Grout Tests,"[OSHPD 1R, 2 &amp; 5] TMS 602, Article 1.4 B Compressive strength determination. Modify TMS 602, Article 1.4 B as follows by adding: Additional testing requirements: At the beginning of all masonry work, at least one test sample of the mortar shall be taken on 3 successive working days and at 1-week intervals thereafter. Where mortar is based on a proportion specification, mortar shall be sampled and tested during construction in accordance with ASTM C780, including Annex 4, to verify the proportions specified in ASTM C270, Table 2. Where mortar is based on a property specification, mortar shall be laboratory prepared and tested prior to construction in accordance with ASTM C780 to verify the properties specified in ASTM C270, Table 1 and field sampled and tested during construction in accordance with ASTM C780 to verify the proportions with the laboratory tests. Mortar sampling and testing is not required for preblended mortars in conformance with ASTM C1714 with a material certificate. Samples of grout shall be taken for each mix design, each day grout is placed, and not less than every 5,000 square feet (464.5 m2) of masonry wall area. They shall meet the minimum strength requirement given in ASTM C476/TMS 602 Section 2.2 or greater as specified. Additional samples shall be taken whenever any change in materials or job conditions occur, as determined by the building official. Test specimens for mortar and grout shall be made as set forth in ASTM C780/C1586 and ASTM C1019. When the prism test method is used in accordance with TMS 602, Article 1.4 B.3 during construction, the tests in this section are not required. Exception: For nonbearing nonshear masonry walls not exceeding total wall height of 12 feet (3658 mm) above top of foundation, mortar test shall be permitted to be limited to those at the beginning of masonry work for each mix design."
2105.4,Section 2105 Quality Assurance,Masonry Core Testing,"[OSHPD 1R, 2 &amp; 5] Two cores shall be taken from each building for each 5,000 square feet (465 m2) of the masonry wall area or fraction thereof. The approved agency shall perform or observe the coring of the masonry walls and sample locations shall be subject to approval of the registered design professional. Core samples shall comply with the following: Cored no sooner than 7 days after grouting of the selected area; Be a minimum of 33/4 inch (95.25 mm) nominal diameter; and Sampled in such a manner as to exclude any masonry unit webs, mortar joint or reinforcing steel. If all cells contain reinforcement, alternate core locations or means to detect voids or delamination shall be selected by the registered design professional and approved by the building official. Visual examination of all cores shall be made by an approved agency and the condition of the cores reported as required by the California Administrative Code. Shear tests of both joints between the grout core and the outside wythes or face shell of the masonry shall be made 28 days after grouting of the sample area using a shear test apparatus acceptable to the enforcement agency. Core samples shall not be soaked before testing. Core samples to be tested shall be stored in sealed plastic bags or nonabsorbent containers immediately after coring and for at least 5 days prior to testing. The average unit shear value for each pair of cores (4 shear tests) from each 5,000 square feet of wall area (or less) on the cross section of core shall not be less than 2.5 √f' m psi. All cores shall be submitted to an approved agency for examination, including core specimens where a face shell separates fromthe grout core during the coring operation. The approved agency shall report the location where each core was taken, report the findings of their visual examination of each core, identify which cores were selected for shear testing, and report the results of the shear tests. Additional cores shall be permitted to be taken at the direction of the registered design professional and with approval of the enforcement agency. Exceptions: Core sampling and testing is not required for non-bearing nonshear masonry walls, not exceeding total wall height of 12 feet above the top of the foundation, built with single-wythe hollow unit concrete masonry that attaches opposite face shells using webs cast as single unit, when designed using an f 'm not exceeding 2,000 psi (13.79 MPa). An infrared thermographic survey or other nondestructive test procedures shall be permitted to be approved as an alternative system to detect voids or delamination in grouted masonry in conjunction with reduced core sampling and testing. A minimum of two cores shall be taken from each building for each 10,000 square feet (930 m2) of the wall."
2106,Chapter 21 Masonry,Seismic Design,
2106.1,Section 2106 Seismic Design,Seismic Design Requirements for Masonry,Masonry structures and components shall comply with the requirements in Chapter 7 of TMS 402 depending on the structure's seismic design category.
2106.1.1,Section 2106 Seismic Design,"TMS 402, Sections 5.4.1.4","[OSHPD 1R, 2 &amp; 5] Replace TMS 402, Section 5.4.1.4 Items (a), (b), (d) &amp; (e) by the following: a. Vertical reinforcement shall be enclosed by lateral ties at least 3/8 inch (9.5 mm) in diameter. b. Vertical spacing of lateral ties, over the full height of the column, shall not exceed 8 longitudinal bar diameters, 24 lateral tie bar diameters, 8 inches (203 mm), or one-half the least cross-sectional dimension of the member. d. Lateral ties shall be embedded in grout. e. Lateral ties shall be located vertically not more than one-half lateral tie spacing above the top of the footing or slab in any story, and shall be spaced not more than one-half a lateral tie spacing nor 2 inches (51 mm) below the lowest horizontal reinforcement in beam, girder, slab, or drop panel above. The top tie shall be within 2 inches (51 mm) of the top of the column."
2106.1.2,Section 2106 Seismic Design,"TMS 402, Chapter 5","[OSHPD 1R, 2 &amp; 5] Add TMS 402, Section 5.7 as follows:5.7 — Lateral Support of Members5.7.1 — Lateral support of masonry may be provided by cross walls, columns, pilasters, counterforts or buttresses where spanning horizontally, or by floors, beams, girts or roofs where spanning vertically. Where walls are supported laterally by vertical elements, the stiffness of each vertical element shall exceed that of the tributary area of the wall."
