id,section,title,ifc_type,occupancy,design_phase,code_category,primary_responsibility,body
407.2.3.1,407 Elevators,Floor Designation,Elevator|Door,Assembly (A)|Business (B)|Educational (E)|Institutional (I)|Residential (R),cd|ca,accessibility,architect,Floor designations complying with 703.2 and 703.4.1 shall be provided on both jambs of elevator hoistway entrances. Floor designations shall be provided in both tactile characters and braille. Tactile characters shall be 2 inches (51 mm) high minimum. A tactile star shall be provided on both jambs at the main entry level.
407.2.3.2,407 Elevators,Car Designations,Elevator|Door,Assembly (A)|Business (B)|Educational (E)|Institutional (I)|Residential (R),sd|dd|cd,accessibility,architect,Destination-oriented elevators shall provide tactile car identification complying with 703.2 on both jambs of the hoistway immediately below the floor designation. Car designations shall be provided in both tactile characters and braille. Tactile characters shall be 2 inches (51 mm) high minimum.
407.3,407 Elevators,Elevator Door Requirements,Elevator|Door,Assembly (A)|Business (B)|Educational (E)|Factory And Industrial (F)|Residential (R),sd|dd|cd,elevators_conveying_systems,elevator_consultant,Hoistway and car doors shall comply with 407.3.
407.3.1,407 Elevators,Type,Elevator|Door,Assembly (A)|Business (B)|Educational (E)|Institutional (I)|Residential (R),sd|dd|cd,elevators_conveying_systems,elevator_consultant,Elevator doors shall be the horizontal sliding type. Car gates shall be prohibited.
407.3.2,407 Elevators,Operation,Elevator|Door,Assembly (A)|Business (B)|Educational (E)|Institutional (I)|Residential (R),sd|dd|cd,elevators_conveying_systems,elevator_consultant,Elevator hoistway and car doors shall open and close automatically.
407.3.3,407 Elevators,Reopening Device,Elevator|Door,Assembly (A)|Business (B)|Educational (E)|Institutional (I)|Residential (R),sd|dd|cd,elevators_conveying_systems,elevator_consultant,Elevator doors shall be provided with a reopening device complying with 407.3.3 that shall stop and reopen a car door and hoistway door automatically if the door becomes obstructed by an object or person.
407.3.3.1,407 Elevators,Height,Door|Elevator,Assembly (A)|Business (B)|Educational (E)|Institutional (I)|Residential (R),sd|dd|cd,accessibility,architect,The device shall be activated by sensing an obstruction passing through the opening at 5 inches (125 mm) nominal and 29 inches (735 mm) nominal above the finish floor.
407.3.3.2,407 Elevators,Contact,Door|Elevator,Assembly (A)|Business (B)|Institutional (I)|Residential (R)|Mercantile (M),sd|dd|cd,elevators_conveying_systems,elevator_consultant,"The device shall not require physical contact to be activated, although contact is permitted to occur before the door reverses."
407.3.3.3,407 Elevators,Duration,Door,Assembly (A)|Business (B)|Educational (E)|Residential (R)|Institutional (I),sd|dd|cd,accessibility,architect,Door reopening devices shall remain effective for 20 seconds minimum.
407.3.4,407 Elevators,Door and Signal Timing,Elevator|Door,Assembly (A)|Business (B)|Educational (E)|Institutional (I)|Residential (R),sd|dd|cd,elevators_conveying_systems,elevator_consultant,The minimum acceptable time from notification that a car is answering a call or notification of the car assigned at the means for the entry of destination information until the doors of that car start to close shall be calculated from the following equation:
407.3.5,407 Elevators,Door Delay,Door|Elevator,Assembly (A)|Business (B)|Educational (E)|Factory And Industrial (F)|Residential (R),sd|dd|cd,elevators_conveying_systems,elevator_consultant,Elevator doors shall remain fully open in response to a car call for 3 seconds minimum.
407.3.6,407 Elevators,Width,Door|Elevator,Assembly (A)|Business (B)|Educational (E)|Institutional (I)|Residential (R),sd|dd|cd,elevators_conveying_systems,architect,The width of elevator doors shall comply with Table 407.4.1.
407.4,407 Elevators,Elevator Car Requirements,Elevator,Assembly (A)|Business (B)|Educational (E)|Institutional (I)|Residential (R),sd|dd|cd,elevators_conveying_systems,elevator_consultant,Elevator cars shall comply with 407.4.
407.4.1,407 Elevators,Car Dimensions,Elevator|Door,Assembly (A)|Business (B)|Educational (E)|Institutional (I)|Residential (R),sd|dd|cd,elevators_conveying_systems,elevator_consultant,Inside dimensions of elevator cars and clear width of elevator doors shall comply with Table 407.4.1.
407.4.2,407 Elevators,Floor Surfaces,Elevator|Slab|Covering,Assembly (A)|Business (B)|Educational (E)|Residential (R)|Institutional (I),sd|dd|cd,accessibility,architect,Floor surfaces in elevator cars shall comply with 302 and 303.
407.4.3,407 Elevators,Platform to Hoistway Clearance,Elevator,Assembly (A)|Business (B)|Educational (E)|Residential (R)|Institutional (I),sd|dd|cd,elevators_conveying_systems,elevator_consultant,The clearance between the car platform sill and the edge of any hoistway landing shall be 1 1/4 inch (32 mm) maximum.
407.4.4,407 Elevators,Leveling,Elevator,Assembly (A)|Business (B)|Educational (E)|Institutional (I)|Residential (R),sd|dd|cd,elevators_conveying_systems,elevator_consultant,Each car shall be equipped with a self-leveling feature that will automatically bring and maintain the car at floor landings within a tolerance of 1/2 inch (13 mm) under rated loading to zero loading conditions.
407.4.5,407 Elevators,Illumination,Elevator|Door|Slab,Assembly (A)|Business (B)|Educational (E)|Institutional (I)|Residential (R),sd|dd|cd,elevators_conveying_systems,electrical_engineer,"The level of illumination at the car controls, platform, car threshold and car landing sill shall be 5 foot candles (54 lux) minimum."
407.4.6,407 Elevators,Elevator Car Controls,Elevator,Assembly (A)|Business (B)|Institutional (I)|Residential (R)|Mercantile (M),sd|dd|cd,accessibility,architect,"Where provided, elevator car controls shall comply with 407.4.6 and 309.4."
407.4.6.1,407 Elevators,Location,Wall|Door|Window|Buildingelementproxy,Assembly (A)|Business (B)|Educational (E)|Institutional (I)|Residential (R),sd|dd|cd,accessibility,architect,Controls shall be located within one of the reach ranges specified in 308.
407.4.6.2,407 Elevators,Buttons,Elevator,Assembly (A)|Business (B)|Educational (E)|Institutional (I)|Residential (R),sd|dd|cd,accessibility,architect,Car control buttons with floor designations shall comply with 407.4.6.2 and shall be raised or flush.
407.4.6.2.1,407 Elevators,Size,Elevator,Assembly (A)|Business (B)|Educational (E)|Institutional (I)|Residential (R),sd|dd|cd,accessibility,architect,Buttons shall be 3/4 inch (19 mm) minimum in their smallest dimension.
407.4.6.2.2,407 Elevators,Arrangement,Elevator,Assembly (A)|Business (B)|Educational (E)|Institutional (I)|Residential (R),sd|dd|cd,elevators_conveying_systems,elevator_consultant,Buttons shall be arranged with numbers in ascending order. When two or more columns of buttons are provided they shall read from left to right.
407.4.6.3,407 Elevators,Keypads,Elevator,Assembly (A)|Business (B)|Educational (E)|Residential (R)|Institutional (I),dd|cd,accessibility,elevator_consultant,Car control keypads shall be in a standard telephone keypad arrangement and shall comply with 407.4.7.2.
407.4.6.4,407 Elevators,Emergency Controls,Door|Wall,Institutional (I),sd|dd|cd,accessibility,architect,Emergency controls shall comply with 407.4.6.4.
407.4.6.4.1,407 Elevators,Height,Elevator,Assembly (A)|Business (B)|Educational (E)|Institutional (I)|Residential (R),sd|dd|cd,accessibility,architect,Emergency control buttons shall have their centerlines 35 inches (890 mm) minimum above the finish floor.
407.4.6.4.2,407 Elevators,Location,Elevator,Assembly (A)|Business (B)|Educational (E)|Residential (R)|Institutional (I),dd|cd,elevators_conveying_systems,elevator_consultant,"Emergency controls, including the emergency alarm, shall be grouped at the bottom of the panel."
407.4.7,407 Elevators,Designations and Indicators of Car Controls,Elevator,Assembly (A)|Business (B)|Educational (E)|Institutional (I)|Residential (R),dd|cd,accessibility,architect,Designations and indicators of car controls shall comply with 407.4.7.
407.4.7.1,407 Elevators,Buttons,Elevator,Assembly (A)|Business (B)|Educational (E)|Institutional (I)|Residential (R),sd|dd|cd,elevators_conveying_systems,elevator_consultant,Car control buttons shall comply with 407.4.7.1.
407.4.7.1.1,407 Elevators,Type,Elevator,Assembly (A)|Business (B)|Educational (E)|Institutional (I)|Residential (R),sd|dd|cd,accessibility,architect,Control buttons shall be identified by tactile characters complying with 703.2.
407.4.7.1.2,407 Elevators,Location,Elevator,Assembly (A)|Business (B)|Educational (E)|Institutional (I)|Residential (R),sd|dd|cd,accessibility,architect,Raised character and braille designations shall be placed immediately to the left of the control button to which the designations apply.
407.4.7.1.3,407 Elevators,Symbols,Elevator,Assembly (A)|Business (B)|Educational (E)|Institutional (I)|Residential (R),sd|dd|cd,accessibility,architect,"The control button for the emergency stop, alarm, door open, door close, main entry floor, and phone, shall be identified with tactile symbols as shown in Table 407.4.7.1.3."
407.4.7.1.4,407 Elevators,Visible Indicators,Elevator,Assembly (A)|Business (B)|Institutional (I)|Residential (R)|Mercantile (M),sd|dd|cd,elevators_conveying_systems,elevator_consultant,Buttons with floor designations shall be provided with visible indicators to show that a call has been registered. The visible indication shall extinguish when the car arrives at the designated floor.
407.4.7.2,407 Elevators,Keypads,Elevator,Assembly (A)|Business (B)|Educational (E)|Institutional (I)|Residential (R),sd|dd|cd,accessibility,architect,Keypads shall be identified by characters complying with 703.5 and shall be centered on the corresponding keypad button. The number five key shall have a single raised dot. The dot shall be 0.118 inch (3 mm) to 0.120 inch (3.05 mm) base diameter and in other aspects comply with Table 703.3.1.
407.4.8,407 Elevators,Car Position Indicators,Elevator,Assembly (A)|Business (B)|Educational (E)|Institutional (I)|Residential (R),sd|dd|cd,elevators_conveying_systems,elevator_consultant,Audible and visible car position indicators shall be provided in elevator cars.
407.4.8.1,407 Elevators,Visible Indicators,Elevator,Assembly (A)|Business (B)|Educational (E)|Institutional (I)|Residential (R),dd|cd,elevators_conveying_systems,elevator_consultant,Visible indicators shall comply with 407.4.8.1.
407.4.8.1.1,407 Elevators,Size,Wall|Door,Assembly (A)|Business (B)|Educational (E)|Residential (R)|Institutional (I),sd|dd|cd,accessibility,architect,Characters shall be 1/2 inch (13 mm) high minimum.
407.4.8.1.2,407 Elevators,Location,Elevator|Door,Assembly (A)|Business (B)|Educational (E)|Factory And Industrial (F)|Residential (R),sd|dd|cd,elevators_conveying_systems,elevator_consultant,Indicators shall be located above the car control panel or above the door.
407.4.8.1.3,407 Elevators,Floor Arrival,Elevator,Assembly (A)|Business (B)|Educational (E)|Residential (R)|Institutional (I),sd|dd|cd,elevators_conveying_systems,elevator_consultant,"As the car passes a floor and when a car stops at a floor served by the elevator, the corresponding character shall illuminate."
407.4.8.1.4,407 Elevators,Destination Indicator,Elevator,Assembly (A)|Business (B)|Institutional (I)|Residential (R)|Mercantile (M),sd|dd|cd,elevators_conveying_systems,elevator_consultant,"In destination-oriented elevators, a display shall be provided in the car with visible indicators to show car destinations."
407.4.8.2,407 Elevators,Audible Indicators,Elevator,Assembly (A)|Business (B)|Educational (E)|Institutional (I)|Residential (R),sd|dd|cd,accessibility,architect,Audible indicators shall comply with 407.4.8.2.
407.4.8.2.1,407 Elevators,Signal Type,Elevator,Assembly (A)|Business (B)|Educational (E)|Institutional (I)|Residential (R),sd|dd|cd,elevators_conveying_systems,elevator_consultant,The signal shall be an automatic verbal annunciator which announces the floor at which the car is about to stop.
407.4.8.2.2,407 Elevators,Signal Level,Buildingelementproxy,Assembly (A)|Business (B)|Educational (E)|Institutional (I)|Residential (R),sd|dd|cd,fire_protection_alarm_systems,fire_protection_engineer,"The verbal annunciator shall be 10 dB minimum above ambient, but shall not exceed 80 dB, measured at the annunciator."
407.4.8.2.3,407 Elevators,Frequency,Buildingelementproxy,Assembly (A)|Business (B)|Educational (E)|Institutional (I)|Residential (R),dd|cd,fire_protection_alarm_systems,fire_protection_engineer,The verbal annunciator shall have a frequency of 300 Hz minimum to 3000 Hz maximum.
407.4.9,407 Elevators,Emergency Communication,Buildingelementproxy|Door,Assembly (A)|Business (B)|Institutional (I)|Residential (R),sd|dd|cd,accessibility,architect,Emergency two-way communication systems shall comply with 308. Tactile symbols and characters shall be provided adjacent to the device and shall comply with 703.2.
408.1,408 Limited-Use/Limited-Application Elevators,General,Elevator,Assembly (A)|Business (B)|Educational (E)|Institutional (I)|Residential (R),sd|dd|cd,elevators_conveying_systems,elevator_consultant,"Limited-use/limited-application elevators shall comply with 408 and with ASME A17.1 (incorporated by reference, see “Referenced Standards” in Chapter 1). They shall be passenger elevators as classified by ASME A17.1. Elevator operation shall be automatic."
408.2,408 Limited-Use/Limited-Application Elevators,Elevator Landings,Elevator|Slab|Ramp|Door,Business (B)|Institutional (I)|Residential (R),sd|dd|cd,elevators_conveying_systems,architect,Landings serving limited-use/limited-application elevators shall comply with 408.2.
408.2.1,408 Limited-Use/Limited-Application Elevators,Call Buttons,Elevator,Assembly (A)|Business (B)|Educational (E)|Institutional (I)|Residential (R),sd|dd|cd,elevators_conveying_systems,architect,Elevator call buttons and keypads shall comply with 407.2.1.
408.2.2,408 Limited-Use/Limited-Application Elevators,Hall Signals,Elevator,Assembly (A)|Business (B)|Educational (E)|Institutional (I)|Mercantile (M),dd|cd,elevators_conveying_systems,elevator_consultant,Hall signals shall comply with 407.2.2.
408.2.3,408 Limited-Use/Limited-Application Elevators,Hoistway Signs,Elevator|Wall|Door,Assembly (A)|Business (B)|Educational (E)|Institutional (I)|Residential (R),dd|cd,accessibility,architect,Signs at elevator hoistways shall comply with 407.2.3.1.
408.3,408 Limited-Use/Limited-Application Elevators,Elevator Doors,Elevator|Door,Assembly (A)|Business (B)|Educational (E)|Institutional (I)|Residential (R),sd|dd|cd,elevators_conveying_systems,elevator_consultant,Elevator hoistway doors shall comply with 408.3.
408.3.1,408 Limited-Use/Limited-Application Elevators,Sliding Doors,Door|Elevator,Assembly (A)|Business (B)|Educational (E)|Institutional (I)|Residential (R),sd|dd|cd,elevators_conveying_systems,elevator_consultant,Sliding hoistway and car doors shall comply with 407.3.1 through 407.3.3 and 408.4.1.
408.3.2,408 Limited-Use/Limited-Application Elevators,Swinging Doors,Door|Elevator,Assembly (A)|Business (B)|Residential (R)|Institutional (I),sd|dd|cd,elevators_conveying_systems,elevator_consultant,"Swinging hoistway doors shall open and close automatically and shall comply with 404, 407.3.2 and 408.3.2."
408.3.2.1,408 Limited-Use/Limited-Application Elevators,Power Operation,Door,Assembly (A)|Business (B)|Educational (E)|Institutional (I)|Mercantile (M),sd|dd|cd,accessibility,architect,"Swinging doors shall be power-operated and shall comply with ANSI/BHMA A156.19 (1997 or 2002 edition) (incorporated by reference, see “Referenced Standards” in Chapter 1)."
408.3.2.2,408 Limited-Use/Limited-Application Elevators,Duration,Door,Assembly (A)|Business (B)|Educational (E)|Institutional (I)|Residential (R),sd|dd|cd,accessibility,architect,Power-operated swinging doors shall remain open for 20 seconds minimum when activated.
408.4,408 Limited-Use/Limited-Application Elevators,Elevator Cars,Elevator,Assembly (A)|Business (B)|Educational (E)|Institutional (I)|Residential (R),sd|dd|cd,elevators_conveying_systems,elevator_consultant,Elevator cars shall comply with 408.4.
408.4.1,408 Limited-Use/Limited-Application Elevators,Car Dimensions and Doors,Elevator|Door,Assembly (A)|Business (B)|Educational (E)|Institutional (I)|Residential (R),sd|dd|cd,accessibility,architect,Elevator cars shall provide a clear width 42 inches (1065 mm) minimum and a clear depth 54 inches (1370 mm) minimum. Car doors shall be positioned at the narrow ends of cars and shall provide 32 inches (815 mm) minimum clear width.
408.4.2,408 Limited-Use/Limited-Application Elevators,Floor Surfaces,Elevator|Slab|Covering,Assembly (A)|Business (B)|Educational (E)|Residential (R)|Institutional (I),sd|dd|cd,accessibility,architect,Floor surfaces in elevator cars shall comply with 302 and 303.
408.4.3,408 Limited-Use/Limited-Application Elevators,Platform to Hoistway Clearance,Elevator|Wall,Assembly (A)|Business (B)|Educational (E)|Residential (R)|Institutional (I),dd|cd,elevators_conveying_systems,elevator_consultant,The platform to hoistway clearance shall comply with 407.4.3.
408.4.4,408 Limited-Use/Limited-Application Elevators,Leveling,Elevator,Assembly (A)|Business (B)|Educational (E)|Institutional (I)|Residential (R),sd|dd|cd,elevators_conveying_systems,elevator_consultant,Elevator car leveling shall comply with 407.4.4.
408.4.5,408 Limited-Use/Limited-Application Elevators,Illumination,Elevator,Assembly (A)|Business (B)|Educational (E)|Institutional (I)|Residential (R),sd|dd|cd,elevators_conveying_systems,elevator_consultant,Elevator car illumination shall comply with 407.4.5.
408.4.6,408 Limited-Use/Limited-Application Elevators,Car Controls,Elevator,Assembly (A)|Business (B)|Educational (E)|Institutional (I)|Residential (R),sd|dd|cd,accessibility,architect,Elevator car controls shall comply with 407.4.6. Control panels shall be centered on a side wall.
408.4.7,408 Limited-Use/Limited-Application Elevators,Designations and Indicators of Car Controls,Elevator,Assembly (A)|Business (B)|Educational (E)|Institutional (I)|Mercantile (M),sd|dd|cd,accessibility,architect,Designations and indicators of car controls shall comply with 407.4.7.
408.4.8,408 Limited-Use/Limited-Application Elevators,Emergency Communications,Elevator,Assembly (A)|Business (B)|Educational (E)|Institutional (I)|Residential (R),dd|cd,elevators_conveying_systems,elevator_consultant,Car emergency signaling devices complying with 407.4.9 shall be provided.
409.1,409 Private Residence Elevators,General,Elevator,Residential (R),sd|dd|cd,elevators_conveying_systems,elevator_consultant,"Private residence elevators that are provided within a residential dwelling unit required to provide mobility features complying with 809.2 through 809.4 shall comply with 409 and with ASME A17.1 (incorporated by reference, see “Referenced Standards” in Chapter 1). They shall be passenger elevators as classified by ASME A17.1. Elevator operation shall be automatic."
409.2,409 Private Residence Elevators,Call Buttons,Elevator,Assembly (A)|Business (B)|Educational (E)|Institutional (I)|Residential (R),sd|dd|cd,accessibility,architect,Call buttons shall be 3/4 inch (19 mm) minimum in the smallest dimension and shall comply with 309.
409.3,409 Private Residence Elevators,Elevator Doors,Elevator|Door,Assembly (A)|Business (B)|Educational (E)|Institutional (I)|Residential (R),sd|dd|cd,elevators_conveying_systems,elevator_consultant,"Hoistway doors, car doors, and car gates shall comply with 409.3 and 404."
409.3.1,409 Private Residence Elevators,Power Operation,Elevator|Door,Assembly (A)|Business (B)|Educational (E)|Institutional (I)|Residential (R),sd|dd|cd,elevators_conveying_systems,elevator_consultant,"Elevator car and hoistway doors and gates shall be power operated and shall comply with ANSI/BHMA A156.19 (1997 or 2002 edition) (incorporated by reference, see “Referenced Standards” in Chapter 1). Power operated doors and gates shall remain open for 20 seconds minimum when activated."
409.3.2,409 Private Residence Elevators,Location,Elevator|Door,Assembly (A)|Business (B)|Educational (E)|Institutional (I)|Residential (R),sd|dd|cd,accessibility,architect,Elevator car doors or gates shall be positioned at the narrow end of the clear floor spaces required by 409.4.1.
409.4,409 Private Residence Elevators,Elevator Cars,Elevator,Residential (R),sd|dd|cd,elevators_conveying_systems,architect,Private residence elevator cars shall comply with 409.4.
409.4.1,409 Private Residence Elevators,Inside Dimensions of Elevator Cars,Elevator,Assembly (A)|Business (B)|Educational (E)|Institutional (I)|Residential (R),sd|dd|cd,accessibility,architect,Elevator cars shall provide a clear floor space of 36 inches (915 mm) minimum by 48 inches (1220 mm) minimum and shall comply with 305.
409.4.2,409 Private Residence Elevators,Floor Surfaces,Elevator|Slab|Covering,Assembly (A)|Business (B)|Educational (E)|Residential (R)|Institutional (I),dd|cd,accessibility,architect,Floor surfaces in elevator cars shall comply with 302 and 303.
409.4.3,409 Private Residence Elevators,Platform to Hoistway Clearance,Elevator|Slab,Assembly (A)|Business (B)|Educational (E)|Institutional (I)|Residential (R),sd|dd|cd,elevators_conveying_systems,elevator_consultant,The clearance between the car platform and the edge of any landing sill shall be 1 1/2 inch (38 mm) maximum.
409.4.4,409 Private Residence Elevators,Leveling,Elevator,Assembly (A)|Business (B)|Educational (E)|Institutional (I)|Residential (R),dd|cd,elevators_conveying_systems,elevator_consultant,Each car shall automatically stop at a floor landing within a tolerance of 1/2 inch (13 mm) under rated loading to zero loading conditions.
409.4.5,409 Private Residence Elevators,Illumination Levels,Elevator,Assembly (A)|Business (B)|Educational (E)|Institutional (I)|Residential (R),sd|dd|cd,elevators_conveying_systems,elevator_consultant,Elevator car illumination shall comply with 407.4.5.
409.4.6,409 Private Residence Elevators,Car Controls,Elevator,Assembly (A)|Business (B)|Educational (E)|Institutional (I)|Residential (R),sd|dd|cd,accessibility,architect,"Elevator car control buttons shall comply with 409.4.6, 309.3, 309.4, and shall be raised or flush."
409.4.6.1,409 Private Residence Elevators,Size,Elevator,Assembly (A)|Business (B)|Educational (E)|Institutional (I)|Residential (R),sd|dd|cd,accessibility,architect,Control buttons shall be 3/4 inch (19 mm) minimum in their smallest dimension.
409.4.6.2,409 Private Residence Elevators,Location,Wall,Assembly (A)|Business (B)|Educational (E)|Institutional (I)|Residential (R),sd|dd|cd,accessibility,architect,"Control panels shall be on a side wall, 12 inches (305 mm) minimum from any adjacent wall."
409.4.7,409 Private Residence Elevators,Emergency Communications,Buildingelementproxy|Wall|Door,Assembly (A)|Business (B)|Educational (E)|Institutional (I)|Residential (R),sd|dd|cd,fire_protection_alarm_systems,fire_protection_engineer,Emergency two-way communication systems shall comply with 409.4.7.
409.4.7.1,409 Private Residence Elevators,Type,Elevator,Assembly (A)|Business (B)|Educational (E)|Institutional (I)|Residential (R),sd|dd|cd,elevators_conveying_systems,elevator_consultant,A telephone and emergency signal device shall be provided in the car.
409.4.7.2,409 Private Residence Elevators,Operable Parts,Buildingelementproxy,Assembly (A)|Business (B)|Educational (E)|Institutional (I)|Residential (R),sd|dd|cd,accessibility,architect,The telephone and emergency signaling device shall comply with 309.3 and 309.4.
409.4.7.3,409 Private Residence Elevators,Compartment,Door|Buildingelementproxy,Assembly (A)|Business (B)|Educational (E)|Institutional (I)|Residential (R),sd|dd|cd,accessibility,architect,"If the telephone or device is in a closed compartment, the compartment door hardware shall comply with 309."
409.4.7.4,409 Private Residence Elevators,Cord,Buildingelementproxy,Assembly (A)|Business (B)|Educational (E)|Institutional (I)|Residential (R),sd|dd|cd,accessibility,architect,The telephone cord shall be 29 inches (735 mm) long minimum.
410.1,410 Platform Lifts,General,Elevator,Assembly (A)|Business (B)|Educational (E)|Institutional (I)|Residential (R),sd|dd|cd,accessibility,architect,"Platform lifts shall comply with ASME A18.1 (1999 edition or 2003 edition) (incorporated by reference, see “Referenced Standards” in Chapter 1). Platform lifts shall not be attendant-operated and shall provide unassisted entry and exit from the lift."
410.2,410 Platform Lifts,Floor Surfaces,Slab|Ramp|Buildingelementproxy|Elevator,Assembly (A)|Business (B)|Educational (E)|Institutional (I)|Residential (R),sd|dd|cd,accessibility,architect,Floor surfaces in platform lifts shall comply with 302 and 303.
410.3,410 Platform Lifts,Clear Floor Space,Elevator,Assembly (A)|Business (B)|Educational (E)|Institutional (I)|Residential (R),sd|dd|cd,accessibility,architect,Clear floor space in platform lifts shall comply with 305.
410.4,410 Platform Lifts,Platform to Runway Clearance,Ramp|Rampflight|Slab,Assembly (A)|Business (B)|Educational (E)|Institutional (I)|Residential (R),sd|dd|cd,accessibility,architect,The clearance between the platform sill and the edge of any runway landing shall be 1 inch (32 mm) maximum.
410.5,410 Platform Lifts,Operable Parts,Elevator,Assembly (A)|Business (B)|Educational (E)|Institutional (I)|Residential (R),sd|dd|cd,accessibility,architect,Controls for platform lifts shall comply with 309.
