id,section,title,ifc_type,occupancy,design_phase,code_category,primary_responsibility,body
706.3,706 Assistive Listening Systems,Receiver Hearing-Aid Compatibility,Buildingelementproxy,Assembly (A)|Business (B)|Educational (E)|Institutional (I),sd|dd|cd,accessibility,architect,Receivers required to be hearing-aid compatible shall interface with telecoils in hearing aids through the provision of neckloops.
706.4,706 Assistive Listening Systems,Sound Pressure Level,Buildingelementproxy,Assembly (A)|Business (B)|Educational (E)|Institutional (I),sd|dd|cd,accessibility,architect,Assistive listening systems shall be capable of providing a sound pressure level of 110 dB minimum and 118 dB maximum with a dynamic range on the volume control of 50 dB.
706.5,706 Assistive Listening Systems,Signal-to-Noise Ratio,Buildingelementproxy,Assembly (A)|Business (B)|Educational (E),sd|dd|cd,accessibility,architect,The signal-to-noise ratio for internally generated noise in assistive listening systems shall be 18 dB minimum.
706.6,706 Assistive Listening Systems,Peak Clipping Level,Wall|Slab|Roof,Assembly (A)|Educational (E)|Business (B),sd|dd|cd,interior_environment,architect,Peak clipping shall not exceed 18 dB of clipping relative to the peaks of speech.
707.1,707 Automatic Teller Machines and Fare Machines,General,Buildingelementproxy,Assembly (A)|Business (B)|Mercantile (M)|Transportation (U),sd|dd|cd,accessibility,architect,Automatic teller machines and fare machines shall comply with 707.
707.2,707 Automatic Teller Machines and Fare Machines,Clear Floor or Ground Space,Slab|Door|Ramp|Rampflight|Stair,Assembly (A)|Business (B)|Educational (E)|Factory And Industrial (F)|Institutional (I),sd|dd|cd,accessibility,architect,A clear floor or ground space complying with 305 shall be provided.
707.3,707 Automatic Teller Machines and Fare Machines,Operable Parts,Door|Window|Shadingdevice,Assembly (A)|Business (B)|Educational (E)|Residential (R)|Institutional (I),sd|dd|cd,accessibility,architect,"Operable parts shall comply with 309. Unless a clear or correct key is provided, each operable part shall be able to be differentiated by sound or touch, without activation."
707.4,707 Automatic Teller Machines and Fare Machines,Privacy,Buildingelementproxy|Wall|Door,Business (B)|Mercantile (M),sd|dd|cd,accessibility,architect,Automatic teller machines shall provide the opportunity for the same degree of privacy of input and output available to all individuals.
707.5,707 Automatic Teller Machines and Fare Machines,Speech Output,Buildingelementproxy|Elevator,Assembly (A)|Business (B)|Institutional (I)|Mercantile (M)|Residential (R),sd|dd|cd,accessibility,architect,"Machines shall be speech enabled. Operating instructions and orientation, visible transaction prompts, user input verification, error messages, and all displayed information for full use shall be accessible to and independently usable by individuals with vision impairments. Speech shall be delivered through a mechanism that is readily available to all users, including but not limited to, an industry standard connector or a telephone handset. Speech shall be recorded or digitized human, or synthesized."
707.5.1,707 Automatic Teller Machines and Fare Machines,User Control,Buildingelementproxy,Assembly (A)|Business (B)|Educational (E)|Institutional (I)|Mercantile (M),sd|dd|cd,accessibility,architect,Speech shall be capable of being repeated or interrupted. Volume control shall be provided for the speech function.
707.5.2,707 Automatic Teller Machines and Fare Machines,Receipts,Buildingelementproxy,Business (B)|Mercantile (M)|Assembly (A),sd|dd|cd,accessibility,architect,"Where receipts are provided, speech output devices shall provide audible balance inquiry information, error messages, and all other information on the printed receipt necessary to complete or verify the transaction."
707.6,707 Automatic Teller Machines and Fare Machines,Input,Door|Window,Assembly (A)|Business (B)|Educational (E)|Institutional (I)|Residential (R),sd|dd|cd,accessibility,architect,Input devices shall comply with 707.6.
707.6.1,707 Automatic Teller Machines and Fare Machines,Input Controls,Buildingelementproxy|Door|Elevator,Assembly (A)|Business (B)|Educational (E)|Institutional (I)|Residential (R),sd|dd|cd,accessibility,architect,"At least one tactilely discernible input control shall be provided for each function. Where provided, key surfaces not on active areas of display screens, shall be raised above surrounding surfaces. Where membrane keys are the only method of input, each shall be tactilely discernable from surrounding surfaces and adjacent keys."
707.6.2,707 Automatic Teller Machines and Fare Machines,Numeric Keys,Buildingelementproxy,Business (B)|Assembly (A)|Institutional (I)|Residential (R),dd|cd,accessibility,architect,Numeric keys shall be arranged in a 12-key ascending or descending telephone keypad layout. The number five key shall be tactilely distinct from the other keys.
707.6.3,707 Automatic Teller Machines and Fare Machines,Function Keys,Elevator,Assembly (A)|Business (B)|Educational (E)|Institutional (I)|Residential (R),sd|dd|cd,accessibility,architect,Function keys shall comply with 707.6.3.
707.6.3.1,707 Automatic Teller Machines and Fare Machines,Contrast,Buildingelementproxy,Assembly (A)|Business (B)|Educational (E)|Institutional (I)|Residential (R),sd|dd|cd,accessibility,architect,Function keys shall contrast visually from background surfaces. Characters and symbols on key surfaces shall contrast visually from key surfaces. Visual contrast shall be either light-on-dark or dark-on-light.
707.6.3.2,707 Automatic Teller Machines and Fare Machines,Tactile Symbols,Buildingelementproxy,Assembly (A)|Business (B)|Educational (E)|Institutional (I)|Mercantile (M),sd|dd|cd,accessibility,architect,Function key surfaces shall have tactile symbols as follows: Enter or Proceed key: raised circle; Clear or Correct key: raised left arrow; Cancel key: raised letter ex; Add Value key: raised plus sign; Decrease Value key: raised minus sign.
707.7,707 Automatic Teller Machines and Fare Machines,Display Screen,Buildingelementproxy,Assembly (A)|Business (B)|Educational (E)|Institutional (I),sd|dd|cd,accessibility,architect,The display screen shall comply with 707.7.
707.7.1,707 Automatic Teller Machines and Fare Machines,Visibility,Buildingelementproxy,Business (B)|Residential (R)|Mercantile (M)|Assembly (A)|Institutional (I),sd|dd|cd,accessibility,architect,The display screen shall be visible from a point located 40 inches (1015 mm) above the center of the clear floor space in front of the machine.
707.7.2,707 Automatic Teller Machines and Fare Machines,Characters,Buildingelementproxy,Assembly (A)|Business (B)|Educational (E)|Institutional (I)|Mercantile (M),sd|dd|cd,accessibility,architect,Characters displayed on the screen shall be in a sans serif font. Characters shall be 3/16 inch (4.8 mm) high minimum based on the uppercase letter “I”. Characters shall contrast with their background with either light characters on a dark background or dark characters on a light background.
707.8,707 Automatic Teller Machines and Fare Machines,Braille Instructions,Door|Elevator,Assembly (A)|Business (B)|Educational (E)|Institutional (I)|Residential (R),sd|dd|cd,accessibility,architect,Braille instructions for initiating the speech mode shall be provided. Braille shall comply with 703.3.
708.1,708 Two-Way Communication Systems,General,Buildingelementproxy|Door,Institutional (I)|Assembly (A)|Residential (R)|Business (B),dd|cd,fire_protection_alarm_systems,fire_protection_engineer,Two-way communication systems shall comply with 708.
708.2,708 Two-Way Communication Systems,Audible and Visual Indicators,Buildingelementproxy|Door|Window,Assembly (A)|Business (B)|Educational (E)|Institutional (I)|Residential (R),dd|cd,fire_protection_alarm_systems,fire_protection_engineer,The system shall provide both audible and visual signals.
708.3,708 Two-Way Communication Systems,Handsets,Buildingelementproxy,Assembly (A)|Business (B)|Educational (E)|Institutional (I)|Residential (R),sd|dd|cd,accessibility,architect,"Handset cords, if provided, shall be 29 inches (735 mm) long minimum."
708.4,708 Two-Way Communication Systems,Residential Dwelling Unit Communication Systems,Door|Buildingelementproxy,Residential (R),sd|dd|cd,accessibility,architect,"Communications systems between a residential dwelling unit and a site, building, or floor entrance shall comply with 708.4."
708.4.1,708 Two-Way Communication Systems,Common Use or Public Use System Interface,Buildingelementproxy|Door,Residential (R)|Assembly (A),sd|dd|cd,accessibility,architect,The common use or public use system interface shall include the capability of supporting voice and TTY communication with the residential dwelling unit interface.
708.4.2,708 Two-Way Communication Systems,Residential Dwelling Unit Interface,Buildingelementproxy,Residential (R),sd|dd|cd,accessibility,architect,The residential dwelling unit system interface shall include a telephone jack capable of supporting voice and TTY communication with the common use or public use system interface.
801.1,801 General,Scope,Wall|Slab|Door,Assembly (A)|Business (B)|Residential (R),sd|dd|cd,fire_resistance_smoke_protection,architect,The provisions of Chapter 8 shall apply where required by Chapter 2 or where referenced by a requirement in this document.
802.1,"802 Wheelchair Spaces, Companion Seats, and Designated Aisle Seats",Wheelchair Spaces,Buildingelementproxy|Slab,Assembly (A)|Business (B)|Educational (E)|Institutional (I)|Mercantile (M),sd|dd|cd,accessibility,architect,Wheelchair spaces shall comply with 802.1.
802.1.1,"802 Wheelchair Spaces, Companion Seats, and Designated Aisle Seats",Floor or Ground Surface,Slab|Ramp|Stair|Floor,Assembly (A)|Business (B)|Educational (E)|Institutional (I)|Mercantile (M),sd|dd|cd,accessibility,architect,The floor or ground surface of wheelchair spaces shall comply with 302. Changes in level are not permitted.
802.1.2,"802 Wheelchair Spaces, Companion Seats, and Designated Aisle Seats",Width,Space|Buildingelementproxy,Assembly (A)|Business (B)|Educational (E)|Institutional (I)|Mercantile (M),sd|dd|cd,accessibility,architect,"A single wheelchair space shall be 36 inches (915 mm) wide minimum Where two adjacent wheelchair spaces are provided, each wheelchair space shall be 33 inches (840 mm) wide minimum."
802.1.3,"802 Wheelchair Spaces, Companion Seats, and Designated Aisle Seats",Depth,Space|Buildingelementproxy,Assembly (A)|Business (B)|Educational (E)|Institutional (I)|Mercantile (M),sd|dd|cd,accessibility,architect,"Where a wheelchair space can be entered from the front or rear, the wheelchair space shall be 48 inches (1220 mm) deep minimum. Where a wheelchair space can be entered only from the side, the wheelchair space shall be 60 inches (1525 mm) deep minimum."
802.1.4,"802 Wheelchair Spaces, Companion Seats, and Designated Aisle Seats",Approach,Slab|Ramp|Door,Assembly (A)|Business (B)|Educational (E)|Institutional (I)|Mercantile (M),sd|dd|cd,accessibility,architect,Wheelchair spaces shall adjoin accessible routes. Accessible routes shall not overlap wheelchair spaces.
802.1.5,"802 Wheelchair Spaces, Companion Seats, and Designated Aisle Seats",Overlap,Slab|Ramp|Stair|Door,Assembly (A)|Business (B)|Educational (E)|Institutional (I)|Mercantile (M),sd|dd|cd,accessibility,architect,Wheelchair spaces shall not overlap circulation paths.
802.2,"802 Wheelchair Spaces, Companion Seats, and Designated Aisle Seats",Lines of Sight,Slab|Railing|Stair|Ramp|Buildingelementproxy,Assembly (A),sd|dd|cd,accessibility,architect,"Lines of sight to the screen, performance area, or playing field for spectators in wheelchair spaces shall comply with 802.2."
802.2.1,"802 Wheelchair Spaces, Companion Seats, and Designated Aisle Seats",Lines of Sight Over Seated Spectators,Stair|Slab|Buildingelementproxy|Ramp|Seat,Assembly (A),sd|dd|cd,accessibility,architect,"Where spectators are expected to remain seated during events, spectators in wheelchair spaces shall be afforded lines of sight complying with 802.2.1."
802.2.1.1,"802 Wheelchair Spaces, Companion Seats, and Designated Aisle Seats",Lines of Sight Over Heads,Stair|Ramp|Slab|Railing|Buildingelementproxy,Assembly (A),sd|dd|cd,accessibility,architect,"Where spectators are provided lines of sight over the heads of spectators seated in the first row in front of their seats, spectators seated in wheelchair spaces shall be afforded lines of sight over the heads of seated spectators in the first row in front of wheelchair spaces."
802.2.1.2,"802 Wheelchair Spaces, Companion Seats, and Designated Aisle Seats",Lines of Sight Between Heads,Stair|Ramp|Slab,Assembly (A),sd|dd|cd,accessibility,architect,"Where spectators are provided lines of sight over the shoulders and between the heads of spectators seated in the first row in front of their seats, spectators seated in wheelchair spaces shall be afforded lines of sight over the shoulders and between the heads of seated spectators in the first row in front of wheelchair spaces."
802.2.2,"802 Wheelchair Spaces, Companion Seats, and Designated Aisle Seats",Lines of Sight Over Standing Spectators,Stair|Ramp|Slab|Railing,Assembly (A),sd|dd|cd,accessibility,architect,"Where spectators are expected to stand during events, spectators in wheelchair spaces shall be afforded lines of sight complying with 802.2.2."
802.2.2.1,"802 Wheelchair Spaces, Companion Seats, and Designated Aisle Seats",Lines of Sight Over Heads,Stair|Ramp|Slab|Railing|Seatingelement,Assembly (A),sd|dd|cd,accessibility,architect,"Where standing spectators are provided lines of sight over the heads of spectators standing in the first row in front of their seats, spectators seated in wheelchair spaces shall be afforded lines of sight over the heads of standing spectators in the first row in front of wheelchair spaces."
802.2.2.2,"802 Wheelchair Spaces, Companion Seats, and Designated Aisle Seats",Lines of Sight Between Heads,Seating|Ramp|Stair|Buildingelementproxy,Assembly (A),sd|dd|cd,accessibility,architect,"Where standing spectators are provided lines of sight over the shoulders and between the heads of spectators standing in the first row in front of their seats, spectators seated in wheelchair spaces shall be afforded lines of sight over the shoulders and between the heads of standing spectators in the first row in front of wheelchair spaces."
802.3,"802 Wheelchair Spaces, Companion Seats, and Designated Aisle Seats",Companion Seats,Buildingelementproxy,Assembly (A),sd|dd|cd,accessibility,architect,Companion seats shall comply with 802.3.
802.3.1,"802 Wheelchair Spaces, Companion Seats, and Designated Aisle Seats",Alignment,Slab|Stair|Railing,Assembly (A),sd|dd|cd,accessibility,architect,"In row seating, companion seats shall be located to provide shoulder alignment with adjacent wheelchair spaces. The shoulder alignment point of the wheelchair space shall be measured 36 inches (915 mm) from the front of the wheelchair space. The floor surface of the companion seat shall be at the same elevation as the floor surface of the wheelchair space."
802.3.2,"802 Wheelchair Spaces, Companion Seats, and Designated Aisle Seats",Type,Buildingelementproxy,Assembly (A),sd|dd|cd,accessibility,architect,"Companion seats shall be equivalent in size, quality, comfort, and amenities to the seating in the immediate area. Companion seats shall be permitted to be movable."
802.4,"802 Wheelchair Spaces, Companion Seats, and Designated Aisle Seats",Designated Aisle Seats,Slab|Railing,Assembly (A),sd|dd|cd,accessibility,architect,Designated aisle seats shall comply with 802.4.
802.4.1,"802 Wheelchair Spaces, Companion Seats, and Designated Aisle Seats",Armrests,Furniture,Assembly (A),sd|dd|cd,accessibility,architect,"Where armrests are provided on the seating in the immediate area, folding or retractable armrests shall be provided on the aisle side of the seat."
802.4.2,"802 Wheelchair Spaces, Companion Seats, and Designated Aisle Seats",Identification,Member,Assembly (A),sd|dd|cd,accessibility,architect,Each designated aisle seat shall be identified by a sign or marker.
803.1,"803 Dressing, Fitting, and Locker Rooms",General,Wall|Door|Slab|Covering,Assembly (A)|Business (B)|Educational (E)|Institutional (I)|Residential (R),sd|dd|cd,accessibility,architect,"Dressing, fitting, and locker rooms shall comply with 803."
803.2,"803 Dressing, Fitting, and Locker Rooms",Turning Space,Door|Slab|Buildingelementproxy,Assembly (A)|Business (B)|Educational (E)|Institutional (I)|Residential (R),sd|dd|cd,accessibility,architect,Turning space complying with 304 shall be provided within the room.
803.3,"803 Dressing, Fitting, and Locker Rooms",Door Swing,Door,Assembly (A)|Business (B)|Educational (E)|Residential (R)|Institutional (I),sd|dd|cd,accessibility,architect,Doors shall not swing into the room unless a clear floor or ground space complying with 305.3 is provided beyond the arc of the door swing.
803.4,"803 Dressing, Fitting, and Locker Rooms",Benches,Buildingelementproxy,Assembly (A)|Institutional (I)|Educational (E),sd|dd|cd,accessibility,architect,A bench complying with 903 shall be provided within the room.
803.5,"803 Dressing, Fitting, and Locker Rooms",Coat Hooks and Shelves,Covering|Wall,Assembly (A)|Business (B)|Educational (E)|Institutional (I)|Residential (R),sd|dd|cd,accessibility,architect,Coat hooks provided within the room shall be located within one of the reach ranges specified in 308. Shelves shall be 40 inches (1015 mm) minimum and 48 inches (1220 mm) maximum above the finish floor or ground.
804.1,804 Kitchens and Kitchenettes,General,Covering|Slab|Wall|Door|Window,Assembly (A)|Business (B)|Educational (E)|Residential (R)|Institutional (I),sd|dd|cd,interior_environment,architect,Kitchens and kitchenettes shall comply with 804.
804.2,804 Kitchens and Kitchenettes,Clearance,Covering|Wall|Door|Slab,Residential (R)|Assembly (A),sd|dd|cd,accessibility,architect,"Where a pass through kitchen is provided, clearances shall comply with 804.2.1. Where a U-shaped kitchen is provided, clearances shall comply with 804.2.2."
804.2.1,804 Kitchens and Kitchenettes,Pass Through Kitchen,Wall|Door|Slab|Buildingelementproxy,Residential (R)|Assembly (A),sd|dd|cd,accessibility,architect,"In pass through kitchens where counters, appliances or cabinets are on two opposing sides, or where counters, appliances or cabinets are opposite a parallel wall, clearance between all opposing base cabinets, counter tops, appliances, or walls within kitchen work areas shall be 40 inches (1015 mm) minimum. Pass through kitchens shall have two entries."
804.2.2,804 Kitchens and Kitchenettes,U-Shaped,Wall|Slab|Door|Buildingelementproxy,Residential (R)|Assembly (A)|Business (B),sd|dd|cd,interior_environment,architect,"In U-shaped kitchens enclosed on three contiguous sides, clearance between all opposing base cabinets, counter tops, appliances, or walls within kitchen work areas shall be 60 inches (1525 mm) minimum."
804.3,804 Kitchens and Kitchenettes,Kitchen Work Surface,Slab|Covering|Buildingelementproxy,Residential (R),sd|dd|cd,accessibility,architect,"In residential dwelling units required to comply with 809, at least one 30 inches (760 mm) wide minimum section of counter shall provide a kitchen work surface that complies with 804.3."
804.3.1,804 Kitchens and Kitchenettes,Clear Floor or Ground Space,Slab|Covering,Assembly (A)|Business (B)|Educational (E)|Institutional (I)|Residential (R),sd|dd|cd,accessibility,architect,A clear floor space complying with 305 positioned for a forward approach shall be provided. The clear floor or ground space shall be centered on the kitchen work surface and shall provide knee and toe clearance complying with 306.
804.3.2,804 Kitchens and Kitchenettes,Height,Slab|Covering,Assembly (A)|Business (B)|Educational (E)|Institutional (I)|Residential (R),sd|dd|cd,accessibility,architect,The kitchen work surface shall be 34 inches (865 mm) maximum above the finish floor or ground.
804.3.3,804 Kitchens and Kitchenettes,Exposed Surfaces,Covering|Slab,Business (B)|Educational (E)|Mercantile (M)|Residential (R),sd|dd|cd,finishes_materials,architect,There shall be no sharp or abrasive surfaces under the work surface counters.
804.4,804 Kitchens and Kitchenettes,Sinks,Buildingelementproxy,Assembly (A)|Business (B)|Educational (E)|Factory And Industrial (F)|Institutional (I),sd|dd|cd,accessibility,architect,Sinks shall comply with 606.
804.5,804 Kitchens and Kitchenettes,Storage,Buildingelementproxy|Covering,Storage (S),sd|dd|cd,accessibility,architect,At least 50 percent of shelf space in storage facilities shall comply with 811.
804.6,804 Kitchens and Kitchenettes,Appliances,Buildingelementproxy|Covering|Slab,Residential (R)|Mercantile (M)|Business (B),sd|dd|cd,interior_environment,architect,"Where provided, kitchen appliances shall comply with 804.6."
804.6.1,804 Kitchens and Kitchenettes,Clear Floor or Ground Space,Slab|Wall|Buildingelementproxy,Residential (R)|Institutional (I)|Assembly (A)|Business (B),sd|dd|cd,accessibility,architect,A clear floor or ground space complying with 305 shall be provided at each kitchen appliance. Clear floor or ground spaces shall be permitted to overlap.
804.6.2,804 Kitchens and Kitchenettes,Operable Parts,Buildingelementproxy|Door|Window,Assembly (A)|Business (B)|Educational (E)|Institutional (I)|Residential (R),sd|dd|cd,accessibility,architect,All appliance controls shall comply with 309.
804.6.3,804 Kitchens and Kitchenettes,Dishwasher,Buildingelementproxy|Slab|Door,Residential (R)|Assembly (A)|Business (B),sd|dd|cd,accessibility,architect,"Clear floor or ground space shall be positioned adjacent to the dishwasher door. The dishwasher door, in the open position, shall not obstruct the clear floor or ground space for the dishwasher or the sink."
804.6.4,804 Kitchens and Kitchenettes,Range or Cooktop,Slab|Covering,Residential (R)|Institutional (I)|Assembly (A)|Business (B),sd|dd|cd,accessibility,architect,"Where a forward approach is provided, the clear floor or ground space shall provide knee and toe clearance complying with 306. Where knee and toe space is provided, the underside of the range or cooktop shall be insulated or otherwise configured to prevent burns, abrasions, or electrical shock. The location of controls shall not require reaching across burners."
804.6.5,804 Kitchens and Kitchenettes,Oven,Buildingelementproxy,Assembly (A)|Business (B)|Educational (E)|Institutional (I)|Residential (R),sd|dd|cd,fire_protection_alarm_systems,architect,Ovens shall comply with 804.6.5.
804.6.5.1,804 Kitchens and Kitchenettes,Side-Hinged Door Ovens,Door|Slab|Buildingelementproxy,Residential (R)|Institutional (I)|Business (B),sd|dd|cd,accessibility,architect,Side-hinged door ovens shall have the work surface required by 804.3 positioned adjacent to the latch side of the oven door.
804.6.5.2,804 Kitchens and Kitchenettes,Bottom-Hinged Door Ovens,Door|Slab,Residential (R)|Business (B)|Mercantile (M)|Assembly (A),sd|dd|cd,accessibility,architect,Bottom-hinged door ovens shall have the work surface required by 804.3 positioned adjacent to one side of the door.
804.6.5.3,804 Kitchens and Kitchenettes,Controls,Buildingelementproxy,Assembly (A)|Business (B)|Educational (E)|Mercantile (M)|Residential (R),sd|dd|cd,interior_environment,architect,Ovens shall have controls on front panels.
804.6.6,804 Kitchens and Kitchenettes,Refrigerator/Freezer,Buildingelementproxy,Residential (R)|Institutional (I)|Business (B)|Assembly (A),sd|dd|cd,accessibility,architect,Combination refrigerators and freezers shall have at least 50 percent of the freezer space 54 inches (1370 mm) maximum above the finish floor or ground. The clear floor or ground space shall be positioned for a parallel approach to the space dedicated to a refrigerator/freezer with the centerline of the clear floor or ground space offset 24 inches (610 mm) maximum from the centerline of the dedicated space.
805.1,805 Medical Care and Long-Term Care Facilities,General,Door|Wall|Slab,Institutional (I),sd|dd|cd,accessibility,architect,Medical care facility and long-term care facility patient or resident sleeping rooms required to provide mobility features shall comply with 805.
805.2,805 Medical Care and Long-Term Care Facilities,Turning Space,Slab|Door|Wall,Assembly (A)|Business (B)|Educational (E)|Institutional (I)|Residential (R),sd|dd|cd,accessibility,architect,Turning space complying with 304 shall be provided within the room.
805.3,805 Medical Care and Long-Term Care Facilities,Clear Floor or Ground Space,Slab|Wall|Door,Institutional (I)|Residential (R),sd|dd|cd,accessibility,architect,A clear floor space complying with 305 shall be provided on each side of the bed. The clear floor space shall be positioned for parallel approach to the side of the bed.
805.4,805 Medical Care and Long-Term Care Facilities,Toilet and Bathing Rooms,Slab|Wall|Door|Covering,Institutional (I)|Residential (R),sd|dd|cd,accessibility,architect,"Toilet and bathing rooms that are provided as part of a patient or resident sleeping room shall comply with 603. Where provided, no fewer than one water closet, one lavatory, and one bathtub or shower shall comply with the applicable requirements of 603 through 610."
806.1,806 Transient Lodging Guest Rooms,General,Buildingelementproxy|Door|Slab|Wall,Residential (R)|Institutional (I),sd|dd|cd,accessibility,architect,Transient lodging guest rooms shall comply with 806. Guest rooms required to provide mobility features shall comply with 806.2. Guest rooms required to provide communication features shall comply with 806.3.
806.2,806 Transient Lodging Guest Rooms,Guest Rooms with Mobility Features,Door|Slab|Wall,Residential (R),sd|dd|cd,accessibility,architect,Guest rooms required to provide mobility features shall comply with 806.2.
