id,section,title,ifc_type,occupancy,design_phase,code_category,primary_responsibility,body
101.1,101 Purpose,General,Door|Ramp|Stair|Elevator|Rampflight,Assembly (A)|Business (B)|Educational (E)|Residential (R)|Mercantile (M),concept|sd|dd|cd,accessibility,architect,"This document contains scoping and technical requirements for accessibility to sites, facilities, buildings, and elements by individuals with disabilities. The requirements are to be applied during the design, construction, additions to, and alteration of sites, facilities, buildings, and elements to the extent required by regulations issued by Federal agencies under the Americans with Disabilities Act of 1990 (ADA)."
101.2,101 Purpose,Effect on Removal of Barriers in Existing Facilities,Door|Ramp|Stair|Slab,Assembly (A)|Business (B)|Educational (E)|Mercantile (M)|Residential (R),sd|dd|cd,accessibility,architect,This document does not address existing facilities unless altered at the discretion of a covered entity. The Department of Justice has authority over existing facilities that are subject to the requirement for removal of barriers under Title III of the ADA. Any determination that this document applies to existing facilities subject to the barrier removal requirement is solely within the discretion of the Department of Justice and is effective only to the extent required by regulations issued by the Department of Justice.
102,102 Dimensions for Adults and Children**,Dimensions for Adults and Children**,Covering|Slab|Buildingelementproxy,Assembly (A)|Business (B)|Educational (E)|Mercantile (M)|Institutional (I),sd|dd|cd,accessibility,architect,"The technical requirements are based on adult dimensions and anthropometrics. In addition, this document includes technical requirements based on children’s dimensions and anthropometrics for drinking fountains, water closets, toilet compartments, lavatories and sinks, dining surfaces, and work surfaces."
103,103 Equivalent Facilitation,Equivalent Facilitation,Door|Ramp|Stair|Elevator|Window,Assembly (A)|Business (B)|Educational (E)|Residential (R)|Institutional (I),sd|dd|cd,accessibility,architect,"Nothing in these requirements prevents the use of designs, products, or technologies as alternatives to those prescribed, provided they result in substantially equivalent or greater accessibility and usability."
104.1,104 Conventions,Dimensions,Wall|Door|Window,Assembly (A)|Business (B)|Educational (E)|Residential (R),sd|dd|cd,means_of_egress,architect,Dimensions that are not stated as “maximum” or “minimum” are absolute.
104.1.1,104 Conventions,Construction and Manufacturing Tolerances,Wall|Slab|Roof,Assembly (A)|Business (B)|Residential (R),sd|dd|cd,finishes_materials,architect,All dimensions are subject to conventional industry tolerances except where the requirement is stated as a range with specific minimum and maximum end points.
104.2,104 Conventions,Calculation of Percentages,Door|Ramp|Rampflight|Stair|Window,Assembly (A)|Business (B)|Educational (E)|Residential (R)|Institutional (I),sd|dd|cd,accessibility,architect,"Where the required number of elements or facilities to be provided is determined by calculations of ratios or percentages and remainders or fractions result, the next greater whole number of such elements or facilities shall be provided. Where the determination of the required size or dimension of an element or facility involves ratios or percentages, rounding down for values less than one half shall be permitted."
104.3,104 Conventions,Figures,Buildingelementproxy,Assembly (A)|Business (B)|Educational (E)|Factory And Industrial (F)|Residential (R),cd,occupancy_classification,architect,"Unless specifically stated otherwise, figures are provided for informational purposes only."
105.1,105 Referenced Standards,General,Buildingelementproxy,Assembly (A)|Business (B)|Educational (E)|Factory And Industrial (F)|High Hazard (H),cd,accessibility,architect,"The standards listed in 105.2 are incorporated by reference in this document and are part of the requirements to the prescribed extent of each such reference. The Director of the Federal Register has approved these standards for incorporation by reference in accordance with 5 U.S.C. 552(a) and 1 CFR part 51. Copies of the referenced standards may be inspected at the Architectural and Transportation Barriers Compliance Board, 1331 F Street, NW, Suite 1000, Washington, DC 20004; at the Department of Justice, Civil Rights Division, Disability Rights Section, 1425 New York Avenue, NW, Washington, DC; at the Department of Transportation, 400 Seventh Street, SW, Room 10424, Washington DC; or at the National Archives and Records Administration (NARA). For information on the availability of this material at NARA, call (202) 741-6030, or go to http://www.archives.gov/federal_register/code_of_federal_regulations/ibr_locations.html."
105.2,105 Referenced Standards,Referenced Standards,Buildingelementproxy,Assembly (A)|Business (B)|Educational (E)|Factory And Industrial (F)|Residential (R),concept|sd|dd|cd,special_construction,architect,"The specific edition of the standards listed below are referenced in this document. Where differences occur between this document and the referenced standards, this document applies."
105.2.1,105 Referenced Standards,ANSI/BHMA,Door|Window|Railing,Assembly (A)|Business (B)|Residential (R),dd|cd,finishes_materials,architect,"Copies of the referenced standards may be obtained from the Builders Hardware Manufacturers Association, 355 Lexington Avenue, 17th floor, New York, NY 10017 (http://www.buildershardware.com)."
105.2.2,105 Referenced Standards,ASME,Elevator,Assembly (A)|Business (B)|Educational (E)|Institutional (I)|Residential (R),sd|dd|cd,elevators_conveying_systems,elevator_consultant,"Copies of the referenced standards may be obtained from the American Society of Mechanical Engineers, Three Park Avenue, New York, New York 10016 (http://www.asme.org)."
105.2.3,105 Referenced Standards,ASTM,Buildingelementproxy,Assembly (A)|Business (B)|Educational (E)|Factory And Industrial (F)|Residential (R),sd|dd|cd,finishes_materials,architect,"Copies of the referenced standards may be obtained from the American Society for Testing and Materials, 100 Bar Harbor Drive, West Conshohocken, Pennsylvania 19428 (http://www.astm.org)."
105.2.4,105 Referenced Standards,ICC/IBC,Buildingelementproxy,Assembly (A)|Business (B)|Educational (E)|Factory And Industrial (F)|High Hazard (H),cd,special_construction,architect,"Copies of the referenced standard may be obtained from the International Code Council, 5203 Leesburg Pike, Suite 600, Falls Church, Virginia 22041 (www.iccsafe.org)."
105.2.5,105 Referenced Standards,NFPA,Buildingelementproxy,Assembly (A)|Business (B)|Educational (E)|Factory And Industrial (F)|Residential (R),cd|ca,fire_protection_alarm_systems,fire_protection_engineer,"Copies of the referenced standards may be obtained from the National Fire Protection Association, 1 Batterymarch Park, Quincy, Massachusetts 02169-7471, (http://www.nfpa.org)."
106.1,106 Definitions,General,Buildingelementproxy,Assembly (A)|Business (B)|Educational (E)|Factory And Industrial (F)|High Hazard (H),concept|sd|dd|cd,occupancy_classification,architect,"For the purpose of this document, the terms defined in 106.5 have the indicated meaning."
106.2,106 Definitions,Terms Defined in Referenced Standards,Buildingelementproxy,Assembly (A)|Business (B)|Educational (E)|Institutional (I)|Mercantile (M),cd,accessibility,architect,"Terms not defined in 106.5 or in regulations issued by the Department of Justice and the Department of Transportation to implement the Americans with Disabilities Act, but specifically defined in a referenced standard, shall have the specified meaning from the referenced standard unless otherwise stated."
106.3,106 Definitions,Undefined Terms,Buildingelementproxy,Assembly (A)|Business (B)|Educational (E)|Institutional (I)|Mercantile (M),concept|sd|dd|cd,accessibility,architect,The meaning of terms not specifically defined in 106.5 or in regulations issued by the Department of Justice and the Department of Transportation to implement the Americans with Disabilities Act or in referenced standards shall be as defined by collegiate dictionaries in the sense that the context implies.
106.4,106 Definitions,Interchangeability,Wall,Assembly (A),cd,occupancy_classification,architect,"Words, terms and phrases used in the singular include the plural and those used in the plural include the singular."
201.1,201 Application,Scope,Wall|Door|Slab|Stair|Ramp,Assembly (A)|Business (B)|Educational (E)|Factory And Industrial (F)|Residential (R),sd|dd|cd,accessibility,architect,All areas of newly designed and newly constructed buildings and facilities and altered portions of existing buildings and facilities shall comply with these requirements.
201.2,201 Application,Application Based on Building or Facility Use,Buildingelementproxy|Wall|Door|Slab,Assembly (A)|Business (B)|Residential (R),sd|dd|cd,occupancy_classification,architect,"Where a site, building, facility, room, or space contains more than one use, each portion shall comply with the applicable requirements for that use."
201.3,201 Application,Temporary and Permanent Structures,Buildingelementproxy|Wall|Roof,Assembly (A)|Business (B)|Residential (R),sd|dd|cd,special_construction,architect,These requirements shall apply to temporary and permanent buildings and facilities.
202.1,202 Existing Buildings and Facilities,General,Wall|Door|Window|Stair|Ramp,Assembly (A)|Business (B)|Educational (E)|Factory And Industrial (F)|High Hazard (H),sd|dd|cd,accessibility,architect,Additions and alterations to existing buildings or facilities shall comply with 202.
202.2,202 Existing Buildings and Facilities,Additions,Wall|Slab|Roof|Door|Window,Assembly (A)|Business (B)|Educational (E)|Residential (R)|Mercantile (M),sd|dd|cd,accessibility,architect,Each addition to an existing building or facility shall comply with the requirements for new construction. Each addition that affects or could affect the usability of or access to an area containing a primary function shall comply with 202.4.
202.3,202 Existing Buildings and Facilities,Alterations,Wall|Door|Window|Slab|Roof,Assembly (A)|Business (B)|Educational (E)|Factory And Industrial (F)|Residential (R),sd|dd|cd,occupancy_classification,architect,"Where existing elements or spaces are altered, each altered element or space shall comply with the applicable requirements of Chapter 2."
202.3.1,202 Existing Buildings and Facilities,Prohibited Reduction in Access,Door|Ramp|Stair|Elevator|Slab,Assembly (A)|Business (B)|Educational (E)|Institutional (I)|Residential (R),sd|dd|cd,accessibility,architect,An alteration that decreases or has the effect of decreasing the accessibility of a building or facility below the requirements for new construction at the time of the alteration is prohibited.
202.3.2,202 Existing Buildings and Facilities,Extent of Application,Wall|Door|Ramp|Stair|Window,Assembly (A)|Business (B)|Educational (E)|Residential (R)|Mercantile (M),sd|dd|cd,accessibility,architect,"An alteration of an existing element, space, or area of a building or facility shall not impose a requirement for accessibility greater than required for new construction."
202.4,202 Existing Buildings and Facilities,Alterations Affecting Primary Function Areas,Door|Ramp|Stair|Elevator|Slab,Assembly (A)|Business (B)|Educational (E)|Mercantile (M)|Residential (R),sd|dd|cd,accessibility,architect,"In addition to the requirements of 202.3, an alteration that affects or could affect the usability of or access to an area containing a primary function shall be made so as to ensure that, to the maximum extent feasible, the path of travel to the altered area, including the rest rooms, telephones, and drinking fountains serving the altered area, are readily accessible to and usable by individuals with disabilities, unless such alterations are disproportionate to the overall alterations in terms of cost and scope as determined under criteria established by the Attorney General. In existing transportation facilities, an area of primary function shall be as defined under regulations published by the Secretary of the Department of Transportation or the Attorney General."
202.5,202 Existing Buildings and Facilities,Alterations to Qualified Historic Buildings and Facilities,Wall|Door|Window|Roof|Slab,Assembly (A)|Business (B)|Educational (E)|Institutional (I)|Residential (R),sd|dd|cd,accessibility,architect,Alterations to a qualified historic building or facility shall comply with 202.3 and 202.4.
203.1,203 General Exceptions,General,Buildingelementproxy,Assembly (A)|Business (B)|Educational (E)|Factory And Industrial (F)|Residential (R),sd|dd|cd,accessibility,architect,"Sites, buildings, facilities, and elements are exempt from these requirements to the extent specified by 203."
203.2,203 General Exceptions,Construction Sites,Buildingelementproxy,Utility And Miscellaneous (U),cd|ca,accessibility,architect,"Structures and sites directly associated with the actual processes of construction, including but not limited to, scaffolding, bridging, materials hoists, materials storage, and construction trailers shall not be required to comply with these requirements or to be on an accessible route. Portable toilet units provided for use exclusively by construction personnel on a construction site shall not be required to comply with 213 or to be on an accessible route."
203.3,203 General Exceptions,Raised Areas,Stair|Ramp|Buildingelementproxy,Institutional (I)|Assembly (A),sd|dd|cd,accessibility,architect,"Areas raised primarily for purposes of security, life safety, or fire safety, including but not limited to, observation or lookout galleries, prison guard towers, fire towers, or life guard stands shall not be required to comply with these requirements or to be on an accessible route."
203.4,203 General Exceptions,Limited Access Spaces,Stair|Ramp|Rampflight|Slab,Assembly (A)|Business (B)|Educational (E)|Factory And Industrial (F)|Residential (R),sd|dd|cd,accessibility,architect,"Spaces accessed only by ladders, catwalks, crawl spaces, or very narrow passageways shall not be required to comply with these requirements or to be on an accessible route."
203.5,203 General Exceptions,Machinery Spaces,Buildingelementproxy|Slab|Door|Elevator|Wall,Business (B)|Factory And Industrial (F)|Utility And Miscellaneous (U),sd|dd|cd,accessibility,architect,"Spaces frequented only by service personnel for maintenance, repair, or occasional monitoring of equipment shall not be required to comply with these requirements or to be on an accessible route. Machinery spaces include, but are not limited to, elevator pits or elevator penthouses; mechanical, electrical or communications equipment rooms; piping or equipment catwalks; water or sewage treatment pump rooms and stations; electric substations and transformer vaults; and highway and tunnel utility facilities."
203.6,203 General Exceptions,Single Occupant Structures,Buildingelementproxy|Door|Ramp|Stair|Slab,Utility And Miscellaneous (U),sd|dd|cd,accessibility,architect,"Single occupant structures accessed only by passageways below grade or elevated above standard curb height, including but not limited to, toll booths that are accessed only by underground tunnels, shall not be required to comply with these requirements or to be on an accessible route."
203.7,203 General Exceptions,Detention and Correctional Facilities,Door|Wall|Buildingelementproxy,Institutional (I),sd|dd|cd,accessibility,architect,"In detention and correctional facilities, common use areas that are used only by inmates or detainees and security personnel and that do not serve holding cells or housing cells required to comply with 232, shall not be required to comply with these requirements or to be on an accessible route."
203.8,203 General Exceptions,Residential Facilities,Door|Ramp|Stair|Slab|Wall,Residential (R),sd|dd|cd,accessibility,architect,"In residential facilities, common use areas that do not serve residential dwelling units required to provide mobility features complying with 809.2 through 809.4 shall not be required to comply with these requirements or to be on an accessible route."
203.9,203 General Exceptions,Employee Work Areas,Door|Ramp|Rampflight|Stair|Slab,Business (B)|Assembly (A)|Mercantile (M),sd|dd|cd,accessibility,architect,"Spaces and elements within employee work areas shall only be required to comply with 206.2.8, 207.1, and 215.3 and shall be designed and constructed so that individuals with disabilities can approach, enter, and exit the employee work area. Employee work areas, or portions of employee work areas, other than raised courtroom stations, that are less than 300 square feet (28 m2) and elevated 7 inches (180 mm) or more above the finish floor or ground where the elevation is essential to the function of the space shall not be required to comply with these requirements or to be on an accessible route."
203.10,203 General Exceptions,"Raised Refereeing, Judging, and Scoring Areas",Slab|Stair|Ramp|Rail|Buildingelementproxy,Assembly (A),sd|dd|cd,accessibility,architect,"Raised structures used solely for refereeing, judging, or scoring a sport shall not be required to comply with these requirements or to be on an accessible route."
203.11,203 General Exceptions,Water Slides,Buildingelementproxy,Assembly (A),sd|dd|cd,accessibility,architect,Water slides shall not be required to comply with these requirements or to be on an accessible route.
203.12,203 General Exceptions,Animal Containment Areas,Wall|Door|Slab,Utility And Miscellaneous (U)|Business (B),sd|dd|cd,accessibility,architect,Animal containment areas that are not for public use shall not be required to comply with these requirements or to be on an accessible route.
203.13,203 General Exceptions,Raised Boxing or Wrestling Rings,Slab|Stair|Ramp|Buildingelementproxy,Assembly (A),sd|dd|cd,accessibility,architect,Raised boxing or wrestling rings shall not be required to comply with these requirements or to be on an accessible route.
203.14,203 General Exceptions,Raised Diving Boards and Diving Platforms,Buildingelementproxy,Assembly (A),sd|dd|cd,accessibility,architect,Raised diving boards and diving platforms shall not be required to comply with these requirements or to be on an accessible route.
204.1,204 Protruding Objects,General,Wall|Column|Door|Railing|Stair,Assembly (A)|Business (B)|Educational (E)|Residential (R)|Institutional (I),sd|dd|cd,accessibility,architect,Protruding objects on circulation paths shall comply with 307.
205.1,205 Operable Parts,General,Door|Window|Ramp|Stair|Buildingelementproxy,Assembly (A)|Business (B)|Educational (E)|Residential (R)|Mercantile (M),sd|dd|cd,accessibility,architect,"Operable parts on accessible elements, accessible routes, and in accessible rooms and spaces shall comply with 309."
206.1,206 Accessible Routes,General,Door|Ramp|Stair|Slab|Rampflight,Assembly (A)|Business (B)|Educational (E)|Factory And Industrial (F)|Residential (R),sd|dd|cd,accessibility,architect,Accessible routes shall be provided in accordance with 206 and shall comply with Chapter 4.
206.2,206 Accessible Routes,Where Required,Ramp|Rampflight|Stair|Door|Slab,Assembly (A)|Business (B)|Educational (E)|Institutional (I)|Residential (R),sd|dd|cd,accessibility,architect,Accessible routes shall be provided where required by 206.2.
206.2.1,206 Accessible Routes,Site Arrival Points,Ramp|Pavement|Door,Assembly (A)|Business (B)|Educational (E)|Institutional (I)|Residential (R),sd|dd|cd,accessibility,architect,At least one accessible route shall be provided within the site from accessible parking spaces and accessible passenger loading zones; public streets and sidewalks; and public transportation stops to the accessible building or facility entrance they serve.
206.2.2,206 Accessible Routes,Within a Site,Pavement|Ramp|Kerb,Assembly (A)|Business (B)|Educational (E)|Factory And Industrial (F)|Residential (R),sd|dd|cd,accessibility,architect,"At least one accessible route shall connect accessible buildings, accessible facilities, accessible elements, and accessible spaces that are on the same site."
206.2.3,206 Accessible Routes,Multi-Story Buildings and Facilities,Ramp|Stair|Elevator|Door,Assembly (A)|Business (B)|Educational (E)|Institutional (I)|Residential (R),sd|dd|cd,accessibility,architect,At least one accessible route shall connect each story and mezzanine in multi-story buildings and facilities.
206.2.3.1,206 Accessible Routes,Stairs and Escalators in Existing Buildings,Stair|Ramp|Elevator,Assembly (A)|Business (B)|Educational (E)|Residential (R)|Institutional (I),sd|dd|cd,accessibility,architect,"In alterations and additions, where an escalator or stair is provided where none existed previously and major structural modifications are necessary for the installation, an accessible route shall be provided between the levels served by the escalator or stair unless exempted by 206.2.3 Exceptions 1 through 7."
206.2.4,206 Accessible Routes,Spaces and Elements,Door|Ramp|Stair|Corridor|Entrance,Assembly (A)|Business (B)|Educational (E)|Factory And Industrial (F)|Residential (R),sd|dd|cd,accessibility,architect,At least one accessible route shall connect accessible building or facility entrances with all accessible spaces and elements within the building or facility which are otherwise connected by a circulation path unless exempted by 206.2.3 Exceptions 1 through 7.
206.2.5,206 Accessible Routes,Restaurants and Cafeterias,Ramp|Stair|Door|Slab,Assembly (A),sd|dd|cd,accessibility,architect,"In restaurants and cafeterias, an accessible route shall be provided to all dining areas, including raised or sunken dining areas, and outdoor dining areas."
206.2.6,206 Accessible Routes,Performance Areas,Ramp|Stair|Door|Slab|Wall,Assembly (A),sd|dd|cd,accessibility,architect,"Where a circulation path directly connects a performance area to an assembly seating area, an accessible route shall directly connect the assembly seating area with the performance area. An accessible route shall be provided from performance areas to ancillary areas or facilities used by performers unless exempted by 206.2.3 Exceptions 1 through 7."
206.2.7,206 Accessible Routes,Press Boxes,Buildingelementproxy|Ramp|Stair|Door,Assembly (A),sd|dd|cd,accessibility,architect,Press boxes in assembly areas shall be on an accessible route.
206.2.8,206 Accessible Routes,Employee Work Areas,Slab|Wall|Door,Business (B)|Educational (E)|Factory And Industrial (F)|Institutional (I)|Mercantile (M),sd|dd|cd,accessibility,architect,Common use circulation paths within employee work areas shall comply with 402.
206.2.9,206 Accessible Routes,Amusement Rides,Ramp|Rampflight|Stair|Slab|Buildingelementproxy,Assembly (A),sd|dd|cd,accessibility,architect,Amusement rides required to comply with 234 shall provide accessible routes in accordance with 206.2.9. Accessible routes serving amusement rides shall comply with Chapter 4 except as modified by 1002.2.
206.2.9.1,206 Accessible Routes,Load and Unload Areas,Pavement|Ramp|Slab|Door,Assembly (A)|Business (B)|Educational (E)|Institutional (I)|Mercantile (M),sd|dd|cd,accessibility,architect,"Load and unload areas shall be on an accessible route. Where load and unload areas have more than one loading or unloading position, at least one loading and unloading position shall be on an accessible route."
206.2.9.2,206 Accessible Routes,"Wheelchair Spaces, Ride Seats Designed for Transfer, and Transfer Devices",Ramp|Slab|Buildingelementproxy,Assembly (A),sd|dd|cd,accessibility,architect,"When amusement rides are in the load and unload position, wheelchair spaces complying with 1002.4, amusement ride seats designed for transfer complying with 1002.5, and transfer devices complying with 1002.6 shall be on an accessible route."
206.2.10,206 Accessible Routes,Recreational Boating Facilities,Ramp|Pavement|Buildingelementproxy,Assembly (A)|Utility And Miscellaneous (U),sd|dd|cd,accessibility,architect,"Boat slips required to comply with 235.2 and boarding piers at boat launch ramps required to comply with 235.3 shall be on an accessible route. Accessible routes serving recreational boating facilities shall comply with Chapter 4, except as modified by 1003.2."
206.2.11,206 Accessible Routes,Bowling Lanes,Buildingelementproxy|Ramp|Rampflight|Door|Slab,Assembly (A),sd|dd|cd,accessibility,architect,"Where bowling lanes are provided, at least 5 percent, but no fewer than one of each type of bowling lane, shall be on an accessible route."
206.2.12,206 Accessible Routes,Court Sports,Slab|Ramp|Stair|Railing|Door,Assembly (A),sd|dd|cd,accessibility,architect,"In court sports, at least one accessible route shall directly connect both sides of the court."
206.2.13,206 Accessible Routes,Exercise Machines and Equipment,Buildingelementproxy|Slab|Ramp|Door,Assembly (A)|Business (B)|Institutional (I)|Educational (E),sd|dd|cd,accessibility,architect,Exercise machines and equipment required to comply with 236 shall be on an accessible route.
206.2.14,206 Accessible Routes,Fishing Piers and Platforms,Slab|Ramp|Railing|Shadingdevice|Buildingelementproxy,Assembly (A),sd|dd|cd,accessibility,architect,Fishing piers and platforms shall be on an accessible route. Accessible routes serving fishing piers and platforms shall comply with Chapter 4 except as modified by 1005.1.
