id,section,title,body,ifc_type,occupancy,design_phase,code_category,primary_responsibility
805.3,Section 805 Structural,Existing Structural Elements Resisting Lateral Loads,"Except as permitted by Section 805.4, where the alteration increases design lateral loads, or where the alteration results in prohibited structural irregularity as defined in ASCE 7, or where the alteration decreases the capacity of any existing lateral load-carrying structural element, the structure of the altered building or structure shall meet the requirements of Sections 1609 and 1613 of the International Building Code. Reduced seismic forces shall be permitted.Exception: Any existing lateral load-carrying structural element whose demand-capacity ratio with the alteration considered is not more than 10 percent greater than its demand-capacity ratio with the alteration ignored shall be permitted to remain unaltered. For purposes of calculating demand-capacity ratios, the demand shall consider applicable load combinations with design lateral loads or forces in accordance with Sections 1609 and 1613 of the International Building Code. Reduced seismic forces shall be permitted. For purposes of this exception, comparisons of demand-capacity ratios and calculation of design lateral loads, forces and capacities shall account for the cumulative effects of additions and alterations since original construction.",Wall|Beam|Column|Slab,Assembly (A)|Business (B)|Educational (E)|Residential (R)|Storage (S),sd|dd|cd,structural_design,structural_engineer
805.4,Section 805 Structural,Voluntary Lateral Force-Resisting System Alterations,"Structural alterations that are intended exclusively to improve the lateral force resisting system and are not required by other sections of this code shall not be required to meet the requirements of Section 1609 or Section 1613 of the International Building Code, provided that the following conditions are met: The capacity of existing structural systems to resist forces is not reduced. New structural elements are detailed and connected to existing or new structural elements as required by the selected design criteria. Where approved, new lateral force-resisting systems are permitted to be of a type designated as ""Ordinary"" or ""Intermediate"" where ASCE 7 Table 12.2-1 states these types of systems are not permitted provided that both of the following apply: The selected design criteria is the International Building Code. The new ""Ordinary"" or ""Intermediate"" system provides deformation compatibility with the existing lateral force-resisting system. New or relocated nonstructural elements are detailed and connected to existing or new structural elements as required by the International Building Code for new construction. The alterations do not create a structural irregularity as defined in ASCE 7 or make an existing structural irregularity more severe.",Wall|Beam|Column|Slab|BuildingElementProxy,Assembly (A)|Business (B)|Educational (E)|Residential (R)|Institutional (I),sd|dd|cd,structural_design,structural_engineer
805.5,Section 805 Structural,Seismic Requirements for Level 2 Alterations With Increased Occupant Load of Unreinforced Masonry or Hollow Clay Tile Buildings,"In addition to the requirements in Section 805.3, Level 2 alterations meeting all of the following conditions shall comply with the applicable requirements in Sections 805.5.1 through 805.5.4. The occupant load of a building increases by more than 20 percent for occupancy groups A, I, E, R, M, B, H, or S used for storage of hazardous materials. Buildings assigned to Seismic Design Category C, D, E, or F. The building's structural system includes unreinforced masonry and hollow clay tile bearing walls. Where there is a change of occupancy with the alteration, the most restrictive seismic requirements in accordance with Section 1006 and this section shall apply. The cumulative effect of alterations compared with the original occupant load that have an increase in occupant load over time exceeding 20 percent shall comply with these provisions. EXCEPTIONS: An increase in the occupant load of less than 50 for occupancy categories A or I. An increase in the occupant load of less than 25 for E occupancies. R-3 occupancies, and all other R occupancies with an increase of 5 dwelling or sleeping units or less. An increase in occupant load of less than 100 for occupancy categories M or B. A cumulative increase in the occupant load of less than 10 for H occupancies or S occupancies using hazardous materials.",,,,,
805.5.1,Section 805 Structural,Large Buildings,"Buildings four or more stories or buildings more than 12,000 square feet shall be required to perform seismic evaluation in accordance with Section 304.3. Any lateral resisting elements shall be required to comply with design requirements for reduced seismic forces in accordance with Section 304.3.2 where found to be deficient.",,,,,
805.5.2,Section 805 Structural,Parapet Bracing,"Buildings with parapets constructed of unreinforced masonry where the parapet height to thickness ratio exceeds 1.5:1 shall be required to have parapets anchored, removed or altered to resist out-of-plane seismic forces, unless an evaluation demonstrates compliance of such items. Use of reduced seismic forces in accordance with Section 304.3.2 shall be permitted.",,,,,
805.5.3,Section 805 Structural,Floor and Roof Wall Anchors,"The alteration shall include the installation of wall anchors at the floor and roof lines, unless an evaluation demonstrates compliance of existing wall anchorage. Use of reduced seismic forces in accordance with Section 304.3.2 shall be permitted.",,,,,
805.5.4,Section 805 Structural,Bracing of Partitions and Nonstructural Walls,"Unreinforced masonry partitions and nonstructural walls within the work area and adjacent to egress paths from the alteration area shall be anchored, removed or altered to resist out-of-plane seismic forces, unless an evaluation demonstrates compliance of such items. Use of reduced seismic forces in accordance with Section 304.3.2 shall be permitted.",,,,,
806,Chapter 8 Alterations—Level 2,Electrical,,,,,none,none
806.1,Section 806 Electrical,New Installations,Newly installed electrical equipment and wiring relating to work done in any work area shall comply with all applicable requirements of NFPA 70 except as provided for in Section 806.4.,BuildingElementProxy,Assembly (A)|Business (B)|Educational (E)|Factory and Industrial (F)|Residential (R),dd|cd|ca,electrical_systems,electrical_engineer
806.2,Section 806 Electrical,Existing Installations,"Existing wiring in all work areas in Group A-1, A-2, A-5, H and I occupancies shall be upgraded to meet the materials and methods requirements of Chapter 7.",BuildingElementProxy,Assembly (A)|High Hazard (H)|Institutional (I),sd|dd|cd,electrical_systems,electrical_engineer
806.3,Section 806 Electrical,Health Care Facilities,"In Group I-2 facilities, ambulatory care facilities and outpatient clinics, any added portion of an existing electrical system shall be required to meet installation and equipment requirements in NFPA 99.",BuildingElementProxy,Institutional (I),sd|dd|cd,electrical_systems,electrical_engineer
806.4,Section 806 Electrical,Residential Occupancies,"In Group R-2, R-3 and R-4 occupancies and buildings regulated by the International Residential Code, the requirements of Sections 806.4.1 through 806.4.7 shall be applicable only to work areas located within a dwelling unit.",Wall|Door|Slab,Residential (R),sd|dd|cd,occupancy_classification,architect
806.4.1,Section 806 Electrical,Enclosed Areas,"Enclosed areas, other than closets, kitchens, basements, garages, hallways, laundry areas, utility areas, storage areas and bathrooms shall have not fewer than two duplex receptacle outlets or one duplex receptacle outlet and one ceiling or wall-type lighting outlet.",BuildingElementProxy|Wall|Slab|Door|Window,Residential (R)|Assembly (A)|Business (B),sd|dd|cd,electrical_systems,electrical_engineer
806.4.2,Section 806 Electrical,Kitchens,Kitchen areas shall have not fewer than two duplex receptacle outlets.,BuildingElementProxy,Residential (R)|Assembly (A)|Business (B),sd|dd|cd,electrical_systems,electrical_engineer
806.4.3,Section 806 Electrical,Laundry Areas,Laundry areas shall have not fewer than one duplex receptacle outlet located near the laundry equipment and installed on an independent circuit.,BuildingElementProxy,Residential (R)|Institutional (I)|Assembly (A)|Business (B),sd|dd|cd,electrical_systems,electrical_engineer
806.4.4,Section 806 Electrical,Ground Fault Circuit Interruption,Newly installed receptacle outlets shall be provided with ground fault circuit interruption as required by NFPA 70.,BuildingElementProxy,Assembly (A)|Business (B)|Educational (E)|Factory and Industrial (F)|Residential (R),dd|cd,electrical_systems,electrical_engineer
806.4.5,Section 806 Electrical,Minimum Lighting Outlets,"Not fewer than one lighting outlet shall be provided in every bathroom, hallway, stairway, attached garage and detached garage with electric power, and to illuminate outdoor entrances and exits.",BuildingElementProxy|Stair|Door,Residential (R)|Business (B)|Assembly (A),sd|dd|cd,electrical_systems,electrical_engineer
806.4.6,Section 806 Electrical,Utility Rooms and Basements,Not fewer than one lighting outlet shall be provided in utility rooms and basements where such spaces are used for storage or contain equipment requiring service.,BuildingElementProxy,Business (B)|Educational (E)|Factory and Industrial (F)|Residential (R)|Storage (S),sd|dd|cd,electrical_systems,electrical_engineer
806.4.7,Section 806 Electrical,Clearance for Equipment,Clearance for electrical service equipment shall be provided in accordance with NFPA 70.,BuildingElementProxy,Assembly (A)|Business (B)|Educational (E)|Factory and Industrial (F)|Mercantile (M),dd|cd,electrical_systems,electrical_engineer
807,Chapter 8 Alterations—Level 2,Mechanical,,,,,none,none
807.1,Section 807 Mechanical,Reconfigured or Converted Spaces,Reconfigured spaces intended for occupancy and spaces converted to habitable or occupiable space in any work area shall be provided with natural or mechanical ventilation in accordance with the International Mechanical Code.Exception: Existing mechanical ventilation systems shall comply with the requirements of Section 807.2.,Wall|Window|Door,Assembly (A)|Business (B)|Educational (E)|Mercantile (M)|Residential (R),sd|dd|cd,mechanical_systems,mechanical_engineer
807.2,Section 807 Mechanical,Altered Existing Systems,"In mechanically ventilated spaces, existing mechanical ventilation systems that are altered, reconfigured or extended shall provide not less than 5 cubic feet per minute (cfm) (0.0024 m3/s) per person of outdoor air and not less than 15 cfm (0.0071 m3/s) of ventilation air per person, or not less than the amount of ventilation air determined by the Indoor Air Quality Procedure of ASHRAE 62.1.",BuildingElementProxy,Assembly (A)|Business (B)|Educational (E)|Factory and Industrial (F)|Residential (R),sd|dd|cd,mechanical_systems,mechanical_engineer
807.3,Section 807 Mechanical,Local Exhaust,"Newly introduced devices, equipment or operations that produce airborne particulate matter, odors, fumes, vapor, combustion products, gaseous contaminants, pathogenic and allergenic organisms, and microbial contaminants in such quantities as to affect adversely or impair health or cause discomfort to occupants shall be provided with local exhaust.",MechanicalSystem|BuildingElementProxy,Assembly (A)|Business (B)|Educational (E)|Factory and Industrial (F)|Residential (R),sd|dd|cd,mechanical_systems,mechanical_engineer
808,Chapter 8 Alterations—Level 2,Plumbing,,,,,none,none
808.1,Section 808 Plumbing,Health Care Facilities,"In Group I-2 facilities, ambulatory care facilities and outpatient clinics, any added portion of an existing medical gas system shall be required to meet installation and equipment requirements in NFPA 99.",BuildingElementProxy,Institutional (I),sd|dd|cd,plumbing_systems,mechanical_engineer
809,Chapter 8 Alterations—Level 2,Energy Conservation,,,,,none,none
809.1,Section 809 Energy Conservation,Minimum Requirements,Level 2 alterations to existing buildings or structures shall comply with the Washington State Energy Code (chapter 51-11C WAC).,Wall|Roof|Slab|Window|Door,Assembly (A)|Business (B)|Educational (E)|Residential (R)|Mercantile (M),sd|dd|cd,assemblies_envelope,architect
