id,section,title,body,ifc_type,occupancy,design_phase,code_category,primary_responsibility
8,,Alterations—Level 2,"User note:About this chapter: Like Chapter 7, the purpose of this chapter is to provide detailed requirements and provisions to identify the required improvements in the existing building elements, building spaces and building structural system when a building is being altered. This chapter is distinguished from Chapters 7 and 9 by involving space reconfiguration that could be up to and including 50 percent of the area of the building. In contrast, Level 1 alterations (Chapter 7) do not involve space reconfiguration, and Level 3 alterations (Chapter 9) involve extensive space reconfiguration that exceeds 50 percent of the building area. Depending on the nature of alteration work, its location within the building, and whether it encompasses one or more tenants, improvements and upgrades could be required for the open floor penetrations, sprinkler system or the installation of additional means of egress such as stairs or fire escapes.",Wall|Slab|Stair|Door|BuildingElementProxy,Business (B)|Assembly (A)|Residential (R),sd|dd|cd,special_construction,architect
801,Chapter 8 Alterations—Level 2,General,,,,,none,none
801.1,Section 801 General,Scope,Level 2 alterations as described in Section 603 shall comply with the requirements of this chapter.Exception: Buildings in which the reconfiguration is exclusively the result of compliance with the accessibility requirements of Section 306.7.1 shall be permitted to comply with Chapter 7.,Wall|Door|Slab,Assembly (A)|Business (B)|Educational (E)|Factory and Industrial (F)|Residential (R),sd|dd|cd,means_of_egress,architect
801.2,Section 801 General,Alteration Level 1 Compliance,"In addition to the requirements of this chapter, all work shall comply with the requirements of Chapter 7.",Wall|Door|Window,Assembly (A)|Business (B)|Educational (E)|Factory and Industrial (F)|Residential (R),sd|dd|cd,fire_resistance_smoke_protection,architect
801.3,Section 801 General,System Installations,"Requirements related to work area are not applicable where the Level 2 alterations are limited solely to one or more of the following: Mechanical systems, electrical systems, fire protection systems and abatement of hazardous materials.Windows, hardware, operating controls, electrical outlets and signs.Alterations undertaken for the primary purpose of increasing the accessibility of a facility.",Window|Door|Covering|BuildingElementProxy,Assembly (A)|Business (B)|Educational (E)|Factory and Industrial (F)|Residential (R),sd|dd|cd,accessibility,architect
801.4,Section 801 General,Compliance,"New construction elements, components, systems and spaces shall comply with the requirements of the International Building Code.Exceptions: Where windows are added they are not required to comply with the light and ventilation requirements of the International Building Code.Newly installed electrical equipment shall comply with the requirements of Section 806.The length of dead-end corridors in newly constructed spaces shall only be required to comply with the provisions of Section 804.7.The minimum ceiling height of the newly created habitable and occupiable spaces and corridors shall be 7 feet (2134 mm).Where provided in below-grade transportation stations, existing and new escalators shall be permitted to have a clear width of less than 32 inches (815 mm).New structural members and connections shall be permitted to comply with alternative design criteria in accordance with Section 302.",Wall|Slab|Door|Window|Beam,Assembly (A)|Business (B)|Mercantile (M)|Residential (R)|Institutional (I),sd|dd|cd,assemblies_envelope,architect
802,Chapter 8 Alterations—Level 2,Building Elements and Materials,,,,,none,none
802.1,Section 802 Building Elements and Materials,Scope,The requirements of this section are limited to work areas in which Level 2 alterations are being performed and shall apply beyond the work area where specified.,Wall|Slab|Door,Assembly (A)|Business (B)|Educational (E)|Mercantile (M)|Residential (R),sd|dd|cd,special_construction,architect
802.2,Section 802 Building Elements and Materials,Vertical Openings,"Existing vertical openings shall comply with the provisions of Sections 802.2.1, 802.2.2 and 802.2.3.",Stair|StairFlight|Ramp|RampFlight|Wall,Assembly (A)|Business (B)|Educational (E)|Residential (R)|Institutional (I),sd|dd|cd,fire_resistance_smoke_protection,architect
802.2.1,Section 802 Building Elements and Materials,Existing Vertical Openings,"Existing interior vertical openings connecting two or more floors shall be enclosed with approved assemblies having a fire-resistance rating of not less than 1 hour with approved opening protectives.Exceptions: Where vertical opening enclosure is not required by the International Building Code or the International Fire Code.Interior vertical openings other than stairways may be blocked at the floor and ceiling of the work area by installation of not less than 2 inches (51 mm) of solid wood or equivalent construction.The enclosure shall not be required where:3.1. Connecting the main floor and mezzanines; or3.2. All of the following conditions are met:3.2.1. The communicating area has a low-hazard occupancy or has a moderate-hazard occupancy that is protected throughout by an automatic sprinkler system.3.2.2. The lowest or next-to-the-lowest level is a street floor.3.2.3. The entire area is open and unobstructed in a manner such that it is reasonable to assume that a fire in any part of the interconnected spaces will be readily obvious to all of the occupants.3.2.4. Exit capacity is sufficient to provide egress simultaneously for all occupants of all levels by considering all areas to be a single floor area for the determination of required exit capacity.3.2.5. Each floor level, considered separately, has not less than one-half of its individual required exit capacity provided by an exit or exits leading directly out of that level without having to traverse another communicating floor level or be exposed to the smoke or fire spreading from another communicating floor level.In Group A occupancies, a minimum 30-minute enclosure shall be provided to protect all vertical openings not exceeding three stories.In Group B occupancies, a minimum 30-minute enclosure shall be provided to protect all vertical openings not exceeding three stories. This enclosure, or the enclosure specified in Section 802.2.1, shall not be required in the following locations:5.1. Buildings not exceeding 3,000 square feet (279 m2) per floor.5.2. Buildings protected throughout by an approved automatic fire sprinkler system.In Group E occupancies, the enclosure shall not be required for vertical openings not exceeding three stories where the building is protected throughout by an approved automatic fire sprinkler system.In Group F occupancies, the enclosure shall not be required in the following locations:7.1. Vertical openings not exceeding three stories.7.2. Special-purpose occupancies where necessary for manufacturing operations and direct access is provided to not fewer than one protected stairway.7.3. Buildings protected throughout by an approved automatic sprinkler system.In Group H occupancies, the enclosure shall not be required for vertical openings not exceeding three stories where necessary for manufacturing operations and every floor level has direct access to not fewer than two remote enclosed stairways or other approved exits.In Group M occupancies, a minimum 30-minute enclosure shall be provided to protect all vertical openings not exceeding three stories. This enclosure, or the enclosure specified in Section 802.2.1, shall not be required in the following locations:9.1. Openings connecting only two floor levels.9.2. Occupancies protected throughout by an approved automatic sprinkler system.In Group R-1 occupancies, the enclosure shall not be required for vertical openings not exceeding three stories in the following locations:10.1. Buildings protected throughout by an approved automatic sprinkler system.10.2. Buildings with less than 25 dwelling units or sleeping units where every sleeping room above the second floor is provided with direct access to a fire escape or other approved second exit by means of an approved exterior door or window having a sill height of not greater than 44 inches (1118 mm) and where both of the following conditions are met:10.2.1. Any exit access corridor exceeding 8 feet (2438 mm) in length that serves two means of egress, one of which is an unprotected vertical opening, shall have not fewer than one of the means of egress separated from the vertical opening by a 1-hour fire barrier.10.2.2. The building is protected throughout by an automatic fire alarm system, installed and supervised in accordance with the International Building Code.In Group R-2 occupancies, a minimum 30-minute enclosure shall be provided to protect all vertical openings not exceeding three stories. This enclosure, or the enclosure specified in Section 802.2.1, shall not be required in the following locations:11.1. Vertical openings not exceeding two stories with not more than four dwelling units per floor.11.2. Buildings protected throughout by an approved automatic sprinkler system.11.3. Buildings with not more than four dwelling units per floor where every sleeping room above the second floor is provided with direct access to a fire escape or other approved second exit by means of an approved exterior door or window having a sill height of not greater than 44 inches (1118 mm) and the building is protected throughout by an automatic fire alarm system complying with Section 803.4.One- and two-family dwellings.Group S occupancies where connecting not more than two floor levels or where connecting not more than three floor levels and the structure is equipped throughout with an approved automatic sprinkler system.Group S occupancies where vertical opening protection is not required for open parking garages and ramps.",Wall|Slab|Stair|Door,Assembly (A)|Business (B)|Educational (E)|Factory and Industrial (F)|High Hazard (H),sd|dd|cd,fire_resistance_smoke_protection,architect
802.2.2,Section 802 Building Elements and Materials,Supplemental Shaft and Floor Opening Enclosure Requirements,"Where the work area on any floor exceeds 50 percent of that floor area, the enclosure requirements of Section 802.2 shall apply to vertical openings other than stairways throughout the floor.Exception: Vertical openings located in tenant spaces that are entirely outside the work area.",Wall|Slab|Floor|BuildingElementProxy,Assembly (A)|Business (B)|Educational (E)|Mercantile (M)|Residential (R),sd|dd|cd,fire_resistance_smoke_protection,architect
802.2.3,Section 802 Building Elements and Materials,Supplemental Stairway Enclosure Requirements,"Where the work area on any floor exceeds 50 percent of that floor area, stairways that are part of the means of egress serving the work area shall, at a minimum, be enclosed with smoketight construction on the highest work area floor and all floors below.Exception: Where stairway enclosure is not required by the International Building Code or the International Fire Code.",Stair|StairFlight|Wall|Door,Assembly (A)|Business (B)|Educational (E)|Factory and Industrial (F)|Residential (R),sd|dd|cd,fire_resistance_smoke_protection,architect
802.3,Section 802 Building Elements and Materials,Smoke Compartments,"In Group I-2 occupancies where the work area is on a story used for sleeping rooms for more than 30 care recipients, the story shall be divided into not less than two compartments by smoke barrier walls in accordance with Section 407.5 of the International Building Code as required for new construction.",Wall,Institutional (I),sd|dd|cd,fire_resistance_smoke_protection,architect
802.4,Section 802 Building Elements and Materials,Interior Finish,"The interior finish and trim of walls and ceilings in exits and corridors in any work area shall comply with the requirements of the International Building Code.Exception: Existing materials that do not comply with the requirements of the International Building Code shall be permitted to be treated with an approved fire-retardant coating in accordance with the manufacturer's instructions to achieve the required classification. Compliance with this section shall be demonstrated by testing the fire-retardant coating on the same material and achieving the required performance. Where the same material is not available, testing on a similar material shall be permitted.",Wall|Covering|Slab,Assembly (A)|Business (B)|Educational (E)|Institutional (I)|Residential (R),sd|dd|cd,finishes_materials,architect
802.4.1,Section 802 Building Elements and Materials,Supplemental Interior Finish Requirements,"Where the work area on any floor exceeds 50 percent of the floor area, Section 802.4 shall apply to the interior finish and trim in exits and corridors serving the work area throughout the floor.Exception: Interior finish within tenant spaces that are entirely outside the work area.",Covering|Wall|Door|Stair|Corridor,Assembly (A)|Business (B)|Educational (E)|Institutional (I)|Mercantile (M),sd|dd|cd,finishes_materials,architect
802.5,Section 802 Building Elements and Materials,Guards,The requirements of Sections 802.5.1 and 802.5.2 shall apply in all work areas.,Railing|Stair|Ramp|Slab,Assembly (A)|Business (B)|Educational (E)|Residential (R)|Mercantile (M),sd|dd|cd,means_of_egress,architect
802.5.1,Section 802 Building Elements and Materials,Minimum Requirement,"Every portion of a floor, such as a balcony or a loading dock, that is more than 30 inches (762 mm) above the floor or grade below and is not provided with guards, or those in which the existing guards are judged to be in danger of collapsing, shall be provided with guards.",Slab|Railing,Assembly (A)|Business (B)|Educational (E)|Mercantile (M)|Residential (R),sd|dd|cd,means_of_egress,architect
802.5.2,Section 802 Building Elements and Materials,Design,"Where there are no guards or where existing guards must be replaced, the guards shall be designed and installed in accordance with the International Building Code.",Railing,Assembly (A)|Business (B)|Educational (E)|Residential (R)|Institutional (I),sd|dd|cd,means_of_egress,architect
802.6,Section 802 Building Elements and Materials,Fire-Resistance Ratings,"Where approved by the code official, buildings where an automatic sprinkler system installed in accordance with Section 903.3.1.1 or 903.3.1.2 of the International Building Code has been added, and the building is now sprinklered throughout, the required fire-resistance ratings of building elements and materials shall be permitted to meet the requirements of the current building code. The building is required to meet the other applicable requirements of the International Building Code.Plans, investigation and evaluation reports, and other data shall be submitted indicating which building elements and materials the applicant is requesting the code official to review and approve for determination of applying the current building code fire-resistance ratings. Any special construction features, including fire-resistance-rated assemblies and smoke-resistive assemblies, conditions of occupancy, means-of-egress conditions, fire code deficiencies, approved modifications or approved alternative materials, design and methods of construction, and equipment applying to the building that impact required fire-resistance ratings shall be identified in the evaluation reports submitted.",Wall|Slab|Roof|Door|Window,Assembly (A)|Business (B)|Educational (E)|Residential (R)|Institutional (I),sd|dd|cd,fire_resistance_smoke_protection,architect
803,Chapter 8 Alterations—Level 2,Fire Protection,,,,,none,none
803.1,Section 803 Fire Protection,Scope,"The requirements of this section shall be limited to work areas in which Level 2 alterations are being performed, and where specified they shall apply throughout the floor on which the work areas are located or otherwise beyond the work area.",Wall|Slab|Door|Window|Roof,Assembly (A)|Business (B)|Educational (E)|Factory and Industrial (F)|Residential (R),sd|dd|cd,finishes_materials,architect
803.1.1,Section 803 Fire Protection,Corridor Ratings,"Where an approved automatic sprinkler system is installed throughout the story, the required fire-resistance rating for any corridor located on the story shall be permitted to be reduced in accordance with the International Building Code. In order to be considered for a corridor rating reduction, such system shall provide coverage for the stairway landings serving the floor and the intermediate landings immediately below.",Wall|Stair|Slab,Assembly (A)|Business (B)|Educational (E)|Institutional (I)|Residential (R),sd|dd|cd,fire_resistance_smoke_protection,architect
803.2,Section 803 Fire Protection,Automatic Sprinkler Systems,Automatic sprinkler systems shall be provided in accordance with the requirements of Sections 803.2.1 through 803.2.6. Installation requirements shall be in accordance with the International Building Code.,BuildingElementProxy,Assembly (A)|Business (B)|Educational (E)|Factory and Industrial (F)|Residential (R),sd|dd|cd,fire_protection_alarm_systems,fire_protection_engineer
803.2.1,Section 803 Fire Protection,High-Rise Buildings,"In high-rise buildings, work areas that have exits or corridors shared by more than one tenant or that have exits or corridors serving an occupant load greater than 30 shall be provided with automatic sprinkler protection in the entire work area where the work area is located on a floor that has a sufficient sprinkler water supply system from an existing standpipe or a sprinkler riser serving that floor.",Wall|Door|Stair|Slab,Assembly (A)|Business (B)|Educational (E)|Institutional (I)|Residential (R),sd|dd|cd,fire_protection_alarm_systems,fire_protection_engineer
803.2.1.1,Section 803 Fire Protection,Supplemental Automatic Sprinkler System Requirements,"Where the work area on any floor exceeds 50 percent of that floor area, Section 803.2.1 shall apply to the entire floor on which the work area is located.Exception: Occupied tenant spaces that are entirely outside the work area.",Wall|Slab|Door,Assembly (A)|Business (B)|Educational (E)|Factory and Industrial (F)|Residential (R),dd|cd,fire_protection_alarm_systems,fire_protection_engineer
803.2.2,Section 803 Fire Protection,"Groups A, B, E, F-1, H, I-1, I-3, I-4, M, R-1, R-2, R-4, S-1 and S-2","In buildings with occupancies in Groups A, B, E, F-1, H, I-1, I-3, I-4, M, R-1, R-2, R-4, S-1 and S-2, work areas that have exits or corridors shared by more than one tenant or that have exits or corridors serving an occupant load greater than 30 shall be provided with automatic sprinkler protection where both of the following conditions occur:The work area is required to be provided with automatic sprinkler protection in accordance with the International Building Code as applicable to new construction.The work area exceeds 50 percent of the floor area.Exception: If the building does not have sufficient municipal water supply for design of a fire sprinkler system available to the floor without installation of a new fire pump, work areas shall be protected by an automatic smoke detection system throughout all occupiable spaces other than sleeping units or individual dwelling units that activates the occupant notification system in accordance with Sections 907.4, 907.5 and 907.6 of the International Building Code.",Wall|BuildingElementProxy|Door|Slab,Assembly (A)|Business (B)|Educational (E)|Factory and Industrial (F)|High Hazard (H),sd|dd|cd,fire_protection_alarm_systems,fire_protection_engineer
803.2.2.1,Section 803 Fire Protection,Mixed Uses,"In work areas containing mixed uses, one or more of which requires automatic sprinkler protection in accordance with Section 803.2.2, such protection shall not be required throughout the work area provided that the uses requiring such protection are separated from those not requiring protection by fire-resistance-rated construction having a minimum 2-hour rating for Group H and a minimum 1-hour rating for all other occupancy groups.",Wall|Door,High Hazard (H)|Assembly (A)|Business (B)|Residential (R),sd|dd|cd,fire_resistance_smoke_protection,architect
803.2.3,Section 803 Fire Protection,Group I-2,"In Group I-2 occupancies, an automatic sprinkler system installed in accordance with Section 903.3.1.1 of the International Fire Code shall be provided in the following In Group I-2, Condition 1, throughout the work area.In Group I-2, Condition 2, throughout the work area where the work area is 50 percent or less of the smoke compartment.In Group I-2, Condition 2, throughout the smoke compartment in which the work occurs where the work area exceeds 50 percent of the smoke compartment.",Wall|Slab|Door|Roof,Institutional (I),sd|dd|cd,fire_protection_alarm_systems,fire_protection_engineer
803.2.4,Section 803 Fire Protection,Windowless Stories,"Work located in a windowless story, as determined in accordance with the International Building Code, shall be sprinklered where the work area is required to be sprinklered under the provisions of the International Building Code for newly constructed buildings and the building has a sufficient municipal water supply without installation of a new fire pump.",Slab|Wall|Window,Assembly (A)|Business (B)|Educational (E)|Institutional (I)|Residential (R),sd|dd|cd,fire_protection_alarm_systems,fire_protection_engineer
803.2.5,Section 803 Fire Protection,Other Required Automatic Sprinkler Systems,"In buildings and areas listed in Table 903.2.11.6 of the International Building Code, work areas that have exits or corridors shared by more than one tenant or that have exits or corridors serving an occupant load greater than 30 shall be provided with an automatic sprinkler system under the following conditions The work area is required to be provided with an automatic sprinkler system in accordance with the International Building Code applicable to new construction; andThe building has sufficient municipal water supply for design of an automatic sprinkler system available to the floor without installation of a new fire pump.",Wall|Slab|Door,Assembly (A)|Business (B)|Educational (E)|Residential (R)|Institutional (I),sd|dd|cd,fire_protection_alarm_systems,fire_protection_engineer
803.2.6,Section 803 Fire Protection,Supervision,"Fire sprinkler systems required by this section shall be supervised by one of the following methods:Approved central station system in accordance with NFPA 72.Approved proprietary system in accordance with NFPA 72.Approved remote station system of the jurisdiction in accordance with NFPA 72.Where approved by the code official, approved local alarm service that will cause the sounding of an alarm in accordance with NFPA 72.Exception: Supervision is not required for the following:Underground key or hub gate valves in roadway boxes.Halogenated extinguishing systems.Carbon dioxide extinguishing systems.Dry- and wet-chemical extinguishing systems.Automatic sprinkler systems installed in accordance with NFPA 13R where a common supply main is used to supply both domestic and automatic sprinkler systems and a separate shutoff valve for the automatic sprinkler system is not provided.",BuildingElementProxy,Assembly (A)|Business (B)|Educational (E)|Factory and Industrial (F)|High Hazard (H),dd|cd,fire_protection_alarm_systems,fire_protection_engineer
803.3,Section 803 Fire Protection,Standpipes,"Where the work area includes exits or corridors shared by more than one tenant and is located more than 50 feet (15 240 mm) above or below the lowest level of fire department access, a standpipe system shall be provided. Standpipes shall have an approved fire department connection with hose connections at each floor level above or below the lowest level of fire department access. Standpipe systems shall be installed in accordance with the International Building Code.Exceptions: A pump shall not be required provided that the standpipes are capable of accepting delivery by fire department apparatus of not less than 250 gallons per minute (gpm) at 65 pounds per square inch (psi) (946 L/m at 448 KPa) to the topmost floor in buildings equipped throughout with an automatic sprinkler system or not less than 500 gpm at 65 psi (1892 L/m at 448 KPa) to the topmost floor in all other buildings. Where the standpipe terminates below the topmost floor, the standpipe shall be designed to meet (gpm/psi) (L/m/KPa) requirements of this exception for possible future extension of the standpipe.The interconnection of multiple standpipe risers shall not be required.",BuildingElementProxy|Wall|Ramp|Stair|Slab,Assembly (A)|Business (B)|Educational (E)|Institutional (I)|Residential (R),sd|dd|cd,fire_protection_alarm_systems,fire_protection_engineer
803.4,Section 803 Fire Protection,Fire Alarm and Detection,"An approved fire alarm system shall be installed in accordance with Sections 803.4.1 through 803.4.2. Where automatic sprinkler protection is provided in accordance with Section 803.2 and is connected to the building fire alarm system, automatic heat detection shall not be required.An approved automatic fire detection system shall be installed in accordance with the provisions of this code and NFPA 72. Devices, combinations of devices, appliances, and equipment shall be approved. The automatic fire detectors shall be smoke detectors, except that an approved alternative type of detector shall be installed in spaces such as boiler rooms, where products of combustion are present during normal operation in sufficient quantity to actuate a smoke detector.",Wall|BuildingElementProxy,Assembly (A)|Business (B)|Educational (E)|Factory and Industrial (F)|Residential (R),sd|dd|cd,fire_protection_alarm_systems,fire_protection_engineer
