id,section,title,body,ifc_type,occupancy,design_phase,code_category,primary_responsibility
803.4.1,Section 803 Fire Protection,Occupancy Requirements,"A fire alarm system shall be installed in accordance with Sections 803.4.1.1 through 803.4.1.6. Existing alarm-notification appliances shall be automatically activated throughout the building. Where the building is not equipped with a fire alarm system, alarm-notification appliances within the work area shall be provided and automatically activated.Exceptions:Occupancies with an existing, previously approved fire alarm system.Where selective notification is permitted, alarm-notification appliances shall be automatically activated in the areas selected.",BuildingElementProxy,Assembly (A)|Business (B)|Educational (E)|Institutional (I)|Residential (R),sd|dd|cd,fire_protection_alarm_systems,fire_protection_engineer
803.4.1.1,Section 803 Fire Protection,Group E,A fire alarm system shall be installed in work areas of Group E occupancies as required by the International Fire Code for existing Group E occupancies.,BuildingElementProxy,Educational (E),sd|dd|cd,fire_protection_alarm_systems,fire_protection_engineer
803.4.1.2,Section 803 Fire Protection,Group I-1,An automatic fire alarm system shall be installed in work areas of Group I-1 facilities as required by Chapter 11 of the International Fire Code for existing Group I-1 occupancies.,BuildingElementProxy,Institutional (I),sd|dd|cd,fire_protection_alarm_systems,fire_protection_engineer
803.4.1.3,Section 803 Fire Protection,Group I-2,An automatic fire alarm system shall be installed throughout Group I-2 occupancies as required by Chapter 11 of the International Fire Code.,BuildingElementProxy,Institutional (I),sd|dd|cd,fire_protection_alarm_systems,fire_protection_engineer
803.4.1.4,Section 803 Fire Protection,Group I-3,A fire alarm system shall be installed in work areas of Group I-3 occupancies as required by the International Fire Code.,BuildingElementProxy,Institutional (I),sd|dd|cd,fire_protection_alarm_systems,fire_protection_engineer
803.4.1.5,Section 803 Fire Protection,Group R-1,A fire alarm system shall be installed in Group R-1 occupancies as required by the International Fire Code for existing Group R-1 occupancies.,BuildingElementProxy,Residential (R),sd|dd|cd,fire_protection_alarm_systems,fire_protection_engineer
803.4.1.6,Section 803 Fire Protection,Group R-2,A fire alarm system shall be installed in work areas of Group R-2 apartment buildings as required by the International Fire Code for existing Group R-2 occupancies.,BuildingElementProxy,Residential (R),sd|dd|cd,fire_protection_alarm_systems,fire_protection_engineer
803.4.2,Section 803 Fire Protection,Supplemental Fire Alarm System Requirements,"Where the work area on any floor exceeds 50 percent of that floor area, Section 803.4.1 shall apply throughout the floor.Exception: Alarm-initiating and notification appliances shall not be required to be installed in tenant spaces outside of the work area.",Wall|Door|BuildingElementProxy,Business (B)|Assembly (A)|Residential (R)|Educational (E)|Mercantile (M),sd|dd|cd,fire_protection_alarm_systems,fire_protection_engineer
804,Chapter 8 Alterations—Level 2,Means of Egress,,,,,none,none
804.1,Section 804 Means of Egress,Scope,"The requirements of this section shall be limited to work areas that include exits or corridors shared by more than one tenant within the work area in which Level 2 alterations are being performed, and where specified they shall apply throughout the floor on which the work areas are located or otherwise beyond the work area.",Wall|Door|Corridor|Stair|Ramp,Assembly (A)|Business (B)|Educational (E)|Institutional (I)|Mercantile (M),sd|dd|cd,means_of_egress,architect
804.2,Section 804 Means of Egress,General,"The means of egress shall comply with the requirements of this section.Exceptions: Where the work area and the means of egress serving it complies with NFPA 101.Means of egress complying with the requirements of the building code under which the building was constructed shall be considered to be compliant means of egress if, in the opinion of the code official, they do not constitute a distinct hazard to life.",Door|Stair|Ramp|Corridor|RampFlight,Assembly (A)|Business (B)|Educational (E)|Institutional (I)|Residential (R),sd|dd|cd,means_of_egress,architect
804.3,Section 804 Means of Egress,Group I-2,"In Group I-2 occupancies, in areas where corridors are used for movement of care recipients in beds, the clear width of ramps and corridors shall be not less than 48 inches (1219 mm).",Ramp|RampFlight|Slab,Institutional (I),sd|dd|cd,accessibility,architect
804.4,Section 804 Means of Egress,Number of Exits,The number of exits shall be in accordance with Sections 804.4.1 through 804.4.3.,,,,,
804.4.1,Section 804 Means of Egress,Minimum Number,"Every story utilized for human occupancy on which there is a work area that includes exits or corridors shared by more than one tenant within the work area shall be provided with the minimum number of exits based on the occupancy and the occupant load in accordance with the International Building Code. In addition, the exits shall comply with Sections 804.4.1.1 and 804.4.1.2.",,,,,
804.4.1.1,Section 804 Means of Egress,Single-Exit Buildings,"A single exit or access to a single exit shall be permitted from spaces, any story or any occupied roof where one of the following conditions exists:The occupant load, number of dwelling units and exit access travel distance do not exceed the values in Table 804.4.1.1(1) or Table 804.4.1.1(2).In Group R-1 or R-2, buildings without an approved automatic sprinkler system, individual single-story or multiple-story dwelling or sleeping units shall be permitted to have a single exit or access to a single exit from the dwelling or sleeping unit provided one of the following criteria are met:2.1. The occupant load is not greater than 10 and the exit access travel distance within the unit does not exceed 75 feet (22 860 mm).2.2. The building is not more than three stories in height; all third-story space is part of dwelling with an exit access doorway on the second story; and the portion of the exit access travel distance from the door to any habitable room within any such unit to the unit entrance doors does not exceed 50 feet (15 240 mm).In buildings of Group R-2 occupancy of any number of stories with not more than four dwelling units per floor served by an interior exit stairway; with a smokeproof enclosure in accordance with Sections 909.20 and 1023.12 of the International Building Code or an exterior stairway as an exit; and where the portion of the exit access travel distance from the dwelling unit entrance door to the exit is not greater than 20 feet (6096 mm).TABLE 804.4.1.1(1)STORIES WITH ONE EXIT OR ACCESS TO ONE EXIT FOR R-2 OCCUPANCIES STORY OCCUPANCY MAXIMUM NUMBER OF DWELLING UNITS MAXIMUM EXIT ACCESS TRAVEL DISTANCE (feet) Basement, first or second story above grade plane R-2a 4 dwelling units 50 Third story above grade plane and higher NP NA NA For SI: 1 foot = 304.8 mm.NP = Not Permitted.NA = Not Applicable.Group R-2, without an approved automatic sprinkler system and provided with emergency escape and rescue openings in accordance with Section 1031 of the International Building Code.TABLE 804.4.1.1(2)STORIES WITH ONE EXIT OR ACCESS TO ONE EXIT FOR OTHER OCCUPANCIES STORY OCCUPANCY MAXIMUM OCCUPANT LOAD PER STORY MAXIMUM EXIT ACCESS TRAVEL DISTANCE (feet) First story above or below grade plane B, F-2, S-2a 35 75 Second story above grade plane B, F-2, S-2a 35 75 Third story above grade plane and higher NP NA NA For SI: 1 foot = 304.8 mm.NP = Not Permitted.NA = Not Applicable.The length of exit access travel distance in a Group S-2 open parking garage shall be not more than 100 feet.",,,,,
804.4.1.2,Section 804 Means of Egress,Fire Escapes Required,"For other than Group I-2, where more than one exit is required, an existing or newly constructed fire escape complying with Section 804.4.1.2.1 shall be accepted as providing one of the required means of egress.",,,,,
804.4.1.2.1,Section 804 Means of Egress,Fire Escape Access and Details,"Fire escapes shall comply with all of the following requirements:Occupants shall have unobstructed access to the fire escape without having to pass through a room subject to locking.Access to a new fire escape shall be through a door, except that windows shall be permitted to provide access from single dwelling units or sleeping units in Group R-1, R-2 and I-1 occupancies or to provide access from spaces having a maximum occupant load of 10 in other occupancy classifications.2.1. The window shall have a minimum net clear opening of 5.7 square feet (0.53 m2) or 5 square feet (0.46 m2) where located at grade.2.2. The minimum net clear opening height shall be 24 inches (610 mm) and net clear opening width shall be 20 inches (508 mm).2.3. The bottom of the clear opening shall not be greater than 44 inches (1118 mm) above the floor.2.4. The operation of the window shall comply with the operational constraints of the International Building Code.Newly constructed fire escapes shall be permitted only where exterior stairways cannot be utilized because of lot lines limiting the stairway size or because of the sidewalks, alleys, or roads at grade level.Openings within 10 feet (3048 mm) of fire escape stairways shall be protected by fire assemblies having minimum 3/4-hour fire-resistance ratings.Exception: Opening protection shall not be required in buildings equipped throughout with an approved automatic sprinkler system.In all buildings of Group E occupancy, up to and including the 12th grade, buildings of Group I occupancy, rooming houses and childcare centers, ladders of any type are prohibited on fire escapes used as a required means of egress.",,,,,
804.4.1.2.2,Section 804 Means of Egress,Construction,The fire escape shall be designed to support a live load of 100 pounds per square foot (4788 Pa) and shall be constructed of steel or other approved noncombustible materials. Fire escapes constructed of wood not less than nominal 2 inches (51 mm) thick are permitted on buildings of Type V construction. Walkways and railings located over or supported by combustible roofs in buildings of Types III and IV construction are permitted to be of wood not less than nominal 2 inches (51 mm) thick.,,,,,
804.4.1.2.3,Section 804 Means of Egress,Dimensions,"Stairways shall be not less than 22 inches (559 mm) wide with risers not more than, and treads not less than, 8 inches (203 mm). Landings at the foot of stairways shall be not less than 40 inches (1016 mm) wide by 36 inches (914 mm) long and located not more than 8 inches (203 mm) below the door.",,,,,
804.4.2,Section 804 Means of Egress,Mezzanines,Mezzanines in the work area and with an occupant load of more than 50 or in which the travel distance to an exit exceeds 75 feet (22 860 mm) shall have access to not fewer than two independent means of egress.Exception: Two independent means of egress are not required where the travel distance to an exit does not exceed 100 feet (30 480 mm) and the building is protected throughout with an automatic sprinkler system.,,,,,
804.4.3,Section 804 Means of Egress,Main Entrance—Group A,"Buildings of Group A with an occupant load of 300 or more shall be provided with a main entrance capable of serving as the main exit with an egress capacity of not less than one-half of the total occupant load. The remaining exits shall be capable of providing one-half of the total required exit capacity.Exception: Where a main exit is not well defined or where multiple main exits are provided, exits shall be permitted to be distributed around the perimeter of the building provided that the total width of egress is not less than 100 percent of the required width.",,,,,
804.5,Section 804 Means of Egress,Egress Doorways,Egress doorways in any work area shall comply with Sections 804.5.1 through 804.5.5.,,,,,
804.5.1,Section 804 Means of Egress,Two Egress Doorways Required,Work areas shall be provided with two egress doorways in accordance with the requirements of Sections 804.5.1.1 and 804.5.1.2.,,,,,
804.5.1.1,Section 804 Means of Egress,Occupant Load and Travel Distance,"In any work area, all rooms and spaces having an occupant load greater than 50 or in which the travel distance to an exit exceeds 75 feet (22 860 mm) shall have not fewer than two egress doorways.Exceptions: Storage rooms having a maximum occupant load of 10.Where the work area is served by a single exit in accordance with Section 804.4.1.1.",,,,,
804.5.1.2,Section 804 Means of Egress,Group I-2,"In Group I-2, Condition 2 work areas that include altered care suites shall comply with Sections 407.4.4 through 407.4.4.6.2 of the International Building Code.",,,,,
804.5.2,Section 804 Means of Egress,Door Swing,"In the work area and in the egress path from any work area to the exit discharge, all egress doors serving an occupant load greater than 50 shall swing in the direction of exit travel.",,,,,
804.5.2.1,Section 804 Means of Egress,Supplemental Requirements for Door Swing,"Where the work area exceeds 50 percent of the floor area, door swing shall comply with Section 804.5.2 throughout the floor.Exception: Means of egress within or serving only a tenant space that is entirely outside the work area.",,,,,
804.5.3,Section 804 Means of Egress,Door Closing,"In any work area, all doors opening onto an exit passageway at grade or an exit stairway shall be self-closing or automatic-closing by listed closing devices.Exceptions: Where exit enclosure is not required by the International Building Code.Means of egress within or serving only a tenant space that is entirely outside the work area.",,,,,
804.5.3.1,Section 804 Means of Egress,Supplemental Requirements for Door Closing,"Where the work area exceeds 50 percent of the floor area, doors shall comply with Section 804.5.3 throughout the exit stairway from the work area to, and including, the level of exit discharge.",,,,,
804.5.4,Section 804 Means of Egress,Panic and Fire Exit Hardware,"In any work area, and in the egress path from any work area to the exit discharge, in buildings or portions thereof of Group A assembly occupancies with an occupant load greater than 100, all required exit doors equipped with latching devices shall be equipped with approved panic or fire exit hardware in accordance with Section 1010.2.9 of the International Building Code.",,,,,
804.5.4.1,Section 804 Means of Egress,Supplemental Requirements for Panic Hardware,"Where the work area exceeds 50 percent of the floor area, panic hardware shall comply with Section 804.5.4 throughout the floor.Exception: Means of egress within a tenant space that is entirely outside the work area.",,,,,
804.5.5,Section 804 Means of Egress,Emergency Power Source in Group I-3,Power-operated sliding doors or power-operated locks for swinging doors shall be operable by a manual release mechanism at the door. Emergency power shall be provided for the doors and locks in accordance with Section 2702 of the International Building Code.Exceptions: Emergency power is not required in facilities with 10 or fewer locks complying with the exception to Section 408.4.1 of the International Building Code.Emergency power is not required where remote mechanical operating releases are provided.,,,,,
804.6,Section 804 Means of Egress,Openings in Corridor Walls,Openings in corridor walls in any work area shall comply with Sections 804.6.1 through 804.6.4.Exception: Openings in corridors where such corridors are not required to be rated in accordance with the International Building Code.,,,,,
804.6.1,Section 804 Means of Egress,Corridor Doors,"Corridor doors in the work area shall not be constructed of hollow core wood and shall not contain louvers. Dwelling unit or sleeping unit corridor doors in work areas in buildings of Groups R-1, R-2 and I-1 shall be not less than 13/8-inch (35 mm) solid core wood or approved equivalent and shall not have any glass panels, other than approved wired glass or other approved glazing material in metal frames. Dwelling unit or sleeping unit corridor doors in work areas in buildings of Groups R-1, R-2 and I-1 shall be equipped with approved door closers. Replacement doors shall be 13/4-inch (44 mm) solid bonded wood core or approved equivalent, unless the existing frame will accommodate only a 13/8-inch (35 mm) door.Exceptions: Corridor doors within a dwelling unit or sleeping unit.Existing doors meeting the requirements of Guidelines on Fire Ratings of Archaic Materials and Assemblies (Resource A) for a rating of 15 minutes or more shall be accepted as meeting the provisions of this requirement.Existing doors in buildings protected throughout with an approved automatic sprinkler system shall be required only to resist smoke, be reasonably tight fitting and shall not contain louvers.In group homes with not more than 15 occupants and that are protected with an approved automatic detection system, closing devices are not required.Door assemblies having a fire protection rating of not less than 20 minutes.",,,,,
804.6.2,Section 804 Means of Egress,Transoms,"In all buildings of Group I-1, I-2, R-1 and R-2 occupancies, all transoms in corridor walls in work areas shall be either glazed with 1/4-inch (6.4 mm) wired glass set in metal frames or other glazing assemblies having a fire protection rating as required for the door and permanently secured in the closed position or sealed with materials consistent with the corridor construction.",,,,,
804.6.3,Section 804 Means of Egress,Other Corridor Openings,"In any work area, unless protected in accordance with Section 716 of the International Building Code, any other sash, grille or opening in a corridor, and any window in a corridor not opening to the outside air, shall be sealed with materials consistent with the corridor construction.",,,,,
804.6.3.1,Section 804 Means of Egress,Supplemental Requirements for Other Corridor Opening,"Where the work area exceeds 50 percent of the floor area, Section 804.6.3 shall be applicable to all corridor windows, grills, sashes and other openings on the floor.Exception: Means of egress within or serving only a tenant space that is entirely outside the work area.",,,,,
804.6.4,Section 804 Means of Egress,Supplemental Requirements for Corridor Openings,"Where the work area on any floor exceeds 50 percent of the floor area, the requirements of Sections 804.6.1 through 804.6.3 shall apply throughout the floor.",,,,,
804.7,Section 804 Means of Egress,Dead-End Corridors,"Dead-end corridors in any work area shall not exceed 35 feet (10 670 mm). In Group I-2 occupancies, dead-end corridors shall not exceed 30 feet (9144 mm).Exceptions: Where dead-end corridors of greater length are permitted by the International Building Code.In other than Group A, I-2 and H occupancies, the maximum length of an existing dead-end corridor shall be 50 feet (15 240 mm) in buildings equipped throughout with an automatic fire alarm system installed in accordance with the International Building Code.In other than Group A, I-2 and H occupancies, the maximum length of an existing dead-end corridor shall be 70 feet (21 356 mm) in buildings equipped throughout with an automatic sprinkler system installed in accordance with the International Building Code.In other than Group A, I-2 and H occupancies, the maximum length of an existing, newly constructed, or extended dead-end corridor shall not exceed 50 feet (15 240 mm) on floors equipped with an automatic sprinkler system installed in accordance with the International Building Code.",,,,,
804.8,Section 804 Means of Egress,Means-of-Egress Lighting,"Means-of-egress lighting shall be in accordance with this section, as applicable.",,,,,
804.8.1,Section 804 Means of Egress,Artificial Lighting Required,Means of egress in all work areas shall be provided with artificial lighting in accordance with the requirements of the International Building Code.,,,,,
804.8.2,Section 804 Means of Egress,Supplemental Requirements for Means-of-Egress Lighting,"Where the work area on any floor exceeds 50 percent of that floor area, means of egress throughout the floor shall comply with Section 804.8.1.Exception: Means of egress within or serving only a tenant space that is entirely outside the work area.",,,,,
804.9,Section 804 Means of Egress,Exit Signs,"Exit signs shall be in accordance with this section, as applicable.",,,,,
804.9.1,Section 804 Means of Egress,Work Areas,Means of egress in all work areas shall be provided with exit signs in accordance with the requirements of the International Building Code.,,,,,
804.9.2,Section 804 Means of Egress,Supplemental Requirements for Exit Signs,"Where the work area on any floor exceeds 50 percent of that floor area, means of egress throughout the floor shall comply with Section 804.9.1.Exception: Means of egress within a tenant space that is entirely outside the work area.",,,,,
804.10,Section 804 Means of Egress,Handrails,"The requirements of Sections 804.10.1 and 804.10.2 shall apply to handrails from the work area floor to, and including, the level of exit discharge.",,,,,
804.10.1,Section 804 Means of Egress,Minimum Requirement,"Every required exit stairway that is part of the means of egress for any work area and that has three or more risers and is not provided with not fewer than one handrail, or in which the existing handrails are judged to be in danger of collapsing, shall be provided with handrails for the full length of the stairway on not fewer than one side. Exit stairways with a required egress width of more than 66 inches (1676 mm) shall have handrails on both sides.",,,,,
804.10.2,Section 804 Means of Egress,Design,Handrails required in accordance with Section 804.10.1 shall be designed and installed in accordance with the provisions of the International Building Code.,,,,,
804.11,Section 804 Means of Egress,Refuge Areas,"Where alterations affect the configuration of an area utilized as a refuge area, the capacity of the refuge area shall not be reduced below the required capacity of the refuge area for horizontal exits in accordance with Section 1026.4 of the International Building Code. Where the horizontal exit also forms a smoke compartment, the capacity of the refuge area for Group I-1, I-2 and I-3 occupancies and Group B ambulatory care facilities shall not be reduced below that required in Sections 407.5.3, 408.6.2, 420.6.1 and 422.3.2 of the International Building Code, as applicable.",,,,,
804.12,Section 804 Means of Egress,Guards,"The requirements of Sections 804.12.1 and 804.12.2 shall apply to guards from the work area floor to, and including, the level of exit discharge but shall be confined to the egress path of any work area.",,,,,
804.12.1,Section 804 Means of Egress,Minimum Requirement,"Every open portion of a stairway, landing, or balcony that is more than 30 inches (762 mm) above the floor or grade below and is not provided with guards, or those portions in which existing guards are judged to be in danger of collapsing, shall be provided with guards.",,,,,
804.12.2,Section 804 Means of Egress,Design,Guards required in accordance with Section 804.12.1 shall be designed and installed in accordance with the International Building Code.,,,,,
805,Chapter 8 Alterations—Level 2,Structural,,,,,none,none
805.1,Section 805 Structural,General,Structural elements and systems within buildings undergoing Level 2 alterations shall comply with this section.,Wall|Beam|Column|Slab|Roof,Assembly (A)|Business (B)|Educational (E)|Factory and Industrial (F)|Residential (R),sd|dd|cd,structural_design,structural_engineer
805.2,Section 805 Structural,Existing Structural Elements Carrying Gravity Loads,"Any existing gravity load-carrying structural element for which an alteration causes an increase in design dead, live or snow load, including snow drift effects, of more than 5 percent shall be replaced or altered as needed to carry the gravity loads required by the International Building Code for new structures. Any existing gravity load-carrying structural element whose gravity load-carrying capacity is decreased as part of the alteration shall be shown to have the capacity to resist the applicable design dead, live and snow loads, including snow drift effects, required by the International Building Code for new structures.Exceptions: Buildings of Group R occupancy with not more than five dwelling or sleeping units used solely for residential purposes where the altered building complies with the conventional light-frame construction methods of the International Building Code or the provisions of the International Residential Code.Buildings in which the increased dead load is attributable to the addition of a second layer of roof covering weighing 3 pounds per square foot (0.1437 kN/m2) or less over an existing single layer of roof covering.",Beam|Column|Slab|Footing,Residential (R)|Business (B)|Assembly (A),sd|dd|cd,structural_design,structural_engineer
