id,section,title,ifc_type,occupancy,design_phase,code_category,primary_responsibility,body
15,,Roof Assemblies and Rooftop Structures,Roof|Slab|BuildingElementProxy,Assembly (A)|Business (B)|Residential (R)|Institutional (I)|Mercantile (M),sd|dd|cd,assemblies_envelope,architect,"User note: Code change proposals to sections preceded by the designation [BF], [BG] or [P] will be considered by one of the code development committees meeting during the 2015 (Group A) Code Development Cycle. All other code change proposals will be considered by the IBC — Structural Code Development Committee during the 2016 (Group B) Code Development Cycle. See explanation on page iv."
1501,Chapter 15 Roof Assemblies and Rooftop Structures,General,,,,none,none,
1501.1,Section 1501 General,Scope,Roof|Slab|Covering,Assembly (A)|Business (B)|Residential (R)|Educational (E)|Mercantile (M),sd|dd|cd,assemblies_envelope,architect,"The provisions of this chapter shall govern the design, materials, construction and quality of roof assemblies, and rooftop structures."
1502,Chapter 15 Roof Assemblies and Rooftop Structures,Definitions,,,,,,
1502.1,Section 1502 Definitions,Definitions,,,,,,The following terms are defined in Chapter 2: AGGREGATE. BALLAST. BUILDING-INTEGRATED PHOTOVOLTAIC (BIPV) PRODUCT. BUILT-UP ROOF COVERING. INTERLAYMENT. MECHANICAL EQUIPMENT SCREEN. METAL ROOF PANEL. METAL ROOF SHINGLE. MODIFIED BITUMEN ROOF COVERING. PENTHOUSE. PHOTOVOLTAIC MODULE. PHOTOVOLTAIC PANEL. PHOTOVOLTAIC PANEL SYSTEM. PHOTOVOLTAIC SHINGLES. POSITIVE ROOF DRAINAGE. RADIANT BARRIER. REROOFING. ROOF ASSEMBLY. ROOF COVERING. ROOF COVERING SYSTEM. ROOF DECK. ROOF RECOVER. ROOF REPAIR. ROOF REPLACEMENT. ROOF VENTILATION. ROOFTOP STRUCTURE. SCUPPER. SINGLE-PLY MEMBRANE. UNDERLAYMENT. VEGETATIVE ROOF.
1503,Chapter 15 Roof Assemblies and Rooftop Structures,Weather Protection,,,,none,none,
1503.1,Section 1503 Weather Protection,General,Roof|Covering,Assembly (A)|Business (B)|Educational (E)|Factory and Industrial (F)|Residential (R),sd|dd|cd,assemblies_envelope,architect,Roof decks shall be covered with approved roof coverings secured to the building or structure in accordance with the provisions of this chapter. Roof coverings shall be designed and installed in accordance with this code and the approved manufacturer's instructions such that the roof covering shall serve to protect the building or structure.
1503.2,Section 1503 Weather Protection,Flashing,Wall|Roof|Covering|Slab,Assembly (A)|Business (B)|Educational (E)|Residential (R)|Mercantile (M),sd|dd|cd,assemblies_envelope,architect,"Flashing shall be installed in such a manner so as to prevent moisture entering the wall and roof through joints in copings, through moisture-permeable materials and at intersections with parapet walls and other penetrations through the roof plane."
1503.2.1,Section 1503 Weather Protection,Locations,Wall|Roof|Covering|Slab|Window,Assembly (A)|Business (B)|Educational (E)|Factory and Industrial (F)|Residential (R),sd|dd|cd,assemblies_envelope,architect,"Flashing shall be installed at wall and roof intersections, at gutters, wherever there is a change in roof slope or direction and around roof openings. Where flashing is of metal, the metal shall be corrosion resistant with a thickness of not less than 0.019 inch (0.483 mm) (No. 26 galvanized sheet)."
1503.3,Section 1503 Weather Protection,Coping,,,,,,"Parapet walls shall be properly coped with noncombustible, weatherproof materials of a width no less than the thickness of the parapet wall."
1503.4,Section 1503 Weather Protection,Roof Drainage,,,,,,"Design and installation of roof drainage systems shall comply with Section 1503 of this code and Sections 1106 and 1108, as applicable, of the International Plumbing Code."
1503.4.1,Section 1503 Weather Protection,Secondary (Emergency Overflow) Drains or Scuppers,,,,,,"Where roof drains are required, secondary (emergency overflow) roof drains or scuppers shall be provided where the roof perimeter construction extends above the roof in such a manner that water will be entrapped if the primary drains allow buildup for any reason. The installation and sizing of secondary emergency overflow drains, leaders and conductors shall comply with Sections 1106 and 1108, as applicable, of the International Plumbing Code."
1503.4.2,Section 1503 Weather Protection,Scuppers,,,,,,"When scuppers are used for secondary (emergency overflow) roof drainage, the quantity, size, location and inlet elevation of the scuppers shall be sized to prevent the depth of ponding water from exceeding that for which the roof was designed as determined by Section 1611.1. Scuppers shall not have an opening dimension of less than 4 inches (102 mm). The flow through the primary system shall not be considered when locating and sizing scuppers."
1503.4.3,Section 1503 Weather Protection,Gutters,,,,,,"Gutters and leaders placed on the outside of buildings, other than Group R-3, private garages and buildings of Type V construction, shall be of noncombustible material or a minimum of Schedule 40 plastic pipe."
1503.5,Section 1503 Weather Protection,Attic and Rafter Ventilation,,,,,,Intake and exhaust vents shall be provided in accordance with Section 1203.2 and the vent product manufacturer's installation instructions.
1503.6,Section 1503 Weather Protection,Crickets and Saddles,,,,,,A cricket or saddle shall be installed on the ridge side of any chimney or penetration greater than 30 inches (762 mm) wide as measured perpendicular to the slope. Cricket or saddle coverings shall be sheet metal or of the same material as the roof covering. Exception: Unit skylights installed in accordance with Section 2405.5 and flashed in accordance with the manufacturer's instructions shall be permitted to be installed without a cricket or saddle.
1504,Chapter 15 Roof Assemblies and Rooftop Structures,Performance Requirements,,,,none,none,
1504.1,Section 1504 Performance Requirements,Wind Resistance of Roofs,Roof|Slab|Covering,Assembly (A)|Business (B)|Educational (E)|Residential (R)|Mercantile (M),sd|dd|cd,assemblies_envelope,architect,"Roof decks and roof coverings shall be designed for wind loads in accordance with Chapter 16 and Sections 1504.2, 1504.3 and 1504.4."
1504.1.1,Section 1504 Performance Requirements,Wind Resistance of Asphalt Shingles,,,,,,"Asphalt shingles shall be tested in accordance with ASTM D7158. Asphalt shingles shall meet the classification requirements of Table 1504.1.1 for the appropriate maximum basic wind speed. Asphalt shingle packaging shall bear a label to indicate compliance with ASTM D7158 and the required classification in Table 1504.1.1. Exception: Asphalt shingles that are not included in the scope of ASTM D7158 shall be tested and labeled to indicate compliance with ASTM D3161 and the required classification in Table 1504.1.1. TABLE 1504.1.1 CLASSIFICATION OF ASPHALT SHINGLES MAXIMUM BASIC WIND SPEED, Vult, FROM FIGURE 1609.3(1), 1609.3(2), 1609.3(3) OR ASCE 7 MAXIMUM BASIC WIND SPEED, Vasd, FROM TABLE 1609.3.1 ASTM D7158a CLASSIFICATION ASTM D3161 CLASSIFICATION 110 85 D, G or H A, D or F 116 90 D, G or H A, D or F 129 100 G or H A, D or F 142 110 G or H F 155 120 G or H F 168 130 H F 181 140 H F 194 150 H F For SI: 1 foot = 304.8 mm; 1 mph = 0.447 m/s. The standard calculations contained in ASTM D7158 assume Exposure Category B or C and building height of 60 feet or less. Additional calculations are required for conditions outside of these assumptions."
1504.2,Section 1504 Performance Requirements,Wind Resistance of Clay and Concrete Tile,,,,,,Wind loads on clay and concrete tile roof coverings shall be in accordance with Section 1609.5.
1504.2.1,Section 1504 Performance Requirements,Testing,,,,,,Testing of concrete and clay roof tiles shall be in accordance with Sections 1504.2.1.1 and 1504.2.1.2.
1504.2.1.1,Section 1504 Performance Requirements,Overturning Resistance,,,,,,Concrete and clay roof tiles shall be tested to determine their resistance to overturning due to wind in accordance with SBCCI SSTD 11 and Chapter 15.
1504.2.1.2,Section 1504 Performance Requirements,Wind Tunnel Testing,,,,,,"Where concrete and clay roof tiles do not satisfy the limitations in Chapter 16 for rigid tile, a wind tunnel test shall be used to determine the wind characteristics of the concrete or clay tile roof covering in accordance with SBCCI SSTD 11 and Chapter 15."
1504.3,Section 1504 Performance Requirements,Wind Resistance of Nonballasted Roofs,,,,,,Roof coverings installed on roofs in accordance with Section 1507 that are mechanically attached or adhered to the roof deck shall be designed to resist the design wind load pressures for components and cladding in accordance with Section 1609.
1504.3.1,Section 1504 Performance Requirements,Other Roof Systems,,,,,,"Built-up, modified bitumen, fully adhered or mechanically attached single-ply roof systems, metal panel roof systems applied to a solid or closely fitted deck and other types of membrane roof coverings shall be tested in accordance with FM 4474, UL 580 or UL 1897."
1504.3.2,Section 1504 Performance Requirements,Structural Metal Panel Roof Systems,,,,,,"Where the metal roof panel functions as the roof deck and roof covering and it provides both weather protection and support for loads, the structural metal panel roof system shall comply with this section. Structural standing-seam metal panel roof systems shall be tested in accordance with ASTM E1592 or FM 4474. Structural through-fastened metal panel roof systems shall be tested in accordance with FM 4474, UL 580 or ASTM E1592. Exceptions: Metal roofs constructed of cold-formed steel shall be permitted to be designed and tested in accordance with the applicable referenced structural design standard in Section 2210.1. Metal roofs constructed of aluminum shall be permitted to be designed and tested in accordance with the applicable referenced structural design standard in Section 2002.1."
1504.4,Section 1504 Performance Requirements,Ballasted Low-Slope Roof Systems,,,,,,"Ballasted low-slope (roof slope &lt; 2:12) single-ply roof system coverings installed in accordance with Sections 1507.12 and 1507.13, and protected membrane ballasted low-slope (roof slope &lt; 2:12) hot-applied rubberized-asphalt roofing systems installed in accordance with Section 1507.18, shall be designed in accordance with Section 1504.8 and ANSI/SPRI RP-4."
1504.5,Section 1504 Performance Requirements,Edge Securement for Low-Slope Roofs,,,,,,"Low-slope built-up, modified bitumen and single-ply roof system metal edge securement, except gutters, shall be designed and installed for wind loads in accordance with Chapter 16 and tested for resistance in accordance with Test Methods RE-1, RE-2 and RE-3 of ANSI/SPRI ES-1, except Vult wind speed shall be determined from Figure 1609.3(1), 1609.3(2) or 1609.3(3) as applicable."
1504.6,Section 1504 Performance Requirements,Physical Properties,,,,,,"Roof coverings installed on low-slope roofs (roof slope &lt; 2:12) in accordance with Section 1507 shall demonstrate physical integrity over the working life of the roof based upon 2,000 hours of exposure to accelerated weathering tests conducted in accordance with ASTM G152, ASTM G155 or ASTM G154. Those roof coverings that are subject to cyclical flexural response due to wind loads shall not demonstrate any significant loss of tensile strength for unreinforced membranes or breaking strength for reinforced membranes when tested as herein required."
1504.7,Section 1504 Performance Requirements,Impact Resistance,Roof,Assembly (A)|Business (B)|Educational (E)|Factory and Industrial (F)|Residential (R),sd|dd|cd,assemblies_envelope,architect,"Roof coverings installed on low-slope roofs (roof slope &lt; 2:12) in accordance with Section 1507 shall resist impact damage based on the results of tests conducted in accordance with ASTM D3746, ASTM D4272, CGSB 37-GP-52M or the ""Resistance to Foot Traffic Test"" in Section 5.5 of FM 4470."
1504.8,Section 1504 Performance Requirements,Aggregate,,,,,,"Aggregate used as surfacing for roof coverings and aggregate, gravel or stone used as ballast shall not be used on the roof of a building located in a hurricane-prone region as defined in Section 202, or on any other building with a mean roof height exceeding that permitted by Table 1504.8 based on the exposure category and basic wind speed at the site. TABLE 1504.8MAXIMUM ALLOWABLE MEAN ROOF HEIGHT PERMITTED FOR BUILDINGS WITH AGGREGATE ON THE ROOF IN AREAS OUTSIDE A HURRICANE-PRONE REGION NOMINAL DESIGN WIND SPEED, Vasd (mph)b, d MAXIMUM MEAN ROOF HEIGHT (ft)a, c Exposure category B C D 85 170 60 30 90 110 35 15 95 75 20 NP 100 55 15 NP 105 40 NP NP 110 30 NP NP 115 20 NP NP 120 15 NP NP Greater than 120 NP NP NP For SI: 1 foot = 304.8 mm; 1 mile per hour = 0.447 m/s. Mean roof height as defined in ASCE 7. For intermediate values of Vasd, the height associated with the next higher value of Vasd shall be used, or direct interpolation is permitted. NP = gravel and stone not permitted for any roof height. Vasd shall be determined in accordance with Section 1609.3.1."
1505,Chapter 15 Roof Assemblies and Rooftop Structures,Fire Classification,,,,none,none,
1505.1,Section 1505 Fire Classification,General,Roof|Slab|Covering,Assembly (A)|Business (B)|Educational (E)|Residential (R)|Utility and Miscellaneous (U),sd|dd|cd,fire_resistance_smoke_protection,architect,"Roof assemblies shall be divided into the classes defined below. Class A, B and C roof assemblies and roof coverings required to be listed by this section shall be tested in accordance with ASTM E108 or UL 790. In addition, fire-retardant-treated wood roof coverings shall be tested in accordance with ASTM D2898. The minimum roof coverings installed on buildings shall comply with Table 1505.1 based on the type of construction of the building. Exception: Skylights and sloped glazing that comply with Chapter 24 or Section 2610. TABLE 1505.1a, b MINIMUM ROOF COVERING CLASSIFICATION FOR TYPES OF CONSTRUCTION IA IB IIA IIB IIIA IIIB IV VA VB B B B Cc B Cc B B Cc For SI: 1 foot = 304.8 mm, 1 square foot = 0.0929 m2. Unless otherwise required in accordance with the International Wildland-Urban Interface Code or due to the location of the building within a fire district in accordance with Appendix D. Nonclassified roof coverings shall be permitted on buildings of Group R-3 and Group U occupancies, where there is a minimum fire-separation distance of 6 feet measured from the leading edge of the roof. Buildings that are not more than two stories above grade plane and having not more than 6,000 square feet of projected roof area and where there is a minimum 10-foot fire-separation distance from the leading edge of the roof to a lot line on all sides of the building, except for street fronts or public ways, shall be permitted to have roofs of No. 1 cedar or redwood shakes and No. 1 shingles constructed in accordance with Section 1505.7."
1505.2,Section 1505 Fire Classification,Class A Roof Assemblies,Roof|Slab|Covering,Assembly (A)|Business (B)|Educational (E)|Factory and Industrial (F)|Residential (R),sd|dd|cd,fire_resistance_smoke_protection,architect,"Class A roof assemblies are those that are effective against severe fire test exposure. Class A roof assemblies and roof coverings shall be listed and identified as Class A by an approved testing agency. Class A roof assemblies shall be permitted for use in buildings or structures of all types of construction. Exceptions: Class A roof assemblies include those with coverings of brick, masonry or an exposed concrete roof deck. Class A roof assemblies also include ferrous or copper shingles or sheets, metal sheets and shingles, clay or concrete roof tile or slate installed on noncombustible decks or ferrous, copper or metal sheets installed without a roof deck on noncombustible framing. Class A roof assemblies include minimum 16 ounce per square foot (0.0416 kg/m2) copper sheets installed over combustible decks. Class A roof assemblies include slate installed over ASTM D226, Type II underlayment over combustible decks."
1505.3,Section 1505 Fire Classification,Class B Roof Assemblies,Roof|Slab|Covering,Assembly (A)|Business (B)|Educational (E)|Residential (R)|Institutional (I),sd|dd|cd,fire_resistance_smoke_protection,architect,Class B roof assemblies are those that are effective against moderate fire-test exposure. Class B roof assemblies and roof coverings shall be listed and identified as Class B by an approved testing agency.
1505.4,Section 1505 Fire Classification,Class C Roof Assemblies,Roof|Slab,Assembly (A)|Business (B)|Educational (E)|Residential (R)|Institutional (I),sd|dd|cd,fire_resistance_smoke_protection,architect,Class C roof assemblies are those that are effective against light fire-test exposure. Class C roof assemblies and roof coverings shall be listed and identified as Class C by an approved testing agency.
1505.5,Section 1505 Fire Classification,Nonclassified Roofing,Roof|Covering,Assembly (A)|Business (B)|Educational (E)|Residential (R)|Mercantile (M),sd|dd|cd,finishes_materials,architect,"Nonclassified roofing is approved material that is not listed as a Class A, B or C roof covering."
1505.6,Section 1505 Fire Classification,Fire-Retardant-Treated Wood Shingles and Shakes,Roof|Covering,Assembly (A)|Business (B)|Educational (E)|Factory and Industrial (F)|High Hazard (H),sd|dd|cd,finishes_materials,architect,"Fire-retardant-treated wood shakes and shingles shall be treated by impregnation with chemicals by the full-cell vacuum-pressure process, in accordance with AWPA C1. Each bundle shall be marked to identify the manufactured unit and the manufacturer, and shall also be labeled to identify the classification of the material in accordance with the testing required in Section 1505.1, the treating company and the quality control agency."
1505.7,Section 1505 Fire Classification,Special Purpose Roofs,Roof|Slab|Covering,Assembly (A)|Business (B)|Educational (E)|Residential (R),sd|dd|cd,assemblies_envelope,architect,"Special purpose wood shingle or wood shake roofing shall conform to the grading and application requirements of Section 1507.8 or 1507.9. In addition, an underlayment of 5/8-inch (15.9 mm) Type X water-resistant gypsum backing board or gypsum sheathing shall be placed under minimum nominal 1/2-inch-thick (12.7 mm) wood structural panel solid sheathing or 1-inch (25 mm) nominal spaced sheathing."
1505.8,Section 1505 Fire Classification,Building-Integrated Photovoltaic Products,,,,,,"Building-integrated photovoltaic products installed as the roof covering shall be tested, listed and labeled for fire classification in accordance with Section 1505.1."
1505.9,Section 1505 Fire Classification,Photovoltaic Panels and Modules,,,,,,"Rooftop-mounted photovoltaic panel systems shall be tested, listed and identified with a fire classification in accordance with UL 1703. The fire classification shall comply with Table 1505.1 based on the type of construction of the building."
1505.10,Section 1505 Fire Classification,Roof Gardens and Landscaped Roofs,,,,,,Roof gardens and landscaped roofs shall comply with Section 1507.16 and shall be installed in accordance with ANSI/SPRI VF-1.
1506,Chapter 15 Roof Assemblies and Rooftop Structures,Materials,,,,none,none,
1506.1,Section 1506 Materials,Scope,Roof|Covering,Assembly (A)|Business (B)|Educational (E)|Factory and Industrial (F)|Residential (R),dd|cd,assemblies_envelope,architect,The requirements set forth in this section shall apply to the application of roof-covering materials specified herein. Roof coverings shall be applied in accordance with this chapter and the manufacturer's installation instructions. Installation of roof coverings shall comply with the applicable provisions of Section 1507.
1506.2,Section 1506 Materials,Material Specifications and Physical Characteristics,Roof|Covering,Assembly (A)|Business (B)|Educational (E)|Factory and Industrial (F)|Residential (R),sd|dd|cd,finishes_materials,architect,Roof-covering materials shall conform to the applicable standards listed in this chapter.
1506.3,Section 1506 Materials,Product Identification,Roof|Slab|Covering,Assembly (A)|Business (B)|Educational (E)|Factory and Industrial (F)|Residential (R),cd|ca,finishes_materials,architect,Roof-covering materials shall be delivered in packages bearing the manufacturer's identifying marks and approved testing agency labels required in accordance with Section 1505. Bulk shipments of materials shall be accompanied with the same information issued in the form of a certificate or on a bill of lading by the manufacturer.
1507,Chapter 15 Roof Assemblies and Rooftop Structures,Requirements for Roof Coverings,,,,none,none,
1507.1,Section 1507 Requirements for Roof Coverings,Scope,Roof|Covering,Assembly (A)|Business (B)|Educational (E)|Factory and Industrial (F)|Residential (R),sd|dd|cd,assemblies_envelope,architect,Roof coverings shall be applied in accordance with the applicable provisions of this section and the manufacturer's installation instructions.
1507.2,Section 1507 Requirements for Roof Coverings,Asphalt Shingles,Roof,Assembly (A)|Business (B)|Educational (E)|Residential (R)|Storage (S),cd|ca,finishes_materials,architect,The installation of asphalt shingles shall comply with the provisions of this section.
1507.2.1,Section 1507 Requirements for Roof Coverings,Deck Requirements,Roof|Slab,Assembly (A)|Business (B)|Educational (E)|Residential (R)|Utility and Miscellaneous (U),sd|dd|cd,assemblies_envelope,architect,Asphalt shingles shall be fastened to solidly sheathed decks.
1507.2.2,Section 1507 Requirements for Roof Coverings,Slope,Roof|Covering,Assembly (A)|Business (B)|Educational (E)|Factory and Industrial (F)|High Hazard (H),sd|dd|cd,finishes_materials,architect,"Asphalt shingles shall only be used on roof slopes of two units vertical in 12 units horizontal (17-percent slope) or greater. For roof slopes from two units vertical in 12 units horizontal (17-percent slope) up to four units vertical in 12 units horizontal (33-percent slope), double underlayment application is required in accordance with Section 1507.2.8."
1507.2.3,Section 1507 Requirements for Roof Coverings,Underlayment,Roof|Slab|Covering,Assembly (A)|Business (B)|Educational (E)|Factory and Industrial (F)|Residential (R),sd|dd|cd,assemblies_envelope,architect,"Unless otherwise noted, required underlayment shall conform to ASTM D226, Type I, ASTM D4869, Type I, or ASTM D6757."
1507.2.4,Section 1507 Requirements for Roof Coverings,Self-Adhering Polymer Modified Bitumen Sheet,,,,,,Self-adhering polymer modified bitumen sheet shall comply with ASTM D1970.
1507.2.5,Section 1507 Requirements for Roof Coverings,Asphalt Shingles,,,,,,Asphalt shingles shall comply with ASTM D225 or ASTM D3462.
1507.2.6,Section 1507 Requirements for Roof Coverings,Fasteners,,,,,,"Fasteners for asphalt shingles shall be galvanized, stainless steel, aluminum or copper roofing nails, minimum 12-gage [0.105 inch (2.67 mm)] shank with a minimum 3/8-inch-diameter (9.5 mm) head, of a length to penetrate through the roofing materials and a minimum of 3/4 inch (19.1 mm) into the roof sheathing. Where the roof sheathing is less than 3/4 inch (19.1 mm) thick, the nails shall penetrate through the sheathing. Fasteners shall comply with ASTM F1667."
1507.2.7,Section 1507 Requirements for Roof Coverings,Attachment,,,,,,"Asphalt shingles shall have the minimum number of fasteners required by the manufacturer, but not less than four fasteners per strip shingle or two fasteners per individual shingle. Where the roof slope exceeds 21 units vertical in 12 units horizontal (21:12), shingles shall be installed as required by the manufacturer."
1507.2.8,Section 1507 Requirements for Roof Coverings,Underlayment Application,,,,,,"For roof slopes from two units vertical in 12 units horizontal (17-percent slope) and up to four units vertical in 12 units horizontal (33-percent slope), underlayment shall be two layers applied in the following manner. Apply a minimum 19-inch-wide (483 mm) strip of underlayment felt parallel with and starting at the eaves, fastened sufficiently to hold in place. Starting at the eave, apply 36-inch-wide (914 mm) sheets of underlayment overlapping successive sheets 19 inches (483 mm) and fasten sufficiently to hold in place. Distortions in the underlayment shall not interfere with the ability of the shingles to seal. For roof slopes of four units vertical in 12 units horizontal (33-percent slope) or greater, underlayment shall be one layer applied in the following manner. Underlayment shall be applied shingle fashion, parallel to and starting from the eave and lapped 2 inches (51 mm), fastened sufficiently to hold in place. Distortions in the underlayment shall not interfere with the ability of the shingles to seal."
