id,section,title,ifc_type,occupancy,design_phase,code_category,primary_responsibility,body
1507.2.8.1,Section 1507 Requirements for Roof Coverings,High Wind Attachment,,,,,,"Underlayment applied in areas subject to high winds [Vasd greater than 110 mph (49 m/s) as determined in accordance with Section 1609.3.1] shall be applied with corrosion-resistant fasteners in accordance with the manufacturer's instructions. Fasteners are to be applied along the overlap not more than 36 inches (914 mm) on center. Underlayment installed where Vasd, in accordance with Section 1609.3.1, equals or exceeds 120 mph (54 m/s) shall comply with ASTM D226 Type II, ASTM D4869 Type IV, or ASTM D6757. The underlayment shall be attached in a grid pattern of 12 inches (305 mm) between side laps with a 6-inch (152 mm) spacing at the side laps. Underlayment shall be applied in accordance with Section 1507.2.8 except all laps shall be a minimum of 4 inches (102 mm). Underlayment shall be attached using metal or plastic cap nails with a head diameter of not less than 1 inch (25 mm) with a thickness of at least 32-gage [0.0134 inch (0.34 mm)] sheet metal. The cap nail shank shall be a minimum of 12 gage [0.105 inch (2.67 mm)] with a length to penetrate through the roof sheathing or a minimum of 3/4 inch (19.1 mm) into the roof sheathing. Exception: As an alternative, adhered underlayment complying with ASTM D1970 shall be permitted."
1507.2.8.2,Section 1507 Requirements for Roof Coverings,Ice Barrier,,,,,,"In areas where there has been a history of ice forming along the eaves causing a backup of water, an ice barrier that consists of at least two layers of underlayment cemented together or of a self-adhering polymer modified bitumen sheet shall be used in lieu of normal underlayment and extend from the lowest edges of all roof surfaces to a point at least 24 inches (610 mm) inside the exterior wall line of the building. Exception: Detached accessory structures that contain no conditioned floor area."
1507.2.9,Section 1507 Requirements for Roof Coverings,Flashings,,,,,,Flashing for asphalt shingles shall comply with this section. Flashing shall be applied in accordance with this section and the asphalt shingle manufacturer's printed instructions.
1507.2.9.1,Section 1507 Requirements for Roof Coverings,Base and Cap Flashing,,,,,,Base and cap flashing shall be installed in accordance with the manufacturer's instructions. Base flashing shall be of either corrosion-resistant metal of minimum nominal 0.019-inch (0.483 mm) thickness or mineral-surfaced roll roofing weighing a minimum of 77 pounds per 100 square feet (3.76 kg/m2). Cap flashing shall be corrosion-resistant metal of minimum nominal 0.019-inch (0.483 mm) thickness.
1507.2.9.2,Section 1507 Requirements for Roof Coverings,Valleys,,,,,,"Valley linings shall be installed in accordance with the manufacturer's instructions before applying shingles. Valley linings of the following types shall be permitted: For open valleys (valley lining exposed) lined with metal, the valley lining shall be at least 24 inches (610 mm) wide and of any of the corrosion-resistant metals in Table 1507.2.9.2. For open valleys, valley lining of two plies of mineral-surfaced roll roofing complying with ASTM D3909 or ASTM D6380 shall be permitted. The bottom layer shall be 18 inches (457 mm) and the top layer a minimum of 36 inches (914 mm) wide. For closed valleys (valleys covered with shingles), valley lining of one ply of smooth roll roofing complying with ASTM D6380, and at least 36 inches (914 mm) wide or types as described in Item 1 or 2 above shall be permitted. Self-adhering polymer modified bitumen underlayment complying with ASTM D1970 shall be permitted in lieu of the lining material. TABLE 1507.2.9.2 VALLEY LINING MATERIAL MATERIAL MINIMUM THICKNESS GAGE WEIGHT Aluminum 0.024 in. — — Cold-rolled copper 0.0216 in. — ASTM B370, 16 oz. per square ft. Copper — — 16 oz Galvanized steel 0.0179 in. 26 (zinc-coated G90) — High-yield copper 0.0162 in. — ASTM B370, 12 oz. per square ft. Lead — — 2.5 pounds Lead-coated copper 0.0216 in. — ASTM B101, 16 oz. per square ft. Lead-coated high-yield copper 0.0162 in. — ASTM B101, 12 oz. per square ft. Painted terne — — 20 pounds Stainless steel — 28 — Zinc alloy 0.027 in. — — For SI: 1 inch = 25.4 mm, 1 pound = 0.454 kg, 1 ounce = 28.35 g, 1 square foot = 0.0929 m2."
1507.2.9.3,Section 1507 Requirements for Roof Coverings,Drip Edge,,,,,,A drip edge shall be provided at eaves and rake edges of shingle roofs. Adjacent segments of the drip edge shall be lapped a minimum of 2 inches (51 mm). The vertical leg of drip edges shall be a minimum of 11/2 inches (38 mm) in width and shall extend a minimum of 1/4 inch (6.4 mm) below sheathing. The drip edge shall extend back on the roof a minimum of 2 inches (51 mm). Underlayment shall be installed over drip edges along eaves. Drip edges shall be installed over underlayment along rake edges. Drip edges shall be mechanically fastened a maximum of 12 inches (305 mm) on center.
1507.3,Section 1507 Requirements for Roof Coverings,Clay and Concrete Tile,Roof,Assembly (A)|Business (B)|Educational (E)|Residential (R)|Mercantile (M),sd|dd|cd,finishes_materials,architect,The installation of clay and concrete tile shall comply with the provisions of this section.
1507.3.1,Section 1507 Requirements for Roof Coverings,Deck Requirements,Roof|Slab,Assembly (A)|Business (B)|Educational (E)|Factory and Industrial (F)|High Hazard (H),sd|dd|cd,assemblies_envelope,architect,Concrete and clay tile shall be installed only over solid sheathing or spaced structural sheathing boards.
1507.3.2,Section 1507 Requirements for Roof Coverings,Deck Slope,Roof|Slab|Covering,Assembly (A)|Business (B)|Educational (E)|Factory and Industrial (F)|Residential (R),sd|dd|cd,assemblies_envelope,architect,"Clay and concrete roof tile shall be installed on roof slopes of 21/2 units vertical in 12 units horizontal (21-percent slope) or greater. For roof slopes from 21/2 units vertical in 12 units horizontal (21-percent slope) to four units vertical in 12 units horizontal (33-percent slope), double underlayment application is required in accordance with Section 1507.3.3."
1507.3.3,Section 1507 Requirements for Roof Coverings,Underlayment,Roof|Covering|Slab,Assembly (A)|Business (B)|Educational (E)|Factory and Industrial (F)|Residential (R),sd|dd|cd,finishes_materials,architect,"Unless otherwise noted, required underlayment shall conform to: ASTM D226, Type II; ASTM D2626 or ASTM D6380, Class M mineral-surfaced roll roofing."
1507.3.3.1,Section 1507 Requirements for Roof Coverings,Low-Slope Roofs,,,,,,"For roof slopes from 21/2 units vertical in 12 units horizontal (21-percent slope), up to four units vertical in 12 units horizontal (33-percent slope), underlayment shall be a minimum of two layers applied as follows: Starting at the eave, a 19-inch (483 mm) strip of underlayment shall be applied parallel with the eave and fastened sufficiently in place. Starting at the eave, 36-inch-wide (914 mm) strips of underlayment felt shall be applied overlapping successive sheets 19 inches (483 mm) and fastened sufficiently in place."
1507.3.3.2,Section 1507 Requirements for Roof Coverings,High-Slope Roofs,,,,,,"For roof slopes of four units vertical in 12 units horizontal (33-percent slope) or greater, underlayment shall be a minimum of one layer of underlayment felt applied shingle fashion, parallel to, and starting from the eaves and lapped 2 inches (51 mm), fastened only as necessary to hold in place."
1507.3.3.3,Section 1507 Requirements for Roof Coverings,High Wind Attachment,,,,,,"Underlayment applied in areas subject to high wind [Vasd greater than 110 mph (49 m/s) as determined in accordance with Section 1609.3.1] shall be applied with corrosion-resistant fasteners in accordance with the manufacturer's installation instructions. Fasteners are to be applied along the overlap not more than 36 inches (914 mm) on center. Underlayment installed where Vasd, in accordance with Section 1609.3.1, equals or exceeds 120 mph (54 m/s) shall be attached in a grid pattern of 12 inches (305 mm) between side laps with a 6-inch (152 mm) spacing at the side laps. Underlayment shall be applied in accordance with Sections 1507.3.3.1 and 1507.3.3.2 except all laps shall be a minimum of 4 inches (102 mm). Underlayment shall be attached using metal or plastic cap nails with a head diameter of not less than 1 inch (25 mm) with a thickness of at least 32-gage [0.0134 inch (0.34 mm)] sheet metal. The cap nail shank shall be a minimum of 12 gage [0.105 inch (2.67 mm)] with a length to penetrate through the roof sheathing or a minimum of 3/4 inch (19.1 mm) into the roof sheathing. Exception: As an alternative, adhered underlayment complying with ASTM D1970 shall be permitted."
1507.3.4,Section 1507 Requirements for Roof Coverings,Clay Tile,Roof,Assembly (A)|Business (B)|Educational (E)|Residential (R)|Mercantile (M),sd|dd|cd,finishes_materials,architect,Clay roof tile shall comply with ASTM C1167.
1507.3.5,Section 1507 Requirements for Roof Coverings,Concrete Tile,Roof,Assembly (A)|Business (B)|Educational (E)|Residential (R)|Mercantile (M),sd|dd|cd,finishes_materials,architect,Concrete roof tile shall comply with ASTM C1492.
1507.3.6,Section 1507 Requirements for Roof Coverings,Fasteners,Roof|Slab|Covering,Assembly (A)|Business (B)|Educational (E)|Factory and Industrial (F)|Residential (R),sd|dd|cd,finishes_materials,architect,"Tile fasteners shall be corrosion resistant and not less than 11-gage, 5/16-inch (8.0 mm) head, and of sufficient length to penetrate the deck a minimum of 3/4 inch (19.1 mm) or through the thickness of the deck, whichever is less. Attaching wire for clay or concrete tile shall not be smaller than 0.083 inch (2.1 mm). Perimeter fastening areas include three tile courses but not less than 36 inches (914 mm) from either side of hips or ridges and edges of eaves and gable rakes."
1507.3.7,Section 1507 Requirements for Roof Coverings,Attachment,Roof|Slab|Covering,Assembly (A)|Business (B)|Educational (E)|Mercantile (M)|Residential (R),sd|dd|cd,assemblies_envelope,architect,"Clay and concrete roof tiles shall be fastened in accordance with Table 1507.3.7. TABLE 1507.3.7CLAY AND CONCRETE TILE ATTACHMENTa, b, c GENERAL - CLAY OR CONCRETE ROOF TILE Maximum Nominal DesignWind Speed, Vasd f (mph) Mean roof height(feet) Roof slope &lt; 3:12 Roof slope 3:12 and over 85 0-60 One fastener per tile. Flat tile without vertical laps, two fasteners per tile. Two fasteners per tile. Only one fastener on slopes of 7:12 and less for tiles with installed weight exceeding 7.5 lbs./sq. ft. having a width not more than 16 inches. 100 0-40 100 &gt;40-60 The head of all tiles shall be nailed. The nose of all eave tiles shall be fastened with approved clips. All rake tiles shall be nailed with two nails. The nose of all ridge, hip and rake tiles shall be set in a bead of roofer's mastic. 110 0-60 The fastening system shall resist the wind forces in Section 1609.5.3. 120 0-60 The fastening system shall resist the wind forces in Section 1609.5.3. 130 0-60 The fastening system shall resist the wind forces in Section 1609.5.3. All &gt;60 The fastening system shall resist the wind forces in Section 1609.5.3. INTERLOCKING CLAY OR CONCRETE ROOF TILE WITH PROJECTING ANCHOR LUGSd, e(Installations on spaced/solid sheathing with battens or spaced sheathing) Maximum Nominal Design Wind Speed, Vasd f (mph) Mean roof height (feet) Roof slope &lt; 5:12 Roof slope 5:12 &lt; 12:12 Roof slope 12:12 and over 85 0-60 Fasteners are not required. Tiles with installed weight less than 9 lbs./sq. ft. require a minimum of one fastener per tile. One fastener per tile every other row. All perimeter tiles require one fastener. Tiles with installed weight less than 9 lbs./sq. ft. require a minimum of one fastener per tile. One fastener required for every tile. Tiles with installed weight less than 9 lbs./sq. ft. require a minimum of one fastener per tile. 100 0-40 100 &gt;40-60 The head of all tiles shall be nailed. The nose of all eave tiles shall be fastened with approved clips. All rake tiles shall be nailed with two nails. The nose of all ridge, hip and rake tiles shall be set in a bead of roofer's mastic. 110 0-60 The fastening system shall resist the wind forces in Section 1609.5.3. 120 0-60 The fastening system shall resist the wind forces in Section 1609.5.3. 130 0-60 The fastening system shall resist the wind forces in Section 1609.5.3. All &gt;60 The fastening system shall resist the wind forces in Section 1609.5.3. INTERLOCKING CLAY OR CONCRETE ROOF TILE WITH PROJECTING ANCHOR LUGS (Installations on solid sheathing without battens) Maximum Nominal Design Wind Speed, Vasd f(mph) Mean roof height (feet) All roof slopes 85 0-60 One fastener per tile. 100 0-40 One fastener per tile. 100 &gt; 40-60 The head of all tiles shall be nailed. The nose of all eave tiles shall be fastened with approved clips. All rake tiles shall be nailed with two nails. The nose of all ridge, hip and rake tiles shall be set in a bead of roofer's mastic. 110 0-60 The fastening system shall resist the wind forces in Section 1609.5.3. 120 0-60 The fastening system shall resist the wind forces in Section 1609.5.3. 130 0-60 The fastening system shall resist the wind forces in Section 1609.5.3. All &gt; 60 The fastening system shall resist the wind forces in Section 1609.5.3. For SI: 1 inch = 25.4 mm, 1 foot = 304.8 mm, 1 mile per hour = 0.447 m/s, 1 pound per square foot = 4.882 kg/m2. Minimum fastener size. Corrosion-resistant nails not less than No. 11 gage with 5/16-inch head. Fasteners shall be long enough to penetrate into the sheathing 3/4 inch or through the thickness of the sheathing, whichever is less. Attaching wire for clay and concrete tile shall not be smaller than 0.083 inch. Snow areas. A minimum of two fasteners per tile are required or battens and one fastener. Roof slopes greater than 24:12. The nose of all tiles shall be securely fastened. Horizontal battens. Battens shall be not less than 1 inch by 2 inch nominal. Provisions shall be made for drainage by a minimum of 1/8-inch riser at each nail or by 4-foot-long battens with at least a 1/2-inch separation between battens. Horizontal battens are required for slopes over 7:12. Perimeter fastening areas include three tile courses but not less than 36 inches from either side of hips or ridges and edges of eaves and gable rakes. Vasd shall be determined in accordance with Section 1609.3.1."
1507.3.8,Section 1507 Requirements for Roof Coverings,Application,Roof|Covering,Assembly (A)|Business (B)|Educational (E)|Residential (R)|Mercantile (M),dd|cd,finishes_materials,architect,"Tile shall be applied according to the manufacturer's installation instructions, based on the following: Climatic conditions. Roof slope. Underlayment system. Type of tile being installed."
1507.3.9,Section 1507 Requirements for Roof Coverings,Flashing,Roof|Slab|Covering,Assembly (A)|Business (B)|Educational (E)|Factory and Industrial (F)|Residential (R),sd|dd|cd,assemblies_envelope,architect,"At the juncture of the roof vertical surfaces, flashing and counterflashing shall be provided in accordance with the manufacturer's installation instructions, and where of metal, shall not be less than 0.019-inch (0.48 mm) (No. 26 galvanized sheet gage) corrosion-resistant metal. The valley flashing shall extend at least 11 inches (279 mm) from the centerline each way and have a splash diverter rib not less than 1 inch (25 mm) high at the flow line formed as part of the flashing. Sections of flashing shall have an end lap of not less than 4 inches (102 mm). For roof slopes of three units vertical in 12 units horizontal (25-percent slope) and over, the valley flashing shall have a 36-inch-wide (914 mm) underlayment of either one layer of Type I underlayment running the full length of the valley, or a self-adhering polymer-modified bitumen sheet complying with ASTM D1970, in addition to other required underlayment. In areas where the average daily temperature in January is 25°F (-4°C) or less or where there is a possibility of ice forming along the eaves causing a backup of water, the metal valley flashing underlayment shall be solid cemented to the roofing underlayment for slopes under seven units vertical in 12 units horizontal (58-percent slope) or self-adhering polymer-modified bitumen sheet shall be installed."
1507.4,Section 1507 Requirements for Roof Coverings,Metal Roof Panels,Roof|Slab|Covering,Assembly (A)|Business (B)|Educational (E)|Factory and Industrial (F)|Residential (R),sd|dd|cd,assemblies_envelope,architect,The installation of metal roof panels shall comply with the provisions of this section.
1507.4.1,Section 1507 Requirements for Roof Coverings,Deck Requirements,Roof|Slab,Assembly (A)|Business (B)|Educational (E)|Residential (R)|Mercantile (M),sd|dd|cd,assemblies_envelope,architect,"Metal roof panel roof coverings shall be applied to a solid or closely fitted deck, except where the roof covering is specifically designed to be applied to spaced supports."
1507.4.2,Section 1507 Requirements for Roof Coverings,Deck Slope,Roof,Assembly (A)|Business (B)|Educational (E)|Residential (R)|Mercantile (M),sd|dd|cd,assemblies_envelope,architect,"Minimum slopes for metal roof panels shall comply with the following: The minimum slope for lapped, nonsoldered seam metal roof panels without applied lap sealant shall be three units vertical in 12 units horizontal (25-percent slope). The minimum slope for lapped, nonsoldered seam metal roof panels with applied lap sealant shall be one-half unit vertical in 12 units horizontal (4-percent slope). Lap sealants shall be applied in accordance with the approved manufacturer's installation instructions. The minimum slope for standing-seam metal roof panel systems shall be one-quarter unit vertical in 12 units horizontal (2-percent slope)."
1507.4.3,Section 1507 Requirements for Roof Coverings,Material Standards,Roof|Slab|Covering,Utility and Miscellaneous (U)|Business (B)|Residential (R)|Assembly (A),sd|dd|cd,finishes_materials,architect,"Metal-sheet roof covering systems that incorporate supporting structural members shall be designed in accordance with Chapter 22. Metal-sheet roof coverings installed over structural decking shall comply with Table 1507.4.3(1). The materials used for metal-sheet roof coverings shall be naturally corrosion resistant or provided with corrosion resistance in accordance with the standards and minimum thicknesses shown in Table 1507.4.3(2). TABLE 1507.4.3(1)METAL ROOF COVERINGS ROOF COVERING TYPE STANDARD APPLICATION RATE/THICKNESS Aluminum ASTM B209, 0.024 inch minimum thickness for roll-formed panels and 0.019 inch minimum thickness for press-formed shingles. Aluminum-zinc alloy coated steel ASTM A792 AZ 50 Cold-rolled copper ASTM B370 minimum 16 oz./sq. ft. and 12 oz./sq. ft. high yield copper for metal-sheet roof covering systems: 12 oz./sq. ft. for preformed metal shingle systems. Copper 16 oz./sq. ft. for metal-sheet roof-covering systems; 12 oz./sq. ft. for preformed metal shingle systems. Galvanized steel ASTM A653 G-90 zinc-coateda. Hard lead 2 lbs./sq. ft. Lead-coated copper ASTM B101 Prepainted steel ASTM A755 Soft lead 3 lbs./sq. ft. Stainless steel ASTM A240, 300 Series Alloys Steel ASTM A924 Terne and terne-coated stainless Terne coating of 40 lbs. per double base box, field painted where applicable in accordance with manufacturer's installation instructions. Zinc 0.027 inch minimum thickness; 99.995% electrolytic high grade zinc with alloy additives of copper (0.08% - 0.20%), titanium (0.07% - 0.12%) and aluminum (0.015%). For SI: 1 ounce per square foot = 0.305 kg/m2, 1 pound per square foot = 4.882 kg/m2, 1 inch = 25.4 mm, 1 pound = 0.454 kg. For Group U buildings, the minimum coating thickness for ASTM A653 galvanized steel roofing shall be G-60. TABLE 1507.4.3(2)MINIMUM CORROSION RESISTANCE 55% Aluminum-zinc alloy coated steel ASTM A792 AZ 50 5% Aluminum alloy-coated steel ASTM A875 GF60 Aluminum-coated steel ASTM A463 T2 65 Galvanized steel ASTM A653 G-90 Prepainted steel ASTM A755a Paint systems in accordance with ASTM A755 shall be applied over steel products with corrosion-resistant coatings complying with ASTM A792, ASTM A875, ASTM A463 or ASTM A653."
1507.4.4,Section 1507 Requirements for Roof Coverings,Attachment,Roof,Assembly (A)|Business (B)|Educational (E)|Factory and Industrial (F)|Residential (R),cd,finishes_materials,architect,"Metal roof panels shall be secured to the supports in accordance with the approved manufacturer's fasteners. In the absence of manufacturer recommendations, the following fasteners shall be used: Galvanized fasteners shall be used for steel roofs. Copper, brass, bronze, copper alloy or 300 series stainless-steel fasteners shall be used for copper roofs. Stainless-steel fasteners are acceptable for all types of metal roofs. Aluminum fasteners are acceptable for aluminum roofs attached to aluminum supports."
1507.4.5,Section 1507 Requirements for Roof Coverings,Underlayment and High Wind,Roof|Slab|Covering,Assembly (A)|Business (B)|Educational (E)|Factory and Industrial (F)|Residential (R),sd|dd|cd,assemblies_envelope,architect,"Underlayment applied in areas subject to high winds [Vasd greater than 110 mph (49 m/s) as determined in accordance with Section 1609.3.1] shall be applied with corrosion-resistant fasteners in accordance with the manufacturer's installation instructions. Fasteners are to be applied along the overlap not more than 36 inches (914 mm) on center. Underlayment installed where Vasd, in accordance with Section 1609.3.1, equals or exceeds 120 mph (54 m/s) shall comply with ASTM D226 Type II, ASTM D4869 Type IV, or ASTM D1970. The underlayment shall be attached in a grid pattern of 12 inches (305 mm) between side laps with a 6-inch (152 mm) spacing at the side laps. Underlayment shall be applied in accordance with the manufacturer's installation instructions except all laps shall be a minimum of 4 inches (102 mm). Underlayment shall be attached using metal or plastic cap nails with a head diameter of not less than 1 inch (25 mm) with a thickness of at least 32-gage [0.0134 inch (0.34 mm)] sheet metal. The cap nail shank shall be a minimum of 12 gage [0.105 inch (2.67 mm)] with a length to penetrate through the roof sheathing or a minimum of 3/4 inch (19.1 mm) into the roof sheathing. Exception: As an alternative, adhered underlayment complying with ASTM D1970 shall be permitted."
1507.5,Section 1507 Requirements for Roof Coverings,Metal Roof Shingles,Roof,Assembly (A)|Business (B)|Educational (E)|Residential (R)|Mercantile (M),sd|dd|cd,finishes_materials,architect,The installation of metal roof shingles shall comply with the provisions of this section.
1507.5.1,Section 1507 Requirements for Roof Coverings,Deck Requirements,Roof|Slab,Assembly (A)|Business (B)|Educational (E)|Residential (R)|Utility and Miscellaneous (U),sd|dd|cd,assemblies_envelope,architect,"Metal roof shingles shall be applied to a solid or closely fitted deck, except where the roof covering is specifically designed to be applied to spaced sheathing."
1507.5.2,Section 1507 Requirements for Roof Coverings,Deck Slope,Roof,Assembly (A)|Business (B)|Educational (E)|Mercantile (M)|Residential (R),sd|dd|cd,assemblies_envelope,architect,Metal roof shingles shall not be installed on roof slopes below three units vertical in 12 units horizontal (25-percent slope).
1507.5.3,Section 1507 Requirements for Roof Coverings,Underlayment,Roof|Covering|Slab,Assembly (A)|Business (B)|Educational (E)|Residential (R)|Mercantile (M),sd|dd|cd,finishes_materials,architect,"Underlayment shall comply with ASTM D226, Type I or ASTM D4869."
1507.5.3.1,Section 1507 Requirements for Roof Coverings,Underlayment and High Wind,,,,,,"Underlayment applied in areas subject to high winds [Vasd greater than 110 mph (49 m/s) as determined in accordance with Section 1609.3.1] shall be applied with corrosion-resistant fasteners in accordance with the manufacturer's installation instructions. Fasteners are to be applied along the overlap not farther apart than 36 inches (914 mm) on center. Underlayment installed where Vasd, in accordance with Section 1609.3.1, equals or exceeds 120 mph (54 m/s) shall comply with ASTM D226 Type II or ASTM D4869 Type IV. The underlayment shall be attached in a grid pattern of 12 inches (305 mm) between side laps with a 6-inch spacing (152 mm) at the side laps. Underlayment shall be applied in accordance with the manufacturer's installation instructions except all laps shall be a minimum of 4 inches (102 mm). Underlayment shall be attached using metal or plastic cap nails with a head diameter of not less than 1 inch (25 mm) with a thickness of at least 32-gage [0.0134 inch (0.34 mm)] sheet metal. The cap nail shank shall be a minimum of 12 gage [0.105 inch (2.67 mm)] with a length to penetrate through the roof sheathing or a minimum of 3/4 inch (19.1 mm) into the roof sheathing. Exception: As an alternative, adhered underlayment complying with ASTM D1970 shall be permitted."
1507.5.4,Section 1507 Requirements for Roof Coverings,Ice Barrier,Roof|Slab,Residential (R)|Assembly (A)|Business (B)|Educational (E)|Institutional (I),sd|dd|cd,assemblies_envelope,architect,"In areas where there has been a history of ice forming along the eaves causing a backup of water, an ice barrier that consists of at least two layers of underlayment cemented together or of a self-adhering polymer-modified bitumen sheet shall be used in lieu of normal underlayment and extend from the lowest edges of all roof surfaces to a point at least 24 inches (610 mm) inside the exterior wall line of the building. Exception: Detached accessory structures that contain no conditioned floor area."
