id,section,title,ifc_type,occupancy,design_phase,code_category,primary_responsibility,body
29,,Plumbing Systems,Slab|Wall|BuildingElementProxy|Door|Covering,Assembly (A)|Business (B)|Educational (E)|Residential (R)|Mercantile (M),sd|dd|cd,plumbing_systems,architect,
2901,Chapter 29 Plumbing Systems,General,,,,none,none,
2901.1,Section 2901 General,Scope,Covering|Slab|BuildingElementProxy,Assembly (A)|Business (B)|Educational (E)|Factory and Industrial (F)|Residential (R),sd|dd|cd,plumbing_systems,architect,"The provisions of this chapter and the Plumbing Code shall govern the erection, installation, alteration, repairs, relocation, replacement, addition to, use or maintenance of plumbing equipment and systems. Toilet and bathing rooms shall be constructed in accordance with Section 1210. Plumbing systems and equipment shall be constructed, installed and maintained in accordance with the Plumbing Code."
2902,Chapter 29 Plumbing Systems,Minimum Plumbing Facilities,,,,none,none,
2902.1,Section 2902 Minimum Plumbing Facilities,Minimum Number of Fixtures,BuildingElementProxy|Door|Slab,Assembly (A)|Business (B)|Educational (E)|Factory and Industrial (F)|Institutional (I),sd|dd|cd,plumbing_systems,architect,"Plumbing fixtures shall be provided in the minimum number as shown in Table 2902.1 based on the actual use of the building or space. Uses not shown in Table 2902.1 shall be considered individually by the code official. The number of occupants shall be determined by this code. [P] TABLE 2902.1 MINIMUM NUMBER OF REQUIRED PLUMBING FIXTURESa (See Sections 2902.1.1 and 2902.2) No. CLASSIFICATION OCCUPANCY DESCRIPTION WATER CLOSETS (URINALS SEE SECTION 419.2 OF THE INTERNATIONAL PLUMBING CODE) LAVATORIES BATHTUBS/ SHOWERS DRINKING FOUNTAINS (SEE SECTION 410 OF THE INTERNATIONAL PLUMBING CODE) OTHER Male Female Male Female 1 Assembly A-1d Theaters and other buildings for the performing arts and motion pictures 1 per 125 1 per 65 1 per 200 — 1 per 500 1 service sink A-2d Nightclubs, bars, taverns, dance halls and buildings for similarpurposes 1 per 40 1 per 40 1 per 75 — 1 per 500 1 service sink Restaurants, banquethalls and food courts 1 per 75 1 per 75 1 per 200 — 1 per 500 1 service sink A-3d Auditoriums withoutpermanent seating, art galleries, exhibition halls, museums, lecturehalls, libraries, arcades and gymnasiums 1 per 125 1 per 65 1 per 200 — 1 per 500 1 service sink Passenger terminals andtransportation facilities 1 per 500 1 per 500 1 per 750 — 1 per 1,000 1 service sink Places of worship and other religious services 1 per 150 1 per 75 1 per 200 — 1 per 1,000 1 service sink A-4 Coliseums, arenas, skating rinks, pools and tennis courts for indoor sporting events andactivities 1 per 75 for the first 1,500 and 1 per 120 for the remainder exceeding 1,500 1 per 40 for the first 1,520 and 1 per 60 for the remainder exceeding 1,520 1 per 200 1 per 150 — 1 per 1,000 1 service sink A-5 Stadiums, amusementparks, bleachers and grandstands for outdoor sporting events and activities 1 per 75 for the first 1,500 and 1 per 120 for the remainder exceeding 1,500 1 per 40 for the first 1,520 and 1 per 60 for the remainder exceeding 1,520 1 per 200 1 per 150 — 1 per 1,000 1 service sink 2 Business B Buildings for the transaction of business,professional services,other servicesinvolving merchandise, office buildings, banks, lightindustrial and similar uses 1 per 25 for the first 50 and 1 per 50 for the remainder exceeding 50 1 per 40 for the first 80 and 1 per 80 for the remainder exceeding 80 — 1 per 100 1 service sinke 3 Educational E Educational facilities 1 per 50 1 per 50 — 1 per 100 1 service sink 4 Factory and industrial F-1 and F-2 Structures in which occupants are engaged in work fabricating, assemblyor processing of products or materials 1 per 100 1 per 100 See Sec- tion 411 of the Plumbing Code 1 per 400 1 service sink 5 Institutional I-1 Residential care 1 per 10 1 per 10 1 per 8 1 per 100 1 service sink I-2 Hospitals, ambulatorynursing home care recipientb 1 per roomc 1 per roomc 1 per 15 1 per 100 1 service sink Employees, other than residential careb 1 per 25 1 per 35 — 1 per 100 — Visitors, other thanresidential care 1 per 75 1 per 100 — 1 per 500 — I-3 Prisonsb 1 per cell 1 per cell 1 per 15 1 per 100 1 service sink I-3 Reformatories, detention centers and correctional centersb 1 per 15 1 per 15 1 per 15 1 per 100 1 service sink Employeesb 1 per 25 1 per 35 — 1 per 100 — I-4 Adult day care and child day care 1 per 15 1 per 15 1h 1 per 100 1 service sink 6 Mercantile M Retail stores, servicestations, shops, salesrooms,markets and shoppingcenters 1 per 500 1 per 750 — 1 per 1,000 1 service sinke 7 Residential R-1 Hotels, motels,boarding houses (transient) 1 per sleeping unit 1 per sleeping unit 1 per sleeping unit — 1 service sink R-2 Dormitories, fraternities,sororities and boarding houses (not transient) 1 per 10 1 per 10 1 per 8 1 per 100 1 service sink R-2 Apartment house 1 per dwelling unit 1 per dwelling unit 1 per dwelling unit — 1 kitchen sink per dwelling unit; 1 automaticclothes washer connectionper 20 dwelling units R-3 One- and two-familydwellings andlodging houses with five or fewer guest rooms 1 per dwelling unit 1 per 10 1 per dwelling unit — 1 kitchen sink per dwelling unit; 1 automaticclothes washer connectionper dwelling unit R-3 Congregate livingfacilities with 16 or fewer persons 1 per 10 1 per 10 1 per 8 1 per 100 1 service sink R-4 Congregate living facilities with 16 orfewer persons 1 per 10 1 per 10 1 per 8 1 per 100 1 service sink 8 Storage S-1 S-2 Structures for the storage of goods,warehouses, store-houses and freight depots, low and moderate hazard 1 per 100 1 per 100 See Section411 of the Plumbing Code 1 per 1,000 1 service sink a. The fixtures shown are based on one fixture being the minimum required for the number of persons indicated or any fraction of the number of persons indicated. The number of occupants shall be determined by this code. b. Toilet facilities for employees shall be separate from facilities for inmates or care recipients. c. A single-occupant toilet room with one water closet and one lavatory serving not more than two adjacent patient sleeping units shall be permitted, provided that each patient sleeping unit has direct access to the toilet room and provisions for privacy for the toilet room user are provided. d. The occupant load for seasonal outdoor seating and entertainment areas shall be included when determining the minimum number of facilities required. e. For business and mercantile occupancies with an occupant load of 15 or fewer, service sinks shall not be required. h. For child day care occupancies, bathtubs/showers shall not be required."
2902.1.1,Section 2902 Minimum Plumbing Facilities,Fixture Calculations,Slab|Wall|Door,Assembly (A)|Business (B)|Educational (E)|Mercantile (M)|Residential (R),sd|dd|cd,plumbing_systems,architect,"To determine the occupant load of each sex, the total occupant load shall be divided in half. To determine the required number of fixtures, the fixture ratio or ratios for each fixture type shall be applied to the occupant load of each sex in accordance with Table 2902.1. Fractional numbers resulting from applying the fixture ratios of Table 2902.1 shall be rounded up to the next whole number. For calculations involving multiple occupancies, such fractional numbers for each occupancy shall first be summed and then rounded up to the next whole number. Exception: The total occupant load shall not be required to be divided in half where approved statistical data indicate a distribution of the sexes of other than 50 percent of each sex."
2902.1.2,Section 2902 Minimum Plumbing Facilities,Family or Assisted-Use Toilet and Bath Fixtures,,,,,,Fixtures located within family or assisted-use toilet and bathing rooms required by Section 1109.2.1 are permitted to be included in the number of required fixtures for either the male or female occupants in assembly and mercantile occupancies.
2902.2,Section 2902 Minimum Plumbing Facilities,Separate Facilities,Slab|Wall|Door,Business (B)|Mercantile (M)|Residential (R)|Assembly (A)|Institutional (I),sd|dd|cd,plumbing_systems,architect,"Where plumbing fixtures are required, separate facilities shall be provided for each sex. Exceptions: Separate facilities shall not be required for dwelling units and sleeping units. Separate facilities shall not be required in structures or tenant spaces with a total occupant load, including both employees and customers, of 15 or fewer. Separate facilities shall not be required in mercantile occupancies in which the maximum occupant load is 100 or less. Separate facilities shall not be required in buildings or tenant spaces where single-occupancy gender-neutral public toilet facilities are provided in accordance with Section 2902.4."
2902.2.1,Section 2902 Minimum Plumbing Facilities,Family or Assisted-Use Toilet Facilities Serving as Separate Facilities,,,,,,"Where a building or tenant space requires a separate toilet facility for each sex and each toilet facility is required to have only one water closet, two family or assisted-use toilet facilities shall be permitted to serve as the required separate facilities. Family or assisted-use toilet facilities shall not be required to be identified for exclusive use by either sex as required by Section 2902.4."
2902.3,Section 2902 Minimum Plumbing Facilities,Employee and Public Toilet Facilities,Wall|Door|Slab,Assembly (A)|Business (B)|Mercantile (M)|Utility and Miscellaneous (U),sd|dd|cd,plumbing_systems,architect,"Customers, patrons and visitors shall be provided with public toilet facilities in structures and tenant spaces intended for public utilization. The number of plumbing fixtures located within the required toilet facilities shall be provided in accordance with Section 2902.1 for all users. Employees shall be provided with toilet facilities in all occupancies. Employee toilet facilities shall be either separate or combined employee and public toilet facilities. Exception: Public toilet facilities shall not be required in: Open or enclosed parking garages where there are no parking attendants. Structures and tenant spaces intended for quick transactions, including takeout, pickup and drop-off, having a public access area less than or equal to 300 square feet (28 m2)."
2902.3.1,Section 2902 Minimum Plumbing Facilities,Access,Door|Wall|Slab,Assembly (A)|Business (B)|Educational (E)|Mercantile (M),sd|dd|cd,accessibility,architect,"The route to the public toilet facilities required by Section 2902.3 shall not pass through kitchens, storage rooms or closets. Access to the required facilities shall be from within the building or from the exterior of the building. Routes shall comply with the accessibility requirements of this code. The public shall have access to the required toilet facilities at all times that the building is occupied."
2902.3.2,Section 2902 Minimum Plumbing Facilities,Location of Toilet Facilities in Occupancies Other Than Malls,,,,,,"In occupancies other than covered and open mall buildings, the required public and employee toilet facilities shall be located not more than one story above or below the space required to be provided with toilet facilities, and the path of travel to such facilities shall not exceed a distance of 500 feet (152 m). Exception: The location and maximum distances of travel to required employee facilities in factory and industrial occupancies are permitted to exceed that required by this section, provided that the location and maximum distance of travel are approved."
2902.3.3,Section 2902 Minimum Plumbing Facilities,Location of Toilet Facilities in Malls,,,,,,"In covered and open mall buildings, the required public and employee toilet facilities shall be located not more than one story above or below the space required to be provided with toilet facilities, and the path of travel to such facilities shall not exceed a distance of 300 feet (91 mm). In mall buildings, the required facilities shall be based on total square footage (m2) within a covered mall building or within the perimeter line of an open mall building, and facilities shall be installed in each individual store or in a central toilet area located in accordance with this section. The maximum distance of travel to central toilet facilities in mall buildings shall be measured from the main entrance of any store or tenant space. In mall buildings, where employees' toilet facilities are not provided in the individual store, the maximum distance of travel shall be measured from the employees' work area of the store or tenant space."
2902.3.4,Section 2902 Minimum Plumbing Facilities,Pay Facilities,,,,,,"Where pay facilities are installed, such facilities shall be in excess of the required minimum facilities. Required facilities shall be free of charge."
2902.3.5,Section 2902 Minimum Plumbing Facilities,Door Locking,,,,,,"Where a toilet room is provided for the use of multiple occupants, the egress door for the room shall not be lockable from the inside of the room. This section does not apply to family or assisted-use toilet rooms."
2902.3.6,Section 2902 Minimum Plumbing Facilities,Prohibited Toilet Room Location,,,,,,Toilet rooms shall not open directly into a room used for the preparation of food for service to the public.
2902.4,Section 2902 Minimum Plumbing Facilities,Signage,Door|Wall,Assembly (A)|Business (B)|Educational (E)|Mercantile (M)|Residential (R),sd|dd|cd,accessibility,architect,Multi-occupancy public toilet facilities shall be designated by a legible sign for each sex. Single-occupancy public facilities shall be designated with gender-neutral signage. Signs shall be readily visible and located near the entrance to each toilet facility. Signs for accessible toilet facilities shall comply with Section 1111.
2902.4.1,Section 2902 Minimum Plumbing Facilities,Directional Signage,Wall|Door,Assembly (A)|Business (B)|Educational (E)|Mercantile (M)|Residential (R),sd|dd|cd,accessibility,architect,"Directional signage indicating the route to the required public toilet facilities shall be posted in a lobby, corridor, aisle or similar space, such that the sign can be readily seen from the main entrance to the building or tenant space."
2902.5,Section 2902 Minimum Plumbing Facilities,Drinking Fountain Location,Wall|Slab|Door|Stair|Ramp,Assembly (A)|Business (B)|Mercantile (M),sd|dd|cd,plumbing_systems,architect,"Drinking fountains shall not be required to be located in individual tenant spaces provided that public drinking fountains are located within a distance of travel of 500 feet (152 m) of the most remote location in the tenant space and not more than one story above or below the tenant space. Where the tenant space is in a covered or open mall, such distance shall not exceed 300 feet (91 440 mm). Drinking fountains shall be located on an accessible route."
new_2902.5.1,Section 2902 Minimum Plumbing Facilities,Drinking Fountain Substitution,,,,,,"Drinking fountains shall not be required in restaurants that provide drinking water in a container free of charge. In establishments of occupancies B or M, with an area of 1,500 square feet (139.4 m2) or less, a water cooler or a bottled water dispenser may be substituted for the required drinking fountain. In other occupancies, including B or M occupancies with an area of more than 1,500 square feet (139.4 m2), water coolers or bottled water dispensers shall be permitted to be substituted for not more than 50 percent of the required number of drinking fountains."
2902.6,Section 2902 Minimum Plumbing Facilities,Small Occupancies,Covering,Assembly (A)|Business (B)|Educational (E)|Mercantile (M)|Storage (S),sd|dd|cd,plumbing_systems,architect,Drinking fountains shall not be required for an occupant load of 15 or fewer.
