id,section,reference,title,depth,body
31.3109,"Section 3109 Swimming Pools, Spas and Hot Tubs",new_3109.2,3109.2 Amendments to the International Swimming Pool and Spa Code,2,"The following amendments shall be made to the International Swimming Pool and Spa Code: Chapter 1, Scope and Administration, shall be deleted in its entirety and ""See the administrative provisions of N.J.A.C. 5:23."" shall be inserted. In addition, any referenced section of Chapter 1 shall be deleted throughout the code and ""the administrative provisions of the Uniform Construction Code (N.J.A.C. 5:23)"" shall be inserted. Chapter 2, Definitions, shall be amended as follows: In Section 201.3, Terms defined in other codes, ""International Plumbing Code"" shall be deleted and ""plumbing subcode (N.J.A.C. 5:23-3.15)"" shall be inserted. In Section 202, Definitions: The definition of ""alteration"" shall be deleted. The definition of ""code official"" shall be deleted and the following shall be inserted: ""Construction Official. A qualified person appointed by the municipal appointing authority or the commissioner pursuant to the act and the regulations to enforce and administer the regulations within the jurisdiction of the enforcing agency."" The definition of ""existing pool or spa"" shall be deleted. The definition of ""owner"" shall be deleted and the following shall be inserted: ""Owner. The owner or owners in fee of the property of a lesser estate therein, a mortgagee or vendee in possession, an assignee of rents, receiver, executor, trustee, lessee or any other person, firm or corporation, directly or indirectly in control of a building, structure or real property and shall include any subdivision thereof of the State."" The definitions of ""permit"" and ""repair"" shall be deleted. Chapter 3, General Compliance, shall be amended as follows: In Section 302.1, Electrical, ""NFPA 70"" shall be deleted and ""the electrical subcode (N.J.A.C. 5:23-3.16)"" shall be inserted. Additionally, ""or the International Residential Code, as applicable in accordance with Section 102.7.1"" shall be deleted. In Section 302.2, Water service and drainage, ""International Plumbing Code"" shall be deleted and ""plumbing subcode (N.J.A.C. 5:23-3.15)"" shall be inserted. In Sections 302.5, Backflow prevention, and 302.6, Waste-water discharge, ""International Plumbing Code or the International Residential Code, as applicable in accordance with Section 102.7.1"" shall be deleted and ""plumbing subcode (N.J.A.C. 5:23-3.15)"" shall be inserted. Section 305, Barrier requirements, shall be amended as follows: In Section 305.1, General, in the second sentence, ""and swimming pools are equipped with a powered safety cover that complies with ASTM F1346"" shall be deleted. Also in the second sentence, "", hot tubs or pools"" shall be replaced with ""or hot tubs"". Section 305.1.1, Construction fencing required, shall be deleted. Section 305.4, Structure wall as a barrier, shall be deleted. In Section 305.5, Onground residential pool structure as a barrier, in item 3, ""capable of being secured, locked or removed to prevent access except where the ladder or steps are"" shall be deleted. In Section 306.1, General, ""in accordance with Section 102.7.1"" shall be deleted. Sections 306.3, Step risers and treads, and 306.4, Deck steps handrail required, shall be deleted. In Section 306.9.1, Hose bibbs, ""International Plumbing Code or the International Residential Code, as applicable in accordance with Section 102.7.1"" shall be deleted and ""plumbing subcode (N.J.A.C. 5:23-3.15)"" shall be inserted. In Sections 307.1.1, Glazing in hazardous locations, 307.1.3, Roofs or canopies, 307.2.2, Materials and structural design, and 316.6.1, Installation, ""in accordance with Section 102.7.1"" shall be deleted. In Section 316.4, Installation, ""in accordance with Section 102.7.1"" shall be deleted. Additionally, ""NFPA 70"" shall be deleted and ""the electrical subcode (N.J.A.C. 5:23-3.16)"" shall be inserted. In Section 318.2, Protection of potable water supply, ""International Residential Code or the International Plumbing Code or, as applicable in accordance with Section 102.7.1"" shall be deleted and ""plumbing subcode (N.J.A.C. 5:23-3.15)"" shall be inserted. In Section 321.2.1, Pool and deck illumination, in the second sentence, ""NFPA 70"" shall be deleted and ""the electrical subcode (N.J.A.C. 5:23-3.16)"" shall be inserted. In Section 321.4, Residential pool and deck illumination, ""NFPA 70"" shall be deleted and ""the electrical subcode (N.J.A.C. 5:23-3.16)"" shall be inserted. Additionally, ""or the International Residential Code, as applicable in accordance with Section 102.7.1"" shall be deleted. Chapter 4, Public swimming pools, shall be amended as follows: In Section 410.1, Toilet facilities, ""International Building Code or International Plumbing Code"" shall be deleted and ""plumbing subcode (N.J.A.C. 5:23-3.15)"" shall be inserted. Amendments to Chapter 6, Aquatic recreation facilities, shall be amended as follows: In Section 601.1, Scope, the following sentence shall be added to the end of the paragraph, ""For purposes of enforcement, Class D-2 and Class D-6 public pools shall be regulated by this chapter and N.J.A.C. 5:23; all other Class D public pools shall be regulated by N.J.A.C. 5:14A."" In Section 609.1, General, ""International Building Code and International Plumbing Code and Section 609.2 through 609.9"" shall be deleted and ""the plumbing subcode (N.J.A.C. 5:23-3.15)"" shall be inserted. Sections 609.2, Number of fixtures, 609.3, Showers, 609.4, Soap dispensers, 609.5, Toilet tissue holder, 609.6, Lavatory mirror, 609.7, Sanitary napkin receptacles, 609.8, Sanitary napkin dispensers, and 609.9, Infant Care, shall be deleted. Appendix A, Board of Appeals, shall be deleted in its entirety."
31,Chapter 31 Special Construction,3110,Section 3110 Automatic Vehicular Gates,1,
31.3110,Section 3110 Automatic Vehicular Gates,3110.1,3110.1 General,2,Automatic vehicular gates shall comply with the requirements of Sections 3110.2 and 3110.3 and other applicable sections of this code.
31.3110,Section 3110 Automatic Vehicular Gates,3110.2,3110.2 Vehicular Gates Intended for Automation,2,"Vehicular gates intended for automation shall be designed, constructed and installed to comply with the requirements of ASTM F2200."
31.3110,Section 3110 Automatic Vehicular Gates,3110.3,3110.3 Vehicular Gate Openers,2,"Vehicular gate openers, where provided, shall be listed in accordance with UL 325."
31,Chapter 31 Special Construction,3111,Section 3111 Solar Energy Systems,1,
31.3111,Section 3111 Solar Energy Systems,3111.1,3111.1 General,2,Solar energy systems shall comply with the requirements of this section.
31.3111,Section 3111 Solar Energy Systems,3111.1.1,3111.1.1 Wind Resistance,3,Rooftop-mounted photovoltaic (PV) panel systems and solar thermal collectors shall be designed in accordance with Section 1609.
31.3111,Section 3111 Solar Energy Systems,3111.1.2,3111.1.2 Roof Live Load,3,Roof structures that provide support for solar energy systems shall be designed in accordance with Section 1607.14.4.
31.3111,Section 3111 Solar Energy Systems,3111.2,3111.2 Solar Thermal Systems,2,"Solar thermal systems shall be designed and installed in accordance with this section, the plumbing subcode (N.J.A.C. 5:23-3.15), the International Mechanical Code and the International Fire Code. Where light-transmitting plastic covers are used, solar thermal collectors shall be designed in accordance with Section 2606.12."
31.3111,Section 3111 Solar Energy Systems,3111.2.1,3111.2.1 Equipment,3,Solar thermal systems and components shall be listed and labeled in accordance with ICC 900/SRCC 300 and ICC 901/SRCC 100.
31.3111,Section 3111 Solar Energy Systems,3111.3,3111.3 Photovoltaic Solar Energy Systems,2,"Photovoltaic solar energy systems shall be designed and installed in accordance with this section, the International Fire Code, NFPA 70 and the manufacturer's installation instructions."
31.3111,Section 3111 Solar Energy Systems,3111.3.1,3111.3.1 Equipment,3,Photovoltaic panels and modules shall be listed and labeled in accordance with UL 1703 or with both UL 61730-1 and UL 61730-2. Inverters shall be listed and labeled in accordance with UL 1741. Systems connected to the utility grid shall use inverters listed for utility interaction.
31.3111,Section 3111 Solar Energy Systems,3111.3.2,3111.3.2 Fire Classification,3,Rooftop-mounted photovoltaic (PV) panel systems shall have a fire classification in accordance with Section 1505.9. Building-integrated photovoltaic (BIPV) systems installed as roof coverings shall have a fire classification in accordance with Section 1505.8.
31.3111,Section 3111 Solar Energy Systems,3111.3.3,3111.3.3 Building-Integrated Photovoltaic (BIPV) Systems,3,BIPV systems installed as roof coverings shall be designed and installed in accordance with Section 1507.
31.3111,Section 3111 Solar Energy Systems,3111.3.4,3111.3.4 Access and Pathways,3,"Roof access, pathways and spacing requirements shall be provided in accordance with Section 1205 of the International Fire Code."
31.3111,Section 3111 Solar Energy Systems,3111.3.5,3111.3.5 Ground-Mounted Photovoltaic Systems,3,Ground-mounted photovoltaic systems shall be designed and installed in accordance with Chapter 16 and the International Fire Code.
31.3111,Section 3111 Solar Energy Systems,3111.3.5.1,3111.3.5.1 Fire Separation Distances,4,Ground-mounted photovoltaic systems shall be subject to the fire separation distance requirements determined by the local jurisdiction.
31,Chapter 31 Special Construction,3112,Section 3112 Greenhouses,1,
31.3112,Section 3112 Greenhouses,3112.1,3112.1 General,2,"The provisions of this section shall apply to greenhouses that are designed and used for the cultivation, maintenance, or protection of plants."
31.3112,Section 3112 Greenhouses,3112.2,3112.2 Accessibility,2,Greenhouses shall be accessible in accordance with Chapter 11.
31.3112,Section 3112 Greenhouses,3112.3,3112.3 Structural Design,2,Greenhouses shall comply with the structural design requirements for greenhouses in Chapter 16.
31.3112,Section 3112 Greenhouses,3112.4,3112.4 Glass and Glazing,2,Glass and glazing used in greenhouses shall comply with Section 2405.
31.3112,Section 3112 Greenhouses,3112.5,3112.5 Light-Transmitting Plastics,2,Light-transmitting plastics shall be permitted in lieu of plain glass in greenhouses and shall comply with Section 2606.
31.3112,Section 3112 Greenhouses,3112.6,3112.6 Membrane Structures,2,Greenhouses that are membrane structures shall comply with Section 3102.
31.3112,Section 3112 Greenhouses,3112.6.1,3112.6.1 Plastic Film,3,Plastic films used in greenhouses shall comply with Section 3102.3.
31,Chapter 31 Special Construction,3113,"Section <span class=""code_deletion"">3113</span> <span class=""code_deletion"">Relocatable Buildings</span>",1,
31,Chapter 31 Special Construction,3114,"Section <span class=""code_deletion"">3114</span> <span class=""code_deletion"">Public Use Restroom Buildings in Flood Hazard Areas</span>",1,
31,Chapter 31 Special Construction,3115,Section 3115 Intermodal Shipping Containers,1,
31.3115,Section 3115 Intermodal Shipping Containers,3115.1,3115.1 General,2,"The provisions of Section 3115 and other applicable sections of this code shall apply to intermodal shipping containers that are repurposed for use as buildings or structures, or as a part of buildings or structures. Exceptions: Intermodal shipping containers previously approved as existing relocatable buildings complying with Chapter 14 of the International Existing Building Code. Stationary storage battery arrays located in intermodal shipping containers complying with Chapter 12 of the International Fire Code. Intermodal shipping containers that are listed as equipment complying with the standard for equipment, such as air chillers, engine generators, modular data centers, and other similar equipment. Intermodal shipping containers housing or supporting experimental equipment are exempt from the requirements of Section 3115, provided that they comply with all of the following: Such units shall be single stand-alone units supported at grade level and used only for occupancies as specified under Risk Category I in Table 1604.5. Such units are located a minimum of 8 feet (2438 mm) from adjacent structures, and are not connected to a fuel gas system or fuel gas utility. In hurricane-prone regions and flood hazard areas, such units are designed in accordance with the applicable provisions of Chapter 16."
31.3115,Section 3115 Intermodal Shipping Containers,3115.2,3115.2 Construction Documents,2,"The construction documents shall contain information to verify the dimensions and establish the physical properties of the steel components and wood floor components of the intermodal shipping container, in addition to the information required by the administrative provisions of the Uniform Construction Code (N.J.A.C. 5:23) and 1603."
31.3115,Section 3115 Intermodal Shipping Containers,3115.3,3115.3 Intermodal Shipping Container Information,2,"Intermodal shipping containers shall bear an existing data plate containing the following information as required by ISO 6346 and verified by an approved agency. A report of the verification process and findings shall be provided to the building owner. Manufacturer's name or identification number.Date manufactured.Safety approval number.Identification number.Maximum operating gross mass or weight (kg) (lbs).Allowable stacking load for 1.8G (kg) (lbs).Transverse racking test force (Newtons).Valid maintenance examination date.Where approved by the building official, the markings and existing data plate are permitted to be removed from the intermodal shipping containers before they are repurposed for use as buildings or structures or as a part of buildings or structures."
31.3115,Section 3115 Intermodal Shipping Containers,3115.4,3115.4 Protection Against Decay and Termites,2,Wood structural floors of intermodal shipping containers shall be protected from decay and termites in accordance with the applicable provisions of Section 2304.12.1.1.
31.3115,Section 3115 Intermodal Shipping Containers,3115.5,3115.5 Under-Floor Ventilation,2,"The space between the bottom of the floor joists and the earth under any intermodal shipping container, except spaces occupied by basements and cellars, shall be provided with ventilation in accordance with Section 1202.4."
31.3115,Section 3115 Intermodal Shipping Containers,3115.6,3115.6 Roof Assemblies,2,"Intermodal shipping container roof assemblies shall comply with the applicable requirements of Chapter 15.Exception: Single-unit, stand-alone intermodal shipping containers not attached to, or stacked vertically over, other intermodal shipping containers, buildings or structures."
31.3115,Section 3115 Intermodal Shipping Containers,3115.7,3115.7 Joints and Voids,2,"Joints and voids that create concealed spaces between connected or stacked intermodal shipping containers at fire-resistance-rated walls, floor or floor/ceiling assemblies and roofs or roof/ceiling assemblies shall be protected by an approved fire-resistant joint system in accordance with Section 715."
31.3115,Section 3115 Intermodal Shipping Containers,3115.8,3115.8 Structural,2,"Intermodal shipping containers that conform to ISO 1496-1 and are repurposed for use as buildings or structures, or as a part of buildings or structures, shall be designed in accordance with Chapter 16 and this section."
31.3115,Section 3115 Intermodal Shipping Containers,3115.8.1,3115.8.1 Foundations,3,Intermodal shipping containers repurposed for use as a permanent building or structure shall be supported on foundations or other supporting structures designed and constructed in accordance with Chapters 16 through 23.
31.3115,Section 3115 Intermodal Shipping Containers,3115.8.1.1,3115.8.1.1 Anchorage,4,Intermodal shipping containers shall be anchored to foundations or other supporting structures as necessary to provide a continuous load path for all applicable design and environmental loads in accordance with Chapter 16.
31.3115,Section 3115 Intermodal Shipping Containers,3115.8.2,3115.8.2 Welds,3,New welds and connections shall be equal to or greater than the original connections.
31.3115,Section 3115 Intermodal Shipping Containers,3115.8.3,3115.8.3 Structural Design,3,"The structural design for the intermodal shipping containers repurposed for use as a building or structure, or as part of a building or structure, shall comply with Section 3115.8.4 or 3115.8.5."
31.3115,Section 3115 Intermodal Shipping Containers,3115.8.4,3115.8.4 Detailed Design Procedure,3,A structural analysis meeting the requirements of this section shall be provided to the building official to demonstrate the structural adequacy of the intermodal shipping containers. Exception: Intermodal shipping containers designed in accordance with Section 3115.8.5.
31.3115,Section 3115 Intermodal Shipping Containers,3115.8.4.1,3115.8.4.1 Material Properties,4,Structural material properties for existing intermodal shipping container steel components shall be established by material testing where the steel grade and composition cannot be identified by the manufacturer's designation as to manufacture and mill test.
31.3115,Section 3115 Intermodal Shipping Containers,3115.8.4.2,3115.8.4.2 Seismic Design Parameters,4,"The seismic force-resisting system shall be designed and detailed in accordance with one of the following: Where all or portions of the corrugated steel container sides are considered to be the seismic force-resisting system, design and detailing shall be in accordance with the ASCE 7, Table 12.2-1 requirements for light-frame bearing-wall systems with shear panels of all other materials. Where portions of the corrugated steel container sides are retained, but are not considered to be the seismic force-resisting system, an independent seismic force-resisting system shall be selected, designed and detailed in accordance with ASCE 7, Table 12.2-1. Where portions of the corrugated steel container sides are retained and integrated into a seismic force-resisting system other than as permitted by Item 1, seismic design parameters shall be developed from testing and analysis in accordance with the administrative provisions of the Uniform Construction Code and ASCE 7, Section 12.2.1.1 or 12.2.1.2."
31.3115,Section 3115 Intermodal Shipping Containers,3115.8.4.3,3115.8.4.3 Allowable Shear Value,4,"The allowable shear values for the intermodal shipping container corrugated steel sheet panel side walls and end walls shall be demonstrated by testing and analysis accordance with the administrative provisions of the Uniform Construction Code. Where penetrations are made in the side walls or end walls designated as part of the lateral force-resisting system, the penetrations shall be substantiated by rational analysis."
31.3115,Section 3115 Intermodal Shipping Containers,3115.8.5,3115.8.5 Simplified Structural Design of Single-Unit Containers,3,Single-unit intermodal shipping containers conforming to the limitations of Section 3115.8.5.1 shall be permitted to be designed in accordance with the simplified structural design provisions of Section 3115.8.5.2.
31.3115,Section 3115 Intermodal Shipping Containers,3115.8.5.1,3115.8.5.1 Limitations,4,"The use of Section 3115.8.5 is subject to the following limitations: The intermodal shipping container shall be a single-unit, stand-alone unit supported on a foundation and shall not be in contact with or supporting any other shipping container or other structure. The intermodal shipping container top and bottom rails, corner castings, and columns or any portion thereof shall not be notched, cut, or removed in any manner. The intermodal shipping container shall be erected in a level and horizontal position with the floor located at the bottom. The intermodal shipping container shall be located in Seismic Design Category A, B, C or D."
31.3115,Section 3115 Intermodal Shipping Containers,3115.8.5.2,3115.8.5.2 Simplified Structural Design,4,"Where permitted by Section 3115.8.5.1, single-unit, stand-alone intermodal shipping containers shall be designed using the following assumptions for the corrugated steel shear walls:The appropriate detailing requirements contained in Chapters 16 through 23.Response modification coefficient, R = 2.Overstrength factor, Ω0 = 2.5.Deflection amplification factor, Cd = 2.Limits on structural height, hn = 9.5 feet (2900 mm)."
31.3115,Section 3115 Intermodal Shipping Containers,3115.8.5.3,3115.8.5.3 Allowable Shear,4,"The allowable shear for the corrugated steel side walls (longitudinal) and end walls (transverse) for wind design and seismic design using the coefficients of Section 3115.8.5.2 shall be in accordance with Table 3115.8.5.3, provided that all of the following conditions are met: The total linear length of all openings in any individual side wall or end wall shall be limited to not more than 50 percent of the length of that side wall or end wall, as shown in Figure 3115.8.5.3(1). Any full-height wall length, or portion thereof, less than 4 feet (305 mm) shall not be considered as a portion of the lateral force-resisting system, as shown in Figure 3115.8.5.3(2). All side walls or end walls used as part of the lateral force-resisting system shall have an existing or new boundary element on all sides to form a continuous load path, or paths, with adequate strength and stiffness to transfer all forces from the point of application to the final point of resistance, as shown in Figure 3115.8.5.3(3). Where openings are made in container walls, floors or roofs, for doors, windows and other openings: The openings shall be framed with steel elements that are designed in accordance with Chapters 16 and 22. The cross section and material grade of any new steel element shall be equal to or greater than the steel element removed. A maximum of one penetration not greater than 6 inches (152 mm) in diameter for conduits, pipes, tubes or vents, or not greater than 16 square inches (10 323 mm2) for electrical boxes, is permitted for each individual 8-foot (2438 mm) length of lateral force-resisting wall. Penetrations located in walls that are not part of the lateral force-resisting system shall not be limited in size or quantity. Existing intermodal shipping container vents shall not be considered a penetration, as shown in Figure 3115.8.5.3(4). End wall doors designated as part of the lateral force-resisting system shall be welded closed. TABLE 3115.8.5.3 ALLOWABLE SHEAR VALUES FOR INTERMODAL SHIPPING CONTAINER CORRUGATED STEEL WALLS FOR WIND OR SEISMIC LOADING CONTAINER DESIGNATIONb CONTAINER DIMENSION (nominal length) CONTAINER DIMENSION (nominal height) ALLOWABLE SHEAR VALUES (PLF)a, c Side Wall End Wall 1EEE 45 feet 9.5 feet 75 843 1EE 8.5 feet 1AAA 40 feet 9.5 feet 84 1AA 8.5 feet 1A 8.0 feet 1AX &lt; 8.0 feet 1BBB 30 feet 9.5 feet 112 1BB 8.5 feet 1B 8.0 feet 1BX &lt; 8.0 feet 1CC 20 feet 8.5 feet 168 1C 8.0 feet 1CX &lt; 8.0 feet 1D 10 feet 8.0 feet 337 1DX &lt; 8.0 feet For SI: 1 foot = 304.8 mm. The allowable strength shear for the side walls and end walls of the intermodal shipping containers are derived from ISO 1496-1 and reduced by a factor of safety of 5. Container designation type is derived from ISO 668. Limitations of Section 3115.8.5.1 shall apply. FIGURE 3115.8.5.3(1) BRACING UNIT DISTRIBUTION—MAXIMUM LINEAR LENGTH For SI: 1 foot = 304.8 mm. FIGURE 3115.8.5.3(2) BRACING UNIT DISTRIBUTION—MINIMUM LINEAR LENGTH FIGURE 3115.8.5.3(3) BRACING UNIT DISTRIBUTION—BOUNDARY ELEMENTS For SI: 1 inch = 25.4 mm, 1 foot = 304.8 mm. FIGURE 3115.8.5.3(4) BRACING UNIT DISTRIBUTION—PENETRATION LIMITATIONS"
