id,section,reference,title,depth,body
,,31,Chapter 31 Special Construction,0,"User notes: About this chapter: Chapter 31 provides regulations for unique buildings and building elements. Those include buildings such as membrane structures, greenhouses and relocatable buildings. Special elements include pedestrian walkways and tunnels, awnings, canopies and marquees, vehicular gates, solar energy systems, public use restrooms in flood hazard areas, and intermodal shipping containers. Code development reminder: Code change proposals to sections preceded by the designation [BS] will be considered by the IBC—Structural Code Development Committee during the 2022 (Group B) Code Development Cycle."
31,Chapter 31 Special Construction,3101,Section 3101 General,1,
31.3101,Section 3101 General,3101.1,3101.1 Scope,2,"The provisions of this chapter shall govern special building construction including membrane structures, temporary structures, pedestrian walkways and tunnels, automatic vehicular gates, awnings and canopies, marquees, signs, towers, antennas, relocatable buildings, swimming pool enclosures and safety devices, solar energy systems, public use restroom buildings on publicly owned lands in flood hazard areas and intermodal shipping containers."
31,Chapter 31 Special Construction,3102,Section 3102 Membrane Structures,1,
31.3102,Section 3102 Membrane Structures,3102.1,3102.1 General,2,"The provisions of Sections 3102.1 through 3102.8 shall apply to air-supported, air-inflated, membrane-covered cable, membrane-covered frame and tensile membrane structures, collectively known as membrane structures, erected for a period of 180 days or longer. Those erected for a shorter period of time shall comply with the International Fire Code. Membrane structures covering water storage facilities, water clarifiers, water treatment plants, sewage treatment plants, greenhouses and similar facilities not used for human occupancy are required to meet only the requirements of Sections 3102.3.1 and 3102.7. Membrane structures erected on a building, balcony, deck or other structure for any period of time shall comply with this section."
31.3102,Section 3102 Membrane Structures,3102.2,3102.2 Tensile Membrane Structures and Air-Supported Structures,2,"Tensile membrane structures and air-supported structures, including permanent and temporary structures, shall be designed and constructed in accordance with ASCE 55. The provisions in Sections 3102.3 through 3102.6 shall apply."
31.3102,Section 3102 Membrane Structures,3102.3,3102.3 Type of Construction,2,"Noncombustible membrane structures shall be classified as Type IIB construction. Noncombustible frame or cable-supported structures covered by an approved membrane in accordance with Section 3102.3.1 shall be classified as Type IIB construction. Heavy timber frame-supported structures covered by an approved membrane in accordance with Section 3102.3.1 shall be classified as Type IV-HT construction. Other membrane structures shall be classified as Type V construction.Exception: Plastic less than 30 feet (9144 mm) above any floor used in greenhouses, where occupancy by the general public is not authorized, and for aquaculture pond covers is not required to meet the fire propagation performance criteria of Test Method 1 or Test Method 2, as appropriate, of NFPA 701."
31.3102,Section 3102 Membrane Structures,3102.3.1,3102.3.1 Membrane and Interior Liner Material,3,"Membranes and interior liners shall be either noncombustible as set forth in Section 703.3 or meet the fire propagation performance criteria of Test Method 1 or Test Method 2, as appropriate, of NFPA 701 and the manufacturer's test protocol.Exception: Plastic less than 20 mil (0.5 mm) in thickness used in greenhouses, where occupancy by the general public is not authorized, and for aquaculture pond covers is not required to meet the fire propagation performance criteria of Test Method 1 or Test Method 2, as appropriate, of NFPA 701."
31.3102,Section 3102 Membrane Structures,new_3102.3.2,3102.3.2 Certification,3,An affidavit or affirmation shall be submitted to the code official and a copy retained on the premises on which the tent or air-supported structure is located. The affidavit or affirmation shall attest to the following information relative to the flame-resistance of the fabric: Names and addresses of the owners of the tent or air-supported structure. Date the fabric was last treated with flame-resistant solution. Trade name or kind of chemical used in treatment. Name of person or firm treating the material. Name of testing agency and test standard by which the fabric was tested.
31.3102,Section 3102 Membrane Structures,3102.4,3102.4 Allowable Floor Areas,2,The area of a membrane structure shall not exceed the limitations specified in Section 506.
31.3102,Section 3102 Membrane Structures,3102.5,3102.5 Maximum Height,2,Membrane structures shall not exceed one story nor shall such structures exceed the height limitations in feet specified in Section 504.3.Exception: Noncombustible membrane structures serving as roofs only.
31.3102,Section 3102 Membrane Structures,3102.6,3102.6 Mixed Construction,2,Membrane structures shall be permitted to be utilized as specified in this section as a portion of buildings of other types of construction. Height and area limits shall be as specified for the type of construction and occupancy of the building.
31.3102,Section 3102 Membrane Structures,3102.6.1,3102.6.1 Noncombustible Membrane,3,"A noncombustible membrane shall be permitted for use as the roof or as a skylight of any building or atrium of a building of any type of construction provided that the membrane is not less than 20 feet (6096 mm) above any floor, balcony or gallery."
31.3102,Section 3102 Membrane Structures,3102.6.1.1,3102.6.1.1 Membrane,4,"A membrane meeting the fire propagation performance criteria of Test Method 1 or Test Method 2, as appropriate, of NFPA 701 shall be permitted to be used as the roof or as a skylight on buildings of Type IIB, III, IV-HT and V construction, provided that the membrane is not less than 20 feet (6096 mm) above any floor, balcony or gallery."
31.3102,Section 3102 Membrane Structures,3102.7,3102.7 Engineering Design,2,"The structure shall be designed and constructed to sustain dead loads; loads due to tension or inflation; live loads including wind, snow or flood and seismic loads and in accordance with Chapter 16."
31.3102,Section 3102 Membrane Structures,3102.7.1,3102.7.1 Lateral Restraint,3,"For membrane-covered frame structures, the membrane shall not be considered to provide lateral restraint in the calculation of the capacities of the frame members."
31.3102,Section 3102 Membrane Structures,3102.8,3102.8 Inflation Systems,2,Air-supported and air-inflated structures shall be provided with primary and auxiliary inflation systems to meet the minimum requirements of Sections 3102.8.1 through 3102.8.3.
31.3102,Section 3102 Membrane Structures,3102.8.1,3102.8.1 Equipment Requirements,3,The inflation system shall consist of one or more blowers and shall include provisions for automatic control to maintain the required inflation pressures. The system shall be so designed as to prevent overpressurization of the system.
31.3102,Section 3102 Membrane Structures,3102.8.1.1,3102.8.1.1 Auxiliary Inflation System,4,"In addition to the primary inflation system, in buildings larger than 1,500 square feet (140 m2) in area, an auxiliary inflation system shall be provided with sufficient capacity to maintain the inflation of the structure in case of primary system failure. The auxiliary inflation system shall operate automatically when there is a loss of internal pressure and when the primary blower system becomes inoperative."
31.3102,Section 3102 Membrane Structures,3102.8.1.2,3102.8.1.2 Blower Equipment,4,"Blower equipment shall meet all of the following requirements:Blowers shall be powered by continuous-rated motors at the maximum power required for any flow condition as required by the structural design.Blowers shall be provided with inlet screens, belt guards and other protective devices as required by the building official to provide protection from injury.Blowers shall be housed within a weather-protecting structure.Blowers shall be equipped with backdraft check dampers to minimize air loss when inoperative.Blower inlets shall be located to provide protection from air contamination. The location of inlets shall be approved."
31.3102,Section 3102 Membrane Structures,3102.8.2,3102.8.2 Standby Power,3,"Wherever an auxiliary inflation system is required, an approved standby power-generating system shall be provided. The system shall be equipped with a suitable means for automatically starting the generator set upon failure of the normal electrical service and for automatic transfer and operation of all of the required electrical functions at full power within 60 seconds of such service failure. Standby power shall be capable of operating independently for not less than 4 hours."
31.3102,Section 3102 Membrane Structures,3102.8.3,3102.8.3 Support Provisions,3,"A system capable of supporting the membrane in the event of deflation shall be provided for in air-supported and air-inflated structures having an occupant load of 50 or more or where covering a swimming pool regardless of occupant load. The support system shall be capable of maintaining membrane structures used as a roof for Type I construction not less than 20 feet (6096 mm) above floor or seating areas. The support system shall be capable of maintaining other membranes not less than 7 feet (2134 mm) above the floor, seating area or surface of the water."
31,Chapter 31 Special Construction,3103,Section 3103 Temporary Structures,1,
31.3103,Section 3103 Temporary Structures,3103.1,3103.1 General,2,"The provisions of Sections 3103.1 through 3103.4 shall apply to structures erected for a period of less than 180 days. Special event structures, tents, umbrella structures and other membrane structures erected for a period of less than 180 days shall also comply with the International Fire Code. Those erected for a longer period of time shall comply with applicable sections of this code."
31.3103,Section 3103 Temporary Structures,3103.1.1,3103.1.1 Conformance,3,"Temporary structures and uses shall conform to the structural strength, fire safety, means of egress, accessibility, light, ventilation and sanitary requirements of this code as necessary to ensure public health, safety and general welfare."
31.3103,Section 3103 Temporary Structures,3103.1.2,3103.1.2 Permit Required,3,"Temporary structures, tents, tensioned membrane structures, and canopies meeting the criteria in N.J.A.C. 5:23-2.14 shall not require a permit. Greenhouses meeting the criteria in N.J.A.C. 5:23-3.2(d) shall not require a permit."
31.3103,Section 3103 Temporary Structures,3103.2,3103.2 Construction Documents,2,"A permit application and construction documents shall be submitted for each installation of a temporary structure. The construction documents, shall include a site plan indicating the location of the temporary structure and information delineating the means of egress and the occupant load."
31.3103,Section 3103 Temporary Structures,3103.3,3103.3 Location,2,Temporary structures shall be located in accordance with the requirements of Table 705.5 based on the fire-resistance rating of the exterior walls for the proposed type of construction.
31.3103,Section 3103 Temporary Structures,3103.4,3103.4 Means of Egress,2,Temporary structures shall conform to the means of egress requirements of Chapter 10 and shall have an exit access travel distance of 100 feet (30 480 mm) or less.
31,Chapter 31 Special Construction,3104,Section 3104 Pedestrian Walkways and Tunnels,1,
31.3104,Section 3104 Pedestrian Walkways and Tunnels,3104.1,3104.1 General,2,"This section shall apply to connections between buildings such as pedestrian walkways or tunnels, located at, above or below grade level, that are used as a means of travel by persons. The pedestrian walkway shall not contribute to the building area or the number of stories or height of connected buildings."
31.3104,Section 3104 Pedestrian Walkways and Tunnels,3104.1.1,3104.1.1 Application,3,Pedestrian walkways shall be designed and constructed in accordance with Sections 3104.2 through 3104.9. Tunnels shall be designed and constructed in accordance with Sections 3104.2 and 3104.10.
31.3104,Section 3104 Pedestrian Walkways and Tunnels,3104.2,3104.2 Separate Structures,2,Buildings connected by pedestrian walkways or tunnels shall be considered to be separate structures. Exceptions: Buildings that are on the same lot and considered as portions of a single building in accordance with Section 503.1.2. Deleted.
31.3104,Section 3104 Pedestrian Walkways and Tunnels,3104.3,3104.3 Construction,2,"The pedestrian walkway shall be of noncombustible construction.Exceptions: Combustible construction shall be permitted where connected buildings are of combustible construction.Fire-retardant-treated wood, in accordance with Section 603.1, Item 1.3, shall be permitted for the roof construction of the pedestrian walkway where connected buildings are not less than Type I or II construction."
31.3104,Section 3104 Pedestrian Walkways and Tunnels,3104.4,3104.4 Contents,2,Only materials and decorations approved by the building official shall be located in the pedestrian walkway.
31.3104,Section 3104 Pedestrian Walkways and Tunnels,3104.5,3104.5 Connections of Pedestrian Walkways to Buildings,2,"The connection of a pedestrian walkway to a building shall comply with Section 3104.5.1, 3104.5.2, 3104.5.3 or 3104.5.4.Exception: Buildings that are on the same lot and considered as portions of a single building in accordance with Section 503.1.2."
31.3104,Section 3104 Pedestrian Walkways and Tunnels,3104.5.1,3104.5.1 Fire Barriers,3,Pedestrian walkways shall be separated from the interior of the building by not less than 2-hour fire barriers constructed in accordance with Section 707 and Sections 3104.5.1.1 through 3104.5.1.3.
31.3104,Section 3104 Pedestrian Walkways and Tunnels,3104.5.1.1,3104.5.1.1 Exterior Walls,4,Exterior walls of buildings connected to pedestrian walkways shall be 2-hour fire-resistance rated. This protection shall extend not less than 10 feet (3048 mm) in every direction surrounding the perimeter of the pedestrian walkway.
31.3104,Section 3104 Pedestrian Walkways and Tunnels,3104.5.1.2,3104.5.1.2 Openings in Exterior Walls of Connected Buildings,4,Openings in exterior walls required to be fire-resistance rated in accordance with Section 3104.5.1.1 shall be equipped with opening protectives providing a not less than 3/4-hour fire protection rating in accordance with Section 716.
31.3104,Section 3104 Pedestrian Walkways and Tunnels,3104.5.1.3,3104.5.1.3 Supporting Construction,4,The fire barrier shall be supported by construction as required by Section 707.5.1.
31.3104,Section 3104 Pedestrian Walkways and Tunnels,3104.5.2,3104.5.2 Alternative Separation,3,"The wall separating the pedestrian walkway and the building shall comply with Section 3104.5.2.1 or 3104.5.2.2 where:The distance between the connected buildings is more than 10 feet (3048 mm).The pedestrian walkway and connected buildings are equipped throughout with an automatic sprinkler system in accordance with Section 903.3.1.1, and the roof of the walkway is not more than 55 feet (16 764 mm) above grade connecting to the fifth, or lower, story above grade plane, of each building.Exception: Open parking garages need not be equipped with an automatic sprinkler system."
31.3104,Section 3104 Pedestrian Walkways and Tunnels,3104.5.2.1,3104.5.2.1 Passage of Smoke,4,The wall shall be capable of resisting the passage of smoke.
31.3104,Section 3104 Pedestrian Walkways and Tunnels,3104.5.2.2,3104.5.2.2 Glass,4,"The wall shall be constructed of a tempered, wired or laminated glass and doors separating the interior of the building from the pedestrian walkway. The glass shall be protected by an automatic sprinkler system in accordance with Section 903.3.1.1 that, when actuated, shall completely wet the entire surface of interior sides of the wall or glass. Obstructions shall not be installed between the sprinkler heads and the wall or glass. The glass shall be in a gasketed frame and installed in such a manner that the framing system will deflect without breaking (loading) the glass before the sprinkler operates."
31.3104,Section 3104 Pedestrian Walkways and Tunnels,3104.5.3,3104.5.3 Open Sides on Walkway,3,"Where the distance between the connected buildings is more than 10 feet (3048 mm), the walls at the intersection of the pedestrian walkway and each building need not be fire-resistance rated provided that both sidewalls of the pedestrian walkway are not less than 50 percent open with the open area uniformly distributed to prevent the accumulation of smoke and toxic gases. The roof of the walkway shall be located not more than 40 feet (12 160 mm) above grade plane, and the walkway shall only be permitted to connect to the third or lower story of each building.Exception: Where the pedestrian walkway is protected with an automatic sprinkler system in accordance with Section 903.3.1.1, the roof of the walkway shall be located not more than 55 feet (16 764 mm) above grade plane and the walkway shall only be permitted to connect to the fifth or lower story of each building."
31.3104,Section 3104 Pedestrian Walkways and Tunnels,3104.5.4,3104.5.4 Exterior Walls Greater Than 2 Hours,3,"Where exterior walls of connected buildings are required by Section 705 to have a fire-resistance rating greater than 2 hours, the walls at the intersection of the pedestrian walkway and each building need not be fire-resistance rated provided:The pedestrian walkway is equipped throughout with an automatic sprinkler system installed in accordance with Section 903.3.1.1.The roof of the walkway is not located more than 55 feet (16 764 mm) above grade plane and the walkway connects to the fifth, or lower, story above grade plane of each building."
31.3104,Section 3104 Pedestrian Walkways and Tunnels,3104.6,3104.6 Public Way,2,Pedestrian walkways over a public way shall comply with Chapter 32.
31.3104,Section 3104 Pedestrian Walkways and Tunnels,3104.7,3104.7 Egress,2,Access shall be provided at all times to a pedestrian walkway that serves as a required exit.
31.3104,Section 3104 Pedestrian Walkways and Tunnels,3104.8,3104.8 Width,2,The unobstructed width of pedestrian walkways shall be not less than 36 inches (914 mm). The total width shall be not greater than 30 feet (9144 mm).
31.3104,Section 3104 Pedestrian Walkways and Tunnels,3104.9,3104.9 Exit Access Travel,2,"The length of exit access travel shall be 200 feet (60 960 mm) or less.Exceptions: Exit access travel distance on a pedestrian walkway equipped throughout with an automatic sprinkler system in accordance with Section 903.3.1.1 shall be 250 feet (76 200 mm) or less.Exit access travel distance on a pedestrian walkway constructed with both sides not less than 50 percent open shall be 300 feet (91 440 mm) or less.Exit access travel distance on a pedestrian walkway constructed with both sides not less than 50 percent open, and equipped throughout with an automatic sprinkler system in accordance with Section 903.3.1.1, shall be 400 feet (122 m) or less."
31.3104,Section 3104 Pedestrian Walkways and Tunnels,3104.10,3104.10 Tunneled Walkway,2,Separation between the tunneled walkway and the building to which it is connected shall be not less than 2-hour fire-resistant construction and openings therein shall be protected in accordance with Section 716.
31,Chapter 31 Special Construction,3105,Section 3105 Awnings and Canopies,1,
31.3105,Section 3105 Awnings and Canopies,3105.1,3105.1 General,2,Awnings and canopies shall comply with the requirements of Sections 3105.2 and 3105.3 and other applicable sections of this code.
31.3105,Section 3105 Awnings and Canopies,3105.2,3105.2 Design and Construction,2,"Awnings and canopies shall be designed and constructed to withstand wind or other lateral loads and live loads as required by Chapter 16 with due allowance for shape, open construction and similar features that relieve the pressures or loads. Structural members shall be protected to prevent deterioration. Awnings shall have frames of noncombustible material, fire-retardant-treated wood, heavy timber complying with Section 2304.11, or 1-hour construction with combustible or noncombustible covers and shall be either fixed, retractable, folding or collapsible."
31.3105,Section 3105 Awnings and Canopies,3105.3,3105.3 Awnings and Canopy Materials,2,"Awnings and canopies shall be provided with an approved covering that complies with one of the following: The fire propagation performance criteria of Test Method 1 or Test Method 2, as appropriate, of NFPA 701. Has a flame spread index not greater than 25 when tested in accordance with ASTM E84 or UL 723. Meets all of the following criteria when tested in accordance with NFPA 286: During the 40 kW exposure, flames shall not spread to the ceiling. Flashover, as defined in NFPA 286, shall not occur. The flame shall not spread to the outer extremity of the sample on any wall or ceiling. The peak heat release rate throughout the test shall not exceed 800 kW. Exception: The fire propagation performance and flame spread index requirements shall not apply to awnings installed on detached one- and two-family dwellings."
31,Chapter 31 Special Construction,3106,Section 3106 Marquees,1,
31.3106,Section 3106 Marquees,3106.1,3106.1 General,2,Marquees shall comply with Sections 3106.2 through 3106.5 and other applicable sections of this code.
31.3106,Section 3106 Marquees,3106.2,3106.2 Thickness,2,"The height or thickness of a marquee measured vertically from its lowest to its highest point shall be not greater than 3 feet (914 mm) where the marquee projects more than two-thirds of the distance from the lot line to the curb line, and shall be not greater than 9 feet (2743 mm) where the marquee is less than two-thirds of the distance from the lot line to the curb line."
31.3106,Section 3106 Marquees,3106.3,3106.3 Roof Construction,2,"Where the roof or any part thereof is a skylight, the skylight shall comply with the requirements of Chapter 24. Every roof and skylight of a marquee shall be sloped to downspouts that shall conduct any drainage from the marquee in such a manner so as not to spill over the sidewalk."
31.3106,Section 3106 Marquees,3106.4,3106.4 Location Prohibited,2,"Every marquee shall be so located as not to interfere with the operation of any exterior standpipe, and such that the marquee does not obstruct the clear passage of stairways or exit discharge from the building or the installation or maintenance of street lighting."
31.3106,Section 3106 Marquees,3106.5,3106.5 Construction,2,A marquee shall be supported entirely from the building and constructed of noncombustible materials. Marquees shall be designed as required in Chapter 16. Structural members shall be protected to prevent deterioration.
31,Chapter 31 Special Construction,3107,Section 3107 Signs,1,
31.3107,Section 3107 Signs,3107.1,3107.1 General,2,"Signs shall be designed, constructed and maintained in accordance with this code."
31,Chapter 31 Special Construction,3108,Section 3108 Telecommunication and Broadcast Towers,1,
31.3108,Section 3108 Telecommunication and Broadcast Towers,3108.1,[BS]  3108.1 General,2,"Towers shall be designed and constructed in accordance with the provisions of TIA 222. Towers shall be designed for seismic loads; exceptions related to seismic design listed in Section 2.7.3 of TIA 222 shall not apply. In Section 2.6.6.2 of TIA 222, the horizontal extent of Topographic Category 2, escarpments, shall be 16 times the height of the escarpment.Exception: Single free-standing poles used to support antennas not greater than 75 feet (22 860 mm), measured from the top of the pole to grade, shall not be required to be noncombustible."
31.3108,Section 3108 Telecommunication and Broadcast Towers,3108.2,[BS]  3108.2 Location and Access,2,"Towers shall be located such that guy wires and other accessories shall not cross or encroach on any street or other public space, or over above-ground electric utility lines, or encroach on any privately owned property without the written consent of the owner of the encroached-upon property, space or above-ground electric utility lines. Towers shall be equipped with climbing and working facilities in compliance with TIA 222. Access to the tower sites shall be limited as required by applicable OSHA, FCC and EPA regulations."
31,Chapter 31 Special Construction,3109,"Section 3109 Swimming Pools, Spas and Hot Tubs",1,
31.3109,"Section 3109 Swimming Pools, Spas and Hot Tubs",3109.1,3109.1 General,2,"The design and construction of swimming pools, spas and hot tubs shall comply with the International Swimming Pool and Spa Code."
