id,section,title,body,ifc_type,occupancy,design_phase,code_category,primary_responsibility
24,,Glass and Glazing,,,,,,
2401,Chapter 24 Glass and Glazing,General,,,,,,
2401.1,Section 2401 General,Scope,"The provisions of this chapter shall govern the materials, design, construction and quality of glass, light-transmitting ceramic and light-transmitting plastic panels for exterior and interior use in both vertical and sloped applications in buildings and structures. Light-transmitting plastic glazing shall also meet the applicable requirements of Chapter 26.Exception: Buildings and structures located within the high-velocity hurricane zone shall also comply with the provisions of Sections 2410 through 2415, excluding Section 2405.5.",,,,,
2401.2,Section 2401 General,Glazing Replacement,The installation of replacement glass shall be as required for new installations.,,,,,
2402,Chapter 24 Glass and Glazing,Definitions,,,,,,
2402.1,Section 2402 Definitions,Definitions,The following terms are defined in Chapter 2:DALLE GLASS.DECORATIVE GLASS.,,,,,
2403,Chapter 24 Glass and Glazing,General Requirements for Glass,,,,,,
2403.1,Section 2403 General Requirements for Glass,Identification,"Each pane shall bear the manufacturer's mark designating the type and thickness of the glass or glazing material. The identification shall not be omitted unless approved and an affidavit is furnished by the glazing contractor certifying that each light is glazed in accordance with approved construction documents that comply with the provisions of this chapter. Safety glazing shall be identified in accordance with Section 2406.3.Each pane of tempered glass, except tempered spandrel glass, shall be permanently identified by the manufacturer. The identification mark shall be acid etched, sand blasted, ceramic fired, laser etched, embossed or of a type that, once applied, cannot be removed without being destroyed.Tempered spandrel glass shall be provided with a removable paper marking by the manufacturer.",,,,,
2403.2,Section 2403 General Requirements for Glass,Glass Supports,"Where one or more sides of any pane of glass are not firmly supported, or are subjected to unusual load conditions, detailed construction documents, detailed shop drawings and analysis or test data ensuring safe performance for the specific installation shall be prepared by a registered design professional.",,,,,
2403.3,Section 2403 General Requirements for Glass,Glass Framing,"To be considered firmly supported, the framing members for each individual pane of glass shall be designed so that the deflection of the edge of the glass perpendicular to the glass pane does not exceed 1/175 of the glass edge length where the glass edge length is not more than 13 feet 6 inches (4115 mm) or 1/240 of the glass edge length + 1/4 inch (6.4 mm) where the glass edge length is greater than 13 feet 6 inches (4115 mm), when subjected to the larger of the positive or negative load where loads are combined as specified in Section 1605.",,,,,
2403.4,Section 2403 General Requirements for Glass,Interior Glazed Areas,"Where interior glazing is installed adjacent to a walking surface, the differential deflection of two adjacent unsupported edges shall be not greater than the thickness of the panels when a force of 50 pounds per linear foot (plf) (730 N/m) is applied horizontally to one panel at any point up to 42 inches (1067 mm) above the walking surface.",,,,,
2403.5,Section 2403 General Requirements for Glass,Louvered Windows or Jalousies,"Float, wired and patterned glass in louvered windows and jalousies shall be no thinner than nominal 3/16 inch (4.8 mm) and no longer than 48 inches (1219 mm). Exposed glass edges shall be smooth.Wired glass with wire exposed on longitudinal edges shall not be used in louvered windows or jalousies.Where other glass types are used, the design shall be submitted to the building official for approval.",,,,,
2404,Chapter 24 Glass and Glazing,Wind and Dead Loads on Glass,,,,,,
2404.1,Section 2404 Wind and Dead Loads on Glass,Vertical Glass,"Glass sloped 15 degrees (0.26 rad) or less from vertical in windows, curtain and window walls, doors and other exterior applications shall be designed to resist the wind loads due to ultimate design wind speed, Vult, in Section 1609 for components and cladding. The load resistance of glass under uniform load shall be determined in accordance with ASTM E1300. The design of vertical glazing shall be based on Equation 24-1. (Equation 24-1) where: Fgw = Wind load on the glass due to ultimate design wind speed, Vult, computed in accordance with Section 1609. Fga = Short duration load on the glass as determined in accordance with ASTM E1300.",,,,,
2404.2,Section 2404 Wind and Dead Loads on Glass,Sloped Glass,"Glass sloped more than 15 degrees (0.26 rad) from vertical in skylights, sunrooms, sloped roofs and other exterior applications shall be designed to resist the most critical combinations of loads determined by Equations 24-2, 24-3 and 24-4. (Equation 24-2) (Equation 24-3) (Equation 24-4) where: D = Glass dead load, psf (kN/m2). For glass sloped 30 degrees (0.52 rad) or less from horizontal, = 13 tg (For SI: 0.0245 tg). For glass sloped more than 30 degrees (0.52 rad) from horizontal, = 13 tg cos θ (For SI: 0.0245 tg cos θ). Fg = Total load, psf (kN/m2) on glass. tg = Total glass thickness, inches (mm) of glass panes and plies. Wi = Inward wind force, psf (kN/m2) due to ultimate design wind speed, Vult, as calculated in Section 1609. Wo = Outward wind force, psf (kN/m2) due to ultimate design wind speed, Vult, as calculated in Section 1609. θ = Angle of slope from horizontal. Exception: The performance grade rating of unit skylights and tubular daylighting devices shall be determined in accordance with Section 2405.5. The design of sloped glazing shall be based on Equation 24-5. (Equation 24-5) where: Fg = Total load on the glass as determined by Equations 24-2, 24-3 and 24-4. Fga = Short duration load resistance of the glass as determined in accordance with ASTM E1300 for Equations 24-2 and 24-3; or the long duration load resistance of the glass as determined in accordance with ASTM E1300 for Equation 24-4.",,,,,
2404.3.1,Section 2404 Wind and Dead Loads on Glass,Vertical Wired Glass,"Wired glass sloped 15 degrees (0.26 rad) or less from vertical in windows, curtain and window walls, doors and other exterior applications shall be designed to resist the wind loads in Section 1609 for components and cladding according to the following equation: (Equation 24-6) where: Fgw = Wind load on the glass due to ultimate design wind speed, Vult, computed in accordance with Section 1609. Fge = Nonfactored load from ASTM E1300 using a thickness designation for monolithic glass that is not greater than the thickness of wired glass.",,,,,
2404.3.2,Section 2404 Wind and Dead Loads on Glass,Sloped Wired Glass,"Wired glass sloped more than 15 degrees (0.26 rad) from vertical in skylights, sunspaces, sloped roofs and other exterior applications shall be designed to resist the most critical of the combinations of loads from Section 2404.2. For Equations 24-2 and 24-3: (Equation 24-7) For Equation 24-4: (Equation 24-8) where: Fg = Total load on the glass as determined by Equations 24-2, 24-3 and 24-4. Fge = Nonfactored load in accordance with ASTM E1300.",,,,,
2404.3.3,Section 2404 Wind and Dead Loads on Glass,Vertical Patterned Glass,"Patterned glass sloped 15 degrees (0.26 rad) or less from vertical in windows, curtain and window walls, doors and other exterior applications shall be designed to resist the wind loads in Section 1609 for components and cladding according to Equation 24-9. (Equation 24-9) where: Fgw = Wind load on the glass due to ultimate design wind speed, Vult, computed in accordance with Section 1609. Fge = Nonfactored load in accordance with ASTM E1300. The value for patterned glass shall be based on the thinnest part of the glass. Interpolation between nonfactored load charts in ASTM E1300 shall be permitted.",,,,,
2404.3.4,Section 2404 Wind and Dead Loads on Glass,Sloped Patterned Glass,"Patterned glass sloped more than 15 degrees (0.26 rad) from vertical in skylights, sunspaces, sloped roofs and other exterior applications shall be designed to resist the most critical of the combinations of loads from Section 2404.2. For Equations 24-2 and 24-3: (Equation 24-10) For Equation 24-4: (Equation 24-11) where: Fg = Total load on the glass as determined by Equations 24-2, 24-3 and 24-4. Fge = Nonfactored load in accordance with ASTM E1300. The value for patterned glass shall be based on the thinnest part of the glass. Interpolation between the nonfactored load charts in ASTM E1300 shall be permitted.",,,,,
2404.3.5,Section 2404 Wind and Dead Loads on Glass,Vertical Sandblasted Glass,"Sandblasted glass sloped 15 degrees (0.26 rad) or less from vertical in windows, curtain and window walls, doors, and other exterior applications shall be designed to resist the wind loads in Section 1609 for components and cladding according to Equation 24-12. (Equation 24-12) where: Fg = Wind load on the glass due to ultimate design wind speed, Vult, computed in accordance with Section 1609. Fge = Nonfactored load in accordance with ASTM E1300. The value for sandblasted glass is for moderate levels of sandblasting.",,,,,
2404.4,Section 2404 Wind and Dead Loads on Glass,Other Designs,"For designs outside the scope of this section, an analysis or test data for the specific installation shall be prepared by a registered design professional.",,,,,
2405,Chapter 24 Glass and Glazing,Sloped Glazing and Skylights,,,,,,
2405.1,Section 2405 Sloped Glazing and Skylights,Scope,"This section applies to the installation of glass and other transparent, translucent or opaque glazing material installed at a slope of more than 15 degrees (0.26 rad) from the vertical plane, including glazing materials in skylights, roofs and sloped walls.",,,,,
2405.2,Section 2405 Sloped Glazing and Skylights,Allowable Glazing Materials and Limitations,"Sloped glazing shall be any of the following materials, subject to the listed limitations.For monolithic glazing systems, the glazing material of the single light or layer shall be laminated glass with a minimum 30-mil (0.76 mm) polyvinyl butyral (or equivalent) interlayer, wired glass, light-transmitting plastic materials meeting the requirements of Section 2606, heat-strengthened glass or fully tempered glass.For multiple-layer glazing systems, each light or layer shall consist of any of the glazing materials specified in Item 1 above.Annealed glass is permitted to be used as specified in Exceptions 2 and 3 of Section 2405.3.3.Laminated glass and plastic materials described in Items 1 and 2 shall not require the screening or height restrictions provided in Section 2405.3.For additional requirements for plastic skylights, see Section 2610. Glass-block construction shall conform to the requirements of Section 2110.1.",,,,,
2405.3,Section 2405 Sloped Glazing and Skylights,Screening,"Broken glass retention screens, where required, shall:Be capable of supporting twice the weight of the glazing;Be firmly and substantially fastened to the framing members; andBe installed within 4 inches (102 mm) of the glass.The screens shall be constructed of a noncombustible material not thinner than No. 12 B&amp;S gage (0.0808 inch) with mesh not larger than 1 inch by 1 inch (25 mm by 25 mm). In a corrosive atmosphere, structurally equivalent noncorrosive screen materials shall be used.",,,,,
2405.3.1,Section 2405 Sloped Glazing and Skylights,Screens Under Monolithic Glazing,Heat-strengthened glass and fully tempered glass shall have screens installed below the full area of the glazing material.,,,,,
2405.3.2,Section 2405 Sloped Glazing and Skylights,Screens Under Multiple-Layer Glazing,"Heat-strengthened glass, fully tempered glass and wired glass used as the bottom glass layer shall have screens installed below the full area of the glazing material.",,,,,
2405.3.3,Section 2405 Sloped Glazing and Skylights,Screening Not Required for Monolithic and Multiple-Layer Sloped Glazing Systems,"In monolithic and multiple-layer sloped glazing systems, the following apply: Fully tempered glass shall be permitted to be installed without retention screens where glazed between intervening floors at a slope of 30 degrees (0.52 rad) or less from the vertical plane, and having the highest point of the glass 10 feet (3048 mm) or less above the walking surface. Retention screens shall not be required below any glazing material, including annealed glass, where the walking surface below the glazing material is permanently protected from the risk of falling glass or the area below the glazing material is not a walking surface. Retention screens shall not be required below any glazing material, including annealed glass, in the sloped glazing systems of commercial or detached noncombustible greenhouses used exclusively for growing plants and not open to the public, provided that the height of the greenhouse at the ridge does not exceed 30 feet (9144 mm) above grade. Retention screens shall not be required in individual dwelling units in Groups R-2, R-3 and R-4 where fully tempered glass is used as single glazing or as both panes in an insulating glass unit, and all of the following conditions are met: Each pane of the glass is 16 square feet (1.5 m2) or less in area. The highest point of the glass is 12 feet (3658 mm) or less above any walking surface or other accessible area. The glass thickness is 3/16 inch (4.8 mm) or less. Retention screens shall not be required for laminated glass with a 15-mil (0.38 mm) polyvinyl butyral (or equivalent) interlayer used in individual dwelling units in Groups R-2, R-3 and R-4, where both of the following conditions are met: Each pane of glass is 16 square feet (1.5 m2) or less in area. The highest point of the glass is 12 feet (3658 mm) or less above a walking surface or other accessible area.",,,,,
2405.3.4,Section 2405 Sloped Glazing and Skylights,Screens Not Required,"For all other types of glazing complying with Section 2405.2, retention screens shall not be required.",,,,,
2405.4,Section 2405 Sloped Glazing and Skylights,Framing,"In Type I and II construction, sloped glazing and skylight frames shall be constructed of noncombustible materials. In structures where acid fumes deleterious to metal are incidental to the use of the buildings, approved pressure-treated wood or other approved noncorrosive materials are permitted to be used for sash and frames. Framing supporting sloped glazing and skylights shall be designed to resist the tributary roof loads in Chapter 16. Skylights set at an angle of less than 45 degrees (0.79 rad) from the horizontal plane shall be mounted at least 4 inches (102 mm) above the plane of the roof on a curb constructed as required for the frame. Skylights shall not be installed in the plane of the roof where the roof pitch is less than 45 degrees (0.79 rad) from the horizontal.Exception: Installation of a skylight without a curb shall be permitted on roofs with a minimum slope of 14 degrees (three units vertical in 12 units horizontal) in Group R-3 occupancies. All unit skylights installed in a roof with a pitch flatter than 14 degrees (0.25 rad) shall be mounted at least 4 inches (102 mm) above the plane of the roof on a curb constructed as required for the frame unless otherwise specified in the manufacturer's installation instructions.",,,,,
2405.5,Section 2405 Sloped Glazing and Skylights,Unit Skylights and Tubular Daylighting Devices,"Unit skylights and tubular daylighting devices shall be tested and labeled as complying with AAMA/WDMA/CSA 101/I.S./A440. The label shall state the name of the manufacturer, the approved labeling agency, the product designation and the performance grade rating as specified in AAMA/WDMA/CSA 101/I.S.2/A440. Where the product manufacturer has chosen to have the performance grade of the skylight rated separately for positive and negative design pressure, then the label shall state both performance grade ratings as specified in AAMA/WDMA/CSA 101/I.S.2/A440 and the skylight shall comply with Section 2405.5.2. Where the skylight is not rated separately for positive and negative pressure, then the performance grade rating shown on the label shall be the performance grade rating determined in accordance with AAMA/WDMA/CSA 101/I.S.2/A440 for both positive and negative design pressure and the skylight shall conform to Section 2405.5.1.",,,,,
2405.5.1,Section 2405 Sloped Glazing and Skylights,Skylights Rated for the Same Performance Grade for Both Positive and Negative Design Pressure,The design of skylights shall be based on Equation 24-13. (Equation 24-13) where: Fg = Maximum load on the skylight determined from Equations 24-2 through 24-4 in Section 2404.2. PG = Performance grade rating of the skylight.,,,,,
2405.5.2,Section 2405 Sloped Glazing and Skylights,Skylights Rated for Separate Performance Grades for Positive and Negative Design Pressure,"The design of skylights rated for performance grade for both positive and negative design pressures shall be based on Equations 24-14 and 24-15. (Equation 24-14) (Equation 24-15) where: PGPos = Performance grade rating of the skylight under positive design pressure; PGNeg = Performance grade rating of the skylight under negative design pressure; and Fgi and Fgo are determined in accordance with the following: For 0.6Wo ≥ D, where: Wo = Outward wind force, psf (kN/m2) due to ultimate design wind speed, Vult, as calculated in Section 1609. D = The dead weight of the glazing, psf (kN/m2) as determined in Section 2404.2 for glass, or by the weight of the plastic, psf (kN/m2) for plastic glazing. Fgi = Maximum load on the skylight determined from Equations 24-3 and 24-4 in Section 2404.2. Fgo = Maximum load on the skylight determined from Equation 24-2. For 0.6Wo &lt; D, where: Wo = The outward wind force, psf (kN/m2) due to ultimate design wind speed, Vult, as calculated in Section 1609. D = The dead weight of the glazing, psf (kN/m2) as determined in Section 2404.2 for glass, or by the weight of the plastic for plastic glazing. Fgi = Maximum load on the skylight determined from Equations 24-2 through 24-4 in Section 2404.2. Fgo = 0.",,,,,
2406,Chapter 24 Glass and Glazing,Safety Glazing,,,,,,
2406.1,Section 2406 Safety Glazing,Human Impact Loads,"Individual glazed areas, including glass mirrors, in hazardous locations as defined in Section 2406.4 shall comply with Sections 2406.1.1 through 2406.1.4.Exception: Mirrors and other glass panels mounted or hung on a surface that provides a continuous backing support.",,,,,
2406.1.1,Section 2406 Safety Glazing,Impact Test,"Except as provided in Sections 2406.1.2 through 2406.1.4, all glazing shall pass the impact test requirements of Section 2406.2.",,,,,
2406.1.2,Section 2406 Safety Glazing,Plastic Glazing,Plastic glazing shall meet the weathering requirements of ANSI Z97.1.,,,,,
2406.1.3,Section 2406 Safety Glazing,Glass Block,Glass-block walls shall comply with Section 2101.2.5.,,,,,
2406.1.4,Section 2406 Safety Glazing,Louvered Windows and Jalousies,Louvered windows and jalousies shall comply with Section 2403.5.,,,,,
2406.2,Section 2406 Safety Glazing,Impact Test,"Where required by other sections of this code, glazing shall be tested in accordance with CPSC 16 CFR Part 1201. Glazing shall comply with the test criteria for Category II, unless otherwise indicated in Table 2406.2(1).Exception: Glazing not in doors or enclosures for hot tubs, whirlpools, saunas, steam rooms, bathtubs and showers shall be permitted to be tested in accordance with ANSI Z97.1. Glazing shall comply with the test criteria for Class A, unless otherwise indicated in Table 2406.2(2).TABLE 2406.2(1)MINIMUM CATEGORY CLASSIFICATION OF GLAZING USING CPSC 16 CFR PART 1201 EXPOSED SURFACE AREA OF ONE SIDE OF ONE LITE GLAZING IN STORM OR COMBINATION DOORS (Category class) GLAZING IN DOORS (Category class) GLAZED PANELS REGULATED BY SECTION 2406.4.3 (Category class) GLAZED PANELS REGULATED BY SECTION 2406.4.2 (Category class) DOORS AND ENCLOSURES REGULATED BY SECTION 2406.4.5 (Category class) SLIDING GLASS DOORS PATIO TYPE (Category class) 9 square feet or less I I No requirement I II II More than 9 square feet II II II II II II For SI: 1 square foot = 0.0929 m2.TABLE 2406.2(2)MINIMUM CATEGORY CLASSIFICATION OF GLAZING USING ANSI Z97.1 EXPOSED SURFACE AREA OF ONE SIDE OF ONE LITE GLAZED PANELS REGULATED BY SECTION 2406.4.3 (Category class) GLAZED PANELS REGULATED BY SECTION 2406.4.2 (Category class) DOORS AND ENCLOSURES REGULATED BY SECTION 2406.4.5a (Category class) 9 square feet or less No requirement B A More than 9 square feet A A A For SI: square foot = 0.0929 m2.Use is only permitted by the exception to Section 2406.2.",,,,,
2406.3,Section 2406 Safety Glazing,Identification of Safety Glazing,"Except as indicated in Section 2406.3.1, each pane of safety glazing installed in hazardous locations shall be identified by a manufacturer's designation specifying who applied the designation, the manufacturer or installer and the safety glazing standard with which it complies, as well as the information specified in Section 2403.1. The designation shall be acid etched, sand blasted, ceramic fired, laser etched, embossed or of a type that once applied, cannot be removed without being destroyed. A label meeting the requirements of this section shall be permitted in lieu of the manufacturer's designation.Exceptions:For other than tempered glass, manufacturer's designations are not required, provided the building official approves the use of a certificate, affidavit or other evidence confirming compliance with this code.Tempered spandrel glass is permitted to be identified by the manufacturer with a removable paper designation.",,,,,
2406.3.1,Section 2406 Safety Glazing,Multipane Assemblies,"Multipane glazed assemblies having individual panes not exceeding 1 square foot (0.09 m2) in exposed areas shall have at least one pane in the assembly marked as indicated in Section 2406.3. Other panes in the assembly shall be marked ""CPSC 16 CFR Part 1201"" or ""ANSI Z97.1,"" as appropriate.",,,,,
2406.4,Section 2406 Safety Glazing,Hazardous Locations,The locations specified in Sections 2406.4.1 through 2406.4.7 shall be considered specific hazardous locations requiring safety glazing materials.,,,,,
2406.4.1,Section 2406 Safety Glazing,Glazing in Doors,"Glazing in all fixed and operable panels of swinging, sliding and bifold doors shall be considered a hazardous location.Exceptions:Glazed openings of a size through which a 3-inch-diameter (76 mm) sphere is unable to pass.Decorative glazing.Glazing materials used as curved glazed panels in revolving doors.Commercial refrigerated cabinet glazed doors.",,,,,
2406.4.2,Section 2406 Safety Glazing,Glazing Adjacent to Doors,Glazing in an individual fixed or operable panel adjacent to a door where the nearest vertical edge of the glazing is within a 24-inch (610 mm) arc of either vertical edge of the door in a closed position and where the bottom exposed edge of the glazing is less than 60 inches (1524 mm) above the walking surface shall be considered a hazardous location.Exceptions:Decorative glazing.Where there is an intervening wall or other permanent barrier between the door and glazing.Where access through the door is to a closet or storage area 3 feet (914 mm) or less in depth. Glazing in this application shall comply with Section 2406.4.3.Glazing in walls on the latch side of and perpendicular to the plane of the door in a closed position in one- and two-family dwellings or within dwelling units in Group R-2.,,,,,
2406.4.3,Section 2406 Safety Glazing,Glazing in Windows,"Glazing in an individual fixed or operable panel that meets all of the following conditions shall be considered a hazardous location:The exposed area of an individual pane is greater than 9 square feet (0.84 m2).The bottom edge of the glazing is less than 18 inches (457 mm) above the floor.The top edge of the glazing is greater than 36 inches (914 mm) above the floor.One or more walking surface(s) are within 36 inches (914 mm), measured horizontally and in a straight line, of the plane of the glazing.Exceptions:Decorative glazing.Where a horizontal rail is installed on the accessible side(s) of the glazing 34 to 38 inches (864 to 965 mm) above the walking surface. The rail shall be capable of withstanding a horizontal load of 50 pounds per linear foot (730 N/m) without contacting the glass and be a minimum of 11/2 inches (38 mm) in cross-sectional height.Outboard panes in insulating glass units or multiple glazing where the bottom exposed edge of the glass is 25 feet (7620 mm) or more above any grade, roof, walking surface or other horizontal or sloped (within 45 degrees of horizontal) (0.79 rad) surface adjacent to the glass exterior.",,,,,
2406.4.4,Section 2406 Safety Glazing,Glazing in Guards and Railings,"Glazing in guards and railings, including structural baluster panels and nonstructural in-fill panels, regardless of area or height above a walking surface shall be considered a hazardous location.",,,,,
