id,section,title,body,ifc_type,occupancy,design_phase,code_category,primary_responsibility
2411.3.4,"Section 2411 High-Velocity Hurricane Zones—Windows, Doors, Glass and Glazing",2411.3.4,"Gaskets used in glazing systems shall comply with the following standards as applicable:ASTM C864, Dense Elastomeric Compression Seal Gaskets, Setting Blocks, and Spacers.ASTM C509, Elastomeric Cellular Preformed Gaskets and Sealing Material.ASTM C1115, Dense Elastomeric Silicone Rubber Gaskets and Accessories.ASTM E2203, Dense Thermoplastic Elastomers Used for Compression Seals, Gaskets, Setting Blocks, Spacers and Accessories.",,,,,
2411.4,"Section 2411 High-Velocity Hurricane Zones—Windows, Doors, Glass and Glazing",Glazed Panel Safeguards,Reserved.,,,,,
2411.5,"Section 2411 High-Velocity Hurricane Zones—Windows, Doors, Glass and Glazing",Operable Window Safeguards,Reserved.,,,,,
2411.6,"Section 2411 High-Velocity Hurricane Zones—Windows, Doors, Glass and Glazing",Interior Locations,Reserved.,,,,,
2411.7,"Section 2411 High-Velocity Hurricane Zones—Windows, Doors, Glass and Glazing",Safety Glazing,Reserved.,,,,,
2411.8,"Section 2411 High-Velocity Hurricane Zones—Windows, Doors, Glass and Glazing",Sloped Glazing,Reserved.,,,,,
2412,Chapter 24 Glass and Glazing,High-Velocity Hurricane Zones—Glass Veneer,,,,,,
2412.1,Section 2412 High-Velocity Hurricane Zones—Glass Veneer,2412.1,Glass veneer shall be as set forth in this section.,,,,,
2412.2,Section 2412 High-Velocity Hurricane Zones—Glass Veneer,Dimension,"Glass veneer units shall be not less than 11/32 inch (8.7 mm) in thickness. No unit shall be larger in area than 10 square feet (0.93 m2) where 15 feet (4.6 m) or less above the grade directly below, nor larger than 6 square feet (0.56 m2) where more than 15 feet (4.6 m) above the grade directly below.",,,,,
2412.3,Section 2412 High-Velocity Hurricane Zones—Glass Veneer,Attachment,Every glass veneer unit shall be attached to the backing with approved mastic cement and corrosion-resistant ties and shall be supported on shelf angles.,,,,,
2412.3.1,Section 2412 High-Velocity Hurricane Zones—Glass Veneer,2412.3.1,"Where more than 6 feet (1829 mm) above grade, veneer shall be supported by shelf angles, and ties shall be used in both horizontal and vertical joints.",,,,,
2412.3.2,Section 2412 High-Velocity Hurricane Zones—Glass Veneer,2412.3.2,"Below a point 6 feet (1829 mm) above grade, glass veneer shall rest on shelf angles. Veneering shall not be supported on construction which is not an integral part of the wall, and over sidewalks shall be supported on a shelf angle not less than 1/4 inch (6.4 mm) above grade.",,,,,
2412.3.3,Section 2412 High-Velocity Hurricane Zones—Glass Veneer,2412.3.3,All edges of glass veneer shall be ground.,,,,,
2412.4.1,Section 2412 High-Velocity Hurricane Zones—Glass Veneer,2412.4.1,The mastic shall cover not less than one-half of the area of the unit after the unit has been set in place and shall be neither less than 1/4 inch (6.4 mm) nor more than 1/2 inch (12.7 mm) in thickness.,,,,,
2412.4.2,Section 2412 High-Velocity Hurricane Zones—Glass Veneer,2412.4.2,The mastic shall be insoluble in water and shall not lose its adhesive qualities when dry.,,,,,
2412.4.3,Section 2412 High-Velocity Hurricane Zones—Glass Veneer,2412.4.3,Absorbent surfaces shall be sealed by a bonding coat before mastic is applied. The bonding coat shall be cohesive with the mastic.,,,,,
2412.4.4,Section 2412 High-Velocity Hurricane Zones—Glass Veneer,2412.4.4,Glass veneer surfaces to which mastic is applied shall be clean and uncoated.,,,,,
2412.4.5,Section 2412 High-Velocity Hurricane Zones—Glass Veneer,2412.4.5,Space between edges of glass veneer shall be filled uniformly with an approved-type pointing compound.,,,,,
2412.5.1,Section 2412 High-Velocity Hurricane Zones—Glass Veneer,2412.5.1,"Shelf angles shall be of corrosion resistant material capable of supporting four times the width of the supported veneer. The shelf angles shall be spaced vertically in alternate horizontal joints, but not more than 3 feet (914 mm) apart. Shelf angles shall be secured to the wall at intervals not exceeding 2 feet (610 mm) with corrosion-resistant bolts not less than 1/4 inch (6.4 mm) diameter. Bolts shall be set in masonry and secured by lead shields.",,,,,
2412.5.2,Section 2412 High-Velocity Hurricane Zones—Glass Veneer,2412.5.2,Ties shall be of corrosion-resistant metal as manufactured especially for holding glass-veneer sheets to masonry surfaces. There shall be not less than one such approved tie for each 2 square feet (0.19 m2) of veneer surface.,,,,,
2412.6,Section 2412 High-Velocity Hurricane Zones—Glass Veneer,Backing,"Exterior glass veneer shall be applied only upon masonry, concrete or stucco.",,,,,
2412.7,Section 2412 High-Velocity Hurricane Zones—Glass Veneer,Expansion Joints,Glass veneer units shall be separated from each other and from adjoining materials by an expansion joint at least 1/16 inch (1.6 mm) in thickness. There shall be at least 1/64 inch (0.4 mm) clearance between bolts and the adjacent glass.,,,,,
2413,Chapter 24 Glass and Glazing,High-Velocity Hurricane Zones—Storm Shutters/External Protective Devices,,,,,,
2413.1,Section 2413 High-Velocity Hurricane Zones—Storm Shutters/External Protective Devices,General,"Unless exterior wall components including but not limited to structural glazing, doors and windows of enclosed buildings have specific product approval to preserve the enclosed building envelope against impact loads as set forth in Chapter 16 (High-Velocity Hurricane Zones), all such components shall be protected by product approved storm shutters.",,,,,
2413.2,Section 2413 High-Velocity Hurricane Zones—Storm Shutters/External Protective Devices,2413.2,"The storm shutters shall be designed and constructed to insure a minimum of 1 inch (25 mm) separation at maximum deflection with components and frames of components they are to protect unless the components and frame are specifically designed to receive the load of storm shutters, and shall be designed to resist the wind pressures as set forth in Chapter 16 (High-Velocity Hurricane Zones) by methods admitting of rational analysis based on established principles of design. Storm shutter shall also be designed to comply with the impact load requirements included within Chapter 16 (High-Velocity Hurricane Zones).",,,,,
2413.3,Section 2413 High-Velocity Hurricane Zones—Storm Shutters/External Protective Devices,2413.3,"The storm shutter design calculations and detailed drawings, including attachment to the main structure, shall be prepared by and bear the seal of a qualified Florida-registered delegated engineer, or if qualified to prepare such design, by the engineer or architect of record, which architect or engineer shall be proficient in structural design. The architect or engineer of record shall, in all instances, review and approve documents prepared by the delegated engineer.",,,,,
2413.4,Section 2413 High-Velocity Hurricane Zones—Storm Shutters/External Protective Devices,2413.4,Storm shutters shall be approved by the certification agency and shall bear the name of the company engraved in every section of the system.,,,,,
2413.5,Section 2413 High-Velocity Hurricane Zones—Storm Shutters/External Protective Devices,2413.5,Deflection shall not exceed the limits set forth in Chapter 16 (High-Velocity Hurricane Zones).,,,,,
2413.6,Section 2413 High-Velocity Hurricane Zones—Storm Shutters/External Protective Devices,2413.6,Reserved.,,,,,
2413.6.1,Section 2413 High-Velocity Hurricane Zones—Storm Shutters/External Protective Devices,2413.6.1,"Shutters used to protect openings above the first story of any building or structure must be permanently installed and closable from the inside of the building or structure unless such openings are accessible without the use of a ladder or lift, or shutters can be installed from the interior of the building or structure.Exception: Group R3 detached single-family residences not exceeding two stories.",,,,,
2413.7,Section 2413 High-Velocity Hurricane Zones—Storm Shutters/External Protective Devices,2413.7,Storm shutters must completely cover an opening in all directions.,,,,,
2413.7.1,Section 2413 High-Velocity Hurricane Zones—Storm Shutters/External Protective Devices,2413.7.1,"On any side of an opening, the maximum side clearance between the shutter and a wall or inset surface shall be 1/4 inch (6.4 mm). Any distance in excess of 1/4 inch (6.4 mm) shall require end closure or shutter overlap, where applicable.",,,,,
2413.7.2,Section 2413 High-Velocity Hurricane Zones—Storm Shutters/External Protective Devices,2413.7.2,Shutter overlap shall be a minimum of 1.5 times the side clearance between the shutter and wall.,,,,,
2413.7.3,Section 2413 High-Velocity Hurricane Zones—Storm Shutters/External Protective Devices,2413.7.3,"End closures shall be designed to resist wind loads specified in Chapter 16 (High-Velocity Hurricane Zones), based on rational analysis.",,,,,
2414,Chapter 24 Glass and Glazing,High-Velocity Hurricane Zones—Curtain Walls,,,,,,
2414.1,Section 2414 High-Velocity Hurricane Zones—Curtain Walls,Scope,This section prescribes requirements for curtain walls of buildings or structures regulated by this code.,,,,,
2414.2,Section 2414 High-Velocity Hurricane Zones—Curtain Walls,Definition,"A curtain wall is any prefabricated assembly of various components to enclose a building usually attached to and/or supported by the building frame other than a single door, or window, masonry units, poured in place concrete and siding of single membrane metal, wood or plastic.",,,,,
2414.3,Section 2414 High-Velocity Hurricane Zones—Curtain Walls,2414.3,"Curtain walls, as defined in Section 2414.2, shall be designed and constructed in accordance with the requirements of this section.",,,,,
2414.4,Section 2414 High-Velocity Hurricane Zones—Curtain Walls,2414.4,Structural glazing in curtain walls shall also comply with the requirements of Section 2415.,,,,,
2414.5.1,Section 2414 High-Velocity Hurricane Zones—Curtain Walls,2414.5.1,"All structural elements of curtain wall systems and their attachments (including embedments) to the main structural frame shall be designed by and bear the seal of a qualified Florida-registered delegated engineer, or if qualified to prepare such design, by the engineer or architect of record, which architect or engineer shall be proficient in structural design. The engineer of record shall, in all instances, review and approve documents prepared by the delegated engineer.",,,,,
2414.5.2,Section 2414 High-Velocity Hurricane Zones—Curtain Walls,2414.5.2,"Curtain wall systems supported from more than two adjacent floors shall be designed to withstand all imposed loads without exceeding allowable stresses in the event of destruction or failure of any single span within the system. Documents for the main building permit shall include sufficient details describing the curtain wall system attachment to the main structure. This portion of the contract documents, if not prepared by the qualified engineer or architect of record, shall bear the signature and seal of the qualified Florida-registered delegated engineer charged with the responsibility for the design of the curtain wall system.",,,,,
2414.5.3,Section 2414 High-Velocity Hurricane Zones—Curtain Walls,2414.5.3,Individual mullions acting as a continuous member shall transfer loads through supports from no more than three adjacent floors.,,,,,
2414.5.4,Section 2414 High-Velocity Hurricane Zones—Curtain Walls,Materials,The materials used in any curtain wall shall comply with the applicable provisions of this code.,,,,,
2414.6,Section 2414 High-Velocity Hurricane Zones—Curtain Walls,Fire Protection,Reserved.,,,,,
2414.7,Section 2414 High-Velocity Hurricane Zones—Curtain Walls,Inspection,Reserved.,,,,,
2415,Chapter 24 Glass and Glazing,High-Velocity Hurricane Zones—Structural Glazing Systems,,,,,,
2415.1,Section 2415 High-Velocity Hurricane Zones—Structural Glazing Systems,Scope,This section prescribes requirements for structural glazing systems of buildings or structures regulated by this code.,,,,,
2415.2.1,Section 2415 High-Velocity Hurricane Zones—Structural Glazing Systems,2415.2.1,"Structural glazing, as defined in Section 2414.2, shall be designed and constructed in accordance with the requirements of this section.",,,,,
2415.2.2,Section 2415 High-Velocity Hurricane Zones—Structural Glazing Systems,2415.2.2,Structural glazing systems used in curtain walls shall also comply with the requirements of Section 2414.,,,,,
2415.3,Section 2415 High-Velocity Hurricane Zones—Structural Glazing Systems,Definition,The terms used in this section shall be defined as set forth in Section 202.,,,,,
2415.4,Section 2415 High-Velocity Hurricane Zones—Structural Glazing Systems,Standards,"Adhesives and sealants used in structural glazing systems shall comply with following standards:ASTM C794, Test Method for Adhesion-In-Peel of Elastomeric Joint Sealants.ASTM C920, Specification for Elastomeric Joint Sealants.ASTM D412, Test Methods for Rubber Properties in Tension.ASTM D624, Test Method for Rubber Property—Tear Resistance.ASTM D2240, Test Method for Rubber Property—Durometer Hardness. Federal Specifications TT-S-001543A and TT-S-00230C.ASTM E331, Test Method for Water Penetration of Exterior Windows, Curtain Walls and Doors.ASTM E330, Test Method for Structural Performance of Exterior Windows, Curtain Walls and Doors.",,,,,
2415.5.1,Section 2415 High-Velocity Hurricane Zones—Structural Glazing Systems,General,Structural glazing systems shall be designed by and bear the seal of a Florida-registered professional engineer.,,,,,
2415.5.2.1,Section 2415 High-Velocity Hurricane Zones—Structural Glazing Systems,Identification,All materials shall be clearly identified as to manufacturer and manufacturer's product number.,,,,,
2415.5.2.2.1,Section 2415 High-Velocity Hurricane Zones—Structural Glazing Systems,2415.5.2.2.1,Only approved silicone elastomer adhesives and sealants shall be used for fastening glass lights and other panels to curtain wall framing.,,,,,
2415.5.2.2.2,Section 2415 High-Velocity Hurricane Zones—Structural Glazing Systems,2415.5.2.2.2,Such adhesives and sealants shall be of a polymer that is 100-percent silicone.,,,,,
2415.5.2.2.3,Section 2415 High-Velocity Hurricane Zones—Structural Glazing Systems,2415.5.2.2.3,Adhesives and sealants shall have been tested in accordance with the standards set forth in Section 2415.4.,,,,,
2415.5.3.1,Section 2415 High-Velocity Hurricane Zones—Structural Glazing Systems,2415.5.3.1,"Compatibility of all components and fabrication procedures of structural glazing systems shall be tested, approved and recommended in writing by the manufacturer of the adhesive; the manufacturer of the coating; whether it is anodized, baked or otherwise applied and the manufacturer of the glass panel.",,,,,
2415.5.3.2,Section 2415 High-Velocity Hurricane Zones—Structural Glazing Systems,2415.5.3.2,"Manufacturer's testing, recommendation and approval shall address, but shall not be limited in scope by the following sections.",,,,,
2415.5.3.2.1,Section 2415 High-Velocity Hurricane Zones—Structural Glazing Systems,2415.5.3.2.1,"The compatibility of the sealant with metal, glazing materials, shims, spacers, setting blocks, backer rods, gaskets and other materials.",,,,,
2415.5.3.2.2,Section 2415 High-Velocity Hurricane Zones—Structural Glazing Systems,2415.5.3.2.2,Adhesion to the designated substrates and adhesion of the substrates to the base metal.,,,,,
2415.5.3.2.3,Section 2415 High-Velocity Hurricane Zones—Structural Glazing Systems,2415.5.3.2.3,The design and structural capability of silicone joints and cross sections.,,,,,
2415.5.4.1.1,Section 2415 High-Velocity Hurricane Zones—Structural Glazing Systems,2415.5.4.1.1,The design stress of the structural silicone shall not exceed 20 psi (138 kPa) for materials having a minimum strength of 100 psi (690 kPa) at the weakest element in the line of stress.,,,,,
2415.5.4.1.2,Section 2415 High-Velocity Hurricane Zones—Structural Glazing Systems,2415.5.4.1.2,Such design stress shall also provide for a safety factor of not less than 5.0.,,,,,
2415.5.4.1.3,Section 2415 High-Velocity Hurricane Zones—Structural Glazing Systems,2415.5.4.1.3,Safety factors greater than 5.0 shall be specified by the engineer when required or recommended by the manufacturer.,,,,,
2415.5.4.1.4,Section 2415 High-Velocity Hurricane Zones—Structural Glazing Systems,2415.5.4.1.4,The silicone structural seal shall have a maximum modulus of elasticity to allow no more than 25-percent movement of the joint width at 20 psi (138 kPa) stress.,,,,,
2415.5.4.1.5,Section 2415 High-Velocity Hurricane Zones—Structural Glazing Systems,2415.5.4.1.5,"In insulating glass units, the secondary silicone seal shall be designed to withstand a minimum of one-half the design negative wind load applicable to the outboard lights.",,,,,
2415.5.4.2,Section 2415 High-Velocity Hurricane Zones—Structural Glazing Systems,Bonding Limits,Structural glazing shall be limited to adhesive bonding on one side or on two opposing sides of an infill glass lights or panel.Exception: Three- or four-side bonding shall be permitted only when structural glazing units are shop fabricated and shop glazed.,,,,,
2415.5.4.3.1,Section 2415 High-Velocity Hurricane Zones—Structural Glazing Systems,2415.5.4.3.1,Job-site replacement reglazing shall be permitted only when performed following a procedure approved in writing by the applicable structural silicone manufacturer.,,,,,
2415.5.4.3.2,Section 2415 High-Velocity Hurricane Zones—Structural Glazing Systems,2415.5.4.3.2,Replacement shall be performed only by individuals or firms approved or certified by the silicone manufacturer.,,,,,
2415.6,Section 2415 High-Velocity Hurricane Zones—Structural Glazing Systems,Fire Protection,Reserved.,,,,,
2415.7.1,Section 2415 High-Velocity Hurricane Zones—Structural Glazing Systems,2415.7.1,A minimum of 1 percent of the structurally glazed panels shall be tested for load carrying capacity and sealant adhesion in accordance with Chapter 16 (High-Velocity Hurricane Zones) and ASTM E330.,,,,,
2415.7.2,Section 2415 High-Velocity Hurricane Zones—Structural Glazing Systems,2415.7.2,Structural glazed panels shall be inspected by a Florida-registered architect or professional engineer for conformance with the approved design and installation procedures determined by the authority having jurisdiction prior to the erection of such panels and after the seal curing period established by the silicone manufacturer.,,,,,
2415.7.3,Section 2415 High-Velocity Hurricane Zones—Structural Glazing Systems,2415.7.3,It shall be the responsibility of the contractor to verify the adhesion of the cured sealant periodically throughout the application to assure compliance with the manufacturer's specifications and quality of application.,,,,,
2415.7.4,Section 2415 High-Velocity Hurricane Zones—Structural Glazing Systems,2415.7.4,"Structural glazing systems on threshold buildings shall be recertified by the owner as specified by the authority having jurisdiction at six month intervals for the first year after installation. Subsequently, such systems shall be recertified every five years at regular intervals.",,,,,
2415.7.5,Section 2415 High-Velocity Hurricane Zones—Structural Glazing Systems,2415.7.5,Such recertifications shall determine the structural condition and adhesion capacity of the silicone sealant.,,,,,
