id,section,reference,displayTitle,depth,body
3.311,Section 311 Storage Group S,311.2,"311.2 Moderate-Hazard Storage, Group S-1",2,"Storage Group S-1 occupancies are buildings occupied for storage uses that are not classified as Group S-2, including, but not limited to, storage of the following:Aerosol products, Levels 2 and 3, aerosol cooking spray, plastic aerosol 3 (PA3)Aircraft hangar (storage and repair)Bags: cloth, burlap and paperBamboos and rattanBasketsBelting: canvas and leatherBeverages over 20-percent alcohol contentBooks and paper in rolls or packsBoots and shoesButtons, including cloth covered, pearl or boneCardboard and cardboard boxesClothing, woolen wearing apparelCordageDry boat storage (indoor)FurnitureFursGlues, mucilage, pastes and sizeGrainsHorns and combs, other than celluloidLeatherLinoleumLithium-ion or lithium metal batteriesLumberMotor vehicle repair garages complying with the maximum allowable quantities of hazardous materials specified in Table 307.1(1) (see Section 406.8)Photo engravingsResilient flooringSelf-service storage facility (mini-storage)SilksSoapsSugarTires, bulk storage ofTobacco, cigars, cigarettes and snuffUpholstery and mattressesVehicle repair garages for vehicles powered by lithium-ion or lithium metal batteriesWax candles"
3.311,Section 311 Storage Group S,311.2.1,311.2.1 Aircraft Hangers,3,Aircraft hangars used for storage or repair shall comply with Section 412.3.
3.311,Section 311 Storage Group S,311.2.2,311.2.2 Motor Vehicle Repair Garages,3,Motor vehicle repair garages shall comply with Section 406.8.
3.311,Section 311 Storage Group S,311.3,"311.3 Low-Hazard Storage, Group S-2",2,"Storage Group S-2 occupancies include, among others, buildings used for the storage of noncombustible materials such as products on wood pallets or in paper cartons with or without single thickness divisions; or in paper wrappings. Such products are permitted to have a negligible amount of plastic trim, such as knobs, handles or film wrapping. Group S-2 storage uses shall include, but not be limited to, storage of the following:AsbestosBeverages up to and including20-percent alcoholCement in bagsChalk and crayonsDairy products in nonwaxed coated paper containersDry cell batteriesElectrical coilsElectrical motorsEmpty cansFood productsFoods in noncombustible containersFresh fruits and vegetables in nonplastic trays or containersFrozen foodsGlassGlass bottles, empty or filled with noncombustible liquidsGypsum boardInert pigmentsIvoryMeatsMetal cabinetsMetal desks with plastic tops and trimMetal partsMetalsMirrorsOil-filled and other types of distribution transformersPublic parking garages, open or enclosedPorcelain and potteryStovesTalc and soapstonesWashers and dryers"
3.311,Section 311 Storage Group S,311.3.1,311.3.1 Public Parking Garages,3,Public parking garages shall comply with Section 406.4 and the additional requirements of Section 406.5 for open parking garages or Section 406.6 for enclosed parking garages.
3,Chapter 3 Occupancy Classification and Use,312,Section 312 Utility and Miscellaneous Group U,1,
3.312,Section 312 Utility and Miscellaneous Group U,312.1,312.1 General,2,"Buildings and structures of an accessory character and miscellaneous structures not classified in any specific occupancy shall be constructed, equipped and maintained to conform to the requirements of this code commensurate with the fire and life hazard incidental to their occupancy. Group U shall include, but not be limited to, the following:Agricultural buildingsAircraft hangars, accessory to a one- or two-family residence (see Section 412.4)BarnsCarportsCommunication equipment structures with a gross floor area of less than 1,500 square feet (139 m2)Fences more than 7 feet (2134 mm) in heightGrain silos, accessory to a residential occupancyLivestock sheltersPrivate garagesRetaining wallsShedsStablesTanksTowers"
3.312,Section 312 Utility and Miscellaneous Group U,312.1.1,312.1.1 Greenhouses,3,Greenhouses not classified as another occupancy shall be classified as Use Group U.
3.312,Section 312 Utility and Miscellaneous Group U,312.2,312.2 Private Garages and Carports,2,Private garages and carports shall comply with Section 406.3.
3.312,Section 312 Utility and Miscellaneous Group U,312.3,312.3 Residential Aircraft Hangars,2,Aircraft hangars accessory to a one- or two-family residence shall comply with Section 412.4.
