id,section,title,body,ifc_type,occupancy,design_phase,code_category,primary_responsibility
11,,Additions,,,,,,
1101,Chapter 11 Additions,General,,,,,,
1101.1,Section 1101 General,Scope,"An addition to a building or structure shall comply with the Florida Building Code as adopted for new construction without requiring the existing building or structure to comply with any requirements of those codes or of these provisions, except as required by this chapter. Where an addition impacts the existing building or structure, that portion shall comply with this code.",Wall|Slab|Roof,Assembly (A)|Business (B)|Educational (E)|Residential (R)|Mercantile (M),sd|dd|cd,occupancy_classification,architect
1101.2,Section 1101 General,Creation or Extension of Nonconformity,"An addition shall not create or extend any nonconformity in the existing building to which the addition is being made with regard to accessibility, structural strength, fire safety, means of egress, or the capacity of mechanical, plumbing, or electrical systems.",Wall|Slab|Roof|Column|Covering,Assembly (A)|Business (B)|Educational (E)|Residential (R)|Institutional (I),sd|dd|cd,special_construction,architect
1101.3,Section 1101 General,Other Work,Any repair or alteration work within an existing building to which an addition is being made shall comply with the applicable requirements for the work as classified in Chapter 6.,,,,,
1101.4,Section 1101 General,Enhanced Classroom Acoustics,"In Group E occupancies, enhanced classroom acoustics shall be provided in all classrooms in the addition with a volume of 20,000 cubic feet (565 m3) or less. Enhanced classroom acoustics shall comply with the reverberation time in Section 808 of ICC A117.1.",,,,,
1102,Chapter 11 Additions,Heights and Areas,,,,,,
1102.1,Section 1102 Heights and Areas,Height Limitations,"No addition shall increase the height of an existing building beyond that permitted under the applicable provisions of Chapter 5 of the Florida Building Code, Building for new buildings.",Wall|Slab|Roof|Column|BuildingElementProxy,Assembly (A)|Business (B)|Educational (E)|Factory and Industrial (F)|Residential (R),concept|sd|dd|cd,building_height_area_limits,architect
1102.2,Section 1102 Heights and Areas,Area Limitations,"No addition shall increase the area of an existing building beyond that permitted under the applicable provisions of Chapter 5 of the Florida Building Code, Building for new buildings unless fire separation as required by the Florida Building Code, Building is provided.Exception: In-filling of floor openings and nonoccupiable appendages such as elevator and exit stairway shafts shall be permitted beyond that permitted by the Florida Building Code, Building.",Wall|Slab|Stair|Elevator|CurtainWall,Assembly (A)|Business (B)|Educational (E)|Factory and Industrial (F)|Residential (R),sd|dd|cd,building_height_area_limits,architect
1102.3,Section 1102 Heights and Areas,Fire Protection Systems,"Existing fire areas increased by the addition shall comply with Chapter 9 of the Florida Building Code, Building.Exception: If an existing warehouse is expanded, the addition must comply with the requirements in Chapter 9 of the Florida Building Code, Building; however, the existing warehouse need not be updated to meet those requirements so long as it is in compliance with the Florida Building Code, 2001 edition, and with requirements concerning automatic sprinkler systems in Section 903 of the Florida Building Code, Building.",Wall|Stair|Elevator|BuildingElementProxy,Assembly (A)|Business (B)|Educational (E)|Factory and Industrial (F)|Residential (R),sd|dd|cd,fire_protection_alarm_systems,fire_protection_engineer
1103,Chapter 11 Additions,Structural,,,,,,
1103.1,Section 1103 Structural,"Compliance With the Florida Building Code, Building","Additions to existing buildings or structures are new construction and shall comply with the Florida Building Code, Building.",,,,,
1103.2,Section 1103 Structural,Additional Gravity Loads,"Existing structural elements supporting any additional gravity loads as a result of additions shall comply with the Florida Building Code, Building.Exceptions:Structural elements whose stress is not increased by more than 5 percent.Buildings of Group R occupancy with no more than five dwelling units or sleeping units used solely for residential purposes where the existing building and the addition comply with the conventional light-frame construction methods of the Florida Building Code, Building or the provisions of the Florida Building Code, Residential.",,,,,
1103.3,Section 1103 Structural,Lateral Force-Resisting System,"The lateral force-resisting system of existing buildings to which additions are made shall comply with Sections 1103.3.1, 1103.3.2 and 1103.3.3.Exceptions:Buildings of Group R occupancy with no more than five dwelling or sleeping units used solely for residential purposes where the existing building and the addition comply with the the provisions of the Florida Building Code, Residential.Any existing lateral load-carrying structural element whose demand-capacity ratio with the addition considered is not more than 10 percent greater than its demand-capacity ratio with the addition ignored shall be permitted to remain unaltered. For purposes of this exception, comparisons of demand-capacity ratios and calculation of design lateral loads, forces and capacities shall account for the cumulative effects of additions and alterations since original construction.",,,,,
1103.3.1,Section 1103 Structural,Vertical Addition,"Any element of the lateral force-resisting system of an existing building subjected to an increase in vertical or lateral loads from the vertical addition shall comply with the Florida Building Code, Building wind provisions.",,,,,
1103.3.2,Section 1103 Structural,Horizontal Addition,"Where horizontal additions are structurally connected to an existing structure, all lateral force-resisting elements of the existing structure affected by such addition shall comply with the Florida Building Code, Building wind provisions.",,,,,
1103.3.3,Section 1103 Structural,Voluntary Addition of Structural Elements to Improve the Lateral Force-Resisting System,Voluntary addition of structural elements to improve the lateral force-resisting system of an existing building shall comply with Section 807.6.,,,,,
1103.4,Section 1103 Structural,Snow Drift Loads,Reserved.,,,,,
1103.5,Section 1103 Structural,Flood Hazard Areas,"Additions and foundations in flood hazard areas shall comply with the following requirements: For horizontal additions that are structurally interconnected to the existing building: If the addition and all other proposed work, when combined, constitute substantial improvement, the existing building and the addition shall comply with Section 1612 of the Florida Building Code, Building, or Section R322 of the Florida Building Code, Residential, as applicable. If the addition constitutes substantial improvement, the existing building and the addition shall comply with Section 1612 of the Florida Building Code, Building, or Section R322 of the Florida Building Code, Residential, as applicable. If the addition does not constitute substantial improvement, the addition is not required to comply with the flood design requirements for new construction, provided that both of the following apply: The addition shall not create or extend any nonconformity of the existing building with the flood resistant construction requirements. The lowest floor of the addition shall be at or above the lower of the lowest floor of the existing building or the lowest floor elevation required in Section 1612 of the Florida Building Code, Building or Section R322 of the Florida Building Code, Residential, as applicable. For horizontal additions that are not structurally interconnected to the existing building: The addition shall comply with Section 1612 of the Florida Building Code, Building or Section R322 of the Florida Building Code, Residential, as applicable. If the addition and all other proposed work, when combined, constitute substantial improvement, the existing building and the addition shall comply with Section 1612 of the Florida Building Code, Building, or Section R322 of the Florida Building Code, Residential, as applicable. For vertical additions and all other proposed work that, when combined, constitute substantial improvement, the existing building shall comply with Section 1612 of the Florida Building Code, Building, or Section R322 of the Florida Building Code, Residential, as applicable. For a new foundation, replacement foundation, or a foundation raised or extended in the vertical, the foundation shall comply with Section 1612 of the Florida Building Code, Building or Section R322 of the Florida Building Code, Residential, as applicable.",,,,,
1104,Chapter 11 Additions,Smoke Alarms in Occupancy Groups R and I-1,,,,,,
1104.1,Section 1104 Smoke Alarms in Occupancy Groups R and I-1,Smoke Alarms in Existing Portions of a Building,"Where an addition is made to a building or structure of a Group R or I-1 occupancy, the existing building shall be provided with smoke alarms as required by the Florida Fire Prevention Code or Section R314 of the Florida Building Code, Residential as applicable.",,,,,
1105,Chapter 11 Additions,Accessibility,,,,,,
1105.1,Section 1105 Accessibility,Minimum Requirements,"Accessibility provisions for new construction shall apply to additions. An addition that affects the accessibility to, or contains an area of, primary function shall comply with the requirements of the Florida Building Code, Accessibility.",,,,,
1105.2,Section 1105 Accessibility,Accessible Dwelling Units and Sleeping Units,Reserved.,,,,,
1105.3,Section 1105 Accessibility,Type A Dwelling or Sleeping Units,Reserved.,,,,,
1105.4,Section 1105 Accessibility,Type B Dwelling or Sleeping Units,Reserved.,,,,,
1106,Chapter 11 Additions,Energy Conservation,,,,,,
1106.1,Section 1106 Energy Conservation,Minimum Requirements,"Additions to existing buildings or structures shall comply with the requirements of the Florida Building Code, Energy Conservation.",,,,,
1107,Chapter 11 Additions,Plumbing,,,,,,
1107.1,Section 1107 Plumbing,Separate Facilities,Additions to existing buildings shall be permitted to comply with Section 810.1.,,,,,
1108,Chapter 11 Additions,Carbon Monoxide Protection,,,,,,
1108.1,Section 1108 Carbon Monoxide Protection,Carbon Monoxide Protection,"An addition to an existing building shall be equipped with carbon monoxide alarms in accordance with the Florida Fire Prevention Code, Section 915 of the Florida Building Code, Building, or Section R315 of the Florida Building Code, Residential, as applicable.",,,,,
