id,section,title,body,ifc_type,occupancy,design_phase,code_category,primary_responsibility
19,,Concrete,"CALIFORNIA BUILDING CODE — MATRIX ADOPTION TABLE CHAPTER 19 — CONCRETE (Matrix Adoption Tables are nonregulatory, intended only as an aid to the code user. See Chapter 1 for state agency authority and building applications.) Adopting agency BSC BSC-CG SFM HCD DSA OSHPD BSCC DPH AGR DWR CEC CA SL SLC 1 2 1/AC AC SS SS/CC 1 1R 2 3 4 5 6 Adopt entire chapter X X X X Adopt entire chapter as amended (amended sections listed below) X X X X X Adopt only those sections that are listed below Chapter / Section 1901.1.1 X X X X 1901.1.2 X X X X 1901.1.3 X X X X 1901.1.4 X 1901.1.5 X 1901.3.1 — 1901.3.4.5 X X X 1903.1 X X X 1903.3 X X X 1903.4 X X X 1903.5 X X X 1905.1.8 1905.5 X X X 1905.6 X X X 1906 X X X 1907.4.1 X 1908.1 X X X 1909 X 1910 X X X 1911 X X X The state agency does not adopt sections identified with the following symbol: † The Office of the State Fire Marshal's adoption of this chapter or individual sections is applicable to structures regulated by other state agencies pursuant to Section 1.11. User notes: About this chapter: Chapter 19 provides minimum accepted practices for the design and construction of buildings and structural components using concrete—both plain and reinforced. Chapter 19 relies primarily on the reference to American Concrete Institute (ACI) 318, Building Code Requirements for Structural Concrete. Structural concrete must be designed and constructed to comply with this code and all listed standards. There are also specific provisions addressing slabs-on-ground and shotcrete. This chapter was extensively reorganized for the 2024 edition. For complete information, see the relocations table in the Preface information of this code. ICC code development note: Code change proposals to this chapter will be considered by the IBC—Structural Code Development Committee during the 2025 (Group B) Code Development Cycle.",,,,,
1901,Chapter 19 Concrete,General,,,,,,
1901.1,Section 1901 General,Scope,"The provisions of this chapter shall govern the materials, quality control, design and construction of concrete used in structures.",,,,,
1901.1.1,Section 1901 General,Application,"[DSA-SS/CC, OSHPD] The scope of application of Chapter 19 is as follows:Structures regulated by the Division of the State Architect—Structural Safety/Community Colleges (DSA-SS/CC), which include those applications listed in Section 1.9.2.2.Structures regulated by the Department of Health Care Access and Information/Office of Statewide Hospital Planning and Development (OSHPD), which include hospital buildings removed from general acute care service, skilled nursing facility buildings, intermediate care facility buildings and acute psychiatric hospital buildings listed in Sections 1.10.1, 1.10.2 and 1.10.5.",,,,,
1901.1.2,Section 1901 General,Amendments in This Chapter,"[DSA-SS/CC, OSHPD] DSA-SS/CC and OSHPD adopts this chapter as amended.",,,,,
1901.1.3,Section 1901 General,"Identification of Amendments. [DSA-SS/CC, OSHPD]","Division of the State Architect - Structural Safety/Community Colleges amendments appear in this chapter preceded by the appropriate acronym, as follows:[DSA-SS/CC] — For applications listed in Section 1.9.2.2.[OSHPD 1R, 2 &amp; 5] Office of Statewide Hospital Planning and Development (OSHPD) amendments appear in this chapter preceded by the appropriate acronym, as follows:[OSHPD 1R] — For applications listed in Section 1.10.1.[OSHPD 2] — For applications listed in Section 1.10.2.[OSHPD 5] — For applications listed in Section 1.10.5.",,,,,
1901.1.4,Section 1901 General,Reference to Other Chapters,"[DSA-SS/CC] Where reference within this chapter is made to sections in Chapters 17 and 18, the provisions in Chapters 17A and 18A respectively shall apply instead.",,,,,
1901.1.5,Section 1901 General,Additional Amendments,[DSA-SS/CC] See Section 1909 for additional requirements.,,,,,
1901.2,Section 1901 General,Plain and Reinforced Concrete,Structural concrete shall be designed and constructed in accordance with the requirements of this chapter and ACI 318 as supplemented in Section 1905 of this code.,,,,,
1901.2.1,Section 1901 General,Structural Concrete With GFRP Reinforcement,Cast-in-place structural concrete internally reinforced with glass fiber reinforced polymer (GFRP) reinforcement conforming to ASTM D7957 and designed in accordance with ACI CODE 440.11 shall be permitted where fire-resistance ratings are not required and only for structures assigned to Seismic Design Category A.,,,,,
1901.3,Section 1901 General,Anchoring to Concrete,"Anchoring to concrete shall be in accordance with ACI 318 as supplemented in Section 1905, and applies to cast-in (headed bolts, headed studs and hooked J- or L-bolts), post-installed expansion (torque-controlled and displacement-controlled), undercut, screw, and adhesive anchors.",,,,,
1901.3.1,Section 1901 General,Power Actuated Fasteners,"[OSHPD 1R, 2 &amp; 5] Power actuated fasteners qualified in accordance with ICC-ES AC 70 shall be deemed to satisfy the requirements of ASCE 7, Section 13.4.5.Power actuated fasteners shall be permitted in seismic shear for components exempt from construction documents review by ASCE 7, Section 13.1.4 and for interior non-bearing non-shear wall partitions only. Power actuated fastener shall not be used to anchor seismic bracing, exterior cladding or curtain wall systems.Exception: Power actuated fasteners in steel to steel connections prequalified for seismic application by cyclic tests in accordance with ICC-ES AC 70 shall be permitted for seismic design.",,,,,
1901.3.2,Section 1901 General,Mechanical Anchors and Specialty Inserts,"[OSHPD 1R, 2 &amp; 5] Mechanical anchors qualified in accordance with ICC-ES AC 193 shall be deemed to satisfy the requirements of this section. Specialty inserts, including cast-in-place specialty inserts, tested in accordance with ICC-ES AC 232 or AC 446 shall be deemed to satisfy the requirements of this section.Note: The removal and resetting of post-installed mechanical anchors are prohibited by ACI 318 Section 17.1.3.",,,,,
1901.3.3,Section 1901 General,Post-Installed Adhesive Anchors,"[OSHPD 1R, 2 &amp; 5] Post-installed reinforcing bars, adhesive anchors, and torque-controlled adhesive anchors qualified in accordance with ICC-ES AC 308 shall be deemed to satisfy the requirements of this section.",,,,,
1901.3.4,Section 1901 General,Proof Tests for Post-Installed Anchors in Concrete,"[OSHPD 1R, 2 &amp; 5] When post-installed anchors are used in lieu of cast-in place bolts, the proof test loads, frequency and acceptance criteria shall be in accordance with this section.Exceptions: Proof tests are not required for the following: Undercut anchors that allow visual confirmation of full set.Repetitively installed anchors (with three or more identical anchors) of diameter one-quarter (1/4) inch or less used for distributed systems or architectural components.Power actuated fasteners used to attach tracks of interior nonstructural partition walls resisting only shear loads and with at least three fasteners per segment of track.Shear dowels across cold joints in slabs on grade, where the slab is not structural in accordance with Section 1907.1.",,,,,
1901.3.4.1,Section 1901 General,General,"[OSHPD 1R, 2 &amp; 5] Test loads or torques, test frequencies, and acceptance criteria shall be shown on the construction documents. If any anchor fails testing, all anchors of the same type shall be tested until twenty (20) consecutive anchors pass, then resume the initial test frequency. Anchors to be tested shall be selected at random by the special inspector or inspector of record (IOR) when 100 percent of the anchors are not tested. The testing of the post-installed anchors shall be done in the presence of the special inspector and a report of the test results shall be submitted to the enforcement agency.",,,,,
1901.3.4.2,Section 1901 General,Proof Testing Procedure,"[OSHPD 1R, 2 &amp; 5] Post-installed anchors shall be tension tested in accordance with ASTM E3121 with test frequency and test loads in accordance with Sections 1901.3.4.3 and 1901.3.4.4, respectively. Proof tests using ASTM E3121 tension test procedure do not require displacement measurement.Exception: Torque-controlled post-installed and screw-type anchors shall be permitted to be tested using torque based on a valid evaluation report using criteria adopted in this code.",,,,,
1901.3.4.3,Section 1901 General,Test Frequency,"[OSHPD 1R, 2 &amp; 5]",,,,,
1901.3.4.3.1,Section 1901 General,Structural Applications,"One hundred percent of post-installed anchors used for structural applications shall be proof tested.Exceptions: Sill bolts. When post-installed anchors are used for sill plate or bottom track bolting applications, 10 percent of the anchors shall be tested.Rebar dowels. When adhesive anchor systems are used to install reinforcing dowel bars in hardened concrete, 25 percent of dowels shall be tested if all the following conditions are met:The dowels are used exclusively to transmit shear forces across joints between existing and new concrete.The number of dowels in any one member equals or exceeds twelve (12).The dowels are uniformly distributed across seismic force resisting members (such as shear walls, collectors and diaphragms).",,,,,
1901.3.4.3.2,Section 1901 General,Nonstructural Applications,"Fifty percent of post-installed anchors used in nonstructural applications shall be proof tested. The percentage of tested anchors applies to each set of anchors of a common type (e.g., adhesive, wedge, or shell and sleeve for expansion bolts), size, and embedment depth and to each group of anchors. Four or more anchors connected to a common element shall be defined as a group. Exceptions: Repetitive anchors. When anchors are used repetitively (with three or more identical anchors) in distribution systems (such as pipe, duct or conduit supports) or architectural systems (such as suspended ceilings, cladding, and partitions), 20 percent of anchors, including at least one anchor in each group, shall be tested.Anchors with low tension. When the design tension on anchors is less than 100 pounds and those anchors are clearly noted on the approved construction documents, 10 percent of anchors shall be tested.",,,,,
1901.3.4.4,Section 1901 General,Test Loads,"[OSHPD 1R, 2 &amp; 5] Required test loads shall be determined by one of the following methods: Twice the maximum allowable tension load or one and a quarter (11/4) times the maximum design strength of anchors as provided in approved evaluation report using criteria adopted in this code or determined in accordance with Chapter 17 of ACI 318.Tension test load need not exceed 80 percent of the nominal yield strength of the anchor element (= 0.8 Ase fya). The manufacturer's recommended installation torque based on approved evaluation report using criteria adopted in this code.",,,,,
1901.3.4.5,Section 1901 General,Test Acceptance Criteria,"[OSHPD 1R, 2 &amp; 5] Proof test shall satisfy the following minimum requirements. Tension test: Anchors shall be tested in the unconfined condition in accordance with ASTM E3121 except that the minimum clearance to the test frame shall be 1.5 times the anchor's embedment depth. Test load shall be maintained for a minimum of 15 seconds and shall exhibit no discernable movement during the tension test, e.g., as evidenced by loosening of the washer under the nut or an abrupt decrease in the gauge pressure. Exception: Adhesive anchors shall be permitted to be tested in confined conditions in accordance with ASTM E3121 when the approved construction documents indicate that concrete breakout does not control the design tensile strength. Torque test: Torque-controlled post-installed anchors tested with a calibrated torque wrench shall attain the specified torque within 1/2 turn of the nut; or one-quarter (1/4) turn of the nut for a 3/8-inch sleeve anchor only. Screw-type anchors tested with a calibrated torque wrench shall attain the specified torque within one-quarter (1/4) turn of the screw after initial seating of the screw head.",,,,,
1901.4,Section 1901 General,Composite Structural Steel and Concrete Structures,Systems of structural steel acting compositely with reinforced concrete shall be designed in accordance with Section 2206 of this code.,,,,,
1901.5,Section 1901 General,Construction Documents,"The construction documents for structural concrete construction shall include:The specified compressive strength of concrete at the stated ages or stages of construction for which each concrete element is designed.The specified strength or grade of reinforcement.The size and location of structural elements, reinforcement and anchors.Provision for dimensional changes resulting from creep, shrinkage and temperature.The magnitude and location of prestressing forces.Anchorage length of reinforcement and location and length of lap splices.Type and location of mechanical and welded splices of reinforcement.Details and location of contraction or isolation joints specified for plain concrete.Minimum concrete compressive strength at time of posttensioning.Stressing sequence for posttensioning tendons.For structures assigned to Seismic Design Category D, E or F, a statement if slab on grade is designed as a structural diaphragm.",,,,,
1901.6,Section 1901 General,Special Inspections and Tests,Special inspections and tests of concrete elements of buildings and structures and concreting operations shall be as required by Chapter 17.,,,,,
1901.7,Section 1901 General,Tolerances for Structural Concrete,"Where not indicated in construction documents, structural tolerances for concrete structural elements shall be in accordance with this section.",,,,,
1901.7.1,Section 1901 General,Cast-in-Place Concrete Tolerances,Structural tolerances for cast-in-place concrete structural elements shall be in accordance with ACI 117.Exceptions: Group R-3 detached one- or two-family dwellings are not required to comply with this section.Shotcrete is not required to comply with this section.,,,,,
1901.7.2,Section 1901 General,Precast Concrete Tolerances,Structural tolerances for precast concrete structural elements shall be in accordance with ACI ITG-7. Exception: Group R-3 detached one- or two-family dwellings are not required to comply with this section.,,,,,
1902,Chapter 19 Concrete,Coordination of Terminology,,,,,,
1902.1,Section 1902 Coordination of Terminology,General,Coordination of terminology used in ACI 318 and ASCE 7 shall be in accordance with Section 1902.1.1.,,,,,
1902.1.1,Section 1902 Coordination of Terminology,Design Displacement,"Design displacement shall be the Design Earthquake Displacement, δDE, defined in ASCE 7 Section 12.8.6.3. For diaphragms that can be idealized as rigid in accordance with ASCE 7 Section 12.3.1.2, δdi, displacement due to diaphragm deformation corresponding to the design earthquake, is permitted to be taken as zero.",,,,,
1903,Chapter 19 Concrete,Specifications for Tests and Materials,,,,,,
1903.1,Section 1903 Specifications for Tests and Materials,General,"Materials used to produce concrete, concrete itself and testing thereof shall comply with the applicable standards listed in ACI 318. Exception: The following standards as referenced in Chapter 35 shall be permitted to be used.ASTM C150ASTM C595ASTM C1157",,,,,
1903.2,Section 1903 Specifications for Tests and Materials,Glass Fiber-Reinforced Concrete,Glass fiber-reinforced concrete (GFRC) and the materials used in such concrete shall be in accordance with the PCI 128.,,,,,
1903.3,Section 1903 Specifications for Tests and Materials,Flat Wall Insulating Concrete Form (ICF) Systems,"Insulating concrete form material used for forming flat concrete walls shall conform to ASTM E2634. [OSHPD 1R, 2 &amp; 5] Not Permitted by OSHPD.",,,,,
1903.4,Section 1903 Specifications for Tests and Materials,Steel Fiber Reinforcement -,"[OSHPD 1R, 2 &amp; 5] Not permitted by OSHPD.",,,,,
1903.5,Section 1903 Specifications for Tests and Materials,Welding of Reinforcing Bars -,"[OSHPD 1R, 2 &amp; 5] Modify ACI 318 Section 26.6.4.1(b) by adding the following:Subject to prior approval of the enforcing agency, longitudinal holding wires conforming to ASTM A1064, of maximum wire size W5, that are machine resistance welded to stirrup/tie cage (or spiral assemblies) consisting of low alloy steel reinforcing conforming to ASTM A706 are permitted when performed under continuous competent control in a fabrication shop. Tack welding of primary reinforcing bars together or to stirrups/ties is not permitted. Holding wire weld locations shall not occur on any longitudinal or primary reinforcing nor on any portion of a reinforcing bar that is or will be bent in accordance with ACI 318 Section 25.3 for the extents specified in AWS D1.4 Section 4.2.6.Quality control tests shall be performed on shop welded specimens by the fabricator. Reinforcing steel specimens containing the holding wire shall be tested for yield and tensile strength at the frequency required by Section 1910.2. Test reports shall be available on request to the approved agency, design professional and enforcement agency.",,,,,
1904,Chapter 19 Concrete,Durability Requirements,,,,,,
1904.1,Section 1904 Durability Requirements,Structural Concrete,"Structural concrete shall conform to the durability requirements of ACI 318. Exception: For Group R-2 and R-3 occupancies not more than three stories above grade plane, the specified compressive strength, f´c, for concrete in basement walls, foundation walls, exterior walls and other vertical surfaces exposed to the weather shall be not less than 3,000 psi (20.7 MPa).",,,,,
1904.2,Section 1904 Durability Requirements,Nonstructural Concrete,"The registered design professional shall assign nonstructural concrete a freeze-thaw exposure class, as defined in ACI 318, based on the anticipated exposure of nonstructural concrete. Nonstructural concrete shall have a minimum specified compressive strength, f´c, of 2,500 psi (17.2 MPa) for Class F0; 3,000 psi (20.7 MPa) for Class F1; and 3,500 psi (24.1 MPa) for Classes F2 and F3. Nonstructural concrete shall be air entrained in accordance with ACI 318.",,,,,
1905,Chapter 19 Concrete,Seismic Requirements,,,,,,
1905.1,Section 1905 Seismic Requirements,General,"In addition to the provisions of ACI 318, structural concrete shall comply with the requirements of Section 1905.",,,,,
1905.2,Section 1905 Seismic Requirements,ACI 318 Section 2.3,"Modify existing definitions and add the following definitions to ACI 318 Section 2.3:CAST-IN-PLACE CONCRETE EQUIVALENT DIAPHRAGM. A cast-in-place noncomposite topping slab diaphragm, as defined in Section 18.12.5, or a diaphragm constructed with precast concrete components that uses closure strips between precast components with detailing that meets the requirements of ACI 318 for the Seismic Design Category of the structure.DETAILED PLAIN CONCRETE STRUCTURAL WALL. A wall complying with the requirements of Chapter 14, and Section 1905.5 of the California Building Code.ORDINARY PLAIN CONCRETE STRUCTURAL WALL. A wall complying with the requirements of Chapter 14, excluding 14.6.2.ORDINARY PRECAST STRUCTURAL WALL. A precast wall complying with the requirements of Chapters 1 through 13, 15, 16 and 19 through 26.ORDINARY REINFORCED CONCRETE STRUCTURAL WALL. A cast-in-place wall complying with the requirements of Chapters 1 through 13, 15, 16 and 19 through 26.PRECAST CONCRETE DIAPHRAGM. A diaphragm constructed with precast concrete components, with or without a cast-in-place topping, that includes the use of discrete connectors or joint reinforcement to transmit diaphragm forces.",,,,,
1905.3,Section 1905 Seismic Requirements,Intermediate Precast Structural Walls,Intermediate precast structural walls shall comply with Section 18.5 of ACI 318 and this section.,,,,,
1905.3.1,Section 1905 Seismic Requirements,Connections Designed to Yield,Connections that are designed to yield shall be capable of maintaining 80 percent of their design strength at the deformation induced by the design displacement or shall use Type 2 mechanical splices.,,,,,
1905.4,Section 1905 Seismic Requirements,Foundations Designed to Resist Earthquake Forces,Foundations resisting earthquake-induced forces or transferring earthquake-induced forces between a structure and the ground shall comply with the requirements of Section 18.13 of ACI 318 and other applicable provisions of ACI 318 unless modified by Chapter 18.,,,,,
1905.5,Section 1905 Seismic Requirements,Detailed Plain Concrete Structural Walls,"Detailed plain concrete structural walls are walls conforming to the requirements of ordinary plain concrete structural walls and Section 1905.5.1. [OSHPD 1R, 2 &amp; 5] Plain concrete shall not be permitted.",,,,,
1905.5.1,Section 1905 Seismic Requirements,Reinforcement,"Reinforcement shall be provided as follows: Vertical reinforcement of not less than 0.20 square inch (129 mm2) in cross-sectional area shall be provided continuously from support to support at each corner, at each side of each opening, and at the ends of walls. The continuous vertical bar required beside an opening is permitted to substitute for one of the two No. 5 bars required by Section 14.6.1 of ACI 318. Horizontal reinforcement of not less than 0.20 square inch (129 mm2) in cross-sectional area shall be provided: Continuously at structurally connected roof and floor levels and at the top of walls. At the bottom of load-bearing walls or in the top of foundations where doweled to the wall. At a maximum spacing of 120 inches (3048 mm). Reinforcement at the top and bottom of openings, where used in determining the maximum spacing specified in Item 2.3, shall be continuous in the wall.",,,,,
1905.6,Section 1905 Seismic Requirements,Structural Plain Concrete,"Structural plain concrete elements shall comply with this section in lieu of Section 14.1.4 of ACI 318. [OSHPD 1R, 2 &amp; 5] Plain concrete shall not be permitted.",,,,,
1905.6.1,Section 1905 Seismic Requirements,Seismic Design Categories A and B,"In structures assigned to Seismic Design Category A or B, detached one- and two-family dwellings three stories or less in height constructed with stud-bearing walls are permitted to have plain concrete footings without longitudinal reinforcement.",,,,,
1905.6.2,Section 1905 Seismic Requirements,"Seismic Design Categories C, D, E and F","Structures assigned to Seismic Design Category C, D, E or F shall not have elements of structural plain concrete, except as follows: Structural plain concrete basement, foundation or other walls below the base as defined in ASCE/SEI 7 are permitted in detached one- and two-family dwellings three stories or less in height constructed with stud-bearing walls. In dwellings assigned to Seismic Design Category D or E, the height of the wall shall not exceed 8 feet (2438 mm), the thickness shall be not less than 71/2 inches (190 mm), and the wall shall retain not more than 4 feet (1219 mm) of unbalanced fill. Walls shall have reinforcement in accordance with Section 14.6.1 of ACI 318. Isolated footings of plain concrete supporting pedestals or columns are permitted, provided that the projection of the footing beyond the face of the supported member does not exceed the footing thickness. Exception: In detached one- and two-family dwellings three stories or less in height, the projection of the footing beyond the face of the supported member is permitted to exceed the footing thickness. Plain concrete footings supporting walls are permitted, provided that the footings have not fewer than two continuous longitudinal reinforcing bars. Bars shall not be smaller than No. 4 and shall have a total area of not less than 0.002 times the gross cross-sectional area of the footing. For footings that exceed 8 inches (203 mm) in thickness, not fewer than one bar shall be provided at the top and bottom of the footing. Continuity of reinforcement shall be provided at corners and intersections. Exceptions: Where assigned to Seismic Design Category C, detached one- and two-family dwellings three stories or less in height constructed with stud-bearing walls are permitted to have plain concrete footings without longitudinal reinforcement. For foundation systems consisting of a plain concrete footing and a plain concrete stemwall, not fewer than one bar shall be provided at the top of the stemwall and at the bottom of the footing. Footings cast monolithically with a slab-on-ground shall have not fewer than one No. 4 bar at the top and bottom of the footing or one No. 5 bar or two No. 4 bars in the middle third of the footing depth.",,,,,
1905.7,Section 1905 Seismic Requirements,Design Requirements for Anchors,"For the design requirements for anchors, Sections 1905.7.1 and 1905.7.2 provide exceptions that are permitted to ACI 318.",,,,,
1905.7.1,Section 1905 Seismic Requirements,Anchors in Tension,The following exception is permitted to ACI 318 Section 17.10.5.2: Exception: Anchors designed to resist wall out-of-plane forces with design strengths equal to or greater than the force determined in accordance with ASCE/SEI 7 Equation 12.11-1 or 12.14-1 shall be deemed to satisfy Section 17.10.5.3(d) of ACI 318.,,,,,
