id,section,title,body,ifc_type,occupancy,design_phase,code_category,primary_responsibility
307.1,Section 307 High-Hazard Group H,High-Hazard Group H,"High-hazard Group H occupancy includes, among others, the use of a building or structure, or a portion thereof, that involves the manufacturing, processing, generation or storage of materials that constitute a physical or health hazard in quantities in excess of those allowed in control areas complying with Section 414, based on the maximum allowable quantity limits for control areas set forth in Tables 307.1(1) and 307.1(2). Hazardous occupancies are classified in Groups H-1, H-2, H-3, H-4 and H-5 and shall be in accordance with this section, the requirements of Section 415 and the California Fire Code. Hazardous materials stored or used on top of roofs or canopies shall be classified as rooftop storage or use and shall comply with the California Fire Code. [F] TABLE 307.1(1)MAXIMUM ALLOWABLE QUANTITY PER CONTROL AREA OF HAZARDOUS MATERIALS POSING A PHYSICAL HAZARDa, i, l, m MATERIAL CLASS GROUP WHEN THE MAXIMUM ALLOWABLE QUANTITY IS EXCEEDED STORAGEb USE—CLOSED SYSTEMSb USE—OPEN SYSTEMSb Solid pounds (cubic feet) Liquid gallons (pounds) Gas (cubic feet at NTP) Solid pounds (cubic feet) Liquid gallons (pounds) Gas (cubic feet at NTP) Solid pounds (cubic feet) Liquid gallons (pounds) Combustible dust NA H-2 See Note o NA NA See Note o NA NA See Note o NA Combustible fiber o Loose H-3 (100) NA NA (100) NA NA (20) NA Baled (1,000) (1,000) (200) Combustible liquidn II H-2 or H-3 NA 120d, e NA NA 120d NA NA 30d IIIA H-2 or H-3 330d, e 330d 80d IIIB NA 13,200e, f 13,200f 3,300f Cryogenic flammable NA H-2 NA 45d NA NA 45d NA NA 10d Cryogenic inert NA NA NA NA NL NA NA NL NA NA Cryogenic oxidizing NA H-3 NA 45d NA NA 45d NA NA 10d Explosives Division 1.1 H-1 1e, g (1)e, g NA 0.25g (0.25)g NA 0.25g (0.25)g Division 1.2 H-1 1e, g (1)e, g 0.25g (0.25)g 0.25g (0.25)g Division 1.3 H-1 or H-2 5e, g (5)e, g 1g (1)g 1g (1)g Division 1.4 H-3 50e, g (50)e, g 50g (50)g NA NA Division 1.4G H-3 125e, k NA NA NA NA NA Division 1.5 H-1 1e, g (1)e, g 0.25g (0.25)g 0.25g (0.25)g Division 1.6 H-1 1e, g NA NA NA NA NA Flammable gas Gaseous 1A (High BV)p H-2 NA NA 1,000d, e NA NA 1,000d, e NA NA Gaseous 1B (High BV)p Gaseous 1B (Low BV)p 162,500d, e 162,500d, e Liquefied 1A (High BV)p (150)d, e NA (150)d, e NA Liquefied 1B (High BV)p 1B (Low BV)p (10,000)d, e (10,000)d, e Flammable liquid n IA H-2 or H-3 NA 30d, e NA NA 30d NA NA 10d IB and IC 120d, e 120d 30d Flammable liquid, combination (IA, IB, IC)n NA H-2 or H-3 NA 120d, e, h NA NA 120d, h NA NA 30d, h Flammable solid NA H-3 125d, e NA NA 125d NA NA 25d NA Inert gas Gaseous NA NA NA NL NA NA NL NA NA Liquefied NA NA NA NL NA NA NL NA NA Organic peroxide UD H-1 1e, g (1)e, g NA 0.25g (0.25)g NA 0.25g (0.25)g I H-2 5d, e (5)d, e 1d (1)d 1d (1)d II H-3 50d, e (50)d, e 50d (50)d 10d (10)d III H-3 125d, e (125)d, e 125d (125)d 25d (25)d IV NA NL NL NL NL NL NL V NA NL NL NL NL NL NL Oxidizer 4 H-1 1g (1)e, g NA 0.25g (0.25)g NA 0.25g (0.25)g 3j H-2 or H-3 10d, e (10)d, e 2d (2)d 2d (2)d 2 H-3 250d, e (250)d, e 250d (250)d 50d (50)d 1 NA 4,000e, f (4,000)e, f 4,000f (4,000)f 1,000f (1,000)f Oxidizing gas Gaseous H-3 NA NA 1,500d, e NA NA 1,500d, e NA NA Liquefied (150)d, e NA (150)d, e NA Pyrophoric NA H-2 4e, g (4)e, g 50e, g 1g (1)g 10e, g 0 0 Unstable (reactive) 4 H-1 1e, g (1)e, g 10e, g 0.25g (0.25)g 2e, g 0.25g (0.25)g 3 H-1 or H-2 5d, e (5)d, e 50d, e 1d (1)d 10d, e 1d (1)d 2 H-3 50d, e (50)d, e 750d, e 50d (50)d 750d, e 10d (10)d 1 NA NL NL NL NL NL NL NL NL Water reactive 3 H-2 5d, e (5)d, e NA 5d (5)d NA 1d (1)d 2 H-3 50d, e (50)d, e 50d (50)d 10d (10)d 1 NA NL NL NL NL NL NL For SI: 1 cubic foot = 0.028 m3, 1 pound = 0.454 kg, 1 gallon = 3.785 L. NL = Not Limited; NA = Not Applicable; UD = Unclassified Detonable. For use of control areas, see Section 414.2. The aggregate quantity in use and storage shall not exceed the maximum allowable quantity for storage, including applicable increases. Reserved. [SFM] In other than Group L occupancies, maximum allowable quantities shall be increased 100 percent in buildings equipped throughout with an automatic sprinkler system in accordance with Section 903.3.1.1. Where Note e also applies, the increase for both notes shall be applied accumulatively. Maximum allowable quantities shall be increased 100 percent when stored in approved storage cabinets, day boxes, gas cabinets, gas rooms or exhausted enclosures or in listed safety cans in accordance with Section 5003.9.10 of the California Fire Code. Where Note d also applies, the increase for both notes shall be applied accumulatively. Quantities shall not be limited in a building equipped throughout with an automatic sprinkler system in accordance with Section 903.3.1.1. Allowed only in buildings equipped throughout with an automatic sprinkler system in accordance with Section 903.3.1.1. Containing not more than the maximum allowable quantity per control area of Class IA, IB or IC flammable liquids. Quantities in parentheses indicate quantity units in parentheses at the head of each column. A maximum quantity of 220 pounds of solid or 22 gallons of liquid Class 3 oxidizers is allowed when such materials are necessary for maintenance purposes, operation or sanitation of equipment when the storage containers and the manner of storage are approved. Net weight of the pyrotechnic composition of the fireworks. Where the net weight of the pyrotechnic composition of the fireworks is not known, 25 percent of the gross weight of the fireworks, including packaging, shall be used. For gallons of liquids, divide the amount in pounds by 10 in accordance with Section 5003.1.2 of the California Fire Code. For oxidizers, unstable (reactive) materials, and water-reactive materials stored or displayed in Group M occupancies or stored in Group S occupancies, see Section 414.2.5.1. For flammable and combustible liquid storage in Group M occupancy wholesale and retail sales uses, see Section 414.2.5.2. Where manufactured, generated or used in such a manner that the concentration and conditions create a fire or explosion hazard based on information prepared in accordance with Section 414.1.3. High Burning Velocity (High BV) Category 1B flammable gas has a burning velocity greater than 3.9 inches per second (10 cm/s). Low Burning Velocity (Low BV) Category 1B flammable gas has a burning velocity of 3.9 inches per second (10 cm/s) or less. [F] TABLE 307.1(2) MAXIMUM ALLOWABLE QUANTITY PER CONTROL AREA OF HAZARDOUS MATERIALS POSING A HEALTH HAZARDa, h, i MATERIAL STORAGEb USE—CLOSED SYSTEMSb USE—OPEN SYSTEMSb Solid poundsd, e, f Liquid gallons (pounds)d, e, f Gas cubic feet at NTP (pounds)d Solid poundsd Liquid gallons (pounds)d Gas cubic feet at NTP (pounds)d Solid poundsd Liquid gallons (pounds)d Corrosives 5,000 500 Gaseous 810e 5,000 500 Gaseous 810e 1,000 100 Liquefied (150) Liquefied (150) Highly Toxic 10 (10) Gaseous 20g 10 (10) Gaseous 20g 3 (3) Liquefied (4)g Liquefied (4)g Toxic 500 (500) Gaseous 810e 500 (500) Gaseous 810e 125 (125) Liquefied (150)e Liquefied (150)e For SI: 1 cubic foot = 0.028 m3, 1 pound = 0.454 kg, 1 gallon = 3.785 L. For use of control areas, see Section 414.2. The aggregate quantity in use and storage shall not exceed the maximum allowable quantity for storage, including applicable increases. Reserved. [SFM] In other than Group L occupancies, maximum allowable quantities shall be increased 100 percent in buildings equipped throughout with an approved automatic sprinkler system in accordance with Section 903.3.1.1. Where Note e also applies, the increase for both notes shall be applied accumulatively. Maximum allowable quantities shall be increased 100 percent where stored in approved storage cabinets, gas cabinets or exhausted enclosures as specified in the California Fire Code. Where Note d also applies, the increase for both notes shall be applied accumulatively. For corrosive, highly toxic and toxic materials stored or displayed in Group M occupancies or stored in Group S occupancies, see Section 414.2.5.1. Allowed only where stored in approved exhausted gas cabinets or exhausted enclosures as specified in the California Fire Code. Quantities in parentheses indicate quantity units in parentheses at the head of each column. For gallons of liquids, divide the amount in pounds by 10 in accordance with Section 5003.1.2 of the California Fire Code.",Wall|Slab|Roof,High Hazard (H),sd|dd|cd,occupancy_classification,architect
307.1.1,Section 307 High-Hazard Group H,Occupancy Exemptions,"Storage, use and handling of hazardous materials in accordance with Table 307.1.1 shall not be counted as contributing to Maximum Allowable Quantities and shall not cause classification of an occupancy to be Group H. Such storage, use and handling shall comply with applicable provisions of the California Fire Code. TABLE 307.1.1 HAZARDOUS MATERIALS EXEMPTIONSa MATERIAL CLASSIFICATION OCCUPANCY OR APPLICATION EXEMPTION Combustible fiber Baled cotton Densely packed baled cotton shall not be classified as combustible fiber, provided that the bales comply with the packing requirements of ISO 8115. Corrosive Building materials The quantity of commonly used building materials that are classified as corrosive materials is not limited. Personal and household products The quantity of personal and household products that are classified as corrosive materials is not limited in retail displays, provided that the products are in original packaging. Retail and wholesale sales occupancies The quantity of medicines, foodstuffs or consumer products, and cosmetics containing not more than 50 percent by volume of water-miscible liquids, with the remainder of the solutions not being flammable, is not limited. To qualify for this allowance, such materials shall be packaged in individual containers not exceeding 1.3 gallons. Explosives Groups B, F, M and S Storage of special industrial explosive devices is not limited. Groups M and R-3 Storage of black powder, smokeless propellant and small arms primers is not limited. Flammable and combustible liquids and gases Aerosols Buildings and structures occupied for the storage of aerosol products, aerosol cooking spray products, or plastic aerosol 3 products shall be classified as Group S-1. Alcoholic beverages The quantity of alcoholic beverages in liquor stores and distributors without bulk storage is not limited. The quantity of alcoholic beverages in distilling or brewing of beverages is not limited. The storage quantity of beer, distilled spirits and wines in barrels and casks is not limited. The quantity of alcoholic beverages in retail and wholesale sales occupancies is not limited. To qualify for this allowance, beverages shall be packaged in individual containers not exceeding 1.3 gallons. Cleaning establishments with combustible liquid solvents The quantity of combustible liquid solvents used in closed systems and having a flash point at or above 140°F is not limited. To qualify for this allowance, equipment shall be listed by an approved testing agency and the occupancy shall be separated from all other areas of the building by 1-hour fire barriers constructed in accordance with Section 707 or 1-hour horizontal assemblies constructed in accordance with Section 711, or both The quantity of combustible liquid solvents having a flash point at or above 200°F is not limited. Closed piping systems The quantity of flammable and combustible liquids and gases utilized for the operation of machinery or equipment is not limited. Fuel The quantity of liquid or gaseous fuel in fuel tanks on vehicles or motorized equipment is not limited. The quantity of gaseous fuels in piping systems and fixed appliances regulated by the International Fuel Gas Code is not limited. The quantity of liquid fuels in piping systems and fixed appliances regulated bythe California Mechanical Code is not limited. Flammable finishing operations using flammable and combustible liquids Buildings and structures occupied for the application of flammable finishes shall comply with Section 416. Fuel oil The quantity of fuel oil storage complying with Section 605.4.2 of the California Fire Code is not limited. Hand sanitizer The quantity of alcohol-based hand rubs (ABHR) classified as Class I or II liquids in dispensers installed in accordance with Sections 5705.5 and 5705.5.1 of the California Fire Code is not limited. The location of the ABHR dispensers shall be provided in the construction documents. Retail and wholesale sales occupancies with flammable and combustible liquids The quantity of medicines, foodstuffs or consumer products, and cosmetics containing not more than 50 percent by volume of water-miscible liquids, with the remainder of the solutions not being flammable, is not limited. To qualify for this allowance, such materials shall be packaged in individual containers not exceeding 1.3 gallons. Highly toxic and toxic materials Retail and wholesale sales occupancies The quantity of medicines, foodstuffs or consumer products, and cosmetics containing not more than 50 percent by volume of water-miscible liquids, with the remainder of the solutions not being flammable, is not limited. To qualify for this allowance, such materials shall be packaged in individual containers not exceeding 1.3 gallons. Any Agricultural materials The quantity of agricultural materials stored or utilized for agricultural purposes on the premises is not limited. Energy storage The quantity of hazardous materials in stationary storage battery systems is not limited. The quantity of hazardous materials in stationary fuel cell power systems is not limited. The quantity of hazardous materials in capacitor energy storage systems is not limited. Refrigeration Systems The quantity of refrigerants in refrigeration systems is not limited. For SI: 1 gallon = 3.785L, °C = (°F - 32)/1.8.Exempted materials and conditions listed in this table are required to comply with applicable provisions of the California Fire Code.",BuildingElementProxy|Wall|Slab,Business (B)|Factory and Industrial (F)|Mercantile (M)|Storage (S)|Residential (R),sd|dd|cd,hazardous_materials,architect
307.2,Section 307 High-Hazard Group H,Hazardous Materials,"Hazardous materials in any quantity shall conform to the requirements of this code, including Section 414, and the California Fire Code.",BuildingElementProxy,High Hazard (H),sd|dd|cd,hazardous_materials,architect
307.3,Section 307 High-Hazard Group H,High-Hazard Group H-1,"Buildings and structures containing materials that pose a detonation hazard shall be classified as Group H-1. Such materials shall include, but not be limited to, the following:Detonable pyrophoric materialsExplosives:Division 1.1Division 1.2Division 1.3Division 1.4Division 1.5Division 1.6Organic peroxides, unclassified detonableOxidizers, Class 4Unstable (reactive) materials, Class 3 detonable and Class 4",Wall|Door|Slab,High Hazard (H),concept|sd|dd|cd,occupancy_classification,architect
307.3.1,Section 307 High-Hazard Group H,Occupancies Containing Explosives Not Classified as H-1,"The following occupancies containing explosive materials shall be classified as follows:Division 1.3 explosive materials that are used and maintained in a form where either confinement or configuration will not elevate the hazard from a mass fire to mass explosion hazard shall be allowed in Group H-2 occupancies.Division 1.4 explosive materials shall be allowed in Group H-3 occupancies.Articles, including articles packaged for shipment, that are not regulated as a Division 1.4 explosive under Bureau of Alcohol, Tobacco, Firearms and Explosives regulations, or unpackaged articles used in process operations that do not propagate a detonation or deflagration between articles shall be allowed in Group H-3 occupancies.",Wall|Door|Slab,High Hazard (H),sd|dd|cd,occupancy_classification,architect
307.4,Section 307 High-Hazard Group H,High-Hazard Group H-2,"Buildings and structures containing materials that pose a deflagration hazard or a hazard from accelerated burning shall be classified as Group H-2. Such materials shall include, but not be limited to, the following:Class I, II or IIIA flammable or combustible liquids that are used or stored in normally open containers or systems, or in closed containers or systems pressurized at more than 15 pounds per square inch gauge (103.4 kPa).Combustible dusts where manufactured, generated or used in such a manner that the concentration and conditions create a fire or explosion hazard based on information prepared in accordance with Section 414.1.3.Cryogenic fluids, flammable.Category 1A flammable gases.Category 1B flammable gases having a burning velocity greater than 3.9 inches per second (10 cm/s).Organic peroxides, Class I.Oxidizers, Class 3, that are used or stored in normally open containers or systems, or in closed containers or systems pressurized at more than 15 pounds per square inch gauge (103 kPa).Pyrophoric liquids, solids and gases, nondetonable.Unstable (reactive) materials, Class 3, nondetonable.Water-reactive materials, Class 3.",Wall|Slab|Door,High Hazard (H),concept|sd|dd|cd,occupancy_classification,architect
307.5,Section 307 High-Hazard Group H,High-Hazard Group H-3,"Buildings and structures containing materials that readily support combustion or that pose a physical hazard shall be classified as Group H-3. Such materials shall include, but not be limited to, the following:Class I, II or IIIA flammable or combustible liquids that are used or stored in normally closed containers or systems pressurized at 15 pounds per square inch gauge (103.4 kPa) or lessCombustible fibers, other than densely packed baled cotton, where manufactured, generated or used in such a manner that the concentration and conditions create a fire or explosion hazard based on information prepared in accordance with Section 414.1.3Consumer fireworks, 1.4G (Class C, Common)Cryogenic fluids, oxidizingCategory 1B flammable gases having a burning velocity of 3.9 inches per second (10 cm/s) or less.Flammable solidsOrganic peroxides, Class II and IIIOxidizers, Class 2Oxidizers, Class 3, that are used or stored in normally closed containers or systems pressurized at 15 pounds per square inch gauge (103 kPa) or lessOxidizing gasesUnstable (reactive) materials, Class 2Water-reactive materials, Class 2",Wall|Door|Slab,High Hazard (H),sd|dd|cd,occupancy_classification,architect
307.6,Section 307 High-Hazard Group H,High-Hazard Group H-4,"Buildings and structures containing materials that are health hazards shall be classified as Group H-4. Such materials shall include, but not be limited to, the following:CorrosivesHighly toxic materialsToxic materials",Wall|Door|Slab,High Hazard (H),concept|sd|dd|cd,occupancy_classification,architect
307.7,Section 307 High-Hazard Group H,High-Hazard Group H-5,Semiconductor fabrication facilities and comparable research and development areas in which hazardous production materials (HPM) are used and the aggregate quantity of materials is in excess of those specified in Tables 307.1(1) and 307.1(2) shall be classified as Group H-5. Such facilities and areas shall be designed and constructed in accordance with Section 415.11.,Wall|Door|Slab,High Hazard (H),concept|sd|dd|cd,occupancy_classification,architect
307.8,Section 307 High-Hazard Group H,Multiple Hazards,"Buildings and structures containing a material or materials representing hazards that are classified in one or more of Groups H-1, H-2, H-3 and H-4 shall conform to the code requirements for each of the occupancies so classified.",Wall|Door|Slab,High Hazard (H),sd|dd|cd,hazardous_materials,architect
308,Chapter 3 Occupancy Classification and Use,Institutional Group I,,,,,none,none
308.1,Section 308 Institutional Group I,Institutional Group I,"Institutional Group I occupancy includes, among others, the use of a building or structure, or a portion thereof, in which care or supervision is provided to persons who are or are incapable of self-preservation without physical assistance or in which persons are detained for penal or correctional purposes or in which the liberty of the occupants is restricted. Institutional occupancies shall be classified as Group I-2, I-3 or I-4. Restraint shall not be permitted in any building except in Group I-2 occupancies constructed for such use in accordance with Section 407.1.1 and Group I-3 occupancies constructed for such use in accordance with Section 408.1.2.Where occupancies house both ambulatory and nonambulatory persons, the more restrictive requirements shall apply.",Wall|Door|Slab,Institutional (I),concept|sd|dd|cd,occupancy_classification,architect
308.2,Section 308 Institutional Group I,Institutional Group I-1,Not used. (See Group R-2.1 Section 310.1.),Wall|Door|Window,Institutional (I),sd|dd|cd,occupancy_classification,architect
308.3,Section 308 Institutional Group I,Institutional Group I-2,"Institutional Group I-2 occupancy shall include buildings and structures used for medical care on a 24-hour basis for more than five persons who are incapable of self-preservation or classified as nonambulatory or bedridden. This group shall include, but not be limited to, the following:Foster care facilitiesDetoxification facilitiesHospitalsNursing homesPsychiatric hospitals",Wall|Door|Slab,Institutional (I),concept|sd|dd|cd,occupancy_classification,architect
308.3.1,Section 308 Institutional Group I,Five or Fewer Persons Receiving Medical Care,A facility with five or fewer persons receiving medical care shall be classified as Group R-3.1 or shall comply with the California Residential Code provided an automatic sprinkler system is installed in accordance with Section 903.3.1.3 of this code or Section R309 of the California Residential Code.,,,,,
308.4,Section 308 Institutional Group I,Institutional Group I-3,"Institutional Group I-3 occupancy shall include buildings or portions of buildings and structures that are inhabited by more than five persons who are under restraint or security. A Group I-3 facility is occupied by persons who are generally incapable of self-preservation due to security measures not under the occupants' control which includes persons restrained. This group shall include, but not be limited to, the following:Correctional centersCorrectional hospitalsCorrectional nursing facilitiesCorrectional mental health facilitiesCorrectional treatment centersCourthouse holding facilityDetention centersDetention treatment roomJailsJuvenile hallsPrerelease centersPrisonsReformatoriesSecure interview roomsTemporary holding facilityBuildings of Group I-3 shall be classified as one of the occupancy conditions specified in Sections 308.4.1 through 308.5.8 and shall comply with Section 408.",Wall|Door|Window|Slab,Institutional (I),concept|sd|dd|cd,occupancy_classification,architect
308.4.1,Section 308 Institutional Group I,Condition 1,"This occupancy condition shall include buildings in which free movement is allowed from sleeping areas, and other spaces where access or occupancy is permitted, to the exterior via means of egress without restraint. A Condition 1 facility is permitted to be constructed as Group R.",Door|Wall|Stair|Ramp|Slab,Residential (R),sd|dd|cd,occupancy_classification,architect
308.4.2,Section 308 Institutional Group I,Condition 2,This occupancy condition shall include buildings in which free movement is allowed from sleeping areas and any other occupied smoke compartment to one or more other smoke compartments. Egress to the exterior is impeded by locked exits.,Door|Wall,Institutional (I),sd|dd|cd,means_of_egress,architect
308.4.3,Section 308 Institutional Group I,Condition 3,"This occupancy condition shall include buildings in which free movement is allowed within individual smoke compartments, such as within a residential unit composed of individual sleeping units and group activity spaces, where egress is impeded by remote-controlled release of means of egress from such a smoke compartment to another smoke compartment.",Wall|Door|Slab,Institutional (I)|Residential (R),sd|dd|cd,occupancy_classification,architect
308.4.4,Section 308 Institutional Group I,Condition 4,"This occupancy condition shall include buildings in which free movement is restricted from an occupied space. Remote-controlled release is provided to permit movement from sleeping units, activity spaces and other occupied areas within the smoke compartment to other smoke compartments.",Door|Wall|BuildingElementProxy,Institutional (I),sd|dd|cd,means_of_egress,architect
308.4.5,Section 308 Institutional Group I,Condition 5,"This occupancy condition shall include buildings in which free movement is restricted from an occupied space. Staff-controlled manual release is provided to permit movement from sleeping units, activity spaces and other occupied areas within the smoke compartment to other smoke compartments.",Door|Wall,Institutional (I),sd|dd|cd,means_of_egress,architect
308.4.6,Section 308 Institutional Group I,Condition 6,This occupancy condition shall include buildings containing only one temporary holding facility with six or fewer persons under restraint or security where the building is protected throughout with a monitored automatic sprinkler system installed in accordance with Section 903.3.1.1 and where the temporary holding facility is protected throughout with an automatic fire alarm system with notification appliances. A Condition 6 building shall be permitted to be classified as a Group B occupancy.,,,,,
