id,section,title,body,ifc_type,occupancy,design_phase,code_category,primary_responsibility
3,,Occupancy Classification and Use,"CALIFORNIA BUILDING CODE — MATRIX ADOPTION TABLE CHAPTER 3 — OCCUPANCY CLASSIFICATION AND USE (Matrix Adoption Tables are nonregulatory, intended only as an aid to the code user. See Chapter 1 for state agency authority and building applications.) Adopting agency BSC BSC -CG SFM HCD DSA OSHPD BSCC DPH AGR DWR CEC CA SL SLC 1 2 1/AC AC SS SS/CC 1 1R 2 3 4 5 6 Adopt entire chapter X X X X X X X X X X Adopt entire chapter as amended (amended sections listed below) X X X Adopt only those sections that are listed below X Chapter / Section 302.1 X X X 302.1.3 X 303.1 X 303.2 X 303.7 X 303.8 X 304.1 X 305.1 X 305.2 X 305.2.1 X 306.2 X Table 307.1(1) X Table 307.1(2) X 307.1.1 X 307.4 X 308.1 X 308.3 X † † 308.4 X 308.4.6 X 308.4.7 X 308.4.8 X 308.4.9 X 308.5 X 308.5.2 X 308.5.3 X 308.5.4 X 310.1 X 310.2 X X 310.3 X X 310.3.1 X 310.3.2 X 310.4 X X 310.4.1 X 310.4.2 X X X 310.5 X 310.6 X 313 X 314 X The state agency does not adopt sections identified with the following symbol: † The Office of the State Fire Marshal's adoption of this chapter or individual sections is applicable to structures regulated by other state agencies pursuant to Section 1.11. User notes: About this chapter: Chapter 3 provides the criteria by which buildings and structures are classified into use groups and occupancies. Through the balance of the code, occupancy classification is fundamental in the setting of features of construction; occupant safety requirements, especially building limitations; means of egress; fire protection systems; and interior finishes. ICC code development note: Code change proposals to sections preceded by the designation [F] will be considered by the IFC code development committee meeting during the 2024 (Group A) Code Development Cycle. All other code change proposals will be considered by a code development committee meeting during the 2025 (Group B) Code Development Cycle.",Wall|Slab|Door,Assembly (A)|Business (B)|Educational (E)|Residential (R)|Mercantile (M),concept|sd|dd,occupancy_classification,architect
301,Chapter 3 Occupancy Classification and Use,Scope,,,,,none,none
301.1,Section 301 Scope,General,The provisions of this chapter shall control the classification of all buildings and structures as to occupancy and use. Different classifications of occupancy and use represent varying levels of hazard and risk to building occupants and adjacent properties.,BuildingElementProxy,Assembly (A)|Business (B)|Educational (E)|Factory and Industrial (F)|Residential (R),sd|dd|cd,occupancy_classification,architect
302,Chapter 3 Occupancy Classification and Use,Occupancy Classification and Use Designation,,,,,none,none
302.1,Section 302 Occupancy Classification and Use Designation,Occupancy Classification,"Occupancy classification is the formal designation of the primary purpose of the building, structure or portion thereof. Structures shall be classified into one or more of the occupancy groups specified in this section based on the nature of the hazards and risks to building occupants generally associated with the intended purpose of the building or structure. An area, room or space that is intended to be occupied at different times for different purposes shall comply with all applicable requirements associated with such potential multipurpose. Structures containing multiple occupancy groups shall comply with Section 508. Where a structure is proposed for a purpose that is not specified in this section, such structure shall be classified in the occupancy it most nearly resembles based on the fire safety and relative hazard. Occupiable roofs shall be classified in the group that the occupancy most nearly resembles, according to the fire safety and relative hazard, and shall comply with Section 503.1.4.Assembly (see Section 303): Groups A-1, A-2, A-3, A-4 and A-5.Business (see Section 304): Group B.[SFM] Organized Camps (see Section 450): Group C.Educational (see Section 305): Group E.Factory and Industrial (see Section 306): Groups F-1 and F-2.High Hazard (see Section 307): Groups H-1, H-2, H-3, H-4 and H-5.Institutional (see Section 308): Groups I-2, I-3 and I-4.[SFM] Laboratory (see Section 202): Group B, unless classified as Group L (see Section 453) or Group H (see Section 307).[SFM] Laboratory Suites (see Section 453): Group L.Mercantile (see Section 309): Group M.Residential (see Section 310): Groups R-1, R-2, R-2.1, R-3, R-3.1 and R-4.Storage (see Section 311): Groups S-1 and S-2.Utility and Miscellaneous (see Section 312): Group U.[SFM] Existing buildings housing existing protective social care homes or facilities established prior to 1972 (see California Fire Code Chapter 11 and California Existing Building Code).",BuildingElementProxy,Assembly (A)|Business (B)|Educational (E)|Factory and Industrial (F)|High Hazard (H),sd|dd|cd,occupancy_classification,architect
302.1.3,Section 302 Occupancy Classification and Use Designation,"Pharmacies; Veterinary Facilities; Barbering, Cosmetology or Electrolysis Establishments; And Acupuncture Offices",See Chapter 12.,,,,,
302.2,Section 302 Occupancy Classification and Use Designation,Use Designation,"Occupancy groups contain subordinate uses having similar hazards and risks to building occupants. Uses include, but are not limited to, those functional designations specified within the occupancy group descriptions in Section 302.1. Certain uses require specific limitations and controls in accordance with the provisions of Chapter 4 and elsewhere in this code.",BuildingElementProxy,Assembly (A)|Business (B)|Educational (E)|Factory and Industrial (F)|High Hazard (H),concept|sd|dd,occupancy_classification,architect
303,Chapter 3 Occupancy Classification and Use,Assembly Group A,,,,,none,none
303.1,Section 303 Assembly Group A,Assembly Group A,"Assembly Group A occupancy includes, among others, the use of a building or structure, or a portion thereof, for the gathering of persons for purposes such as civic, social or religious functions; recreation, food or drink consumption or awaiting transportation; motion picture and television production studio sound stages, approved production facilities and production locations; or for the showing of motion pictures when an admission fee is charged and when such building or structure is open to the public and has a capacity of 10 or more persons.",Wall|Door|Stair|Slab,Assembly (A),concept|sd|dd|cd,occupancy_classification,architect
303.1.1,Section 303 Assembly Group A,Small Buildings and Tenant Spaces,A building or tenant space used for assembly purposes with an occupant load of less than 50 persons shall be classified as a Group B occupancy.,Wall|Door|Slab,Assembly (A)|Business (B),sd|dd|cd,occupancy_classification,architect
303.1.2,Section 303 Assembly Group A,Small Assembly Spaces,The following rooms and spaces shall not be classified as Assembly occupancies:A room or space used for assembly purposes with an occupant load of less than 50 persons and accessory to another occupancy shall be classified as a Group B occupancy or as part of that occupancy.A room or space used for assembly purposes that is less than 750 square feet (70 m2) in area and accessory to another occupancy shall be classified as a Group B occupancy or as part of that occupancy.,Wall|Door|Slab,Assembly (A)|Business (B),sd|dd|cd,occupancy_classification,architect
303.1.3,Section 303 Assembly Group A,Associated With Group E Occupancies,A room or space used for assembly purposes that is associated with a Group E occupancy is not considered a separate occupancy.,Wall|Door|Slab,Educational (E)|Assembly (A),concept|sd|dd|cd,occupancy_classification,architect
303.1.4,Section 303 Assembly Group A,Accessory to Places of Religious Worship,Accessory religious educational rooms and religious auditoriums with occupant loads of less than 100 per room or space are not considered separate occupancies.,Wall|Door|Slab,Assembly (A)|Educational (E),sd|dd|cd,occupancy_classification,architect
303.1.5,Section 303 Assembly Group A,Special Amusement Areas,Special amusement areas shall comply with Section 411.,Wall|Door|Window|Slab,Assembly (A),sd|dd|cd,occupancy_classification,architect
303.2,Section 303 Assembly Group A,Assembly Group A-1,"Group A-1 occupancy includes assembly uses, usually with fixed seating, intended for the production and viewing of the performing arts or motion pictures, including but not limited to:Motion picture and television production studio sound stages, approved production facilities and production locations. (with live audiences).Motion picture theatersSymphony and concert hallsTelevision and radio studios admitting an audienceTheaters",Wall|Door|Slab|Stair|Roof,Assembly (A),concept|sd|dd|cd,occupancy_classification,architect
303.3,Section 303 Assembly Group A,Assembly Group A-2,"Group A-2 occupancy includes assembly uses intended for food and/or drink consumption, including but not limited to:Banquet hallsCasinos (gaming areas)NightclubsRestaurants, cafeterias and similar dining facilities (including associated commercial kitchens)Taverns and bars",Wall|Door|Slab|Window|BuildingElementProxy,Assembly (A),concept|sd|dd|cd,occupancy_classification,architect
303.4,Section 303 Assembly Group A,Assembly Group A-3,"Group A-3 occupancy includes assembly uses intended for worship, recreation or amusement and other assembly uses not classified elsewhere in Group A, including but not limited to:Amusement arcadesArt galleriesBowling alleysCommunity hallsCourtroomsDance halls (not including food or drink consumption)Exhibition hallsFuneral parlorsGreenhouses for the conservation and exhibition of plants that provide public accessGymnasiums (without spectator seating)Indoor swimming pools (without spectator seating)Indoor tennis courts (without spectator seating)Lecture hallsLibrariesMuseumsPlaces of religious worshipPool and billiard parlorsWaiting areas in transportation terminals",Wall|Slab|Door|Window,Assembly (A),concept|sd|dd|cd,occupancy_classification,architect
303.5,Section 303 Assembly Group A,Assembly Group A-4,"Group A-4 occupancy includes assembly uses intended for viewing of indoor sporting events and activities with spectator seating, including but not limited to: ArenasSkating rinksSwimming poolsTennis courts",Slab|Railing|Stair|Door|Wall,Assembly (A),concept|sd|dd|cd,occupancy_classification,architect
303.6,Section 303 Assembly Group A,Assembly Group A-5,"Group A-5 occupancy includes assembly uses intended for participation in or viewing outdoor activities, including but not limited to:Amusement park structuresBleachersGrandstandsStadiums",Slab|Stair|Railing|Roof|Beam,Assembly (A),concept|sd|dd|cd,occupancy_classification,architect
303.7,Section 303 Assembly Group A,Fixed Guideway Transit Systems,[SFM] Fixed guideway transit system buildings shall conform to the requirements of this code for their occupancy classification in addition to the provisions set forth in Section 443.,,,,,
303.8,Section 303 Assembly Group A,Subterranean Spaces for Winery Facilities in Natural or Manmade Caves,"[SFM] For fire and life safety requirements, see Section 446.",,,,,
304,Chapter 3 Occupancy Classification and Use,Business Group B,,,,,none,none
304.1,Section 304 Business Group B,Business Group B,"Business Group B occupancy includes, among others, the use of a building or structure, or a portion thereof, for office, professional or service-type transactions, including storage of records and accounts. Business occupancies shall include, but not be limited to, the following:Airport traffic control towersAmbulatory care facilitiesAnimal hospitals, kennels and poundsBanksBarber and beauty shopsCar washCivic administrationClinic, outpatient Dry cleaning and laundries: pick-up and delivery stations and self-serviceEducational occupancies for students above the 12th grade including higher education laboratoriesElectronic data entryFood processing establishments and commercial kitchens not associated with restaurants, cafeterias and similar dining facilities not more than 2,500 square feet (232 m2) in areaLaboratories: testing and research and [SFM] instructionLithium-ion or lithium metal battery testing, research and developmentMotor vehicle showroomsPost officesPrint shopsProfessional services (architects, attorneys, dentists, physicians, engineers, etc.)Radio and television stationsTelephone exchangesTraining and skill development not in a school or academic program (this shall include, but not be limited to, tutoring centers, martial arts studios, gymnastics and similar uses regardless of the ages served, and where not classified as a Group A occupancy)",Wall|Slab|Door,Business (B),concept|sd|dd|cd,occupancy_classification,architect
304.2,Section 304 Business Group B,Airport Traffic Control Towers,Airport traffic control towers shall comply with Section 412.2.,BuildingElementProxy|Slab|Stair|Wall|Window,Business (B),sd|dd|cd,occupancy_classification,architect
304.3,Section 304 Business Group B,Ambulatory Care Facilities,Ambulatory care facilities shall comply with Section 422.,BuildingElementProxy,Business (B),concept|sd|dd|cd,occupancy_classification,architect
305,Chapter 3 Occupancy Classification and Use,Educational Group E,,,,,none,none
305.1,Section 305 Educational Group E,Educational Group E,"Educational Group E occupancy includes, among others, the use of a building or structure, or a portion thereof, more than six persons at any one time for educational purposes through the 12th grade. Exception: [SFM] A residence used as a home school for the children who normally reside at the residence. Such residences shall remain classified as Group R-2, or Group R-3 occupancies.",Wall|Door|Slab,Educational (E),concept|sd|dd|cd,occupancy_classification,architect
305.1.1,Section 305 Educational Group E,Accessory to Places of Religious Worship,"Religious educational rooms and religious auditoriums, which are accessory to places of religious worship in accordance with Section 303.1.4 and have occupant loads of less than 100 per room or space, shall be classified as Group A-3 occupancies.",Wall|Door|Slab,Assembly (A)|Educational (E),sd|dd|cd,occupancy_classification,architect
305.2,Section 305 Educational Group E,"Group E, Child-Care Facilities","This group includes buildings and structures or portions thereof occupied by more than six children 36 months of age and older who receive educational, supervision or personal care services for fewer than 24 hours per day. Exception: [SFM] A child-care facility not otherwise classified a Group R-3 occupancy, where occupants are not capable of responding to an emergency situation without physical assistance from the staff shall be classified as Group I-4. Infants and toddlers are allowed in a Group E child care when the facility complies with California Building Code Section 305.2.1, 305.2.2, 305.2.3 or 308.5.1.",,,,,
305.2.1,Section 305 Educational Group E,Within Places of Religious Worship,Rooms and spaces within places of religious worship providing such child care during religious functions shall be classified as part of the primary occupancy where not licensed for child-care purposes by the Department of Social Services.,Wall|Door|Slab,Assembly (A)|Educational (E),concept|sd|dd|cd,occupancy_classification,architect
305.2.2,Section 305 Educational Group E,Five or Fewer Children,A facility having five or fewer children receiving such day care shall be classified as part of the primary occupancy.,BuildingElementProxy,Educational (E)|Residential (R),concept|sd|dd|cd,occupancy_classification,architect
305.2.3,Section 305 Educational Group E,Five or Fewer Children in a Dwelling Unit,A facility such as the above within a dwelling unit and having five or fewer children receiving such day care shall be classified as a Group R-3 occupancy or shall comply with the California Residential Code.,Wall|Door|Window,Residential (R),sd|dd|cd,occupancy_classification,architect
305.3,Section 305 Educational Group E,Storm Shelters in Group E Occupancies,Storm shelters shall be provided for Group E occupancies where required by Section 423.5.,Wall|Slab|Door|Roof,Educational (E),sd|dd|cd,special_construction,architect
306,Chapter 3 Occupancy Classification and Use,Factory Group F,,,,,none,none
306.1,Section 306 Factory Group F,Factory Industrial Group F,"Factory Industrial Group F occupancy includes, among others, the use of a building or structure, or a portion thereof, for assembling, disassembling, fabricating, finishing, manufacturing, packaging, repair or processing operations that are not classified as a Group H hazardous or Group S storage occupancy.",BuildingElementProxy|Slab|Wall,Factory and Industrial (F),concept|sd|dd|cd,occupancy_classification,architect
306.2,Section 306 Factory Group F,"Moderate-Hazard Factory Industrial, Group F-1","Factory industrial uses that are not classified as Factory Industrial F-2 Low Hazard shall be classified as F-1 Moderate Hazard and shall include, but not be limited to, the following:Aircraft (manufacturing, not to include repair)AppliancesAthletic equipmentAutomobiles and other motor vehiclesBakeriesBeverages: over 20-percent alcohol contentBicyclesBoatsBrooms or brushesBusiness machinesCameras and photo equipmentCanvas or similar fabricCarpets and rugs (includes cleaning)ClothingConstruction and agricultural machineryDisinfectantsDry cleaning and dyeingElectric generation plantsElectronicsEnergy storage systems (ESS) in dedicated use buildingsEnergy storage systems (ESS) and equipment containing lithium-ion or lithium metal batteriesEngines (including rebuilding)Food processing establishments and commercial kitchens not associated with restaurants, cafeterias and similar dining facilities more than 2,500 square feet (232 m2) in areaFurnitureHemp productsJute productsLaundriesLeather productsLithium-ion batteriesMachineryMetalsMillwork (sash and door)[SFM] Motion picture and television production studio Sound Stages, Approved Production Facilities and production locations (without live audiences)Motion pictures and television filming (without spectators)Musical instrumentsOptical goodsPaper mills or productsPhotographic filmPlastic productsPrinting or publishingRecreational vehiclesRefuse incinerationShoesSoaps and detergentsTextilesTobaccoTrailersUpholsteringVehicles powered by lithium-ion or lithium metal batteriesWater/sewer treatment facilitiesWood; distillationWoodworking (cabinet)",Wall|Slab|Roof,Factory and Industrial (F),concept|sd|dd,occupancy_classification,architect
306.2.1,Section 306 Factory Group F,Aircraft Manufacturing Facilities,Aircraft manufacturing facilities shall comply with Section 412.6.,BuildingElementProxy|Slab|Wall,Factory and Industrial (F),sd|dd|cd,occupancy_classification,architect
306.3,Section 306 Factory Group F,"Low-Hazard Factory Industrial, Group F-2","Factory industrial uses that involve the fabrication or manufacturing of noncombustible materials that during finishing, packing or processing do not involve a significant fire hazard shall be classified as Group F-2 occupancies and shall include, but not be limited to, the following:Beverages: up to and including 20-percent alcohol contentBrick and masonryCeramic productsFoundriesGlass productsGypsumIceMetal products (fabrication and assembly)",Wall|Slab|Column|Roof|Door,Factory and Industrial (F),concept|sd|dd|cd,occupancy_classification,architect
307,Chapter 3 Occupancy Classification and Use,High-Hazard Group H,,,,,none,none
