id,section,reference,title,depth,body
31,Chapter 31 Vents,P3114.4,P3114.4 Location,2,Individual and branch air admittance valves shall be located not less than 4 inches (102 mm) above the horizontal branch drain or fixture drain being vented. Stack-type air admittance valves shall be located not less than 6 inches (152 mm) above the flood level rim of the highest fixture being vented. The air admittance valve shall be located within the maximum developed length permitted for the vent. The air admittance valve shall be installed not less than 6 inches (152 mm) above insulation materials where installed in attics.
31,Chapter 31 Vents,P3114.5,P3114.5 Access and Ventilation,2,Access shall be provided to air admittance valves. Such valves shall be installed in a location that allows air to enter the valve.
31,Chapter 31 Vents,P3114.6,P3114.6 Size,2,The air admittance valve shall be rated for the size of the vent to which the valve is connected.
31,Chapter 31 Vents,P3114.7,P3114.7 Vent Required,2,"Within each plumbing system, not less than one stack vent or a vent stack shall extend outdoors to the open air."
31,Chapter 31 Vents,P3114.8,P3114.8 Prohibited Installations,2,Air admittance valves shall not be used to vent sumps or tanks except where the vent system for the sump or tank has been designed by an engineer. Air admittance valves shall not be installed on outdoor vent terminals for the sole purpose of reducing clearances to gravity or mechanical air intakes.
