id,section,reference,title,depth,body
30,Chapter 30 Sanitary Drainage,P3005.1,P3005.1 Drainage Fittings and Connections,2,"Changes in direction in drainage piping shall be made by the appropriate use of sanitary tees, wyes, sweeps, bends or by a combination of these drainage fittings in accordance with Table P3005.1. Change in direction by combination fittings, heel or side inlets or increasers shall be installed in accordance with Table P3005.1 and Sections P3005.1.1 through P3005.1.4, based on the pattern of flow created by the fitting. TABLE P3005.1 FITTINGS FOR CHANGE IN DIRECTION TYPE OF FITTING PATTERN CHANGE IN DIRECTION Horizontal to verticalc Vertical to horizontal Horizontal to horizontal Sixteenth bend X X X Eighth bend X X X Sixth bend X X X Quarter bend X Xa Xa Short sweep X Xa,b Xa Long sweep X X X Sanitary tee Xc — — Wye X X X Combination wye and eighth bend X X X For SI: 1 inch = 25.4 mm. The fittings shall only be permitted for a 2-inch or smaller fixture drain. Three inches and larger. For a limitation on multiple connection fittings, see Section P3005.1.1."
30,Chapter 30 Sanitary Drainage,P3005.1.1,P3005.1.1 Horizontal to Vertical (Multiple Connection Fittings),3,Double fittings such as double sanitary tees and tee-wyes or approved multiple connection fittings and back-to-back fixture arrangements that connect two or more branches at the same level shall be permitted as long as directly opposing connections are the same size and the discharge into directly opposing connections is from similar fixture types or fixture groups. Double sanitary tee patterns shall not receive the discharge of back-to-back water closets and fixtures or appliances with pumping action discharge.Exception: Back-to-back water closet connections to double sanitary tee patterns shall be permitted where the horizontal developed length between the outlet of the water closet and the connection to the double sanitary tee is 18 inches (457 mm) or greater.
30,Chapter 30 Sanitary Drainage,P3005.1.2,"P3005.1.2 Heel- or Side-Inlet Quarter Bends, Drainage",3,"Heel-inlet quarter bends shall be an acceptable means of connection, except where the quarter bends serves a water closet. A low-heel inlet shall not be used as a wet-vented connection. Side-inlet quarter bends shall be an acceptable means of connection for both drainage, wet venting and stack venting arrangements."
30,Chapter 30 Sanitary Drainage,P3005.1.3,"P3005.1.3 Heel- or Side-Inlet Quarter Bends, Venting",3,"Heel-inlet or side-inlet quarter bends, or any arrangement of pipe and fittings producing a similar effect, shall be acceptable as a dry vent where the inlet is placed in a vertical position. The inlet is permitted to be placed in a horizontal position only where the entire fitting is part of a dry vent arrangement."
30,Chapter 30 Sanitary Drainage,P3005.1.4,P3005.1.4 Water Closet Connection Between Flange and Pipe,3,"One-quarter bends 3 inches (76 mm) in diameter shall be acceptable for water closet or similar connections, provided that a 4-inch by 3-inch (102 mm by 76 mm) flange is installed to receive the closet fixture horn. Alternately, a 4-inch by 3-inch (102 mm by 76 mm) elbow shall be acceptable with a 4-inch (102 mm) flange."
30,Chapter 30 Sanitary Drainage,P3005.1.5,P3005.1.5 Provisions for Future Fixtures,3,"Where drainage has been roughed-in for future fixtures, the drainage unit values of the future fixtures shall be considered in determining the required drain sizes. Such future installations shall be terminated with an accessible permanent plug or cap fitting."
30,Chapter 30 Sanitary Drainage,P3005.1.6,P3005.1.6 Drainage Piping Size Reduction in the Direction of Flow,3,"The size of the drainage piping shall not be reduced in the direction of the flow. The following shall not be considered a reduction in size in the direction of flow:A 4-inch by 3-inch (102 mm by 76 mm) water closet flange.A water closet bend fitting having a 4-inch (102 mm) inlet and a 3-inch (76 mm) outlet provided that the 4-inch (102 mm) leg of the fitting is upright and below, but not necessarily directly connected to, the water closet flange.An offset closet flange."
30,Chapter 30 Sanitary Drainage,P3005.2,P3005.2 Cleanouts Required,2,Cleanouts shall be provided for drainage piping in accordance with Sections P3005.2.1 through P3005.2.11
30,Chapter 30 Sanitary Drainage,P3005.2.1,P3005.2.1 Horizontal Drains and Building Drains,3,"Horizontal drainage pipes in buildings shall have cleanouts located at intervals of not more than 100 feet (30 480 mm). Building drains shall have cleanouts located at intervals of not more than 100 feet (30 480 mm) except where manholes are used instead of cleanouts, the manholes shall be located at intervals of not more than 400 feet (122 m). The interval length shall be measured from the cleanout or manhole opening, along the developed length of the piping to the next drainage fitting providing access for cleaning, the end of the horizontal drain or the end of the building drain.Exception: Horizontal fixture drain piping serving a nonremovable trap shall not be required to have a cleanout for the section of piping between the trap and the vent connection for such trap."
30,Chapter 30 Sanitary Drainage,P3005.2.2,P3005.2.2 Building Sewers,3,"Building sewers smaller than 8 inches (203 mm) shall have cleanouts located at intervals of not more than 100 feet (30 480 mm). Building sewers 8 inches (203 mm) and larger shall have a manhole located not more than 200 feet (60 960 mm) from the junction of the building drain and building sewer and at intervals of not more than 400 feet (122 m). The interval length shall be measured from the cleanout or manhole opening, along the developed length of the piping to the next drainage fitting providing access for cleaning, a manhole or the end of the building sewer."
30,Chapter 30 Sanitary Drainage,P3005.2.3,P3005.2.3 Building Drain and Building Sewer Junction,3,"The junction of the building drain and the building sewer shall be served by a cleanout that is located at the junction or within 10 feet (3048 mm) developed length of piping upstream of the junction. For the requirements of this section, removal of a water closet shall not be required to provide cleanout access."
30,Chapter 30 Sanitary Drainage,P3005.2.4,P3005.2.4 Changes of Direction,3,"Where a horizontal drainage pipe, a building drain or a building sewer has a change of horizontal direction greater than 45 degrees (0.79 rad), a cleanout shall be installed at the change of direction. Where more than one change of horizontal direction greater than 45 degrees (0.79 rad) occurs within 40 feet (12 192 mm) of developed length of piping, the cleanout installed for the first change of direction shall serve as the cleanout for all changes in direction within that 40 feet (12 192 mm) of developed length of piping."
30,Chapter 30 Sanitary Drainage,P3005.2.5,P3005.2.5 Cleanout Size,3,"Cleanouts shall be the same size as the piping served by the cleanout, except cleanouts for piping larger than 4 inches (102 mm) need not be larger than 4 inches (102 mm). Exceptions: A removable P-trap with slip- or ground-joint connections can serve as a cleanout for drain piping that is one size larger than the P-trap size. Cleanouts located on stacks can be one size smaller than the stack size. The size of cleanouts for cast-iron piping can be in accordance with the referenced standards for cast iron fittings as indicated in Table P3002.3."
30,Chapter 30 Sanitary Drainage,P3005.2.6,P3005.2.6 Cleanout Plugs,3,"Cleanout plugs shall be copper alloy, plastic or other approved materials. Cleanout plugs for borosilicate glass piping systems shall be of borosilicate glass. Copper-alloy cleanout plugs shall conform to ASTM A74 and shall be limited for use only on metallic piping systems. Plastic cleanout plugs shall conform to the referenced standards for plastic pipe fittings as indicated in Table P3002.3. Cleanout plugs shall have a raised square head, a countersunk square head or a countersunk slot head. Where a cleanout plug will have a trim cover screw installed into the plug, the plug shall be manufactured with a blind end threaded hole for such purpose."
30,Chapter 30 Sanitary Drainage,P3005.2.7,P3005.2.7 Manholes,3,Manholes and manhole covers shall be of an approved type. Manholes located inside of a building shall have gastight covers that require tools for removal.
30,Chapter 30 Sanitary Drainage,P3005.2.8,P3005.2.8 Installation Arrangement,3,The installation arrangement of a cleanout shall enable cleaning of drainage piping only in the direction of drainage flow. Exceptions: Test tees serving as cleanouts. A two-way cleanout installation that is approved for meeting the requirements of Section P3005.2.3.
30,Chapter 30 Sanitary Drainage,P3005.2.9,P3005.2.9 Required Clearance,3,"Cleanouts for 6-inch (153 mm) and smaller piping shall be provided with a clearance of not less than 18 inches (457 mm) from, and perpendicular to, the face of the opening to any obstruction. Cleanouts for 8-inch (203 mm) and larger piping shall be provided with a clearance of not less than 36 inches (914 mm) from, and perpendicular to, the face of the opening to any obstruction."
30,Chapter 30 Sanitary Drainage,P3005.2.10,P3005.2.10 Cleanout Access,3,"Required cleanouts shall not be installed in concealed locations. For the purposes of this section, concealed locations include, but are not limited to, the inside of plenums, within walls, within floor/ceiling assemblies, below grade and in crawl spaces where the height from the crawl space floor to the nearest obstruction along the path from the crawl space opening to the cleanout location is less than 24 inches (610 mm). Cleanouts with openings at a finished wall shall have the face of the opening located within 11/2 inches (38 mm) of the finished wall surface. Cleanouts located below grade shall be extended to grade level so that the top of the cleanout plug is at or above grade. A cleanout installed in a floor or walkway that will not have a trim cover installed shall have a counter-sunk plug installed so the top surface of the plug is flush with the finished surface of the floor or walkway."
30,Chapter 30 Sanitary Drainage,P3005.2.10.1,P3005.2.10.1 Cleanout Equivalent,4,"A fixture trap or a fixture with an integral trap, removable without altering the concealed piping, shall be acceptable as a cleanout equivalent."
30,Chapter 30 Sanitary Drainage,P3005.2.10.2,P3005.2.10.2 Cleanout Plug Trim Covers,4,"Trim covers and access doors for cleanout plugs shall be designed for such purposes. Trim cover fasteners that thread into cleanout plugs shall be corrosion resistant. Cleanout plugs shall not be covered with mortar, plaster or any other permanent material."
30,Chapter 30 Sanitary Drainage,P3005.2.10.3,P3005.2.10.3 Floor Cleanout Assemblies,4,"Where it is necessary to protect a cleanout plug from the loads of vehicular traffic, cleanout assemblies in accordance with ASME A112.36.2M shall be installed."
30,Chapter 30 Sanitary Drainage,P3005.2.11,P3005.2.11 Prohibited Use,3,The use of a threaded cleanout opening to add a fixture or extend piping shall be prohibited except where another cleanout of equal size is installed with the required access and clearance.
30,Chapter 30 Sanitary Drainage,P3005.3,P3005.3 Horizontal Drainage Piping Slope,2,"Horizontal drainage piping shall be installed in uniform alignment at uniform slopes not less than 1/4 unit vertical in 12 units horizontal (2-percent slope) for 21/2-inch (64 mm) diameter and less, and not less than 1/8 unit vertical in 12 units horizontal (1-percent slope) for diameters of 3 inches (76 mm) or more."
30,Chapter 30 Sanitary Drainage,P3005.4,P3005.4 Drain Pipe Sizing,2,"Drain pipes shall be sized according to drainage fixture unit (d.f.u.) loads. The size of the drainage piping shall not be reduced in size in the direction of flow. The following general procedure is permitted to be used:Draw an isometric layout or riser diagram denoting fixtures on the layout.Assign d.f.u. values to each fixture group plus individual fixtures using Table P3004.1.Starting with the top floor or most remote fixtures, work downstream toward the building drain accumulating d.f.u. values for fixture groups plus individual fixtures for each branch. Where multiple bath groups are being added, use the reduced d.f.u. values in Table P3004.1, which take into account probability factors of simultaneous use.Size branches and stacks by equating the assigned d.f.u. values to pipe sizes shown in Table P3005.4.1.Determine the pipe diameter and slope of the building drain and building sewer based on the accumulated d.f.u. values, using Table P3005.4.2."
30,Chapter 30 Sanitary Drainage,P3005.4.1,P3005.4.1 Branch and Stack Sizing,3,"Branches and stacks shall be sized in accordance with Table P3005.4.1. Below grade drain pipes shall be not less than 11/2 inches (38 mm) in diameter. Drain stacks shall be not smaller than the largest horizontal branch connected. Exceptions: A 4-inch by 3-inch (102 mm by 76 mm) closet bend or flange. A 4-inch (102 mm) closet bend connected to a 3-inch (76 mm) stack tee shall not be prohibited. TABLE P3005.4.1 MAXIMUM FIXTURE UNITS ALLOWED TO BE CONNECTED TO BRANCHES AND STACKS NOMINAL PIPE SIZE (inches) ANY HORIZONTAL FIXTURE BRANCH ANY ONE VERTICAL STACK OR DRAIN 11/4a, b — — 11/2b 3 4 2b 6 10 21/2b 12 20 3 20 48 4 160 240 For SI: 1 inch = 25.4 mm. 11/4-inch pipe size limited to a single-fixture drain. See Table P3201.7. Water closets prohibited."
30,Chapter 30 Sanitary Drainage,P3005.4.2,P3005.4.2 Building Drain and Sewer Size and Slope,3,"Pipe sizes and slope shall be determined from Table P3005.4.2 on the basis of drainage load in fixture units (d.f.u.) computed from Table P3004.1. TABLE P3005.4.2 MAXIMUM NUMBER OF FIXTURE UNITS ALLOWED TO BE CONNECTED TO THE BUILDING DRAIN, BUILDING DRAIN BRANCHES OR THE BUILDING SEWER DIAMETER OF PIPE (inches) SLOPE PER FOOT 1/8 inch 1/4 inch 1/2 inch 11/2a, b — Note a Note a 2b — 21 27 21/2b — 24 31 3 36 42 50 4 180 216 250 For SI: 1 inch = 25.4 mm, 1 foot = 304.8 mm. 11/2-inch pipe size limited to a building drain branch serving not more than two waste fixtures, or not more than one waste fixture if serving a pumped discharge fixture or food waste disposer discharge. No water closets."
30,Chapter 30 Sanitary Drainage,P3005.5,P3005.5 Connections to Offsets and Bases of Stacks,2,Horizontal branches shall connect to the bases of stacks at a point located not less than 10 times the diameter of the drainage stack downstream from the stack. Horizontal branches shall connect to horizontal stack offsets at a point located not less than 10 times the diameter of the drainage stack downstream from the upper stack.
30,Chapter 30 Sanitary Drainage,P3006,Section P3006 Sizing of Drain Pipe Offsets,1,
30,Chapter 30 Sanitary Drainage,P3006.1,P3006.1 Vertical Offsets,2,"An offset in a vertical drain, with a change of direction of 45 degrees (0.79 rad) or less from the vertical, shall be sized as a straight vertical drain."
30,Chapter 30 Sanitary Drainage,P3006.2,P3006.2 Horizontal Offsets Above the Lowest Branch,2,"A stack with an offset of more than 45 degrees (0.79 rad) from the vertical shall be sized as follows:The portion of the stack above the offset shall be sized as for a regular stack based on the total number of fixture units above the offset.The offset shall be sized as for a building drain in accordance with Table P3005.4.2.The portion of the stack below the offset shall be sized as for the offset or based on the total number of fixture units on the entire stack, whichever is larger."
30,Chapter 30 Sanitary Drainage,P3006.3,P3006.3 Horizontal Offsets Below the Lowest Branch,2,"In soil or waste stacks below the lowest horizontal branch, a change in diameter shall not be required if the offset is made at an angle not greater than 45 degrees (0.79 rad) from the vertical. If an offset greater than 45 degrees (0.79 rad) from the vertical is made, the offset and stack below it shall be sized as a building drain in accordance with Table P3005.4.2."
30,Chapter 30 Sanitary Drainage,P3007,Section P3007 Sumps and Ejectors,1,
30,Chapter 30 Sanitary Drainage,P3007.1,P3007.1 Building Subdrains,2,"Building subdrains that cannot be discharged to the sewer by gravity flow shall be discharged into a tightly covered and vented sump from which the liquid shall be lifted and discharged into the building gravity drainage system by automatic pumping equipment or other approved method. In other than existing structures, the sump shall not receive drainage from any piping within the building capable of being discharged by gravity to the building sewer."
30,Chapter 30 Sanitary Drainage,P3007.2,P3007.2 Valves Required,2,"A check valve and a full open valve located on the discharge side of the check valve shall be installed in the pump or ejector discharge piping between the pump or ejector and the gravity drainage system. Access shall be provided to such valves. Such valves shall be located above the sump cover required by Section P3007.3.2 or, where the discharge pipe from the ejector is below grade, the valves shall be accessibly located outside the sump below grade in an access pit with a removable access cover."
30,Chapter 30 Sanitary Drainage,P3007.3,P3007.3 Sump Design,2,"The sump pump, sump and discharge piping shall conform to the requirements of Sections P3007.3.1 through P3007.3.5."
30,Chapter 30 Sanitary Drainage,P3007.3.1,P3007.3.1 Sump Pump,3,The sump pump capacity and head shall be appropriate to anticipated use requirements.
30,Chapter 30 Sanitary Drainage,P3007.3.2,P3007.3.2 Sump,3,"The sump shall be not less than 18 inches (457 mm) in diameter and 24 inches (610 mm) deep, unless otherwise approved. The sump shall be accessible and located so that drainage flows into the sump by gravity. The sump shall be constructed of tile, concrete, steel, plastic or other approved materials. The sump bottom shall be solid and provide permanent support for the pump. The sump shall be fitted with a gastight removable cover that is installed not more than 2 inches (51 mm) below grade or floor level. The cover shall be adequate to support anticipated loads in the area of use. The sump shall be vented in accordance with Chapter 31."
30,Chapter 30 Sanitary Drainage,P3007.3.3,P3007.3.3 Discharge Pipe and Fittings,3,Discharge pipe and fittings serving sump pumps and ejectors shall be constructed of materials in accordance with Sections P3007.3.3.1 and P3007.3.3.2.
30,Chapter 30 Sanitary Drainage,P3007.3.3.1,P3007.3.3.1 Materials,4,"Pipe and fitting materials shall be constructed of copper alloy, copper, CPVC, ductile iron, PE, or PVC."
30,Chapter 30 Sanitary Drainage,P3007.3.3.2,P3007.3.3.2 Ratings,4,"Pipe and fittings shall be rated for the maximum system operating pressure and temperature. Pipe fitting materials shall be compatible with the pipe material. Where pipe and fittings are buried in the earth, they shall be suitable for burial."
30,Chapter 30 Sanitary Drainage,P3007.3.4,P3007.3.4 Maximum Effluent Level,3,The effluent level control shall be adjusted and maintained to at all times prevent the effluent in the sump from rising to within 2 inches (51 mm) of the invert of the gravity drain inlet into the sump.
30,Chapter 30 Sanitary Drainage,P3007.3.5,P3007.3.5 Ejector Connection to the Drainage System,3,"Pumps connected to the drainage system shall connect to a building sewer, building drain, soil stack, waste stack or horizontal branch drain. Where the discharge line connects into horizontal drainage piping, the connection shall be made through a wye fitting into the top of the drainage piping and such wye fitting shall be located not less than 10 pipe diameters from the base of any soil stack, waste stack or fixture drain."
30,Chapter 30 Sanitary Drainage,P3007.4,P3007.4 Sewage Pumps and Sewage Ejectors,2,A sewage pump or sewage ejector shall automatically discharge the contents of the sump to the building drainage system.
30,Chapter 30 Sanitary Drainage,P3007.5,P3007.5 Macerating Toilet Systems and Pumped Waste Systems,2,Macerating toilet systems and pumped waste systems shall comply with ASME A112.3.4/CSA B45.9 and shall be installed in accordance with the manufacturer's instructions.
30,Chapter 30 Sanitary Drainage,P3007.6,P3007.6 Capacity,2,"Sewage pumps and sewage ejectors shall have the capacity and head for the application requirements. Pumps and ejectors that receive the discharge of water closets shall be capable of handling spherical solids with a diameter of up to and including 2 inches (51 mm). Other pumps or ejectors shall be capable of handling spherical solids with a diameter of up to and including 1/2 inch (13 mm). The minimum capacity of a pump or ejector based on the diameter of the discharge pipe shall be in accordance with Table 3007.6. Exceptions: Grinder pumps or grinder ejectors that receive the discharge of water closets shall have a discharge opening of not less than 11/4 inches (32 mm). Macerating toilet assemblies that serve single water closets shall have a discharge opening of not less than 3/4 inch (19 mm). TABLE 3007.6 MINIMUM CAPACITY OF SEWAGE PUMP OR SEWAGE EJECTOR DIAMETER OF THE DISCHARGE PIPE (inches) CAPACITY OF PUMP OR EJECTOR (gpm) 2 21 21/2 30 3 46 For SI: 1 inch = 25.4 mm, 1 gallon per minute = 3.785 L/m."
30,Chapter 30 Sanitary Drainage,P3008,Section P3008 Backwater Valves,1,
30,Chapter 30 Sanitary Drainage,P3008.1,P3008.1 Where Required,2,"Where the flood level rims of plumbing fixtures are below the elevation of the manhole cover of the next upstream manhole in the public sewer, the fixtures shall be protected by a backwater valve installed in the building drain, branch of the building drain or horizontal branch serving such fixtures."
30,Chapter 30 Sanitary Drainage,P3008.2,P3008.2 Allowable Installations,2,"Where plumbing fixtures are installed on a floor with a finished floor elevation above the elevation of the manhole cover of the next upstream manhole in the public sewer, and a backwater valve is installed in the building drain or horizontal branch serving such fixtures, the backwater valve shall be of the normally open type.Exception: Normally closed backwater valve installations for existing buildings shall not be prohibited."
30,Chapter 30 Sanitary Drainage,P3008.3,P3008.3 Material,2,"Backwater valves shall comply with ASME A112.14.1, CSA B181.1 or CSA B181.2."
30,Chapter 30 Sanitary Drainage,P3008.4,P3008.4 Location,2,Backwater valves shall be installed so that access is provided to the working parts.
30,Chapter 30 Sanitary Drainage,P3009,Section P3009 Graywater Soil Absorption Systems,1,
30,Chapter 30 Sanitary Drainage,P3009.1,P3009.1 Scope,2,"The provisions of this section shall govern the materials, design, construction and installation of subsurface graywater soil absorption systems connected to nonpotable water from on-site water reuse systems."
30,Chapter 30 Sanitary Drainage,P3009.2,P3009.2 Materials,2,"Above-ground drain, waste and vent piping for subsurface graywater soil absorption systems shall conform to one of the standards indicated in Table P3002.1(1). Subsurface graywater soil absorption, underground building drainage and vent pipe shall conform to one of the standards indicated in Table P3002.1(2)."
30,Chapter 30 Sanitary Drainage,P3009.3,P3009.3 Tests,2,"Drain, waste and vent piping for subsurface graywater soil absorption systems shall be tested in accordance with Section P2503."
30,Chapter 30 Sanitary Drainage,P3009.4,P3009.4 Inspections,2,Subsurface graywater soil absorption systems shall be inspected in accordance with Section R109.
30,Chapter 30 Sanitary Drainage,P3009.5,P3009.5 Disinfection,2,Disinfection shall not be required for on-site nonpotable reuse water for subsurface graywater soil absorption systems.
30,Chapter 30 Sanitary Drainage,P3009.6,P3009.6 Coloring,2,On-site nonpotable reuse water used for subsurface graywater soil absorption systems shall not be required to be dyed.
30,Chapter 30 Sanitary Drainage,P3009.7,P3009.7 Sizing,2,"The system shall be sized in accordance with the sum of the output of all water sources connected to the graywater soil absorption system. Where graywater collection piping is connected to subsurface graywater soil absorption systems, graywater output shall be calculated according to the gallons-per-day-per-occupant (liters per day per occupant) number based on the type of fixtures connected. The graywater discharge shall be calculated by the following equation: (Equation 30-1) where: A = Number of occupants: Number of occupants shall be determined by the actual number of occupants, but not less than two occupants for one bedroom and one occupant for each additional bedroom. B = Estimated flow demands for each occupant: 25 gallons (94.6 L) per day per occupant for showers, bathtubs and lavatories and 15 gallons (56.7 L) per day per occupant for clothes washers or laundry trays. C = Estimated graywater discharge based on the total number of occupants."
30,Chapter 30 Sanitary Drainage,P3009.8,P3009.8 Percolation Tests,2,The permeability of the soil in the proposed absorption system shall be determined by percolation tests or permeability evaluation.
30,Chapter 30 Sanitary Drainage,P3009.8.1,P3009.8.1 Percolation Tests and Procedures,3,"Not less than three percolation tests in each system area shall be conducted. The holes shall be spaced uniformly in relation to the bottom depth of the proposed absorption system. More percolation tests shall be made where necessary, depending on system design."
