id,section,reference,title,depth,body
30,Chapter 30 Sanitary Drainage,P3009.8.1.1,P3009.8.1.1 Percolation Test Hole,4,The test hole shall be dug or bored. The test hole shall have vertical sides and a horizontal dimension of 4 inches to 8 inches (102 mm to 203 mm). The bottom and sides of the hole shall be scratched with a sharp-pointed instrument to expose the natural soil. Loose material shall be removed from the hole and the bottom shall be covered with 2 inches (51 mm) of gravel or coarse sand.
30,Chapter 30 Sanitary Drainage,P3009.8.1.2,"P3009.8.1.2 Test Procedure, Sandy Soils",4,"The hole shall be filled with clear water to not less than 12 inches (305 mm) above the bottom of the hole for tests in sandy soils. The time for this amount of water to seep away shall be determined, and this procedure shall be repeated if the water from the second filling of the hole seeps away in 10 minutes or less. The test shall proceed as follows: Water shall be added to a point not more than 6 inches (152 mm) above the gravel or coarse sand. Thereupon, from a fixed reference point, water levels shall be measured at 10-minute intervals for a period of 1 hour. Where 6 inches (152 mm) of water seeps away in less than 10 minutes, a shorter interval between measurements shall be used. The water depth shall not exceed 6 inches (152 mm). Where 6 inches (152 mm) of water seeps away in less than 2 minutes, the test shall be stopped and a rate of less than 3 minutes per inch (7.2 s/mm) shall be reported. The final water level drop shall be used to calculate the percolation rate. Soils not meeting these requirements shall be tested in accordance with Section P3009.8.1.3."
30,Chapter 30 Sanitary Drainage,P3009.8.1.3,"P3009.8.1.3 Test Procedure, Other Soils",4,"The hole shall be filled with clear water, and a minimum water depth of 12 inches (305 mm) shall be maintained above the bottom of the hole for a 4-hour period by refilling whenever necessary or by use of an automatic siphon. Water remaining in the hole after 4 hours shall not be removed. Thereafter, the soil shall be allowed to swell not less than 16 hours or more than 30 hours. Immediately after the soil swelling period, the measurements for determining the percolation rate shall be made as follows: any soil sloughed into the hole shall be removed and the water level shall be adjusted to 6 inches (152 mm) above the gravel or coarse sand. Thereupon, from a fixed reference point, the water level shall be measured at 30-minute intervals for a period of 4 hours, unless two successive water level drops do not vary by more than 1/16 inch (1.59 mm). Not less than three water level drops shall be observed and recorded. The hole shall be filled with clear water to a point not more than 6 inches (152 mm) above the gravel or coarse sand whenever it becomes nearly empty. Adjustments of the water level shall not be made during the three measurement periods except to the limits of the last measured water level drop. When the first 6 inches (152 mm) of water seeps away in less than 30 minutes, the time interval between measurements shall be 10 minutes and the test run for 1 hour. The water depth shall not exceed 5 inches (127 mm) at any time during the measurement period. The drop that occurs during the final measurement period shall be used in calculating the percolation rate."
30,Chapter 30 Sanitary Drainage,P3009.8.1.4,P3009.8.1.4 Mechanical Test Equipment,4,Mechanical percolation test equipment shall be of an approved type.
30,Chapter 30 Sanitary Drainage,P3009.8.2,P3009.8.2 Permeability Evaluation,3,Soil shall be evaluated for estimated percolation based on structure and texture in accordance with accepted soil evaluation practices. Borings shall be made in accordance with Section P3009.8.1.1 for evaluating the soil.
30,Chapter 30 Sanitary Drainage,P3009.9,P3009.9 Subsurface Graywater Soil Absorption System Site Location,2,"The surface grade of soil absorption systems shall be located at a point lower than the surface grade of any water well or reservoir on the same or adjoining lot. Where this is not possible, the site shall be located so surface water drainage from the site is not directed toward a well or reservoir. The soil absorption system shall be located with a minimum horizontal distance between various elements as indicated in Table P3009.9. Private sewage disposal systems in compacted areas, such as parking lots and driveways, are prohibited. Surface water shall be diverted away from any soil absorption site on the same or neighboring lots. TABLE P3009.9 LOCATION OF SUBSURFACE IRRIGATION SYSTEM ELEMENT MINIMUM HORIZONTAL DISTANCE STORAGE TANK (feet) ABSORPTION FIELD (feet) Buildings 5 2 Lot line adjoining private property 5 5 Public water main 10 10 Seepage pits 5 5 Septic tanks 0 5 Streams and lakes 50 50 Water service 5 5 Water wells 50 100 For SI: 1 foot = 304.8 mm."
30,Chapter 30 Sanitary Drainage,P3009.10,P3009.10 Installation,2,Absorption systems shall be installed in accordance with Sections P3009.10.1 through P3009.11.1.
30,Chapter 30 Sanitary Drainage,P3009.10.1,P3009.10.1 Absorption Area,3,"The total absorption area required shall be computed from the estimated daily graywater discharge and the design-loading rate based on the percolation rate for the site. The required absorption area equals the estimated graywater discharge divided by the design loading rate from Table P3009.10.1. TABLE P3009.10.1 DESIGN LOADING RATE PERCOLATION RATE (minutes per inch) DESIGN LOADING FACTOR (gallons per square foot per day) 0 to less than 10 1.2 10 to less than 30 0.8 30 to less than 45 0.72 45 to 60 0.4 For SI: 1 minute per inch = min/25.4 mm, 1 gallon per square foot = 40.7 L/m2."
30,Chapter 30 Sanitary Drainage,P3009.10.2,P3009.10.2 Seepage Trench Excavations,3,Seepage trench excavations shall be not less than 1 foot (304 mm) in width and not greater than 5 feet (1524 mm) in width. Trench excavations shall be spaced not less than 2 feet (610 mm) apart. The soil absorption area of a seepage trench shall be computed by using the bottom of the trench area (width) multiplied by the length of pipe. Individual seepage trenches shall be not greater than 100 feet (30 480 mm) in developed length.
30,Chapter 30 Sanitary Drainage,P3009.10.3,P3009.10.3 Seepage Bed Excavations,3,"Seepage bed excavations shall be not less than 5 feet (1524 mm) in width and have more than one distribution pipe. The absorption area of a seepage bed shall be computed by using the bottom of the trench area. Distribution piping in a seepage bed shall be uniformly spaced not greater than 5 feet (1524 mm) and not less than 3 feet (914 mm) apart, and greater than 3 feet (914 mm) and not less than 1 foot (305 mm) from the sidewall or headwall."
30,Chapter 30 Sanitary Drainage,P3009.10.4,P3009.10.4 Excavation and Construction,3,"The bottom of a trench or bed excavation shall be level. Seepage trenches or beds shall not be excavated where the soil is so wet that such material rolled between the hands forms a soil wire. Smeared or compacted soil surfaces in the sidewalls or bottom of seepage trench or bed excavations shall be scarified to the depth of smearing or compaction and the loose material removed. Where rain falls on an open excavation, the soil shall be left until sufficiently dry so a soil wire will not form when soil from the excavation bottom is rolled between the hands. The bottom area shall then be scarified and loose material removed."
30,Chapter 30 Sanitary Drainage,P3009.10.5,P3009.10.5 Aggregate and Backfill,3,Not less than 6 inches (150 mm) in depth of aggregate ranging in size from 1/2 to 21/2 inches (12.7 mm to 64 mm) shall be laid into the trench below the distribution piping elevation. The aggregate shall be evenly distributed not less than 2 inches (51 mm) in depth over the top of the distribution pipe. The aggregate shall be covered with approved synthetic materials or 9 inches (229 mm) of uncompacted marsh hay or straw. Building paper shall not be used to cover the aggregate. Not less than 9 inches (229 mm) of soil backfill shall be provided above the covering.
30,Chapter 30 Sanitary Drainage,P3009.11,P3009.11 Distribution Piping,2,"Distribution piping shall be not less than 3 inches (76 mm) in diameter. Materials shall comply with Table P3009.11. The top of the distribution pipe shall be not less than 8 inches (203 mm) below the original surface. The slope of the distribution pipes shall be not less than 2 inches (51 mm) and not greater than 4 inches (102 mm) per 100 feet (30 480 mm). TABLE P3009.11 DISTRIBUTION PIPE MATERIAL STANDARD Polyethylene (PE) plastic pipe ASTM F405 Polyvinyl chloride (PVC) plastic pipe ASTM D2729 Polyvinyl chloride (PVC) plastic pipe with a 3.5-inch O.D. and solid, cellular core or composite wall ASTM F1488 For SI: 1 inch = 25.4 mm."
30,Chapter 30 Sanitary Drainage,P3009.11.1,P3009.11.1 Joints,3,Joints in distribution pipe shall be made in accordance with Section P3003.
30,Chapter 30 Sanitary Drainage,P3010,Section P3010 Replacement of Underground Building Sewers and Building Drains by Pipe Bursting Methods,1,
30,Chapter 30 Sanitary Drainage,P3010.1,P3010.1 General,2,This section shall govern the replacement of existing building sewer and building drain piping by pipe-bursting methods.
30,Chapter 30 Sanitary Drainage,P3010.2,P3010.2 Applicability,2,The replacement of building sewer and building drain piping by pipe bursting methods shall be limited to gravity drainage piping of sizes 6 inches (150 mm) and smaller. The replacement piping shall be of the same nominal size as the existing piping.
30,Chapter 30 Sanitary Drainage,P3010.3,P3010.3 Preinstallation Inspection,2,The existing piping sections to be replaced shall be inspected internally by a recorded video camera survey. The survey shall include notations of the position of cleanouts and the depth of connections to the existing piping.
30,Chapter 30 Sanitary Drainage,P3010.4,P3010.4 Pipe,2,The replacement pipe shall be made of a high-density polyethylene (HDPE) and shall be in compliance with ASTM F714.
30,Chapter 30 Sanitary Drainage,P3010.5,P3010.5 Pipe Fittings,2,Pipe fittings to be connected to the replacement pipe shall be made of high-density polyethylene (HDPE) and shall be in compliance with ASTM D2683.
30,Chapter 30 Sanitary Drainage,P3010.6,P3010.6 Cleanouts,2,"Where the existing building sewer or building drain did not have cleanouts meeting the requirements of this code, cleanout fittings shall be installed as required by this code."
30,Chapter 30 Sanitary Drainage,P3010.7,P3010.7 Post-Installation Inspection,2,The completed replacement piping section shall be inspected internally by a recorded video camera survey. The video survey shall be reviewed and approved by the building official prior to pressure testing of the replacement piping system.
30,Chapter 30 Sanitary Drainage,P3010.8,P3010.8 Pressure Testing,2,The replacement piping system and the connections to the replacement piping shall be tested in accordance with Section P2503.4.
30,Chapter 30 Sanitary Drainage,P3011,Section P3011 Relining of Building Sewers and Building Drains,1,
30,Chapter 30 Sanitary Drainage,P3011.1,P3011.1 General,2,This section shall govern the relining of existing building sewer and building drainage piping.
30,Chapter 30 Sanitary Drainage,P3011.2,P3011.2 Applicability,2,The relining of existing building sewer piping and building drainage piping shall be limited to gravity drainage piping 4 inches (102 mm) in diameter and larger. The relined piping shall be of the same nominal size as the existing piping.
30,Chapter 30 Sanitary Drainage,P3011.3,P3011.3 Preinstallation Requirements,2,"Prior to commencement of the relining installation, the existing piping sections to be relined shall be descaled and cleaned. After the cleaning process has occurred and water has been flushed through the system, the piping shall be inspected internally by a recorded video camera survey."
30,Chapter 30 Sanitary Drainage,P3011.3.1,P3011.3.1 Preinstallation Recorded Video Camera Survey,3,"The video survey shall include verification of the project address location. The video shall include notations of the cleanout and fitting locations, and the approximate depth of the existing piping. The video shall also include notations of the length of piping at intervals not greater than 25 feet (7620 mm)."
30,Chapter 30 Sanitary Drainage,P3011.4,P3011.4 Permitting,2,"Prior to issuing a permit for relining, the building official shall review and evaluate the preinstallation recorded video camera survey to determine whether the piping system is able to be relined in accordance with the proposed lining system manufacturer's installation requirements and applicable referenced standards."
30,Chapter 30 Sanitary Drainage,P3011.5,P3011.5 Prohibited Applications,2,"Where the preinstallation recorded video camera survey reveals that piping systems are not installed correctly, or defects exist, relining shall not be permitted. The defective portions of piping shall be exposed and repaired with pipe and fittings in accordance with this code. Defects shall include, but are not limited to, backslope or insufficient slope, complete pipe wall deterioration or complete separations such as from tree root invasion or improper support."
30,Chapter 30 Sanitary Drainage,P3011.6,P3011.6 Relining Materials,2,The relining materials shall be manufactured in compliance with applicable standards and certified as required in Section P2609. Fold-and-form pipe reline materials shall be manufactured in compliance with ASTM F1504 or ASTM F1871.
30,Chapter 30 Sanitary Drainage,P3011.7,P3011.7 Installation,2,"The installation of relining materials shall be performed in accordance with the manufacturer's installation instructions, applicable referenced standards and this code."
30,Chapter 30 Sanitary Drainage,P3011.7.1,P3011.7.1 Material Data Report,3,"The installer shall record the data as required by the relining material manufacturer and applicable standards. The recorded data shall include, but is not limited to, the location of the project, relining material type, amount of product installed and conditions of the installation. A copy of the data report shall be provided to the building official prior to final approval."
30,Chapter 30 Sanitary Drainage,P3011.8,P3011.8 Post-Installation Recorded Video Camera Survey,2,The completed relined piping system shall be inspected internally by a recorded video camera survey after the system has been flushed and flow-tested with water. The video survey shall be submitted to the building official prior to finalization of the permit. The video survey shall be reviewed and evaluated to provide verification that no defects exist. Any defects identified shall be repaired and replaced in accordance with this code.
30,Chapter 30 Sanitary Drainage,P3011.9,P3011.9 Certification,2,"Certification shall be provided in writing to the building official, from the permit holder, that the relining materials have been installed in accordance with the manufacturer's installation instructions, the applicable standards and this code."
30,Chapter 30 Sanitary Drainage,P3011.10,P3011.10 Approval,2,"Upon verification of compliance with the requirements of Sections P3011.1 through P3011.9, the building official shall approve the installation."
