id,section,title,ifc_type,occupancy,design_phase,code_category,primary_responsibility,body
805.3.1.1,Section 805 Means of Egress,Single-Exit Buildings,,,,,,"A single exit or access to a single exit shall be permitted from spaces, any story or any occupied roof where one of the following exist: The occupant load, number of dwelling units and exit access travel distance do not exceed the values in Table 805.3.1.1(1) or 805.3.1.1(2). In Group R-1 or R-2 buildings without an approved automatic sprinkler system, individual single-story or multistory dwelling or sleeping units shall be permitted to have a single exit or access to a single exit from the dwelling or sleeping unit provided one of the following criteria are met: The occupant load is not greater than 10 and the exit access travel distance within the unit does not exceed 75 feet (22 860 mm). The building is not more than three stories in height; all third story space is part of dwelling with an exit access doorway on the second story; and the portion of the exit access travel distance from the door to any habitable room within any such unit to the unit entrance doors does not exceed 50 feet (15 240 mm). In buildings of Group R-2 occupancy of any number of stories and with not more than four dwelling units per floor; served by an interior exit stairway with a smokeproof enclosure in accordance with Sections 909.20 and 1023.11 of the Florida Building Code, Building or an exterior exit stairway outside stairway as an exit; and with such exit where the portion of the exit access travel distance from the dwelling unit entrance door to the exit is a maximum of 20 feet (6096 mm). TABLE 805.3.1.1(1) STORIES WITH ONE EXIT OR ACCESS TO ONE EXIT FOR R-2 OCCUPANCIES STORY OCCUPANCY MAXIMUM NUMBER OF DWELLING UNITS MAXIMUM EXIT ACCESS TRAVEL DISTANCE Basement, first or second story above grade plane R-2a 4 dwelling units 50 feet Third story above grade plane and higher NP NA NA For SI: 1 foot = 304.8 mm. NP = Not Permitted. NA = Not Applicable. Group R-2, without an approved automatic sprinkler system and provided with emergency escape and rescue openings in accordance with Section 1030 of the Florida Building Code, Building. TABLE 805.3.1.1(2) STORIES WITH ONE EXIT OR ACCESS TO ONE EXIT FOR OTHER OCCUPANCIES STORY OCCUPANCY MAXIMUM OCCUPANT LOAD PER STORY MAXIMUM EXIT ACCESS TRAVEL DISTANCE (feet) First story above or below grade plane B, F-2, S-2a 35 75 Second story above grade plane B, F-2, S-2a 35 75 Third story above grade plane and higher NP NA NA For SI: 1 foot = 304.8 mm. NP = Not Permitted. NA = Not Applicable. The length of exit access travel distance in a Group S-2 open parking garage shall be not more than 100 feet."
805.3.1.2,Section 805 Means of Egress,Fire Escapes Required,,,,,,"For other than Group I-2, where more than one exit is required, an existing or newly constructed fire escape complying with Section 805.3.1.2.1 shall be accepted as providing one of the required means of egress."
805.3.1.2.1,Section 805 Means of Egress,Fire Escape Access and Details,,,,,,"Fire escapes shall comply with all of the following requirements: Occupants shall have unobstructed access to the fire escape without having to pass through a room subject to locking. Access to a new fire escape shall be through a door, except that windows shall be permitted to provide access from single dwelling units or sleeping units in Group R-1, R-2 and I-1 occupancies or to provide access from spaces having a maximum occupant load of 10 in other occupancy classifications. The window shall have a minimum net clear opening of 5.7 square feet (0.53 m2) or 5 square feet (0.46 m2) where located at grade. The minimum net clear opening height shall be 24 inches (610 mm) and net clear opening width shall be 20 inches (508 mm). The bottom of the clear opening shall not be greater than 44 inches (1118 mm) above the floor. The operation of the window shall comply with the operational constraints of the Florida Building Code, Building. Newly constructed fire escapes shall be permitted only where exterior stairways cannot be utilized because of lot lines limiting the stairway size or because of the sidewalks, alleys, or roads at grade level. Openings within 10 feet (3048 mm) of fire escape stairways shall be protected by fire assemblies having minimum 3/4-hour fire-resistance ratings. Exception: Opening protection shall not be required in buildings equipped throughout with an approved automatic sprinkler system. In all buildings of Group E occupancy, up to and including the 12th grade, buildings of Group I occupancy, rooming houses and childcare centers, ladders of any type are prohibited on fire escapes used as a required means of egress."
805.3.1.2.2,Section 805 Means of Egress,Construction,,,,,,The fire escape shall be designed to support a live load of 100 pounds per square foot (4788 Pa) and shall be constructed of steel or other approved noncombustible materials. Fire escapes constructed of wood not less than nominal 2 inches (51 mm) thick are permitted on buildings of Type V construction. Walkways and railings located over or supported by combustible roofs in buildings of Types III and IV construction are permitted to be of wood not less than nominal 2 inches (51 mm) thick.
805.3.1.2.3,Section 805 Means of Egress,Dimensions,,,,,,"Stairways shall be at least 22 inches (559 mm) wide with risers not more than, and treads not less than, 8 inches (203 mm). Landings at the foot of stairways shall be not less than 40 inches (1016 mm) wide by 36 inches (914 mm) long and located not more than 8 inches (203 mm) below the door."
805.3.2,Section 805 Means of Egress,Mezzanines,,,,,,Mezzanines in the work area and with an occupant load of more than 50 or in which the travel distance to an exit exceeds 75 feet (22 860 mm) shall have access to at least two independent means of egress.Exception: Two independent means of egress are not required where the travel distance to an exit does not exceed 100 feet (30 480 mm) and the building is protected throughout with an automatic sprinkler system.
805.3.3,Section 805 Means of Egress,Main Entrance—Group A,,,,,,"All buildings of Group A with an occupant load of 300 or more shall be provided with a main entrance capable of serving as the main exit with an egress capacity of at least one-half of the total occupant load. The remaining exits shall be capable of providing one-half of the total required exit capacity.Exception: Where there is no well-defined main exit or where multiple main exits are provided, exits shall be permitted to be distributed around the perimeter of the building provided that the total width of egress is not less than 100 percent of the required width."
805.4,Section 805 Means of Egress,Egress Doorways,,,,,,Egress doorways in any work area shall comply with Sections 805.4.1 through 805.4.5.
805.4.1,Section 805 Means of Egress,Two Egress Doorways Required,,,,,,Work areas shall be provided with two egress doorways in accordance with the requirements of Sections 805.4.1.1 and 805.4.1.2.
805.4.1.1,Section 805 Means of Egress,Occupant Load and Travel Distance,,,,,,"In any work area, all rooms and spaces having an occupant load greater than 50 or in which the travel distance to an exit exceeds 75 feet (22 860 mm) shall have a minimum of two egress doorways.Exceptions:Storage rooms having a maximum occupant load of 10.Where the work area is served by a single exit in accordance with Section 805.3.1.1."
805.4.1.2,Section 805 Means of Egress,Group I-2,,,,,,"In Group I-2, Condition 2, work areas that include altered care suites shall comply with Sections 407.4.4 through 407.4.4.6.2 of the Florida Building Code, Building."
805.4.2,Section 805 Means of Egress,Door Swing,,,,,,"In the work area and in the egress path from any work area to the exit discharge, all egress doors serving an occupant load greater than 50 shall swing in the direction of exit travel."
805.4.2.1,Section 805 Means of Egress,Supplemental Requirements for Door Swing,,,,,,"Where the work area exceeds 50 percent of the floor area, door swing shall comply with Section 805.4.2 throughout the floor.Exception: Means of egress within or serving only a tenant space that is entirely outside the work area."
805.4.3,Section 805 Means of Egress,Door Closing,,,,,,"In any work area, all doors opening onto an exit passageway at grade or an exit stairway shall be self-closing or automatic-closing by listed closing devices.Exceptions:Where exit enclosure is not required by the Florida Building Code, Building.Means of egress within or serving only a tenant space that is entirely outside the work area."
805.4.3.1,Section 805 Means of Egress,Supplemental Requirements for Door Closing,,,,,,"Where the work area exceeds 50 percent of the floor area, doors shall comply with Section 805.4.3 throughout the exit stairway from the work area to, and including, the level of exit discharge."
805.4.4,Section 805 Means of Egress,Panic and Fire Exit Hardware,,,,,,"In any work area, and in the egress path from any work area to the exit discharge, in buildings or portions thereof of Group A assembly occupancies with an occupant load greater than 100, all required exit doors equipped with latching devices shall be equipped with approved panic or fire exit hardware in accordance with Section 1010.2.9 of the Florida Building Code, Building."
805.4.4.1,Section 805 Means of Egress,Supplemental Requirements for Panic Hardware,,,,,,"Where the work area exceeds 50 percent of the floor area, panic hardware shall comply with Section 805.4.4 throughout the floor.Exception: Means of egress within a tenant space that is entirely outside the work area."
805.4.5,Section 805 Means of Egress,Emergency Power Source in Group I-3,,,,,,"Power-operated sliding doors or power-operated locks for swinging doors shall be operable by a manual release mechanism at the door. Emergency power shall be provided for the doors and locks in accordance with Section 2702 of the Florida Building Code, Building.Exceptions:Emergency power is not required in facilities with 10 or fewer locks complying with the exception to Section 408.4.1 of the Florida Building Code, Building.Emergency power is not required where remote mechanical operating releases are provided."
805.5,Section 805 Means of Egress,Openings in Corridor Walls,,,,,,"Openings in corridor walls in any work area shall comply with Sections 805.5.1 through 805.5.4.Exception: Openings in corridors where such corridors are not required to be rated in accordance with the Florida Building Code, Building."
805.5.1,Section 805 Means of Egress,Corridor Doors,,,,,,"Corridor doors in the work area shall not be constructed of hollow core wood and shall not contain louvers. All dwelling unit or sleeping unit corridor doors in work areas in buildings of Groups R-1, R-2, and I-1 shall be at least 13/8-inch (35 mm) solid core wood or approved equivalent and shall not have any glass panels, other than approved wired glass or other approved glazing material in metal frames. All dwelling unit or sleeping unit corridor doors in work areas in buildings of Groups R-1, R-2, and I-1 shall be equipped with approved door closers. All replacement doors shall be 13/4-inch (44 mm) solid bonded wood core or approved equivalent, unless the existing frame will accommodate only a 13/8-inch (35 mm) door.Exceptions:Corridor doors within a dwelling unit or sleeping unit.Existing doors meeting the requirements of Guidelines on Fire Ratings of Archaic Materials and Assemblies for a rating of 15 minutes or more shall be accepted as meeting the provisions of this requirement.Existing doors in buildings protected throughout with an approved automatic sprinkler system shall be required only to resist smoke, be reasonably tight fitting, and shall not contain louvers.In group homes with a maximum of 15 occupants and that are protected with an approved automatic detection system, closing devices may be omitted.Door assemblies having a fire protection rating of at least 20 minutes."
805.5.2,Section 805 Means of Egress,Transoms,,,,,,"In all buildings of Group I-1, I-2, R-1 and R-2 occupancies, all transoms in corridor walls in work areas shall be either glazed with 1/4-inch (6.4 mm) wired glass set in metal frames or other glazing assemblies having a fire protection rating as required for the door and permanently secured in the closed position or sealed with materials consistent with the corridor construction."
805.5.3,Section 805 Means of Egress,Other Corridor Openings,,,,,,"In any work area, unless otherwise protected in accordance with Section 716 of the Florida Building Code, Building, any other sash, grille, or opening in a corridor, and any window in a corridor not opening to the outside air, shall be sealed with materials consistent with the corridor construction."
805.5.3.1,Section 805 Means of Egress,Supplemental Requirements for Other Corridor Opening,,,,,,"Where the work area exceeds 50 percent of the floor area, Section 805.5.3 shall be applicable to all corridor windows, grills, sashes, and other openings on the floor.Exception: Means of egress within or serving only a tenant space that is entirely outside the work area."
805.5.4,Section 805 Means of Egress,Supplemental Requirements for Corridor Openings,,,,,,"Where the work area on any floor exceeds 50 percent of the floor area, the requirements of Sections 805.5.1 through 805.5.3 shall apply throughout the floor."
805.6,Section 805 Means of Egress,Dead-End Corridors,,,,,,"Dead-end corridors in any work area shall not exceed 35 feet (10 670 mm). In Group I-2 occupancies, dead-end corridors shall not exceed 30 feet (9144 mm).Exceptions:Where dead-end corridors of greater length are permitted by the Florida Building Code, Building.In other than Group A, I-2 and H occupancies, the maximum length of an existing dead-end corridor shall be 50 feet (15 240 mm) in buildings equipped throughout with an automatic fire alarm system installed in accordance with the Florida Building Code, Building.In other than Group A, I-2 and H occupancies, the maximum length of an existing dead-end corridor shall be 70 feet (21 356 mm) in buildings equipped throughout with an automatic sprinkler system installed in accordance with the Florida Building Code, Building.In other than Group A, I-2 and H occupancies, the maximum length of an existing, newly constructed, or extended dead-end corridor shall not exceed 50 feet (15 240 mm) on floors equipped with an automatic sprinkler system installed in accordance with the Florida Building Code, Building."
805.7,Section 805 Means of Egress,Means-of-Egress Lighting,,,,,,"Means-of-egress lighting shall be in accordance with this section, as applicable."
805.7.1,Section 805 Means of Egress,Artificial Lighting Required,,,,,,"Means of egress in all work areas shall be provided with artificial lighting in accordance with the requirements of the Florida Building Code, Building."
805.7.2,Section 805 Means of Egress,Supplemental Requirements for Means-of-Egress Lighting,,,,,,"Where the work area on any floor exceeds 50 percent of that floor area, means of egress throughout the floor shall comply with Section 805.7.1.Exception: Means of egress within or serving only a tenant space that is entirely outside the work area."
805.8,Section 805 Means of Egress,Exit Signs,,,,,,"Exit signs shall be in accordance with this section, as applicable."
805.8.1,Section 805 Means of Egress,Work Areas,,,,,,"Means of egress in all work areas shall be provided with exit signs in accordance with the requirements of the Florida Building Code, Building."
805.8.2,Section 805 Means of Egress,Supplemental Requirements for Exit Signs,,,,,,"Where the work area on any floor exceeds 50 percent of that floor area, means of egress throughout the floor shall comply with Section 805.8.1.Exception: Means of egress within a tenant space that is entirely outside the work area."
805.9,Section 805 Means of Egress,Handrails,,,,,,"The requirements of Sections 805.9.1 and 805.9.2 shall apply to handrails from the work area floor to, and including, the level of exit discharge."
805.9.1,Section 805 Means of Egress,Minimum Requirement,,,,,,"Every required exit stairway that is part of the means of egress for any work area and that has three or more risers and is not provided with at least one handrail, or in which the existing handrails are judged to be in danger of collapsing, shall be provided with handrails for the full length of the stairway on at least one side. All exit stairways with a required egress width of more than 66 inches (1676 mm) shall have handrails on both sides."
805.9.2,Section 805 Means of Egress,Design,,,,,,"Handrails required in accordance with Section 805.9.1 shall be designed and installed in accordance with the provisions of the Florida Building Code, Building."
805.10,Section 805 Means of Egress,Refuge Areas,,,,,,"Where alterations affect the configuration of an area utilized as a refuge area, the capacity of the refuge area shall not be reduced below the required capacity of the refuge area for horizontal exits in accordance with Section 1026.4 of the Florida Building Code, Building.Where the horizontal exit also forms a smoke compartment, the capacity of the refuge area for Group I-1, I-2 and I-3 occupancies and Group B ambulatory care facilities shall not be reduced below that required in Sections 407.5.1, 408.6.2, 420.4.1 and 422.3.2 of the Florida Building Code, Building, as applicable."
805.11,Section 805 Means of Egress,Guards,,,,,,"The requirements of Sections 805.11.1 and 805.11.2 shall apply to guards from the work area floor to, and including, the level of exit discharge but shall be confined to the egress path of any work area."
805.11.1,Section 805 Means of Egress,Minimum Requirement,,,,,,"Every open portion of a stairway, landing, or balcony that is more than 30 inches (762 mm) above the floor or grade below and is not provided with guards, or those portions in which existing guards are judged to be in danger of collapsing, shall be provided with guards."
805.11.2,Section 805 Means of Egress,Design,,,,,,"Guards required in accordance with Section 805.11.1 shall be designed and installed in accordance with the Florida Building Code, Building."
805.12,Section 805 Means of Egress,Group I-2,,,,,,"In Group I-2 occupancies, in areas where corridors are used for movement of care recipients in beds, the clear width of ramps and corridors shall be not less than 48 inches (1219 mm)."
806.1,Section 806 Accessibility,General,,,,,,"A building, facility, or element that is altered shall comply with the provisions of the Florida Building Code, Accessibility."
806.2,Section 806 Accessibility,Stairways and Escalators in Existing Buildings,,,,,,Reserved.
807.1,Section 807 Structural,General,,,,,,Structural elements and systems within buildings undergoing Level 2 alterations shall comply with this section.
807.2,Section 807 Structural,New Structural Elements,,,,,,"New structural elements in alterations, including connections and anchorage, shall comply with the Florida Building Code, Building."
807.3,Section 807 Structural,Minimum Design Loads,,,,,,The minimum design loads on existing elements of a structure that do not support additional loads as a result of an alteration shall be the loads applicable at the time the building was constructed.
807.4,Section 807 Structural,Existing Structural Elements Carrying Gravity Loads,,,,,,"Alterations shall not reduce the capacity of existing gravity load-carrying structural elements unless it is demonstrated that the elements have the capacity to carry the applicable design gravity loads required by the Florida Building Code, Building. Existing structural elements supporting any additional gravity loads as a result of the alterations shall comply with the Florida Building Code, Building.Exceptions:Structural elements whose stress is not increased by more than 5 percent.Buildings of Group R occupancy with not more than five dwelling or sleeping units used solely for residential purposes where the existing building and its alteration comply with the conventional light-frame construction methods of the Florida Building Code, Building or the provisions of the Florida Building Code, Residential."
807.5,Section 807 Structural,Existing Structural Elements Resisting Lateral Loads,,,,,,"Except as permitted by Section 807.6, where the alteration increases design lateral loads, or where the alteration decreases the capacity of any existing lateral load-carrying structural element, the structure of the altered building or structure shall be shown to meet the wind provisions of the Florida Building Code, Building.Exception: Any existing lateral load-carrying structural element whose demand-capacity ratio with the alteration considered is not more than 10 percent greater than its demand-capacity ratio with the alteration ignored shall be permitted to remain unaltered. For purposes of calculating demand-capacity ratios, the demand shall consider applicable load combinations with design lateral loads or forces in accordance with Florida Building Code, Building Section 1609. For purposes of this exception, comparisons of demand-capacity ratios and calculation of design lateral loads, forces and capacities shall account for the cumulative effects of additions and alterations since original construction."
807.6,Section 807 Structural,Voluntary Lateral Force-Resisting System Alterations,,,,,,"Structural alterations of that are intended exclusively to improve the lateral force-resisting system and are not required by other sections of this code shall not be required to meet the requirements of Section 1609 of the Florida Building Code, Building, provided that all of the following:The capacity of existing structural systems to resist forces is not reduced.New structural elements are detailed and connected to the existing or new structural elements as required by the Florida Building Code, Building for new construction.New or relocated nonstructural elements are detailed and connected to existing or new structural elements as required by the Florida Building Code, Building for new construction."
808.1,Section 808 Electrical,New Installations,,,,,,All newly installed electrical equipment and wiring relating to work done in any work area shall comply with all applicable requirements of NFPA 70 except as provided for in Section 808.3.
808.2,Section 808 Electrical,Existing Installations,,,,,,"Existing wiring in all work areas in Group A-1, A-2, A-5, H and I occupancies shall be upgraded to meet the materials and methods requirements of Chapter 7."
808.3,Section 808 Electrical,Residential Occupancies,,,,,,"In Group R-2, R-3 and R-4 occupancies and buildings regulated by the Florida Building Code, Residential, the requirements of Sections 808.3.1 through 808.3.7 shall be applicable only to work areas located within a dwelling unit."
808.3.1,Section 808 Electrical,Enclosed Areas,,,,,,"All enclosed areas, other than closets, kitchens, basements, garages, hallways, laundry areas, utility areas, storage areas and bathrooms shall have a minimum of two duplex receptacle outlets or one duplex receptacle outlet and one ceiling or wall-type lighting outlet."
808.3.2,Section 808 Electrical,Kitchens,,,,,,Kitchen areas shall have a minimum of two duplex receptacle outlets.
808.3.3,Section 808 Electrical,Laundry Areas,,,,,,Laundry areas shall have a minimum of one duplex receptacle outlet located near the laundry equipment and installed on an independent circuit.
808.3.4,Section 808 Electrical,Ground Fault Circuit Interruption,,,,,,Newly installed receptacle outlets shall be provided with ground fault circuit interruption as required by NFPA 70.
808.3.5,Section 808 Electrical,Minimum Lighting Outlets,,,,,,"At least one lighting outlet shall be provided in every bathroom, hallway, stairway, attached garage, and detached garage with electric power, and to illuminate outdoor entrances and exits."
808.3.6,Section 808 Electrical,Utility Rooms and Basements,,,,,,At least one lighting outlet shall be provided in utility rooms and basements where such spaces are used for storage or contain equipment requiring service.
808.3.7,Section 808 Electrical,Clearance for Equipment,,,,,,Clearance for electrical service equipment shall be provided in accordance with the NFPA 70.
809.1,Section 809 Mechanical,Reconfigured or Converted Spaces,,,,,,"All reconfigured spaces intended for occupancy and all spaces converted to habitable or occupiable space in any work area shall be provided with natural or mechanical ventilation in accordance with the Florida Building Code, Mechanical.Exception: Existing mechanical ventilation systems shall comply with the requirements of Section 809.2."
809.2,Section 809 Mechanical,Altered Existing Systems,,,,,,"In mechanically ventilated spaces, existing mechanical ventilation systems that are altered, reconfigured, or extended shall provide not less than 5 cubic feet per minute (cfm) (0.0024 m3/s) per person of outdoor air and not less than 15 cfm (0.0071 m3/s) of ventilation air per person; or not less than the amount of ventilation air determined by the Indoor Air Quality Procedure of ASHRAE 62."
809.3,Section 809 Mechanical,Local Exhaust,,,,,,"All newly introduced devices, equipment, or operations that produce airborne particulate matter, odors, fumes, vapor, combustion products, gaseous contaminants, pathogenic and allergenic organisms, and microbial contaminants in such quantities as to affect adversely or impair health or cause discomfort to occupants shall be provided with local exhaust."
