id,section,title,ifc_type,occupancy,design_phase,code_category,primary_responsibility,body
1012.5,Section 1012 Ramps,Minimum Dimensions,Ramp|RampFlight,Assembly (A)|Business (B)|Educational (E)|Institutional (I)|Residential (R),sd|dd|cd,means_of_egress,architect,The minimum dimensions of means of egress ramps shall comply with Sections 1012.5.1 through 1012.5.3.
1012.5.1,Section 1012 Ramps,Width and Capacity,Ramp|Railing,Assembly (A)|Business (B)|Educational (E)|Institutional (I)|Residential (R),sd|dd|cd,means_of_egress,architect,"The minimum width and required capacity of a means of egress ramp shall be not less than that required for corridors by Section 1020.3. The clear width of a ramp between handrails, if provided, or other permissible projections shall be 36 inches (914 mm) minimum."
1012.5.2,Section 1012 Ramps,Headroom,Ramp|Slab,Assembly (A)|Business (B)|Educational (E)|Residential (R)|Institutional (I),sd|dd|cd,means_of_egress,architect,The minimum headroom in all parts of the means of egress ramp shall be not less than 80 inches (2032 mm) above the finished floor of the ramp run and any intermediate landings. The minimum clearance shall be maintained for the full width of the ramp and landing.
1012.5.3,Section 1012 Ramps,Restrictions,Ramp|RampFlight|Door|Slab,Assembly (A)|Business (B)|Educational (E)|Factory and Industrial (F)|Residential (R),sd|dd|cd,means_of_egress,architect,Means of egress ramps shall not reduce in width in the direction of egress travel. Projections into the required ramp and landing width are prohibited. Doors opening onto a landing shall not reduce the clear width to less than 42 inches (1067 mm).
1012.6,Section 1012 Ramps,Landings,Ramp|RampFlight|Slab|Door,Assembly (A)|Business (B)|Educational (E)|Factory and Industrial (F)|Residential (R),sd|dd|cd,means_of_egress,architect,"Ramps shall have landings at the bottom and top of each ramp, points of turning, entrance, exits and at doors. Landings shall comply with Sections 1012.6.1 through 1012.6.5."
1012.6.1,Section 1012 Ramps,Slope,Slab|Ramp|Stair|StairFlight,Assembly (A)|Business (B)|Educational (E)|Residential (R)|Institutional (I),sd|dd|cd,means_of_egress,architect,Landings shall have a slope not steeper than one unit vertical in 48 units horizontal (2-percent slope) in any direction. Changes in level are not permitted.
1012.6.2,Section 1012 Ramps,Width,Ramp|RampFlight|Slab,Assembly (A)|Business (B)|Educational (E)|Factory and Industrial (F)|Residential (R),sd|dd|cd,means_of_egress,architect,The landing width shall be not less than the width of the widest ramp run adjoining the landing.
1012.6.3,Section 1012 Ramps,Length,Ramp|RampFlight|Slab,Residential (R),sd|dd|cd,accessibility,architect,"The landing length shall be 60 inches (1525 mm) minimum.Exceptions: In Group R-2 and R-3 individual dwelling and sleeping units that are not required to be Accessible units, Type A units or Type B units in accordance with Section 1108, landings are permitted to be 36 inches (914 mm) minimum.Where the ramp is not a part of an accessible route, the length of the landing shall not be required to be more than 48 inches (1219 mm) in the direction of travel."
1012.6.4,Section 1012 Ramps,Change in Direction,Ramp|RampFlight|Slab,Residential (R),sd|dd|cd,accessibility,architect,"Where changes in direction of travel occur at landings provided between ramp runs, the landing shall be 60 inches by 60 inches (1524 mm by 1524 mm) minimum.Exception: In Group R-2 and R-3 individual dwelling or sleeping units that are not required to be Accessible units, Type A units or Type B units in accordance with Section 1108, landings are permitted to be 36 inches by 36 inches (914 mm by 914 mm) minimum."
1012.6.5,Section 1012 Ramps,Doorways,Door|Ramp|Slab,Assembly (A)|Business (B)|Educational (E)|Institutional (I)|Residential (R),sd|dd|cd,accessibility,architect,"Where doorways are located adjacent to a ramp landing, maneuvering clearances required by ICC A117.1 are permitted to overlap the required landing area."
1012.7,Section 1012 Ramps,Ramp Construction,Ramp|Railing,Assembly (A)|Business (B)|Educational (E)|Residential (R)|Institutional (I),sd|dd|cd,finishes_materials,architect,"Ramps shall be built of materials consistent with the types permitted for the type of construction of the building, except that wood handrails shall be permitted for all types of construction."
1012.7.1,Section 1012 Ramps,Ramp Surface,Ramp|RampFlight|Covering,Assembly (A)|Business (B)|Educational (E)|Factory and Industrial (F)|Residential (R),sd|dd|cd,finishes_materials,architect,The surface of ramps shall be of slip-resistant materials that are securely attached.
1012.7.2,Section 1012 Ramps,Outdoor Conditions,Ramp|RampFlight|Slab|Pavement,Assembly (A)|Business (B)|Educational (E)|Mercantile (M)|Residential (R),sd|dd|cd,accessibility,architect,Outdoor ramps and outdoor approaches to ramps shall be designed so that water will not accumulate on walking surfaces.
1012.8,Section 1012 Ramps,Handrails,Ramp|Railing,Assembly (A)|Business (B)|Educational (E)|Institutional (I)|Residential (R),sd|dd|cd,means_of_egress,architect,Ramps with a rise greater than 6 inches (152 mm) shall have handrails on both sides. Handrails shall comply with Section 1014.
1012.9,Section 1012 Ramps,Guards,Railing|Stair|Ramp|Slab,Assembly (A)|Business (B)|Educational (E)|Residential (R)|Institutional (I),sd|dd|cd,means_of_egress,architect,Guards shall be provided where required by Section 1015 and shall be constructed in accordance with Section 1015.
1012.10,Section 1012 Ramps,Edge Protection,Ramp|RampFlight|Slab,Assembly (A)|Business (B)|Educational (E)|Institutional (I)|Residential (R),sd|dd|cd,accessibility,architect,"Edge protection complying with Section 1012.10.1 or 1012.10.2 shall be provided on each side of ramp runs and at each side of ramp landings.Exceptions: Edge protection is not required on ramps that are not required to have handrails, provided they have flared sides that comply with the ICC A117.1 curb ramp provisions.Edge protection is not required on the sides of ramp landings serving an adjoining ramp run or stairway.Edge protection is not required on the sides of ramp landings having a vertical dropoff of not more than 1/2 inch (12.7 mm) within 10 inches (254 mm) horizontally of the required landing area."
1012.10.1,Section 1012 Ramps,"Curb, Rail, Wall or Barrier",Kerb|Railing|Wall|Slab,Assembly (A)|Business (B)|Educational (E)|Institutional (I)|Mercantile (M),sd|dd|cd,means_of_egress,architect,"A curb, rail, wall or barrier shall be provided to serve as edge protection. A curb shall be not less than 4 inches (102 mm) in height. Barriers shall be constructed so that the barrier prevents the passage of a 4-inch-diameter (102 mm) sphere, where any portion of the sphere is within 4 inches (102 mm) of the floor or ground surface."
1012.10.2,Section 1012 Ramps,Extended Floor or Ground Surface,Ramp|Slab|Railing,Assembly (A)|Business (B)|Educational (E)|Mercantile (M)|Residential (R),sd|dd|cd,means_of_egress,architect,The floor or ground surface of the ramp run or landing shall extend 12 inches (305 mm) minimum beyond the inside face of a handrail complying with Section 1014.
1013,Chapter 10 Means of Egress,Exit Signs,,,,none,none,
1013.1,Section 1013 Exit Signs,Where Required,Door|Wall|BuildingElementProxy,Assembly (A)|Business (B)|Educational (E)|Institutional (I)|Residential (R),sd|dd|cd,means_of_egress,architect,"Exits and exit access doors shall be marked by an approved exit sign readily visible from any direction of egress travel. The path of egress travel to exits and within exits shall be marked by readily visible exit signs to clearly indicate the direction of egress travel in cases where the exit or the path of egress travel is not immediately visible to the occupants. Intervening means of egress doors within exits shall be marked by exit signs. Exit sign placement shall be such that any point in an exit access corridor or exit passageway is within 100 feet (30 480 mm) or the listed viewing distance of the sign, whichever is less, from the nearest visible exit sign.Exceptions:Exit signs are not required in rooms or areas that require only one exit or exit access.Main exterior exit doors or gates that are obviously and clearly identifiable as exits need not have exit signs where approved by the building official.Exit signs are not required in occupancies in Group U and individual sleeping units or dwelling units in Group R-1, R-2 or R-3.Exit signs are not required in dayrooms, sleeping rooms or dormitories in occupancies in Group I-3.In occupancies in Groups A-4 and A-5, exit signs are not required on the seating side of vomitories or openings into seating areas where exit signs are provided in the concourse that are readily apparent from the vomitories. Egress lighting is provided to identify each vomitory or opening within the seating area in an emergency."
1013.2,Section 1013 Exit Signs,Low-Level Exit Signs in Group R-1,Wall|Door|BuildingElementProxy,Residential (R),sd|dd|cd,means_of_egress,architect,"Where exit signs are required in Group R-1 occupancies by Section 1013.1, additional low-level exit signs shall be provided in all areas serving guest rooms in Group R-1 occupancies and shall comply with Section 1013.5.The bottom of the sign shall be not less than 10 inches (254 mm) nor more than 18 inches (455 mm) above the floor level. The sign shall be flush mounted to the door or wall. Where mounted on the wall, the edge of the sign shall be within 4 inches (102 mm) of the door frame on the latch side."
1013.3,Section 1013 Exit Signs,Illumination,Wall|Door,Assembly (A)|Business (B)|Educational (E)|Factory and Industrial (F)|Residential (R),sd|dd|cd,means_of_egress,architect,Exit signs shall be internally or externally illuminated.Exception: Tactile signs required by Section 1013.4 need not be provided with illumination.
1013.4,Section 1013 Exit Signs,Raised Character and Braille Exit Signs,Door|Ramp|Stair|StairFlight|Wall,Assembly (A)|Business (B)|Educational (E)|Residential (R)|Institutional (I),sd|dd|cd,accessibility,architect,"Where exit signs are provided at an area of refuge with direct access to a stairway, an exterior area for assisted rescue, an exit stairway or ramp, an exit passageway, a horizontal exit and the exit discharge, a sign stating ""EXIT"" in visual characters, raised characters and braille and complying with ICC A117.1 shall be provided."
1013.5,Section 1013 Exit Signs,Internally Illuminated Exit Signs,Covering,Assembly (A)|Business (B)|Educational (E)|Factory and Industrial (F)|High Hazard (H),dd|cd,fire_protection_alarm_systems,electrical_engineer,"Electrically powered, self-luminous and photoluminescent exit signs shall be listed and labeled in accordance with UL 924 and shall be installed in accordance with the manufacturer's instructions and Chapter 27. Exit signs shall be illuminated at all times."
1013.6,Section 1013 Exit Signs,Externally Illuminated Exit Signs,Door|Wall|Stair|Ramp|BuildingElementProxy,Assembly (A)|Business (B)|Educational (E)|Factory and Industrial (F)|Residential (R),sd|dd|cd,means_of_egress,architect,Externally illuminated exit signs shall comply with Sections 1013.6.1 through 1013.6.3.
1013.6.1,Section 1013 Exit Signs,Graphics,Wall|Door,Assembly (A)|Business (B)|Educational (E)|Institutional (I)|Residential (R),sd|dd|cd,means_of_egress,architect,"Every exit sign and directional exit sign shall have plainly legible letters not less than 6 inches (152 mm) high with the principal strokes of the letters not less than 3/4 inch (19.1 mm) wide. The word ""EXIT"" shall have letters having a width not less than 2 inches (51 mm) wide, except the letter ""I,"" and the minimum spacing between letters shall be not less than 3/8 inch (9.5 mm). Signs larger than the minimum established in this section shall have letter widths, strokes and spacing in proportion to their height.The word ""EXIT"" shall be in high contrast with the background and shall be clearly discernible when the means of exit sign illumination is or is not energized. If a chevron directional indicator is provided as part of the exit sign, the construction shall be such that the direction of the chevron directional indicator cannot be readily changed."
1013.6.2,Section 1013 Exit Signs,Exit Sign Illumination,Door|Wall,Assembly (A)|Business (B)|Educational (E)|Institutional (I)|Residential (R),sd|dd|cd,means_of_egress,architect,The face of an exit sign illuminated from an external source shall have an intensity of not less than 5 footcandles (54 lux).
1013.6.3,Section 1013 Exit Signs,Power Source,BuildingElementProxy,Institutional (I),cd|ca,fire_protection_alarm_systems,electrical_engineer,"Exit signs shall be illuminated at all times. To ensure continued illumination for a duration of not less than 90 minutes in case of primary power loss, the sign illumination means shall be connected to an emergency power system provided from storage batteries, unit equipment or an on-site generator. The installation of the emergency power system shall be in accordance with Chapter 27. Group I-2, Condition 2 exit sign illumination shall not be provided by unit equipment batteries only.Exception: Approved exit sign illumination types that provide continuous illumination independent of external power sources for a duration of not less than 90 minutes, in case of primary power loss, are not required to be connected to an emergency electrical system."
1014,Chapter 10 Means of Egress,Handrails,,,,none,none,
1014.1,Section 1014 Handrails,Where Required,Railing|Stair|StairFlight|Ramp|RampFlight,Assembly (A)|Business (B)|Educational (E)|Institutional (I)|Residential (R),sd|dd|cd,means_of_egress,architect,"Handrails serving flights of stairways, ramps, stepped aisles and ramped aisles shall be adequate in strength and attachment in accordance with Section 1607.9. Handrails required for flights of stairways by Section 1011.11 shall comply with Sections 1014.2 through 1014.9. Handrails required for ramps by Section 1012.8 shall comply with Sections 1014.2 through 1014.8. Handrails for stepped aisles and ramped aisles required by Section 1030.16 shall comply with Sections 1014.2 through 1014.8."
1014.2,Section 1014 Handrails,Height,Railing|Stair|StairFlight|Ramp,Residential (R)|Utility and Miscellaneous (U),sd|dd|cd,means_of_egress,architect,"Handrail height, measured above stair tread nosings, or finish surface of ramp slope, shall be uniform, not less than 34 inches (864 mm) and not more than 38 inches (965 mm). Handrail height of alternating tread devices and ships ladders, measured above tread nosings, shall be uniform, not less than 30 inches (762 mm) and not more than 34 inches (864 mm).Exceptions: Where handrail fittings or bendings are used to provide continuous transition between flights, the fittings or bendings shall be permitted to exceed the maximum height.In Group R-3 occupancies; within dwelling units in Group R-2 occupancies; and in Group U occupancies that are associated with a Group R-3 occupancy or associated with individual dwelling units in Group R-2 occupancies; where handrail fittings or bendings are used to provide continuous transition between flights, transition at winder treads, transition from handrail to guard, or where used at the start of a flight, the handrail height at the fittings or bendings shall be permitted to exceed the maximum height.Handrails on top of a guard where permitted along stepped aisles and ramped aisles in accordance with Section 1030.16."
1014.3,Section 1014 Handrails,Handrail Graspability,,,,,,"Required handrails shall comply with Section 1014.3.1 or shall provide equivalent graspability.Exception: In Group R-3 occupancies; within dwelling units in Group R-2 occupancies; and in Group U occupancies that are accessory to a Group R-3 occupancy or accessory to individual dwelling units in Group R-2 occupancies; handrails shall be Type I in accordance with Section 1014.3.1, Type II in accordance with Section 1014.3.2 or shall provide equivalent graspability."
1014.3.1,Section 1014 Handrails,Type I,,,,,,"Handrails with a circular cross section shall have an outside diameter of not less than 11/4 inches (32 mm) and not greater than 2 inches (51 mm). Where the handrail is not circular, it shall have a perimeter dimension of not less than 4 inches (102 mm) and not greater than 61/4 inches (160 mm) with a maximum cross-sectional dimension of 21/4 inches (57 mm) and minimum cross-sectional dimension of 1 inch (25 mm). Edges shall have a minimum radius of 0.01 inch (0.25 mm)."
1014.3.2,Section 1014 Handrails,Type II,,,,,,Handrails with a perimeter greater than 61/4 inches (160 mm) shall provide a graspable finger recess area on both sides of the profile. The finger recess shall begin within a distance of 3/4 inch (19 mm) measured vertically from the tallest portion of the profile and achieve a depth of not less than 5/16 inch (8 mm) within 7/8 inch (22 mm) below the widest portion of the profile. This required depth shall continue for not less than 3/8 inch (10 mm) to a level that is not less than 13/4 inches (45 mm) below the tallest portion of the profile. The width of the handrail above the recess shall be not less than 11/4 inches (32 mm) to not greater than 23/4 inches (70 mm). Edges shall have a minimum radius of 0.01 inch (0.25 mm).
1014.4,Section 1014 Handrails,Continuity,,,,,,"Handrail gripping surfaces shall be continuous, without interruption by newel posts or other obstructions.Exceptions: Handrails within dwelling units are permitted to be interrupted by a newel post at a turn or landing.Within a dwelling unit, the use of a volute, turnout, starting easing or starting newel is allowed over the lowest tread.Handrail brackets or balusters attached to the bottom surface of the handrail that do not project horizontally beyond the sides of the handrail within 11/2 inches (38 mm) of the bottom of the handrail shall not be considered obstructions. For each 1/2 inch (12.7 mm) of additional handrail perimeter dimension above 4 inches (102 mm), the vertical clearance dimension of 11/2 inches (38 mm) shall be permitted to be reduced by 1/8 inch (3.2 mm).Where handrails are provided along walking surfaces with slopes not steeper than 1:20, the bottoms of the handrail gripping surfaces shall be permitted to be obstructed along their entire length where they are integral to crash rails or bumper guards.Handrails serving stepped aisles or ramped aisles are permitted to be discontinuous in accordance with Section 1030.16.1."
1014.5,Section 1014 Handrails,Fittings,,,,,,Handrails shall not rotate within their fittings.
1014.6,Section 1014 Handrails,Handrail Extensions,,,,,,"Handrails shall return to a wall, guard or the walking surface or shall be continuous to the handrail of an adjacent flight of stairs or ramp run. Where handrails are not continuous between flights, the handrails shall extend horizontally not less than 12 inches (305 mm) beyond the top riser and continue to slope for the depth of one tread beyond the bottom riser. At ramps where handrails are not continuous between runs, the handrails shall extend horizontally above the landing 12 inches (305 mm) minimum beyond the top and bottom of ramp runs. The extensions of handrails shall be in the same direction of the flights of stairs at stairways and the ramp runs at ramps.Exceptions: Handrails within a dwelling unit that is not required to be accessible need extend only from the top riser to the bottom riser.Handrails serving aisles in rooms or spaces used for assembly purposes are permitted to comply with the handrail extensions in accordance with Section 1030.16.Handrails for alternating tread devices and ships ladders are permitted to terminate at a location vertically above the top and bottom risers. Handrails for alternating tread devices are not required to be continuous between flights or to extend beyond the top or bottom risers."
1014.7,Section 1014 Handrails,Clearance,,,,,,Clear space between a handrail and a wall or other surface shall be not less than 11/2 inches (38 mm). A handrail and a wall or other surface adjacent to the handrail shall be free of any sharp or abrasive elements.
1014.8,Section 1014 Handrails,Projections,,,,,,"On ramps and on ramped aisles that are part of an accessible route, the clear width between handrails shall be 36 inches (914 mm) minimum. Projections into the required width of aisles, stairways and ramps at each side shall not exceed 41/2 inches (114 mm) at or below the handrail height. Projections into the required width shall not be limited above the minimum headroom height required in Section 1011.3. Projections due to intermediate handrails shall not constitute a reduction in the egress width. Where a pair of intermediate handrails are provided within the stairway width without a walking surface between the pair of intermediate handrails and the distance between the pair of intermediate handrails is greater than 6 inches (152 mm), the available egress width shall be reduced by the distance between the closest edges of each such intermediate pair of handrails that is greater than 6 inches (152 mm)."
1014.9,Section 1014 Handrails,Intermediate Handrails,,,,,,"Stairways shall have intermediate handrails located in such a manner that all portions of the stairway minimum width or required capacity are within 30 inches (762 mm) of a handrail. On monumental stairs, handrails shall be located along the most direct path of egress travel."
1015,Chapter 10 Means of Egress,Guards,,,,none,none,
1015.1,Section 1015 Guards,General,Railing|Window,Assembly (A)|Business (B)|Educational (E)|Residential (R)|Institutional (I),sd|dd|cd,means_of_egress,architect,Guards shall comply with the provisions of Sections 1015.2 through 1015.7. Operable windows with sills located more than 72 inches (1829 mm) above finished grade or other surface below shall comply with Section 1015.8.
1015.2,Section 1015 Guards,Where Required,Railing|Ramp|Stair|Slab|Roof,Assembly (A)|Business (B)|Educational (E)|Institutional (I)|Residential (R),sd|dd|cd,means_of_egress,architect,"Guards shall be located along open-sided walking surfaces, including mezzanines, equipment platforms, aisles, stairs, ramps and landings that are located more than 30 inches (762 mm) measured vertically to the floor or grade below at any point within 36 inches (914 mm) horizontally to the edge of the open side. Guards shall be adequate in strength and attachment in accordance with Section 1607.9.Exceptions: Guards are not required for the following locations:On the loading side of loading docks or piers.On the audience side of stages and raised platforms, including stairs leading up to the stage and raised platforms.On raised stage and platform floor areas, such as runways, ramps and side stages used for entertainment or presentations.At vertical openings in the performance area of stages and platforms.At elevated walking surfaces appurtenant to stages and platforms for access to and utilization of special lighting or equipment.Along vehicle service pits not accessible to the public.In assembly seating areas at cross aisles in accordance with Section 1030.17.2.On the loading side of station platforms on fixed guideway transit or passenger rail systems."
1015.2.1,Section 1015 Guards,Glazing,Railing|Wall|Slab|Window,Assembly (A)|Business (B)|Educational (E)|Institutional (I)|Residential (R),sd|dd|cd,means_of_egress,architect,"Where glass is used to provide a guard or as a portion of the guard system, the guard shall comply with Section 2407. Where the glazing provided does not meet the strength and attachment requirements of Section 1607.9, complying guards shall be located along glazed sides of open-sided walking surfaces."
1015.3,Section 1015 Guards,Height,Railing|Stair|Ramp,Residential (R)|Assembly (A)|Factory and Industrial (F),sd|dd|cd,means_of_egress,architect,"Required guards shall be not less than 42 inches (1067 mm) high, measured vertically as follows:From the adjacent walking surfaces.On stairways and stepped aisles, from the line connecting the leading edges of the tread nosings.On ramps and ramped aisles, from the ramp surface at the guard.Exceptions: For occupancies in Group R-3 not more than three stories above grade in height and within individual dwelling units in occupancies in Group R-2 not more than three stories above grade in height with separate means of egress, required guards shall be not less than 36 inches (914 mm) in height measured vertically above the adjacent walking surfaces.For occupancies in Group R-3, and within individual dwelling units in occupancies in Group R-2, guards on the open sides of stairs shall have a height not less than 34 inches (864 mm) measured vertically from a line connecting the leading edges of the treads.For occupancies in Group R-3, and within individual dwelling units in occupancies in Group R-2, where the top of the guard serves as a handrail on the open sides of stairs, the top of the guard shall be not less than 34 inches (864 mm) and not more than 38 inches (965 mm) measured vertically from a line connecting the leading edges of the treads.The guard height in assembly seating areas shall comply with Section 1030.17 as applicable.Along alternating tread devices and ships ladders, guards where the top rail serves as a handrail shall have height not less than 30 inches (762 mm) and not more than 34 inches (864 mm), measured vertically from the leading edge of the device tread nosing.In Group F occupancies where exit access stairways serve fewer than three stories and such stairways are not open to the public, and where the top of the guard also serves as a handrail, the top of the guard shall be not less than 34 inches (864 mm) and not more than 38 inches (965 mm) measured vertically from a line connecting the leading edges of the treads."
