id,section,title,ifc_type,occupancy,design_phase,code_category,primary_responsibility,body
10,,Means of Egress,Stair|Ramp|Door|Wall|Slab,Assembly (A)|Business (B)|Educational (E)|Residential (R)|Institutional (I),sd|dd|cd,means_of_egress,architect,"User notes: About this chapter: Chapter 10 provides the general criteria for designing the means of egress established as the primary method for protection of people in buildings by allowing timely relocation or evacuation of building occupants. Both prescriptive and performance language is utilized in this chapter to provide for a basic approach in the determination of a safe exiting system for all occupancies. It addresses all portions of the egress system (exit access, exits and exit discharge) and includes design requirements as well as provisions regulating individual components. The requirements detail the size, arrangement, number and protection of means of egress components. Functional and operational characteristics that will permit the safe use of components without special knowledge or effort are specified. The means of egress protection requirements work in coordination with other sections of the code, such as protection of vertical openings (see Chapter 7), interior finish (see Chapter 8), fire suppression and detection systems (see Chapter 9) and numerous others, all having an impact on life safety. Chapter 10 is subdivided into four main sections: general (Sections 1003—1015), exit access (Sections 1016—1021), exit (Sections 1022—1027) and exit discharge (Sections 1028—1029). Special allowances for the unique requirements for assembly spaces (Section 1030) and emergency escape and rescue openings (Section 1031) complete the chapter. Chapter 10 of this code is duplicated in Chapter 10 of the International Fire Code®; however, the International Fire Code contains one additional section on maintenance of the means of egress system in existing buildings. Section 1010 was extensively reorganized for the 2021 edition. For complete information, see the moved sections table in the preface information for the International Building Code."
1001,Chapter 10 Means of Egress,Administration,,,,none,none,
1001.1,Section 1001 Administration,General,Door|Stair|Ramp|RampFlight|Slab,Assembly (A)|Business (B)|Educational (E)|Factory and Industrial (F)|Residential (R),sd|dd|cd,means_of_egress,architect,"Buildings or portions thereof shall be provided with a means of egress system as required by this chapter. The provisions of this chapter shall control the design, construction and arrangement of means of egress components required to provide an approved means of egress from structures and portions thereof. Where Chapter 11 and this chapter have provisions relating to the same content, both chapters apply."
1001.2,Section 1001 Administration,Minimum Requirements,Door|Stair|Ramp|Slab|Wall,Assembly (A)|Business (B)|Educational (E)|Institutional (I)|Residential (R),sd|dd|cd,means_of_egress,architect,It shall be unlawful to alter a building or structure in a manner that will reduce the number of exits or the minimum width or required capacity of the means of egress to less than required by this code.
1002,Chapter 10 Means of Egress,Maintenance and Plans,,,,none,none,
1002.1,[F] Section 1002 Maintenance and Plans,Maintenance,Door|Stair|Ramp|RampFlight|Slab,Assembly (A)|Business (B)|Educational (E)|Factory and Industrial (F)|Residential (R),cd|ca,means_of_egress,architect,Means of egress shall be maintained in accordance with the International Fire Code.
1002.2,[F] Section 1002 Maintenance and Plans,Fire Safety and Evacuation Plans,BuildingElementProxy,Assembly (A)|Business (B)|Educational (E)|Factory and Industrial (F)|Residential (R),cd|ca,fire_protection_alarm_systems,fire_protection_engineer,Fire safety and evacuation plans shall be provided for all occupancies and buildings where required by the International Fire Code. Such fire safety and evacuation plans shall comply with the applicable provisions of Sections 401.2 and 404 of the International Fire Code.
1003,Chapter 10 Means of Egress,General Means of Egress,,,,none,none,
1003.1,Section 1003 General Means of Egress,Applicability,Door|Stair|Ramp|Wall|Slab,Assembly (A)|Business (B)|Educational (E)|Mercantile (M)|Residential (R),sd|dd|cd,means_of_egress,architect,"The general requirements specified in Sections 1003 through 1015 shall apply to all three elements of the means of egress system, in addition to those specific requirements for the exit access, the exit and the exit discharge detailed elsewhere in this chapter."
1003.2,Section 1003 General Means of Egress,Ceiling Height,Roof|Slab|Stair|Ramp|Door,Assembly (A)|Business (B)|Educational (E)|Factory and Industrial (F)|Residential (R),sd|dd|cd,means_of_egress,architect,The means of egress shall have a ceiling height of not less than 7 feet 6 inches (2286 mm) above the finished floor.Exceptions: Sloped ceilings in accordance with Section 1208.2.Ceilings of dwelling units and sleeping units within residential occupancies in accordance with Section 1208.2.Allowable projections in accordance with Section 1003.3.Stair headroom in accordance with Section 1011.3.Door height in accordance with Section 1010.1.1.Ramp headroom in accordance with Section 1012.5.2.The clear height of floor levels in vehicular and pedestrian traffic areas of public and private parking garages in accordance with Section 406.2.2.Areas above and below mezzanine floors in accordance with Section 505.2.
1003.3,Section 1003 General Means of Egress,Protruding Objects,Wall|Column|Beam|Door|Railing,Assembly (A)|Business (B)|Educational (E)|Residential (R)|Mercantile (M),sd|dd|cd,accessibility,architect,Protruding objects on circulation paths shall comply with the requirements of Sections 1003.3.1 through 1003.3.4.
1003.3.1,Section 1003 General Means of Egress,Headroom,Wall|Door|Slab,Assembly (A)|Business (B)|Educational (E)|Residential (R)|Institutional (I),sd|dd|cd,means_of_egress,architect,"Protruding objects are permitted to extend below the minimum ceiling height required by Section 1003.2 where a minimum headroom of 80 inches (2032 mm) is provided over any circulation paths, including walks, corridors, aisles and passageways. Not more than 50 percent of the ceiling area of a means of egress shall be reduced in height by protruding objects.Exception: Door closers and stops shall not reduce headroom to less than 78 inches (1981 mm).A barrier shall be provided where the vertical clearance above a circulation path is less than 80 inches (2032 mm) high above the finished floor. The leading edge of such a barrier shall be located 27 inches (686 mm) maximum above the finished floor."
1003.3.2,Section 1003 General Means of Egress,Post-Mounted Objects,Railing|Sign|Ramp|Stair,Assembly (A)|Business (B)|Educational (E)|Mercantile (M)|Residential (R),sd|dd|cd,accessibility,architect,"A free-standing object mounted on a post or pylon shall not overhang that post or pylon more than 4 inches (102 mm) where the lowest point of the leading edge is more than 27 inches (686 mm) and less than 80 inches (2032 mm) above the finished floor. Where a sign or other obstruction is mounted between posts or pylons and the clear distance between the posts or pylons is greater than 12 inches (305 mm), the lowest edge of such sign or obstruction shall be 27 inches (686 mm) maximum or 80 inches (2032 mm) minimum above the finished floor or ground.Exception: These requirements shall not apply to sloping portions of handrails between the top and bottom riser of stairs and above the ramp run."
1003.3.3,Section 1003 General Means of Egress,Horizontal Projections,Wall|Railing|Stair|Ramp|Door,Assembly (A)|Business (B)|Educational (E)|Residential (R)|Mercantile (M),sd|dd|cd,accessibility,architect,Objects with leading edges more than 27 inches (685 mm) and not more than 80 inches (2030 mm) above the finished floor shall not project horizontally more than 4 inches (102 mm) into the circulation path.Exception: Handrails are permitted to protrude 41/2 inches (114 mm) from the wall or guard.
1003.3.4,Section 1003 General Means of Egress,Clear Width,Wall|Column|Beam|Railing,Assembly (A)|Business (B)|Educational (E)|Institutional (I)|Residential (R),sd|dd|cd,accessibility,architect,Protruding objects shall not reduce the minimum clear width of accessible routes.
1003.4,Section 1003 General Means of Egress,Slip-Resistant Surface,Slab|Stair|Ramp|StairFlight|RampFlight,Assembly (A)|Business (B)|Educational (E)|Residential (R)|Institutional (I),sd|dd|cd,means_of_egress,architect,Circulation paths of the means of egress shall have a slip-resistant surface and be securely attached.
1003.5,Section 1003 General Means of Egress,Elevation Change,Ramp|Stair|Slab|Railing|Covering,Assembly (A)|Business (B)|Institutional (I)|Residential (R)|Mercantile (M),sd|dd|cd,means_of_egress,architect,"Where changes in elevation of less than 12 inches (305 mm) exist in the means of egress, sloped surfaces shall be used. Where the slope is greater than one unit vertical in 20 units horizontal (5-percent slope), ramps complying with Section 1012 shall be used. Where the difference in elevation is 6 inches (152 mm) or less, the ramp shall be equipped with either handrails or floor finish materials that contrast with adjacent floor finish materials.Exceptions: Steps at exterior doors complying with Section 1010.1.4.A stair with a single riser or with two risers and a tread is permitted at locations not required to be accessible by Chapter 11 where the risers and treads comply with Section 1011.5, the minimum depth of the tread is 13 inches (330 mm) and not less than one handrail complying with Section 1014 is provided within 30 inches (762 mm) of the centerline of the normal path of egress travel on the stair.A step is permitted in aisles serving seating that has a difference in elevation less than 12 inches (305 mm) at locations not required to be accessible by Chapter 11, provided that the risers and treads comply with Section 1030.14 and the aisle is provided with a handrail complying with Section 1030.16.Throughout a story in a Group I-2 occupancy, any change in elevation in portions of the means of egress that serve nonambulatory persons shall be by means of a ramp or sloped walkway."
1003.6,Section 1003 General Means of Egress,Means of Egress Continuity,Wall|Door|Stair|Ramp|Slab,Assembly (A)|Business (B)|Educational (E)|Institutional (I)|Residential (R),sd|dd|cd,means_of_egress,architect,The path of egress travel along a means of egress shall not be interrupted by a building element other than a means of egress component as specified in this chapter. Obstructions shall not be placed in the minimum width or required capacity of a means of egress component except projections permitted by this chapter. The minimum width or required capacity of a means of egress system shall not be diminished along the path of egress travel.
1003.7,Section 1003 General Means of Egress,"Elevators, Escalators and Moving Walks",Elevators|BuildingElementProxy,Assembly (A)|Business (B)|Educational (E)|Institutional (I)|Residential (R),sd|dd|cd,means_of_egress,architect,"Elevators, escalators and moving walks shall not be used as a component of a required means of egress from any other part of the building.Exception: Elevators used as an accessible means of egress in accordance with Section 1009.4."
1004,Chapter 10 Means of Egress,Occupant Load,,,,none,none,
1004.1,Section 1004 Occupant Load,Design Occupant Load,Door|Stair|Ramp|RampFlight|Slab,Assembly (A)|Business (B)|Educational (E)|Residential (R)|Mercantile (M),sd|dd|cd,means_of_egress,architect,"In determining means of egress requirements, the number of occupants for whom means of egress facilities are provided shall be determined in accordance with this section."
1004.2,Section 1004 Occupant Load,Cumulative Occupant Loads,Wall|Door|Stair|Ramp|Slab,Assembly (A)|Business (B)|Educational (E)|Institutional (I)|Residential (R),sd|dd|cd,means_of_egress,architect,"Where the path of egress travel includes intervening rooms, areas or spaces, cumulative occupant loads shall be determined in accordance with this section."
1004.2.1,Section 1004 Occupant Load,Intervening Spaces or Accessory Areas,Wall|Door|Slab|Stair|Ramp,Assembly (A)|Business (B)|Educational (E)|Mercantile (M)|Residential (R),sd|dd|cd,means_of_egress,architect,"Where occupants egress from one or more rooms, areas or spaces through others, the design occupant load shall be the combined occupant load of interconnected accessory or intervening spaces. Design of egress path capacity shall be based on the cumulative portion of occupant loads of all rooms, areas or spaces to that point along the path of egress travel."
1004.2.2,Section 1004 Occupant Load,Adjacent Levels for Mezzanines,Slab|Stair|StairFlight|Wall|Door,Assembly (A)|Business (B)|Educational (E)|Mercantile (M)|Residential (R),sd|dd|cd,means_of_egress,architect,"That portion of the occupant load of a mezzanine with required egress through a room, area or space on an adjacent level shall be added to the occupant load of that room, area or space."
1004.2.3,Section 1004 Occupant Load,Adjacent Stories,Stair|StairFlight|Ramp|RampFlight|Door,Assembly (A)|Business (B)|Educational (E)|Residential (R)|Mercantile (M),sd|dd|cd,means_of_egress,architect,"Other than for the egress components designed for convergence in accordance with Section 1005.6, the occupant load from separate stories shall not be added."
1004.3,Section 1004 Occupant Load,Multiple Function Occupant Load,Wall|Slab|Door,Assembly (A)|Business (B)|Educational (E)|Mercantile (M)|Residential (R),sd|dd|cd,occupancy_classification,architect,"Where an area under consideration contains multiple functions having different occupant load factors, the design occupant load for such area shall be based on the floor area of each function calculated independently."
1004.4,Section 1004 Occupant Load,Multiple Occupancies,Door|Stair|Ramp|RampFlight|Slab,Assembly (A)|Business (B)|Educational (E)|Residential (R)|Mercantile (M),sd|dd|cd,means_of_egress,architect,"Where a building contains two or more occupancies, the means of egress requirements shall apply to each portion of the building based on the occupancy of that space. Where two or more occupancies utilize portions of the same means of egress system, those egress components shall meet the more stringent requirements of all occupancies that are served."
1004.5,Section 1004 Occupant Load,Areas Without Fixed Seating,Slab|Wall|BuildingElementProxy,Assembly (A)|Business (B)|Educational (E)|Residential (R)|Mercantile (M),sd|dd|cd,means_of_egress,architect,"The number of occupants shall be computed at the rate of one occupant per unit of area as prescribed in Table 1004.5. For areas without fixed seating, the occupant load shall be not less than that number determined by dividing the floor area under consideration by the occupant load factor assigned to the function of the space as set forth in Table 1004.5. Where an intended function is not listed in Table 1004.5, the building official shall establish a function based on a listed function that most nearly resembles the intended function. Exception: Where approved by the building official, the actual number of occupants for whom each occupied space, floor or building is designed, although less than those determined by calculation, shall be permitted to be used in the determination of the design occupant load. TABLE 1004.5 MAXIMUM FLOOR AREA ALLOWANCES PER OCCUPANT FUNCTION OF SPACE OCCUPANT LOAD FACTORa Accessory storage areas, mechanical equipment room 300 gross Agricultural building 300 gross Aircraft hangars 500 gross Airport terminal Baggage claim 20 gross Baggage handling 300 gross Concourse 100 gross Waiting areas 15 gross Assembly Gaming floors (keno, slots, etc.) 11 gross Exhibit gallery and museum 30 net Assembly with fixed seats See Section 1004.6 Assembly without fixed seats Concentrated (chairs only—not fixed) 7 net Standing space 5 net Unconcentrated (tables and chairs) 15 net Bowling centers, allow 5 persons for each lane including 15 feet of runway, and for additional areas 7 net Business areas 150 gross Concentrated business use areas See Section 1004.8 Courtrooms—other than fixed seating areas 40 net Day care 35 net Dormitories 50 gross Educational Classroom area 20 net Shops and other vocational room areas 50 net Exercise rooms 50 gross Group H-5 fabrication and manufacturing areas 200 gross Industrial areas 100 gross Institutional areas Inpatient treatment areas 240 gross Outpatient areas 100 gross Sleeping areas 120 gross Kitchens, commercial 200 gross Library Reading rooms 50 net Stack area 100 gross Locker rooms 50 gross Mall buildings—covered and open See Section 402.8.2 Mercantile 60 gross Storage, stock, shipping areas 300 gross Parking garages 200 gross Residential 200 gross Skating rinks, swimming pools Rink and pool 50 gross Decks 15 gross Stages and platforms 15 net Warehouses 500 gross For SI: 1 foot = 304.8 mm, 1 square foot = 0.0929 m2. Floor area in square feet per occupant."
1004.5.1,Section 1004 Occupant Load,Increased Occupant Load,Slab|Wall|Door,Assembly (A)|Business (B)|Educational (E)|Mercantile (M)|Institutional (I),sd|dd|cd,occupancy_classification,architect,"The occupant load permitted in any building, or portion thereof, is permitted to be increased from that number established for the occupancies in Table 1004.5, provided that all other requirements of the code are met based on such modified number and the occupant load does not exceed one occupant per 7 square feet (0.65 m2) of occupiable floor space. Where required by the building official, an approved aisle, seating or fixed equipment diagram substantiating any increase in occupant load shall be submitted. Where required by the building official, such diagram shall be posted."
1004.6,Section 1004 Occupant Load,Fixed Seating,Wall|Slab|Stair|Ramp|BuildingElementProxy,Assembly (A)|Educational (E)|Business (B),sd|dd|cd,occupancy_classification,architect,"For areas having fixed seats and aisles, the occupant load shall be determined by the number of fixed seats installed therein. The occupant load for areas in which fixed seating is not installed, such as waiting spaces, shall be determined in accordance with Section 1004.5 and added to the number of fixed seats.The occupant load of wheelchair spaces and the associated companion seat shall be based on one occupant for each wheelchair space and one occupant for the associated companion seat provided in accordance with Section 1109.2.3.For areas having fixed seating without dividing arms, the occupant load shall be not less than the number of seats based on one person for each 18 inches (457 mm) of seating length.The occupant load of seating booths shall be based on one person for each 24 inches (610 mm) of booth seat length measured at the backrest of the seating booth."
1004.7,Section 1004 Occupant Load,Outdoor Areas,Slab|Railing|Door|Stair|Ramp,Assembly (A)|Business (B)|Residential (R),sd|dd|cd,means_of_egress,architect,"Yards, patios, occupied roofs, courts and similar outdoor areas accessible to and usable by the building occupants shall be provided with means of egress as required by this chapter. The occupant load of such outdoor areas shall be assigned by the building official in accordance with the anticipated use. Where outdoor areas are to be used by persons in addition to the occupants of the building, and the path of egress travel from the outdoor areas passes through the building, means of egress requirements for the building shall be based on the sum of the occupant loads of the building plus the outdoor areas.Exceptions:Outdoor areas used exclusively for service of the building need only have one means of egress.Both outdoor areas associated with Group R-3 and individual dwelling units of Group R-2."
1004.8,Section 1004 Occupant Load,Concentrated Business Use Areas,Slab|Wall|Door|Window,Business (B),sd|dd|cd,occupancy_classification,architect,"The occupant load factor for concentrated business use shall be applied to telephone call centers, trading floors, electronic data processing centers and similar business use areas with a higher density of occupants than would normally be expected in a typical business occupancy environment. Where approved by the building official, the occupant load for concentrated business use areas shall be the actual occupant load, but not less than one occupant per 50 square feet (4.65 m2) of gross occupiable floor space."
1004.9,Section 1004 Occupant Load,Posting of Occupant Load,Wall|Door,Assembly (A),cd|ca,occupancy_classification,owner,"Every room or space that is an assembly occupancy shall have the occupant load of the room or space posted in a conspicuous place, near the main exit or exit access doorway from the room or space, for the intended configurations. Posted signs shall be of an approved legible permanent design and shall be maintained by the owner or the owner's authorized agent."
1005,Chapter 10 Means of Egress,Means of Egress Sizing,,,,none,none,
1005.1,Section 1005 Means of Egress Sizing,General,Wall|Door|Stair|Ramp|Slab,Assembly (A)|Business (B)|Educational (E)|Factory and Industrial (F)|Residential (R),sd|dd|cd,means_of_egress,architect,All portions of the means of egress system shall be sized in accordance with this section.Exception: Aisles and aisle accessways in rooms or spaces used for assembly purposes complying with Section 1030.
1005.2,Section 1005 Means of Egress Sizing,Minimum Width Based on Component,Door|Stair|StairFlight|Ramp|RampFlight,Assembly (A)|Business (B)|Educational (E)|Factory and Industrial (F)|Residential (R),sd|dd|cd,means_of_egress,architect,"The minimum width, in inches (mm), of any means of egress components shall be not less than that specified for such component, elsewhere in this code."
1005.3,Section 1005 Means of Egress Sizing,Required Capacity Based on Occupant Load,Door|Stair|Ramp|RampFlight|Slab,Assembly (A)|Business (B)|Educational (E)|Factory and Industrial (F)|Residential (R),sd|dd|cd,means_of_egress,architect,"The required capacity, in inches (mm), of the means of egress for any room, area, space or story shall be not less than that determined in accordance with Sections 1005.3.1 and 1005.3.2."
1005.3.1,Section 1005 Means of Egress Sizing,Stairways,Stair|StairFlight,Assembly (A)|Business (B)|Educational (E)|Factory and Industrial (F)|Institutional (I),sd|dd|cd,means_of_egress,architect,"The capacity, in inches, of means of egress stairways shall be calculated by multiplying the occupant load served by such stairways by a means of egress capacity factor of 0.3 inch (7.6 mm) per occupant. Where stairways serve more than one story, only the occupant load of each story considered individually shall be used in calculating the required capacity of the stairways serving that story.Exceptions: For other than Group H and I-2 occupancies, the capacity, in inches, of means of egress stairways shall be calculated by multiplying the occupant load served by such stairways by a means of egress capacity factor of 0.2 inch (5.1 mm) per occupant in buildings equipped throughout with an automatic sprinkler system installed in accordance with Section 903.3.1.1 or 903.3.1.2 and an emergency voice/alarm communication system in accordance with Section 907.5.2.2.Facilities with smoke-protected assembly seating shall be permitted to use the capacity factors in Table 1030.6.2 indicated for stepped aisles for exit access or exit stairways where the entire path for means of egress from the seating to the exit discharge is provided with a smoke control system complying with Section 909.Facilities with open-air assembly seating shall be permitted to the capacity factors in Section 1030.6.3 indicated for stepped aisles for exit access or exit stairways where the entire path for means of egress from the seating to the exit discharge is open to the outdoors."
1005.3.2,Section 1005 Means of Egress Sizing,Other Egress Components,Door|Ramp|RampFlight|Slab|BuildingElementProxy,Assembly (A)|Business (B)|Educational (E)|Institutional (I)|High Hazard (H),sd|dd|cd,means_of_egress,architect,"The capacity, in inches, of means of egress components other than stairways shall be calculated by multiplying the occupant load served by such component by a means of egress capacity factor of 0.2 inch (5.1 mm) per occupant.Exceptions: For other than Group H and I-2 occupancies, the capacity, in inches, of means of egress components other than stairways shall be calculated by multiplying the occupant load served by such component by a means of egress capacity factor of 0.15 inch (3.8 mm) per occupant in buildings equipped throughout with an automatic sprinkler system installed in accordance with Section 903.3.1.1 or 903.3.1.2 and an emergency voice/alarm communication system in accordance with Section 907.5.2.2.Facilities with smoke-protected assembly seating shall be permitted to use the capacity factors in Table 1030.6.2 indicated for level or ramped aisles for means of egress components other than stairways where the entire path for means of egress from the seating to the exit discharge is provided with a smoke control system complying with Section 909.Facilities with open-air assembly seating shall be permitted to the capacity factors in Section 1030.6.3 indicated for level or ramped aisles for means of egress components other than stairways where the entire path for means of egress from the seating to the exit discharge is open to the outdoors."
