id,section,title,ifc_type,occupancy,design_phase,code_category,primary_responsibility,body
1010.1.1.1,"Section 1010 Doors, Gates and Turnstiles",Projections Into Clear Opening,Door|Wall,Assembly (A)|Business (B)|Educational (E)|Factory and Industrial (F)|Residential (R),sd|dd|cd,means_of_egress,architect,"There shall not be projections into the required clear opening width lower than 34 inches (864 mm) above the floor or ground. Projections into the clear opening width between 34 inches (864 mm) and 80 inches (2032 mm) above the floor or ground shall not exceed 4 inches (102 mm).Exception: Door closers, overhead door stops, power door operators, and electromagnetic door locks shall be permitted to be 78 inches (1980 mm) minimum above the floor."
1010.1.2,"Section 1010 Doors, Gates and Turnstiles",Egress Door Types,Door,Business (B)|Factory and Industrial (F)|Institutional (I)|Residential (R)|Storage (S),sd|dd|cd,means_of_egress,architect,"Egress doors shall be of the side-hinged swinging door, pivoted door, or balanced door types.Exceptions: Private garages, office areas, factory and storage areas with an occupant load of 10 or less.Group I-3 occupancies used as a place of detention.Critical or intensive care patient rooms within suites of health care facilities.Doors within or serving a single dwelling unit in Groups R-2 and R-3.In other than Group H occupancies, revolving doors complying with Section 1010.3.1.In other than Group H occupancies, special purpose horizontal sliding, accordion or folding door assemblies complying with Section 1010.3.3.Power-operated doors in accordance with Section 1010.3.2.Doors serving a bathroom within an individual sleeping unit in Group R-1.In other than Group H occupancies, manually operated horizontal sliding doors are permitted in a means of egress from spaces with an occupant load of 10 or less."
1010.1.2.1,"Section 1010 Doors, Gates and Turnstiles",Direction of Swing,Door,Assembly (A)|Business (B)|Educational (E)|Factory and Industrial (F)|High Hazard (H),sd|dd|cd,means_of_egress,architect,"Side-hinged swinging doors, pivoted doors and balanced doors shall swing in the direction of egress travel where serving a room or area containing an occupant load of 50 or more persons or a Group H occupancy."
1010.1.3,"Section 1010 Doors, Gates and Turnstiles",Forces to Unlatch and Open Doors,Door,Assembly (A)|Business (B)|Educational (E)|Institutional (I)|Residential (R),sd|dd|cd,means_of_egress,architect,"The forces to unlatch doors shall comply with the following:Where door hardware operates by push or pull, the operational force to unlatch the door shall not exceed 15 pounds (67 N).Where door hardware operates by rotation, the operational force to unlatch the door shall not exceed 28 inch-pounds (315 N-cm).The force to open doors shall comply with the following:For interior swinging egress doors that are manually operated, other than doors required to be fire rated, the force for pushing or pulling open the door shall not exceed 5 pounds (22 N).For other swinging doors, sliding doors or folding doors, and doors required to be fire rated, the door shall require not more than a 30-pound (133 N) force to be set in motion and shall move to a full-open position when subjected to not more than a 15-pound (67 N) force."
1010.1.3.1,"Section 1010 Doors, Gates and Turnstiles",Location of Applied Forces,Door,Assembly (A)|Business (B)|Educational (E)|Institutional (I)|Residential (R),sd|dd|cd,means_of_egress,architect,Forces shall be applied to the latch side of the door.
1010.1.3.2,"Section 1010 Doors, Gates and Turnstiles",Manual Horizontal Sliding Doors,Door,Assembly (A)|Business (B)|Educational (E)|Institutional (I)|Residential (R),sd|dd|cd,means_of_egress,architect,"Where a manual horizontal sliding door is required to latch, the latch or other mechanism shall prevent the door from rebounding into a partially open position when the door is closed."
1010.1.4,"Section 1010 Doors, Gates and Turnstiles",Floor Elevation,Door|Slab|Stair,Factory and Industrial (F)|High Hazard (H)|Residential (R)|Storage (S)|Utility and Miscellaneous (U),sd|dd|cd,means_of_egress,architect,"There shall be a floor or landing on each side of a door. Such floor or landing shall be at the same elevation on each side of the door. Landings shall be level except for exterior landings, which are permitted to have a slope not to exceed 0.25 unit vertical in 12 units horizontal (2-percent slope). Exceptions: At doors serving individual dwelling units or sleeping units in Groups R-2 and R-3 : a door is permitted to open at the top step of an interior flight of stairs, provided that the door does not swing over the top step. At exterior doors serving Groups F, H, R-2 and S and where such doors are not part of an accessible route, the landing at an exterior door shall not be more than 7 inches (178 mm) below the landing on the egress side of the door, provided that the door, other than an exterior storm or screen door, does not swing over the landing. At exterior doors serving Group U and individual dwelling units and sleeping units in Groups R-2 and R-3, and where such units are not required to be Accessible units, Type A units or Type B units, the landing at an exterior doorway shall be not more than 73/4 inches (197 mm) below the landing on the egress side of the door. Such doors, including storm or screen doors, shall be permitted to swing over either landing. Variations in elevation due to differences in finish materials, but not more than 1/2 inch (12.7 mm). Exterior decks, patios or balconies that are part of Type B dwelling units or sleeping units, that have impervious surfaces and that are not more than 4 inches (102 mm) below the finished floor level of the adjacent interior space of the dwelling unit or sleeping unit. Doors serving equipment spaces not required to be accessible in accordance with Section 1103.2.9 and serving an occupant load of five or less shall be permitted to have a landing on one side to be not more than 7 inches (178 mm) above or below the landing on the egress side of the door."
1010.1.5,"Section 1010 Doors, Gates and Turnstiles",Landings at Doors,Door|Stair|StairFlight|Slab,Residential (R)|Utility and Miscellaneous (U),sd|dd|cd,means_of_egress,architect,"Landings shall have a width not less than the width of the stairway or the door, whichever is greater. Doors in the fully open position shall not reduce a required dimension by more than 7 inches (178 mm). Where a landing serves an occupant load of 50 or more, doors in any position shall not reduce the landing to less than one-half its required width. Landings shall have a length measured in the direction of travel of not less than 44 inches (1118 mm).Exception: Landing length in the direction of travel in Groups R-3 and U and within individual units of Group R-2 need not exceed 36 inches (914 mm)."
1010.1.6,"Section 1010 Doors, Gates and Turnstiles",Thresholds,Door|Slab,Residential (R),sd|dd|cd,means_of_egress,architect,"Thresholds at doorways shall not exceed 3/4 inch (19.1 mm) in height above the finished floor or landing for sliding doors serving dwelling units or 1/2 inch (12.7 mm) above the finished floor or landing for other doors. Raised thresholds and floor level changes greater than 1/4 inch (6.4 mm) at doorways shall be beveled with a slope not greater than one unit vertical in two units horizontal (50-percent slope). Exceptions: In occupancy Group R-2 or R-3, threshold heights for sliding and side-hinged exterior doors shall be permitted to be up to 73/4 inches (197 mm) in height if all of the following apply: The door is not part of the required means of egress. The door is not part of an accessible route as required by Chapter 11. The door is not part of an Accessible unit, Type A unit or Type B unit. In Type B units, where Exception 5 to Section 1010.1.4 permits a 4-inch (102 mm) elevation change at the door, the threshold height on the exterior side of the door shall not exceed 43/4 inches (120 mm) in height above the exterior deck, patio or balcony for sliding doors or 41/2 inches (114 mm) above the exterior deck, patio or balcony for other doors."
1010.1.7,"Section 1010 Doors, Gates and Turnstiles",Door Arrangement,Door|Wall,Residential (R)|Assembly (A)|Business (B)|Educational (E)|Institutional (I),sd|dd|cd,means_of_egress,architect,Space between two doors in a series shall be 48 inches (1219 mm) minimum plus the width of a door swinging into the space. Doors in a series shall swing either in the same direction or away from the space between the doors.Exceptions:The minimum distance between horizontal sliding power-operated doors in a series shall be 48 inches (1219 mm).Storm and screen doors serving individual dwelling units in Groups R-2 and R-3 need not be spaced 48 inches (1219 mm) from the other door.Doors within individual dwelling units in Groups R-2 and R-3 other than within Type A dwelling units.
1010.2,"Section 1010 Doors, Gates and Turnstiles",Door Operations,Door,Assembly (A)|Business (B)|Educational (E)|Residential (R)|Institutional (I),sd|dd|cd,means_of_egress,architect,"Except as specifically permitted by this section, egress doors shall be readily openable from the egress side without the use of a key or special knowledge or effort."
1010.2.1,"Section 1010 Doors, Gates and Turnstiles",Unlatching,Door,Assembly (A)|Business (B)|Educational (E)|Institutional (I)|Mercantile (M),sd|dd|cd,means_of_egress,architect,"The unlatching of any door or leaf for egress shall require not more than one motion in a single linear or rotational direction to release all latching and all locking devices. Exceptions: Places of detention or restraint. Where manually operated bolt locks are permitted by Section 1010.2.5. Doors with automatic flush bolts as permitted by Section 1010.2.4, Item 4. Doors from individual dwelling units and sleeping units of Group R occupancies as permitted by Section 1010.2.4, Item 5. Temporary door locking devices used in accordance with section 1010.2.16."
1010.2.2,"Section 1010 Doors, Gates and Turnstiles",Hardware,Door,Assembly (A)|Business (B)|Educational (E)|Factory and Industrial (F)|High Hazard (H),sd|dd|cd,accessibility,architect,"Door handles, pulls, latches, locks and other operating devices on doors required to be accessible by Chapter 11 shall not require tight grasping, tight pinching or twisting of the wrist to operate. Exception: Non-fixed portions of door or gate hardware, including keys, access cards and temporary door locking devices."
1010.2.3,"Section 1010 Doors, Gates and Turnstiles",Hardware Height,Door,Assembly (A)|Business (B)|Educational (E)|Mercantile (M)|Residential (R),sd|dd|cd,accessibility,architect,"Door handles, pulls, latches, locks and other operating devices shall be installed 34 inches (864 mm) minimum and 48 inches (1219 mm) maximum above the finished floor. Locks used only for security purposes and not used for normal operation are permitted at any height.Exception: Access doors or gates in barrier walls and fences protecting pools, spas and hot tubs shall be permitted to have operable parts of the latch release on self-latching devices at 54 inches (1370 mm) maximum above the finished floor or ground, provided that the self-latching devices are not also self-locking devices operated by means of a key, electronic opener or integral combination lock."
1010.2.4,"Section 1010 Doors, Gates and Turnstiles",Locks and Latches,Door,Assembly (A)|Business (B)|Factory and Industrial (F)|Institutional (I)|Mercantile (M),sd|dd|cd,means_of_egress,architect,"Locks and latches shall be permitted to prevent operation of doors where any of the following exist: Places of detention or restraint. In Group I-1, Condition 2 and Group I-2 occupancies where the clinical needs of persons receiving care require containment or where persons receiving care pose a security threat, provided that all clinical staff can readily unlock doors at all times, and all such locks are keyed to keys carried by all clinical staff at all times or all clinical staff have the codes or other means necessary to operate the locks at all times. In buildings in occupancy Group A having an occupant load of 300 or less, Groups B, F, M and S, and in places of religious worship, the main door or doors are permitted to be equipped with key-operated locking devices from the egress side provided: The locking device is readily distinguishable as locked. A readily visible durable sign is posted on the egress side on or adjacent to the door stating: THIS DOOR TO REMAIN UNLOCKED WHEN THIS SPACE IS OCCUPIED. The sign shall be in letters 1 inch (25 mm) high on a contrasting background. The use of the key-operated locking device is revocable by the building official for due cause. Where egress doors are used in pairs, approved automatic flush bolts shall be permitted to be used, provided that the door leaf having the automatic flush bolts does not have a doorknob or surface-mounted hardware. Doors from individual dwelling or sleeping units of Group R occupancies having an occupant load of 10 or less are permitted to be equipped with a night latch, dead bolt or security chain, provided such devices are openable from the inside without the use of a key or tool. Fire doors after the minimum elevated temperature has disabled the unlatching mechanism in accordance with listed fire door test procedures. Doors serving roofs not intended to be occupied shall be permitted to be locked preventing entry to the building from the roof. Other than egress courts, where occupants must egress from an exterior space through the building for means of egress, exit access doors shall be permitted to be equipped with an approved locking device where installed and operated in accordance with all of the following: The maximum occupant load shall be posted where required by Section 1004.9. Such signage shall be permanently affixed inside the building and shall be posted in a conspicuous space near all the exit access doorways. A weatherproof telephone or two-way communication system installed in accordance with Sections 1009.8.1 and 1009.8.2 shall be located adjacent to not less than one required exit access door on the exterior side. The egress door locking device is readily distinguishable as locked and shall be a key-operated locking device. A clear window or glazed door opening, not less than 5 square feet (0.46 m2) in area, shall be provided at each exit access door to determine if there are occupants using the outdoor area. A readily visible, durable sign shall be posted on the interior side on or adjacent to each locked required exit access door serving the exterior area stating, ""THIS DOOR TO REMAIN UNLOCKED WHEN THE OUTDOOR AREA IS OCCUPIED."" The letters on the sign shall be not less than 1 inch (25.4 mm) high on a contrasting background. The occupant load of the occupied exterior area shall not exceed 300 occupants in accordance with Section 1004. Locking devices are permitted on doors to balconies, decks or other exterior spaces serving individual dwelling or sleeping units. Locking devices are permitted on doors to balconies, decks or other exterior spaces of 250 square feet (23.23 m2) or less serving a private office space. Temporary door locking devices used in accordance with section 1010.2.16."
1010.2.5,"Section 1010 Doors, Gates and Turnstiles",Bolt Locks,,,,,,"Manually operated flush bolts or surface bolts are not permitted.Exceptions: On doors not required for egress in individual dwelling units or sleeping units.Where a pair of doors serves a storage or equipment room, manually operated edge- or surface-mounted bolts are permitted on the inactive leaf.Where a pair of doors serves an occupant load of less than 50 persons in a Group B, F or S occupancy, manually operated edge- or surface-mounted bolts are permitted on the inactive leaf. The inactive leaf shall not contain doorknobs, panic bars or similar operating hardware.Where a pair of doors serves a Group B, F or S occupancy, manually operated edge- or surface-mounted bolts are permitted on the inactive leaf provided that such inactive leaf is not needed to meet egress capacity requirements and the building is equipped throughout with an automatic sprinkler system in accordance with Section 903.3.1.1. The inactive leaf shall not contain doorknobs, panic bars or similar operating hardware.Where a pair of doors serves patient care rooms in Group I-2 occupancies, self-latching edge- or surface-mounted bolts are permitted on the inactive leaf provided that the inactive leaf is not needed to meet egress capacity requirements and the inactive leaf shall not contain doorknobs, panic bars or similar operating hardware."
1010.2.6,"Section 1010 Doors, Gates and Turnstiles",Closet Doors,,,,,,Closet doors that latch in the closed position shall be openable from inside the closet.
1010.2.7,"Section 1010 Doors, Gates and Turnstiles",Stairway Doors,,,,,,"Interior stairway means of egress doors shall be openable from both sides without the use of a key or special knowledge or effort.Exceptions: Stairway discharge doors shall be openable from the egress side and shall only be locked from the opposite side.This section shall not apply to doors arranged in accordance with Section 403.5.3.Stairway exit doors are permitted to be locked from the side opposite the egress side, provided that they are openable from the egress side and capable of being unlocked simultaneously without unlatching upon a signal from the fire command center, if present, or a signal by emergency personnel from a single location inside the main entrance to the building.Stairway exit doors shall be openable from the egress side and shall only be locked from the opposite side in Group B, F, M and S occupancies where the only interior access to the tenant space is from a single exit stairway where permitted in Section 1006.3.4.Stairway exit doors shall be openable from the egress side and shall only be locked from the opposite side in Group R-2 occupancies where the only interior access to the dwelling unit is from a single exit stairway where permitted in Section 1006.3.4."
1010.2.8,"Section 1010 Doors, Gates and Turnstiles",Locking Arrangements in Educational Occupancies,,,,,,"In Group E occupancies, Group B educational occupancies and Group I-4 occupancies, egress doors from classrooms, offices and other occupied rooms with locking arrangements designed to keep intruders from entering the room shall comply with all of the following conditions:The door shall be capable of being unlocked from outside the room with a key or other approved means.The door shall be openable from within the room in accordance with Section 1010.2.Modifications shall not be made to listed panic hardware, fire door hardware or door closers.Modifications to fire door assemblies shall be in accordance with NFPA 80.Remote locking or unlocking of doors from an approved location shall be permitted in addition to the unlocking operation in Item 1."
1010.2.9,"Section 1010 Doors, Gates and Turnstiles",Panic and Fire Exit Hardware,,,,,,"Swinging doors serving a Group H occupancy and swinging doors serving rooms or spaces with an occupant load of 50 or more in a Group A or E occupancy shall not be provided with a latch or lock other than panic hardware or fire exit hardware.Exceptions: A main exit of a Group A occupancy shall be permitted to have locking devices in accordance with Section 1010.2.4, Item 3.Doors provided with panic hardware or fire exit hardware and serving a Group A or E occupancy shall be permitted to be electrically locked in accordance with Section 1010.2.11 or 1010.2.12.Exit access doors serving occupied exterior areas shall be permitted to be locked in accordance with Section 1010.2.4, Item 8.Courtrooms shall be permitted to be locked in accordance with Section 1010.2.13, Item 3."
1010.2.9.1,"Section 1010 Doors, Gates and Turnstiles",Refrigeration Machinery Room,,,,,,"Refrigeration machinery rooms larger than 1,000 square feet (93 m2) shall have not less than two exit or exit access doorways that swing in the direction of egress travel and shall be equipped with panic hardware or fire exit hardware."
1010.2.9.2,"Section 1010 Doors, Gates and Turnstiles",Rooms With Electrical Equipment,,,,,,"Exit or exit access doors serving transformer vaults, rooms designated for batteries or energy storage systems, or modular data centers shall be equipped with panic hardware or fire exit hardware. Rooms containing electrical equipment rated 800 amperes or more that contain overcurrent devices, switching devices or control devices and where the exit or exit access door is less than 25 feet (7620 mm) from the equipment working space as required by NFPA 70, such doors shall not be provided with a latch or lock other than panic hardware or fire exit hardware. The doors shall swing in the direction of egress travel."
1010.2.9.3,"Section 1010 Doors, Gates and Turnstiles",Installation,,,,,,"Where panic or fire exit hardware is installed, it shall comply with the following:Panic hardware shall be listed in accordance with UL 305.Fire exit hardware shall be listed in accordance with UL 10C and UL 305.The actuating portion of the releasing device shall extend not less than one-half of the door leaf width.The maximum unlatching force shall not exceed 15 pounds (67 N)."
1010.2.9.4,"Section 1010 Doors, Gates and Turnstiles",Balanced Doors,,,,,,"If balanced doors are used and panic hardware is required, the panic hardware shall be the push-pad type and the pad shall not extend more than one-half the width of the door measured from the latch side."
1010.2.10,"Section 1010 Doors, Gates and Turnstiles",Monitored or Recorded Egress,,,,,,"Where electrical systems that monitor or record egress activity are incorporated, the locking system shall comply with Section 1010.2.11, 1010.2.12, 1010.2.13, 1010.2.14 or 1010.2.15 or shall be readily openable from the egress side without the use of a key or special knowledge or effort."
1010.2.11,"Section 1010 Doors, Gates and Turnstiles",Door Hardware Release of Electrically Locked Egress Doors,,,,,,"Door hardware release of electric locking systems shall be permitted on doors in the means of egress in any occupancy except Group H where installed and operated in accordance with all of the following:The door hardware that is affixed to the door leaf has an obvious method of operation that is readily operated under all lighting conditions.The door hardware is capable of being operated with one hand and shall comply with Section 1010.2.1.Operation of the door hardware directly interrupts the power to the electric lock and unlocks the door immediately.Loss of power to the electric locking system automatically unlocks the door.Where panic or fire exit hardware is required by Section 1010.2.9, operation of the panic or fire exit hardware also releases the electric lock.The locking system units shall be listed in accordance with UL 294."
1010.2.12,"Section 1010 Doors, Gates and Turnstiles",Sensor Release of Electrically Locked Egress Doors,,,,,,"Sensor release of electric locking systems shall be permitted on doors located in the means of egress in any occupancy except Group H where installed and operated in accordance with all of the following criteria:The sensor shall be installed on the egress side, arranged to detect an occupant approaching the doors, and shall cause the electric locking system to unlock.The electric locks shall be arranged to unlock by a signal from or loss of power to the sensor.Loss of power to the lock or locking system shall automatically unlock the electric locks.The doors shall be arranged to unlock from a manual unlocking device located 40 inches to 48 inches (1016 mm to 1219 mm) vertically above the floor and within 5 feet (1524 mm) of the secured doors. Ready access shall be provided to the manual unlocking device and the device shall be clearly identified by a sign that reads ""PUSH TO EXIT."" When operated, the manual unlocking device shall result in direct interruption of power to the electric lock—independent of other electronics—and the electric lock shall remain unlocked for not less than 30 seconds.Activation of the building fire alarm system, where provided, shall automatically unlock the electric lock, and the electric lock shall remain unlocked until the fire alarm system has been reset.Activation of the building automatic sprinkler system or fire detection system, where provided, shall automatically unlock the electric lock. The electric lock shall remain unlocked until the fire alarm system has been reset.Emergency lighting shall be provided on the egress side of the door.The door locking system units shall be listed in accordance with UL 294."
1010.2.13,"Section 1010 Doors, Gates and Turnstiles",Delayed Egress,,,,,,"Delayed egress locking systems shall be permitted to be installed on doors serving the following occupancies in buildings that are equipped throughout with an automatic sprinkler system in accordance with Section 903.3.1.1 or an approved automatic smoke or heat detection system installed in accordance with Section 907.Group B, F, I, M, R, S and U occupancies.Group E classrooms with an occupant load of less than 50.In courtrooms in Group A-3 and B occupancies, delayed egress locking systems shall be permitted to be installed on exit or exit access doors, other than the main exit or exit access door, in buildings that are equipped throughout with an automatic sprinkler system in accordance with Section 903.3.1.1."
