id,section,title,body
2109.2.4.8.9.1,Section 2109 Empirical Design of Adobe Masonry,General,"Clay plaster shall be any plaster having a clay or clay subsoil binder. Such plaster shall contain sufficient clay to fully bind the aggregate and shall be permitted to contain reinforcing fibers. Acceptable reinforcing fibers include chopped straw, sisal, and animal hair."
2109.2.4.8.9.2,Section 2109 Empirical Design of Adobe Masonry,Clay Subsoil Requirements,The suitability of clay subsoil shall be determined in accordance with the Figure 2 Ribbon Test and the Figure 3 Ball Test in the appendix of ASTM E2392/E2392M.
2109.2.4.8.9.3,Section 2109 Empirical Design of Adobe Masonry,Weather-Exposed Locations,Clay plaster exposed to water from direct or wind-driven rain or snow shall be finished with an approved erosion-resistant finish. The use of clay plasters shall not be permitted on weather-exposed parapets.
2109.2.4.8.9.4,Section 2109 Empirical Design of Adobe Masonry,Prohibited Finish Coat,Plaster containing Portland cement shall not be permitted as a finish over clay plaster.
2109.2.4.8.9.5,Section 2109 Empirical Design of Adobe Masonry,Conditions Where Lathing Is Not Required,"For unstabilized adobe walls finished with unstabilized clay plaster, lathing shall not be required."
2109.2.4.9,Section 2109 Empirical Design of Adobe Masonry,Lintels,Lintels shall be considered to be structural members and shall be designed in accordance with the applicable provisions of Chapter 16.
2110,Chapter 21 Masonry,Glass Unit Masonry,
2110.1,Section 2110 Glass Unit Masonry,General,Glass unit masonry construction shall comply with Chapter 13 of TMS 402 and this section.
2110.1.1,Section 2110 Glass Unit Masonry,Limitations,"Solid or hollow approved glass block shall not be used in fire walls, party walls, fire barriers, fire partitions or smoke barriers, or for load-bearing construction. Such blocks shall be erected with mortar and reinforcement in metal channel-type frames, structural frames, masonry or concrete recesses, embedded panel anchors as provided for both exterior and interior walls or other approved joint materials. Wood strip framing shall not be used in walls required to have a fire-resistance rating by other provisions of this code.Exceptions: Glass-block assemblies having a fire protection rating of not less than 3/4 hour shall be permitted as opening protectives in accordance with Section 716 in fire barriers, fire partitions and smoke barriers that have a required fire-resistance rating of 1 hour or less and do not enclose exit stairways and ramps or exit passageways.Glass-block assemblies as permitted in Section 404.6, Exception 2."
2111,Chapter 21 Masonry,Masonry Fireplaces,
2111.1,Section 2111 Masonry Fireplaces,General,"The construction of masonry fireplaces, consisting of concrete or masonry, shall be in accordance with this section."
2111.2,Section 2111 Masonry Fireplaces,Fireplace Drawings,"The construction documents shall describe in sufficient detail the location, size and construction of masonry fireplaces. The thickness and characteristics of materials and the clearances from walls, partitions and ceilings shall be indicated."
2111.3,Section 2111 Masonry Fireplaces,Footings and Foundations,"Footings for masonry fireplaces and their chimneys shall be constructed of concrete or solid masonry not less than 12 inches (305 mm) thick and shall extend not less than 6 inches (153 mm) beyond the face of the fireplace or foundation wall on all sides. Footings shall be founded on natural undisturbed earth or engineered fill below frost depth. In areas not subjected to freezing, footings shall be not less than 12 inches (305 mm) below finished grade."
2111.3.1,Section 2111 Masonry Fireplaces,Ash Dump Cleanout,"Cleanout openings, located within foundation walls below fireboxes, where provided, shall be equipped with ferrous metal or masonry doors and frames constructed to remain tightly closed, except when in use. Cleanouts shall be accessible and located so that ash removal will not create a hazard to combustible materials."
2111.4,Section 2111 Masonry Fireplaces,Seismic Reinforcement,"In structures assigned to Seismic Design Category A or B, seismic reinforcement is not required. In structures assigned to Seismic Design Category C or D, masonry fireplaces shall be reinforced and anchored in accordance with Sections 2111.4.1, 2111.4.2 and 2111.5. In structures assigned to Seismic Design Category E or F, masonry fireplaces shall be reinforced in accordance with the requirements of Sections 2101 through 2108."
2111.4.1,Section 2111 Masonry Fireplaces,Vertical Reinforcing,"For fireplaces with chimneys up to 40 inches (1016 mm) wide, four No. 4 continuous vertical bars, anchored in the foundation, shall be placed in the concrete between wythes of solid masonry or within the cells of hollow unit masonry and grouted in accordance with Section 2103.3. For fireplaces with chimneys greater than 40 inches (1016 mm) wide, two additional No. 4 vertical bars shall be provided for each additional 40 inches (1016 mm) in width or fraction thereof."
2111.4.2,Section 2111 Masonry Fireplaces,Horizontal Reinforcing,"Vertical reinforcement shall be placed enclosed within 1/4-inch (6.4 mm) ties or other reinforcing of equivalent net cross-sectional area, spaced not to exceed 18 inches (457 mm) on center in concrete; or placed in the bed joints of unit masonry at not less than every 18 inches (457 mm) of vertical height. Two such ties shall be provided at each bend in the vertical bars."
2111.5,Section 2111 Masonry Fireplaces,Seismic Anchorage,"Masonry fireplaces and foundations shall be anchored at each floor, ceiling or roof line more than 6 feet (1829 mm) above grade with two 3/16-inch by 1-inch (4.8 mm by 25 mm) straps embedded not less than 12 inches (305 mm) into the chimney. Straps shall be hooked around the outer bars and extend 6 inches (152 mm) beyond the bend. Each strap shall be fastened to not fewer than four floor joists with two 1/2-inch (12.7 mm) bolts.Exception: Seismic anchorage is not required for the following:In structures assigned to Seismic Design Category A or B.Where the masonry fireplace is constructed completely within the exterior walls."
2111.6,Section 2111 Masonry Fireplaces,Firebox Walls,"Masonry fireboxes shall be constructed of solid masonry units, hollow masonry units grouted solid, stone or concrete. Where a lining of firebrick not less than 2 inches (51 mm) in thickness or other approved lining is provided, the minimum thickness of back and sidewalls shall each be 8 inches (203 mm) of solid masonry, including the lining. The width of joints between firebricks shall be not greater than 1/4 inch (6.4 mm). Where a lining is not provided, the total minimum thickness of back and sidewalls shall be 10 inches (254 mm) of solid masonry. Firebrick shall conform to ASTM C27 or ASTM C1261 and shall be laid with medium-duty refractory mortar conforming to ASTM C199."
2111.6.1,Section 2111 Masonry Fireplaces,Steel Fireplace Units,"Steel fireplace units are permitted to be installed with solid masonry to form a masonry fireplace provided that they are installed according to either the requirements of their listing or the requirements of this section. Steel fireplace units incorporating a steel firebox lining shall be constructed with steel not less than 1/4 inch (6.4 mm) in thickness, and an air-circulating chamber that is ducted to the interior of the building. The firebox lining shall be encased with solid masonry to provide a total thickness at the back and sides of not less than 8 inches (203 mm), of which not less than 4 inches (102 mm) shall be of solid masonry or concrete. Circulating air ducts employed with steel fireplace units shall be constructed of metal or masonry."
2111.7,Section 2111 Masonry Fireplaces,Firebox Dimensions,"The firebox of a concrete or masonry fireplace shall have a minimum depth of 20 inches (508 mm). The throat shall be not less than 8 inches (203 mm) above the fireplace opening. The throat opening shall be not less than 4 inches (102 mm) in depth. The cross-sectional area of the passageway above the firebox, including the throat, damper and smoke chamber, shall be not less than the cross-sectional area of the flue.Exception: Rumford fireplaces shall be permitted provided that the depth of the fireplace is not less than 12 inches (305 mm) and not less than one-third of the width of the fireplace opening, and the throat is not less than 12 inches (305 mm) above the lintel, and not less than 1/20 the cross-sectional area of the fireplace opening."
2111.8,Section 2111 Masonry Fireplaces,Lintel and Throat,Masonry over a fireplace opening shall be supported by a lintel of noncombustible material. The minimum required bearing length on each end of the fireplace opening shall be 4 inches (102 mm). The fireplace throat or damper shall be located not less than 8 inches (203 mm) above the top of the fireplace opening.
2111.8.1,Section 2111 Masonry Fireplaces,Damper,"Masonry fireplaces shall be equipped with a ferrous metal damper located not less than 8 inches (203 mm) above the top of the fireplace opening. Dampers shall be installed in the fireplace or at the top of the flue venting the fireplace, and shall be operable from the room containing the fireplace. Damper controls shall be permitted to be located in the fireplace."
2111.9,Section 2111 Masonry Fireplaces,Smoke Chamber Walls,"Smoke chamber walls shall be constructed of solid masonry units, hollow masonry units grouted solid, stone or concrete. The total minimum thickness of front, back and sidewalls shall be 8 inches (203 mm) of solid masonry. The inside surface shall be parged smooth with refractory mortar conforming to ASTM C199. Where a lining of firebrick not less than 2 inches (51 mm) thick, or a lining of vitrified clay not less than 5/8 inch (15.9 mm) thick, is provided, the total minimum thickness of front, back and sidewalls shall be 6 inches (152 mm) of solid masonry, including the lining. Firebrick shall conform to ASTM C1261 and shall be laid with refractory mortar conforming to ASTM C199. Vitrified clay linings shall conform to ASTM C315."
2111.9.1,Section 2111 Masonry Fireplaces,Smoke Chamber Dimensions,"The inside height of the smoke chamber from the fireplace throat to the beginning of the flue shall be not greater than the inside width of the fireplace opening. The inside surface of the smoke chamber shall not be inclined more than 45 degrees (0.76 rad) from vertical where prefabricated smoke chamber linings are used or where the smoke chamber walls are rolled or sloped rather than corbeled. Where the inside surface of the smoke chamber is formed by corbeled masonry, the walls shall not be corbeled more than 30 degrees (0.52 rad) from vertical."
2111.10,Section 2111 Masonry Fireplaces,Hearth and Hearth Extension,"Masonry fireplace hearths and hearth extensions shall be constructed of concrete or masonry, supported by noncombustible materials, and reinforced to carry their own weight and all imposed loads. Combustible material shall not remain against the underside of hearths or hearth extensions after construction."
2111.10.1,Section 2111 Masonry Fireplaces,Hearth Thickness,The minimum thickness of fireplace hearths shall be 4 inches (102 mm).
2111.10.2,Section 2111 Masonry Fireplaces,Hearth Extension Thickness,"The minimum thickness of hearth extensions shall be 2 inches (51 mm).Exception: Where the bottom of the firebox opening is raised not less than 8 inches (203 mm) above the top of the hearth extension, a hearth extension of not less than 3/8-inch-thick (9.5 mm) brick, concrete, stone, tile or other approved noncombustible material is permitted."
2111.11,Section 2111 Masonry Fireplaces,Hearth Extension Dimensions,"Hearth extensions shall extend not less than 16 inches (406 mm) in front of, and not less than 8 inches (203 mm) beyond, each side of the fireplace opening. Where the fireplace opening is 6 square feet (0.557 m2) or larger, the hearth extension shall extend not less than 20 inches (508 mm) in front of, and not less than 12 inches (305 mm) beyond, each side of the fireplace opening."
2111.12,Section 2111 Masonry Fireplaces,Fireplace Clearance,"Any portion of a masonry fireplace located in the interior of a building or within the exterior wall of a building shall have a clearance to combustibles of not less than 2 inches (51 mm) from the front faces and sides of masonry fireplaces and not less than 4 inches (102 mm) from the back faces of masonry fireplaces. The airspace shall not be filled, except to provide fireblocking in accordance with Section 2111.13. Exceptions: Masonry fireplaces listed and labeled for use in contact with combustibles in accordance with UL 127 and installed in accordance with the manufacturer's instructions are permitted to have combustible material in contact with their exterior surfaces. Where masonry fireplaces are constructed as part of masonry or concrete walls, combustible materials shall not be in contact with the masonry or concrete walls less than 12 inches (306 mm) from the inside surface of the nearest firebox lining. Exposed combustible trim and the edges of sheathing materials, such as wood siding, flooring and drywall, are permitted to abut the masonry fireplace sidewalls and hearth extension, in accordance with Figure 2111.12, provided that such combustible trim or sheathing is not less than 12 inches (306 mm) from the inside surface of the nearest firebox lining. Exposed combustible mantels or trim is permitted to be placed directly on the masonry fireplace front surrounding the fireplace opening, provided that such combustible materials shall not be placed within 6 inches (153 mm) of a fireplace opening. Combustible material directly above and within 12 inches (305 mm) of the fireplace opening shall not project more than 1/8 inch (3.2 mm) for each 1-inch (25 mm) distance from such opening. Combustible materials located along the sides of the fireplace opening that project more than 11/2 inches (38 mm) from the face of the fireplace shall have an additional clearance equal to the projection. For SI: 1 inch = 25.4 mm FIGURE 2111.12 ILLUSTRATION OF EXCEPTION TO FIREPLACE CLEARANCE PROVISION"
2111.13,Section 2111 Masonry Fireplaces,Fireplace Fireblocking,"All spaces between fireplaces and floors and ceilings through which fireplaces pass shall be fireblocked with noncombustible material securely fastened in place. The fireblocking of spaces between wood joists, beams or headers shall be to a depth of 1 inch (25 mm) and shall only be placed on strips of metal or metal lath laid across the spaces between combustible material and the chimney."
2111.14,Section 2111 Masonry Fireplaces,Exterior Air,Factory-built or masonry fireplaces covered in this section shall be equipped with an exterior air supply to ensure proper fuel combustion unless the room is mechanically ventilated and controlled so that the indoor pressure is neutral or positive.
2111.14.1,Section 2111 Masonry Fireplaces,Factory-Built Fireplaces,"Exterior combustion air ducts for factory-built fireplaces shall be listed components of the fireplace, and installed according to the fireplace manufacturer's instructions."
2111.14.2,Section 2111 Masonry Fireplaces,Masonry Fireplaces,Listed combustion air ducts for masonry fireplaces shall be installed according to the terms of their listing and manufacturer's instructions.
2111.14.3,Section 2111 Masonry Fireplaces,Exterior Air Intake,"The exterior air intake shall be capable of providing all combustion air from the exterior of the dwelling. The exterior air intake shall not be located within a garage, attic, basement or crawl space of the dwelling nor shall the air intake be located at an elevation higher than the firebox. The exterior air intake shall be covered with a corrosion-resistant screen of 1/4-inch (6.4 mm) mesh."
2111.14.4,Section 2111 Masonry Fireplaces,Clearance,Unlisted combustion air ducts shall be installed with a minimum 1-inch (25 mm) clearance to combustibles for all parts of the duct within 5 feet (1524 mm) of the duct outlet.
2111.14.5,Section 2111 Masonry Fireplaces,Passageway,"The combustion air passageway shall be not less than 6 square inches (3870 mm2) and not more than 55 square inches (0.035 m2), except that combustion air systems for listed fireplaces or for fireplaces tested for emissions shall be constructed according to the fireplace manufacturer's instructions."
2111.14.6,Section 2111 Masonry Fireplaces,Outlet,The exterior air outlet is permitted to be located in the back or sides of the firebox chamber or within 24 inches (610 mm) of the firebox opening on or near the floor. The outlet shall be closable and designed to prevent burning material from dropping into concealed combustible spaces.
2112,Chapter 21 Masonry,Masonry Heaters,
2112.1,Section 2112 Masonry Heaters,Definition,"A masonry heater is a heating appliance constructed of concrete or solid masonry, hereinafter referred to as ""masonry,"" which is designed to absorb and store heat from a solid fuel fire built in the firebox by routing the exhaust gases through internal heat exchange channels in which the flow path downstream of the firebox includes flow in either a horizontal or downward direction before entering the chimney and which delivers heat by radiation from the masonry surface of the heater."
2112.2,Section 2112 Masonry Heaters,Installation,Masonry heaters shall be installed in accordance with this section and comply with one of the following:Masonry heaters shall comply with the requirements of ASTM E1602.Masonry heaters shall be listed and labeled in accordance with UL 1482 or EN 15250 and installed in accordance with the manufacturer's instructions.
2112.3,Section 2112 Masonry Heaters,Footings and Foundation,The firebox floor of a masonry heater shall be a minimum thickness of 4 inches (102 mm) of noncombustible material and be supported on a noncombustible footing and foundation in accordance with Section 2113.2.
2112.4,Section 2112 Masonry Heaters,Seismic Reinforcing,"In structures assigned to Seismic Design Category D, E or F, masonry heaters shall be anchored to the masonry foundation in accordance with Section 2113.3. Seismic reinforcing shall not be required within the body of a masonry heater with a height that is equal to or less than 3.5 times its body width and where the masonry chimney serving the heater is not supported by the body of the heater. Where the masonry chimney shares a common wall with the facing of the masonry heater, the chimney portion of the structure shall be reinforced in accordance with Section 2113."
2112.5,Section 2112 Masonry Heaters,Masonry Heater Clearance,"Combustible materials shall not be placed within 36 inches (914 mm) or the distance of the allowed reduction method from the outside surface of a masonry heater in accordance with NFPA 211, Section 12.6, and the required space between the heater and combustible material shall be fully vented to permit the free flow of air around all heater surfaces.Exceptions: Where the masonry heater wall thickness is not less than 8 inches (203 mm) of solid masonry and the wall thickness of the heat exchange channels is not less than 5 inches (127 mm) of solid masonry, combustible materials shall not be placed within 4 inches (102 mm) of the outside surface of a masonry heater. A clearance of not less than 8 inches (203 mm) shall be provided between the gas-tight capping slab of the heater and a combustible ceiling.Masonry heaters listed and labeled in accordance with UL 1482 or EN 15250 and installed in accordance with the manufacturer's instructions."
2113,Chapter 21 Masonry,Masonry Chimneys,
2113.1,Section 2113 Masonry Chimneys,General,"The construction of masonry chimneys consisting of solid masonry units, hollow masonry units grouted solid, stone or concrete shall be in accordance with this section."
2113.2,Section 2113 Masonry Chimneys,Footings and Foundations,"Footings for masonry chimneys shall be constructed of concrete or solid masonry not less than 12 inches (305 mm) thick and shall extend not less than 6 inches (152 mm) beyond the face of the foundation or support wall on all sides. Footings shall be founded on natural undisturbed earth or engineered fill below frost depth. In areas not subjected to freezing, footings shall be not less than 12 inches (305 mm) below finished grade."
2113.3,Section 2113 Masonry Chimneys,Seismic Reinforcement,"In structures assigned to Seismic Design Category A or B, seismic reinforcement is not required. In structures assigned to Seismic Design Category C or D, masonry chimneys shall be reinforced and anchored in accordance with Sections 2113.3.1, 2113.3.2 and 2113.4. In structures assigned to Seismic Design Category E or F, masonry chimneys shall be reinforced in accordance with the requirements of Sections 2101 through 2108 and anchored in accordance with Section 2113.4."
2113.3.1,Section 2113 Masonry Chimneys,Vertical Reinforcement,"For chimneys up to 40 inches (1016 mm) wide, four No. 4 continuous vertical bars anchored in the foundation shall be placed in the concrete between wythes of solid masonry or within the cells of hollow unit masonry and grouted in accordance with Section 2103.3. Grout shall be prevented from bonding with the flue liner so that the flue liner is free to move with thermal expansion. For chimneys greater than 40 inches (1016 mm) wide, two additional No. 4 vertical bars shall be provided for each additional 40 inches (1016 mm) in width or fraction thereof."
2113.3.2,Section 2113 Masonry Chimneys,Horizontal Reinforcement,"Vertical reinforcement shall be placed enclosed within 1/4-inch (6.4 mm) ties, or other reinforcing of equivalent net cross-sectional area, spaced not to exceed 18 inches (457 mm) on center in concrete, or placed in the bed joints of unit masonry, at not less than every 18 inches (457 mm) of vertical height. Two such ties shall be provided at each bend in the vertical bars."
2113.4,Section 2113 Masonry Chimneys,Seismic Anchorage,"Masonry chimneys and foundations shall be anchored at each floor, ceiling or roof line more than 6 feet (1829 mm) above grade with two 3/16-inch by 1-inch (4.8 mm by 25 mm) straps embedded not less than 12 inches (305 mm) into the chimney. Straps shall be hooked around the outer bars and extend 6 inches (152 mm) beyond the bend. Each strap shall be fastened to not less than four floor joists with two 1/2-inch (12.7 mm) bolts.Exception: Seismic anchorage is not required for the following:In structures assigned to Seismic Design Category A or B.Where the masonry fireplace is constructed completely within the exterior walls."
2113.5,Section 2113 Masonry Chimneys,Corbeling,"Masonry chimneys shall not be corbeled more than half of the chimney's wall thickness from a wall or foundation, nor shall a chimney be corbeled from a wall or foundation that is less than 12 inches (305 mm) in thickness unless it projects equally on each side of the wall, except that on the second story of a two-story dwelling, corbeling of chimneys on the exterior of the enclosing walls is permitted to equal the wall thickness. The projection of a single course shall not exceed one-half the unit height or one-third of the unit bed depth, whichever is less."
2113.6,Section 2113 Masonry Chimneys,Changes in Dimension,"The chimney wall or chimney flue lining shall not change in size or shape within 6 inches (152 mm) above or below where the chimney passes through floor components, ceiling components or roof components."
2113.7,Section 2113 Masonry Chimneys,Offsets,"Where a masonry chimney is constructed with a fireclay flue liner surrounded by one wythe of masonry, the maximum offset shall be such that the centerline of the flue above the offset does not extend beyond the center of the chimney wall below the offset. Where the chimney offset is supported by masonry below the offset in an approved manner, the maximum offset limitations shall not apply. Each individual corbeled masonry course of the offset shall not exceed the projection limitations specified in Section 2113.5."
2113.8,Section 2113 Masonry Chimneys,Additional Load,Chimneys shall not support loads other than their own weight unless they are designed and constructed to support the additional load. Masonry chimneys are permitted to be constructed as part of the masonry walls or concrete walls of the building.
2113.9,Section 2113 Masonry Chimneys,Termination,"Chimneys shall extend not less than 2 feet (610 mm) higher than any portion of the building within 10 feet (3048 mm), but shall be not less than 3 feet (914 mm) above the highest point where the chimney passes through the roof."
2113.9.1,Section 2113 Masonry Chimneys,Chimney Caps,"Masonry chimneys shall have a concrete, metal or stone cap, sloped to shed water, a drip edge and a caulked bond break around any flue liners in accordance with ASTM C1283."
2113.9.2,Section 2113 Masonry Chimneys,Spark Arrestors,"Where a spark arrestor is installed on a masonry chimney, the spark arrestor shall meet all of the following requirements:The net free area of the arrestor shall be not less than four times the net free area of the outlet of the chimney flue it serves.The arrestor screen shall have heat and corrosion resistance equivalent to 19-gage galvanized steel or 24-gage stainless steel.Openings shall not permit the passage of spheres having a diameter greater than 1/2 inch (12.7 mm) nor block the passage of spheres having a diameter less than 3/8 inch (9.5 mm).The spark arrestor shall be accessible for cleaning and the screen or chimney cap shall be removable to allow for cleaning of the chimney flue."
