id,section,title,body
2113.9.3,Section 2113 Masonry Chimneys,Rain Caps,"Where a masonry or metal rain cap is installed on a masonry chimney, the net free area under the cap shall be not less than four times the net free area of the outlet of the chimney flue it serves."
2113.10,Section 2113 Masonry Chimneys,Wall Thickness,"Masonry chimney walls shall be constructed of concrete, solid masonry units or hollow masonry units grouted solid with not less than 4 inches (102 mm) nominal thickness."
2113.10.1,Section 2113 Masonry Chimneys,Masonry Veneer Chimneys,"Where masonry is used as veneer for a framed chimney, through flashing and weep holes shall be provided as required by Chapter 14."
2113.11,Section 2113 Masonry Chimneys,Flue Lining (Material),"Masonry chimneys shall be lined. The lining material shall be appropriate for the type of appliance connected, according to the terms of the appliance listing and the manufacturer's instructions."
2113.11.1,Section 2113 Masonry Chimneys,Residential-Type Appliances (General),"Flue lining systems shall comply with one of the following:Clay flue lining complying with the requirements of ASTM C315.Listed chimney lining systems complying with UL 1777.Factory-built chimneys or chimney units listed for installation within masonry chimneys.Other approved materials that will resist corrosion, erosion, softening or cracking from flue gases and condensate at temperatures up to 1,800°F (982°C)."
2113.11.1.1,Section 2113 Masonry Chimneys,Flue Linings for Specific Appliances,"Flue linings other than those covered in Section 2113.11.1 intended for use with specific appliances shall comply with Sections 2113.11.1.2 through 2113.11.1.4, 2113.11.2 and 2113.11.3."
2113.11.1.2,Section 2113 Masonry Chimneys,Gas Appliances,Flue lining systems for gas appliances shall be in accordance with the Mechanical Code.
2113.11.1.3,Section 2113 Masonry Chimneys,Pellet Fuel-Burning Appliances,Flue lining and vent systems for use in masonry chimneys with pellet fuel-burning appliances shall be limited to flue lining systems complying with Section 2113.11.1 and pellet vents listed for installation within masonry chimneys (see Section 2113.11.1.5 for marking).
2113.11.1.4,Section 2113 Masonry Chimneys,Oil-Fired Appliances Approved for Use With L-Vent,Flue lining and vent systems for use in masonry chimneys with oil-fired appliances approved for use with Type L vent shall be limited to flue lining systems complying with Section 2113.11.1 and listed chimney liners complying with UL 641 (see Section 2113.11.1.5 for marking).
2113.11.1.5,Section 2113 Masonry Chimneys,Notice of Usage,"When a flue is relined with a material not complying with Section 2113.11.1, the chimney shall be plainly and permanently identified by a label attached to a wall, ceiling or other conspicuous location adjacent to where the connector enters the chimney. The label shall include the following message or equivalent language: ""This chimney is for use only with (type or category of appliance) that burns (type of fuel). Do not connect other types of appliances."""
2113.11.2,Section 2113 Masonry Chimneys,Concrete and Masonry Chimneys for Medium-Heat Appliances,Concrete and masonry chimneys for medium-heat appliances shall comply with Sections 2113.11.2.1 through 2113.11.2.5.
2113.11.2.1,Section 2113 Masonry Chimneys,Construction,"Chimneys for medium-heat appliances shall be constructed of solid masonry units or of concrete with walls not less than 8 inches (203 mm) thick, or with stone masonry not less than 12 inches (305 mm) thick."
2113.11.2.2,Section 2113 Masonry Chimneys,Lining,Concrete and masonry chimneys shall be lined with an approved medium-duty refractory brick not less than 41/2 inches (114 mm) thick laid on the 41/2-inch bed (114 mm) in an approved medium-duty refractory mortar. The lining shall start 2 feet (610 mm) or more below the lowest chimney connector entrance. Chimneys terminating 25 feet (7620 mm) or less above a chimney connector entrance shall be lined to the top.
2113.11.2.3,Section 2113 Masonry Chimneys,Multiple Passageway,Concrete and masonry chimneys containing more than one passageway shall have the liners separated by a minimum 4-inch-thick (102 mm) concrete or solid masonry wall.
2113.11.2.4,Section 2113 Masonry Chimneys,Termination Height,Concrete and masonry chimneys for medium-heat appliances shall extend not less than 10 feet (3048 mm) higher than any portion of any building within 25 feet (7620 mm).
2113.11.2.5,Section 2113 Masonry Chimneys,Clearance,A minimum clearance of 4 inches (102 mm) shall be provided between the exterior surfaces of a concrete or masonry chimney for medium-heat appliances and combustible material.
2113.11.3,Section 2113 Masonry Chimneys,Concrete and Masonry Chimneys for High-Heat Appliances,Concrete and masonry chimneys for high-heat appliances shall comply with 2113.11.3.1 through 2113.11.3.4.
2113.11.3.1,Section 2113 Masonry Chimneys,Construction,"Chimneys for high-heat appliances shall be constructed with double walls of solid masonry units or of concrete, each wall to be not less than 8 inches (203 mm) thick with a minimum airspace of 2 inches (51 mm) between the walls."
2113.11.3.2,Section 2113 Masonry Chimneys,Lining,"The inside of the interior wall shall be lined with an approved high-duty refractory brick, not less than 41/2 inches (114 mm) thick laid on the 41/2-inch bed (114 mm) in an approved high-duty refractory mortar. The lining shall start at the base of the chimney and extend continuously to the top."
2113.11.3.3,Section 2113 Masonry Chimneys,Termination Height,Concrete and masonry chimneys for high-heat appliances shall extend not less than 20 feet (6096 mm) higher than any portion of any building within 50 feet (15 240 mm).
2113.11.3.4,Section 2113 Masonry Chimneys,Clearance,"Concrete and masonry chimneys for high-heat appliances shall have approved clearance from buildings and structures to prevent overheating combustible materials, permit inspection and maintenance operations on the chimney and prevent danger of burns to persons."
2113.12,Section 2113 Masonry Chimneys,Clay Flue Lining (Installation),"Clay flue liners shall be installed in accordance with ASTM C1283 and extend from a point not less than 8 inches (203 mm) below the lowest inlet or, in the case of fireplaces, from the top of the smoke chamber to a point above the enclosing walls. The lining shall be carried up vertically, with a maximum slope not greater than 30 degrees (0.52 rad) from the vertical.Clay flue liners shall be laid in medium-duty nonwater-soluble refractory mortar conforming to ASTM C199 with tight mortar joints left smooth on the inside and installed to maintain an airspace or insulation not to exceed the thickness of the flue liner separating the flue liners from the interior face of the chimney masonry walls. Flue lining shall be supported on all sides. Only enough mortar shall be placed to make the joint and hold the liners in position."
2113.13.1,Section 2113 Masonry Chimneys,Listed Materials,Listed materials used as flue linings shall be installed in accordance with the terms of their listings and the manufacturer's instructions.
2113.13.2,Section 2113 Masonry Chimneys,Space Around Lining,The space surrounding a chimney lining system or vent installed within a masonry chimney shall not be used to vent any other appliance.Exception: This shall not prevent the installation of a separate flue lining in accordance with the manufacturer's instructions.
2113.14,Section 2113 Masonry Chimneys,Multiple Flues,"Where two or more flues are located in the same chimney, masonry wythes shall be built between adjacent flue linings. The masonry wythes shall be not less than 4 inches (102 mm) thick and bonded into the walls of the chimney.Exception: Where venting only one appliance, two flues are permitted to adjoin each other in the same chimney with only the flue lining separation between them. The joints of the adjacent flue linings shall be staggered not less than 4 inches (102 mm)."
2113.15,Section 2113 Masonry Chimneys,Flue Area (Appliance),Chimney flues shall not be smaller in area than the area of the connector from the appliance. Chimney flues connected to more than one appliance shall be not less than the area of the largest connector plus 50 percent of the areas of additional chimney connectors. Exceptions: Chimney flues serving oil-fired appliances sized in accordance with NFPA 31. Chimney flues serving gas-fired appliances sized in accordance with the Mechanical Code.
2113.16,Section 2113 Masonry Chimneys,Flue Area (Masonry Fireplace),"Flue sizing for chimneys serving fireplaces shall be in accordance with Section 2113.16.1 or 2113.16.2. For SI: 1 inch = 25.4 mm, 1 square inch = 645 mm2. FIGURE 2113.16 FLUE SIZES FOR MASONRY CHIMNEYS TABLE 2113.16(1) NET CROSS-SECTIONAL AREA OF ROUND FLUE SIZESa FLUE SIZE, INSIDE DIAMETER (inches) CROSS-SECTIONAL AREA (square inches) 6 28 7 38 8 50 10 78 103/4 90 12 113 15 176 18 254 For SI: 1 inch = 25.4 mm, 1 square inch = 645.16 mm2. Flue sizes are based on ASTM C315. TABLE 2113.16(2) NET CROSS-SECTIONAL AREA OF SQUARE AND RECTANGULAR FLUE SIZES FLUE SIZE, OUTSIDE NOMINAL DIMENSIONS (inches) CROSS-SECTIONAL AREA (square inches) 4.5 × 8.5 23 4.5 × 13 34 8 × 8 42 8.5 × 8.5 49 8 × 12 67 8.5 × 13 76 12 × 12 102 8.5 × 18 101 13 ×13 127 12 × 16 131 13 × 18 173 16 × 16 181 16 × 20 222 18 × 18 233 20 × 20 298 20 × 24 335 24 × 24 431 For SI: 1 inch = 25.4 mm, 1 square inch = 645.16 mm2."
2113.16.1,Section 2113 Masonry Chimneys,Minimum Area,Round chimney flues shall have a minimum net cross-sectional area of not less than 1/12 of the fireplace opening. Square chimney flues shall have a minimum net cross-sectional area of not less than 1/10 of the fireplace opening. Rectangular chimney flues with an aspect ratio less than 2 to 1 shall have a minimum net cross-sectional area of not less than 1/10 of the fireplace opening. Rectangular chimney flues with an aspect ratio of 2 to 1 or more shall have a minimum net cross-sectional area of not less than 1/8 of the fireplace opening.
2113.16.2,Section 2113 Masonry Chimneys,Determination of Minimum Area,The minimum net cross-sectional area of the flue shall be determined in accordance with Figure 2113.16. A flue size providing not less than the equivalent net cross-sectional area shall be used. Cross-sectional areas of clay flue linings are as provided in Tables 2113.16(1) and 2113.16(2) or as provided by the manufacturer or as measured in the field. The height of the chimney shall be measured from the firebox floor to the top of the chimney flue.
2113.17,Section 2113 Masonry Chimneys,Inlet,"Inlets to masonry chimneys shall enter from the side. Inlets shall have a thimble of fireclay, rigid refractory material or metal that will prevent the connector from pulling out of the inlet or from extending beyond the wall of the liner."
2113.18,Section 2113 Masonry Chimneys,Masonry Chimney Cleanout Openings,"Cleanout openings shall be provided within 6 inches (152 mm) of the base of each flue within every masonry chimney. The upper edge of the cleanout shall be located not less than 6 inches (152 mm) below the lowest chimney inlet opening. The height of the opening shall be not less than 6 inches (152 mm). The cleanout shall be provided with a noncombustible cover.Exception: Chimney flues serving masonry fireplaces, where cleaning is possible through the fireplace opening."
2113.19,Section 2113 Masonry Chimneys,Chimney Clearances,"Any portion of a masonry chimney located in the interior of the building or within the exterior wall of the building shall have a minimum airspace clearance to combustibles of 2 inches (51 mm). Chimneys located entirely outside the exterior walls of the building, including chimneys that pass through the soffit or cornice, shall have a minimum airspace clearance of 1 inch (25 mm). The airspace shall not be filled, except to provide fireblocking in accordance with Section 2113.20. Exceptions: Masonry chimneys equipped with a chimney lining system listed and labeled for use in chimneys in contact with combustibles in accordance with UL 1777, and installed in accordance with the manufacturer's instructions, are permitted to have combustible material in contact with their exterior surfaces. Where masonry chimneys are constructed as part of masonry or concrete walls, combustible materials shall not be in contact with the masonry or concrete wall less than 12 inches (305 mm) from the inside surface of the nearest flue lining. Exposed combustible trim and the edges of sheathing materials, such as wood siding, are permitted to abut the masonry chimney sidewalls, in accordance with Figure 2113.19, provided that such combustible trim or sheathing is not less than 12 inches (305 mm) from the inside surface of the nearest flue lining. Combustible material and trim shall not overlap the corners of the chimney by more than 1 inch (25 mm). FIGURE 2113.19 ILLUSTRATION OF EXCEPTION THREE CHIMNEY CLEARANCE PROVISION"
2113.20,Section 2113 Masonry Chimneys,Chimney Fireblocking,"All spaces between chimneys and floors and ceilings through which chimneys pass shall be fireblocked with noncombustible material securely fastened in place. The fireblocking of spaces between wood joists, beams or headers shall be self-supporting or be placed on strips of metal or metal lath laid across the spaces between combustible material and the chimney."
2114,Chapter 21 Masonry,Dry-Stack Masonry,
2114.1,Section 2114 Dry-Stack Masonry,General,The design of dry-stack masonry structures shall comply with the requirements of Chapters 1 through 8 of TMS 402 except as modified by Sections 2114.2 through 2114.5.
2114.2,Section 2114 Dry-Stack Masonry,Limitations,Dry-stack masonry shall be prohibited in Risk Category IV structures.
2114.3,Section 2114 Dry-Stack Masonry,Materials,Concrete masonry units complying with ASTM C90 shall be used.
2114.4,Section 2114 Dry-Stack Masonry,Strength,Dry-stack masonry shall be of adequate strength and proportions to support all superimposed loads without exceeding the allowable stresses listed in Table 2114.4. Allowable stresses not specified in Table 2114.4 shall comply with the requirements of Chapter 8 of TMS 402. TABLE 2114.4 GROSS CROSS-SECTIONAL AREA ALLOWABLE STRESS FOR DRY-STACK MASONRY DESCRIPTION MAXIMUM ALLOWABLE STRESS (psi) Compression 45 Flexural tension Horizontal span 30 Vertical span 18 Shear 10 For SI: 1 pound per square inch = 0.006895 MPa.
2114.5,Section 2114 Dry-Stack Masonry,Construction,Construction of dry-stack masonry shall comply with ASTM C946.
