id,section,reference,title,depth,body
14,Chapter 14 Heating and Cooling Equipment and Appliances,new_M1411.3.5.1,M1411.3.5.1 (307.2.4.1) Ductless Mini-Split System Traps,4,"Ductless mini-split equipment that produces condensate shall be provided with an inline check valve located in the drain line, or a trap."
14,Chapter 14 Heating and Cooling Equipment and Appliances,M1411.4,"M1411.4 <span class=""code_addition"">(307.3) </span>Condensate Pumps",2,"Condensate pumps located in uninhabitable spaces, such as attics and crawl spaces, shall be connected to the appliance or equipment served such that when the pump fails, the appliance or equipment will be prevented from operating. Pumps shall be installed in accordance with the manufacturer's instructions."
14,Chapter 14 Heating and Cooling Equipment and Appliances,M1411.5,M1411.5 Auxiliary Drain Pan,2,Category IV condensing appliances shall have an auxiliary drain pan where damage to any building component will occur as a result of stoppage in the condensate drainage system. These pans shall be installed in accordance with the applicable provisions of Section M1411.3.Exception: Fuel-fired appliances that automatically shut down operation in the event of a stoppage in the condensate drainage system.
14,Chapter 14 Heating and Cooling Equipment and Appliances,M1411.6,M1411.6 Insulation of Refrigerant Piping,2,Piping and fittings for refrigerant vapor (suction) lines shall be insulated with insulation having a thermal resistivity of not less than R-3 and having external surface permeance not exceeding 0.05 perm [2.87 ng/(s • m2 • Pa)] when tested in accordance with ASTM E96. Insulation shall be protected in accordance with Section N1103.3.1.
14,Chapter 14 Heating and Cooling Equipment and Appliances,M1412,"Section <span class=""code_deletion"">M1412</span> <span class=""code_deletion"">Absorption Cooling Equipment</span>",1,
14,Chapter 14 Heating and Cooling Equipment and Appliances,M1413,"Section <span class=""code_deletion"">M1413</span> <span class=""code_deletion"">Evaporative Cooling Equipment</span>",1,
14,Chapter 14 Heating and Cooling Equipment and Appliances,M1414,Section M1414 Fireplace Stoves,1,
14,Chapter 14 Heating and Cooling Equipment and Appliances,M1414.1,"M1414.1 <span class=""code_addition"">(905.1) </span>General",2,"Fireplace stoves shall be listed, labeled and installed in accordance with the terms of the listing. Fireplace stoves shall be tested in accordance with UL 737. Fireplace inserts intended for installation in fireplaces shall be listed and labeled in accordance with the requirements of UL 1482 and shall be installed in accordance with the manufacturer's instructions."
14,Chapter 14 Heating and Cooling Equipment and Appliances,new_M1414.2,M1414.2 (905.2) Connection to Fireplace,2,The connection of solid fuel appliances to chimney flues serving fireplaces shall comply with Sections M1803.4 and M1805.3.1.
14,Chapter 14 Heating and Cooling Equipment and Appliances,M1414.2,"<span class=""code_deletion"">M1414.2</span><span class=""code_addition"">M1414.3</span> <span class=""code_addition"">(905.3) </span>Hearth Extensions",2,Hearth extensions for fireplace stoves shall be installed in accordance with the listing of the fireplace stove. The supporting structure for a hearth extension for a fireplace stove shall be at the same level as the supporting structure for the fireplace unit. The hearth extension shall be readily distinguishable from the surrounding floor area.
14,Chapter 14 Heating and Cooling Equipment and Appliances,M1415,Section M1415 Masonry Heaters,1,
14,Chapter 14 Heating and Cooling Equipment and Appliances,M1415.1,M1415.1 General,2,Masonry heaters shall be constructed in accordance with Section R1002.
14,Chapter 14 Heating and Cooling Equipment and Appliances,new_M1415.2,M1415.2 General,2,"Clothes dryers shall be exhausted in accordance with the manufacturer's instructions.The delayed effective date of this Rule is January 1, 2021.The Statutory authority for Rule-making is G. S. 143-136; 143-138."
14,Chapter 14 Heating and Cooling Equipment and Appliances,new_M1415.2.1,M1415.2.1 (504.6) Makeup Air,3,"Where a closet is designed for the installation of a clothes dryer, an opening having an area of not less than 100 square inches (0.0645 m2) shall be provided in the closet enclosure or makeup air shall be provided by other approved means. The delayed effective date of this Rule is January 1, 2021. The Statutory authority for Rule-making is G. S. 143-136; 143-138."
14,Chapter 14 Heating and Cooling Equipment and Appliances,new_M1416,Section M1416 Factory-Built Fireplaces,1,
14,Chapter 14 Heating and Cooling Equipment and Appliances,new_M1416.1,M1416.1 (R1004.1) General,2,Factory-built fireplaces shall be listed and labeled and shall be installed in accordance with the conditions of the listing. Factory-built fireplaces shall be tested in accordance with UL 127.
14,Chapter 14 Heating and Cooling Equipment and Appliances,new_M1416.2,M1416.2 (R1004.2) Hearth Extensions,2,Hearth extensions of approved factory-built fireplaces shall be installed in accordance with the listing of the fireplace. The hearth extension shall be readily distinguishable from the surrounding floor area. Listed and labeled hearth extensions shall comply with UL 1618.
14,Chapter 14 Heating and Cooling Equipment and Appliances,new_M1416.3,M1416.3 (R1004.3) Decorative Shrouds,2,Decorative shrouds shall not be installed at the termination of chimneys for factory-built fireplace systems and installed in accordance with the manufacturer's instructions.
14,Chapter 14 Heating and Cooling Equipment and Appliances,new_M1416.4,M1416.4 (R1004.4) Unvented Gas Log Heaters,2,"An unvented gas log heater shall not be installed in a factory-built fireplace unless the fireplace system has been specifically tested, listed and labeled for such use in accordance with UL 127."
14,Chapter 14 Heating and Cooling Equipment and Appliances,new_M1416.5,M1416.5 (R1004.5) Gasketed Fireplace Doors,2,"A gasketed fireplace door shall not be installed on a factory-built fireplace except where the fireplace system has been specifically tested, listed and labeled for such use in accordance with UL 127."
