id,section,title,body,ifc_type,occupancy,design_phase,code_category,primary_responsibility
R315.3,Chapter 3 Building Planning,Location,"Carbon monoxide alarms in dwelling units shall be installed outside of each separate sleeping area in the immediate vicinity of the bedrooms. Where a fuel-burning appliance is located within a bedroom or its attached bathroom, a carbon monoxide alarm shall be installed within the bedroom.",,,,,
R315.4,Chapter 3 Building Planning,Combination Alarms,Combination carbon monoxide and smoke alarms shall be permitted to be used in lieu of carbon monoxide alarms.,,,,,
R315.5,Chapter 3 Building Planning,Power Source,"Carbon monoxide alarms shall receive their primary power from the building wiring where such wiring is served from a commercial source and, where primary power is interrupted, shall receive power from a battery. Wiring shall be permanent and without a disconnecting switch other than those required for overcurrent protection. Exceptions: Carbon monoxide alarms shall be permitted to be battery operated where installed in buildings without commercial power. Carbon monoxide alarms installed in accordance with Section R315.2.2 shall be permitted to be battery powered.",,,,,
R315.6,Chapter 3 Building Planning,Carbon Monoxide Detection Systems,Carbon monoxide detection systems shall be permitted to be used in lieu of carbon monoxide alarms and shall comply with Sections R315.6.1 through R315.6.4.,,,,,
R315.6.1,Chapter 3 Building Planning,General,Household carbon monoxide detection systems shall comply with NFPA 720. Carbon monoxide detectors shall be listed in accordance with UL 2075.,,,,,
R315.6.2,Chapter 3 Building Planning,Location,Carbon monoxide detectors shall be installed in the locations specified in Section R315.3. These locations supersede the locations specified in NFPA 720.,,,,,
R315.6.3,Chapter 3 Building Planning,Permanent Fixture,"Where a household carbon monoxide detection system is installed, it shall become a permanent fixture of the occupancy and owned by the homeowner.",,,,,
R315.6.4,Chapter 3 Building Planning,Combination Detectors,"Combination carbon monoxide and smoke detectors shall be permitted to be installed in carbon monoxide detection systems in lieu of carbon monoxide detectors, provided that they are listed in accordance with UL 2075 and UL 268.",,,,,
R316,Chapter 3 Building Planning,Foam Plastic,,,,,,
R316.1,Chapter 3 Building Planning,General,"The provisions of this section shall govern the materials, design, application, construction and installation of foam plastic materials.",Slab|Roof|Wall|Stair|Window,Residential (R),sd|dd|cd,occupancy_classification,architect
R316.2,Chapter 3 Building Planning,Labeling and Identification,"Packages and containers of foam plastic insulation and foam plastic insulation components delivered to the job site shall bear the label of an approved agency showing the manufacturer's name, the product listing, product identification and information sufficient to determine that the end use will comply with the requirements.",,,,,
R316.3,Chapter 3 Building Planning,Surface Burning Characteristics,"Unless otherwise allowed in Section R316.5, foam plastic or foam plastic cores used as a component in manufactured assemblies used in building construction shall have a flame spread index of not more than 75 and shall have a smoke-developed index of not more than 450 when tested in the maximum thickness and density intended for use in accordance with ASTM E84 or UL 723. Loose-fill-type foam plastic insulation shall be tested as board stock for the flame spread index and smoke-developed index. Exception: Foam plastic insulation more than 4 inches (102 mm) thick shall have a flame spread index of not more than 75 and a smoke-developed index of not more than 450 where tested at a thickness of not more than 4 inches (102 mm), provided that the end use is approved in accordance with Section R316.6 using the thickness and density intended for use.",,,,,
R316.4,Chapter 3 Building Planning,Thermal Barrier,"Unless otherwise allowed in Section R316.5, foam plastic shall be separated from the interior of a building by an approved thermal barrier of not less than 1/2-inch (12.7 mm) gypsum wallboard, 23/32-inch (18.2 mm) wood structural panel or a material that is tested in accordance with and meets the acceptance criteria of both the Temperature Transmission Fire Test and the Integrity Fire Test of NFPA 275.",,,,,
R316.5,Chapter 3 Building Planning,Specific Requirements,The following requirements shall apply to these uses of foam plastic unless specifically approved in accordance with Section R316.6 or by other sections of the code or the requirements of Sections R316.2 through R316.4 have been met.,,,,,
R316.5.1,Chapter 3 Building Planning,Masonry or Concrete Construction,"The thermal barrier specified in Section R316.4 is not required in a masonry or concrete wall, floor or roof when the foam plastic insulation is separated from the interior of the building by not less than a 1-inch (25 mm) thickness of masonry or concrete.",,,,,
R316.5.2,Chapter 3 Building Planning,Roofing,"The thermal barrier specified in Section R316.4 is not required where the foam plastic in a roof assembly or under a roof covering is installed in accordance with the code and the manufacturer's instructions and is separated from the interior of the building by tongue-and-groove wood planks or wood structural panel sheathing, in accordance with Section R803, that is not less than 15/32 inch (11.9 mm) thick bonded with exterior glue, identified as Exposure 1 and with edges supported by blocking or tongue-and-groove joints or an equivalent material. The smoke-developed index for roof applications shall not be limited.",,,,,
R316.5.3,Chapter 3 Building Planning,Attics,"The thermal barrier specified in Section R316.4 is not required where all of the following apply: Attic access is required by Section R807.1. The space is entered only for purposes of repairs or maintenance. The foam plastic insulation has been tested in accordance with Section R316.6 or the foam plastic insulation is protected against ignition using one of the following ignition barrier materials: 11/2-inch-thick (38 mm) mineral fiber insulation. 1/4-inch-thick (6.4 mm) wood structural panels. 3/8-inch (9.5 mm) particleboard. 1/4-inch (6.4 mm) hardboard. 3/8-inch (9.5 mm) gypsum board. Corrosion-resistant steel having a base metal thickness of 0.016 inch (0.406 mm). 11/2-inch-thick (38 mm) cellulose insulation; or 1/4-inch (6.4 mm) fiber-cement panel, soffit or backer board. The ignition barrier is not required where the foam plastic insulation has been tested in accordance with Section R316.6.",,,,,
R316.5.4,Chapter 3 Building Planning,Crawl Spaces,The thermal barrier specified in Section R316.4 is not required where all of the following apply: Crawl space access is required by Section R408.4. Entry is made only for purposes of repairs or maintenance. The foam plastic insulation has been tested in accordance with Section R316.6 or the foam plastic insulation is protected against ignition using one of the following ignition barrier materials: 11/2-inch-thick (38 mm) mineral fiber insulation; 1/4-inch-thick (6.4 mm) wood structural panels; 3/8-inch (9.5 mm) particleboard; 1/4-inch (6.4 mm) hardboard; 3/8-inch (9.5 mm) gypsum board; or Corrosion-resistant steel having a base metal thickness of 0.016 inch (0.406 mm).,,,,,
R316.5.5,Chapter 3 Building Planning,Foam-Filled Exterior Doors,Foam-filled exterior doors are exempt from the requirements of Sections R316.3 and R316.4.,,,,,
R316.5.6,Chapter 3 Building Planning,Foam-Filled Garage Doors,Foam-filled garage doors in attached or detached garages are exempt from the requirements of Sections R316.3 and R316.4.,,,,,
R316.5.7,Chapter 3 Building Planning,Foam Backer Board,The thermal barrier specified in Section R316.4 is not required where siding backer board foam plastic insulation has a thickness of not more than 0.5 inch (12.7 mm) and a potential heat of not more than 2000 Btu per square foot (22 720 kJ/m2) when tested in accordance with NFPA 259 provided that: The foam plastic insulation is separated from the interior of the building by not less than 2 inches (51 mm) of mineral fiber insulation; The foam plastic insulation is installed over existing exterior wall finish in conjunction with re-siding; or The foam plastic insulation has been tested in accordance with Section R316.6.,,,,,
R316.5.8,Chapter 3 Building Planning,Re-siding,The thermal barrier specified in Section R316.4 is not required where the foam plastic insulation is installed over existing exterior wall finish in conjunction with re-siding provided that the foam plastic has a thickness of not more than 0.5 inch (12.7 mm) and a potential heat of not more than 2000 Btu per square foot (22 720 kJ/m2) when tested in accordance with NFPA 259.,,,,,
R316.5.9,Chapter 3 Building Planning,Interior Trim,"The thermal barrier specified in Section R316.4 is not required for exposed foam plastic interior trim, provided that all of the following are met: The density is not less than 20 pounds per cubic foot (320 kg/m3). The thickness of the trim is not more than 0.5 inch (12.7 mm) and the width is not more than 8 inches (204 mm). The interior trim shall not constitute more than 10 percent of the aggregate wall and ceiling area of any room or space. The flame spread index does not exceed 75 when tested per ASTM E 84 or UL 723. The smoke-developed index is not limited.",,,,,
R316.5.10,Chapter 3 Building Planning,Interior Finish,Foam plastics shall be permitted as interior finish where approved in accordance with Section R316.6. Foam plastics that are used as an interior finish shall meet the flame spread index and smoke-developed index requirements of Sections R302.9.1 and R302.9.2.,,,,,
R316.5.11,Chapter 3 Building Planning,Sill Plates and Headers,Foam plastic shall be permitted to be spray applied to sill plates and headers or installed in the perimeter joist space without the thermal barrier specified in Section R316.4 subject to all of the following: The thickness of the foam plastic shall be not more than 31/4 inches (83 mm). The density of the foam plastic shall be in the range of 0.5 to 2.0 pounds per cubic foot (8 to 32 kg/m3). The foam plastic shall have a flame spread index of 25 or less and an accompanying smoke-developed index of 450 or less when tested in accordance with ASTM E84 or UL 723.,,,,,
R316.5.12,Chapter 3 Building Planning,Sheathing,"Foam plastic insulation used as sheathing shall comply with Section R316.3 and Section R316.4. Where the foam plastic sheathing is exposed to the attic space at a gable or kneewall, the provisions of Section R316.5.3 shall apply. Where foam plastic insulation is used as exterior wall sheathing on framed wall assemblies, it shall comply with Section R316.8.",,,,,
R316.5.13,Chapter 3 Building Planning,Floors,The thermal barrier specified in Section R316.4 is not required to be installed on the walking surface of a structural floor system that contains foam plastic insulation when the foam plastic is covered by not more than a nominal 1/2-inch-thick (12.7 mm) wood structural panel or equivalent. The thermal barrier specified in Section R316.4 is required on the underside of the structural floor system that contains foam plastic insulation when the underside of the structural floor system is exposed to the interior of the building.,,,,,
R316.6,Chapter 3 Building Planning,Specific Approval,"Foam plastic not meeting the requirements of Sections R316.3 through R316.5 shall be specifically approved on the basis of one of the following approved tests: NFPA 286 with the acceptance criteria of Section R302.9.4, FM 4880, UL 1040 or UL 1715, or fire tests related to actual end-use configurations. Approval shall be based on the actual end-use configuration and shall be performed on the finished foam plastic assembly in the maximum thickness intended for use. Assemblies tested shall include seams, joints and other typical details used in the installation of the assembly and shall be tested in the manner intended for use.",,,,,
R316.7,Chapter 3 Building Planning,Termite Damage,"The use of foam plastics in areas of ""very heavy"" termite infestation probability shall be in accordance with Section R318.4.",,,,,
R316.8,Chapter 3 Building Planning,Wind Resistance,Foam plastic insulation complying with ASTM C 578 and ASTM C 1289 and used as exterior wall sheathing on framed wall assemblies shall comply with SBCA FS 100 for wind pressure resistance unless installed directly over a sheathing material that is separately capable of resisting the wind load or otherwise exempted from the scope of SBCA FS 100.,,,,,
R317,Chapter 3 Building Planning,Protection of Wood and Wood-Based Products Against Decay,,,,,,
R317.1,Chapter 3 Building Planning,Location Required,"Protection of wood and wood-based products from decay shall be provided in the following locations by the use of naturally durable wood or wood that is preservative-treated in accordance with AWPA U1 for the species, product, preservative and end use. Preservatives shall be listed in Section 4 of AWPA U1. Wood joists or the bottom of a wood structural floor when closer than 18 inches (457 mm) or wood girders when closer than 12 inches (305 mm) to the exposed ground in crawl spaces or unexcavated area located within the periphery of the building foundation. Wood framing members that rest on concrete or masonry exterior foundation walls and are less than 8 inches (203 mm) from the exposed ground. Sills and sleepers on a concrete or masonry slab that is in direct contact with the ground unless separated from such slab by an impervious moisture barrier. The ends of wood girders entering exterior masonry or concrete walls having clearances of less than 1/2 inch (12.7 mm) on tops, sides and ends. Wood siding, sheathing and wall framing on the exterior of a building having a clearance of less than 6 inches (152 mm) from the ground or less than 2 inches (51 mm) measured vertically from concrete steps, porch slabs, patio slabs and similar horizontal surfaces exposed to the weather. Wood structural members supporting moisture-permeable floors or roofs that are exposed to the weather, such as concrete or masonry slabs, unless separated from such floors or roofs by an impervious moisture barrier. Wood furring strips or other wood framing members attached directly to the interior of exterior masonry walls or concrete walls below grade except where an approved vapor retarder is applied between the wall and the furring strips or framing members.",,,,,
R317.1.1,Chapter 3 Building Planning,Field Treatment,"Field-cut ends, notches and drilled holes of preservative-treated wood shall be treated in the field in accordance with AWPA M4.",,,,,
R317.1.2,Chapter 3 Building Planning,Ground Contact,"All wood in contact with the ground, embedded in concrete in direct contact with the ground or embedded in concrete exposed to the weather that supports permanent structures intended for human occupancy shall be approved pressure-preservative-treated wood suitable for ground contact use, except that untreated wood used entirely below groundwater level or continuously submerged in fresh water shall not be required to be pressure-preservative treated.",,,,,
R317.1.3,Chapter 3 Building Planning,Geographical Areas,"In geographical areas where experience has demonstrated a specific need, approved naturally durable or pressure-preservative-treated wood shall be used for those portions of wood members that form the structural supports of buildings, balconies, porches or similar permanent building appurtenances when those members are exposed to the weather without adequate protection from a roof, eave, overhang or other covering that would prevent moisture or water accumulation on the surface or at joints between members. Depending on local experience, such members may include: Horizontal members such as girders, joists and decking. Vertical members such as posts, poles and columns. Both horizontal and vertical members.",,,,,
R317.1.4,Chapter 3 Building Planning,Wood Columns,Wood columns shall be approved wood of natural decay resistance or approved pressure-preservative-treated wood. Exceptions: Columns exposed to the weather or in basements where supported by concrete piers or metal pedestals projecting 1 inch (25 mm) above a concrete floor or 6 inches (152 mm) above exposed earth and the earth is covered by an approved impervious moisture barrier. Columns in enclosed crawl spaces or unexcavated areas located within the periphery of the building when supported by a concrete pier or metal pedestal at a height more than 8 inches (203 mm) from exposed earth and the earth is covered by an impervious moisture barrier. Deck posts supported by concrete piers or metal pedestals projecting not less than 1 inch (25 mm) above a concrete floor or 6 inches (152 mm) above exposed earth.,,,,,
R317.1.5,Chapter 3 Building Planning,Exposed Glued-Laminated Timbers,"The portions of glued-laminated timbers that form the structural supports of a building or other structure and are exposed to weather and not properly protected by a roof, eave or similar covering shall be pressure treated with preservative, or be manufactured from naturally durable or preservative-treated wood.",,,,,
R317.2,Chapter 3 Building Planning,Quality Mark,"Lumber and plywood required to be pressure-preservative treated in accordance with Section R317.1 shall bear the quality mark of an approved inspection agency that maintains continuing supervision, testing and inspection over the quality of the product and that has been approved by an accreditation body that complies with the requirements of the American Lumber Standard Committee treated wood program.",,,,,
R317.2.1,Chapter 3 Building Planning,Required Information,"The required quality mark on each piece of pressure-preservative-treated lumber or plywood shall contain the following information: Identification of the treating plant. Type of preservative. The minimum preservative retention. End use for which the product was treated. Standard to which the product was treated. Identity of the approved inspection agency. The designation ""Dry,"" if applicable. Exception: Quality marks on lumber less than 1 inch (25 mm) nominal thickness, or lumber less than nominal 1 inch by 5 inches (25 mm by 127 mm) or 2 inches by 4 inches (51 mm by 102 mm) or lumber 36 inches (914 mm) or less in length shall be applied by stamping the faces of exterior pieces or by end labeling not less than 25 percent of the pieces of a bundled unit.",,,,,
R317.3,Chapter 3 Building Planning,Fasteners and Connectors in Contact With Preservative-Treated and Fire-Retardant-Treated Wood,"Fasteners, including nuts and washers, and connectors in contact with preservative-treated wood and fire-retardant-treated wood shall be in accordance with this section. The coating weights for zinc-coated fasteners shall be in accordance with ASTM A 153. Stainless steel driven fasteners shall be in accordance with the material requirements of ASTM F1667.",,,,,
R317.3.1,Chapter 3 Building Planning,Fasteners for Preservative-Treated Wood,"Fasteners, including nuts and washers, for preservative-treated wood shall be of hot-dipped, zinc-coated galvanized steel, stainless steel, silicon bronze or copper. Coating types and weights for connectors in contact with preservative-treated wood shall be in accordance with the connector manufacturer's recommendations. In the absence of manufacturer's recommendations, a minimum of ASTM A 653 type G185 zinc-coated galvanized steel, or equivalent, shall be used. Exceptions: 1/2-inch-diameter (12.7 mm) or greater steel bolts. Fasteners other than nails and timber rivets shall be permitted to be of mechanically deposited zinc-coated steel with coating weights in accordance with ASTM B 695, Class 55 minimum. Plain carbon steel fasteners in SBX/DOT and zinc borate preservative-treated wood in an interior, dry environment shall be permitted.",,,,,
R317.3.2,Chapter 3 Building Planning,Fastenings for Wood Foundations,"Fastenings, including nuts and washers, for wood foundations shall be as required in AF&amp;PA; PWF.",,,,,
R317.3.3,Chapter 3 Building Planning,Fasteners for Fire-Retardant-Treated Wood Used in Exterior Applications or Wet or Damp Locations,"Fasteners, including nuts and washers, for fire-retardant-treated wood used in exterior applications or wet or damp locations shall be of hot-dipped, zinc-coated galvanized steel, stainless steel, silicon bronze or copper. Fasteners other than nails and timber rivets shall be permitted to be of mechanically deposited zinc-coated steel with coating weights in accordance with ASTM B 695, Class 55 minimum.",,,,,
R317.3.4,Chapter 3 Building Planning,Fasteners for Fire-Retardant-Treated Wood Used in Interior Applications,"Fasteners, including nuts and washers, for fire-retardant-treated wood used in interior locations shall be in accordance with the manufacturer's recommendations. In the absence of the manufacturer's recommendations, Section R317.3.3 shall apply.",,,,,
R317.4,Chapter 3 Building Planning,Plastic Composites,"Plastic composite exterior deck boards, stair treads, guards and handrails containing wood, cellulosic or other biodegradable materials shall comply with the requirements of Section R507.3.",,,,,
R318,Chapter 3 Building Planning,Protection Against Subterranean Termites,,,,,,
R318.1,Chapter 3 Building Planning,Subterranean Termite Control Methods,"In areas subject to damage from termites as indicated by Table R301.2(1), methods of protection shall be one, or a combination, of the following methods: Chemical termiticide treatment in accordance with Section R318.2. Termite baiting system installed and maintained in accordance with the label. Pressure-preservative-treated wood in accordance with the provisions of Section R317.1. Naturally durable termite-resistant wood. Physical barriers in accordance with Section R318.3 and used in locations as specified in Section R317.1. Cold-formed steel framing in accordance with Sections R505.2.1 and R603.2.1.",,,,,
R318.1.1,Chapter 3 Building Planning,Quality Mark,"Lumber and plywood required to be pressure-preservative treated in accordance with Section R318.1 shall bear the quality mark of an approved inspection agency that maintains continuing supervision, testing and inspection over the quality of the product and that has been approved by an accreditation body that complies with the requirements of the American Lumber Standard Committee treated wood program.",,,,,
R318.1.2,Chapter 3 Building Planning,Field Treatment,"Field-cut ends, notches and drilled holes of pressure-preservative-treated wood shall be retreated in the field in accordance with AWPA M4.",,,,,
R318.2,Chapter 3 Building Planning,Chemical Termiticide Treatment,"Chemical termiticide treatment shall include soil treatment or field-applied wood treatment. The concentration, rate of application and method of treatment of the chemical termiticide shall be in strict accordance with the termiticide label.",,,,,
R318.3,Chapter 3 Building Planning,Barriers,"Approved physical barriers, such as metal or plastic sheeting or collars specifically designed for termite prevention, shall be installed in a manner to prevent termites from entering the structure. Shields placed on top of an exterior foundation wall are permitted to be used only if in combination with another method of protection.",,,,,
R318.4,Chapter 3 Building Planning,Foam Plastic Protection,"In areas where the probability of termite infestation is ""very heavy"" as indicated in Figure R301.2(6), extruded and expanded polystyrene, polyisocyanurate and other foam plastics shall not be installed on the exterior face or under interior or exterior foundation walls or slab foundations located below grade. The clearance between foam plastics installed above grade and exposed earth shall be not less than 6 inches (152 mm). Exceptions: Buildings where the structural members of walls, floors, ceilings and roofs are entirely of noncombustible materials or pressure-preservative-treated wood. Where in addition to the requirements of Section R318.1, an approved method of protecting the foam plastic and structure from subterranean termite damage is used. On the interior side of basement walls.",,,,,
R319,Chapter 3 Building Planning,Site Address,,,,,,
new_R319.1,Chapter 3 Building Planning,Address Numbers,"Premises shall comply with the provisions set forth in Section 118, 12-A DCMR, governing street numbering and addresses.",,,,,
R320,Chapter 3 Building Planning,Accessibility,,,,,,
R320.1,Chapter 3 Building Planning,Scope,"Where there are four or more dwelling units or sleeping units in a single structure, the provisions of Chapter 11 of the International Building Code for Group R-3 shall apply.",,,,,
R320.1.1,Chapter 3 Building Planning,Guestrooms,"A dwelling with guestrooms shall comply with the provisions of Chapter 11 of the International Building Code for Group R-3. For the purpose of applying the requirements of Chapter 11 of the International Building Code, guestrooms shall be considered to be sleeping units. Exception: Owner-occupied lodging houses with five or fewer guestrooms constructed in accordance with the International Residential Code are not required to be accessible.",,,,,
R321,Chapter 3 Building Planning,Elevators and Platform Lifts,,,,,,
R321.1,Chapter 3 Building Planning,Elevators,"Where provided, passenger elevators, limited-use and limited-application elevators or private residence elevators shall comply with ASME A17.1/CSA B44.",,,,,
R321.2,Chapter 3 Building Planning,Platform Lifts,"Where provided, platform lifts shall comply with ASME A18.1.",,,,,
