id,section,title,body,ifc_type,occupancy,design_phase,code_category,primary_responsibility
R308.3.1,Chapter 3 Building Planning,Impact Test,"Where required by other sections of the code, glazing shall be tested in accordance with CPSC 16 CFR 1201. Glazing shall comply with the test criteria for Category II unless otherwise indicated in Table R308.3.1(1). Exception: Glazing not in doors or enclosures for hot tubs, whirlpools, saunas, steam rooms, bathtubs and showers shall be permitted to be tested in accordance with ANSI Z97.1. Glazing shall comply with the test criteria for Class A unless indicated in Table R308.3.1(2). TABLE R308.3.1(1)MINIMUM CATEGORY CLASSIFICATION OF GLAZING USING CPSC 16 CFR 1201 EXPOSED SURFACE AREA OF ONE SIDE OF ONE LITE GLAZING IN STORM OR COMBINATION DOORS (Category Class) GLAZING IN DOORS (Category Class) GLAZED PANELS REGULATED BY SECTION R308.4.3 (Category Class) GLAZED PANELS REGULATED BY SECTION R308.4.2 (Category Class) GLAZING IN DOORS AND ENCLOSURES REGULATED BY SECTION 308.4.5 (Category Class) SLIDING GLASS DOORS PATIO TYPE (Category Class) 9 square feet or less I I NR I II II More than 9 square feet II II II II II II For SI: 1 square foot = 0.0929 m2. NR = ""No Requirement."" TABLE R308.3.1(2)MINIMUM CATEGORY CLASSIFICATION OF GLAZING USING ANSI Z97.1 EXPOSED SURFACE AREA OF ONE SIDE OF ONE LITE GLAZED PANELS REGULATED BY SECTION R308.4.3 (Category Class) GLAZED PANELS REGULATED BY SECTION R308.4.2 (Category Class) DOORS AND ENCLOSURES REGULATED BY SECTION R308.4.5a (Category Class) 9 square feet or less No requirement B A More than 9 square feet A A A For SI: 1 square foot = 0.0929 m2. Use is permitted only by the exception to Section R308.3.1.",,,,,
R308.4,Chapter 3 Building Planning,Hazardous Locations,The locations specified in Sections R308.4.1 through R308.4.7 shall be considered to be specific hazardous locations for the purposes of glazing.,,,,,
R308.4.1,Chapter 3 Building Planning,Glazing in Doors,"Glazing in fixed and operable panels of swinging, sliding and bifold doors shall be considered to be a hazardous location. Exceptions: Glazed openings of a size through which a 3-inch-diameter (76 mm) sphere is unable to pass. Decorative glazing.",,,,,
R308.4.2,Chapter 3 Building Planning,Glazing Adjacent to Doors,Glazing in an individual fixed or operable panel adjacent to a door shall be considered to be a hazardous location where the bottom exposed edge of the glazing is less than 60 inches (1524 mm) above the floor or walking surface and it meets either of the following conditions: Where the glazing is within 24 inches (610 mm) of either side of the door in the plane of the door in a closed position. Where the glazing is on a wall perpendicular to the plane of the door in a closed position and within 24 inches (610 mm) of the hinge side of an in-swinging door. Exceptions: Decorative glazing. Where there is an intervening wall or other permanent barrier between the door and the glazing. Where access through the door is to a closet or storage area 3 feet (914 mm) or less in depth. Glazing in this application shall comply with Section R308.4.3. Glazing that is adjacent to the fixed panel of patio doors.,,,,,
R308.4.3,Chapter 3 Building Planning,Glazing in Windows,"Glazing in an individual fixed or operable panel that meets all of the following conditions shall be considered to be a hazardous location: The exposed area of an individual pane is larger than 9 square feet (0.836 m2), The bottom edge of the glazing is less than 18 inches (457 mm) above the floor, The top edge of the glazing is more than 36 inches (914 mm) above the floor; and One or more walking surfaces are within 36 inches (914 mm), measured horizontally and in a straight line, of the glazing. Exceptions: Decorative glazing. Where a horizontal rail is installed on the accessible side(s) of the glazing 34 to 38 inches (864 to 965 mm) above the walking surface. The rail shall be capable of withstanding a horizontal load of 50 pounds per linear foot (730 N/m) without contacting the glass and have a cross-sectional height of not less than 11/2 inches (38 mm). Outboard panes in insulating glass units and other multiple glazed panels where the bottom edge of the glass is 25 feet (7620 mm) or more above grade, a roof, walking surfaces or other horizontal [within 45 degrees (0.79 rad) of horizontal] surface adjacent to the glass exterior.",,,,,
R308.4.4,Chapter 3 Building Planning,Glazing in Guards and Railings,"Glazing in guards and railings, including structural baluster panels and nonstructural in-fill panels, regardless of area or height above a walking surface shall be considered to be a hazardous location.",,,,,
R308.4.5,Chapter 3 Building Planning,Glazing and Wet Surfaces,"Glazing in walls, enclosures or fences containing or facing hot tubs, spas, whirlpools, saunas, steam rooms, bathtubs, showers and indoor or outdoor swimming pools where the bottom exposed edge of the glazing is less than 60 inches (1524 mm) measured vertically above any standing or walking surface shall be considered to be a hazardous location. This shall apply to single glazing and each pane in multiple glazing. Exception: Glazing that is more than 60 inches (1524 mm), measured horizontally and in a straight line, from the water's edge of a bathtub, hot tub, spa, whirlpool or swimming pool or from the edge of a shower, sauna or steam room.",,,,,
R308.4.6,Chapter 3 Building Planning,Glazing Adjacent to Stairs and Ramps,"Glazing where the bottom exposed edge of the glazing is less than 36 inches (914 mm) above the plane of the adjacent walking surface of stairways, landings between flights of stairs and ramps shall be considered to be a hazardous location. Exceptions: Where a rail is installed on the accessible side(s) of the glazing 34 to 38 inches (864 to 965 mm) above the walking surface. The rail shall be capable of withstanding a horizontal load of 50 pounds per linear foot (730 N/m) without contacting the glass and have a cross-sectional height of not less than 11/2 inches (38 mm). Glazing 36 inches (914 mm) or more measured horizontally from the walking surface.",,,,,
R308.4.7,Chapter 3 Building Planning,Glazing Adjacent to the Bottom Stair Landing,Glazing adjacent to the landing at the bottom of a stairway where the glazing is less than 36 inches (914 mm) above the landing and within a 60-inch (1524 mm) horizontal arc less than 180 degrees from the bottom tread nosing shall be considered to be a hazardous location. Exception: The glazing is protected by a guard complying with Section R312 and the plane of the glass is more than 18 inches (457 mm) from the guard. FIGURE R308.4.7 PROHIBITED GLAZING LOCATIONS AT BOTTOM STAIR LANDINGS,,,,,
R308.5,Chapter 3 Building Planning,Site-Built Windows,Site-built windows shall comply with Section 2404 of the International Building Code.,,,,,
R308.6,Chapter 3 Building Planning,Skylights and Sloped Glazing,Skylights and sloped glazing shall comply with the following sections.,,,,,
R308.6.1,Chapter 3 Building Planning,Definitions,"The following terms are defined in Chapter 2: SKYLIGHT, UNIT. SKYLIGHTS AND SLOPED GLAZING. TUBULAR DAYLIGHTING DEVICE (TDD).",,,,,
R308.6.2,Chapter 3 Building Planning,Materials,"The following types of glazing shall be permitted to be used: Laminated glass with not less than a 0.015-inch (0.38 mm) polyvinyl butyral interlayer for glass panes 16 square feet (1.5 m2) or less in area located such that the highest point of the glass is not more than 12 feet (3658 mm) above a walking surface or other accessible area; for higher or larger sizes, the interlayer thickness shall be not less than 0.030 inch (0.76 mm). Fully tempered glass. Heat-strengthened glass. Wired glass. Approved rigid plastics.",,,,,
R308.6.3,Chapter 3 Building Planning,"Screens, General","For fully tempered or heat-strengthened glass, a retaining screen meeting the requirements of Section R308.6.7 shall be installed below the glass, except for fully tempered glass that meets either condition listed in Section R308.6.5.",,,,,
R308.6.4,Chapter 3 Building Planning,Screens With Multiple Glazing,"Where the inboard pane is fully tempered, heat-strengthened or wired glass, a retaining screen meeting the requirements of Section R308.6.7 shall be installed below the glass, except for either condition listed in Section R308.6.5. Other panes in the multiple glazing shall be of any type listed in Section R308.6.2.",,,,,
R308.6.5,Chapter 3 Building Planning,Screens Not Required,"Screens shall not be required where fully tempered glass is used as single glazing or the inboard pane in multiple glazing and either of the following conditions are met: Glass area 16 square feet (1.49 m2) or less. Highest point of glass not more than 12 feet (3658 mm) above a walking surface or other accessible area, nominal glass thickness not more than 3/16 inch (4.8 mm), and (for multiple glazing only) the other pane or panes fully tempered, laminated or wired glass. Glass area greater than 16 square feet (1.49 m2). Glass sloped 30 degrees (0.52 rad) or less from vertical, and highest point of glass not more than 10 feet (3048 mm) above a walking surface or other accessible area.",,,,,
R308.6.6,Chapter 3 Building Planning,Glass in Greenhouses,"Any glazing material is permitted to be installed without screening in the sloped areas of greenhouses, provided that the greenhouse height at the ridge does not exceed 20 feet (6096 mm) above grade.",,,,,
R308.6.7,Chapter 3 Building Planning,Screen Characteristics,"The screen and its fastenings shall be capable of supporting twice the weight of the glazing, be firmly and substantially fastened to the framing members, and have a mesh opening of not more than 1 inch by 1 inch (25 mm by 25 mm).",,,,,
R308.6.8,Chapter 3 Building Planning,Curbs for Skylights,Unit skylights installed in a roof with a pitch flatter than three units vertical in 12 units horizontal (25-percent slope) shall be mounted on a curb extending not less than 4 inches (102 mm) above the plane of the roof unless otherwise specified in the manufacturer's installation instructions.,,,,,
R308.6.9,Chapter 3 Building Planning,Testing and Labeling,"Unit skylights and tubular daylighting devices shall be tested by an approved independent laboratory, and bear a label identifying manufacturer, performance grade rating and approved inspection agency to indicate compliance with the requirements of AAMA/WDMA/CSA 101/I.S.2/A440.",,,,,
R308.6.9.1,Chapter 3 Building Planning,Comparative Analysis for Glass-Glazed Unit Skylights,Structural wind load design pressures for glass-glazed unit skylights different than the size tested in accordance with Section R308.6.9 shall be permitted to be different than the design value of the tested unit where determined in accordance with one of the following comparative analysis methods: Structural wind load design pressures for glass-glazed unit skylights smaller than the size tested in accordance with Section R308.6.9 shall be permitted to be higher than the design value of the tested unit provided that such higher pressures are determined by accepted engineering analysis. Components of the smaller unit shall be the same as those of the tested unit. Such calculated design pressures shall be validated by an additional test of the glass-glazed unit skylight having the highest allowable design pressure. In accordance with WDMA I.S. 11.,,,,,
R309,Chapter 3 Building Planning,Garages and Carports,,,,,,
R309.1,Chapter 3 Building Planning,Floor Surface,Garage floor surfaces shall be of approved noncombustible material. The area of floor used for parking of automobiles or other vehicles shall be sloped to facilitate the movement of liquids to a drain or toward the main vehicle entry doorway.,,,,,
R309.2,Chapter 3 Building Planning,Carports,Carports shall be open on not less than two sides. Carport floor surfaces shall be of approved noncombustible material. Carports not open on two or more sides shall be considered to be a garage and shall comply with the provisions of this section for garages. Exception: Asphalt surfaces shall be permitted at ground level in carports. The area of floor used for parking of automobiles or other vehicles shall be sloped to facilitate the movement of liquids to a drain or toward the main vehicle entry doorway.,,,,,
R309.3,Chapter 3 Building Planning,Flood Hazard Areas,"For buildings located in flood hazard areas as established by Table R301.2(1), garage floors shall be: Elevated to or above the design flood elevation as determined in accordance with Section R322; or Located below the design flood elevation provided that the floors are at or above grade on not less than one side, are used solely for parking, building access or storage, meet the requirements of Section R322 and are otherwise constructed in accordance with this code.",,,,,
R309.4,Chapter 3 Building Planning,Automatic Garage Door Openers,"Automatic garage door openers, if provided, shall be listed and labeled in accordance with UL 325.",,,,,
R309.5,Chapter 3 Building Planning,Fire Sprinklers,"Private garages shall be protected by fire sprinklers where the garage wall has been designed based on Table R302.1(2), Footnote a. Sprinklers in garages shall be connected to an automatic sprinkler system that complies with Section P2904. Garage sprinklers shall be residential sprinklers or quick-response sprinklers, designed to provide a density of 0.05 gpm/ft2. Garage doors shall not be considered obstructions with respect to sprinkler placement.",,,,,
R310,Chapter 3 Building Planning,Emergency Escape and Rescue Openings,,,,,,
R310.1,Chapter 3 Building Planning,Emergency Escape and Rescue Opening Required,"Basements, habitable attics and every sleeping room shall have not less than one operable emergency escape and rescue opening. Where basements contain one or more sleeping rooms, an emergency escape and rescue opening shall be required in each sleeping room. Emergency escape and rescue openings shall open directly into a public way, or to a yard or court that opens to a public way. Exceptions: Storm shelters and basements used only to house mechanical equipment not exceeding a total floor area of 200 square feet (18.58 m2). Where access to a public way cannot be provided, a safe dispersal area shall be provided where all of the following are met: The area shall be of a size to accommodate at least 5 square feet (0.46 m2) for each person. The area shall be located on the same lot at least 25 feet (7620 mm) away from the building requiring egress. The area shall be permanently maintained and identified as a safe dispersal area. The area shall be provided with a safe and unobstructed path of travel from the building.",,,,,
R310.1.1,Chapter 3 Building Planning,Operational Constraints and Opening Control Devices,"Emergency escape and rescue openings shall be operational from the inside of the room without the use of keys, tools or special knowledge. Window opening control devices complying with ASTM F2090 shall be permitted for use on windows serving as a required emergency escape and rescue opening.",,,,,
R310.2,Chapter 3 Building Planning,Emergency Escape and Rescue Openings,Emergency escape and rescue openings shall have minimum dimensions as specified in this section.,,,,,
R310.2.1,Chapter 3 Building Planning,Minimum Opening Area,Emergency and escape rescue openings shall have a net clear opening of not less than 5.7 square feet (0.530 m2). The net clear opening dimensions required by this section shall be obtained by the normal operation of the emergency escape and rescue opening from the inside. The net clear height opening shall be not less than 24 inches (610 mm) and the net clear width shall be not less than 20 inches (508 mm). Exception: Grade floor or below grade openings shall have a net clear opening of not less than 5 square feet (0.465 m2).,,,,,
R310.2.2,Chapter 3 Building Planning,Window Sill Height,"Where a window is provided as the emergency escape and rescue opening, it shall have a sill height of not more than 44 inches (1118 mm) above the floor; where the sill height is below grade, it shall be provided with a window well in accordance with Section R310.2.3.",,,,,
R310.2.3,Chapter 3 Building Planning,Window Wells,"The horizontal area of the window well shall be not less than 9 square feet (0.9 m2), with a horizontal projection and width of not less than 36 inches (914 mm). The area of the window well shall allow the emergency escape and rescue opening to be fully opened. Exception: The ladder or steps required by Section R310.2.3.1 shall be permitted to encroach not more than 6 inches (152 mm) into the required dimensions of the window well.",,,,,
R310.2.3.1,Chapter 3 Building Planning,Ladder and Steps,"Window wells with a vertical depth greater than 44 inches (1118 mm) shall be equipped with a permanently affixed ladder or steps usable with the window in the fully open position. Ladders or steps required by this section shall not be required to comply with Sections R311.7 and R311.8. Ladders or rungs shall have an inside width of not less than 12 inches (305 mm), shall project not less than 3 inches (76 mm) from the wall and shall be spaced not more than 18 inches (457 mm) on center vertically for the full height of the window well.",,,,,
R310.2.3.2,Chapter 3 Building Planning,Drainage,"Window wells shall be designed for proper drainage by connecting to the building's foundation drainage system required by Section R405.1 or by an approved alternative method. Exception: A drainage system for window wells is not required where the foundation is on well-drained soil or sand-gravel mixture soils in accordance with the United Soil Classification System, Group I Soils, as detailed in Table R405.1.",,,,,
R310.2.4,Chapter 3 Building Planning,Emergency Escape and Rescue Openings Under Decks and Porches,Emergency escape and rescue openings shall be permitted to be installed under decks and porches provided that the location of the deck allows the emergency escape and rescue openings to be fully opened and provides a path not less than 36 inches (914 mm) in height to a yard or court.,,,,,
R310.2.5,Chapter 3 Building Planning,Replacement Windows,"Replacement windows installed in buildings meeting the scope of this code shall be exempt from the maximum sill height requirements of Sections R310.1 and Sections R310.2.1 and R310.2.2, provided the replacement window meets the following conditions: The replacement window is the manufacturer's largest standard size window that will fit within the existing frame or existing rough opening. The replacement window is of the same operating style as the existing window or a style that provides for an equal or greater window opening area than the existing window. The replacement window is not part of a change of occupancy.",,,,,
R310.3,Chapter 3 Building Planning,Emergency Escape and Rescue Doors,"Where a door is provided as the required emergency escape and rescue opening, it shall be permitted to be a side-hinged door or a slider. Where the opening is below the adjacent ground elevation, it shall be provided with a bulkhead enclosure.",,,,,
R310.3.1,Chapter 3 Building Planning,Minimum Door Opening Size,The minimum net clear height opening for any door that serves as an emergency and escape rescue opening shall be in accordance with Section R310.2.1.,,,,,
R310.3.2,Chapter 3 Building Planning,Bulkhead Enclosures,Bulkhead enclosures shall provide direct access from the basement. The bulkhead enclosure shall provide the minimum net clear opening equal to the door in the fully open position.,,,,,
R310.3.2.1,Chapter 3 Building Planning,Drainage,"Bulkhead enclosures shall be designed for proper drainage by connecting to the building's foundation drainage system required by Section R405.1 or by an approved alternative method. Exception: A drainage system for bulkhead enclosures is not required where the foundation is on well-drained soil or sand-gravel mixture soils in accordance with the United Soil Classification System, Group I Soils, as detailed in Table R405.1.",,,,,
R310.4,Chapter 3 Building Planning,"Bars, Grilles, Covers and Screens","Bars, grilles, covers, screens or similar devices are permitted to be placed over emergency escape and rescue openings, bulkhead enclosures, or window wells that serve such openings, provided that the minimum net clear opening size complies with Sections R310.1.1 to R310.2.3, and such devices shall be releasable or removable from the inside without the use of a key, tool, special knowledge or force greater than that required for the normal operation of the escape and rescue opening.",,,,,
R310.5,Chapter 3 Building Planning,Dwelling Additions,"Where dwelling additions occur that contain sleeping rooms, an emergency escape and rescue opening shall be provided in each new sleeping room. Where dwelling additions occur that have basements, an emergency escape and rescue opening shall be provided in the new basement. Exceptions: An emergency escape and rescue opening is not required in a new basement that contains a sleeping room with an emergency escape and rescue opening. An emergency escape and rescue opening is not required in a new basement where there is an emergency escape and rescue opening in an existing basement that is accessible from the new basement.",,,,,
R310.6,Chapter 3 Building Planning,Alterations or Repairs of Existing Basements,An emergency escape and rescue opening is not required where existing basements undergo alterations or repairs. Exception: New sleeping rooms created in an existing basement shall be provided with emergency escape and rescue openings in accordance with Section R310.1.,,,,,
R311,Chapter 3 Building Planning,Means of Egress,,,,,,
R311.1,Chapter 3 Building Planning,Means of Egress,Dwellings shall be provided with a means of egress in accordance with this section. The means of egress shall provide a continuous and unobstructed path of vertical and horizontal egress travel from all portions of the dwelling to the required egress door without requiring travel through a garage. The required egress door shall open directly into a public way or to a yard or court that opens to a public way.,,,,,
R311.2,Chapter 3 Building Planning,Egress Door,"Not less than one egress door shall be provided for each dwelling unit. The egress door shall be side-hinged, and shall provide a clear width of not less than 32 inches (813 mm) where measured between the face of the door and the stop, with the door open 90 degrees (1.57 rad). The clear height of the door opening shall be not less than 78 inches (1981 mm) in height measured from the top of the threshold to the bottom of the stop. Other doors shall not be required to comply with these minimum dimensions. Egress doors shall be readily openable from inside the dwelling without the use of a key or special knowledge or effort.",,,,,
R311.3,Chapter 3 Building Planning,Floors and Landings at Exterior Doors,There shall be a landing or floor on each side of each exterior door. The width of each landing shall be not less than the door served. Every landing shall have a dimension of not less than 36 inches (914 mm) measured in the direction of travel. The slope at exterior landings shall not exceed 1/4 unit vertical in 12 units horizontal (2 percent). Exception: Exterior balconies less than 60 square feet (5.6 m2) and only accessible from a door are permitted to have a landing less than 36 inches (914 mm) measured in the direction of travel.,,,,,
R311.3.1,Chapter 3 Building Planning,Floor Elevations at the Required Egress Doors,"Landings or finished floors at the required egress door shall be not more than 11/2 inches (38 mm) lower than the top of the threshold. Exception: The landing or floor on the exterior side shall be not more than 73/4 inches (196 mm) below the top of the threshold provided the door does not swing over the landing or floor. Where exterior landings or floors serving the required egress door are not at grade, they shall be provided with access to grade by means of a ramp in accordance with Section R311.8 or a stairway in accordance with Section R311.7.",,,,,
R311.3.2,Chapter 3 Building Planning,Floor Elevations for Other Exterior Doors,"Doors other than the required egress door shall be provided with landings or floors not more than 73/4 inches (196 mm) below the top of the threshold. Exception: A top landing is not required where a stairway of not more than two risers is located on the exterior side of the door, provided that the door does not swing over the stairway.",,,,,
R311.3.3,Chapter 3 Building Planning,Storm and Screen Doors,Storm and screen doors shall be permitted to swing over exterior stairs and landings.,,,,,
R311.4,Chapter 3 Building Planning,Vertical Egress,Egress from habitable levels including habitable attics and basements not provided with an egress door in accordance with Section R311.2 shall be by a ramp in accordance with Section R311.8 or a stairway in accordance with Section R311.7.,,,,,
R311.5.1,Chapter 3 Building Planning,Attachment,"Exterior landings, decks, balconies, stairs and similar facilities shall be positively anchored to the primary structure to resist both vertical and lateral forces or shall be designed to be self-supporting. Attachment shall not be accomplished by use of toenails or nails subject to withdrawal.",,,,,
R311.6,Chapter 3 Building Planning,Hallways,The width of a hallway shall be not less than 3 feet (914 mm).,,,,,
