id,section,reference,title,depth,body
3.307,Section 307 High-Hazard Group H,307.3.1,[F]  307.3.1 Occupancies Containing Explosives Not Classified as H-1,3,"The following occupancies containing explosive materials shall be classified as follows:Division 1.3 explosive materials that are used and maintained in a form where either confinement or configuration will not elevate the hazard from a mass fire to mass explosion hazard shall be allowed in H-2 occupancies.Articles, including articles packaged for shipment, that are not regulated as a Division 1.4 explosive under Bureau of Alcohol, Tobacco, Firearms and Explosives regulations, or unpackaged articles used in process operations that do not propagate a detonation or deflagration between articles shall be allowed in H-3 occupancies."
3.307,Section 307 High-Hazard Group H,307.4,[F]  307.4 High-Hazard Group H-2,2,"Buildings and structures containing materials that pose a deflagration hazard or a hazard from accelerated burning shall be classified as Group H-2. Such materials shall include, but not be limited to, the following:Class I, II or IIIA flammable or combustible liquids that are used or stored in normally open containers or systems, or in closed containers or systems pressurized at more than 15 pounds per square inch gauge (103.4 kPa).Combustible dusts where manufactured, generated or used in such a manner that the concentration and conditions create a fire or explosion hazard based on information prepared in accordance with Section 414.1.3.Cryogenic fluids, flammable.Flammable gases.Organic peroxides, Class I.Oxidizers, Class 3, that are used or stored in normally open containers or systems, or in closed containers or systems pressurized at more than 15 pounds per square inch gauge (103 kPa).Pyrophoric liquids, solids and gases, nondetonable.Unstable (reactive) materials, Class 3, nondetonable.Water-reactive materials, Class 3."
3.307,Section 307 High-Hazard Group H,307.5,[F]  307.5 High-Hazard Group H-3,2,"Buildings and structures containing materials that readily support combustion or that pose a physical hazard shall be classified as Group H-3. Such materials shall include, but not be limited to, the following:Class I, II or IIIA flammable or combustible liquids that are used or stored in normally closed containers or systems pressurized at 15 pounds per square inch gauge (103.4 kPa) or less.Combustible fibers, other than densely packed baled cotton, where manufactured, generated or used in such a manner that the concentration and conditions create a fire or explosion hazard based on information prepared in accordance with Section 414.1.3.Consumer fireworks, 1.4G (Class C, Common)Cryogenic fluids, oxidizingFlammable solidsOrganic peroxides, Class II and IIIOxidizers, Class 2Oxidizers, Class 3, that are used or stored in normally closed containers or systems pressurized at 15 pounds per square inch gauge (103 kPa) or lessOxidizing gasesUnstable (reactive) materials, Class 2Water-reactive materials, Class 2"
3.307,Section 307 High-Hazard Group H,307.6,[F]  307.6 High-Hazard Group H-4,2,"Buildings and structures containing materials that are health hazards shall be classified as Group H-4. Such materials shall include, but not be limited to, the following:CorrosivesHighly toxic materialsToxic materials"
3.307,Section 307 High-Hazard Group H,307.7,[F]  307.7 High-Hazard Group H-5,2,Semiconductor fabrication facilities and comparable research and development areas in which hazardous production materials (HPM) are used and the aggregate quantity of materials is in excess of those listed in Tables 307.1(1) and 307.1(2) shall be classified as Group H-5. Such facilities and areas shall be designed and constructed in accordance with Section 415.11.
3.307,Section 307 High-Hazard Group H,307.8,[F]  307.8 Multiple Hazards,2,"Buildings and structures containing a material or materials representing hazards that are classified in one or more of Groups H-1, H-2, H-3 and H-4 shall conform to the code requirements for each of the occupancies so classified."
3,Chapter 3 Occupancy Classification and Use,308,Section 308 Institutional Group I,1,
3.308,Section 308 Institutional Group I,308.1,308.1 Institutional Group I,2,"Institutional Group I occupancy includes, among others, the use of a building or structure, or a portion thereof, in which care or supervision is provided to persons who are or are not capable of self-preservation without physical assistance or in which persons are detained for penal or correctional purposes or in which the liberty of the occupants is restricted. Institutional occupancies shall be classified as Group I-1, I-2, I-3 or I-4."
3.308,Section 308 Institutional Group I,308.2,308.2 Institutional Group I-1,2,"Institutional Group I-1 occupancy shall include buildings, structures or portions thereof for more than 16 persons, excluding staff, who reside on a 24-hour basis in a supervised environment and receive custodial care. Buildings of Group I-1 shall be classified as one of the occupancy conditions specified in Section 308.2.1 or 308.2.2. This group shall include, but not be limited to, the following:Alcohol and drug centersAssisted living facilitiesCongregate care facilitiesGroup homesHalfway housesResidential board and care facilitiesSocial rehabilitation facilities"
3.308,Section 308 Institutional Group I,308.2.1,308.2.1 Condition 1,3,"This occupancy condition shall include buildings in which all persons receiving custodial care who, without any assistance, are capable of responding to an emergency situation to complete building evacuation."
3.308,Section 308 Institutional Group I,308.2.2,308.2.2 Condition 2,3,This occupancy condition shall include buildings in which there are any persons receiving custodial care who require limited verbal or physical assistance while responding to an emergency situation to complete building evacuation.
3.308,Section 308 Institutional Group I,308.2.3,308.2.3 Six to 16 Persons Receiving Custodial Care,3,A facility housing not fewer than six and not more than 16 persons receiving custodial care shall be classified as Group R-4.
3.308,Section 308 Institutional Group I,308.2.4,308.2.4 Five or Fewer Persons Receiving Custodial Care,3,A facility with five or fewer persons receiving custodial care shall be classified as Group R-3 or shall comply with the Residential Code of New York State provided an automatic sprinkler system is installed in accordance with Section 903.3.1.3 or Section P2904 of the Residential Code of New York State.
3.308,Section 308 Institutional Group I,308.3,308.3 Institutional Group I-2,2,"Institutional Group I-2 occupancy shall include buildings and structures used for medical care on a 24-hour basis for more than five persons who are incapable of self-preservation. This group shall include, but not be limited to, the following:Foster care facilitiesDetoxification facilitiesHospitalsNursing homesPsychiatric hospitals"
3.308,Section 308 Institutional Group I,308.3.1,308.3.1 Occupancy Conditions,3,Buildings of Group I-2 shall be classified as one of the occupancy conditions specified in Section 308.3.1.1 or 308.3.1.2.
3.308,Section 308 Institutional Group I,308.3.1.1,308.3.1.1 Condition 1,4,"This occupancy condition shall include facilities that provide nursing and medical care but do not provide emergency care, surgery, obstetrics or in-patient stabilization units for psychiatric or detoxification, including but not limited to nursing homes and foster care facilities."
3.308,Section 308 Institutional Group I,308.3.1.2,308.3.1.2 Condition 2,4,"This occupancy condition shall include facilities that provide nursing and medical care and could provide emergency care, surgery, obstetrics or in-patient stabilization units for psychiatric or detoxification, including but not limited to hospitals."
3.308,Section 308 Institutional Group I,308.3.2,308.3.2 Five or Fewer Persons Receiving Medical Care,3,A facility with five or fewer persons receiving medical care shall be classified as Group R-3 or shall comply with the Residential Code of New York State provided an automatic sprinkler system is installed in accordance with Section 903.3.1.3 or Section P2904 of the Residential Code of New York State.
3.308,Section 308 Institutional Group I,308.4,308.4 Institutional Group I-3,2,"Institutional Group I-3 occupancy shall include buildings and structures that are inhabited by more than five persons who are under restraint or security. A Group I-3 facility is occupied by persons who are generally incapable of self-preservation due to security measures not under the occupants' control. This group shall include, but not be limited to, the following:Correctional centersDetention centersJailsPrerelease centersPrisonsReformatoriesBuildings of Group I-3 shall be classified as one of the occupancy conditions specified in Sections 308.4.1 through 308.4.5 (see Section 408.1)."
3.308,Section 308 Institutional Group I,308.4.1,308.4.1 Condition 1,3,"This occupancy condition shall include buildings in which free movement is allowed from sleeping areas, and other spaces where access or occupancy is permitted, to the exterior via means of egress without restraint. A Condition 1 facility is permitted to be constructed as Group R."
3.308,Section 308 Institutional Group I,308.4.2,308.4.2 Condition 2,3,This occupancy condition shall include buildings in which free movement is allowed from sleeping areas and any other occupied smoke compartment to one or more other smoke compartments. Egress to the exterior is impeded by locked exits.
3.308,Section 308 Institutional Group I,308.4.3,308.4.3 Condition 3,3,"This occupancy condition shall include buildings in which free movement is allowed within individual smoke compartments, such as within a residential unit comprised of individual sleeping units and group activity spaces, where egress is impeded by remote-controlled release of means of egress from such a smoke compartment to another smoke compartment."
3.308,Section 308 Institutional Group I,308.4.4,308.4.4 Condition 4,3,"This occupancy condition shall include buildings in which free movement is restricted from an occupied space. Remote-controlled release is provided to permit movement from sleeping units, activity spaces and other occupied areas within the smoke compartment to other smoke compartments."
3.308,Section 308 Institutional Group I,308.4.5,308.4.5 Condition 5,3,"This occupancy condition shall include buildings in which free movement is restricted from an occupied space. Staff-controlled manual release is provided to permit movement from sleeping units, activity spaces and other occupied areas within the smoke compartment to other smoke compartments."
3.308,Section 308 Institutional Group I,308.5,"308.5 Institutional Group I-4, Day Care Facilities",2,"Institutional Group I-4 occupancy shall include buildings and structures occupied by more than five persons of any age who receive custodial care for fewer than 24 hours per day by persons other than parents or guardians, relatives by blood, marriage or adoption, and in a place other than the home of the person cared for. This group shall include, but not be limited to, the following:Adult day careChild day care"
3.308,Section 308 Institutional Group I,308.5.1,308.5.1 Classification as Group E,3,"A child day care facility that provides care for more than five but not more than 100 children 21/2 years or less of age, where the rooms in which the children are cared for are located on a level of exit discharge serving such rooms and each of these child care rooms has an exit door directly to the exterior, shall be classified as Group E."
3.308,Section 308 Institutional Group I,308.5.2,308.5.2 Within a Place of Religious Worship,3,Rooms and spaces within places of religious worship providing such care during religious functions shall be classified as part of the primary occupancy.
3.308,Section 308 Institutional Group I,308.5.3,308.5.3 Five or Fewer Persons Receiving Care,3,A facility having five or fewer persons receiving custodial care shall be classified as part of the primary occupancy.
3.308,Section 308 Institutional Group I,308.5.4,308.5.4 Five or Fewer Persons Receiving Care in a Dwelling Unit,3,A facility such as the above within a dwelling unit and having five or fewer persons receiving custodial care shall be classified as a Group R-3 occupancy or shall comply with the Residential Code of New York State.
3,Chapter 3 Occupancy Classification and Use,309,Section 309 Mercantile Group M,1,
3.309,Section 309 Mercantile Group M,309.1,309.1 Mercantile Group M,2,"Mercantile Group M occupancy includes, among others, the use of a building or structure or a portion thereof for the display and sale of merchandise, and involves stocks of goods, wares or merchandise incidental to such purposes and accessible to the public. Mercantile occupancies shall include, but not be limited to, the following:Department storesDrug storesMarketsGreenhouses for display and sale of plants that provide public access.Motor fuel-dispensing facilitiesRetail or wholesale storesSales rooms"
3.309,Section 309 Mercantile Group M,309.2,309.2 Quantity of Hazardous Materials,2,The aggregate quantity of nonflammable solid and nonflammable or noncombustible liquid hazardous materials stored or displayed in a single control area of a Group M occupancy shall not exceed the quantities in Table 414.2.5(1).
3,Chapter 3 Occupancy Classification and Use,310,Section 310 Residential Group R,1,
3.310,Section 310 Residential Group R,310.1,310.1 Residential Group R,2,"Residential Group R includes, among others, the use of a building or structure, or a portion thereof, for sleeping purposes when not classified as an Institutional Group I or when not regulated by the Residential Code of New York State."
3.310,Section 310 Residential Group R,310.2,310.2 Residential Group R-1,2,"Residential Group R-1 occupancies containing sleeping units where the occupants are primarily transient in nature, including:Boarding houses (transient) with more than 10 occupantsCongregate living facilities (transient) with more than 10 occupantsHotels (transient)Motels (transient)"
3.310,Section 310 Residential Group R,310.3,310.3 Residential Group R-2,2,"Residential Group R-2 occupancies containing sleeping units or more than two dwelling units where the occupants are primarily permanent in nature, including:Apartment housesCongregate living facilities (nontransient) with more than 16 occupantsBoarding houses (nontransient)ConventsDormitoriesFraternities and sororitiesMonasteriesHotels (nontransient)Live/work unitsMotels (nontransient)Vacation timeshare properties"
3.310,Section 310 Residential Group R,310.4,310.4 Residential Group R-3,2,"Residential Group R-3 occupancies where the occupants are primarily permanent in nature and not classified as Group R-1, R-2, R-4 or I, including:Buildings that do not contain more than two dwelling unitsCare facilities that provide accommodations for five or fewer persons receiving careCongregate living facilities (nontransient) with 16 or fewer occupantsBoarding houses (nontransient)ConventsDormitoriesFraternities and sororitiesMonasteriesCongregate living facilities (transient) with 10 or fewer occupantsBoarding houses (transient)Lodging houses (transient) with five or fewer guest rooms and 10 or fewer occupants"
3.310,Section 310 Residential Group R,310.4.1,310.4.1 Care Facilities Within a Dwelling,3,Care facilities for five or fewer persons receiving care that are within a single-family dwelling are permitted to comply with the Residential Code of New York State provided an automatic sprinkler system is installed in accordance with Section 903.3.1.3 or Section P2904 of the Residential Code of New York State.
3.310,Section 310 Residential Group R,310.4.2,310.4.2 Lodging Houses,3,Owner-occupied lodging houses with five or fewer guest rooms and 10 or fewer total occupants shall be permitted to be constructed in accordance with the Residential Code of New York State.
3.310,Section 310 Residential Group R,310.5,310.5 Residential Group R-4,2,"Residential Group R-4 occupancy shall include buildings, structures or portions thereof for more than five but not more than 16 persons, excluding staff, who reside on a 24-hour basis in a supervised residential environment and receive custodial care. Buildings of Group R-4 shall be classified as one of the occupancy conditions specified in Section 310.5.1 or 310.5.2. This group shall include, but not be limited to, the following:Alcohol and drug centersAssisted living facilitiesCongregate care facilitiesGroup homesHalfway housesResidential board and care facilitiesSocial rehabilitation facilitiesGroup R-4 occupancies shall meet the requirements for construction as defined for Group R-3, except as otherwise provided for in this code."
3.310,Section 310 Residential Group R,310.5.1,310.5.1 Condition 1,3,"This occupancy condition shall include buildings in which all persons receiving custodial care, without any assistance, are capable of responding to an emergency situation to complete building evacuation."
3.310,Section 310 Residential Group R,310.5.2,310.5.2 Condition 2,3,This occupancy condition shall include buildings in which there are any persons receiving custodial care who require limited verbal or physical assistance while responding to an emergency situation to complete building evacuation.
3,Chapter 3 Occupancy Classification and Use,311,Section 311 Storage Group S,1,
3.311,Section 311 Storage Group S,311.1,311.1 Storage Group S,2,"Storage Group S occupancy includes, among others, the use of a building or structure, or a portion thereof, for storage that is not classified as a hazardous occupancy."
3.311,Section 311 Storage Group S,311.1.1,311.1.1 Accessory Storage Spaces,3,A room or space used for storage purposes that is accessory to another occupancy shall be classified as part of that occupancy.
3.311,Section 311 Storage Group S,311.2,"311.2 Moderate-Hazard Storage, Group S-1",2,"Storage Group S-1 occupancies are buildings occupied for storage uses that are not classified as Group S-2, including, but not limited to, storage of the following:Aerosol products, Levels 2 and 3Aircraft hangar (storage and repair)Bags: cloth, burlap and paperBamboos and rattanBasketsBelting: canvas and leatherBooks and paper in rolls or packsBoots and shoesButtons, including cloth covered, pearl or boneCardboard and cardboard boxesClothing, woolen wearing apparelCordageDry boat storage (indoor)FurnitureFursGlues, mucilage, pastes and sizeGrainsHorns and combs, other than celluloidLeatherLinoleumLumberMotor vehicle repair garages complying with the maximum allowable quantities of hazardous materials listed in Table 307.1(1) (see Section 406.8)Photo engravingsResilient flooringSelf-service storage facility (mini-storage)SilksSoapsSugarTires, bulk storage ofTobacco, cigars, cigarettes and snuffUpholstery and mattressesWax candles"
3.311,Section 311 Storage Group S,311.3,"311.3 Low-Hazard Storage, Group S-2",2,"Storage Group S-2 occupancies include, among others, buildings used for the storage of noncombustible materials such as products on wood pallets or in paper cartons with or without single thickness divisions; or in paper wrappings. Such products are permitted to have a negligible amount of plastic trim, such as knobs, handles or film wrapping. Group S-2 storage uses shall include, but not be limited to, storage of the following:AsbestosBeverages up to and including 16-percent alcohol in metal, glass or ceramic containersCement in bagsChalk and crayonsDairy products in nonwaxed coated paper containersDry cell batteriesElectrical coilsElectrical motorsEmpty cansFood productsFoods in noncombustible containersFresh fruits and vegetables in nonplastic trays or containersFrozen foodsGlassGlass bottles, empty or filled with noncombustible liquidsGypsum boardInert pigmentsIvoryMeatsMetal cabinetsMetal desks with plastic tops and trimMetal partsMetalsMirrorsOil-filled and other types of distribution transformersParking garages, open or enclosedPorcelain and potteryStovesTalc and soapstonesWashers and dryers"
3,Chapter 3 Occupancy Classification and Use,312,Section 312 Utility and Miscellaneous Group U,1,
3.312,Section 312 Utility and Miscellaneous Group U,312.1,"<span class=""code_addition"">[NY]</span>  312.1 General",2,"Buildings and structures of an accessory character and miscellaneous structures not classified in any specific occupancy shall be constructed, equipped and maintained to conform to the requirements of this code commensurate with the fire and life hazard incidental to their occupancy. Group U shall include, but not be limited to, the following: Agricultural buildings Aircraft hangars, accessory to a one- or two-family residence (see Section 412.4) Barns Carports Communication equipment structures with a gross floor area of less than 1,500 square feet (139 m2) Fences more than 6 feet (1829 mm) in height Grain silos, accessory to a residential occupancy Live fire training facilities Livestock shelters Private garages Retaining walls Sheds Stables Tanks Towers"
3.312,Section 312 Utility and Miscellaneous Group U,312.1.1,312.1.1 Greenhouses,3,Greenhouses not classified as another occupancy shall be classified as Use Group U.
