id,section,reference,title,depth,body
,,3,Chapter 3 Occupancy Classification and Use,0,"User note: About this chapter: Chapter 3 provides the criteria by which buildings and structures are classified into use groups and occupancies. Through the balance of the code, occupancy classification is fundamental in the setting of features of construction; occupant safety requirements, especially building limitations; means of egress; fire protection systems; and interior finishes."
3,Chapter 3 Occupancy Classification and Use,301,Section 301 Scope,1,
3.301,Section 301 Scope,301.1,301.1 General,2,The provisions of this chapter shall control the classification of all buildings and structures as to occupancy and use. Different classifications of occupancy and use represent varying levels of hazard and risk to building occupants and adjacent properties.
3,Chapter 3 Occupancy Classification and Use,302,Section 302 Occupancy Classification and Use Designation,1,
3.302,Section 302 Occupancy Classification and Use Designation,302.1,302.1 Occupancy Classification,2,"Occupancy classification is the formal designation of the primary purpose of the building, structure or portion thereof. Structures shall be classified into one or more of the occupancy groups listed in this section based on the nature of the hazards and risks to building occupants generally associated with the intended purpose of the building or structure. An area, room or space that is intended to be occupied at different times for different purposes shall comply with all applicable requirements associated with such potential multipurpose. Structures containing multiple occupancy groups shall comply with Section 508. Where a structure is proposed for a purpose that is not specifically listed in this section, such structure shall be classified in the occupancy it most nearly resembles based on the fire safety and relative hazard. Occupied roofs shall be classified in the group that the occupancy most nearly resembles, according to the fire safety and relative hazard, and shall comply with Section 503.1.4.Assembly (see Section 303): Groups A-1, A-2, A-3, A-4 and A-5.Business (see Section 304): Group B.Educational (see Section 305): Group E.Factory and Industrial (see Section 306): Groups F-1 and F-2.High Hazard (see Section 307): Groups H-1, H-2, H-3, H-4 and H-5.Institutional (see Section 308): Groups I-1, I-2, I-3 and I-4.Mercantile (see Section 309): Group M.Residential (see Section 310): Groups R-1, R-2, R-3 and R-4.Storage (see Section 311): Groups S-1 and S-2.Utility and Miscellaneous (see Section 312): Group U."
3.302,Section 302 Occupancy Classification and Use Designation,302.2,302.2 Use Designation,2,"Occupancy groups contain subordinate uses having similar hazards and risks to building occupants. Uses include, but are not limited to, those functional designations listed within the occupancy group descriptions in Section 302.1. Certain uses require specific limitations and controls in accordance with the provisions of Chapter 4 and elsewhere in this code."
3,Chapter 3 Occupancy Classification and Use,303,Section 303 Assembly Group A,1,
3.303,Section 303 Assembly Group A,303.1,303.1 Assembly Group A,2,"Assembly Group A occupancy includes, among others, the use of a building or structure, or a portion thereof, for the gathering of persons for purposes such as civic, social or religious functions; recreation, food or drink consumption or awaiting transportation."
3.303,Section 303 Assembly Group A,303.1.1,303.1.1 Small Buildings and Tenant Spaces,3,A building or tenant space used for assembly purposes with an occupant load of less than 50 persons shall be classified as a Group B occupancy.
3.303,Section 303 Assembly Group A,303.1.2,303.1.2 Small Assembly Spaces,3,The following rooms and spaces shall not be classified as Assembly occupancies:A room or space used for assembly purposes with an occupant load of less than 50 persons and accessory to another occupancy shall be classified as a Group B occupancy or as part of that occupancy.A room or space used for assembly purposes that is less than 750 square feet (70 m2) in area and accessory to another occupancy shall be classified as a Group B occupancy or as part of that occupancy.
3.303,Section 303 Assembly Group A,303.1.3,303.1.3 Associated With Group E Occupancies,3,A room or space used for assembly purposes that is associated with a Group E occupancy is not considered a separate occupancy.
3.303,Section 303 Assembly Group A,303.1.4,303.1.4 Accessory to Places of Religious Worship,3,Accessory religious educational rooms and religious auditoriums with occupant loads of less than 100 per room or space are not considered separate occupancies.
3.303,Section 303 Assembly Group A,303.2,303.2 Assembly Group A-1,2,"Group A-1 occupancy includes assembly uses, usually with fixed seating, intended for the production and viewing of the performing arts or motion pictures including, but not limited to:Motion picture theatersSymphony and concert hallsTelevision and radio studios admitting an audienceTheaters"
3.303,Section 303 Assembly Group A,303.3,303.3 Assembly Group A-2,2,"Group A-2 occupancy includes assembly uses intended for food and/or drink consumption including, but not limited to:Banquet hallsCasinos (gaming areas)NightclubsRestaurants, cafeterias and similar dining facilities (including associated commercial kitchens)Taverns and bars"
3.303,Section 303 Assembly Group A,303.4,303.4 Assembly Group A-3,2,"Group A-3 occupancy includes assembly uses intended for worship, recreation or amusement and other assembly uses not classified elsewhere in Group A including, but not limited to:Amusement arcadesArt galleriesBowling alleysCommunity hallsCourtroomsDance halls (not including food or drink consumption)Exhibition hallsFuneral parlorsGreenhouses for the conservation and exhibition of plants that provide public access.Gymnasiums (without spectator seating)Indoor swimming pools (without spectator seating)Indoor tennis courts (without spectator seating)Lecture hallsLibrariesMuseumsPlaces of religious worshipPool and billiard parlorsWaiting areas in transportation terminals"
3.303,Section 303 Assembly Group A,303.5,303.5 Assembly Group A-4,2,"Group A-4 occupancy includes assembly uses intended for viewing of indoor sporting events and activities with spectator seating including, but not limited to:ArenasSkating rinksSwimming poolsTennis courts"
3.303,Section 303 Assembly Group A,303.6,303.6 Assembly Group A-5,2,"Group A-5 occupancy includes assembly uses intended for participation in or viewing outdoor activities including, but not limited to:Amusement park structuresBleachersGrandstandsStadiums"
3,Chapter 3 Occupancy Classification and Use,304,Section 304 Business Group B,1,
3.304,Section 304 Business Group B,304.1,304.1 Business Group B,2,"Business Group B occupancy includes, among others, the use of a building or structure, or a portion thereof, for office, professional or service-type transactions, including storage of records and accounts. Business occupancies shall include, but not be limited to, the following:Airport traffic control towersAmbulatory care facilitiesAnimal hospitals, kennels and poundsBanksBarber and beauty shopsCar washCivic administrationClinic, outpatientDry cleaning and laundries: pick-up and delivery stations and self-serviceEducational occupancies for students above the 12th gradeElectronic data processingFood processing establishments and commercial kitchens not associated with restaurants, cafeterias and similar dining facilities not more than 2,500 square feet (232 m2) in area.Laboratories: testing and researchMotor vehicle showroomsPost officesPrint shopsProfessional services (architects, attorneys, dentists, physicians, engineers, etc.)Radio and television stationsTelephone exchangesTraining and skill development not in a school or academic program (this shall include, but not be limited to, tutoring centers, martial arts studios, gymnastics and similar uses regardless of the ages served, and where not classified as a Group A occupancy)."
3,Chapter 3 Occupancy Classification and Use,305,Section 305 Educational Group E,1,
3.305,Section 305 Educational Group E,305.1,305.1 Educational Group E,2,"Educational Group E occupancy includes, among others, the use of a building or structure, or a portion thereof, by six or more persons at any one time for educational purposes through the 12th grade."
3.305,Section 305 Educational Group E,305.1.1,305.1.1 Accessory to Places of Religious Worship,3,"Religious educational rooms and religious auditoriums, which are accessory to places of religious worship in accordance with Section 303.1.4 and have occupant loads of less than 100 per room or space, shall be classified as Group A-3 occupancies."
3.305,Section 305 Educational Group E,305.2,"305.2 Group E, Day Care Facilities",2,"This group includes buildings and structures or portions thereof occupied by more than five children older than 21/2 years of age who receive educational, supervision or personal care services for fewer than 24 hours per day."
3.305,Section 305 Educational Group E,305.2.1,305.2.1 Within Places of Religious Worship,3,Rooms and spaces within places of religious worship providing such day care during religious functions shall be classified as part of the primary occupancy.
3.305,Section 305 Educational Group E,305.2.2,305.2.2 Five or Fewer Children,3,A facility having five or fewer children receiving such day care shall be classified as part of the primary occupancy.
3.305,Section 305 Educational Group E,305.2.3,305.2.3 Five or Fewer Children in a Dwelling Unit,3,A facility such as the above within a dwelling unit and having five or fewer children receiving such day care shall be classified as a Group R-3 occupancy or shall comply with the Residential Code of New York State.
3,Chapter 3 Occupancy Classification and Use,306,Section 306 Factory Group F,1,
3.306,Section 306 Factory Group F,306.1,306.1 Factory Industrial Group F,2,"Factory Industrial Group F occupancy includes, among others, the use of a building or structure, or a portion thereof, for assembling, disassembling, fabricating, finishing, manufacturing, packaging, repair or processing operations that are not classified as a Group H hazardous or Group S storage occupancy."
3.306,Section 306 Factory Group F,306.2,"306.2 Moderate-Hazard Factory Industrial, Group F-1",2,"Factory industrial uses that are not classified as Factory Industrial F-2 Low Hazard shall be classified as F-1 Moderate Hazard and shall include, but not be limited to, the following:Aircraft (manufacturing, not to include repair)AppliancesAthletic equipmentAutomobiles and other motor vehiclesBakeriesBeverages: over 16-percent alcohol contentBicyclesBoatsBrooms or brushesBusiness machinesCameras and photo equipmentCanvas or similar fabricCarpets and rugs (includes cleaning)ClothingConstruction and agricultural machineryDisinfectantsDry cleaning and dyeingElectric generation plantsElectronicsEngines (including rebuilding)Food processing establishments and commercial kitchens not associated with restaurants, cafeterias and similar dining facilities more than 2,500 square feet (232 m2) in area.FurnitureHemp productsJute productsLaundriesLeather productsMachineryMetalsMillwork (sash and door)Motion pictures and television filming (without spectators)Musical instrumentsOptical goodsPaper mills or productsPhotographic filmPlastic productsPrinting or publishingRecreational vehiclesRefuse incinerationShoesSoaps and detergentsTextilesTobaccoTrailersUpholsteringWood; distillationWoodworking (cabinet)"
3.306,Section 306 Factory Group F,306.3,"306.3 Low-Hazard Factory Industrial, Group F-2",2,"Factory industrial uses that involve the fabrication or manufacturing of noncombustible materials that during finishing, packing or processing do not involve a significant fire hazard shall be classified as F-2 occupancies and shall include, but not be limited to, the following:Beverages: up to and including 16-percent alcohol contentBrick and masonryCeramic productsFoundriesGlass productsGypsumIceMetal products (fabrication and assembly)"
3,Chapter 3 Occupancy Classification and Use,307,Section 307 High-Hazard Group H,1,
3.307,Section 307 High-Hazard Group H,307.1,[F]  307.1 High-Hazard Group H,2,"High-hazard Group H occupancy includes, among others, the use of a building or structure, or a portion thereof, that involves the manufacturing, processing, generation or storage of materials that constitute a physical or health hazard in quantities in excess of those allowed in control areas complying with Section 414, based on the maximum allowable quantity limits for control areas set forth in Tables 307.1(1) and 307.1(2). Hazardous occupancies are classified in Groups H-1, H-2, H-3, H-4 and H-5 and shall be in accordance with this section, the requirements of Section 415 and the Fire Code of New York State. Hazardous materials stored, or used on top of roofs or canopies, shall be classified as outdoor storage or use and shall comply with the Fire Code of New York State. TABLE 307.1(1)MAXIMUM ALLOWABLE QUANTITY PER CONTROL AREA OF HAZARDOUS MATERIALS POSING A PHYSICAL HAZARDa, j, m, n, p MATERIAL CLASS GROUP WHEN THE MAXIMUMALLOWABLE QUANTITY ISEXCEEDED STORAGEb USE-CLOSED SYSTEMSb USE-OPEN SYSTEMSb Solid pounds(cubic feet) Liquid gallons(pounds) Gas cubic feet at NTP Solid pounds(cubic feet) Liquid gallons(pounds) Gas cubic feet at NTP Solid pounds(cubic feet) Liquid gallons (pounds) Combustible dust NA H-2 See Note q NA NA See Note q NA NA See Note q NA Combustible fiberq Loose H-3 (100) NA NA (100) NA NA (20) NA Baledo (1,000) (1,000) (200) Combustible liquidc, i II H-2 or H-3 NA 120d, e NA NA 120d NA NA 30d IIIA H-2 or H-3 330d, e 330d 80d IIIB NA 13,200e, f 13,200f 3,300f Cryogenic flammable NA H-2 NA 45d NA NA 45d NA NA 10d Cryogenic inert NA NA NA NA NL NA NA NL NA NA Cryogenic oxidizing NA H-3 NA 45d NA NA 45d NA NA 10d Explosives Division 1.1 H-1 1e, g (1)e, g NA 0.25g (0.25)g NA 0.25g (0.25)g Division 1.2 H-1 1e, g (1)e, g 0.25g (0.25)g 0.25g (0.25)g Division 1.3 H-1 or H-2 5e, g (5)e, g 1g (1)g 1g (1)g Division 1.4 H-3 50e, g (50)e, g 50g (50)g NA NA Division 1.4G H-3 125e, l NA NA NA NA NA Division 1.5 H-1 1e, g (1)e, g 0.25g (0.25)g 0.25g (0.25)g Division 1.6 H-1 1e, g NA NA NA NA NA Flammable gas Gaseous H-2 NA NA 1,000d,e NA NA 1,000d,e NA NA Liquefied (150)d,e NA (150)d,e NA Flammable liquidc IA H-2 or H-3 NA 30d, e NA NA 30d NA NA 10d IB and IC 120d, e 120d 30d Flammable liquid, combination (IA, IB, IC) NA H-2 or H-3 NA 120d, e, h NA NA 120d, h NA NA 30d, h Flammable solid NA H-3 125d, e NA NA 125d NA NA 25d NA Inert gas Gaseous NA NA NA NL NA NA NL NA NA Liquefied NA NA NA NL NA NA NL NA NA Organic peroxide UD H-1 1e, g (1)e, g NA 0.25g (0.25)g NA 0.25g (0.25)g I H-2 5d, e (5)d, e 1d (1)d 1d (1)d II H-3 50d, e (50)d, e 50d (50)d 10d (10)d III H-3 125d, e (125)d, e 125d (125)d 25d (25)d IV NA NL NL NL NL NL NL V NA NL NL NL NL NL NL Oxidizer 4 H-1 1g (1)e, g NA 0.25g (0.25)g NA 0.25g (0.25)g 3k H-2 or H-3 10d, e (10)d, e 2d (2)d 2d (2)d 2 H-3 250d, e (250)d, e 250d (250)d 50d (50)d 1 NA 4,000e, f (4,000)e, f 4,000f (4,000)f 1,000f (1,000)f Oxidizing gas Gaseous H-3 NA NA 1,500d,e NA NA 1,500d,e NA NA Liquefied (150)d, e NA (150)d,e NA Pyrophoric NA H-2 4e, g (4)e, g 50e, g 1g (1)g 10e, g 0 0 Unstable (reactive) 4 H-1 1e, g (1)e, g 10e, g 0.25g (0.25)g 2e, g 0.25g (0.25)g 3 H-1 or H-2 5d, e (5)d, e 50d, e 1d (1)d 10d, e 1d (1)d 2 H-3 50d, e (50)d, e 750d, e 50d (50)d 750d, e 10d (10)d 1 NA NL NL NL NL NL NL NL NL Water reactive 3 H-2 5d, e (5)d, e NA 5d (5)d NA 1d (1)d 2 H-3 50d, e (50)d, e 50d (50)d 10d (10)d 1 NA NL NL NL NL NL NL For SI: 1 cubic foot = 0.028 m3, 1 pound = 0.454 kg, 1 gallon = 3.785 L. NL = Not Limited; NA = Not Applicable; UD = Unclassified Detonable. For use of control areas, see Section 414.2. The aggregate quantity in use and storage shall not exceed the quantity listed for storage. The quantities of alcoholic beverages in retail and wholesale sales occupancies shall not be limited provided the liquids are packaged in individual containers not exceeding 1.3 gallons. In retail and wholesale sales occupancies, the quantities of medicines, foodstuffs or consumer products, and cosmetics containing not more than 50 percent by volume of water-miscible liquids with the remainder of the solutions not being flammable, shall not be limited, provided that such materials are packaged in individual containers not exceeding 1.3 gallons. Maximum allowable quantities shall be increased 100 percent in buildings equipped throughout with an automatic sprinkler system in accordance with Section 903.3.1.1. Where Note e also applies, the increase for both notes shall be applied accumulatively. Maximum allowable quantities shall be increased 100 percent when stored in approved storage cabinets, day boxes, gas cabinets, gas rooms or exhausted enclosures or in listed safety cans in accordance with Section 5003.9.10 of the Fire Code of New York State. Where Note d also applies, the increase for both notes shall be applied accumulatively. Quantities shall not be limited in a building equipped throughout with an automatic sprinkler system in accordance with Section 903.3.1.1. Allowed only in buildings equipped throughout with an automatic sprinkler system in accordance with Section 903.3.1.1. Containing not more than the maximum allowable quantity per control area of Class IA, IB or IC flammable liquids. The maximum allowable quantity shall not apply to fuel oil storage complying with Section 603.3.2 of the Fire Code of New York State. Quantities in parentheses indicate quantity units in parentheses at the head of each column. A maximum quantity of 220 pounds of solid or 22 gallons of liquid Class 3 oxidizers is allowed when such materials are necessary for maintenance purposes, operation or sanitation of equipment when the storage containers and the manner of storage are approved. Net weight of the pyrotechnic composition of the fireworks. Where the net weight of the pyrotechnic composition of the fireworks is not known, 25 percent of the gross weight of the fireworks, including packaging, shall be used. For gallons of liquids, divide the amount in pounds by 10 in accordance with Section 5003.1.2 of the Fire Code of New York State. For storage and display quantities in Group M and storage quantities in Group S occupancies complying with Section 414.2.5, see Tables 414.2.5(1) and 414.2.5(2). Densely packed baled cotton that complies with the packing requirements of ISO 8115 shall not be included in this material class. The following shall not be included in determining the maximum allowable quantities: Liquid or gaseous fuel in fuel tanks on vehicles. Liquid or gaseous fuel in fuel tanks on motorized equipment operated in accordance with the Fire Code of New York State. Gaseous fuels in piping systems and fixed appliances regulated by the Fuel Gas Code of New York State. Liquid fuels in piping systems and fixed appliances regulated by the Mechanical Code of New York State. Alcohol-based hand rubs classified as Class I or II liquids in dispensers that are installed in accordance with Sections 5705.5 and 5705.5.1 of the Fire Code of New York State. The location of the alcohol-based hand rub (ABHR) dispensers shall be provided in the construction documents. Where manufactured, generated or used in such a manner that the concentration and conditions create a fire or explosion hazard based on information prepared in accordance with Section 414.1.3. [F] TABLE 307.1(2)MAXIMUM ALLOWABLE QUANTITY PER CONTROL AREA OF HAZARDOUS MATERIALS POSING A HEALTH HAZARDa, c, f, h, i MATERIAL STORAGEb USE-CLOSED SYSTEMSb USE-OPEN SYSTEMSb Solidpoundsd, e Liquid gallons(pounds)d, e Gas cubic feet at NTP(pounds)d Solidpoundsd Liquid gallons(pounds)d Gas cubic feet at NTP(pounds)d Solidpoundsd Liquid gallons(pounds)d Corrosives 5,000 500 Gaseous 810e Liquefied (150) 5,000 500 Gaseous 810e Liquefied (150) 1,000 100 Highly Toxic 10 (10) Gaseous 20g Liquefied (4)g 10 (10) Gaseous 20g Liquefied (4)g 3 (3) Toxic 500 (500) Gaseous 810e Liquefied (150)e 500 (500) Gaseous 810e Liquefied (150)e 125 (125) For SI: 1 cubic foot = 0.028 m3, 1 pound = 0.454 kg, 1 gallon = 3.785 L. For use of control areas, see Section 414.2. The aggregate quantity in use and storage shall not exceed the quantity listed for storage. In retail and wholesale sales occupancies, the quantities of medicines, foodstuffs or consumer products, and cosmetics containing not more than 50 percent by volume of water-miscible liquids and with the remainder of the solutions not being flammable, shall not be limited, provided that such materials are packaged in individual containers not exceeding 1.3 gallons. Maximum allowable quantities shall be increased 100 percent in buildings equipped throughout with an approved automatic sprinkler system in accordance with Section 903.3.1.1. Where Note e also applies, the increase for both notes shall be applied accumulatively. Maximum allowable quantities shall be increased 100 percent where stored in approved storage cabinets, gas cabinets or exhausted enclosures as specified in the Fire Code of New York State. Where Note d also applies, the increase for both notes shall be applied accumulatively. For storage and display quantities in Group M and storage quantities in Group S occupancies complying with Section 414.2.5, see Tables 414.2.5(1) and 414.2.5(2). Allowed only where stored in approved exhausted gas cabinets or exhausted enclosures as specified in the Fire Code of New York State. Quantities in parentheses indicate quantity units in parentheses at the head of each column. For gallons of liquids, divide the amount in pounds by 10 in accordance with Section 5003.1.2 of the Fire Code of New York State."
3.307,Section 307 High-Hazard Group H,307.1.1,[F]  307.1.1 Uses Other Than Group H,3,"An occupancy that stores, uses or handles hazardous materials as described in one or more of the following items shall not be classified as Group H, but shall be classified as the occupancy that it most nearly resembles. Buildings and structures occupied for the application of flammable finishes, provided that such buildings or areas conform to the requirements of Section 416 and the Fire Code of New York State. Wholesale and retail sales and storage of flammable and combustible liquids in mercantile occupancies conforming to the Fire Code of New York State. Closed piping system containing flammable or combustible liquids or gases utilized for the operation of machinery or equipment. Cleaning establishments that utilize combustible liquid solvents having a flash point of 140째F (60째C) or higher in closed systems employing equipment listed by an approved testing agency, provided that this occupancy is separated from all other areas of the building by 1-hour fire barriers constructed in accordance with Section 707 or 1-hour horizontal assemblies constructed in accordance with Section 711, or both. Cleaning establishments that utilize a liquid solvent having a flash point at or above 200째F (93째C). Liquor stores and distributors without bulk storage. Refrigeration systems. The storage or utilization of materials for agricultural purposes on the premises. Stationary storage battery systems installed in accordance with the Fire Code of New York State. Corrosive personal or household products in their original packaging used in retail display. Commonly used corrosive building materials. Buildings and structures occupied for aerosol product storage shall be classified as Group S-1, provided that such buildings conform to the requirements of the Fire Code of New York State. Display and storage of nonflammable solid and nonflammable or noncombustible liquid hazardous materials in quantities not exceeding the maximum allowable quantity per control area in Group M or S occupancies complying with Section 414.2.5. The storage of black powder, smokeless propellant and small arms primers in Groups M and R-3 and special industrial explosive devices in Groups B, F, M and S, provided such storage conforms to the quantity limits and requirements prescribed in the Fire Code of New York State. Stationary fuel cell power systems installed in accordance with the Fire Code of New York State. Capacitor energy storage systems in accordance with the Fire Code of New York State. Group B higher education laboratory occupancies complying with Section 428 and Chapter 38 of the Fire Code of New York State."
3.307,Section 307 High-Hazard Group H,307.2,[F]  307.2 Hazardous Materials,2,"Hazardous materials in any quantity shall conform to the requirements of this code, including Section 414, and the Fire Code of New York State."
3.307,Section 307 High-Hazard Group H,307.3,[F]  307.3 High-Hazard Group H-1,2,"Buildings and structures containing materials that pose a detonation hazard shall be classified as Group H-1. Such materials shall include, but not be limited to, the following:Detonable pyrophoric materialsExplosives:Division 1.1Division 1.2Division 1.3Division 1.4Division 1.5Division 1.6Organic peroxides, unclassified detonableOxidizers, Class 4Unstable (reactive) materials, Class 3 detonable and Class 4"
