id,section,title,ifc_type,occupancy,design_phase,code_category,primary_responsibility,body
717.3.3.4,Section 717 Ducts and Air Transfer Openings,Ceiling Radiation Damper Actuation,Slab|Covering,Assembly (A)|Business (B)|Educational (E)|Factory and Industrial (F)|Institutional (I),dd|cd,fire_resistance_smoke_protection,mechanical_engineer,"The operating temperature of a ceiling radiation damper actuation device shall be 50°F (27.8°C) above the normal temperature within the duct system, but not less than 160°F (71°C)."
717.3.3.5,Section 717 Ducts and Air Transfer Openings,Corridor Damper Actuation,Wall|Door|Slab,Assembly (A)|Business (B)|Educational (E)|Institutional (I)|Residential (R),dd|cd,fire_resistance_smoke_protection,fire_protection_engineer,Corridor damper actuation shall be in accordance with Sections 717.3.3.1 and 717.3.3.2.
717.4,Section 717 Ducts and Air Transfer Openings,Access and Identification,Wall|Slab|Covering,Assembly (A)|Business (B)|Educational (E)|Institutional (I)|Residential (R),dd|cd,fire_protection_alarm_systems,mechanical_engineer,"Fire and smoke dampers shall be provided with an approved means of access that is large enough to permit inspection and maintenance of the damper and its operating parts. The access shall not affect the integrity of fire-resistance-rated assemblies. The access openings shall not reduce the fire-resistance rating of the assembly. Access points shall be permanently identified on the exterior by a label having letters not less than 1/2 inch (12.7 mm) in height reading: FIRE/SMOKE DAMPER, SMOKE DAMPER or FIRE DAMPER. Access doors in ducts shall be tight fitting and suitable for the required duct construction."
717.5,Section 717 Ducts and Air Transfer Openings,Where Required,Wall|Slab|Door,Assembly (A)|Business (B)|Educational (E)|Institutional (I)|Residential (R),dd|cd,fire_resistance_smoke_protection,fire_protection_engineer,"Fire, dampers, smoke dampers, combination fire/smoke dampers, ceiling radiation dampers and corridor dampers shall be provided at the locations prescribed in Sections 717.5.1 through 717.5.7 and 717.6. Where an assembly is required to have both fire dampers and smoke dampers, combination fire/smoke dampers or a fire damper and a smoke damper shall be provided."
717.5.1,Section 717 Ducts and Air Transfer Openings,Fire Walls,Wall,Assembly (A)|Business (B)|Educational (E)|Residential (R)|Institutional (I),sd|dd|cd,fire_resistance_smoke_protection,architect,Ducts and air transfer openings permitted in fire walls in accordance with Section 706.11 shall be protected with listed fire dampers installed in accordance with their listing.
717.5.1.1,Section 717 Ducts and Air Transfer Openings,Horizontal Exits,Wall|Covering,Assembly (A)|Business (B)|Educational (E)|Factory and Industrial (F)|Institutional (I),dd|cd,fire_resistance_smoke_protection,fire_protection_engineer,A listed smoke damper designed to resist the passage of smoke shall be provided at each point a duct or air transfer opening penetrates a fire wall that serves as a horizontal exit.
717.5.2,Section 717 Ducts and Air Transfer Openings,Fire Barriers,Wall|Slab|Ramp,Assembly (A)|Business (B)|Educational (E)|Institutional (I)|Residential (R),sd|dd|cd,fire_resistance_smoke_protection,architect,"Ducts and air transfer openings of fire barriers shall be protected with approved fire dampers installed in accordance with their listing. Ducts and air transfer openings shall not penetrate enclosures for interior exit stairways and ramps and exit passageways, except as permitted by Sections 1023.5 and 1024.6, respectively. Exception: Fire dampers are not required at penetrations of fire barriers where any of the following apply: Penetrations are tested in accordance with ASTM E119 or UL 263 as part of the fire-resistance-rated assembly. Ducts are used as part of an approved smoke control system in accordance with Section 909 and where the use of a fire damper would interfere with the operation of a smoke control system. Such walls are penetrated by ducted HVAC systems, have a required fire-resistance rating of 1 hour or less, are in areas of other than Group H and are in buildings equipped throughout with an automatic sprinkler system in accordance with Section 903.3.1.1 or 903.3.1.2. For the purposes of this exception, a ducted HVAC system shall be a duct system for conveying supply, return or exhaust air as part of the structure's HVAC system. Such a duct system shall be constructed of sheet steel not less than No. 26 gage thickness and shall be continuous from the air-handling appliance or equipment to the air outlet and inlet terminals."
717.5.2.1,Section 717 Ducts and Air Transfer Openings,Horizontal Exits,Wall|Slab|Door,Assembly (A)|Business (B)|Educational (E)|Institutional (I)|Residential (R),sd|dd|cd,fire_resistance_smoke_protection,architect,A listed smoke damper designed to resist the passage of smoke shall be provided at each point a duct or air transfer opening penetrates a fire barrier that serves as a horizontal exit.
717.5.3,Section 717 Ducts and Air Transfer Openings,Shaft Enclosures,Wall|Slab|Door,Business (B)|Residential (R)|Assembly (A)|Storage (S)|Utility and Miscellaneous (U),dd|cd,fire_resistance_smoke_protection,architect,Shaft enclosures that are permitted to be penetrated by ducts and air transfer openings shall be protected with listed fire and smoke dampers installed in accordance with their listing. Exceptions: Fire and smoke dampers are not required at penetrations of exhaust shafts where steel exhaust subducts extend not less than 22 inches (559 mm) vertically in exhaust shafts provided there is a continuous airflow upward to the outside and the fan is provided with backup standby power. Fire dampers are not required where penetrations are tested in accordance with ASTM E119 or UL 263 as part of the fire-resistance-rated assembly. Fire and smoke dampers are not required where ducts are used as part of an approved smoke control system in accordance with Section 909. Fire and smoke dampers are not required where the penetrations are in dedicated parking garage exhaust or supply shafts that are separated from other building shafts by not less than 2-hour fire-resistance-rated construction. Smoke dampers are not required at penetrations of shafts where the building is equipped throughout with an automatic sprinkler system in accordance with Section 903.3.1.1 or 903.3.1.2. Fire dampers and combination fire/smoke dampers are not required in kitchen and clothes dryer exhaust systems when installed in accordance with the International Mechanical Code.
717.5.4,Section 717 Ducts and Air Transfer Openings,Fire Partitions,Wall|Covering|Slab,Assembly (A)|Business (B)|Educational (E)|Mercantile (M)|Residential (R),sd|dd|cd,fire_resistance_smoke_protection,architect,"Ducts and air transfer openings that penetrate fire partitions shall be protected with listed fire dampers installed in accordance with their listing. Exceptions: In occupancies other than Group H, fire dampers are not required where any of the following apply: Corridor walls in buildings equipped throughout with an automatic sprinkler system in accordance with Section 903.3.1.1 or 903.3.1.2 and the duct is protected as a through penetration in accordance with Section 714. Tenant partitions in covered and open mall buildings where the walls are not required by provisions elsewhere in the code to extend to the underside of the floor or roof sheathing, slab or deck above. The duct system is constructed of approved materials in accordance with the International Mechanical Code and the duct penetrating the wall complies with all of the following requirements: The duct shall not exceed 100 square inches (0.06 m2). The duct shall be constructed of steel not less than 0.0217 inch (0.55 mm) in thickness. The duct shall not have openings that communicate the corridor with adjacent spaces or rooms. The duct shall be installed above a ceiling. The duct shall not terminate at a wall register in the fire-resistance-rated wall. A minimum 12-inch-long (305 mm) by 0.060-inch-thick (1.52 mm) steel sleeve shall be centered in each duct opening. The sleeve shall be secured to both sides of the wall and all four sides of the sleeve with minimum 11/2-inch by 11/2-inch by 0.060-inch (38 mm by 38 mm by 1.52 mm) steel retaining angles. The retaining angles shall be secured to the sleeve and the wall with No. 10 (M5) screws. The annular space between the steel sleeve and the wall opening shall be filled with mineral wool batting on all sides. Such walls are penetrated by ducted HVAC systems, have a required fire-resistance rating of 1 hour or less, and are in buildings equipped throughout with an automatic sprinkler system in accordance with Section 903.3.1.1 or 903.3.1.2. For the purposes of this exception, a ducted HVAC system shall be a duct system for conveying supply, return or exhaust air as part of the structure's HVAC system. Such a duct system shall be constructed of sheet steel not less than No. 26 gage thickness and shall be continuous from the air-handling appliance or equipment to the air outlet and inlet terminals."
717.5.4.1,Section 717 Ducts and Air Transfer Openings,Corridors,Wall|Slab|Door,Assembly (A)|Business (B)|Educational (E)|Institutional (I)|Residential (R),sd|dd|cd,fire_resistance_smoke_protection,architect,"Duct and air transfer openings that penetrate corridors shall be protected with dampers as follows:A corridor damper shall be provided where corridor ceilings, constructed as required for the corridor walls as permitted in Section 708.4, Exception 3, are penetrated. A ceiling radiation damper shall be provided where the ceiling membrane of a fire-resistance-rated floor-ceiling or roof-ceiling assembly, constructed as permitted in Section 708.4, Exception 2, is penetrated. A listed smoke damper designed to resist the passage of smoke shall be provided at each point a duct or air transfer opening penetrates a corridor enclosure required to have smoke and draft control doors in accordance with Section 716.5.3. Exceptions: Smoke dampers are not required where the building is equipped throughout with an approved smoke control system in accordance with Section 909, and smoke dampers are not necessary for the operation and control of the system. Smoke dampers are not required in corridor penetrations where the duct is constructed of steel not less than 0.019 inch (0.48 mm) in thickness and there are no openings serving the corridor."
717.5.5,Section 717 Ducts and Air Transfer Openings,Smoke Barriers,Wall|Slab|Covering,Institutional (I)|Business (B)|Assembly (A),sd|dd|cd,fire_resistance_smoke_protection,architect,"A listed smoke damper designed to resist the passage of smoke shall be provided at each point a duct or air transfer opening penetrates a smoke barrier. Smoke dampers and smoke damper actuation methods shall comply with Section 717.3.3.2. Exceptions: Smoke dampers are not required where the openings in ducts are limited to a single smoke compartment and the ducts are constructed of steel. Smoke dampers are not required in smoke barriers required by Section 407.5 for Group I-2, Condition 2—where the HVAC system is fully ducted in accordance with Section 603 of the International Mechanical Code and where buildings are equipped throughout with an automatic sprinkler system in accordance with Section 903.3.1.1 and equipped with quick-response sprinklers in accordance with Section 903.3.2."
717.5.6,Section 717 Ducts and Air Transfer Openings,Exterior Walls,Wall,Assembly (A)|Business (B)|Educational (E)|Residential (R)|Institutional (I),dd|cd,fire_resistance_smoke_protection,architect,Ducts and air transfer openings in fire-resistance-rated exterior walls required to have protected openings in accordance with Section 705.10 shall be protected with listed fire dampers installed in accordance with their listing.
717.5.7,Section 717 Ducts and Air Transfer Openings,Smoke Partitions,Wall|Door|BuildingElementProxy,Assembly (A)|Business (B)|Educational (E)|Institutional (I)|Residential (R),sd|dd|cd,fire_resistance_smoke_protection,architect,"A listed smoke damper designed to resist the passage of smoke shall be provided at each point that an air transfer opening penetrates a smoke partition. Smoke dampers and smoke damper actuation methods shall comply with Section 717.3.3.2. Exception: Where the installation of a smoke damper will interfere with the operation of a required smoke control system in accordance with Section 909, approved alternative protection shall be utilized."
717.6,Section 717 Ducts and Air Transfer Openings,Horizontal Assemblies,Slab|Roof|Covering,Assembly (A)|Business (B)|Educational (E)|Factory and Industrial (F)|Residential (R),sd|dd|cd,fire_resistance_smoke_protection,architect,"Penetrations by ducts and air transfer openings of a floor, floor/ceiling assembly or the ceiling membrane of a roof/ceiling assembly shall be protected by a shaft enclosure that complies with Section 713 or shall comply with Sections 717.6.1 through 717.6.3."
717.6.1,Section 717 Ducts and Air Transfer Openings,Through Penetrations,Wall|Slab|Covering,Residential (R)|Institutional (I),sd|dd|cd,fire_resistance_smoke_protection,architect,"In occupancies other than Groups I-2 and I-3, a duct constructed of approved materials in accordance with the International Mechanical Code that penetrates a fire-resistance-rated floor/ceiling assembly that connects not more than two stories is permitted without shaft enclosure protection, provided a listed fire damper is installed at the floor line or the duct is protected in accordance with Section 714.4. For air transfer openings, see Section 712.1.9. Exception: A duct is permitted to penetrate three floors or less without a fire damper at each floor, provided such duct meets all of the following requirements:The duct shall be contained and located within the cavity of a wall and shall be constructed of steel having a minimum wall thickness of 0.0187 inches (0.4712 mm) (No. 26 gage). The duct shall open into only one dwelling or sleeping unit and the duct system shall be continuous from the unit to the exterior of the building. The duct shall not exceed 4-inch (102 mm) nominal diameter and the total area of such ducts shall not exceed 100 square inches (0.065 m2) in any 100 square feet (9.3 m2) of floor area.The annular space around the duct is protected with materials that prevent the passage of flame and hot gases sufficient to ignite cotton waste where subjected to ASTM E119 or UL 263 time-temperature conditions under a minimum positive pressure differential of 0.01 inch (2.49 Pa) of water at the location of the penetration for the time period equivalent to the fire-resistance rating of the construction penetrated.Grille openings located in a ceiling of a fire-resistance-rated floor/ceiling or roof/ceiling assembly shall be protected with a listed ceiling radiation damper installed in accordance with Section 717.6.2.1."
717.6.2,Section 717 Ducts and Air Transfer Openings,Membrane Penetrations,Slab|Roof|Wall,Assembly (A)|Business (B)|Educational (E)|Residential (R)|Institutional (I),sd|dd|cd,fire_resistance_smoke_protection,architect,Ducts and air transfer openings constructed of approved materials in accordance with the International Mechanical Code that penetrate the ceiling membrane of a fire-resistance-rated floor/ceiling or roof/ceiling assembly shall be protected with one of the following:A shaft enclosure in accordance with Section 713. A listed ceiling radiation damper installed at the ceiling line where a duct penetrates the ceiling of a fire-resistance-rated floor/ceiling or roof/ceiling assembly. A listed ceiling radiation damper installed at the ceiling line where a diffuser with no duct attached penetrates the ceiling of a fire-resistance-rated floor/ceiling or roof/ceiling assembly.
717.6.2.1,Section 717 Ducts and Air Transfer Openings,Ceiling Radiation Dampers,,,,,,"Ceiling radiation dampers shall be tested in accordance with Section 717.3.1. Ceiling radiation dampers shall be installed in accordance with the details listed in the fire-resistance-rated assembly and the manufacturer's instructions and the listing. Ceiling radiation dampers are not required where one of the following applies:Tests in accordance with ASTM E119 or UL 263 have shown that ceiling radiation dampers are not necessary in order to maintain the fire-resistance rating of the assembly. Where exhaust duct penetrations are protected in accordance with Section 714.4.2, are located within the cavity of a wall and do not pass through another dwelling unit or tenant space. Where duct and air transfer openings are protected with a duct outlet protection system tested as part of a fire-resistance-rated assembly in accordance with ASTM E119 or UL 263."
717.6.3,Section 717 Ducts and Air Transfer Openings,Nonfire-Resistance-Rated Floor Assemblies,Slab|BuildingElementProxy,Residential (R)|Business (B)|Assembly (A),dd|cd,fire_resistance_smoke_protection,mechanical_engineer,"Duct systems constructed of approved materials in accordance with the International Mechanical Code that penetrate nonfire-resistance-rated floor assemblies shall be protected by any of the following methods:A shaft enclosure in accordance with Section 713. The duct connects not more than two stories, and the annular space around the penetrating duct is protected with an approved noncombustible material that resists the free passage of flame and the products of combustion. In floor assemblies composed of noncombustible materials, a shaft shall not be required where the duct connects not more than three stories, the annular space around the penetrating duct is protected with an approved noncombustible material that resists the free passage of flame and the products of combustion and a fire damper is installed at each floor line. Exception: Fire dampers are not required in ducts within individual residential dwelling units."
717.7,Section 717 Ducts and Air Transfer Openings,Flexible Ducts and Air Connectors,Wall|Slab|Roof|BuildingElementProxy,Assembly (A)|Business (B)|Educational (E)|Residential (R)|Institutional (I),sd|dd|cd,fire_resistance_smoke_protection,mechanical_engineer,"Flexible ducts and air connectors shall not pass through any fire-resistance-rated assembly. Flexible air connectors shall not pass through any wall, floor or ceiling."
718.1,Section 718 Concealed Spaces,General,Wall|Slab|Roof,Assembly (A)|Business (B)|Educational (E)|Residential (R),sd|dd|cd,fire_resistance_smoke_protection,architect,"Fireblocking and draftstopping shall be installed in combustible concealed locations in accordance with this section. Fireblocking shall comply with Section 718.2. Draftstopping in floor/ceiling spaces and attic spaces shall comply with Sections 718.3 and 718.4, respectively. The permitted use of combustible materials in concealed spaces of buildings of Type I or II construction shall be limited to the applications indicated in Section 718.5."
718.2,Section 718 Concealed Spaces,Fireblocking,Wall|Floor|Roof|Slab|BuildingElementProxy,Assembly (A)|Business (B)|Educational (E)|Factory and Industrial (F)|Residential (R),sd|dd|cd,fire_resistance_smoke_protection,architect,"In combustible construction, fireblocking shall be installed to cut off concealed draft openings (both vertical and horizontal) and shall form an effective barrier between floors, between a top story and a roof or attic space. Fireblocking shall be installed in the locations specified in Sections 718.2.2 through 718.2.7."
718.2.1,Section 718 Concealed Spaces,Fireblocking Materials,Wall|Slab|Column,Assembly (A)|Business (B)|Educational (E)|Residential (R),dd|cd,fire_resistance_smoke_protection,architect,"Fireblocking shall consist of the following materials:Two-inch (51 mm) nominal lumber. Two thicknesses of 1-inch (25 mm) nominal lumber with broken lap joints. One thickness of 0.719-inch (18.3 mm) wood structural panels with joints backed by 0.719-inch (18.3 mm) wood structural panels. One thickness of 0.75-inch (19.1 mm) particleboard with joints backed by 0.75-inch (19 mm) particle-board.One-half-inch (12.7 mm) gypsum board. One-fourth-inch (6.4 mm) cement-based millboard.Batts or blankets of mineral wool, mineral fiber or other approved materials installed in such a manner as to be securely retained in place. Cellulose insulation installed as tested for the specific application."
718.2.1.1,Section 718 Concealed Spaces,Batts or Blankets of Mineral Wool or Mineral Fiber,Wall,Assembly (A)|Business (B)|Educational (E)|Factory and Industrial (F)|Residential (R),dd|cd,fire_resistance_smoke_protection,architect,Batts or blankets of mineral wool or mineral fiber or other approved nonrigid materials shall be permitted for compliance with the 10-foot (3048 mm) horizontal fireblocking in walls constructed using parallel rows of studs or staggered studs.
718.2.1.2,Section 718 Concealed Spaces,Unfaced Fiberglass,Wall,Assembly (A)|Business (B)|Educational (E)|Factory and Industrial (F)|Residential (R),cd,fire_resistance_smoke_protection,architect,"Unfaced fiberglass batt insulation used as fireblocking shall fill the entire cross section of the wall cavity to a minimum height of 16 inches (406 mm) measured vertically. Where piping, conduit or similar obstructions are encountered, the insulation shall be packed tightly around the obstruction."
718.2.1.3,Section 718 Concealed Spaces,Loose-Fill Insulation Material,Wall|Slab|Covering,Assembly (A)|Business (B)|Residential (R)|Educational (E)|Institutional (I),dd|cd,fire_resistance_smoke_protection,architect,"Loose-fill insulation material, insulating foam sealants and caulk materials shall not be used as a fireblock unless specifically tested in the form and manner intended for use to demonstrate its ability to remain in place and to retard the spread of fire and hot gases."
718.2.1.4,Section 718 Concealed Spaces,Fireblocking Integrity,Wall|Slab|Floor|Roof,Assembly (A)|Business (B)|Educational (E)|Residential (R)|Institutional (I),sd|dd|cd,fire_resistance_smoke_protection,architect,The integrity of fire-blocks shall be maintained.
718.2.1.5,Section 718 Concealed Spaces,Double Stud Walls,Wall,Assembly (A)|Business (B)|Educational (E)|Factory and Industrial (F)|Residential (R),sd|dd|cd,fire_resistance_smoke_protection,architect,Batts or blankets of mineral or glass fiber or other approved nonrigid materials shall be allowed as fireblocking in walls constructed using parallel rows of studs or staggered studs.
718.2.2,Section 718 Concealed Spaces,Concealed Wall Spaces,Wall|Covering,Assembly (A)|Business (B)|Educational (E)|Factory and Industrial (F)|Residential (R),sd|dd|cd,fire_resistance_smoke_protection,architect,"Fireblocking shall be provided in concealed spaces of stud walls and partitions, including furred spaces, and parallel rows of studs or staggered studs, as follows: Vertically at the ceiling and floor levels. Horizontally at intervals not exceeding 10 feet (3048 mm)."
718.2.3,Section 718 Concealed Spaces,Connections Between Horizontal and Vertical Spaces,Wall|Slab|Covering|Stair|Roof,Assembly (A)|Business (B)|Educational (E)|Residential (R)|Institutional (I),sd|dd|cd,fire_resistance_smoke_protection,architect,"Fireblocking shall be provided at interconnections between concealed vertical stud wall or partition spaces and concealed horizontal spaces created by an assembly of floor joists or trusses, and between concealed vertical and horizontal spaces such as occur at soffits, drop ceilings, cove ceilings and similar locations."
718.2.4,Section 718 Concealed Spaces,Stairways,Stair|StairFlight|Wall,Assembly (A)|Business (B)|Educational (E)|Residential (R)|Institutional (I),sd|dd|cd,fire_resistance_smoke_protection,architect,Fireblocking shall be provided in concealed spaces between stair stringers at the top and bottom of the run. Enclosed spaces under stairways shall comply with Section 1011.7.3.
718.2.5,Section 718 Concealed Spaces,Ceiling and Floor Openings,Slab|Roof|Chimney|Covering,Assembly (A)|Business (B)|Educational (E)|Residential (R)|Storage (S),dd|cd,fire_resistance_smoke_protection,architect,"Where required by Section 712.1.8, Exception 1 of Section 714.4.1.2 or Section 714.5, fireblocking of the annular space around vents, pipes, ducts, chimneys and fireplaces at ceilings and floor levels shall be installed with a material specifically tested in the form and manner intended for use to demonstrate its ability to remain in place and resist the free passage of flame and the products of combustion."
718.2.5.1,Section 718 Concealed Spaces,Factory-Built Chimneys and Fireplaces,Chimney|Wall,Assembly (A)|Business (B)|Educational (E)|Factory and Industrial (F)|Residential (R),sd|dd|cd,fire_resistance_smoke_protection,architect,Factory-built chimneys and fireplaces shall be fire-blocked in accordance with UL 103 and UL 127.
