id,section,title,ifc_type,occupancy,design_phase,code_category,primary_responsibility,body
712.1.5.2,Section 712 Vertical Openings,Joints in or Between Nonfire-Resistance-Rated Floor Assemblies,Slab|Wall|Covering,Assembly (A)|Business (B)|Residential (R)|Educational (E)|Institutional (I),sd|dd|cd,fire_resistance_smoke_protection,architect,"Joints in or between floor assemblies without a required fire-resistance rating shall be permitted where they comply with one of the following: The joint shall be concealed within the cavity of a wall.The joint shall be located above a ceiling. The joint shall be sealed, treated or covered with an approved material or system to resist the free passage of flame and the products of combustion. Exception: Joints meeting one of the exceptions listed in Section 715.1."
712.1.6,Section 712 Vertical Openings,Ducts and Air Transfer Openings,Wall|Slab|BuildingElementProxy,Assembly (A)|Business (B)|Educational (E)|Factory and Industrial (F)|Residential (R),sd|dd|cd,fire_resistance_smoke_protection,mechanical_engineer,Penetrations by ducts and air transfer openings shall be protected in accordance with Section 717. Grease ducts shall be protected in accordance with the International Mechanical Code.
712.1.7,Section 712 Vertical Openings,Atriums,Stair|Ramp|Slab|Wall|Railing,Institutional (I)|Assembly (A)|High Hazard (H),sd|dd|cd,means_of_egress,architect,"In other than Group H occupancies, atriums complying with Section 404 shall be permitted."
712.1.8,Section 712 Vertical Openings,Masonry Chimney,Chimney|Wall,Assembly (A)|Business (B)|Educational (E)|Factory and Industrial (F)|Residential (R),sd|dd|cd,fire_resistance_smoke_protection,architect,Approved vertical openings for masonry chimneys shall be permitted where the annular space is fireblocked at each floor level in accordance with Section 718.2.5.
712.1.9,Section 712 Vertical Openings,Two-Story Openings,Slab|Wall|Stair|StairFlight|BuildingElementProxy,Business (B)|Educational (E)|Factory and Industrial (F)|Mercantile (M)|Residential (R),sd|dd|cd,fire_resistance_smoke_protection,architect,"In other than Groups I-2 and I-3, a vertical opening that is not used as one of the applications listed in this section shall be permitted if the opening complies with all of the items below: Does not connect more than two stories.Does not penetrate a horizontal assembly that separates fire areas or smoke barriers that separate smoke compartments. Is not concealed within the construction of a wall or a floor/ceiling assembly. Is not open to a corridor in Group I and R occupancies.Is not open to a corridor on nonsprinklered floors. Is separated from floor openings and air transfer openings serving other floors by construction conforming to required shaft enclosures."
712.1.10,Section 712 Vertical Openings,Parking Garages,Ramp|RampFlight|Slab|Door,Storage (S),sd|dd|cd,fire_resistance_smoke_protection,architect,"Vertical openings in parking garages for automobile ramps, elevators and duct systems shall comply with Section 712.1.10.1, 712.1.10.2 or 712.1.10.3, as applicable."
712.1.10.1,Section 712 Vertical Openings,Automobile Ramps,Ramp|Slab|Wall,Storage (S),sd|dd|cd,fire_resistance_smoke_protection,architect,"Vertical openings for automobile ramps in open and enclosed parking garages shall be permitted where constructed in accordance with Sections 406.5 and 406.6, respectively."
712.1.10.2,Section 712 Vertical Openings,Elevators,Elevator|BuildingElementProxy,Storage (S),sd|dd|cd,elevators_conveying_systems,architect,"Vertical openings for elevator hoistways in open or enclosed parking garages that serve only the parking garage, and complying with Sections 406.5 and 406.6, respectively, shall be permitted."
712.1.10.3,Section 712 Vertical Openings,Duct Systems,Slab|Wall,Storage (S),sd|dd|cd,fire_resistance_smoke_protection,architect,"Vertical openings for mechanical exhaust or supply duct systems in open or enclosed parking garages complying with Sections 406.5 and 406.6, respectively, shall be permitted to be unenclosed where such duct system is contained within and serves only the parking garage."
712.1.11,Section 712 Vertical Openings,Mezzanine,Slab|Stair|Railing|Wall,Assembly (A)|Business (B)|Educational (E)|Factory and Industrial (F)|Residential (R),sd|dd|cd,fire_resistance_smoke_protection,architect,Vertical openings between a mezzanine complying with Section 505 and the floor below shall be permitted.
712.1.12,Section 712 Vertical Openings,Exit Access Stairways and Ramps,Stair|Ramp|Wall|Slab,Assembly (A)|Business (B)|Educational (E)|Institutional (I)|Residential (R),sd|dd|cd,means_of_egress,architect,Vertical openings containing exit access stairways or ramps in accordance with Section 1019 shall be permitted.
712.1.13,Section 712 Vertical Openings,Openings,Slab|Door|Wall,Assembly (A)|Business (B)|Educational (E)|Residential (R)|Institutional (I),sd|dd|cd,fire_resistance_smoke_protection,architect,Vertical openings for floor fire doors and access doors shall be permitted where protected by Section 712.1.13.1 or 712.1.13.2.
712.1.13.1,Section 712 Vertical Openings,Horizontal Fire Door Assemblies,Door|Slab,Assembly (A)|Business (B)|Educational (E)|Factory and Industrial (F)|Residential (R),dd|cd,fire_resistance_smoke_protection,architect,"Horizontal fire door assemblies used to protect openings in fire-resistance-rated horizontal assemblies shall be tested in accordance with NFPA 288, and shall achieve a fire-resistance rating not less than the assembly being penetrated. Horizontal fire door assemblies shall be labeled by an approved agency. The label shall be permanently affixed and shall specify the manufacturer, the test standard and the fire-resistance rating."
712.1.13.2,Section 712 Vertical Openings,Access Doors,Slab|Roof|Covering,Assembly (A)|Business (B)|Educational (E)|Factory and Industrial (F)|Residential (R),sd|dd|cd,fire_resistance_smoke_protection,architect,"Access doors shall be permitted in ceilings of fire-resistance-rated floor/ceiling and roof/ceiling assemblies, provided such doors are tested in accordance with ASTM E119 or UL 263 as horizontal assemblies and labeled by an approved agency for such purpose."
712.1.14,Section 712 Vertical Openings,Group I-3,Wall|Slab|Stair|Door,Institutional (I),sd|dd|cd,fire_resistance_smoke_protection,architect,"In Group I-3 occupancies, vertical openings shall be permitted in accordance with Section 408.5."
712.1.15,Section 712 Vertical Openings,Skylights,Roof|Slab|Window,Assembly (A)|Business (B)|Educational (E)|Factory and Industrial (F)|Residential (R),sd|dd|cd,fire_resistance_smoke_protection,architect,"Skylights and other penetrations through a fire-resistance-rated roof deck or slab are permitted to be unprotected, provided that the structural integrity of the fire-resistance-rated roof assembly is maintained. Unprotected skylights shall not be permitted in roof assemblies required to be fire-resistance rated in accordance with Section 705.8.6. The supporting construction shall be protected to afford the required fire-resistance rating of the horizontal assembly supported."
712.1.16,Section 712 Vertical Openings,Openings Otherwise Permitted,Slab|Wall|Stair|Door,Assembly (A)|Business (B)|Educational (E)|Residential (R)|Institutional (I),sd|dd|cd,fire_resistance_smoke_protection,architect,Vertical openings shall be permitted where allowed by other sections of this code.
713.1,Section 713 Shaft Enclosures,General,Wall|Slab|Stair|Ramp|Roof,Assembly (A)|Business (B)|Educational (E)|Factory and Industrial (F)|Residential (R),sd|dd|cd,fire_resistance_smoke_protection,architect,The provisions of this section shall apply to shafts required to protect openings and penetrations through floor/ceiling and roof/ceiling assemblies. Interior exit stairways and ramps shall be enclosed in accordance with Section 1023.
713.2,Section 713 Shaft Enclosures,Construction,Wall|Slab,Assembly (A)|Business (B)|Educational (E)|Institutional (I)|Residential (R),sd|dd|cd,fire_resistance_smoke_protection,architect,"Shaft enclosures shall be constructed as fire barriers in accordance with Section 707 or horizontal assemblies in accordance with Section 711, or both."
713.3,Section 713 Shaft Enclosures,Materials,Wall|Slab|Door,Assembly (A)|Business (B)|Educational (E)|Residential (R)|Institutional (I),sd|dd|cd,fire_resistance_smoke_protection,architect,The shaft enclosure shall be of materials permitted by the building type of construction.
713.4,Section 713 Shaft Enclosures,Fire-Resistance Rating,Wall|Slab|Door,Assembly (A)|Business (B)|Educational (E)|Residential (R)|Institutional (I),sd|dd|cd,fire_resistance_smoke_protection,architect,"Shaft enclosures shall have a fire-resistance rating of not less than 2 hours where connecting four stories or more, and not less than 1 hour where connecting less than four stories. The number of stories connected by the shaft enclosure shall include any basements but not any mezzanines. Shaft enclosures shall have a fire-resistance rating not less than the floor assembly penetrated, but need not exceed 2 hours. Shaft enclosures shall meet the requirements of Section 703.2.1."
713.5,Section 713 Shaft Enclosures,Continuity,Wall|Slab,Assembly (A)|Business (B)|Residential (R)|Institutional (I)|Storage (S),sd|dd|cd,fire_resistance_smoke_protection,architect,"Shaft enclosures shall be constructed as fire barriers in accordance with Section 707 or horizontal assemblies constructed in accordance with Section 711, or both, and shall have continuity in accordance with Section 707.5 for fire barriers or Section 711.2.2 for horizontal assemblies, as applicable."
713.6,Section 713 Shaft Enclosures,Exterior Walls,Wall|Slab|Stair|Ramp,Assembly (A)|Business (B)|Educational (E)|Residential (R),sd|dd|cd,fire_resistance_smoke_protection,architect,"Where exterior walls serve as a part of a required shaft enclosure, such walls shall comply with the requirements of Section 705 for exterior walls and the fire-resistance-rated enclosure requirements shall not apply. Exception: Exterior walls required to be fire-resistance rated in accordance with Section 1021.2 for exterior egress balconies, Section 1023.7 for interior exit stairways and ramps and Section 1027.6 for exterior exit stairways and ramps."
713.7,Section 713 Shaft Enclosures,Openings,Wall|Door|Slab,Assembly (A)|Business (B)|Educational (E)|Residential (R)|Institutional (I),sd|dd|cd,fire_resistance_smoke_protection,architect,Openings in a shaft enclosure shall be protected in accordance with Section 716 as required for fire barriers. Doors shall be self- or automatic-closing by smoke detection in accordance with Section 716.5.9.3.
713.7.1,Section 713 Shaft Enclosures,Prohibited Openings,Wall|Door|Window,Assembly (A)|Business (B)|Educational (E)|Factory and Industrial (F)|Residential (R),sd|dd|cd,fire_resistance_smoke_protection,architect,Openings other than those necessary for the purpose of the shaft shall not be permitted in shaft enclosures.
713.8,Section 713 Shaft Enclosures,Penetrations,Wall|Beam|Slab,Assembly (A)|Business (B)|Residential (R)|Institutional (I)|High Hazard (H),sd|dd|cd,fire_resistance_smoke_protection,architect,"Penetrations in a shaft enclosure shall be protected in accordance with Section 714 as required for fire barriers. Structural elements, such as beams or joists, where protected in accordance with Section 714 shall be permitted to penetrate a shaft enclosure."
713.8.1,Section 713 Shaft Enclosures,Prohibited Penetrations,Wall|Slab|Door,Assembly (A)|Business (B)|Educational (E)|Factory and Industrial (F)|Residential (R),sd|dd|cd,fire_resistance_smoke_protection,architect,Penetrations other than those necessary for the purpose of the shaft shall not be permitted in shaft enclosures.
713.9,Section 713 Shaft Enclosures,Joints,Wall|Slab,Assembly (A)|Business (B)|Educational (E)|Residential (R)|Institutional (I),dd|cd,fire_resistance_smoke_protection,architect,Joints in a shaft enclosure shall comply with Section 715.
713.10,Section 713 Shaft Enclosures,Duct and Air Transfer Openings,Wall|Slab,Assembly (A)|Business (B)|Educational (E)|Residential (R)|Institutional (I),dd|cd,fire_resistance_smoke_protection,architect,Penetrations of a shaft enclosure by ducts and air transfer openings shall comply with Section 717.
713.11,Section 713 Shaft Enclosures,Enclosure at the Bottom,Wall|Slab|Door,Assembly (A)|Business (B)|Educational (E)|Factory and Industrial (F)|Residential (R),sd|dd|cd,fire_resistance_smoke_protection,architect,"Shafts that do not extend to the bottom of the building or structure shall comply with one of the following: They shall be enclosed at the lowest level with construction of the same fire-resistance rating as the lowest floor through which the shaft passes, but not less than the rating required for the shaft enclosure. They shall terminate in a room having a use related to the purpose of the shaft. The room shall be separated from the remainder of the building by fire barriers constructed in accordance with Section 707 or horizontal assemblies constructed in accordance with Section 711, or both. The fire-resistance rating and opening protectives shall be not less than the protection required for the shaft enclosure. They shall be protected by approved fire dampers install ed in accordance with their listing at the lowest floor level within the shaft enclosure. Exceptions: The fire-resistance-rated room separation is not required, provided there are no openings in or penetrations of the shaft enclosure to the interior of the building except at the bottom. The bottom of the shaft shall be closed off around the penetrating items with materials permitted by Section 718.3.1 for draftstopping, or the room shall be provided with an approved automatic sprinkler system. A shaft enclosure containing a waste or linen chute shall not be used for any other purpose and shall discharge in a room protected in accordance with Section 713.13.4.The fire-resistance-rated room separation and the protection at the bottom of the shaft are not required provided there are no combustibles in the shaft and there are no openings or other penetrations through the shaft enclosure to the interior of the building."
713.12,Section 713 Shaft Enclosures,Enclosure at Top,Wall|Slab|Roof,Assembly (A)|Business (B)|Educational (E)|Factory and Industrial (F)|Residential (R),sd|dd|cd,fire_resistance_smoke_protection,architect,"A shaft enclosure that does not extend to the underside of the roof sheathing, deck or slab of the building shall be enclosed at the top with construction of the same fire-resistance rating as the topmost floor penetrated by the shaft, but not less than the fire-resistance rating required for the shaft enclosure."
713.13,Section 713 Shaft Enclosures,Waste and Linen Chutes and Incinerator Rooms,,,,,,"Waste and linen chutes shall comply with the provisions of NFPA 82, Chapter 5 and shall meet the requirements of Sections 713.13.1 through 713.13.6. Incinerator rooms shall meet the provisions of Sections 713.13.4 through 713.13.5. Exception: Chutes serving and contained within a single dwelling unit."
713.13.1,Section 713 Shaft Enclosures,Waste and Linen,,,,,,"A shaft enclosure containing a recycling, or waste or linen chute shall not be used for any other purpose and shall be enclosed in accordance with Section 713.4. Openings into the shaft, from access rooms and discharge rooms, shall be protected in accordance with this section and Section 716. Openings into chutes shall not be located in corridors. Doors into chutes shall be self-closing. Discharge doors shall be self- or automatic-closing upon the actuation of a smoke detector in accordance with Section 716.5.9.3, except that heat-activated closing devices shall be permitted between the shaft and the discharge room."
713.13.2,Section 713 Shaft Enclosures,Materials,Wall|Shaft|Slab|BuildingElementProxy,Assembly (A)|Business (B)|Educational (E)|Factory and Industrial (F)|Residential (R),sd|dd|cd,fire_resistance_smoke_protection,architect,"A shaft enclosure containing a waste, recycling, or linen chute shall be constructed of materials as permitted by the building type of construction."
713.13.3,Section 713 Shaft Enclosures,Chute Access Rooms,Wall|Door|Slab,Residential (R)|Institutional (I)|Assembly (A)|Business (B),sd|dd|cd,fire_resistance_smoke_protection,architect,"Access openings for waste or linen chutes shall be located in rooms or compartments enclosed by not less than 1-hour fire barriers constructed in accordance with Section 707 or horizontal assemblies constructed in accordance with Section 711, or both. Openings into the access rooms shall be protected by opening protectives having a fire protection rating of not less than 3/4 hour. Doors shall be self- or automatic-closing upon the detection of smoke in accordance with Section 716.5.9.3."
713.13.4,Section 713 Shaft Enclosures,Chute Discharge Room,Wall|Door|Slab,Residential (R)|Institutional (I)|Assembly (A),sd|dd|cd,fire_resistance_smoke_protection,architect,"Waste or linen chutes shall discharge into an enclosed room separated by fire barriers with a fire-resistance rating not less than the required fire rating of the shaft enclosure and constructed in accordance with Section 707 or horizontal assemblies constructed in accordance with Section 711, or both. Openings into the discharge room from the remainder of the building shall be protected by opening protectives having a fire protection rating equal to the protection required for the shaft enclosure. Doors shall be self- or automatic-closing upon the detection of smoke in accordance with Section 716.5.9.3. Waste chutes shall not terminate in an incinerator room. Waste and linen rooms that are not provided with chutes need only comply with Table 509."
713.13.5,Section 713 Shaft Enclosures,Incinerator Room,Wall|Door|Slab,Assembly (A)|Business (B)|Institutional (I)|Residential (R)|Utility and Miscellaneous (U),sd|dd|cd,fire_resistance_smoke_protection,architect,Incinerator rooms shall comply with Table 509.
713.13.6,Section 713 Shaft Enclosures,Automatic Sprinkler System,Wall|Slab|Door,Assembly (A)|Business (B)|Educational (E)|Factory and Industrial (F)|Residential (R),sd|dd|cd,fire_protection_alarm_systems,fire_protection_engineer,An approved automatic sprinkler system shall be installed in accordance with Section 903.2.11.2.
713.14,Section 713 Shaft Enclosures,"Elevator, Dumbwaiter and Other Hoistways",Shaft|Wall|Door,Assembly (A)|Business (B)|Educational (E)|Factory and Industrial (F)|Residential (R),sd|dd|cd,elevators_conveying_systems,architect,"Elevator, dumbwaiter and other hoistway enclosures shall be constructed in accordance with Section 713 and Chapter 30."
714.1,Section 714 Penetrations,Scope,Wall|Slab|BuildingElementProxy,Assembly (A)|Business (B)|Residential (R)|Institutional (I)|Educational (E),sd|dd|cd,fire_resistance_smoke_protection,architect,The provisions of this section shall govern the materials and methods of construction used to protect through penetrations and membrane penetrations of horizontal assemblies and fire-resistance-rated wall assemblies.
714.1.1,Section 714 Penetrations,Ducts and Air Transfer Openings,Wall|Slab,Assembly (A)|Business (B)|Residential (R),dd|cd,fire_resistance_smoke_protection,architect,"Penetrations of fire-resistance-rated walls by ducts that are not protected with dampers shall comply with Sections 714.2 through 714.3.3. Penetrations of horizontal assemblies not protected with a shaft as permitted by Section 717.6, and not required to be protected with fire dampers by other sections of this code, shall comply with Sections 714.4 through 714.5.2. Ducts and air transfer openings that are protected with dampers shall comply with Section 717."
714.2,Section 714 Penetrations,Installation Details,,,,,,"Where sleeves are used, they shall be securely fastened to the assembly penetrated. The space between the item contained in the sleeve and the sleeve itself and any space between the sleeve and the assembly penetrated shall be protected in accordance with this section. Insulation and coverings on or in the penetrating item shall not penetrate the assembly unless the specific material used has been tested as part of the assembly in accordance with this section."
714.3,Section 714 Penetrations,Fire-Resistance-Rated Walls,,,,,,"Penetrations into or through fire walls, fire barriers, smoke barrier walls and fire partitions shall comply with Sections 714.3.1 through 714.3.3. Penetrations in smoke barrier walls shall also comply with Section 714.4.4."
714.3.1,Section 714 Penetrations,Through Penetrations,,,,,,"Through penetrations of fire-resistance-rated walls shall comply with Section 714.3.1.1 or 714.3.1.2. Exception: Where the penetrating items are steel, ferrous or copper pipes, tubes or conduits, the annular space between the penetrating item and the fire-resistance-rated wall is permitted to be protected by either of the following measures: In concrete or masonry walls where the penetrating item is a maximum 6-inch (152 mm) nominal diameter and the area of the opening through the wall does not exceed 144 square inches (0.0929 m2), concrete, grout or mortar is permitted where installed the full thickness of the wall or the thickness required to maintain the fire-resistance rating. The material used to fill the annular space shall prevent the passage of flame and hot gases sufficient to ignite cotton waste when subjected to ASTM E119 or UL 263 time-temperature fire conditions under a minimum positive pressure differential of 0.01 inch (2.49 Pa) of water at the location of the penetration for the time period equivalent to the fire-resistance rating of the construction penetrated."
714.3.1.1,Section 714 Penetrations,Fire-Resistance-Rated Assemblies,,,,,,Penetrations shall be installed as tested in an approved fire-resistance-rated assembly.
714.3.1.2,Section 714 Penetrations,Through-Penetration Firestop System,,,,,,"Through penetrations shall be protected by an approved penetration firestop system installed as tested in accordance with ASTM E814 or UL 1479, with a minimum positive pressure differential of 0.01 inch (2.49 Pa) of water and shall have an F rating of not less than the required fire-resistance rating of the wall penetrated."
714.3.2,Section 714 Penetrations,Membrane Penetrations,,,,,,"Membrane penetrations shall comply with Section 714.3.1. Where walls or partitions are required to have a fire-resistance rating, recessed fixtures shall be installed such that the required fire resistance will not be reduced. Exceptions: Membrane penetrations of maximum 2-hour fire-resistance-rated walls and partitions by steel electrical boxes that do not exceed 16 square inches (0.0 103 m2) in area, provided the aggregate area of the openings through the membrane does not exceed 100 square inches (0.0645 m2) in any 100 square feet (9.29 m2) of wall area. The annular space between the wall membrane and the box shall not exceed 1/8 inch (3.2 mm). Such boxes on opposite sides of the wall or partition shall be separated by one of the following: By a horizontal distance of not less than 24 inches (610 mm) where the wall or partition is constructed with individual noncommunicating stud cavities; By a horizontal distance of not less than the depth of the wall cavity where the wall cavity is filled with cellulose loose-fill, rockwool or slag mineral wool insulation; By solid fireblocking in accordance with Section 718.2.1; By protecting both outlet boxes with listed putty pads; or By other listed materials and methods. Membrane penetrations by listed electrical boxes of any material, provided such boxes have been tested for use in fire-resistance-rated assemblies and are installed in accordance with the instructions included in the listing. The annular space between the wall membrane and the box shall not exceed 1/8 inch (3.2 mm) unless listed otherwise. Such boxes on opposite sides of the wall or partition shall be separated by one of the following: By the horizontal distance specified in the listing of the electrical boxes; By solid fireblocking in accordance with Section 718.2.1; By protecting both boxes with listed putty pads; or By other listed materials and methods. Membrane penetrations by electrical boxes of any size or type, that have been listed as part of a wall opening protective material system for use in fire-resistance-rated assemblies and are installed in accordance with the instructions included in the listing. Membrane penetrations by boxes other than electrical boxes, provided such penetrating items and the annular space between the wall membrane and the box, are protected by an approved membrane penetration firestop system installed as tested in accordance with ASTM E814 or UL 1479, with a minimum positive pressure differential of 0.01 inch (2.49 Pa) of water, and shall have an F and T rating of not less than the required fire-resistance rating of the wall penetrated and be installed in accordance with their listing. The annular space created by the penetration of an automatic sprinkler, provided it is covered by a metal escutcheon plate. Membrane penetrations of maximum 2-hour fire resistance-rated walls and partitions by steel electrical boxes that exceed 16 square inches (0.0 103 m2) in area, or steel electrical boxes of any size having an aggregate area through the membrane exceeding 100 square inches (0.0645 m2) in any 100 square feet (9.29 m2) of wall area, provided such penetrating items are protected by listed putty pads or other listed materials and methods, and installed in accordance with the listing."
714.3.3,Section 714 Penetrations,Dissimilar Materials,,,,,,Noncombustible penetrating items shall not connect to combustible items beyond the point of firestopping unless it can be demonstrated that the fire-resistance integrity of the wall is maintained.
